date,username,to,replies,retweets,favorites,text,geo,mentions,hashtags,id,permalink
2020-03-02 23:47:00,AgathaBacelar,,1,3,10,"Some of our #TeamAgatha volunteers are reaching new heights in canvassing... #AgathaForCongress",,,#TeamAgatha #AgathaForCongress,1234626289220358144,https://twitter.com/AgathaBacelar/status/1234626289220358144
2020-03-02 23:43:00,AgathaBacelar,,1,3,21,"I'll say.",,,,1234625282470023170,https://twitter.com/AgathaBacelar/status/1234625282470023170
2020-03-02 22:44:00,AgathaBacelar,,1,1,15,"A big heartfelt thanks to my political ladies, pausing in their nonstop canvassing for a pose in front of the famous ""Painted Ladies"" of #SanFrancisco. #AgathaForCongress",,,#SanFrancisco #AgathaForCongress,1234610434595938304,https://twitter.com/AgathaBacelar/status/1234610434595938304
2020-03-02 22:37:43,AgathaBacelar,,0,1,6,"""Having a new generation representing the 21st century can help encourage dialogue & collaboration across the aisle."" Couldn't have said it better myself! #ElectTheFuture",,,#ElectTheFuture,1234608854807105536,https://twitter.com/AgathaBacelar/status/1234608854807105536
2020-03-02 21:42:24,AgathaBacelar,sama,0,0,3,"The top 3 Dems in the House are in their late 70s, and ignore policies popular w/ young voters like #UBI, #GreenNewDeal and #MedicareForAll. CA-12 is one of the youngest districts in the US but our representation in Congress hasn’t changed in 30+ years. Help us change that!",,,#UBI #GreenNewDeal #MedicareForAll,1234594932184109056,https://twitter.com/AgathaBacelar/status/1234594932184109056
2020-03-02 21:00:53,AgathaBacelar,,1,3,8,"Data from @SFElections this morning shows that younger San Franciscans have not turned out for early voting as much as 65+ year olds. https://twitter.com/sama/status/1234285123131990016",,@SFElections,,1234584487192711168,https://twitter.com/AgathaBacelar/status/1234584487192711168
2020-03-02 20:47:00,AgathaBacelar,,0,4,23,"We our four-legged volunteers #TeamAgatha",,,#TeamAgatha,1234580990732984322,https://twitter.com/AgathaBacelar/status/1234580990732984322
2020-03-02 20:01:27,AgathaBacelar,,1,6,29,"Check out this awesome campaign poster art from Audrey H., she's a passionate volunteer who has worked tirelessly for #AgathaForCongress because of her belief in the urgent need for #UBI, immigrant and climate justice and affordable housing in #SanFrancisco. ",,,#AgathaForCongress #UBI #SanFrancisco,1234569528933142528,https://twitter.com/AgathaBacelar/status/1234569528933142528
2020-03-02 19:53:55,AgathaBacelar,,0,3,14,"Badge of honor",,,,1234567630838616064,https://twitter.com/AgathaBacelar/status/1234567630838616064
2020-03-02 18:18:00,AgathaBacelar,,0,4,16,"Thank you @ELTECOLOTENYC for bringing #Latina power to this election! I am the first Latina Democrat to run for US Congress CA-12. #AgathaForCongress",,@ELTECOLOTENYC,#Latina #AgathaForCongress,1234543493478899712,https://twitter.com/AgathaBacelar/status/1234543493478899712
2020-03-02 18:08:00,AgathaBacelar,,0,2,18,"#SanFrancisco time to get your vote on! We're seeing record registration this year, so polling stations will be busy - make sure you have a plan to vote! Find your polling place https://sfelections.sfgov.org/vote-your-polling-place #AgathaForCongress #ElectTheFuture #TheStatusQuoMustGo",,,#SanFrancisco #AgathaForCongress #ElectTheFuture #TheStatusQuoMustGo,1234540976875737089,https://twitter.com/AgathaBacelar/status/1234540976875737089
2020-03-02 02:09:10,AgathaBacelar,,0,0,5,"Jessica sparked a national conversation about gun culture.",,,,1234299679799595008,https://twitter.com/AgathaBacelar/status/1234299679799595008
2020-03-02 01:56:59,AgathaBacelar,,1,0,12,"All campaign volunteers are awesome, but Team Agatha has some really special people bringing their creative energy to this campaign, like Jessica, who is not just a canvasser but a gun violence activist who accidentally founded a movement https://youtu.be/BqK-O56JJgY via @YouTube",,@YouTube,,1234296614107222018,https://twitter.com/AgathaBacelar/status/1234296614107222018
2020-03-02 01:33:09,AgathaBacelar,,1,3,18,"The LED light-up ropes and the girls of Oakland with their mad double dutch skills attract crowds! https://youtu.be/eQAScKaeBB0 Next First Friday is March 6th.",,,,1234290614671273984,https://twitter.com/AgathaBacelar/status/1234290614671273984
2020-03-02 01:26:49,AgathaBacelar,,1,7,29,"Someone sent me a Red Bull ad asking, is this you?? It was! What can I say, I'm a #STEM nerd who competed at double dutch jump rope. It's a great way to connect with community &amp; young voters @First Fridays in Oakland, join us! (p.s. I always carry ropes) https://www.instagram.com/p/BIWLb7fgpOq/",,,#STEM,1234289020319911936,https://twitter.com/AgathaBacelar/status/1234289020319911936
2020-03-01 23:45:00,AgathaBacelar,,0,2,16,"We're knocking on doors and visiting merchants and businesses; we've also spent a lot of time talking with students. Only some of them will be voting age this Tuesday, but all of them will vote someday. It's never too early to start listening to the future. #AgathaForCongress",,,#AgathaForCongress,1234263397853782018,https://twitter.com/AgathaBacelar/status/1234263397853782018
2020-03-01 23:30:00,AgathaBacelar,,0,6,28,"Congress needs more young representatives to fight the status quo, which does not serve the 100%. I'm a millennial, but I meet many boomers who share my urgency on climate action and getting money out of politics. We need voters of all ages in this fight! #TheStatusQuoMustGo",,,#TheStatusQuoMustGo,1234259622955036674,https://twitter.com/AgathaBacelar/status/1234259622955036674
2020-03-01 22:21:18,AgathaBacelar,CalebNPierce,0,0,1," ",,,,1234242334667051008,https://twitter.com/AgathaBacelar/status/1234242334667051008
2020-03-01 21:10:00,AgathaBacelar,,0,1,8,"With canvassing it's all about making sure the message sticks. #AgathaForCongress #ElectTheFuture #TheStatusQuoMustGo",,,#AgathaForCongress #ElectTheFuture #TheStatusQuoMustGo,1234224390784475137,https://twitter.com/AgathaBacelar/status/1234224390784475137
2020-03-01 20:46:44,AgathaBacelar,,2,1,7,"The critical lack of affordable housing contributes to a brain drain from the district - maybe something a multi-millionaire in distant DC is unlikely to notice, but it’s a reality millennials in #SanFrancisco talk about often. We get a lot of messages like this. #ElectTheFuture",,,#SanFrancisco #ElectTheFuture,1234218535854829568,https://twitter.com/AgathaBacelar/status/1234218535854829568
2020-03-01 20:40:00,AgathaBacelar,,0,3,13,"Team Agatha is everywhere this weekend, exercising our legs to remind San Franciscans to exercise their choice for a representative of everyday citizens and the climate over corporate PACS. #AgathaForCongress #TheStatusQuoMustGo #ElectTheFuture",,,#AgathaForCongress #TheStatusQuoMustGo #ElectTheFuture,1234216841280663552,https://twitter.com/AgathaBacelar/status/1234216841280663552
2020-03-01 18:33:29,AgathaBacelar,lourensantsigma,1,8,23,"""The affordability crisis...has sent families fleeing from high-cost places like San Francisco, where the average apartment rents for above $4,000."" SF ranks #1 in billionaires but the struggle for ordinary people to afford living here is a losing battle. #TheStatusQuoMustGo",,,#TheStatusQuoMustGo,1234185003069669378,https://twitter.com/AgathaBacelar/status/1234185003069669378
2020-03-01 18:00:00,AgathaBacelar,,2,3,23,"Many places, voting is fraught with danger, or not available. Here, the dangers are less visible but no less real: voter rolls purged, voting machine tampering, foreign interference, polling stations closed. We need leaders who will strengthen our democracy! #AgathaForCongress",,,#AgathaForCongress,1234176576968937475,https://twitter.com/AgathaBacelar/status/1234176576968937475
2020-03-01 16:22:51,AgathaBacelar,_RandyDiaz,1,0,1,"California hates to not gain your talent, but it's an understandable position. Even the Silicon Valley Blockchain Society is reportedly on record recommending new startups in the space form not just outside Silicon Valley but the US entirely!",,,,1234152130207866882,https://twitter.com/AgathaBacelar/status/1234152130207866882
2020-03-01 06:29:06,AgathaBacelar,,0,0,28,"Canvassing with my mom <3",,,,1234002706009710593,https://twitter.com/AgathaBacelar/status/1234002706009710593
2020-02-29 23:57:00,AgathaBacelar,,1,6,45,"Getting out the vote in this district is better than a leg day at the gym #sanfrancisco #AgathaForCongress",,,#sanfrancisco #AgathaForCongress,1233904029933035521,https://twitter.com/AgathaBacelar/status/1233904029933035521
2020-02-29 23:18:51,AgathaBacelar,JeffSalzman2,0,0,2," ",,,,1233894432048418817,https://twitter.com/AgathaBacelar/status/1233894432048418817
2020-02-29 23:17:31,AgathaBacelar,SavannahRN88,0,0,2," It's a priority",,,,1233894095656931328,https://twitter.com/AgathaBacelar/status/1233894095656931328
2020-02-29 23:15:33,AgathaBacelar,ChewFor,0,0,2," ",,,,1233893599554633729,https://twitter.com/AgathaBacelar/status/1233893599554633729
2020-02-29 23:04:01,AgathaBacelar,gabecolors,0,0,1," ",,,,1233890696890703872,https://twitter.com/AgathaBacelar/status/1233890696890703872
2020-02-29 23:03:45,AgathaBacelar,aexisempire,0,0,0," ",,,,1233890629861560320,https://twitter.com/AgathaBacelar/status/1233890629861560320
2020-02-29 22:59:01,AgathaBacelar,_RandyDiaz,1,0,0,"For starters, clarity in regulating crypto will stop the brain drain of entrepreneurs in this sector from leaving the district/US. Also: technology regulation that prevents digital advertising profiteering from running roughshod over democracy.",,,,1233889439685890049,https://twitter.com/AgathaBacelar/status/1233889439685890049
2020-02-29 22:51:36,AgathaBacelar,Riptide360,1,1,5," ",,,,1233887574294286336,https://twitter.com/AgathaBacelar/status/1233887574294286336
2020-02-29 22:38:27,AgathaBacelar,sprincas,0,0,3," ",,,,1233884263751094272,https://twitter.com/AgathaBacelar/status/1233884263751094272
2020-02-29 20:21:32,AgathaBacelar,boxmonkey,0,0,0," ",,,,1233849807388606466,https://twitter.com/AgathaBacelar/status/1233849807388606466
2020-02-29 19:13:58,AgathaBacelar,,4,16,148,"My mom is originally from Brazil, speaks four languages, and raised me brilliantly. Some political terms in English are still new to her, though, like “canvassing.” Today she’ll get to do some canvassing herself!",,,,1233832802774208512,https://twitter.com/AgathaBacelar/status/1233832802774208512
2020-02-29 19:06:00,AgathaBacelar,,3,15,61,"I've knocked on a lot of doors in San Francisco and held a lot of conversations with voters. What I hear over and over, regardless of age, gender or party: the need for affordable housing & healthcare. We're on the threshold of a shift to a people-first economy.",,,,1233830797288693760,https://twitter.com/AgathaBacelar/status/1233830797288693760
2020-02-29 19:00:00,AgathaBacelar,,0,0,14,"To all the volunteers, the canvassers, lit droppers, door knockers, poll workers, phone and text bankers and sign holders, thank you for all you do. Democracy takes all of us. San Franciscans, vote March 3rd! #AgathaForCongress #TheStatusQuoMustGo #ElectTheFuture",,,#AgathaForCongress #TheStatusQuoMustGo #ElectTheFuture,1233829290397097986,https://twitter.com/AgathaBacelar/status/1233829290397097986
2020-02-29 18:45:00,AgathaBacelar,,2,8,41,"Persuading skeptical babies might be the best part of canvassing. #AgathaForCongress #ElectTheFuture",,,#AgathaForCongress #ElectTheFuture,1233825512637816840,https://twitter.com/AgathaBacelar/status/1233825512637816840
2020-02-29 18:35:00,AgathaBacelar,,0,1,19,"Can we really have a Green New Deal and Medicare for all? The signs are good. #AgathaForCongress #ElectTheFuture #TheStatusQuoMustGo",,,#AgathaForCongress #ElectTheFuture #TheStatusQuoMustGo,1233822996021813248,https://twitter.com/AgathaBacelar/status/1233822996021813248
2020-02-29 18:34:53,AgathaBacelar,LoveIslandLuver,0,0,2," ",,,,1233822968041488384,https://twitter.com/AgathaBacelar/status/1233822968041488384
2020-02-29 18:20:13,AgathaBacelar,AndrewYang,1,13,64,"Thank you Andrew! Our campaign has received the most amazing support from #YangGang, they bring the most amazing spirit - a true movement. Canvassing in #SanFrancisco, getting the #UBI message out! ",,,#YangGang #SanFrancisco #UBI,1233819276613545986,https://twitter.com/AgathaBacelar/status/1233819276613545986
2020-02-29 17:38:00,AgathaBacelar,,0,4,18,"You'll be seeing Team Agatha everywhere this weekend across #SanFrancisco, getting out the vote! #AgathaForCongress #ElectTheFuture #TheStatusQuoMustGo",,,#SanFrancisco #AgathaForCongress #ElectTheFuture #TheStatusQuoMustGo,1233808651401474056,https://twitter.com/AgathaBacelar/status/1233808651401474056
2020-02-29 16:53:34,AgathaBacelar,,1,2,20,"We have awesome volunteers in every neighborhood in the city making sure people know about our campaign and the March 3rd primary. #ElectTheFuture #TheStatusQuoMustGo #AgathaForCongress",,,#ElectTheFuture #TheStatusQuoMustGo #AgathaForCongress,1233797469789491200,https://twitter.com/AgathaBacelar/status/1233797469789491200
2020-02-29 16:49:47,AgathaBacelar,JohannHo,2,1,4,"then what will I do with all of these",,,,1233796520182333440,https://twitter.com/AgathaBacelar/status/1233796520182333440
2020-02-29 16:42:23,AgathaBacelar,RealSteveCox,0,0,1," ",,,,1233794656942448640,https://twitter.com/AgathaBacelar/status/1233794656942448640
2020-02-29 09:12:01,AgathaBacelar,CptnStupendous,0,0,4,"Thank you! You might appreciate this post on our Medium publication by a kindred spirit Gen-Xer ",,,,1233681318115831808,https://twitter.com/AgathaBacelar/status/1233681318115831808
2020-02-29 09:09:59,AgathaBacelar,ChrisRay179,0,0,8," ",,,,1233680807958466562,https://twitter.com/AgathaBacelar/status/1233680807958466562
2020-02-29 05:39:08,AgathaBacelar,alzoron,0,2,44,"I do. U=universal.",,,,1233627744098865152,https://twitter.com/AgathaBacelar/status/1233627744098865152
2020-02-29 05:25:16,AgathaBacelar,ryanfmassey,0,0,0," ",,,,1233624254882533376,https://twitter.com/AgathaBacelar/status/1233624254882533376
2020-02-29 05:23:55,AgathaBacelar,C4_JUSTICE,0,1,3,"Agreed! I’m a proponent of liquid democracy with its combination of direct participation and alternative exercise of representation.",,,,1233623915605286912,https://twitter.com/AgathaBacelar/status/1233623915605286912
2020-02-29 05:20:04,AgathaBacelar,JayKing730,1,0,4," ",,,,1233622943885717504,https://twitter.com/AgathaBacelar/status/1233622943885717504
2020-02-29 04:46:00,AgathaBacelar,NaomiAKlein,0,8,27,"No one should have to worry about the affordability of a coronavirus vaccine. A reminder: although ~70% of Americans support Medicare-For-All, Nancy Pelosi - who takes donations from hospitals and insurance companies - calls herself ""not a fan"". https://secure.actblue.com/donate/yes2medicare4all",,,,1233614371286220800,https://twitter.com/AgathaBacelar/status/1233614371286220800
2020-02-29 04:06:30,AgathaBacelar,StarrsedaiKaren,1,0,39," ",,,,1233604432694149123,https://twitter.com/AgathaBacelar/status/1233604432694149123
2020-02-29 02:15:00,AgathaBacelar,,3,9,36,"The once-bright future for crypto in the US has dimmed. San Francisco, once a headquarters for the crypto industry, has suffered as federal intervention pushed innovators out of our district & the country. We need a crypto-fluent Congress. https://www.agathaforcongress.com/crypto",,,,1233576370866810881,https://twitter.com/AgathaBacelar/status/1233576370866810881
2020-02-29 01:23:30,AgathaBacelar,,1,3,18,"Today I did a merchant walk and talked to six Americans who weren't planning on voting in the primary. After our conversation they now know when the election is, how to register online, and that there are worthwhile candidates to vote for. We have so much work to do ",,,,1233563410299785217,https://twitter.com/AgathaBacelar/status/1233563410299785217
2020-02-29 01:23:29,AgathaBacelar,,3,2,24,"All of our campaign literature—big or small—prominently features the primary election date of March 3rd.",,,,1233563407007322112,https://twitter.com/AgathaBacelar/status/1233563407007322112
2020-02-29 01:23:28,AgathaBacelar,,3,8,51,"Nowhere on @SpeakerPelosi's mailer does it mention when to vote or that the election is March 3rd. This is a classic move by incumbent politicians. They are more likely to win an election when fewer people turn out to vote, so they don't encourage what's best for our democracy.",,@SpeakerPelosi,,1233563401810534400,https://twitter.com/AgathaBacelar/status/1233563401810534400
2020-02-29 01:04:16,AgathaBacelar,danileis,0,0,3," ",,,,1233558572350529536,https://twitter.com/AgathaBacelar/status/1233558572350529536
2020-02-29 00:47:00,AgathaBacelar,,0,4,15,"spotted #AgathaForCongress",,,#AgathaForCongress,1233554224895520769,https://twitter.com/AgathaBacelar/status/1233554224895520769
2020-02-29 00:23:49,AgathaBacelar,,0,2,16,"Opportunity knocks more than once. It even leaves a calling card.",,,,1233548391117983744,https://twitter.com/AgathaBacelar/status/1233548391117983744
2020-02-28 23:26:57,AgathaBacelar,ZachandMattShow,0,11,56,"A year ago my young professionals group hosted @andrewyang &amp; all Dem candidates in SF; back then hardly anyone knew about #UBI or Andrew. That now even Mike Bloomberg sees the value of Andrew's ideas &amp; impact shows how quickly the status quo can change https://secure.actblue.com/donate/agathaubi",,@AndrewYang,#UBI,1233534081767313408,https://twitter.com/AgathaBacelar/status/1233534081767313408
2020-02-28 23:25:45,AgathaBacelar,,0,4,23,"“Uno de nosotros, una latina, se está postulando al congreso.”",,,,1233533780448595969,https://twitter.com/AgathaBacelar/status/1233533780448595969
2020-02-28 21:43:00,AgathaBacelar,,3,12,73,"We talk to so many voters who need affordable housing and Medicare for all, and don't feel heard by representative Nancy Pelosi. After 30 years San Franciscans deserve a representative for the 100% #AgathaForCongress #ElectTheFuture #TheStatusQuoMustGo",,,#AgathaForCongress #ElectTheFuture #TheStatusQuoMustGo,1233507919821332480,https://twitter.com/AgathaBacelar/status/1233507919821332480
2020-02-28 21:39:00,AgathaBacelar,,28,462,2049,"Help me get second in San Francisco's jungle primary, and put #UBI on the ballot for the general election for US Congress CA-12 in November! Donate here ",,,#UBI,1233506913997991937,https://twitter.com/AgathaBacelar/status/1233506913997991937
2020-02-28 21:25:05,AgathaBacelar,Mike_French1,0,0,1," ",,,,1233503413897482240,https://twitter.com/AgathaBacelar/status/1233503413897482240
2020-02-28 21:23:30,AgathaBacelar,thejdmorris,0,6,10," These stats show climate breakdown is no longer an image of the future, but a present reality. The wonder isn't that young voters in San Francisco overwhelmingly support the Green New Deal, but that Nancy Pelosi is so dismissive of it, and them. #ElectTheFuture",,,#ElectTheFuture,1233503012884185088,https://twitter.com/AgathaBacelar/status/1233503012884185088
2020-02-28 20:41:00,AgathaBacelar,,0,4,6,"Talking with #AmericanVibe about the housing and #homelessness crisis in #SanFrancisco, and the critical actions we can take (but so far haven't) at the federal level: invest in/build more affordable housing, change zoning laws, and #MedicareForAll. #TheStatusQuoMustGo",,,#AmericanVibe #homelessness #SanFrancisco #MedicareForAll #TheStatusQuoMustGo,1233492317069180928,https://twitter.com/AgathaBacelar/status/1233492317069180928
2020-02-28 20:40:24,AgathaBacelar,,0,1,2,"wait for it... https://youtu.be/JagyST4xa_I via @YouTube",,@YouTube,,1233492167001300992,https://twitter.com/AgathaBacelar/status/1233492167001300992
2020-02-28 19:51:00,AgathaBacelar,,0,5,24,"A shout out to the Dreamers. You are loved. You are valued. You are remembered. You are Americans. Sí se puede! (here I am with the incomparable @DoloresHuerta)",,@DoloresHuerta,,1233479734186651649,https://twitter.com/AgathaBacelar/status/1233479734186651649
2020-02-28 17:21:57,AgathaBacelar,,0,3,12,"District voters want Medicare for all, something the incumbent - who takes money from insurance companies - is ‘not a fan of’.",,,,1233442223640858625,https://twitter.com/AgathaBacelar/status/1233442223640858625
2020-02-28 17:17:52,AgathaBacelar,,1,3,12,"Challenging the most prolific fundraiser of corporate PAC money has been called ‘unrealistic’. Yet a majority of voters in #SanFrancisco want to see urgent climate action, a voter sentiment Pelosi has dismissed as “the green new dream or whatever”. #TheStatusQuoMustGo",,,#SanFrancisco #TheStatusQuoMustGo,1233441196946575360,https://twitter.com/AgathaBacelar/status/1233441196946575360
2020-02-28 17:08:03,AgathaBacelar,,3,16,51,"We always knew challenging the most powerful fundraiser in party history would be an uphill battle. But also: 40% of SF voters are millennials like me, more interested in new ideas and in a new generation of leadership. #ElectTheFuture https://www.buzzfeednews.com/article/addybaird/nancy-pelosi-democratic-primary-challengers-2020 via @addysbaird",,@addysbaird,#ElectTheFuture,1233438726505680897,https://twitter.com/AgathaBacelar/status/1233438726505680897
2020-02-28 08:16:00,AgathaBacelar,,1,6,32,"Here's volunteer Mert at it again, another 100 voters will open their door to democracy in action: a choice between the corporate PAC-financed status quo...or new leadership fighting for affordable housing, Medicare for all, a Green New Deal and #UBI. #ElectTheFuture",,,#UBI #ElectTheFuture,1233304831609069568,https://twitter.com/AgathaBacelar/status/1233304831609069568
2020-02-28 01:26:00,AgathaBacelar,,0,5,19,"Here's the always-motivational Muriel MacDonald of @sunrisebayarea rallying Team Agatha for the final push to the primary, reminding young voters they too can speak out for the environment, and act with an urgency missing from the so-called 'adults' in the room. ",,@sunrisebayarea,,1233201651676110848,https://twitter.com/AgathaBacelar/status/1233201651676110848
2020-02-28 01:13:11,AgathaBacelar,jackiemccaffrey,0,1,1," ",,,,1233198429448241152,https://twitter.com/AgathaBacelar/status/1233198429448241152
2020-02-28 00:04:18,AgathaBacelar,,0,3,19,"Getting proximate with voters is the best part of every day. #TheStatusQuoMustGo #ElectTheFuture #AgathaForCongress",,,#TheStatusQuoMustGo #ElectTheFuture #AgathaForCongress,1233181091327905794,https://twitter.com/AgathaBacelar/status/1233181091327905794
2020-02-27 23:36:36,AgathaBacelar,richieSF2016,0,0,0,"I'm the first Latina Democrat to run for the CA12 seat ",,,,1233174121078349825,https://twitter.com/AgathaBacelar/status/1233174121078349825
2020-02-27 22:50:00,AgathaBacelar,,0,6,19,"About 12% of San Franciscans have voted. For everyone else - March 3rd is less than a week away. Keep an eye out for Mert, bringing democracy to your door: a representative for the 100% fighting for affordable housing, Medicare for all, a Green New Deal and #UBI #ElectTheFuture",,,#UBI #ElectTheFuture,1233162393204686850,https://twitter.com/AgathaBacelar/status/1233162393204686850
2020-02-27 22:39:20,AgathaBacelar,sdchef2013,2,0,1,"I eat there all the time! Extra peppers! I remember when they were $2.75...then @CheapEatsSF made them (justifiably) famous! Still the best value in town!",,@CheapEatsSF,,1233159709764382721,https://twitter.com/AgathaBacelar/status/1233159709764382721
2020-02-27 22:36:54,AgathaBacelar,Dzimm11,0,1,1," ",,,,1233159096511029248,https://twitter.com/AgathaBacelar/status/1233159096511029248
2020-02-27 22:31:16,AgathaBacelar,ChantalTip,1,0,1,"Yes!",,,,1233157678991495168,https://twitter.com/AgathaBacelar/status/1233157678991495168
2020-02-27 22:29:20,AgathaBacelar,ucbyanggang,0,4,17,"Thank you @ucbyanggang !",,@ucbyanggang,,1233157192901001216,https://twitter.com/AgathaBacelar/status/1233157192901001216
2020-02-27 22:11:00,AgathaBacelar,,9,250,890,"I'm glad to see @andrewyang's #UBI message continue to gain traction as people start to understand UBI is a solution for more than poverty. It’s about dignity &amp; building a society where everyone contributes equally because everyone is able to contribute. https://youtu.be/eTuvaTzcWfE",,@AndrewYang,#UBI,1233152578436894722,https://twitter.com/AgathaBacelar/status/1233152578436894722
2020-02-27 20:58:58,AgathaBacelar,MindfulSkeptics,0,0,2,"Thank you, that would be great! Let’s DM the details!",,,,1233134452752019456,https://twitter.com/AgathaBacelar/status/1233134452752019456
2020-02-27 20:31:00,AgathaBacelar,,1,3,22,"Our favorite kind of photo, keep 'em coming! #AgathaForCongress #ElectTheFuture #TheStatusQuoMustGo",,,#AgathaForCongress #ElectTheFuture #TheStatusQuoMustGo,1233127412851990528,https://twitter.com/AgathaBacelar/status/1233127412851990528
2020-02-27 19:43:00,AgathaBacelar,,0,5,13,"There's a lot of love in this city...but a lot of struggle, too. We can do better. This campaign is about representing everyday citizens over corporate interests. Vote for @AgathaBacelar on March 3rd for an end to the status quo that is not serving the 100%.",,@AgathaBacelar,,1233115332962734081,https://twitter.com/AgathaBacelar/status/1233115332962734081
2020-02-27 17:35:00,AgathaBacelar,,0,2,11,"I Team Agatha volunteers!",,,,1233083121022664705,https://twitter.com/AgathaBacelar/status/1233083121022664705
2020-02-27 07:14:45,AgathaBacelar,ucbyanggang,0,0,10," ",,,,1232927032733888512,https://twitter.com/AgathaBacelar/status/1232927032733888512
2020-02-27 02:50:00,AgathaBacelar,SpirosMargaris,4,23,50,"Should robots have a face? I share #AndrewYang's optimism that the coming tech-driven changes are an opportunity to harness converging technologies for a truly inclusive, human-centered future. But we're going to need the right leaders, &amp; #UBI. #AgathaForCongress #ElectTheFuture",,,#AndrewYang #UBI #AgathaForCongress #ElectTheFuture,1232860403312578561,https://twitter.com/AgathaBacelar/status/1232860403312578561
