date,username,to,replies,retweets,favorites,text,geo,mentions,hashtags,id,permalink
2019-11-01 19:16:27,AgathaBacelar,,0,2,15,"Rep @RoKhanna at @SFBWofficial: There is not enough blockchain literacy among members of Congress, and definitely not enough understanding of the potential for China to become leaders in the space. #SFBW19",,@RoKhanna @SFBWofficial,#SFBW19,1190346884281335808,https://twitter.com/AgathaBacelar/status/1190346884281335808
2019-11-01 17:42:48,AgathaBacelar,,1,4,22,"Canvasing is like Trick-or-Treating for our Democracy. ",,,,1190323317267259393,https://twitter.com/AgathaBacelar/status/1190323317267259393
2019-10-31 20:26:09,AgathaBacelar,briantylercohen,2,4,25,"I watched @KatieHill4CA's documentary with so much admiration. What hustle. All that sacrifice to serve her community. Seeing her go and seeing the double standard and abuse of power over women kindles a fire that will ignite at the ballot box and beyond. https://www.youtube.com/watch?v=B2MeTpDByEw",,@KatieHill4CA,,1190002037695512576,https://twitter.com/AgathaBacelar/status/1190002037695512576
2019-10-31 00:27:45,AgathaBacelar,johnnyyP,0,0,2,"Thanks for your support!",,,,1189700450708160512,https://twitter.com/AgathaBacelar/status/1189700450708160512
2019-10-29 19:53:22,AgathaBacelar,,1,8,33,"As a country, we have never realized our best ideas. We never truly integrated schools, we never truly gave access to the ballot box. And we’ve yet to implement a Universal Basic Income to become an egalitarian society. Our best selves are still within reach.",,,,1189269012393410560,https://twitter.com/AgathaBacelar/status/1189269012393410560
2019-10-29 19:49:57,AgathaBacelar,,0,6,21,"As a country, we have never realized our best ideas. We never truly integrated schools, we never truly gave access to the ballot box. And we’ve yet to implement a Universal Basic Income to become an egalitarian society. Our best selves are still within reach.",,,,1189268149931331587,https://twitter.com/AgathaBacelar/status/1189268149931331587
2019-10-29 19:44:50,AgathaBacelar,,2,9,40,"#UBI is about dignity and building a society where everyone contributes equally because everyone *can* contribute. UBI helps us make our democracy more reflective of the people.",,,#UBI,1189266862175076352,https://twitter.com/AgathaBacelar/status/1189266862175076352
2019-10-29 19:38:36,AgathaBacelar,,3,4,40,"I’m a supporter of UBI because I believe everyone is intrinsically valued just for being alive. You should have dignity and a basic standard of living, and we shouldn’t put qualifications on who deserves their basic needs to be met.",,,,1189265294155497473,https://twitter.com/AgathaBacelar/status/1189265294155497473
2019-10-29 19:38:35,AgathaBacelar,,1,1,25,"My understanding of the issues that challenge us today comes from getting proximate. One of the things I've learned is that poverty is not an anomaly. It’s something that’s felt by the majority of people and it’s often invisible.",,,,1189265292821700608,https://twitter.com/AgathaBacelar/status/1189265292821700608
2019-10-29 19:38:35,AgathaBacelar,,5,71,229,"Thread: My full speech at the #BasicIncomeMarch in SF. @ubimarchsf @IncomeMarch #UBI #BasicIncome",,@ubimarchsf @IncomeMarch,#BasicIncomeMarch #UBI #BasicIncome,1189265289285918720,https://twitter.com/AgathaBacelar/status/1189265289285918720
2019-10-28 22:56:14,AgathaBacelar,,0,8,28,"Thanks to everyone that came out to the #BasicIncomeMarch! It was amazing to speak in front of such an enthusiastic and energetic crowd. Lets #EndPoverty!",,,#BasicIncomeMarch #EndPoverty,1188952644414361600,https://twitter.com/AgathaBacelar/status/1188952644414361600
2019-10-27 21:03:30,AgathaBacelar,,0,3,17,"Incredible turnout for the #UBIMarch!",,,#UBIMarch,1188561886603661312,https://twitter.com/AgathaBacelar/status/1188561886603661312
2019-10-27 17:22:22,AgathaBacelar,,1,6,34,"I'll be speaking in front of my largest crowd yet today at the SF #UBIMarch! Come join us as we march for economic justice for the millions of people left behind in today's economy.",,,#UBIMarch,1188506234204221440,https://twitter.com/AgathaBacelar/status/1188506234204221440
2019-10-25 16:23:16,AgathaBacelar,,1,8,25,"What a surprise, China is looking to become the world leader in another emerging technology. Our representatives need to step up and start seriously talking about cryptocurrency legislation.",,,,1187766587878543360,https://twitter.com/AgathaBacelar/status/1187766587878543360
2019-10-24 23:01:30,AgathaBacelar,528ILoveAnimals,1,0,4,"I am also rooting for Nancy Pelosi as she navigates the Trump impeachment process. I’m running now so I can be sworn into office in 2021 - once Trump is *hopefully* out of office.",,,,1187504416414257153,https://twitter.com/AgathaBacelar/status/1187504416414257153
2019-10-24 21:50:35,AgathaBacelar,,0,7,16,"Even Trump's team says the education system is ""fundamentally broken"" and is calling for ""mass student loan forgiveness"" #CancelStudentDebt",,,#CancelStudentDebt,1187486568887357440,https://twitter.com/AgathaBacelar/status/1187486568887357440
2019-10-23 23:02:34,AgathaBacelar,matthewstoller,0,0,10,"I saw a Congress that is woefully uneducated about technology and cryptocurrency, and cared more about dunking on Facebook than learning.",,,,1187142297311252480,https://twitter.com/AgathaBacelar/status/1187142297311252480
2019-10-23 22:54:12,AgathaBacelar,DianaValerie,1,0,1,"Yeah, it was more about dunking on Facebook for the same issues than discussing Libra.",,,,1187140190663348224,https://twitter.com/AgathaBacelar/status/1187140190663348224
2019-10-23 22:52:21,AgathaBacelar,DarkAges_2019,1,0,4,"All the more reasons to ask intelligent questions about it.",,,,1187139727826145280,https://twitter.com/AgathaBacelar/status/1187139727826145280
2019-10-23 22:34:08,AgathaBacelar,,7,12,37,"What is the point of having a hearing on Libra, if over half of the representatives aren't going to ask a single question about Libra?",,,,1187135141321175040,https://twitter.com/AgathaBacelar/status/1187135141321175040
2019-10-22 19:45:00,AgathaBacelar,Evanshaub,1,4,22,"It was a pleasure speaking with the @yanggangpodcast folks.",,@Yanggangpodcast,,1186730189625217025,https://twitter.com/AgathaBacelar/status/1186730189625217025
2019-10-22 18:47:26,AgathaBacelar,,2,24,40,"Here we go again. This is what happens when a public utility is owned by private entities. The public is bearing the cost of decades of bad management. Fixing this will require public ownership of PG&E and massive investment in public infrastructure.",,,,1186715702519980032,https://twitter.com/AgathaBacelar/status/1186715702519980032
2019-10-21 17:11:18,AgathaBacelar,repairrestores1,1,0,1,"Ending Citizens' United and getting money out of politics is definitely one of my main policy goals.",,,,1186329121506226176,https://twitter.com/AgathaBacelar/status/1186329121506226176
2019-10-21 16:50:18,AgathaBacelar,Evilgenius29,1,0,0,"I think the article's point is that the vast majority of billionaire wealth is NOT going to philanthropy, and the portion they are giving away is being allocated in a way that is undemocratic.",,,,1186323836704133120,https://twitter.com/AgathaBacelar/status/1186323836704133120
2019-10-19 17:21:04,AgathaBacelar,CtrldEntropy,0,0,2,"I would love to talk with you @joelcomm!",,@joelcomm,,1185606805121974272,https://twitter.com/AgathaBacelar/status/1185606805121974272
2019-10-19 17:00:01,AgathaBacelar,,3,6,13,"""The inequities that result from the role of money in politics and our geographically based electoral system also need to be remedied. Otherwise, the power structure will keep pandering to older — and whiter and more affluent — voters.""",,,,1185601505769902080,https://twitter.com/AgathaBacelar/status/1185601505769902080
2019-10-19 16:59:04,AgathaBacelar,,2,5,11,"""For younger viewers, it encapsulated a growing sense that many older people, even those who are ostensibly liberals, are dangerously blasé about the future — and that their willingness to play with fire stems from their belief that they won’t live long enough to get burned.""",,,,1185601269454389248,https://twitter.com/AgathaBacelar/status/1185601269454389248
2019-10-19 16:58:01,AgathaBacelar,,4,21,35,"Great article from @nytimes about generational inequality. ""Older people today hold disproportionate power because they have the numbers and the means to do so."" ""our modern political system is stacked against the young.""",,@nytimes,,1185601002705043456,https://twitter.com/AgathaBacelar/status/1185601002705043456
2019-10-19 00:19:42,AgathaBacelar,DianaValerie,0,0,0,"Yes! I did an event last month about reinventing governance with technology.",,,,1185349769347993601,https://twitter.com/AgathaBacelar/status/1185349769347993601
2019-10-18 16:16:30,AgathaBacelar,AndrewYang,1,5,35,"I didn't realize I would be doing an AMA during the same time as you! I'm doing one over in r/politics! Come ask me some questions! #UBI #ForwardTogether https://www.reddit.com/r/politics/comments/djpooe/im_agatha_bacelar_the_millennial_challenging/?sort=qa",,,#UBI #ForwardTogether,1185228169910996992,https://twitter.com/AgathaBacelar/status/1185228169910996992
2019-10-18 16:11:36,AgathaBacelar,,1,9,21,"The AMA is starting now! https://www.reddit.com/r/politics/comments/djpooe/im_agatha_bacelar_the_millennial_challenging/",,,,1185226933606371329,https://twitter.com/AgathaBacelar/status/1185226933606371329
2019-10-18 15:53:17,AgathaBacelar,,1,8,20,"In just a few minutes I'll be doing an AMA in r/politics! Drop in and ask me some questions! #AMA #TheStatusQuoMustGo",,,#AMA #TheStatusQuoMustGo,1185222327023202304,https://twitter.com/AgathaBacelar/status/1185222327023202304
2019-10-17 20:52:04,AgathaBacelar,,1,10,15,"I'll be speaking at the @ubimarchsf with some other great people on October 26th. Join us as we march to put money back into the hands of the people! https://www.eventbrite.com/e/basic-income-march-san-francisco-tickets-74921938535",,@ubimarchsf,,1184935130588049408,https://twitter.com/AgathaBacelar/status/1184935130588049408
2019-10-17 14:40:47,AgathaBacelar,karalas,2,3,9,"I’m going on the @yanggangpodcast today!",,@Yanggangpodcast,,1184841693012447232,https://twitter.com/AgathaBacelar/status/1184841693012447232
2019-10-16 22:33:25,AgathaBacelar,lawrence97431,1,0,1,"Thank you so much for your support!",,,,1184598246817054720,https://twitter.com/AgathaBacelar/status/1184598246817054720
2019-10-16 16:38:21,AgathaBacelar,,0,6,16,"It's incredible to see such a positive response my AMA with r/cryptocurrency. I'm doing another AMA in r/politics this Friday at 10am PST, come ask me questions!",,,,1184508892786520064,https://twitter.com/AgathaBacelar/status/1184508892786520064
2019-10-16 15:56:11,AgathaBacelar,lawrence97431,2,0,2,"Check out the podcast I did with @BitcoinMagazine, we talked a lot about this.",,@BitcoinMagazine,,1184498279930687489,https://twitter.com/AgathaBacelar/status/1184498279930687489
2019-10-16 15:29:39,AgathaBacelar,lawrence97431,0,0,0,"They aren’t mutually exclusive ",,,,1184491601634004992,https://twitter.com/AgathaBacelar/status/1184491601634004992
2019-10-16 15:08:00,AgathaBacelar,,11,2,28,"Who do you think the biggest winners and losers of the debate were? It was exciting to see a question on both automation and big tech, as well as some excellent discussion around UBI and a FJG.",,,,1184486155468697600,https://twitter.com/AgathaBacelar/status/1184486155468697600
2019-10-15 21:05:32,AgathaBacelar,,0,6,13,"The recent #earthquakes in the Bay Area are a good reminder for everyone to make sure to have an Earthquake Preparedness kit ready in case of emergency.",,,#earthquakes,1184213741694406657,https://twitter.com/AgathaBacelar/status/1184213741694406657
2019-10-14 15:44:54,AgathaBacelar,,0,9,26,"My campaign got another shoutout in this @IBTimes article!",,@IBTimes,,1183770665888804865,https://twitter.com/AgathaBacelar/status/1183770665888804865
2019-10-13 15:32:55,AgathaBacelar,,0,16,42,"Starting in 30 minutes, I'll be answering questions about my views on 'practical' cryptocurrency legislation on r/cryptocurrency. Come asks some questions! https://www.reddit.com/r/CryptoCurrency/comments/dhbv5z/ama_with_us_congressional_candidate_agatha/",,,,1183405262259908609,https://twitter.com/AgathaBacelar/status/1183405262259908609
2019-10-12 16:10:04,AgathaBacelar,EliudKipchoge,0,3,16,"Kipchoge kept running even after the sub-2 hour marathon! Thank you for inspiring us.",,,,1183052222621335558,https://twitter.com/AgathaBacelar/status/1183052222621335558
2019-10-11 19:35:00,AgathaBacelar,,1,8,24,"I'm excited to announce I'll be doing an AMA with r/politics 5.5 million subscribers on Friday, October 18th at 10am PST! Come talk with me about how we can build a system that works for the 100%.",,,,1182741406676344832,https://twitter.com/AgathaBacelar/status/1182741406676344832
2019-10-11 18:01:25,AgathaBacelar,,0,12,26,"At a Silicon Valley Nigeria Economic Development event to discuss diversity and inclusion in fintech. A photographer caught glimpses of what always being on campaign trail looks like: making connections, handing out campaign postcards, and spreading the mission. #SVNED – at Bespoke",,,#SVNED,1182717854543568896,https://twitter.com/AgathaBacelar/status/1182717854543568896
2019-10-10 21:12:54,AgathaBacelar,,3,3,13,"On a campaign call this morning my team placed bets on what my personality type is. So I took a test to find out. Safe to say they were spot on.",,,,1182403658698215424,https://twitter.com/AgathaBacelar/status/1182403658698215424
2019-10-10 20:45:11,AgathaBacelar,,1,7,27,"I'm very proud of this interview I did with @BitcoinMagazine, where I discuss how blockchain could be used as an agent of social change. Check it out!",,@BitcoinMagazine,,1182396680433332225,https://twitter.com/AgathaBacelar/status/1182396680433332225
2019-10-09 22:23:34,AgathaBacelar,,0,5,17,"So proud of Carlos’ work with @payourinterns. He helps the public sector allocate funds to pay interns. I love following his many wins online and then running into each other at these events.",,@payourinterns,,1182059053255544832,https://twitter.com/AgathaBacelar/status/1182059053255544832
2019-10-09 19:15:24,AgathaBacelar,,0,1,7,"@marinabichoffe tou adorando a foto de pão de queijo no seu perfil. I feel so understood. Let’s lift each other up! #ltxfest2019",,@marinabichoffe,#ltxfest2019,1182011700771508224,https://twitter.com/AgathaBacelar/status/1182011700771508224
2019-10-09 18:45:02,AgathaBacelar,,1,3,28,"Immediately bonded with a group of Brazilian women in tech at #ltxfest2019",,,#ltxfest2019,1182004056006389760,https://twitter.com/AgathaBacelar/status/1182004056006389760
2019-10-09 02:32:56,AgathaBacelar,DuganFire,1,0,2,"I support UBI!",,,,1181759421484953600,https://twitter.com/AgathaBacelar/status/1181759421484953600
2019-10-09 00:40:06,AgathaBacelar,latinas_tech,0,5,16,"Excited to attend #LTXFest19 and be among other Latinas in tech tomorrow!",,,#LTXFest19,1181731024792719360,https://twitter.com/AgathaBacelar/status/1181731024792719360
2019-10-08 23:24:47,AgathaBacelar,AgathaBacelar,1,1,6,"With politicians that favor the status quo in office we cannot expect any meaningful change to occur. We need people in government willing to embrace new ideas to solve old problems.",,,,1181712069629861888,https://twitter.com/AgathaBacelar/status/1181712069629861888
2019-10-08 23:24:39,AgathaBacelar,AgathaBacelar,1,3,6,"Since Pelosi took office in 1989, inequality has risen along with the sea levels. Our schools are more segregated than ever before. Incarceration has increased upwards of 500%. An entire generation became the first in history to be poorer than their parents.",,,,1181712037430214657,https://twitter.com/AgathaBacelar/status/1181712037430214657
2019-10-08 23:24:10,AgathaBacelar,SimplyLivengood,2,7,22,"I’m taking on one of the most powerful politicians in America—not because of who she is—but because of the system she operates. We have already seen the result of trusting the current political establishment to guide us into the future.",,,,1181711917116575744,https://twitter.com/AgathaBacelar/status/1181711917116575744
2019-10-07 21:46:13,AgathaBacelar,WayneVaughan,0,0,1,"The numbers seem to line up between the Times illustration and your chart? They start at around 40% in the 1950s and ends up around 30-35% today. Yours is for the top 1%, which would be the 3rd or 4th to last point on the Times graph.",,,,1181324879959773184,https://twitter.com/AgathaBacelar/status/1181324879959773184
2019-10-07 16:19:12,AgathaBacelar,DLeonhardt,6,61,183,"This chart is incredible.",,,,1181242582174556162,https://twitter.com/AgathaBacelar/status/1181242582174556162
2019-10-06 21:29:26,AgathaBacelar,native719,3,17,66,"That's great! I support UBI and I would support the Freedom Dividend with that inclusion. I agree the point of UBI is to make people better off. As long as we ensure that any changes to the existing benefit structure wouldn't do the opposite, I'm onboard.",,,,1180958268207718400,https://twitter.com/AgathaBacelar/status/1180958268207718400
2019-10-06 21:17:40,AgathaBacelar,native719,8,2,30,"I'm a fan of UBI and I would support its implementation. My only issue with the Freedom Dividend is forcing people to choose between UBI and existing benefits could unexpectedly push some people deeper into financial turmoil, and I would want to see provisions to prevent that.",,,,1180955303874949120,https://twitter.com/AgathaBacelar/status/1180955303874949120
2019-10-06 20:26:51,AgathaBacelar,jaytay777,0,0,1," ",,,,1180942517870579712,https://twitter.com/AgathaBacelar/status/1180942517870579712
2019-10-06 19:40:07,AgathaBacelar,,1,18,32,"Plastic waste has been found in the deepest point in the ocean. Humans consume 74K microplastics a year, with unknown health implications. This new @theintercept video shows how corporate lobbying shifted the blame of plastic pollution onto consumers.",,@theintercept,,1180930753929965569,https://twitter.com/AgathaBacelar/status/1180930753929965569
2019-10-05 16:59:43,AgathaBacelar,,79,286,658,"The current political system is no longer serving us. We have a choice: Elect new leaders with fresh ideas or keep repeating the same mistakes over and over again. Let's #ElectTheFuture and show the world what we are capable of. Join me at http://agathaforcongress.com",,,#ElectTheFuture,1180528001953349632,https://twitter.com/AgathaBacelar/status/1180528001953349632
2019-10-04 19:36:24,AgathaBacelar,MikeMik19301536,1,0,0,"I like UBI but have some issues with forcing people to choose between it and existing benefits.",,,,1180205043930169344,https://twitter.com/AgathaBacelar/status/1180205043930169344
2019-10-04 18:53:04,AgathaBacelar,,15,33,91,"Exciting announcement! I'll be doing an AMA with r/cryptocurrency's 900K members on Sunday October 13th at 9am PST! Come ask me some questions about my views on crypto! We have more exciting announcements on the horizon so stay tuned!",,,,1180194141113741312,https://twitter.com/AgathaBacelar/status/1180194141113741312
2019-10-04 18:18:39,AgathaBacelar,,1,6,14,"The campaign got a shoutout in @bizjournals! Making waves! ",,@bizjournals,,1180185477305032705,https://twitter.com/AgathaBacelar/status/1180185477305032705
2019-10-04 03:23:23,AgathaBacelar,scottmtkd,0,0,0,"Thanks for your support! ",,,,1179960177631453184,https://twitter.com/AgathaBacelar/status/1179960177631453184
2019-10-04 01:35:03,AgathaBacelar,,0,0,0,"@SFBWofficial ",,@SFBWofficial,,1179932913682407424,https://twitter.com/AgathaBacelar/status/1179932913682407424
2019-10-03 21:53:49,AgathaBacelar,xavieriturralde,0,0,0,"Highest GDP.",,,,1179877238625320960,https://twitter.com/AgathaBacelar/status/1179877238625320960
2019-10-03 20:45:11,AgathaBacelar,realPaulCaine,0,0,3,"I'd like to think we live in a country that values not subjecting children to traumatizing experiences due to actions outside of their control.",,,,1179859967039266816,https://twitter.com/AgathaBacelar/status/1179859967039266816
2019-10-03 20:18:59,AgathaBacelar,ACLU,6,17,55,"It's great that so many people are interested in my positions on cryptocurrencies, but the issue that is most personal to me is still immigration. It's horrifying the wealthiest country in the world is causing children to experience this.",,,,1179853375099174912,https://twitter.com/AgathaBacelar/status/1179853375099174912
2019-10-03 19:13:28,AgathaBacelar,,0,0,5,"This graphic created by @BitStarzNews has me https://news.bitstarz.com/pro-crypto-liberal-challenges-house-speaker-nancy-pelosi-in-ca-primary",,@BitStarzNews,,1179836884026941440,https://twitter.com/AgathaBacelar/status/1179836884026941440
2019-10-03 18:37:56,AgathaBacelar,,0,5,15,"New article about the campaign, this time from @IBTimes. ""[Bacelar] believes that the current political landscape holds back a future ""where economic freedom is afforded to all.""",,@IBTimes,,1179827943226298368,https://twitter.com/AgathaBacelar/status/1179827943226298368
2019-10-03 17:29:32,AgathaBacelar,,0,0,0,"It doesn't fix everything, but in a time when public trust in institutions is at all time lows, having tools that enable trustless systems can be very valuable. Our representatives should be knowledgable about them!",,,,1179810731337732096,https://twitter.com/AgathaBacelar/status/1179810731337732096
2019-10-03 14:15:11,AgathaBacelar,coelhoosvaldo3,0,0,7," ",,,,1179761818991874055,https://twitter.com/AgathaBacelar/status/1179761818991874055
2019-10-03 00:53:19,AgathaBacelar,,1,9,49,"What an exciting day! A lot of campaign records were broken. Expect some exciting announcements in the near future!",,,,1179560024365879296,https://twitter.com/AgathaBacelar/status/1179560024365879296
2019-10-02 20:44:41,AgathaBacelar,fintechfrank,1,0,2,"Happy to consider it! Would you mind reaching out to our comms director at press@agathaforcongress.com with more details?",,,,1179497452421828608,https://twitter.com/AgathaBacelar/status/1179497452421828608
2019-10-02 18:26:32,AgathaBacelar,Cointelegraph,2,8,30,"Another great article about the campaign, this time by @Cointelegraph. It's incredible to see this much interest around getting representatives that understand emerging tech / crypto into office! #ElectTheFuture",,@Cointelegraph,#ElectTheFuture,1179462686179872768,https://twitter.com/AgathaBacelar/status/1179462686179872768
2019-10-02 17:09:34,AgathaBacelar,TheBlock__,3,14,90,"I answered some questions about my stances on crypto for @TheBlock__ . Check it out!",,@TheBlock__,,1179443317953613824,https://twitter.com/AgathaBacelar/status/1179443317953613824
2019-10-02 15:27:05,AgathaBacelar,NBCNews,0,2,15,"Oh no! Wishing you a speedy recover @BernieSanders.",,@BernieSanders,,1179417526486421504,https://twitter.com/AgathaBacelar/status/1179417526486421504
2019-10-02 14:33:45,AgathaBacelar,CoinDesk,2,1,5,"Great article! If you would like to know about my campaign, follow me or check out http://agathaforcongress.com !",,,,1179404105414008839,https://twitter.com/AgathaBacelar/status/1179404105414008839
2019-10-02 14:29:56,AgathaBacelar,CoinDesk,0,5,17,"Thanks @coindesk for the great article about my campaign!",,@CoinDesk,,1179403143362297857,https://twitter.com/AgathaBacelar/status/1179403143362297857
2019-10-01 23:58:08,AgathaBacelar,BTCTN,0,6,17,"Some more amazing coverage by @BTCTN ! Let's get a fresh perspective and some new ideas into government! #TheStatusQuoMustGo",,@BTCTN,#TheStatusQuoMustGo,1179183748392243200,https://twitter.com/AgathaBacelar/status/1179183748392243200
2019-10-01 16:58:38,AgathaBacelar,Ryuu_Akiyama,0,0,0,"Yes! Absolutely!",,,,1179078177588563968,https://twitter.com/AgathaBacelar/status/1179078177588563968
2019-10-01 16:58:21,AgathaBacelar,BootsieNemo,0,0,1,"Agreed",,,,1179078107518533632,https://twitter.com/AgathaBacelar/status/1179078107518533632
2019-10-01 16:45:43,AgathaBacelar,,3,10,25,"Grateful for the coverage by @CCNMarkets! I'm excited about the ways technologies, like blockchain, can enable self-governance and decentralize power from tech giants. Ultimately, governments should be run by the people.",,@CCNMarkets,,1179074928294805505,https://twitter.com/AgathaBacelar/status/1179074928294805505
2019-10-01 15:54:51,AgathaBacelar,SpuriousReasons,0,0,2,"Excellent point. One of the most interesting things to me about blockchain tech is the potential to decentralize that type of control among the people.",,,,1179062125387374593,https://twitter.com/AgathaBacelar/status/1179062125387374593
2019-10-01 15:53:34,AgathaBacelar,Kevin4Earth,0,0,4,"Great answer!",,,,1179061805504552960,https://twitter.com/AgathaBacelar/status/1179061805504552960
2019-10-01 15:53:03,AgathaBacelar,danielford77,1,0,2,"Great clip! Other than Yang and Warren, have any 2020 candidates discussed plans for dealing with big Tech?",,,,1179061674776547329,https://twitter.com/AgathaBacelar/status/1179061674776547329
2019-10-01 15:51:02,AgathaBacelar,johnmattdavis,0,0,0,"Great answer!",,,,1179061167169212418,https://twitter.com/AgathaBacelar/status/1179061167169212418
2019-10-01 15:48:28,AgathaBacelar,,25,10,18,"Curious what my followers think of big tech.",,,,1179060520374026241,https://twitter.com/AgathaBacelar/status/1179060520374026241
2019-10-01 15:42:50,AgathaBacelar,,4,12,23,"Amazing quote in this article: ""Having to mount a legal challenge, Zuckerberg said, would “suck for us”. In response, the Massachusetts senator said: “What would really ‘suck’ is if we don’t fix a corrupt system.”",,,,1179059103504588800,https://twitter.com/AgathaBacelar/status/1179059103504588800
2019-10-01 14:22:38,AgathaBacelar,Progressiveorb1,0,0,1,"Thanks for your support! ",,,,1179038920551493635,https://twitter.com/AgathaBacelar/status/1179038920551493635
2019-10-01 04:38:12,AgathaBacelar,karnverma11,0,0,0,"Thanks!",,,,1178891843364278273,https://twitter.com/AgathaBacelar/status/1178891843364278273
