date,username,to,replies,retweets,favorites,text,geo,mentions,hashtags,id,permalink
2019-11-15 16:49:07,AgathaBacelar,TheLoFiShow,2,0,5,"I’m not saying don’t support Andrew Yang because he has a VAT tax in his policy. Presidential policies are more about laying a vision and showing its viable, but when it comes time to work out the details we should consider all options.",,,,1195383237712826369,https://twitter.com/AgathaBacelar/status/1195383237712826369
2019-11-15 16:42:59,AgathaBacelar,DgnIndependent,1,0,1,"A VAT is flat across all income brackets, that’s how it can be passed without a constitutional amendment.",,,,1195381695152656384,https://twitter.com/AgathaBacelar/status/1195381695152656384
2019-11-15 16:37:31,AgathaBacelar,TheLoFiShow,3,0,3,"That’s true, but a big part of that is because of the way it was structured, and because of how easy it is to move around the EU unrestricted, those problems could be addressed. Valuation is more difficult. The wealthy need to pay more taxes, and a VAT doesn’t do that.",,,,1195380319429414918,https://twitter.com/AgathaBacelar/status/1195380319429414918
2019-11-15 16:34:50,AgathaBacelar,stahnchan,0,0,2,"A corporate VAT makes much more sense than a consumer VAT, but it would need to be structured in a way that didn’t stifle small business.",,,,1195379641378172928,https://twitter.com/AgathaBacelar/status/1195379641378172928
2019-11-15 16:32:25,AgathaBacelar,MilosBishop,0,0,2,"It’s understandable. I agree deficit spending isn’t necessarily a bad thing when done correctly. It’s odd that most of the 2020 candidates seem to have it baked into their policies, but virtually none mention it publicly, though that might be because there is still a stigma.",,,,1195379032646307840,https://twitter.com/AgathaBacelar/status/1195379032646307840
2019-11-15 16:25:15,AgathaBacelar,TheLoFiShow,2,0,2,"Some combination of closing loopholes, existing progressive tax systems, budget reallocation, deficit spending, and a wealth tax. A VAT may have a place, but it does nothing to change the fact that the wealthy are paying the lowest effective tax rates in 60 years.",,,,1195377231435943936,https://twitter.com/AgathaBacelar/status/1195377231435943936
2019-11-14 23:45:56,AgathaBacelar,schloops01,1,0,1,"",,,,1195125743405207552,https://twitter.com/AgathaBacelar/status/1195125743405207552
2019-11-14 22:47:14,AgathaBacelar,WisdomOfDan,2,0,0,"Odds are everyone's tax policy is overestimating the revenue. Costly and time consuming aren't the best reasons, its like admitting we could implement a better system but won't do it because it would be hard or a lot of work.",,,,1195110974161743872,https://twitter.com/AgathaBacelar/status/1195110974161743872
2019-11-14 22:35:58,AgathaBacelar,WisdomOfDan,1,0,1,"Yang's math is also not infallible. He assumes an $800 million bump from ""economic growth"", which is based on a study that estimated growth from a deficit funded UBI, and over 8 years. The same study estimated half that growth for tax funded UBI.",,,,1195108137813987328,https://twitter.com/AgathaBacelar/status/1195108137813987328
2019-11-14 22:34:15,AgathaBacelar,WisdomOfDan,1,0,0,"Ironically Donald Trump once proposed a one-time wealth tax that would raise 5.7 trillion. I haven't put together a policy proposal, but its possible to raise significant revenue.",,,,1195107705804869632,https://twitter.com/AgathaBacelar/status/1195107705804869632
2019-11-14 22:32:20,AgathaBacelar,ashow0rld,2,0,1,"I'm not saying anything about the FD. I support UBI, but VAT taxes ARE regressive. The FD and UBI should not live or die based on a particular taxation scheme.",,,,1195107222033850368,https://twitter.com/AgathaBacelar/status/1195107222033850368
2019-11-14 22:20:02,AgathaBacelar,WisdomOfDan,1,0,0,"A one time-wealth tax, even on certain assets, would do the same thing without implementing a regressive tax.",,,,1195104125198848000,https://twitter.com/AgathaBacelar/status/1195104125198848000
2019-11-14 22:19:16,AgathaBacelar,WisdomOfDan,0,0,1,"It's not harder than ""I think"". I'm aware of the challenges associated with taxing wealth. I'm not convinced they are unsolvable. There are other progressive taxes besides a wealth tax that could also be used. I'm not proposing waiting any longer for UBI.",,,,1195103932470546432,https://twitter.com/AgathaBacelar/status/1195103932470546432
2019-11-14 20:50:21,AgathaBacelar,stahnchan,2,0,1,"The Roosevelt Institute study did model the impact of a tax funded UBI and found it still increased economic output, just not as much as a deficit funded UBI.",,,,1195081556093587456,https://twitter.com/AgathaBacelar/status/1195081556093587456
2019-11-14 20:42:26,AgathaBacelar,stahnchan,1,0,3,"Right, I absolutely support UBI, but feel there is still room for debate around whether or not a VAT tax is the right way to fund it.",,,,1195079563463680001,https://twitter.com/AgathaBacelar/status/1195079563463680001
2019-11-14 20:41:20,AgathaBacelar,DgnIndependent,1,0,1,"I'm aware. I would recommend reading this for a primer on the pros and cons of a VAT tax. The main concern is the redistribution of the tax burden by switching to a regressive taxation scheme and the potential for purchasing power erosion. http://www.taxhistory.org/www/freefiles.nsf/Files/VATReader.pdf/$file/VATReader.pdf",,,,1195079287348445184,https://twitter.com/AgathaBacelar/status/1195079287348445184
2019-11-14 20:35:26,AgathaBacelar,stahnchan,1,0,2,"The study says the 2.3 trillion growth would also have occurred over 8 years, not a single year.",,,,1195077801646247936,https://twitter.com/AgathaBacelar/status/1195077801646247936
2019-11-14 20:31:55,AgathaBacelar,DgnIndependent,3,0,1,"Yang's 2.3 trillion for GDP growth comes from this study, which assumed UBI was funded by deficit spending and not a VAT tax. The same paper estimates only half the impact of a tax funded UBI. http://rooseveltinstitute.org/wp-content/uploads/2017/08/Modeling-the-Macroeconomic-Effects-of-a-UBI.pdf",,,,1195076917193347072,https://twitter.com/AgathaBacelar/status/1195076917193347072
2019-11-14 20:27:20,AgathaBacelar,martinpepper,1,0,1,"That still puts him at around $10 billion short but that's just a drop in the bucket compared to the amount of $required for UBI.",,,,1195075765622034432,https://twitter.com/AgathaBacelar/status/1195075765622034432
2019-11-14 19:55:28,AgathaBacelar,Vinnie37540118,5,0,3,"Has Yang said how Democracy Dollars would be funded? Deficit spending?",,,,1195067745932414976,https://twitter.com/AgathaBacelar/status/1195067745932414976
2019-11-14 19:54:24,AgathaBacelar,martinpepper,1,0,0,"A corporate VAT tax is less problematic than a consumer VAT tax, so we should separate those two. We have to worry about the impacts on small businesses. Many in my district (San Francisco) are closing due to rising costs, and an additional 10% VAT tax would be very harmful.",,,,1195067478197407744,https://twitter.com/AgathaBacelar/status/1195067478197407744
2019-11-14 19:41:21,AgathaBacelar,bebi_lovely,2,0,0,"They can do the same thing with a VAT tax, moving portions of their business out of the country to avoid the tax. Corporations aren't being taxed because they have been able to dump lobbying money into politics, not because of a lack of a viable tax mechanism.",,,,1195064193906434048,https://twitter.com/AgathaBacelar/status/1195064193906434048
2019-11-14 19:39:53,AgathaBacelar,martinpepper,0,0,0,"Any of the ways we've raised tax revenue in the past should be on the table. The $800 million in Yang's proposal that comes from ""economic growth"" also was based on a study that assumed UBI was financed by deficit spending, not a VAT tax.",,,,1195063822882525184,https://twitter.com/AgathaBacelar/status/1195063822882525184
2019-11-14 19:38:10,AgathaBacelar,bebi_lovely,2,0,0,"You tax the company profits, not transactions. In Europe tech companies previously routed all their transactions through Ireland to avoid paying higher taxes in different countries. The loophole was only closed in 2017.",,,,1195063392811151360,https://twitter.com/AgathaBacelar/status/1195063392811151360
2019-11-14 19:30:00,AgathaBacelar,JulieChrysty,1,0,1,"I understand the logic behind taxing luxury items, but this also has the adverse effect of making these items harder for lower income people to afford. There might be some categories a VAT tax would make sense, but they would need to be considered on a case by case basis.",,,,1195061337904185349,https://twitter.com/AgathaBacelar/status/1195061337904185349
2019-11-14 19:28:43,AgathaBacelar,martinpepper,3,0,1,"It's not wise to link the two definitively. If we were to pass a VAT only for it to later lose public support, we wouldn't want to lose UBI also.",,,,1195061015798403072,https://twitter.com/AgathaBacelar/status/1195061015798403072
2019-11-14 19:26:41,AgathaBacelar,AgathaBacelar,0,0,2,"Corporations are always going to look for loopholes, and a VAT tax isn't ironclad. It's important to have representatives that aren't bought by corporate money willing to hold them accountable.",,,,1195060502902104064,https://twitter.com/AgathaBacelar/status/1195060502902104064
2019-11-14 19:25:58,AgathaBacelar,bebi_lovely,2,0,1,"If those companies are spending their money in other countries, that money wouldn't be taxed under a domestic us VAT either. In those cases a VAT could actually lead to those businesses moving many services outside the US to avoid the tax.",,,,1195060320533807104,https://twitter.com/AgathaBacelar/status/1195060320533807104
2019-11-14 19:24:09,AgathaBacelar,JulieChrysty,1,0,1,"A VAT makes a lot of sense for countries like Monaco, because it allows them to raise tax revenue from people that aren't citizens but spend a lot of money. There might be a similar context it could be used here.",,,,1195059864231235585,https://twitter.com/AgathaBacelar/status/1195059864231235585
2019-11-14 19:16:49,AgathaBacelar,bebi_lovely,1,0,2,"We just close the corporate loopholes allowing them to avoid paying taxes. We've taxed businesses before without a VAT. The key is removing corporate money from politics.",,,,1195058018129342464,https://twitter.com/AgathaBacelar/status/1195058018129342464
2019-11-14 19:15:22,AgathaBacelar,martinpepper,2,0,2,"I am accounting for that. UBI does not NEED a VAT tax. People would still be getting their check if it were funded in a way that placed less burden on working people, and their $would go further.",,,,1195057654810365952,https://twitter.com/AgathaBacelar/status/1195057654810365952
2019-11-14 19:08:59,AgathaBacelar,ashow0rld,7,0,1,"Taxes don't stay the same, rates change over time. Even if you support a VAT tax, it's important to have representatives that are aware of the risks of a VAT and willing to fight for working people and prevent spending power erosion.",,,,1195056045770473472,https://twitter.com/AgathaBacelar/status/1195056045770473472
2019-11-14 19:03:05,AgathaBacelar,tibudo,0,0,9,"This is one of the reasons I'm also fighting for medicare for all.",,,,1195054562450657280,https://twitter.com/AgathaBacelar/status/1195054562450657280
2019-11-14 19:01:57,AgathaBacelar,ashow0rld,2,0,1,"I've seen the chart. Whether taxation is regressive or progressive has nothing to do with ""net transfer"". For a tax to progressive (not the same as a progressive policy), the rates must increase for more wealthy individuals. A consumption tax does not do this.",,,,1195054276084502528,https://twitter.com/AgathaBacelar/status/1195054276084502528
2019-11-14 17:24:42,AgathaBacelar,schloops01,3,0,2,"This is why it is critical to not blindly support a VAT. They do have the potential to erode purchasing power, and we need representatives that fight for working people and not the wealthy.",,,,1195029803503505414,https://twitter.com/AgathaBacelar/status/1195029803503505414
2019-11-14 17:22:56,AgathaBacelar,schloops01,2,0,1,"Warrens plan has a 50% flight tax for people that try to renounce citizenship, would that not alleviate that concern?",,,,1195029360488505344,https://twitter.com/AgathaBacelar/status/1195029360488505344
2019-11-14 17:22:05,AgathaBacelar,AgathaBacelar,4,0,10,"Even if you support a VAT, it will be critical to have representatives fighting to ensure working class peoples purchasing power is not eroded now or in the future.",,,,1195029147451478016,https://twitter.com/AgathaBacelar/status/1195029147451478016
2019-11-14 17:21:24,AgathaBacelar,GigiGloriby,4,1,2,"It's important to note that even in Europe, necessities are taxed under the VAT (albeit lower rates), and while these rates were low initially they WERE eventually raised.",,,,1195028973517828096,https://twitter.com/AgathaBacelar/status/1195028973517828096
2019-11-14 17:14:28,AgathaBacelar,schloops01,1,0,0,"If any of them were actually worried about trying to avoid a VAT tax, they would be deploying the same people to avoid that as well, by reducing the amount of transactions they make or by spending abroad.",,,,1195027228481900545,https://twitter.com/AgathaBacelar/status/1195027228481900545
2019-11-14 17:13:08,AgathaBacelar,GigiGloriby,0,0,1,"Wealthy do not spend 70% of their income, it’s mostly reinvested in assets that make them more money like stocks, bonds, and real estate. This is why a regressive tax is self perpetuating, it means low income have less resources to acquire these assets, while wealthy have more.",,,,1195026893151408128,https://twitter.com/AgathaBacelar/status/1195026893151408128
2019-11-14 17:09:25,AgathaBacelar,GigiGloriby,3,0,1,"For people that spend most of their income, a VAT essentially is an income tax—one that unlike our current income tax—results in higher effective rates for those that make less.",,,,1195025957104414720,https://twitter.com/AgathaBacelar/status/1195025957104414720
2019-11-14 17:06:47,AgathaBacelar,schloops01,1,0,2,"Amazon should be taxed, but we can do that by eliminating loopholes and forcing them to pay corporate taxes. Your absolutely right about wealthy having their income tied up in assets. We’ve taxed the wealthy before, it’s not impossible.",,,,1195025294517620736,https://twitter.com/AgathaBacelar/status/1195025294517620736
2019-11-14 16:57:00,AgathaBacelar,martinpepper,3,0,1,"Wealthy people don’t have to avoid a VAT tax, they spend such a small portion of their income their effective tax rates would be minuscule. A VAT tax is really effective at raising money from people who do a lot of spending, ethic is mostly working class ppl.",,,,1195022833849524224,https://twitter.com/AgathaBacelar/status/1195022833849524224
2019-11-14 16:51:39,AgathaBacelar,martinpepper,2,0,0,"A progressive tax doesn’t mean a break even, it means that the wealthy share more of the tax burden than low income through higher effective tax rates. A VAT, even excluding basic goods, is regressive because wealthy spend a low % of their total income vs working people.",,,,1195021486114783232,https://twitter.com/AgathaBacelar/status/1195021486114783232
2019-11-14 16:39:23,AgathaBacelar,AgathaBacelar,0,0,2,"of those two components before supporting the FD as it stands today. I believe UBI is key to reducing income inequality and poverty in the US.",,,,1195018398331101184,https://twitter.com/AgathaBacelar/status/1195018398331101184
2019-11-14 16:38:15,AgathaBacelar,THEJessAllen,4,3,11,"I support UBI, I recently marched and spoke at the SF UBI March. I’m concerned about the FD forcing people to choose between existing benefits, and the potential for a VAT tax to erode purchasing power similar to what has occured in France, and would need to know the specifics",,,,1195018115144224769,https://twitter.com/AgathaBacelar/status/1195018115144224769
2019-11-14 00:21:25,AgathaBacelar,andrewdsmith89,2,0,2,"It's not impossible to tax the wealthy. It's been done before and we can do it again. Over the last 40 years the overall tax rate on the top 400 richest families has steadily declined.",,,,1194772285225230338,https://twitter.com/AgathaBacelar/status/1194772285225230338
2019-11-13 21:43:43,AgathaBacelar,,1,7,26,"It’s #thxbirthcontrol day! Last year I took a contraceptive counseling course b/c almost half of pregnancies in the U.S. are unplanned and there’s so much we can do to improve outcomes and experiences related to family planning.",,,#thxbirthcontrol,1194732601161895937,https://twitter.com/AgathaBacelar/status/1194732601161895937
2019-11-13 18:38:37,AgathaBacelar,,11,23,164,"An energizing day knocking on doors and talking to neighbors!",,,,1194686017745252353,https://twitter.com/AgathaBacelar/status/1194686017745252353
2019-11-12 23:58:19,AgathaBacelar,,0,6,41,"Highlight from door knocking today: getting invited inside a home for a bilingual conversation, coffee, and pan dulce.",,,,1194404085526454272,https://twitter.com/AgathaBacelar/status/1194404085526454272
2019-11-12 21:35:04,AgathaBacelar,JulieChrysty,1,1,4,"All excellent points, thank you for taking the time to clarify.",,,,1194368033742938112,https://twitter.com/AgathaBacelar/status/1194368033742938112
2019-11-12 19:18:51,AgathaBacelar,JulieChrysty,1,0,4,"Thanks for your willingness to talk through things and consider options!",,,,1194333754690428929,https://twitter.com/AgathaBacelar/status/1194333754690428929
2019-11-12 18:37:13,AgathaBacelar,claudiakins_BTS,2,0,1,"Interesting. It sounds similar to this.",,,,1194323279143563264,https://twitter.com/AgathaBacelar/status/1194323279143563264
2019-11-12 18:10:38,AgathaBacelar,,1,6,35,"I wish with all my heart that the #DACA case before the Supreme Court goes well today. #HomeIsHere",,,#DACA #HomeIsHere,1194316587794219008,https://twitter.com/AgathaBacelar/status/1194316587794219008
2019-11-12 17:47:01,AgathaBacelar,bekindtopeople2,0,0,1,"If you know of some other research, please share! I'm very data and research oriented and am willing to read and consider other studies.",,,,1194310645761470465,https://twitter.com/AgathaBacelar/status/1194310645761470465
2019-11-12 17:31:42,AgathaBacelar,LatinasforYang,0,0,1,"Thanks for showing up! It was incredible to see so much support!",,,,1194306789782589440,https://twitter.com/AgathaBacelar/status/1194306789782589440
2019-11-12 17:30:36,AgathaBacelar,SheilaHaines7,0,0,0,"Thanks sheila!",,,,1194306513210265600,https://twitter.com/AgathaBacelar/status/1194306513210265600
2019-11-12 17:29:54,AgathaBacelar,gracenote108,0,0,2,"Great! I can't wait to see it!",,,,1194306336512569344,https://twitter.com/AgathaBacelar/status/1194306336512569344
2019-11-12 17:29:24,AgathaBacelar,Oblivious010,1,0,1,"Fair enough, I'm just saying we should be open to considering all options and go with one that results in the most economically just system.",,,,1194306211685912577,https://twitter.com/AgathaBacelar/status/1194306211685912577
2019-11-12 17:28:31,AgathaBacelar,claudiakins_BTS,2,0,2,"It might be progressive in the political sense, but a progressive tax is one where you pay more the more you earn, which a VAT is not. I agree on the urgency to pass UBI, and as a representative I would work towards passing the best version of it possible.",,,,1194305990193139712,https://twitter.com/AgathaBacelar/status/1194305990193139712
2019-11-12 17:26:38,AgathaBacelar,Oblivious010,0,0,1,"Not if its things they were supposed to register under law in order to be taxed anyways. There are systems that preserve anonymity where required.",,,,1194305516656136192,https://twitter.com/AgathaBacelar/status/1194305516656136192
2019-11-12 17:25:23,AgathaBacelar,Chupwn,1,0,1,"Fair enough, I'm just making the distinction that I am pro-UBI, not pro-VAT. We should work towards a taxation system that results in the most economic justice.",,,,1194305201106116608,https://twitter.com/AgathaBacelar/status/1194305201106116608
2019-11-12 17:20:36,AgathaBacelar,SheilaHaines7,3,0,2,"I'm committed to supporting UBI, and if a VAT is the only way to do it, then fine. But its only advantage is that it is easy to collect, and we should be willing to consider other options that result in a more equitable system for all.",,,,1194303995906412544,https://twitter.com/AgathaBacelar/status/1194303995906412544
2019-11-12 17:19:16,AgathaBacelar,GigiGloriby,0,0,8,"We are all UBI supporters, at the end of the day a healthy debate over the best way to fund it is in everyone's best interest.",,,,1194303661939163136,https://twitter.com/AgathaBacelar/status/1194303661939163136
2019-11-12 17:16:34,AgathaBacelar,Chupwn,1,0,1,"Collection issues could be solved with emerging tech. There are many interesting projects in the fintech / blockchain space for better digital tracking of assets.",,,,1194302981438443520,https://twitter.com/AgathaBacelar/status/1194302981438443520
2019-11-12 17:13:23,AgathaBacelar,Chupwn,0,1,2,"Like I've mentioned elsewhere, I'm committed to UBI, but also committed to enacting the most economically just system possible. If that is a VAT + UBI, then fine, but the only advantage of a VAT is that it is easy too collect, and we should be open to considering other options.",,,,1194302178216816645,https://twitter.com/AgathaBacelar/status/1194302178216816645
2019-11-12 17:12:01,AgathaBacelar,prettygrimstuff,1,0,5,"Thanks! Most Americans want UBI but are indifferent to the way it is funded. We should be open to a friendly debate about the merit of different options, and keep an open mind.",,,,1194301838289334273,https://twitter.com/AgathaBacelar/status/1194301838289334273
2019-11-12 17:07:57,AgathaBacelar,Swagaliciousnss,1,0,0,"Right, so it’s easy to collect. However, rich spend much less of their income than normal Americans, who spend 90%. If Jeff Bezos spends <1% of his income, his effective tax rate is 0.1%, vs 9% for normal Americans.",,,,1194300813994164224,https://twitter.com/AgathaBacelar/status/1194300813994164224
2019-11-12 17:02:12,AgathaBacelar,prettygrimstuff,1,0,7,"I’ve already said, I’m committed to enacting UBI. This is a discussion among UBI supporters about how best to fund it, and as a representative it would be my job to push for the best system while still achieving the overall goal.",,,,1194299366967627779,https://twitter.com/AgathaBacelar/status/1194299366967627779
2019-11-12 16:59:27,AgathaBacelar,,1,0,3,"I don’t think tying it empirically to a taxation scheme is ideal, unless absolutely necessary to get it passed. It limits future options if nothing else.",,,,1194298673783459840,https://twitter.com/AgathaBacelar/status/1194298673783459840
2019-11-12 16:56:31,AgathaBacelar,Swagaliciousnss,1,1,7,"I agree that enacting UBI is the top priority, and if a VAT is the only way to do it, then fine. It’s only advantage is that it’s easy to collect, and we should be willing to consider other options.",,,,1194297934365351936,https://twitter.com/AgathaBacelar/status/1194297934365351936
2019-11-12 16:53:58,AgathaBacelar,BeWater84640726,3,0,2,"I support UBI, but think all options should be on the table with regards to how it should be funded. If a VAT tax is the only way, then fine, but it’s only advantage is it’s easy to collect. Solving homelessness in SF will require more than UBI. We need more housing.",,,,1194297295715487744,https://twitter.com/AgathaBacelar/status/1194297295715487744
2019-11-12 16:48:53,AgathaBacelar,scottsantens,1,0,0,"His effective rate might go up, but it wouldn’t it still be lower than most Americans, who spend 90% of their income? Even if you assume 50% is exempt from the tax, that’s 45% * 10% = 4.5% rate. If Bezos spends < 1%, his effective rate is 0.1%. How is that a just system?",,,,1194296013663531008,https://twitter.com/AgathaBacelar/status/1194296013663531008
2019-11-12 16:43:47,AgathaBacelar,BeWater84640726,0,0,1,"Most economists agree that some level of deficit spending is good for the economy, especially if it is putting money directly back into the hands of people via UBI.",,,,1194294730734964736,https://twitter.com/AgathaBacelar/status/1194294730734964736
2019-11-12 16:42:15,AgathaBacelar,scottsantens,0,0,0,"We both agree on the transfer side, which would happen regardless of the tax system used, so why not discuss the tax system?",,,,1194294346943610880,https://twitter.com/AgathaBacelar/status/1194294346943610880
2019-11-12 16:39:38,AgathaBacelar,scottsantens,1,0,0,"if most Americans spend 90% of their income, and Jeff Bezos spends <1% of his income, please explain how he would pay a higher effective tax rate than most Americans.",,,,1194293685728337920,https://twitter.com/AgathaBacelar/status/1194293685728337920
2019-11-12 16:38:00,AgathaBacelar,BeWater84640726,1,0,2,"We could pay for it with a combination of existing progressive tax systems, budget reallocation, and deficit spending. I’m open to a VAT but also committed to working towards The most economically just system possible.",,,,1194293274518777856,https://twitter.com/AgathaBacelar/status/1194293274518777856
2019-11-12 16:35:47,AgathaBacelar,scottsantens,1,1,1,"Net transfer isn’t the same thing as effective tax rate. It means lower and middle income will be getting more, but wealthy will still be paying lower effective rates.",,,,1194292717431341058,https://twitter.com/AgathaBacelar/status/1194292717431341058
2019-11-12 16:31:34,AgathaBacelar,scottsantens,1,0,1,"A wealth tax has bipartisan support, 74% of Americans support it, collection difficulties aside.",,,,1194291657367154688,https://twitter.com/AgathaBacelar/status/1194291657367154688
2019-11-12 16:29:56,AgathaBacelar,scottsantens,1,1,8,"Like I mentioned, I’m committed to enacting UBI. I’m also committed to working towards the taxation system that results in the most economic justice. If that is a VAT or a an LVT then fine, but we should be willing to consider all options.",,,,1194291247424397312,https://twitter.com/AgathaBacelar/status/1194291247424397312
