date,username,to,replies,retweets,favorites,text,geo,mentions,hashtags,id,permalink
2019-08-29 16:32:15,AgathaBacelar,,4,12,42,".@CNN replaces Andrew Yang's photo with Beto's, who is only polling at 1%. Warren is also shown above Sanders even though he polled higher than her in 9 of 31 August polls. #YangMediaBlackout #DNCRigginIntensifies",,@CNN,#YangMediaBlackout #DNCRigginIntensifies,1167112740025946112,https://twitter.com/AgathaBacelar/status/1167112740025946112
2019-08-29 14:05:07,AgathaBacelar,YDM_Podcast,1,9,11,"Thanks for having me on the show @YDM_Podcast! Check out the interview to find out more about my policy positions and my reasons for running!",,@YDM_Podcast,,1167075712404090884,https://twitter.com/AgathaBacelar/status/1167075712404090884
2019-08-28 19:30:05,AgathaBacelar,,1,8,16,"You can watch more of my interview with the @TheDamageReport here!",,@TheDamageReport,,1166795106201948166,https://twitter.com/AgathaBacelar/status/1166795106201948166
2019-08-28 16:49:56,AgathaBacelar,AliceI7764,0,0,0,"Thank you so much for your support Alice! It's people like you that make my race possible. You can donate at",,,,1166754800882438144,https://twitter.com/AgathaBacelar/status/1166754800882438144
2019-08-28 02:56:06,AgathaBacelar,yassaminansari,0,0,1,"Thanks @yassaminansari! Let’s talk about how you’re gonna run too ;)",,@yassaminansari,,1166544960511823872,https://twitter.com/AgathaBacelar/status/1166544960511823872
2019-08-27 16:03:29,AgathaBacelar,,0,13,34,"Bernie wrote an op-ed in the @CJR about his plan to address the journalism crisis. A healthy democracy requires a free press. It's great to see politicians acknowledging the forces gutting local newsrooms across the country.",,@CJR,,1166380722971541504,https://twitter.com/AgathaBacelar/status/1166380722971541504
2019-08-27 15:03:26,AgathaBacelar,,4,14,55,"I’m excited to appear on @TheDamageReport today to talk about why I’m running against @SpeakerPelosi!",,@TheDamageReport @SpeakerPelosi,,1166365609958899712,https://twitter.com/AgathaBacelar/status/1166365609958899712
2019-08-27 14:44:16,AgathaBacelar,mariemary2653,2,0,4,"I support impeachment.",,,,1166360786245079040,https://twitter.com/AgathaBacelar/status/1166360786245079040
2019-08-26 19:02:41,AgathaBacelar,,1,11,28,"I got to speak to a room full of people with @sunrisemvmt on Sunday. Climate change demands immediate action, and it's amazing to see so many passionate people gathered in one place.",,@sunrisemvmt,,1166063433592102916,https://twitter.com/AgathaBacelar/status/1166063433592102916
2019-08-26 16:02:32,AgathaBacelar,,1,9,22,"Millennials graduated into the worst jobs market in 80 years, resulting in earnings losses that takes years and years to rebound. The next recession will make the Millennial disadvantage even worse. #MillennialsNeedRepresentation",,,#MillennialsNeedRepresentation,1166018096550662145,https://twitter.com/AgathaBacelar/status/1166018096550662145
2019-08-25 20:18:58,AgathaBacelar,,1,12,24,"The UN climate report published last month said averting a global catastrophe would require “historically unprecedented societal transformation”. DNC leadership responds by voting down the proposal to hold a climate debate. #TheStatusQuoMustGo",,,#TheStatusQuoMustGo,1165720243999608833,https://twitter.com/AgathaBacelar/status/1165720243999608833
2019-08-24 17:04:20,AgathaBacelar,,0,17,24,"The #AmazonIsBurning thanks in part to pro-Trump GOP lobbyists pushing to ""develop"" the region. --by @lhfang",,@lhfang,#AmazonIsBurning,1165308872359206912,https://twitter.com/AgathaBacelar/status/1165308872359206912
2019-08-24 02:02:37,AgathaBacelar,garrytan,0,0,3,"My political campaign meets all of those requirements .",,,,1165081949116846080,https://twitter.com/AgathaBacelar/status/1165081949116846080
2019-08-23 23:26:07,AgathaBacelar,AliceHamers1,1,1,1,"It’s definitely a part of my platform, but there are only so many issues you can squeeze into a tweet . You can learn more about my full platform at my website http://agathaforcongress.com !",,,,1165042564455518208,https://twitter.com/AgathaBacelar/status/1165042564455518208
2019-08-23 19:42:44,AgathaBacelar,,28,191,360,"The DNC is selectively choosing which polls can be used to qualify candidates, with no transparency into how they decide which polls make the cut. Some uncertified polls are ranked by RCP and FiveThirtyEight as more accurate than 'certified' ones.",,,,1164986346517041152,https://twitter.com/AgathaBacelar/status/1164986346517041152
2019-08-23 18:16:53,AgathaBacelar,,0,7,15,"Trump's own staffers can't explain his recent tweets ordering US companies to leave China. ""We simply at this point don't know what he means by that and neither do some of the officials here in the White House.""",,,,1164964742198247424,https://twitter.com/AgathaBacelar/status/1164964742198247424
2019-08-23 16:23:25,AgathaBacelar,,2,16,41,"Bolsonaro is blaming NGOs and droughts for the Amazon fires. But NASA satellite images show that the fires are the result of Bolsonaro’s push to develop the Amazon. Governments need to come together and #ActForTheAmazon, before it is too late.",,,#ActForTheAmazon,1164936189708660741,https://twitter.com/AgathaBacelar/status/1164936189708660741
2019-08-23 16:12:49,AgathaBacelar,MamaGray1024,1,0,1,"The current Green Card quotas were set before I was born. Wait times have begun to spiral out of control. Congress should reform the antiquated quotas and enact a limit on wait times. As a millennial, I also support cancelling all student debt.",,,,1164933522018074624,https://twitter.com/AgathaBacelar/status/1164933522018074624
2019-08-22 21:17:10,AgathaBacelar,julito77,1,1,14,"Thank you for the conversation! They don't call us Latino Rebels for nothing ",,,,1164647727323439104,https://twitter.com/AgathaBacelar/status/1164647727323439104
2019-08-22 19:28:00,AgathaBacelar,ewarren,1,3,11,"Over a 40-year career, women overall lose $418,800 as a result of the wage gap, with women of color losing almost $870,000.",,,,1164620253218787328,https://twitter.com/AgathaBacelar/status/1164620253218787328
2019-08-22 18:41:08,AgathaBacelar,,0,29,36,"It is #BlackWomensEqualPayDay At the current rate, black women will not reach pay parity until 2119. Closing the gap requires acknowledging sexism &amp; racism have been baked into our economy for centuries and continue to shape opportunities for women.",,,#BlackWomensEqualPayDay,1164608460320718848,https://twitter.com/AgathaBacelar/status/1164608460320718848
2019-08-22 13:54:00,AgathaBacelar,MillReview,0,7,23,"Thank you so mucv @MillReview for having me on the podcast! Give it a listen to hear me talk about my views on the #GreenNewDeal, #MedicareForAll, and #LiquidDemocracy!",,@MillReview,#GreenNewDeal #MedicareForAll #LiquidDemocracy,1164536199416934405,https://twitter.com/AgathaBacelar/status/1164536199416934405
2019-08-21 16:44:13,AgathaBacelar,staticnervves,2,25,44,"The #AmazonFire can be seen from space. Several Brazilian cities are blanketed in plumes of smoke. When will we decide the environment should be a topic of foreign policy?",,,#AmazonFire,1164216646593961984,https://twitter.com/AgathaBacelar/status/1164216646593961984
2019-08-20 23:45:25,AgathaBacelar,,0,1,18,"“My desire to see more women in the House remains, but my satisfaction with the establishment...has waned significantly. I’ve been so inspired by all the young women primarying entrenched and established politicians this last year, and you are no exception.” -Amelia – at Crossroads Café",,,,1163960257787260928,https://twitter.com/AgathaBacelar/status/1163960257787260928
2019-08-20 23:45:24,AgathaBacelar,,2,4,29,"Amelia was one of the amazing people on our campaign team this summer. She heads back to college soon, but we love knowing the seeds of the squad are taking root all over. – at Crossroads Café",,,,1163960253995552768,https://twitter.com/AgathaBacelar/status/1163960253995552768
2019-08-20 23:07:00,AgathaBacelar,,0,8,21,"As the Trump administration relaxes rules protecting wetlands and streams, a new study found that 82% of vegetated tidal lands that once existed in the Bay Area have been diked, drained or cut off from the sea.",,,,1163950588997984256,https://twitter.com/AgathaBacelar/status/1163950588997984256
2019-08-20 21:26:59,AgathaBacelar,sentientweeter,0,0,0,"I support medicare-for-all / HR 1384. I believe the only solution to the affordable housing crisis is a massive investment in public housing.",,,,1163925420346974208,https://twitter.com/AgathaBacelar/status/1163925420346974208
2019-08-20 18:28:44,AgathaBacelar,,2,15,32,"This is why climate change is our most pressing foreign policy issue. Brazil is home to the world’s largest tropical forest seen as vital to countering global warming. Thanks to Bolsonaro’s environmental policy, wildfires are up 83% over 2018.",,,,1163880563712778241,https://twitter.com/AgathaBacelar/status/1163880563712778241
2019-08-20 16:00:24,AgathaBacelar,,0,11,27,"Thanks to @ExercisingDrunk and @SFist for covering the debate between the progressive candidates challenging Pelosi! Thanks to @SavageJoyMarie1 for hosting!",,@ExercisingDrunk @SFist @SavageJoyMarie1,,1163843233505402880,https://twitter.com/AgathaBacelar/status/1163843233505402880
2019-08-19 16:41:30,AgathaBacelar,,2,7,15,"Pro-worker tech regulation is needed to address our status as the disparity capital of the nation. As a STEM candidate with experience in both tech and social impact, I bring a unique capacity to represent this district with fluency in both technology and the needs of workers.",,,,1163491189091213313,https://twitter.com/AgathaBacelar/status/1163491189091213313
2019-08-19 14:48:52,AgathaBacelar,RealProgressUS,1,8,19,"Wow! Thanks for everyone's support in this poll! If you haven't had a chance to vote yet, and liked my performance in the debate, please give me a vote!",,,,1163462842474876930,https://twitter.com/AgathaBacelar/status/1163462842474876930
2019-08-18 23:49:19,AgathaBacelar,RealProgressUS,3,7,17,"If you watched the debate and liked my performance, please consider voting for me in this poll!",,,,1163236464836001793,https://twitter.com/AgathaBacelar/status/1163236464836001793
2019-08-18 22:19:56,AgathaBacelar,,1,1,14,"A encantadora @FabianaCozza com uma galera de fãs brasileiras em São Francisco! ",,@FabianaCozza,,1163213968556474368,https://twitter.com/AgathaBacelar/status/1163213968556474368
2019-08-18 22:14:26,AgathaBacelar,,0,3,18,"A beautiful day at Yerba Buena for a @FabianaCozza concert. So proud to have a beloved Brazilian perform here in SF.",,@FabianaCozza,,1163212586461978625,https://twitter.com/AgathaBacelar/status/1163212586461978625
2019-08-18 19:51:40,AgathaBacelar,,0,3,20,"Stop by and see us at #SOMA #SundayStreets!",,,#SOMA #SundayStreets,1163176658158809088,https://twitter.com/AgathaBacelar/status/1163176658158809088
2019-08-18 19:11:56,AgathaBacelar,,1,7,24,"Thanks so much for hosting and bringing us together for a conversation! @SavageJoyMarie1",,@SavageJoyMarie1,,1163166659802124288,https://twitter.com/AgathaBacelar/status/1163166659802124288
2019-08-16 20:42:47,AgathaBacelar,,3,21,31,"Tune into the debate tomorrow with @SavageJoyMarie1 to find out more about who I am, what I stand for, and how I plan to fight for a better future in Washington! For more details, check out this amazing debate preview in @SFist by @ExercisingDrunk!",,@SavageJoyMarie1 @SFist @ExercisingDrunk,,1162464743623254016,https://twitter.com/AgathaBacelar/status/1162464743623254016
2019-08-16 18:00:49,AgathaBacelar,,1,16,64,"Tech is the reason why San Francisco is one of the highest GDP-producing cities in the US. It's also why SF is the disparity capital of the nation. Regulating tech giants as economic institutions & providers of public services—while also protecting workers—is a key priority.",,,,1162423986623373312,https://twitter.com/AgathaBacelar/status/1162423986623373312
2019-08-16 15:47:57,AgathaBacelar,,3,20,50,"Our planet is dying from climate change. Each year brings a new record for debt and wealth inequality. More of us are dying from suicide and overdoses than ever before. Let’s stand up and fight for our future. The status quo must go. It’s #OurTurn to lead.",,,#OurTurn,1162390547060776960,https://twitter.com/AgathaBacelar/status/1162390547060776960
2019-08-15 16:10:07,AgathaBacelar,danawt,21,19,41,"This is a reminder of Israel's control over the West Bank and Gaza. Palestinians are not free to visit their own homes. Why is Netanyahu so afraid of @IlhanMN and @RashidaTlaib? #KnowledgeIsPower. Members of Congress should visit both Israel and Palestine.",,@IlhanMN @RashidaTlaib,#KnowledgeIsPower,1162033740366749696,https://twitter.com/AgathaBacelar/status/1162033740366749696
2019-08-15 02:45:00,AgathaBacelar,,1,13,27,"Just 17 months ago I attended a rally where a grief stricken student led a huge crowd in a moment of silence for gun victims. Then, I hoped our lawmakers would heed the cry of my generation for gun legislation. They didn't. Now I'm running for Congress. http://bit.ly/2KxHoG0",,,,1161831123325878274,https://twitter.com/AgathaBacelar/status/1161831123325878274
2019-08-14 16:52:00,AgathaBacelar,,29,79,145,"What's wrong with this picture? Since 1997, costs of: Hospital Services: up 225% College Textbooks: up 200% College Tuition: up 190% Childcare: up 125% Meanwhile: Cars: up 0% Televisions: Down 100% Our priorities seem off....",,,,1161681890040004608,https://twitter.com/AgathaBacelar/status/1161681890040004608
2019-08-14 15:31:32,AgathaBacelar,,4,24,33,"70% of Americans support #MedicareForAll. Instead of representing her constituents, Nancy Pelosi backs the insurance companies and healthcare professionals who donate to her campaign. What does that say about our representative democracy?",,,#MedicareForAll,1161661641701777409,https://twitter.com/AgathaBacelar/status/1161661641701777409
2019-08-14 04:00:25,AgathaBacelar,,0,2,10,"Which tech event am I at?",,,,1161487716934193152,https://twitter.com/AgathaBacelar/status/1161487716934193152
2019-08-13 19:24:38,AgathaBacelar,grumpybirdieS,0,1,2,"My foreign policy positions can be found at https://www.agathaforcongress.com/issues (240 characters is a bit limited to get into specifics). If you have more questions I would be happy to answer them.",,,,1161357914138824704,https://twitter.com/AgathaBacelar/status/1161357914138824704
2019-08-13 19:18:32,AgathaBacelar,EclecticRadical,1,0,1,"Yes, I do.",,,,1161356380084682754,https://twitter.com/AgathaBacelar/status/1161356380084682754
2019-08-13 18:15:12,AgathaBacelar,AOC,3,9,26,"""Republicans laugh and say you can’t pay for [the #GND ]."" But when they want to pass tax cuts for the wealthy or an expansion of the military budget, all of a sudden the magic money tree is in full bloom. ",,,#GND,1161340443201720320,https://twitter.com/AgathaBacelar/status/1161340443201720320
2019-08-13 17:20:04,AgathaBacelar,AYAmericans,0,1,3,"Having younger representatives in congress would help. How many sitting members of congress have student loan debt? I'm a 27-year old challenging Nancy Pelosi. It's time for a new generation of representatives!",,,,1161326568083378177,https://twitter.com/AgathaBacelar/status/1161326568083378177
2019-08-13 16:57:00,AgathaBacelar,Snubs,2,0,6,"Hey Shannon, I'm running for congress in your district. A big part of my platform is reforming Democracy through tech. I would love to talk with you about it!",,,,1161320763380514817,https://twitter.com/AgathaBacelar/status/1161320763380514817
2019-08-13 15:52:10,AgathaBacelar,,1,11,19,"Even the conservative media admits the F-35 project has been a colossal waste of money. Costs for the jet are expected to reach $1 trillion. Yet when we talk about things like student debt, the GND, or M4A all we hear is ""How do we pay for it?""",,,,1161304444643885056,https://twitter.com/AgathaBacelar/status/1161304444643885056
2019-08-12 23:12:26,AgathaBacelar,,0,3,12,"Elected officials continue to flirt with deciding what can published online. Nancy Pelosi called Section 230 ""a gift"" in an interview with @karaswisher. Now Trump is targeting 230 as well. This is why we need representatives that understand tech.",,@karaswisher,,1161052854653579264,https://twitter.com/AgathaBacelar/status/1161052854653579264
2019-08-12 22:01:47,AgathaBacelar,alexstamos,0,0,5,"This is why San Francisco needs a representative that understands tech.",,,,1161035075267338240,https://twitter.com/AgathaBacelar/status/1161035075267338240
2019-08-12 17:27:52,AgathaBacelar,AOC,3,7,21,"We need leaders that will stand up to injustices, not downplay them. That's why I'm challenging Nancy Pelosi for the #CA12 seat. Together, we can make a brighter future for everyone.",,,#CA12,1160966140476006404,https://twitter.com/AgathaBacelar/status/1160966140476006404
2019-08-12 17:14:00,AgathaBacelar,,0,6,14,"Despite what a vast majority of Americans believe, federal laws still do not prohibit discrimination based on sexual-orientation and gender-identity. I support the Equality Act to ensure everyone is treated equally under the law.",,,,1160962650752241664,https://twitter.com/AgathaBacelar/status/1160962650752241664
2019-08-12 16:04:23,AgathaBacelar,pppatticake,1,0,2,"Quick Version: https://twitter.com/AgathaBacelar/status/1155895064209395712 In-depth policy positions: https://www.agathaforcongress.com/issues I'm happy to answer any additional questions!",,,,1160945130473345024,https://twitter.com/AgathaBacelar/status/1160945130473345024
2019-08-12 15:33:08,AgathaBacelar,theYoungPAC,1,13,28,"I'm honored to receive the endorsement of @theYoungPAC. It's time for a generational change in politics. Young people need a seat at the table. #ItsOurTurn",,@theYoungPAC,#ItsOurTurn,1160937265910046723,https://twitter.com/AgathaBacelar/status/1160937265910046723
2019-08-12 02:21:07,AgathaBacelar,seankent,15,0,12,"I'm challenging her in the primary. San Francisco is ready for a new generation of leadership.",,,,1160737951199850496,https://twitter.com/AgathaBacelar/status/1160737951199850496
2019-08-12 01:40:33,AgathaBacelar,,2,4,20,"We need a constitutional amendment to overturn Citizens United, but until then, California and @CACleanMoney will lead the way towards secure and transparent elections.",,@CACleanMoney,,1160727742830145536,https://twitter.com/AgathaBacelar/status/1160727742830145536
2019-08-12 01:33:52,AgathaBacelar,MillReview,1,1,18,"I’m running against Pelosi and would love to appear on your podcast!",,,,1160726058913583105,https://twitter.com/AgathaBacelar/status/1160726058913583105
2019-08-11 23:55:36,AgathaBacelar,KateStewartActs,2,3,6,"",,,,1160701331612557312,https://twitter.com/AgathaBacelar/status/1160701331612557312
2019-08-11 23:09:43,AgathaBacelar,painter_nancy,2,1,7,"I’m available! My DMs are open, and my campaign can be reached at hello-at-agathaforcongress-dot-com.",,,,1160689780977328129,https://twitter.com/AgathaBacelar/status/1160689780977328129
2019-08-11 23:04:06,AgathaBacelar,ryangrim,6,8,64,"I agree Democrats should unify around the progressive issues championed by @AOC—most of the voters in Pelosi’s district support them. It’s the reason I decided to challenge Pelosi for her seat.",,@AOC,,1160688367887011840,https://twitter.com/AgathaBacelar/status/1160688367887011840
2019-08-11 22:44:43,AgathaBacelar,karaswisher,0,0,2,"Agreed. The tech industry has had several misses, many of which stem from a lack of diversity. In order to fix a broken system you first have to be optimistic things can be fixed--otherwise, why try? I'm optimistic that we, collectively, can fix tech's problems. #HalfFull",,,#HalfFull,1160683490653827072,https://twitter.com/AgathaBacelar/status/1160683490653827072
2019-08-11 18:01:13,AgathaBacelar,AngryBlackLady,0,0,4,"Amazing , will do!",,,,1160612148113891328,https://twitter.com/AgathaBacelar/status/1160612148113891328
2019-08-11 17:59:28,AgathaBacelar,,4,5,32,"Three Chinese elders helped me pick a Chinese name for my campaign. 柏艾珂 (pronounced bǎi ài kē) Ai means love and ke refers to a lucky green jade. Bai-ai-ke rhymes with 博愛客 meaning a grand loving person. 博愛 is a significant term of a governor or emperor.",,,,1160611705900036096,https://twitter.com/AgathaBacelar/status/1160611705900036096
2019-08-11 17:47:26,AgathaBacelar,AngryBlackLady,1,0,6,"Shaun somewhat recklessly endorsed one of my opponents in the #CA12 race. I know you aren't in my district, but as someone right across the Bay, I would love to talk with you about my plans to make life better for people in the Bay Area as well as nationwide.",,,#CA12,1160608678090645504,https://twitter.com/AgathaBacelar/status/1160608678090645504
2019-08-11 16:50:52,AgathaBacelar,karaswisher,1,1,4,"Despite all the negative press, I still feel at its core the tech industry is about finding innovative ways to solve problems. There are so many talented and passionate people in the tech industry who truly want to make a difference.",,,,1160594443478523904,https://twitter.com/AgathaBacelar/status/1160594443478523904
2019-08-11 16:37:23,AgathaBacelar,nicky_skinz,0,10,30,"The #youthvote is very strong in San Francisco: 41% of registered voters are millennials. If you live in SF and are not registered to vote, please do! We need every vote possible to ensure we are heard in 2020.",,,#youthvote,1160591051146403840,https://twitter.com/AgathaBacelar/status/1160591051146403840
2019-08-10 22:10:46,AgathaBacelar,MikeMik19301536,1,0,0,"Trolls keep reporting my account.",,,,1160312560526086144,https://twitter.com/AgathaBacelar/status/1160312560526086144
2019-08-10 20:01:19,AgathaBacelar,notme__us,0,0,2,"I want to eliminate private insurance.",,,,1160279981370425344,https://twitter.com/AgathaBacelar/status/1160279981370425344
2019-08-10 16:05:28,AgathaBacelar,TUSK81,0,0,1,"Yes we are!",,,,1160220631071244288,https://twitter.com/AgathaBacelar/status/1160220631071244288
2019-08-09 22:39:37,AgathaBacelar,PoliSci_JpR,1,0,3,"Absolutely.",,,,1159957434187821056,https://twitter.com/AgathaBacelar/status/1159957434187821056
2019-08-09 22:30:59,AgathaBacelar,,2,6,20,"Yesterday, ICE officials suddenly detained 680 people in Mississippi in the largest immigration raid in U.S. history. Their kids had no one to pick them up from school and were terrified. What our government is doing is deplorable and nauseating.",,,,1159955258778382336,https://twitter.com/AgathaBacelar/status/1159955258778382336
2019-08-09 22:19:59,AgathaBacelar,ShahidForChange,2,1,8,"This isn't true, and it's easy to check. According to the FEC you filed on 4/12. I filed on 2/28. https://www.fec.gov/data/candidate/H8CA12262/?cycle=2020&amp;election_full=true&amp;tab=filings",,,,1159952492806860800,https://twitter.com/AgathaBacelar/status/1159952492806860800
2019-08-09 21:09:06,AgathaBacelar,genofthesea,1,0,1,"With all the ways politicians try to get out of endorsing a true universal public option, it's understandable that you would be confused. I've spoken publicly many times about my views on healthcare, and they are on my website.",,,,1159934652619972608,https://twitter.com/AgathaBacelar/status/1159934652619972608
2019-08-09 21:03:42,AgathaBacelar,genofthesea,1,0,4,"I am for ""true single"" payer. It's easy to twist words when it comes to healthcare.",,,,1159933292524662784,https://twitter.com/AgathaBacelar/status/1159933292524662784
2019-08-09 19:18:17,AgathaBacelar,HarshDonoghue,19,23,69,"Every day I'm told I should drop out of the race. Young women are significantly less likely than young men to receive encouragement to run for office. I'm running because I believe there aren't enough voices like mine in Congress. https://www.american.edu/spa/wpi/upload/girls-just-wanna-not-run_policy-report.pdf",,,,1159906763530915841,https://twitter.com/AgathaBacelar/status/1159906763530915841
2019-08-09 18:47:11,AgathaBacelar,,3,26,51,"Help #ExpandTheSquad! I'm running against @SpeakerPelosi to fight Climate Change, ensure equal and universal access to healthcare, and help fix Democracy. I'm not accepting any corporate PAC money, so any amount helps!",,@SpeakerPelosi,#ExpandTheSquad,1159898939719475200,https://twitter.com/AgathaBacelar/status/1159898939719475200
2019-08-09 17:33:00,AgathaBacelar,,0,2,8,"It looks like my roommates and I would be safe in our mission apartment in all but 2 movies: The Core and San Andreas.",,,,1159880268804550656,https://twitter.com/AgathaBacelar/status/1159880268804550656
2019-08-09 16:20:06,AgathaBacelar,tomcoates,1,0,0,"The mission seems to fair pretty well.",,,,1159861923761942530,https://twitter.com/AgathaBacelar/status/1159861923761942530
2019-08-09 16:08:10,AgathaBacelar,,0,12,21,"Instead of spending $80 billion a year to incarcerate more than two million of our neighbors, we should use that money to increase graduation rates and implement restorative justice practices. Let’s invest in equal justice for all Americans.",,,,1159858921860767744,https://twitter.com/AgathaBacelar/status/1159858921860767744
2019-08-09 01:11:47,AgathaBacelar,papichulomin,0,0,0,"Thanks for the support!",,,,1159633337062793216,https://twitter.com/AgathaBacelar/status/1159633337062793216
2019-08-08 18:08:00,AgathaBacelar,,2,26,43,"Immigrant detention is by far the most profitable sector of the private prison business. CoreCivic and the GEO Group earn millions in long-term ICE contracts. It's great to see Denver take a stand against these horrible practices.",,,,1159526688830582784,https://twitter.com/AgathaBacelar/status/1159526688830582784
2019-08-08 17:30:18,AgathaBacelar,soapboxdiatribe,0,0,3,"Thanks! I haven't been on any of those shows yet, but my team is trying to make it happen.",,,,1159517203542077440,https://twitter.com/AgathaBacelar/status/1159517203542077440
