date,username,to,replies,retweets,favorites,text,geo,mentions,hashtags,id,permalink
2019-05-18 21:08:46,AOC,AlexCKaufman,871,4848,20693,".@JayInslee’s climate plan is the most serious + comprehensive one to address our crisis in the 2020 field. It meets key marks: Big enough Fast enough Economically stimulating for working people Acknowledges injustice + w/ an eye to make communities whole",,@JayInslee,,1129856374605832193,https://twitter.com/AOC/status/1129856374605832193
2019-05-18 17:05:43,AOC,,4312,16867,75688,"How to Bail Out Main Street, Not Wall Street: Cap All Interest Rates at 15% (includes Credit Cards &amp; all lending) Federal Student Loan Cancellation (for the past) Tuition-Free Public Colleges (for the future) Medicare for All (no egregious medical debt w/single payer)",,,,1129795212920987650,https://twitter.com/AOC/status/1129795212920987650
2019-05-18 16:49:19,AOC,YahooFinance,1448,5461,31246,"Our radical, totally crazy idea to reduce the demand on our social safety net (food stamps, Medicaid, WIC, etc): Pay people more.",,,,1129791084308176901,https://twitter.com/AOC/status/1129791084308176901
2019-05-18 14:17:24,AOC,CNBC,2632,15991,64399,"It still blows my mind that the CEOs who crashed our economy + caused millions of people to lose their homes not only escaped handcuffs; but got bonuses, too. Many still have influential roles shaping the economy today. But we’re the crazy ones for wanting to tax ‘em, right?",,,,1129752853315227652,https://twitter.com/AOC/status/1129752853315227652
2019-05-18 13:57:35,AOC,,1355,9305,46039,"White Supremacists get charged w hate crimes. Muslims get charged w terrorism. This is a HUGE difference. Hate crimes are underreported, deprioritized, + aren’t treated as seriously as domestic terror charges. Yet in the US, Neo-Nazi violence far outnumbers Islamic extremism.",,,,1129747865205706753,https://twitter.com/AOC/status/1129747865205706753
2019-05-18 13:52:19,AOC,nowthisnews,4525,33134,112547,"When a mass shooting is committed by a Muslim, the crime is almost automatically labeled as Domestic Terrorism. But when White Supremacists like Dylann Roof shot up a black church, or attack the Tree of Life Synagogue, the FBI declined to charge them w/ Domestic Terrorism. Why?",,,,1129746541412048901,https://twitter.com/AOC/status/1129746541412048901
2019-05-17 20:49:11,AOC,MikeLevin,1072,3135,15867,"Fun fact: #GreenNewDeal is a **resolution** - aka an overarching policy framework - NOT a bill. So if you’re curious about what a world with a #GreenNewDeal might look like, @MikeLevinCA’s Zero-Emission Vehicle Bill is a great example! ",,,#GreenNewDeal #GreenNewDeal,1129489059565527041,https://twitter.com/AOC/status/1129489059565527041
2019-05-17 18:23:38,AOC,,13374,20946,94285,"What angers me about the GOP’s attempts to turn the United States into a far-right Christian theocracy is how dishonest they are about it. At least be forthright about your desire to subvert and dismantle our democracy into a creepy theological order led by a mad king.",,,,1129452432034029568,https://twitter.com/AOC/status/1129452432034029568
2019-05-17 18:19:27,AOC,,5151,13215,72444,"The GOP doesn’t care about babies at all - especially brown, black, or poor ones. If they did, they’d: - cosponsor the Green New Deal or at LEAST have a real climate plan - guarantee healthcare so ALL can get prenatal care - not stand for the death+caging of babies on our border",,,,1129451377946693632,https://twitter.com/AOC/status/1129451377946693632
2019-05-17 18:13:46,AOC,,6556,24917,124117,"To the GOP extremists trying to invoke “the unborn” to jail people for abortion: Where are you on climate change? OH right, you want to burn fossil fuels til there’s hell on Earth. If they were truthful about their motives, they’d be consistent in their principles. They’re not.",,,,1129449948288815105,https://twitter.com/AOC/status/1129449948288815105
2019-05-17 02:43:54,AOC,adrielhampton,182,114,1392,"Yep! I’m just carrying it in the House and whipping votes there but if Mitch McConnell wants to actually use religious principles for good + reinstate usury laws, he’s more than welcome.",,,,1129215937775845376,https://twitter.com/AOC/status/1129215937775845376
2019-05-17 02:32:53,AOC,voxdotcom,4833,15389,73400,"Usury - aka high interest - happens to be explicitly denounced in the Bible (& in many other religions). Looking forward to having the religious right uphold their principles + sign onto my bill. Unless of course they’re only invoking religion to punish women + queer people.",,,,1129213168222375936,https://twitter.com/AOC/status/1129213168222375936
2019-05-16 23:51:14,AOC,RepKatieHill,833,6236,30962,".@KatieHill4CA went IN on Big Pharma payouts + bonuses today Usually CSPAN zooms in pretty tight on members - I didn’t realize my reactions cheering her on were on camera until she showed it to me ",,@KatieHill4CA,,1129172485918928897,https://twitter.com/AOC/status/1129172485918928897
2019-05-16 21:25:00,AOC,BarbraStreisand,9816,33248,165230,"If male politicians could get pregnant, there would be as many Planned Parenthood clinics as there are Post Offices. ",,,,1129135686160920577,https://twitter.com/AOC/status/1129135686160920577
2019-05-16 16:05:13,AOC,Public_Citizen,3828,36309,159266,"Spoiler: Because Australia has universal healthcare.",,,,1129055210746372096,https://twitter.com/AOC/status/1129055210746372096
2019-05-16 12:54:36,AOC,pdacosta,734,2984,27780,"We all have our hard days, but turning it around is all about perspective. People often ask me how I deal w/ negativity. In person, the far outweighs the . These notes sometimes get taken down, only for new ones to pop up the next day. Thank you everyone for the support ",,,,1129007238973206529,https://twitter.com/AOC/status/1129007238973206529
2019-05-16 05:27:01,AOC,,4019,28697,126954,"Ultimately, this is about women’s power. When women are in control of their sexuality, it threatens a core element underpinning right-wing ideology: patriarchy. It’s a brutal form of oppression to seize control of the 1 essential thing a person should command: their own body.",,,,1128894602801553409,https://twitter.com/AOC/status/1128894602801553409
2019-05-16 05:10:17,AOC,,11739,84173,315244,"Abortion bans aren’t just about controlling women’s bodies. They’re about controlling women’s sexuality. Owning women. From limiting birth control to banning comprehensive sex ed, US religious fundamentalists are working hard to outlaw sex that falls outside their theology.",,,,1128890390982123522,https://twitter.com/AOC/status/1128890390982123522
2019-05-15 22:20:47,AOC,RepRaskin,20,67,1229,"Thank you Rep. Raskin - it’s all because I get to learn from the best! Thanks for your leadership in calling + prioritizing this hearing.",,,,1128787337142525952,https://twitter.com/AOC/status/1128787337142525952
2019-05-15 22:16:58,AOC,AlecMapa,500,3436,24254,"Thanks for your advocacy! It‘s wrong that many children eligible for adoption go without adoptive families due to discrimination against the LGBT+ community. A loving family is a core element of wellbeing + happiness. That chance shouldn’t be taken from any child or parent.",,,,1128786377183760387,https://twitter.com/AOC/status/1128786377183760387
2019-05-15 21:40:33,AOC,mmcauliff,1130,9585,40472,"Today’s hearing on White Supremacy was powerful. Heather Heyer’s mother, @SusanBro7, offered testimony on how ‘being non-racist isn’t good enough; we must be anti-racist.’ We also learned how white supremacist mass shootings escape FBI “domestic terror“ classification &amp; more.",,@SusanBro7,,1128777210113011713,https://twitter.com/AOC/status/1128777210113011713
2019-05-15 21:32:24,AOC,mmcauliff,191,377,7303,"Not technically the 1st time, a few weeks ago I briefly covered for @RepRaskin for a few minutes as he quickly ran to a vote in Judiciary. But this is definitely my first time chairing for a significant amount of time!",,@RepRaskin,,1128775160872484864,https://twitter.com/AOC/status/1128775160872484864
2019-05-15 20:22:13,AOC,,1780,4397,16333,"1st Q today: to military contractor TransDigm, w/ a history of price gouging the public. Their 3in clutch disc costs $32 to make. They charged DoD $1,443 149x. How many kids could we have sent to college tuition-free at the cost of their unfair gouging?",,,,1128757496682831874,https://twitter.com/AOC/status/1128757496682831874
2019-05-15 20:01:13,AOC,Liz_Wheeler,3127,98,1390,"Actually it *would* be a felony for women - if those women are medical providers. See? According to your own semantic standard, you “lied.” We can fact-check obvious semantics all day and make absurd bad faith claims if that’s how you want be. But I have better uses for my time.",,,,1128752212837109761,https://twitter.com/AOC/status/1128752212837109761
2019-05-15 19:31:05,AOC,Liz_Wheeler,683,273,2439,"It’s a felony punishable by jail, incl cases of women pregnant by rape or incest. Twitter is 280 chars - read the context clues in grammar of the tweet. But good to know you’re here to promote criminalizing medical providers aiding victims of rape and incest! good job",,,,1128744629019598848,https://twitter.com/AOC/status/1128744629019598848
2019-05-15 13:05:38,AOC,,3013,23161,86897,"This law would force children - 12 year olds - to carry a pregnancy by their rapist. This law would force people w/ mental disabilities to carry pregnancy by rape to term. This law forces people to be pregnant against their own consent. It’s horrifying.",,,,1128647627434811393,https://twitter.com/AOC/status/1128647627434811393
2019-05-15 12:59:35,AOC,,6136,15947,55211,"Alabama lawmakers are making all abortions a felony punishable w jailtime,incl women victimized by rape+incest. Of course, no added punishments for rapists. It’s going to @GovernorKayIvey‘s desk. She will decide the future of women’s rights in Alabama.",,@GovernorKayIvey,,1128646103858065408,https://twitter.com/AOC/status/1128646103858065408
2019-05-15 12:41:13,AOC,jmillerlewis,2838,11458,70149," Oh, what’s that? All these spooky “socialist” proposals are winning over vast majorities of GOP voters because they are common-sense, humane policies? Ya don’t say.",,,,1128641483844870144,https://twitter.com/AOC/status/1128641483844870144
2019-05-14 23:10:21,AOC,JanelleMonae,349,873,17955,"Thank you Q.U.E.E.N.! ",,,,1128437421216026624,https://twitter.com/AOC/status/1128437421216026624
2019-05-14 22:11:43,AOC,katieporteroc,549,1360,10181,"Until very recently, there were few mothers of young children in Congress. Today is quite different. We could still use a lot more, but watching moms like @katieporteroc, @RepGraceMeng, @RashidaTlaib &amp; others navigate motherhood in office is so inspiring to me.",,@katieporteroc @RepGraceMeng @RashidaTlaib,,1128422668569579522,https://twitter.com/AOC/status/1128422668569579522
2019-05-14 21:56:00,AOC,Newsweek,3258,17202,63184,"The Senate Intel Committee (which is GOP-controlled!) issued a legally binding subpoena, & Sen. @LindseyGrahamSC advised that individual to ignore it. If Lindsey Graham wants to work for Trump so badly, he can resign his seat and move his office down a few blocks to do so.",,@LindseyGrahamSC,,1128418710677417984,https://twitter.com/AOC/status/1128418710677417984
2019-05-14 16:40:00,AOC,justicedems,465,1505,7727,".@SenMarkey, longtime climate leader + #GreenNewDeal Senate lead, was on at last night’s rally!",,@SenMarkey,#GreenNewDeal,1128339186833133569,https://twitter.com/AOC/status/1128339186833133569
2019-05-14 16:18:06,AOC,QuickTake,1920,10413,38383,"So much of our healthcare is needlessly expensive. When people vote for another military budget increase & then ask, “How are you going to pay for Medicare for All?” What they actually mean is, “How are you going to keep Big Pharma profits high if we can’t price gouge anymore?”",,,,1128333677459591168,https://twitter.com/AOC/status/1128333677459591168
2019-05-13 17:26:48,AOC,AOC,78,276,1814,"But also if you’re a staffer getting invited to a spa weekend funded by lobbyists, maybe ask yourself why you’re saying yes to that. It’s like those timeshare co’s who offer free vacations to people. You THINK you’re gonna say no, but they do it for a reason.",,,,1127988578410205187,https://twitter.com/AOC/status/1127988578410205187
2019-05-13 17:23:24,AOC,AOC,24,163,1306,"So sometimes you think you’re getting some straightforward info by some professor here or there, as if it’s a CRS report or something. But instead they just saying “objectively” that social security isn’t worth saving, etc. Without other viewpoints.",,,,1127987720868044800,https://twitter.com/AOC/status/1127987720868044800
2019-05-13 17:22:17,AOC,AndrewFeinberg,31,163,1478,"It’s not that simple. Oftentimes you have no idea you’re listening to a lobbyist bc they incorporate 3rd party groups with confusing names. I saw this 1st hand at the Harvard “Orientation” hosted by AEI. It was marketed at “objective” (lobbyists always say they’re objective).",,,,1127987440885600256,https://twitter.com/AOC/status/1127987440885600256
2019-05-13 17:18:43,AOC,,586,2815,18869,"It’s that bundle for elections, so you pick up their call,accept invites, become friends. In practice it’s not transactional, it’s social. So while ppl don’t see how lobbying influences votes, their whole enviro + staff has been exposed to mainly 1 point of view: lobbyists’.",,,,1127986542415437824,https://twitter.com/AOC/status/1127986542415437824
2019-05-13 17:11:51,AOC,,240,1906,13854,"When I was looking at lobbying from the outside, just as a normal voting citizen, it appeared to me as more transactional in nature than it actually is. It’s not necessarily that a lobbyist calls you and says “vote/don’t vote for this bill or we won’t donate to you again...” /2",,,,1127984814102065153,https://twitter.com/AOC/status/1127984814102065153
2019-05-13 17:09:15,AOC,ryangrim,1508,13758,42917,"This is how corporate lobbying works: Lobbyists ID bills they need to kill to keep profits high (no matter the human cost), come up w/ “sensible” talking points to mask intent + say policy is “misguided,” then schmooze policymakers in secret into accepting said talking points.",,,,1127984160830906371,https://twitter.com/AOC/status/1127984160830906371
2019-05-13 16:41:01,AOC,MattLaslo,1966,3173,15590,"It’s true. The #GreenNewDeal, as much as GOP hiss, scream, storytell &amp; cry about it, has forced even the most entrenched Tea Partiers into publicly abandoning their climate denial stance. The reason they’re so focused on discrediting the GND is because it’s a winning policy. ",,,#GreenNewDeal,1127977054576758785,https://twitter.com/AOC/status/1127977054576758785
2019-05-13 15:39:15,AOC,,2140,10312,35073,"This is why a “middle ground” approach to our climate crisis is unacceptable. This isn’t like other issues where you can pretend you’re a sober adult by cutting the difference between left and right. You’re either fighting for our future or you’re not.",,,,1127961511157227527,https://twitter.com/AOC/status/1127961511157227527
2019-05-12 21:02:30,AOC,,4537,18157,120610,"Happy #MothersDay! Let’s celebrate by making 3 months paid parental leave the minimum standard for all workers in the United States. ",,,#MothersDay #MothersDay,1127680471830286336,https://twitter.com/AOC/status/1127680471830286336
2019-05-12 18:46:19,AOC,TheEconomist,2428,10555,60475,"If you think your ‘celibacy’ is due to “female empowerment,” maybe it’s because far too many people relied on the disempowerment + silence of women to not be ‘celibate’ in the first place.",,,,1127646201241841670,https://twitter.com/AOC/status/1127646201241841670
2019-05-12 18:17:25,AOC,means_tv,413,2966,18067,"Direct action gets the goods! Congratulations to Stop &amp; Shop workers, who along w/ teachers + many other workers over the past year successfully protected their salary &amp; working conditions from cuts through collective action.",,,,1127638925940596739,https://twitter.com/AOC/status/1127638925940596739
2019-05-12 16:19:12,AOC,knockdownmovie,844,2657,22143,"A little over 1 year ago today. #KnockDowntheHouse",,,#KnockDowntheHouse,1127609176019148806,https://twitter.com/AOC/status/1127609176019148806
2019-05-12 16:01:36,AOC,MaxKennerly,14752,8472,54335,"This is a technique of the GOP, to take dry humor + sarcasm literally and “fact check” it. Like the “world ending in 12 years” thing, you’d have to have the social intelligence of a sea sponge to think it’s literal. But the GOP is basically Dwight from The Office so who knows.",,,,1127604746066583552,https://twitter.com/AOC/status/1127604746066583552
2019-05-11 19:24:33,AOC,,3262,7101,60285,"And in the meantime, as we continue fighting for Medicare for All, a living wage, & more: Unionize your workplace. Demand a raise. And don’t stop until you get one. ",,,,1127293435717869568,https://twitter.com/AOC/status/1127293435717869568
2019-05-11 18:15:03,AOC,,2586,11271,74880,"Ultimately, living in a moral society, a good nation, means establishing some basic standards of dignity: - healthcare as a right - a living wage - public education that prepares for civil society + economy (which now shld incl college) - all people having power in the economy",,,,1127275942265671686,https://twitter.com/AOC/status/1127275942265671686
2019-05-11 17:54:10,AOC,,9375,28808,121722,"When we say “tax the rich,” we mean nesting-doll yacht rich. For-profit prison rich. Betsy DeVos, student-loan-shark rich. Trick-the-country-into-war rich. Subsidizing-workforce-w-food-stamps rich. Because THAT kind of rich is simply not good for society, & it’s like 10 people.",,,,1127270688925134849,https://twitter.com/AOC/status/1127270688925134849
2019-05-11 17:47:09,AOC,,872,3326,31654,"US GDP is at an all-time high. As a nation, we are more prosperous than we ever have been. But that’s simply not the lived truth. Even now, I’m paid similar to a doctor or corporate lawyer - many who‘d think they are “rich,” but it’s nowhere near what we actually mean in policy.",,,,1127268922070319104,https://twitter.com/AOC/status/1127268922070319104
2019-05-11 17:38:22,AOC,,1724,8713,55488,"It’s a big part of what makes this Chase tweet so bad. It’s the idea that if you choose to have any expense beyond mere animalistic survival - an iced coffee, a cab after a 18hr shift on your feet - you deserve suffering, eviction, or skipped medicine. You don’t. Nobody does.",,,,1127266713899347969,https://twitter.com/AOC/status/1127266713899347969
2019-05-11 17:31:45,AOC,,965,10449,56416,"The myth that bad credit or struggling w bills = irresponsibility is a heinous myth. Paying people less than what’s needed to live is what’s actually irresponsible. GDP + costs are rising, wages are not. That doesn’t mean YOU’RE bad. It means working people are set up to fail.",,,,1127265047179354112,https://twitter.com/AOC/status/1127265047179354112
2019-05-11 17:24:43,AOC,,825,4740,45034,"Now I’m going through a huge income transition compared to living off tips (which diff pay every week, very hard). & I have HEALTH INSURANCE, which now means I have fewer expenses. According to banks, I’d be more “responsible,” but my character hasn’t changed. Just my math. /3",,,,1127263277237583874,https://twitter.com/AOC/status/1127263277237583874
2019-05-11 17:13:34,AOC,,1223,5414,48547,"When I was waitressing, I used to jerk awake in the middle of sleep worried that I may have forgotten if a bill cleared, or if I had enough to pay a Dr in cash. Was that bc I was “irresponsible?” No. It’s bc I wasn’t being paid a living wage as cost of living skyrocketed. /2",,,,1127260469381742594,https://twitter.com/AOC/status/1127260469381742594
2019-05-11 17:03:47,AOC,,7043,39307,177161,"Going from waitressing a year ago to now carries a LOT of life-adjustments. But 3 paychecks in has shown me how 1 of the greatest scams in US is the idea that financial struggle is due to “poor character.” It’s a huge myth designed to keep people from empowering themselves. /1",,,,1127258010936598528,https://twitter.com/AOC/status/1127258010936598528
2019-05-11 13:37:31,AOC,outmagazine,360,4343,30703,"In our house, we name a Queen of Hearts @NinaWest that is YOU! Thank you for being a relentless example of kindness, consciousness, compassion, and courage. Thank you for using your gifts to focus on voices + issues that deserve all the shine and elevation in the world. ",,@NinaWest,,1127206100988833792,https://twitter.com/AOC/status/1127206100988833792
2019-05-11 00:45:31,AOC,knockdownmovie,616,2224,17313,"Hell yeah #KnockDowntheHouse",,,#KnockDowntheHouse,1127011820034826241,https://twitter.com/AOC/status/1127011820034826241
2019-05-10 23:23:52,AOC,,1246,4762,41311,"If you don’t understand this man’s sign - or don’t approach it with a desire to - then you do not understand this political moment. The same folks who said Trump was impossible in 2016 are the same ones lecturing on what’s “electable” in 2020. Don’t buy it. Vote your values.",,,,1126991273439764480,https://twitter.com/AOC/status/1126991273439764480
2019-05-10 23:19:13,AOC,,454,3555,27194,"The forces getting in the way of solving our climate crisis are politicians themselves + lobbyists. It is the willingness to bend to corporate power - the same ones that use coal miners’ plights for a tax break, yet refuse to pay for those same miners’ healthcare for black lung.",,,,1126990102532698114,https://twitter.com/AOC/status/1126990102532698114
2019-05-10 23:14:50,AOC,,266,1778,20848,"All of this is to say don’t let any politician, no matter the party, lecture you about what is “possible” or “electable.” Don’t ever let a politician imply that working people are “less-than” or “uneducated” - aka that they are the ones in the way of solving the climate crisis.",,,,1126988999367774210,https://twitter.com/AOC/status/1126988999367774210
2019-05-10 23:08:12,AOC,,374,1271,23096,"Then he said, “I like you. I can tell that you are genuine and fighting for us. You’re real and you get it.” I thanked him and his family from the bottom of my heart.",,,,1126987330143830016,https://twitter.com/AOC/status/1126987330143830016
2019-05-10 23:06:22,AOC,,379,1281,20207,"I somehow got it out: “With all respect sir, how do you... manage to support both of us at the same time?” This is what he said: “I’ve been saying for years that climate change is our most important crisis. You’re one of the only ones who‘s been willing to be decisive on it.”",,,,1126986869558972417,https://twitter.com/AOC/status/1126986869558972417
2019-05-10 23:02:45,AOC,,371,855,14718,"I was pretty astonished. We shook hands, he introduced himself, and told me he wanted to show his support. I could barely get my question out - I wanted to honor his positivity, yet respectfully find a way to ask, “How?”",,,,1126985959516585984,https://twitter.com/AOC/status/1126985959516585984
2019-05-10 23:00:47,AOC,,6054,10099,73063,"About an hour ago, I was walking out of my office for the day. There was a man what I believe was his teenage son hanging a small sign they made outside my office (we let people leave well wishes on our wall). Astonishingly, his sign read: “Trump supporters for Ocasio-Cortez.”",,,,1126985462260936706,https://twitter.com/AOC/status/1126985462260936706
2019-05-10 21:15:13,AOC,NaomiAKlein,3544,11574,52108,"This is a dealbreaker. There is no “middle ground” w/ climate denial & delay. Blaming “blue collar” Americans as the main opponents to bold climate policy is gas lobbyist 101. We’re not going to solve the climate crisis w/ this lack of leadership. Our kids’ lives are at stake.",,,,1126958896973778950,https://twitter.com/AOC/status/1126958896973778950
2019-05-10 19:33:24,AOC,cspan,3925,11301,93462,"Today I presided over the House floor for the first time. Every day here is a sacred privilege + responsibility entrusted to me by my community. I never forget that, and moments like these drive it home. Thank you to the people of NY14 + beyond. This House belongs to all of us.",,,,1126933275245780992,https://twitter.com/AOC/status/1126933275245780992
2019-05-10 14:43:24,AOC,,2058,1538,13119,"Lastly, if anyone has recommendations for baby gear that folds up nicely or tips on how to prep a workplace for little ones, please give me your recs! If you’re a new mom/parent + could bring your babies / kids to work, what would help that? What would you want to see? ",,,,1126860292695187456,https://twitter.com/AOC/status/1126860292695187456
2019-05-10 14:24:56,AOC,,660,2091,23542,"8. This is convo is bigger than parental leave - it’s a larger conversation about how modern work has grown so hostile to family life. It doesn’t have to be that way! Work + family can go together, but we have to break down the barriers that force people to choose between them.",,,,1126855646429818880,https://twitter.com/AOC/status/1126855646429818880
2019-05-10 14:24:02,AOC,,208,1138,17108,"7. Additionally, paying a living min wage to our most junior staffers means they’re talented + capable (no 2nd job) to take over big-time situations, meaning senior staffers are confident enough in them to take parental leave and not feel like everything will fall apart.",,,,1126855420226699265,https://twitter.com/AOC/status/1126855420226699265
2019-05-10 14:16:44,AOC,,201,745,11904,"6. We make an effort to make our office family-friendly. We talk about what play mats + cribs we need along w/ our legislative agenda. My personal office can be used for pumping/feeding. Staff can bring their babies to work if they like & we are working to prepare to have them.",,,,1126853581427093504,https://twitter.com/AOC/status/1126853581427093504
