date,username,to,replies,retweets,favorites,text,geo,mentions,hashtags,id,permalink
2019-07-12 17:19:44,AOC,morningmika,3359,2922,18460,"Hey Mika - GOP has alleged that I am lying about the accounts of migrant women at the border, particularly about the fact that they were were told to drink out of a toilet bowl. Committee staff conferred with me ahead of time about formally requesting to be sworn in.",,,,1149730072787636224,https://twitter.com/AOC/status/1149730072787636224
2019-07-12 16:18:41,AOC,morningmika,1475,2405,24298,"GOP has been stating that I am lying about the translated accounts of migrants at the border, particularly about the fact that women were drinking out of a toilet bowl. Committee staff conferred with me ahead of time about requesting to be sworn in.",,,,1149714706413817856,https://twitter.com/AOC/status/1149714706413817856
2019-07-11 16:02:20,AOC,mkink,2275,9183,40805,"Well, just as we said, Amazon quietly came to NYC without needing a dime of public money or special tax treatment. The jobs came without the cost. NYC is an attractive place to locate on its own (incl. public infra!), w/o billions of dollars in corporate giveaway “incentives.”",,,,1149348204045094912,https://twitter.com/AOC/status/1149348204045094912
2019-07-11 13:45:04,AOC,AOC,825,2386,7119,"",,,,1149313659325296641,https://twitter.com/AOC/status/1149313659325296641
2019-07-11 13:43:09,AOC,,1970,8864,20203,"If people come knocking, you do NOT have to open your door unless there is a signed judicial warrant. Check the site above to learn how to handle your rights in 4 scenarios in 7 different languages.",,,,1149313177605353473,https://twitter.com/AOC/status/1149313177605353473
2019-07-11 13:38:30,AOC,,3860,10759,23628,"No matter who you are or what your status is, this is the United States of America - where ALL people have rights. Know yours. Prepare. Visit http://WeHaveRights.US to learn how to handle this &amp; other ICE encounters in multiple languages.",,,,1149312007776157696,https://twitter.com/AOC/status/1149312007776157696
2019-07-11 13:29:14,AOC,mkcheok,9110,30122,46269,"ICE will launch raids across 10 major cities this SUNDAY. Check your neighbors & know your rights. Remember: no one can enter your home without a *judicial warrant.* Sometimes ICE will try to show other papers to get in your house. Judicial warrants are from a court. /1",,,,1149309677680975875,https://twitter.com/AOC/status/1149309677680975875
2019-07-11 03:48:36,AOC,,1640,10818,53357,"132 members - incl GOP & Independents - voted against creating the Dept of Homeland Security. Don’t let people rewrite history as if DHS/ICE always existed, or is a no-brainer. It’s a young agency, ill-conceived after 9/11 & sacrificed our civil liberties - like the Patriot Act.",,,,1149163552730746881,https://twitter.com/AOC/status/1149163552730746881
2019-07-11 03:27:58,AOC,CBSNews,3077,14651,74932,"It’s really not that radical. When DHS was 1st formed by Bush 17 years ago, many members of Congress were concerned - incl GOP - that we were setting up a ticking time bomb for civil liberties erosion & abuse of power. Discussing reorganization shouldn’t be out of the question.",,,,1149158361109336065,https://twitter.com/AOC/status/1149158361109336065
2019-07-11 01:58:04,AOC,,1106,2691,12599,"“Ocasio-Cortez’s implication is that, by raising interest rates out of a fear of illusory inflation, the Fed may have needlessly hurt American workers. Powell’s concession on that point is significant.”",,,,1149135739722096640,https://twitter.com/AOC/status/1149135739722096640
2019-07-10 22:47:40,AOC,MrRBourne,205,392,17112,"Thanks - I appreciate that.",,,,1149087820818079745,https://twitter.com/AOC/status/1149087820818079745
2019-07-10 14:47:58,AOC,SenKamalaHarris,1979,4638,26952,"The War on Drugs has grown far beyond our criminal justice system - it’s also evolved into a poverty trap for impacted families. Today I’m proud to work w/ @SenKamalaHarris to undo “1-Strike” rules that take housing opportunities away from communities caught in the War on Drugs.",,@SenKamalaHarris,,1148967100641415168,https://twitter.com/AOC/status/1148967100641415168
2019-07-10 03:26:20,AOC,MotherJones,6255,17599,51686,"DHS & ICE are flagrantly violating Congressional orders, just as we said they would. Yet it was @IlhanMN, @AyannaPressley, @RashidaTlaib &amp; I that were wrong to oppose throwing more money to abusive agencies, right? ",,@IlhanMN @AyannaPressley @RashidaTlaib,,1148795563988664326,https://twitter.com/AOC/status/1148795563988664326
2019-07-10 00:49:54,AOC,NBCLatino,3393,11255,45448,".@KellyannePolls curious how you’re going to defend the child sexual assault that seems to be happening on your watch. Remind me again how sexual assault is a “funding” problem? Bc last I checked ending this is about holding abusers to account, something you can’t seem to do.",,@KellyannePolls,,1148756195408252930,https://twitter.com/AOC/status/1148756195408252930
2019-07-10 00:42:21,AOC,AyannaPressley,9303,6011,35863,"Trust me when I say you don’t want to get caught in @AyannaPressley’s righteous fire Kellyanne is way over her head defending caging children &amp; families in conditions that have killed almost 30 people on her admin’s watch. She may play games with people’s lives, but we don’t.",,@AyannaPressley,,1148754293631135745,https://twitter.com/AOC/status/1148754293631135745
2019-07-09 22:03:39,AOC,,1478,4216,47048,"(Being a woman does not mean you’re immune from being bad to women or genderqueer people. Just like being a man doesn’t mean you don’t have a role in the movement for gender equity! We are all in this together.)",,,,1148714359302119424,https://twitter.com/AOC/status/1148714359302119424
2019-07-09 21:58:19,AOC,LisaMarieBoothe,3007,4916,57414,"Just when you think all hope is lost, we get a Fox News contributor to realize that patriarchy has no gender ",,,,1148713014746583045,https://twitter.com/AOC/status/1148713014746583045
2019-07-09 19:45:04,AOC,nypost,16981,24762,147411,"“Catfight” is the sexist term Republicans use when two adult women happen to disagree with each other. The reason they find it so novel &exciting is bc the GOP haven’t elected enough women themselves to see that it can, in fact, be a normal occurrence in a functioning democracy.",,,,1148679483161010176,https://twitter.com/AOC/status/1148679483161010176
2019-07-09 18:34:28,AOC,ddale8,2585,5262,19890,"One of the most devastating aspects of throwing people in jail is that they can lose jobs, miss rent, & lose their home, triggering a cycle of poverty w/ generational consequences. Many don’t even learn about special jail exemptions until they’re given to the rich & connected ",,,,1148661713170063360,https://twitter.com/AOC/status/1148661713170063360
2019-07-09 17:21:05,AOC,nowthisnews,4413,10531,56672,"Growing your own food is very satisfying. We like to pop outside, pluck some greens, &throw them on the pan after a rinse. It’s WAY better for the environment, too. Gardens can sequester more carbon than lawns. Plus: no mowing (&no gasoline)! Let’s bring back victory gardens ",,,,1148643245921951745,https://twitter.com/AOC/status/1148643245921951745
2019-07-09 16:39:50,AOC,,1785,2789,13054,"Today I am joining @repblumenauer and @SenSanders in pushing Congress to acknowledge the climate emergency. The US isn’t leading on climate, and we must. Let’s join the four leading nations &amp; 740 local governments that have declared a climate emergency.",,@repblumenauer @SenSanders,,1148632865820819457,https://twitter.com/AOC/status/1148632865820819457
2019-07-09 15:11:09,AOC,Public_Citizen,1258,3915,17915,"Frontline communities are already impacted by the climate crisis & environmental injustice. That’s why they’re named in the #GreenNewDeal. Fixing the pipes in Flint, cleaning the air in the Bronx &amp; transitioning away from pipelines on reservations sets an example for our future.",,,#GreenNewDeal,1148610546360565761,https://twitter.com/AOC/status/1148610546360565761
2019-07-08 19:39:00,AOC,,569,1048,7054,"When Hurricane Sandy hit NYC in 2012, FEMA’s flood maps - which impact the National Flood Insurance Program (!!) - hadn’t been updated since *1983,* before the government even acknowledged climate change was real and connected to fossil fuels. https://www1.nyc.gov/site/floodmaps/index.page",,,,1148315567486590981,https://twitter.com/AOC/status/1148315567486590981
2019-07-08 19:35:26,AOC,AlexJLamers,1528,3156,15167,"The severity of today’s flash flood “has climatologically <1% chance of occurring in a given year.” Floods that were once rare (“100-year floods”) are now expected to happen more regularly. I learned in FSC hearings that certain key flood maps haven’t updated in *decades.* ",,,,1148314669968482310,https://twitter.com/AOC/status/1148314669968482310
2019-07-08 18:21:44,AOC,AndreaNRuth,4520,7778,46510,"“A glass of water could’ve [beat a 20-yr incumbt]” “The Green Dream or whatever” “Their public whatever” Those aren’t quotes from me; they‘re from the Speaker. Having respect for ourselves doesn’t mean we lack respect for her. It means we won’t let everyday people be dismissed.",,,,1148296121149796352,https://twitter.com/AOC/status/1148296121149796352
2019-07-08 18:03:12,AOC,,2153,4865,28823,"Climate change intensifies flooding, wildfires, & extreme weather. It’s more than 1 day or 1 storm; it’s all of them. Places are flooding where they haven’t before; there are 90-degree days in Alaska in June. The GOP will mock & sow confusion until it’s their home swept away.",,,,1148291459285733376,https://twitter.com/AOC/status/1148291459285733376
2019-07-08 17:43:24,AOC,,808,1936,13871,"If the GOP is suddenly so concerned w/ funding “humanitarian crises” they‘ve created, let’s come up w an *actual* funding package that ensures no person in public housing has to drink poisoned water or suffer cold winters again. Simple: GOP needs to pay NYCHA the $34b they owe.",,,,1148286474376437760,https://twitter.com/AOC/status/1148286474376437760
2019-07-08 17:39:03,AOC,IamJohnBurnett,774,2621,14890,"NYCHA is in a crisis bc over YEARS of GOP majorities, they refused to fund basic maintenance of public housing to sabatoge it. NYCHA *alone* is owed ~$34 bn. I have vids of hearings breaking down this horrifying neglect. But if GOP wants to fund public housing $now, let’s go.",,,,1148285379906330624,https://twitter.com/AOC/status/1148285379906330624
2019-07-08 17:30:50,AOC,fox5melanie,8050,12428,54408,"Unprecedented flooding is quickly becoming a new normal. Despite that, Republicans are tripling down on fossil fuels w/no plan to transition off them, or make the critical infra investments we need to prep for the climate crisis. Each day of inaction puts more of us in danger.",,,,1148283312798126080,https://twitter.com/AOC/status/1148283312798126080
2019-07-08 00:53:24,AOC,,19059,1694,28586,"Ok everyone, planning to take a few days of rest within the next few months and am sourcing a few ideas. What’s your favorite US National Park to visit? (Any tips for visiting said park also welcome!)",,,,1148032301793775621,https://twitter.com/AOC/status/1148032301793775621
2019-07-07 19:11:21,AOC,ESPNFC,474,2631,37794," ",,,,1147946219160985601,https://twitter.com/AOC/status/1147946219160985601
2019-07-07 18:12:03,AOC,,4087,5272,52735,"“I had watched for many years and seen how a few rich families held much of Argentina's wealth and power in their hands. So the government brought in an eight hour working day, sickness pay and fair wages to give poor workers a fair go.” - Evita Perón",,,,1147931296724856832,https://twitter.com/AOC/status/1147931296724856832
2019-07-07 18:10:21,AOC,nypost,8030,13028,110246,"“I know that, like every woman of the people, I have more strength than I appear to have.” - Evita Perón",,,,1147930869904093184,https://twitter.com/AOC/status/1147930869904093184
2019-07-07 17:26:10,AOC,nrarmour,5799,17618,121548,"At this point we shouldn’t even be asking for #EqualPay for the #USWMNT - we should demand they be paid at least twice as much ",,,#EqualPay #USWMNT,1147919751705968640,https://twitter.com/AOC/status/1147919751705968640
2019-07-07 17:08:45,AOC,USWNT,837,7412,82480,"USA! USA! Congratulations and thank you @USWNT for your excellence, tenacity, and champion’s spirit. You did it. And we are ALL so proud! ",,@USWNT,,1147915365575471104,https://twitter.com/AOC/status/1147915365575471104
2019-07-07 15:51:15,AOC,USWNT,607,3597,39102,"“Some teams visit pressure. We live there.” - @USWNT ",,@USWNT,,1147895865882927104,https://twitter.com/AOC/status/1147895865882927104
2019-07-07 01:15:43,AOC,matthewstoller,7901,7784,37065,"I don’t believe it was a good idea for Dems to blindly trust the Trump admin when so many kids have died in their custody. It’s a huge mistake. This admin also refuses to hand over docs to Congress on the whereabouts of families. People’s lives are getting bargained, & for what?",,,,1147675528989696001,https://twitter.com/AOC/status/1147675528989696001
2019-07-07 01:01:39,AOC,,6450,14320,108198,"I find it strange when members act as though social media isn’t important. They set millions of on to run TV ads so people can see their message. I haven’t dialed for dollars *once* this year, &amp; have more time to do my actual job. Yet we’d rather campaign like it’s 2008.",,,,1147671989383049216,https://twitter.com/AOC/status/1147671989383049216
2019-07-07 00:49:35,AOC,joshjame,7336,11503,71491,"That public “whatever” is called public sentiment. And wielding the power to shift it is how we actually achieve meaningful change in this country.",,,,1147668951834476545,https://twitter.com/AOC/status/1147668951834476545
2019-07-06 14:25:53,AOC,ryangrim,1672,3514,39236,"Bleeps happen ",,,,1147511994322497536,https://twitter.com/AOC/status/1147511994322497536
2019-07-05 18:02:50,AOC,BernieSanders,1496,3567,49012,"Thank you, @SenSanders. It’s an honor to work alongside you and the millions of other people fighting for education, healthcare, and a living wage as rights.",,@SenSanders,,1147204203804278785,https://twitter.com/AOC/status/1147204203804278785
2019-07-05 14:33:35,AOC,BermudezWrites,3730,8850,66304,"I probably spent the first 10 mos after my primary terrified, too. Each day felt like a tightrope, as if one slip would end it all. Fear followed me around&moved into my apt. But courage requires fear. We should teach each other how we handle fear, to help others be courageous.",,,,1147151543269056512,https://twitter.com/AOC/status/1147151543269056512
2019-07-05 14:13:22,AOC,JoeNBC,11364,13847,72369,"Ah yes, now Newt & the GOP are resorting to calling me a liar. Who else do they call liars? - 96% of scientists who agree on climate change - Millions of Americans they locked up in the War on Drugs - #MeToo survivors So I’ll take it as a compliment. Thanks.",,,#MeToo #MeToo,1147146454252867584,https://twitter.com/AOC/status/1147146454252867584
2019-07-05 13:03:58,AOC,,2555,2851,29414,"(Updated the $since previous one was estimate of his cancelled Veteran’s day military parade)",,,,1147128988588023809,https://twitter.com/AOC/status/1147128988588023809
2019-07-05 13:02:55,AOC,,42544,35731,155636,"Trump spent millions on a poorly attended, 1 day parade days after saying he couldn’t afford toothpaste & soap for caged children. Did he ask Congress for military parade ? No. Trump held these kids hostage to secure billions for their abusers. Congress needs to see that.",,,,1147128726372724736,https://twitter.com/AOC/status/1147128726372724736
2019-07-04 19:36:42,AOC,politico,3067,20755,57063,"When members of Congress asked CBP if they knew about violently racist & sexually disturbing secret Facebook group w up to 10,000 CBP officers, they told us they just learned about it. Looks like CBP lied. Reporting shows they knew about it for *years.* This is a big deal. ",,,,1146865436895666176,https://twitter.com/AOC/status/1146865436895666176
2019-07-04 19:08:58,AOC,CBSNews,14068,22551,70588,"CBP is trying to refute the toilet drinking story by saying their toilets have sinks. The sink in the cell we visited wasn’t functional. Guards told these women,Cuban refugees , they could drink out of the bowl. This account has been corroborated by other members of Congress.",,,,1146858457854808064,https://twitter.com/AOC/status/1146858457854808064
2019-07-04 18:53:22,AOC,ryangrim,406,1893,8193,"This is pretty wild, and a testament to why everyday people in NYC have begun to vote out those engaged with Tammany Hall-style political machinery in the first place. Elections should not be decided by lawyers who make millions grifting off the “widows & orphans” court. ",,,,1146854532963590145,https://twitter.com/AOC/status/1146854532963590145
2019-07-04 18:35:48,AOC,DiegoBernalTX,1231,4420,18098,"“Just got back from visiting [CBP]. People say that Trump’s policies have failed. I disagree. I think they’re working exactly the way they’re supposed to. This is exactly what they wanted to happen. This is not a logistical problem. It is a moral problem.” - @DiegoBernalTX",,@DiegoBernalTX,,1146850109847670785,https://twitter.com/AOC/status/1146850109847670785
2019-07-04 18:27:07,AOC,GadiNBC,2435,8212,27325,"Republicans & CBP (as if they would tell on themselves?) are working overtime to discredit my account from the camps. However, you could remove my entire account & the claims still stand. Details are now being corroborated by independent 3rd parties, from courts to inspectors.",,,,1146847926116933632,https://twitter.com/AOC/status/1146847926116933632
2019-07-04 14:15:29,AOC,pauldemko,558,1172,6698,"@justinamash is right about this ",,@justinamash,,1146784600741634048,https://twitter.com/AOC/status/1146784600741634048
2019-07-04 14:01:06,AOC,AOC,3699,9744,51536,"Happy Independence Day! American democracy was once an unspeakable idea. To challenge the divine right of Kings & aristocrats was to challenge the structure of society. The founders’ notion of a government by the people was incredibly radical. And in many ways, it still is. ",,,,1146780979169808385,https://twitter.com/AOC/status/1146780979169808385
2019-07-03 20:08:04,AOC,,1364,1436,11396,"4. Econ: We need large-scale public investment to spur job creation for citizens&immigrants alike. Ideally that investment transitions us to a sustainable economy (climate & income-wise). We are overdue to rebuild American infra&it’s going to take ALL of us & immigrants to do it.",,,,1146510940998918149,https://twitter.com/AOC/status/1146510940998918149
2019-07-03 20:08:03,AOC,,1000,1589,11712,"3. Border policy: As @JulianCastro mentioned in the #DemDebate, it’s time to repeal Section 1325 &amp; 1326, the statutes this admin is using to mindlessly throw people in cages. We have to take these proceedings out of criminal code &amp; into civil code. Torture accomplishes nothing.",,@JulianCastro,#DemDebate,1146510939593814017,https://twitter.com/AOC/status/1146510939593814017
2019-07-03 20:08:03,AOC,,547,827,6429,"2. Climate change: There is broad consensus from military to activists that resource strains (droughts, famine, etc) & nat disasters are drivers of refugees. People are fleeing places that were once livable &are no longer. It will get worse the longer we do nothing #GreenNewDeal",,,#GreenNewDeal,1146510938163568643,https://twitter.com/AOC/status/1146510938163568643
2019-07-03 20:07:58,AOC,,1898,3341,17445,"A thread of some of the policy approaches we should consider wrt immigration: 1. Foreign policy: Reinstate US humanitarian aid in the Northern Triangle, where people are fleeing. US should start acting like a real partner in Latin America,& increase visas where we intervene.",,,,1146510918576234496,https://twitter.com/AOC/status/1146510918576234496
2019-07-03 19:46:09,AOC,AdamSerwer,2739,9345,34926,"The cruelty is the goal. It’s called “deterrence” - a policy stance that if our country inflicts enough pain on refugees, they will think twice before believing America is worth their dreams & aspirations. Only policy change can end cruelty, not blank checks to the status quo.",,,,1146505427724771328,https://twitter.com/AOC/status/1146505427724771328
2019-07-03 19:39:32,AOC,kylegriffin1,8918,6808,28442,"The GOP’s grand plan to “Make America Great Again” is to hurt children, immigrants, refugees into thinking America isn’t great - that it’s cruel & inhumane - so people don’t come at all. But America isn’t America at all without immigrants. To turn them away is Un-American.",,,,1146503762779037697,https://twitter.com/AOC/status/1146503762779037697
2019-07-03 17:26:12,AOC,MotherJones,7913,17217,92359,"When you stand up to bullies once, it gets easier to do each following time. I am used to the right’s behavior towards me - but I will never get used to their heartless cruelty towards other human beings escaping violence & despair, nor their indifference to everyday Americans.",,,,1146470207625551873,https://twitter.com/AOC/status/1146470207625551873
2019-07-03 16:54:48,AOC,hayleyalvz,14,13,248,"Of course. Our prayers are with you - and we will work our hardest to honor his last wish to Congress.",,,,1146462305376493568,https://twitter.com/AOC/status/1146462305376493568
2019-07-03 16:26:05,AOC,NBCNightlyNews,837,5197,28455,"Fmr. Detective Luis Alvarez, 9/11 first responder, & loving father of 3 sons, left us far too soon. He spent his last days fighting for the 9/11 Victim’s Compensation Fund. Some issues should be above partisanship or delay. We must pass the bill as soon as Congress reconvenes.",,,,1146455078469062656,https://twitter.com/AOC/status/1146455078469062656
2019-07-03 02:17:12,AOC,KellyannePolls,9695,21120,120156,"Also @KellyannePolls, maybe you actually do your job and show up to a Congressional hearing next time you want to talk to me. After all you, you ran away and skipped out on Oversight committee last week, just to call into Fox and Friends instead. ",,@KellyannePolls,,1146241449022959617,https://twitter.com/AOC/status/1146241449022959617
2019-07-03 02:12:52,AOC,,3544,14071,79161,"Are CBP officers waking up women in the middle of sleep a “funding” problem? Is calling migrants “filthy” “wh*res” a funding problem? Is threatening violence on members of Congress a “funding” problem? No, it’s not. It’s a far deeper, systemic, more violent problem than that.",,,,1146240357883088897,https://twitter.com/AOC/status/1146240357883088897
2019-07-03 02:09:35,AOC,KellyannePolls,6748,22113,118740,"The $4.6 billion wasn’t humanitarian at all. It had NO accountability measures for facilities that abuse children and families. It didn’t fix the problem, just funded abuse. I don’t believe in billion dollar blank checks for unethical, abusive administrations. Including yours.",,,,1146239531223539713,https://twitter.com/AOC/status/1146239531223539713
2019-07-02 23:46:05,AOC,SalHernandez,8409,20589,69857,"The right is responding to what’s been exposed at the border by denying it & saying I’m lying. Hard to assert when the details I shared are corroborated by other members of Congress, court documents, migrant testimony, and now photos released today by the Inspector General.",,,,1146203421747425280,https://twitter.com/AOC/status/1146203421747425280
2019-07-02 21:36:39,AOC,GadiNBC,13715,44155,99888,"These are concentration camps. According to concentration camp experts, people begin to die due to overcrowding, neglect, and shortage of resources. We saw all three of those signs on our trip yesterday. Another person died yesterday. And those are the deaths we know about.",,,,1146170846303662081,https://twitter.com/AOC/status/1146170846303662081
2019-07-02 18:17:37,AOC,billmckibben,8826,17148,65813,"We just experienced *the hottest month ever recorded on Planet Earth.* Unless we act drastically now, it’s only going to get worse. What will that mean for our food, water, shelter, safety? We need a #GreenNewDeal. Now.",,,#GreenNewDeal,1146120757178765314,https://twitter.com/AOC/status/1146120757178765314
2019-07-02 16:18:50,AOC,thedailybeast,19304,20681,92257,"How many migrant women has Kellyanne Conway touched? Hugged? Sat on a concrete floor with? Actually listened to? The answer is none. Her actions show she doesn’t believe all human beings are worthy of basic dignity. That‘s why she defends & muddies the clear and indefensible.",,,,1146090864604790785,https://twitter.com/AOC/status/1146090864604790785
2019-07-02 14:01:30,AOC,KlasfeldReports,1450,4940,17782,"And now CBP is pushing easily disprovable lies about members of Congress. Truly nuts. And to think this week the GOP & Dem “Problem Solvers Caucus” fought to eliminate ALL accountability amendments from funding. They just wrote a multi-billion dollar blank check for misconduct.",,,,1146056305649410048,https://twitter.com/AOC/status/1146056305649410048
2019-07-02 13:50:39,AOC,,2035,10217,49682,"When you pair: - 9,500 current + former CBP officers are part of a violently racist & sexually violent secret Facebook group - Corroborating accounts of abuse - CBP couldn’t control their own officers for a Congressional tour What else do you call that but a rogue agency?",,,,1146053573404266496,https://twitter.com/AOC/status/1146053573404266496
2019-07-02 13:46:30,AOC,RepDean,5521,19724,78324,"I can’t understate how disturbing it was that CBP officers were openly disrespectful of the Congressional tour. If officers felt comfortable violating agreements in front of their *own* management & superiors, that tells us the agency has lost all control of their own officers.",,,,1146052528997588992,https://twitter.com/AOC/status/1146052528997588992
