date,username,to,replies,retweets,favorites,text,geo,mentions,hashtags,id,permalink
2019-10-03 19:44:27,AOC,kimmaicutler,3,7,238,"Kudos!",,,,1179844681695404032,https://twitter.com/AOC/status/1179844681695404032
2019-10-03 19:42:41,AOC,cspan,787,636,4498,"Our monthly town hall is tonight! We’re answering questions, & updating everyone on our Just Society suite of bills & more. RSVPs are already maxed out to constituents, but you can tune in online via CSPAN ",,,,1179844236600123393,https://twitter.com/AOC/status/1179844236600123393
2019-10-03 16:54:43,AOC,publicbankla,334,1836,12452,"Wow. Congratulations to the California grassroots for this enormous victory. Kudos to @GavinNewsom for signing this. Public banking is next level! #PeopleOverProfit",,@GavinNewsom,#PeopleOverProfit,1179801969432649728,https://twitter.com/AOC/status/1179801969432649728
2019-10-03 01:32:08,AOC,yashar,2995,6449,45603,"So apparently at Fox News you can parrot a wide range of conspiracy theories & falsely claim white supremacy is a “hoax,” but saying this gets you fired? I’m just trying to figure out where the line is After all, how was he supposed to know this was below their standards?",,,,1179569794334564352,https://twitter.com/AOC/status/1179569794334564352
2019-10-03 00:43:36,AOC,Castro4Congress,29,54,2103," you’ll have to shave the beard hermano!",,,,1179557577383976960,https://twitter.com/AOC/status/1179557577383976960
2019-10-02 23:58:04,AOC,FullFrontalSamB,1273,2327,27640,"You’re in, @FullFrontalSamB! #TheSquadIsBig",,@FullFrontalSamB,#TheSquadIsBig,1179546117639491584,https://twitter.com/AOC/status/1179546117639491584
2019-10-02 16:35:05,AOC,,2006,11098,115030,"Sending lots of love and solidarity to @BernieSanders today as he rests and recovers. A lot of people don’t understand how crazy hard grassroots campaigning is - for organizers and candidates alike. Rest up, friend. We’re with you!",,@BernieSanders,,1179434638038712326,https://twitter.com/AOC/status/1179434638038712326
2019-10-02 13:51:45,AOC,katiecurtin7,163,587,5767,"Thank YOU! Inspired by your diligent, committed, hard-working & tenacious students. What a humbling video & thanks for thinking of me during #LatinxHeritageMonth. Keep at it and aim high!",,,#LatinxHeritageMonth,1179393536116035587,https://twitter.com/AOC/status/1179393536116035587
2019-10-02 04:06:44,AOC,RAICESTEXAS,520,5007,25476,"As dire as things can be, it’s important to show how mass mobilization is still winning in very big ways through public pressure and organizing. For-profit prison & detention co’s are running dry. Banks see them as too much of a public liability & are no longer financing them ",,,,1179246312761499650,https://twitter.com/AOC/status/1179246312761499650
2019-10-02 03:29:49,AOC,CristinaAlesci,7210,17533,94798,"“Billionaires should not exist” does not mean certain people should not exist. It means no person should have a billion dollars. The ascent of billionaires is a symptom & outcome of an immoral system that tells people affordable insulin is impossible but exploitation is fine.",,,,1179237019043729410,https://twitter.com/AOC/status/1179237019043729410
2019-10-01 22:37:26,AOC,andreagonram,1539,7329,40152,"The cruelty has always been the point.",,,,1179163439954087936,https://twitter.com/AOC/status/1179163439954087936
2019-10-01 22:31:45,AOC,NY1weather,50,53,1751,"Well dang",,,,1179162007569928192,https://twitter.com/AOC/status/1179162007569928192
2019-10-01 01:40:53,AOC,MarketWatch,4193,9963,87242,"“Struggling” with what? Math?",,,,1178847217743998979,https://twitter.com/AOC/status/1178847217743998979
2019-10-01 00:37:25,AOC,knockdownmovie,1166,17596,72963,"“If another country came in here, blew up our mountains and poisoned our water, we’d go to war. But industry can.” - Paula Jean Swearengin",,,,1178831247155568641,https://twitter.com/AOC/status/1178831247155568641
2019-09-30 21:21:16,AOC,im_Uncia,1831,6753,23590,"We stand for the basic human dignity of Kashmiris & support democracy, equality, and human rights for all - including the most vulnerable. Reports of violence & torture are extremely concerning, and the blockade from communication and life-saving medical care must end.",,,,1178781885641773057,https://twitter.com/AOC/status/1178781885641773057
2019-09-30 20:11:03,AOC,justinamash,9082,32084,169855,"It’s wild to me how people crawled over my 60 mins interview with a fine-toothed comb to find any word or reason to claim I’m unfit for the job, yet here Kevin McCarthy (the GOP Leader!) is a bumbling, sloppy, dishonest mess & his mediocrity is accepted as a matter of course.",,,,1178764214409859073,https://twitter.com/AOC/status/1178764214409859073
2019-09-30 18:48:37,AOC,ACLU,276,2978,13260,"On October 8th, Aimee Stephens & the @ACLU will bring the first trans civil rights case ever heard by the US Supreme Court. Thank you, Aimee - for your courage to fight for civil rights and the dignity of all people in our country. #TransRightsAreHumanRights",,@ACLU,#TransRightsAreHumanRights,1178743469977866240,https://twitter.com/AOC/status/1178743469977866240
2019-09-30 18:01:24,AOC,NPR,1351,6399,29430,"One of the major reasons we don’t talk about debt & poverty is shame. Yet way more Americans are living in poverty than our country wants to admit. It’s time we stop looking the other way on economic abuse, like predatory lending, abusive workplaces, & extortionary landlords.",,,,1178731586013016064,https://twitter.com/AOC/status/1178731586013016064
2019-09-30 17:34:21,AOC,RepBarbaraLee,260,811,5524,"It’s an honor of a lifetime to join members of Congress who have been taking the hard road & fighting for justice their whole lives. Barbara Lee is one of them. Thank you, @RepBarbaraLee for leading the fight in reproductive justice to end the Hyde Amendment. #BeBoldEndHyde ",,@RepBarbaraLee,#BeBoldEndHyde,1178724777084817408,https://twitter.com/AOC/status/1178724777084817408
2019-09-30 17:00:18,AOC,realDonaldTrump,5195,20438,104930,"I truly can think of few things less patriotic, more cowardly, and plainly pathetic + reckless than amplifying calls for civil war within your own country. This President has never been interested in leading. He‘s interested in consolidating power with a cult of personality.",,,,1178716208314699776,https://twitter.com/AOC/status/1178716208314699776
2019-09-30 14:59:44,AOC,kashishds,211,285,3323,"Jackson Heights never fails! We were successful in our Momo hunting last night. I had the Mokthuk at Lhasa Fast Food ",,,,1178685868804100097,https://twitter.com/AOC/status/1178685868804100097
2019-09-30 13:44:11,AOC,JulianCastro,19,29,877,"That soundtrack tho ",,,,1178666854824513538,https://twitter.com/AOC/status/1178666854824513538
2019-09-30 13:07:52,AOC,DecrimNY,16,8,209," ",,,,1178657717545779200,https://twitter.com/AOC/status/1178657717545779200
2019-09-29 19:36:57,AOC,jdakwar,35,6,158,"Thanks!",,,,1178393242301272071,https://twitter.com/AOC/status/1178393242301272071
2019-09-29 18:11:15,AOC,,10283,39945,174216,"Trump Tower used as a piggy bank was enough. 10 incidents of obstruction of justice was enough. Permanently separating children & parents for profit was enough. Detention camps were enough. Muslim ban was enough. Trans servicemember ban was enough. Ukraine is beyond enough.",,,,1178371678759464963,https://twitter.com/AOC/status/1178371678759464963
2019-09-29 16:30:52,AOC,,298,1361,13042,"Shana Tovah to our neighbors and family in NY-14 and across the world! Here’s to a happy and sweet new year for all. #RoshHashanah",,,#RoshHashanah,1178346413509545986,https://twitter.com/AOC/status/1178346413509545986
2019-09-29 16:16:21,AOC,JulianCastro,778,3506,25809,"Thank you, @JulianCastro!",,@JulianCastro,,1178342762166521856,https://twitter.com/AOC/status/1178342762166521856
2019-09-28 21:58:57,AOC,,836,3424,29421,"For months & years, these women endured criticism & death threats for telling the truth. Yet they still tried to stop blatant corruption as it got worse: diplomats staying at Trump properties, kids dying in for-profit prisons who gave $to his inaugural cmte, obstr of justice.",,,,1178066592703406080,https://twitter.com/AOC/status/1178066592703406080
2019-09-28 21:13:34,AOC,,4108,15490,99572,"Today I’m showing some love to @RepMaxineWaters + @RashidaTlaib, who endured the brunt of gaslighting &amp; vitriol for being among the first to recognize WH corruption &amp; publicly advocate for impeachment, making it easier for the rest of us. People think that’s easy. It’s not.",,@RepMaxineWaters @RashidaTlaib,,1178055172465086470,https://twitter.com/AOC/status/1178055172465086470
2019-09-28 16:37:45,AOC,NaureenAkhter,17,5,172," ",,,,1177985759434985473,https://twitter.com/AOC/status/1177985759434985473
2019-09-28 16:12:22,AOC,NelStamp,1103,2279,29861,"To be honest, it should really be @AyannaPressley plus 3 since she is *easily* the best singer out of all of us. I’m just the one holding the wind fan ",,@AyannaPressley,,1177979369937100801,https://twitter.com/AOC/status/1177979369937100801
2019-09-28 04:38:18,AOC,nytimes,3633,15634,76478,"This is beyond partisanship. It is a heartbreaking betrayal of our nation. The President and everyone involved in this should resign immediately.",,,,1177804702345383938,https://twitter.com/AOC/status/1177804702345383938
2019-09-28 03:54:50,AOC,glennkirschner2,3492,21063,119141,"“If it’s a secret, I’ll vote for it.” For a party that brands itself on being so tough, they sure run around DC like a bunch of cowards.",,,,1177793763114209283,https://twitter.com/AOC/status/1177793763114209283
2019-09-28 03:36:01,AOC,nowthisnews,918,6675,27263,"Not only must Native voices not be ignored, they should be *centered* in a climate agenda. Indigenous wisdom, principles, & organizing have been proven right on climate over and over. Listen (& learn! @RepDebHaaland + @sharicedavids are the US’ first Native Congresswomen)",,@RepDebHaaland @sharicedavids,,1177789029259059205,https://twitter.com/AOC/status/1177789029259059205
2019-09-27 21:31:31,AOC,BrianKarem,4736,12121,80448,"No matter your politics, the idea of *anyone* (let alone a man!) intimidating Speaker Pelosi is laughable. Congress was >80% male when she became speaker. Kellyanne Conway is running out of excuses. Perhaps that’s why she’s been running away from our Oversight subpoenas. ",,,,1177697298819751936,https://twitter.com/AOC/status/1177697298819751936
2019-09-27 18:58:44,AOC,brianmrosenthal,1670,4715,25830,"NYC taxi drivers were trapped in a predatory lending scheme for taxi medallions. Drivers, many of them immigrants, were piled on w/ million-dollar loans on incomes of $~20k/year. It’s led to a suicide crisis. They need to be bailed out & those responsible need to answer for it.",,,,1177658850478039041,https://twitter.com/AOC/status/1177658850478039041
2019-09-27 16:36:11,AOC,,9803,54887,232253,"I love how McConnell is saying “since you’re impeaching, NOW we’re not going to pass bills.” What does he mean, now? Mitch McConnell hasn’t done a damn thing all year. He literally brags that his office is a graveyard. We passed gun safety in Feb & he STILL hasn’t held a vote.",,,,1177622976201666560,https://twitter.com/AOC/status/1177622976201666560
2019-09-26 22:27:07,AOC,realDonaldTrump,5227,24841,201389,"Then why did you confess to it?",,,,1177348904163192835,https://twitter.com/AOC/status/1177348904163192835
2019-09-26 22:10:13,AOC,ryanstruyk,3778,17901,79970,"There is almost no excuse for a member of Congress to have not read the whistleblower report by now. It’s a few pages. This is literally our jobs. If you don’t have the commitment to be here and do the work, cut your fancy fundraisers & make the time, or quit. cc: @SenateGOP",,@SenateGOP,,1177344652409745408,https://twitter.com/AOC/status/1177344652409745408
2019-09-26 18:48:36,AOC,JuliaCarmel__,443,2103,10816,"NY’s party registration date has been moved from October to Valentine’s Day! This gives NYers MONTHS more time to register to vote in primary elections There’s more to do, like same-day reg &amp; open primaries. Congrats to all the activists + organizers for this major win ",,,,1177293912488235008,https://twitter.com/AOC/status/1177293912488235008
2019-09-26 17:01:11,AOC,AOC,1665,6668,42483,"Yo, @NRA - you seemed to have had a lot of time yesterday waiting outside my office and making videos about me. Yet you‘re suddenly so quiet &amp; pressed about answering my question. Are you scared or just punking out? Release the raw video.",,@NRA,,1177266880261832704,https://twitter.com/AOC/status/1177266880261832704
2019-09-26 15:48:40,AOC,,3884,9942,35822,"The full whistleblower complaint has been declassified for the public. Read it yourself - it’s extremely disturbing. It discusses the President using the power of the US gov to extort foreign govs into 2020 political probes, & WH attempts to cover it up. https://www.nytimes.com/interactive/2019/09/26/us/politics/whistle-blower-complaint.html",,,,1177248630002135041,https://twitter.com/AOC/status/1177248630002135041
2019-09-26 12:53:48,AOC,shannonrwatts,1762,7075,50056,"Hey @NRA, why don’t you release my full, unedited interview? You know, the one where my first answer to your question was “Aren’t y’all broke?” I think the public would like to see it in full. Releasing it is the right move - unless of course you think it’ll make you look bad.",,@NRA,,1177204625885339651,https://twitter.com/AOC/status/1177204625885339651
2019-09-26 12:43:54,AOC,shannonrwatts,227,594,10389,"I wish they’d release the tape of the full interview. My first response to them was “Aren’t y’all broke?” ",,,,1177202134095421440,https://twitter.com/AOC/status/1177202134095421440
2019-09-26 02:05:52,AOC,oldmanebro,22,7,158,"Thank you!!",,,,1177041567208615936,https://twitter.com/AOC/status/1177041567208615936
2019-09-25 20:11:01,AOC,SeanMcElwee,1360,2352,21330,"A progressive agenda is a winning agenda. ",,,,1176952266156335105,https://twitter.com/AOC/status/1176952266156335105
2019-09-25 16:50:54,AOC,AFROSOCDSA,15,5,67,"Thank you! ",,,,1176901904221265920,https://twitter.com/AOC/status/1176901904221265920
2019-09-25 16:49:53,AOC,nowthisnews,1416,5458,24799,"“It is not responsible to complain about anything we dislike as ‘socialism,’ particularly when many of my colleagues across the aisle are more than happy to support billions of dollars in government subsidies + carveouts for oil, gas, & fossil fuel industries.” Bye, @HouseGOP ",,@HouseGOP,,1176901649127890947,https://twitter.com/AOC/status/1176901649127890947
2019-09-25 15:19:16,AOC,,2433,5308,36952,"Also - what they are calling a “transcript” isn’t even a transcript. It’s a collection of notes. This is what they are *admitting* to and it’s way above and beyond what is necessary for impeachment. The President engaged in an outright betrayal of our country.",,,,1176878843673620480,https://twitter.com/AOC/status/1176878843673620480
2019-09-25 15:12:55,AOC,NPR,7886,16202,84972,"""I would like you to do us a favor...” Folks, I am surprised the White House even released this transcript. It’s worse than we thought. The President sought to use the powers of the United States government to investigate a political opponent. We have no choice but to impeach.",,,,1176877244641402881,https://twitter.com/AOC/status/1176877244641402881
2019-09-25 13:30:04,AOC,nytimes,1274,13511,48334,"Did you know our Fed poverty line is based on 1955 spending, & the way we calculate it hasn’t changed since 1964? It assumes 1 earner & a mother home full-time. It doesn’t include cost of childcare, geographic cost of living, or healthcare. Some predict it should be *$38k/yr.*",,,,1176851364581969928,https://twitter.com/AOC/status/1176851364581969928
2019-09-25 12:42:50,AOC,nowthisnews,3032,13560,64697,"Big day! We’re rolling out our next major project: A Just Society. It’s a 6-piece suite: 1. Recognizing Poverty Act 2. Place to Prosper Act 3. Mercy in Re-Entry Act 4. Embrace Act 5. Uplift Our Workers Act 6. Ratify the UN Covenant on Economic, Social, & Cultural Rights ",,,,1176839475474915329,https://twitter.com/AOC/status/1176839475474915329
2019-09-25 01:32:20,AOC,RepPressley,976,3065,16206,"Eight. Dollars.",,,,1176670740973838336,https://twitter.com/AOC/status/1176670740973838336
2019-09-25 01:21:15,AOC,,2008,5508,50438,"Policy drop tomorrow Because while we must hold this administration accountable in the short term, We also need to propose solutions that help heal profound systems of economic injustice for the long term.",,,,1176667950515916801,https://twitter.com/AOC/status/1176667950515916801
2019-09-24 19:15:05,AOC,nowthisnews,3351,12948,53974,"When it comes to climate change, we are going to pay no matter what. The question is: will we pay (more) to react and contribute to destruction, or will we pay to proactively defend and preserve future generations? Look around & read the science. That is the question before us.",,,,1176575799710736384,https://twitter.com/AOC/status/1176575799710736384
2019-09-24 17:54:31,AOC,_waleedshahid,606,3814,16237,"This is a huge deal: one of the first major political party adoptions of a #GreenNewDeal as an official policy plank. Our future relies on whether our leaders choose to act now. Thank you @UKLabour and all people in the movement for leading the world with ACTION. ",,@UKLabour,#GreenNewDeal,1176555526446039042,https://twitter.com/AOC/status/1176555526446039042
2019-09-24 16:25:40,AOC,AOC,1987,7377,37112,"Remember: the work to save our democracy is deeper than the Q of Trump. We must fix the deeply rooted, broken systems that enabled this crisis in our democracy in the 1st place. In addition to impeachment, we must also pursue long-term changes to keep this from happening again.",,,,1176533166686908418,https://twitter.com/AOC/status/1176533166686908418
2019-09-24 15:37:39,AOC,BillKristol,1731,4205,24393,"Yes, this is an emergency. We don’t have the luxury of time w/ another committee. Judiciary has been investigating& putting the pieces together for months. Impeachment belongs there. We must honor jurisdiction, historical precedent,& work done + allow Judiciary to move forward.",,,,1176521080779026433,https://twitter.com/AOC/status/1176521080779026433
2019-09-23 19:47:15,AOC,,139,242,2787,"Big thanks to Rep. @JoeNeguse and the local Unitarian ministry who introduced me to Ingrid and her family, and have been fighting hard for her freedom. #FamiliesBelongTogether",,@JoeNeguse,#FamiliesBelongTogether,1176221510450798594,https://twitter.com/AOC/status/1176221510450798594
2019-09-23 19:40:10,AOC,ConorMichael28,1158,2102,12245,"Last week, Ingrid Latorre gave birth inside a Colorado church where the local faith community is protecting her. We met in the church rec room where she went into labor. If we had a functioning immigration system w/ real paths to citizenship, we wouldn’t have to live like this.",,,,1176219727963807744,https://twitter.com/AOC/status/1176219727963807744
2019-09-23 19:11:10,AOC,,104,67,919," : produced by our very own @shelbyworks!",,@shelbyworks,,1176212427932930050,https://twitter.com/AOC/status/1176212427932930050
2019-09-23 19:06:25,AOC,,1169,1863,9631,"Anything less than a solution on the scale of the crisis is a form of climate denial. It’s time for #GenerationGND. ",,,#GenerationGND,1176211231708983296,https://twitter.com/AOC/status/1176211231708983296
2019-09-23 18:13:28,AOC,FOX5Atlanta,5317,26522,108592,"White supremacy is a fundamentally violent ideology that’s been growing at an alarming rate, fueling one mass shooting after another. It’s about time we recognized white nationalism for the major terrorist threat that it is.",,,,1176197906778525696,https://twitter.com/AOC/status/1176197906778525696
2019-09-23 16:41:39,AOC,business,1759,13020,44233,"When the public democratically decides to invest in ourselves, in working people, they call it socialism. When a billionaire-captured government forces the public to pay for their misdeeds at the expense of working people, they just call it the cost of capitalism.",,,,1176174800785592320,https://twitter.com/AOC/status/1176174800785592320
2019-09-22 16:55:55,AOC,JoeNeguse,2450,4720,26670,"“In many ways, the climate crisis is a product, it’s an externality, of our unsustainable way of life, & you don’t fix that with a solar panel, You fix it by changing the way we think & operate as a society. We‘ve done it before, & can do it again.” Thanks for having me, Joe!",,,,1175816002044608524,https://twitter.com/AOC/status/1175816002044608524
2019-09-22 04:15:10,AOC,JamesFallows,2804,6745,30868,"It is one thing for a sitting president to break the law. It’s another to let him. The integrity of our democracy isn’t threatened when a president breaks the law. It‘s threatened when we do nothing about it. The GOP’s silence & refusal to act shouldn’t be a surprise. Ours is.",,,,1175624555974602753,https://twitter.com/AOC/status/1175624555974602753
2019-09-22 03:54:22,AOC,,17337,42377,223768,"At this point, the bigger national scandal isn’t the president’s lawbreaking behavior - it is the Democratic Party’s refusal to impeach him for it.",,,,1175619319432196096,https://twitter.com/AOC/status/1175619319432196096
2019-09-21 23:15:29,AOC,,554,3522,16215,"We are being invited into people’s homes. One woman just showed me her recent blood test, which is sky-high in benzene levels. I’m told many others are the same. Oil and gas co’s are going in hard to lobby+dominate local govs. But the community is organizing to fight back.",,,,1175549135493246977,https://twitter.com/AOC/status/1175549135493246977
2019-09-21 23:05:16,AOC,,3008,12883,38511,"I’m in Colorado w/ @JoeNeguse visiting communities whose air is being poisoned by fracking. What we’re seeing is appalling. Companies are building fracking sites on public lands, across the street from schools + homes. Their toxic emissions are invisible. This camera sees them.",,@JoeNeguse,,1175546566133919744,https://twitter.com/AOC/status/1175546566133919744
2019-09-21 19:06:53,AOC,ericmbudd,534,1065,8924,"Boulder brought the house down this morning! Big thanks to all the Coloradoans who joined @JoeNeguse and I for a powerful #GreenNewDeal conversation ",,@JoeNeguse,#GreenNewDeal,1175486575896956928,https://twitter.com/AOC/status/1175486575896956928
2019-09-21 13:42:48,AOC,mcwm,91,50,2241,"Yes, which is another item being tested for larger rollout soon ",,,,1175405017978888193,https://twitter.com/AOC/status/1175405017978888193
2019-09-21 13:41:57,AOC,,893,2192,27614,"I am currently in Colorado to visit families impacted by fracking sites and to cohost a #GreenNewDeal town hall with Rep. @JoeNeguse. This is our first trip testing innovative approaches to childcare policies. We’re hoping to learn from it &amp; refine for future trips/ideas ",,@JoeNeguse,#GreenNewDeal,1175404802811027456,https://twitter.com/AOC/status/1175404802811027456
2019-09-20 17:56:28,AOC,billclarkphotos,1242,4734,49302,"Immensely proud of the movement today #ClimateStrike",,,#ClimateStrike,1175106463905325057,https://twitter.com/AOC/status/1175106463905325057
2019-09-20 14:41:27,AOC,,377,110,1383,"(Certain localities and municipalities did pursue abolition earlier, but none were federally recognized.)",,,,1175057387918692352,https://twitter.com/AOC/status/1175057387918692352
2019-09-20 14:39:48,AOC,,584,315,2426,"The right is pushing back on this. To clarify in 280 chars, DC was the first area where enslaved people were freed by the US government. It was enacted by the Compensated Emancipation Act of 1862.",,,,1175056974481936384,https://twitter.com/AOC/status/1175056974481936384
2019-09-20 14:13:53,AOC,JamilSmith,983,3031,20188,"I cannot tell you how powerful young people mobilizing their parents & grandparents are in changing the game on issues & elections. We did this last yr & continue to now. It’s twofold organizing: it expands the electorate and flips voters. It takes multiple convos. Start now!",,,,1175050451881988097,https://twitter.com/AOC/status/1175050451881988097
2019-09-20 13:35:18,AOC,blkahn,2812,24183,165068,"Incredible.",,,,1175040739761414144,https://twitter.com/AOC/status/1175040739761414144
2019-09-19 21:36:56,AOC,soledadobrien,28,26,655,"Happy birthday! ",,,,1174799558695686145,https://twitter.com/AOC/status/1174799558695686145
2019-09-19 18:47:05,AOC,FenitN,5053,7440,39731,"DC was the 1st territory in the United States to free the enslaved. It’s where Black Americans fled the tyranny of slavery & towards greater freedom, to DC. Yet today it’s where 2nd class citizenship reigns, and the right to vote is denied. It’s time to recognize DC statehood.",,,,1174756817425096705,https://twitter.com/AOC/status/1174756817425096705
2019-09-18 23:36:37,AOC,,569,1051,9254,"Y aquí tratando en Español y Spanglish (fue un poquito difícil ¡perdón!)",,,,1174467293151211525,https://twitter.com/AOC/status/1174467293151211525
2019-09-18 23:36:02,AOC,,2831,5931,31640,"Today was Puerto Rico Advocacy Day in DC Here’s what we’re fighting for: 1. Full audit of Puerto Rico’s debt 2. Cancellation of PR’s debt 3. End La Junta and establish oversight accountable to the people 4. A #GreenNewDeal to rebuild PR",,,#GreenNewDeal,1174467146572869633,https://twitter.com/AOC/status/1174467146572869633
2019-09-18 20:20:33,AOC,CynthiaNixon,325,469,4158,"There will always be powerful interest in promoting the idea that the left is losing power 1 way or another. The big way they try to dismantle the left isn’t to attack it, but to gaslight & deflate it. Dripping condescension that I’m being “educated” should be a big red flag ",,,,1174417949257555971,https://twitter.com/AOC/status/1174417949257555971
