date,username,to,replies,retweets,favorites,text,geo,mentions,hashtags,id,permalink
2019-09-21 17:25:05,AsmMarcLevine,,0,0,1,"Join me and hundreds of other North Bay residents as we come together to #CleanOurCoasts! How do you plan to help on #CACoastalCleanupDay2019? Share your story, and do your part to keep our coasts clean! #CCD2019 #TrashTagChallenge http://coastalcleanupday.org",,,#CleanOurCoasts #CACoastalCleanupDay2019 #CCD2019 #TrashTagChallenge,1175460956304007168,https://twitter.com/AsmMarcLevine/status/1175460956304007168
2019-09-21 00:02:56,AsmMarcLevine,,0,2,3,"Calliope, a Marin student and climate activist, helped organize today's #ClimateStrike in San Rafael. All over the country and around the world, we demand #ClimateActionNow #FridaysForFuture",,,#ClimateStrike #ClimateActionNow #FridaysForFuture,1175198690664992773,https://twitter.com/AsmMarcLevine/status/1175198690664992773
2019-09-20 17:20:40,AsmMarcLevine,,0,1,2,"Since 1989, 7.5 million cigarette butts have been collected during the annual California Coastal Cleanup Day. Let's keep these butts off the beach for good. Tell @GavinNewsom to ban smoking at state parks &amp; beaches by signing #AB1718 &amp; #SB8 into law.",,@GavinNewsom,#AB1718 #SB8,1175097456822030336,https://twitter.com/AsmMarcLevine/status/1175097456822030336
2019-09-18 21:01:55,AsmMarcLevine,,0,1,4,"Thank you @senfeinstein for supporting my #ab18 &amp; your career of work to end #gunviolence in our nation. I’m committed to move this important legislation forward in 2020.",,@SenFeinstein,#ab18 #gunviolence,1174428361080430594,https://twitter.com/AsmMarcLevine/status/1174428361080430594
2019-09-18 20:15:56,AsmMarcLevine,,0,1,3,"As a father, this #backtoschool PSA by @sandyhook is difficult to watch. As a legislator, it solidifies my resolve to end #gunviolence in our state &amp; across our nation.",,@sandyhook,#backtoschool #gunviolence,1174416789691936769,https://twitter.com/AsmMarcLevine/status/1174416789691936769
2019-09-16 17:25:06,AsmMarcLevine,,0,0,3,"Today we honor all Californians of Mexican descent that have continue to make significant contributions to our state. #MexicanIndependenceDay",,,#MexicanIndependenceDay,1173649018771189769,https://twitter.com/AsmMarcLevine/status/1173649018771189769
2019-09-12 23:46:10,AsmMarcLevine,,0,1,1,"Smoking is a danger to the health of California’s people, land and water. Just as California banned indoor smoking decades ago, it is time that visitors enjoying our state beaches and state parks be protected from the harm caused by smoking. Read more: https://a10.asmdc.org/press-releases/20190912-levine-measure-ban-smoking-and-vaping-state-parks-and-beaches-approved-state",,,,1172295365795569667,https://twitter.com/AsmMarcLevine/status/1172295365795569667
2019-09-12 21:08:07,AsmMarcLevine,,0,2,3,"Do you have a plan to keep your family safe during the next natural disaster? My #AB747 is headed to @CAgovernor &amp; will require local governments to include evacuation routes &amp; capacity in their general plan to help cities &amp; counties better prepare for future natural disasters.",,@CAgovernor,#AB747,1172255593681342464,https://twitter.com/AsmMarcLevine/status/1172255593681342464
2019-09-11 21:46:47,AsmMarcLevine,,2,1,4,"While I rose to support #AB5, today's vote is the beginning, not the end of the discussion about the dynamics &amp; responsibilities between employers and employees - including the use of subcontracted workers. This is something I will continue to work on in 2020. #CAleg",,,#AB5 #CAleg,1171902934055051264,https://twitter.com/AsmMarcLevine/status/1171902934055051264
2019-09-11 21:10:44,AsmMarcLevine,,0,2,1,"The @marinij hits the target. My #AB747 will require cities &amp; counties to include evacuation routes in their general plans to help first responders save lives. The bill was approved by the CA Legislature today &amp; is headed to @CAgovernor @GavinNewsom.",,@marinij @CAgovernor @GavinNewsom,#AB747,1171893865093181440,https://twitter.com/AsmMarcLevine/status/1171893865093181440
2019-09-11 20:30:23,AsmMarcLevine,,0,2,4,"As we work towards a carbon free future, we must do more to encourage electric vehicle charging stations in every community. Here is my floor speech on #AB684, which will help to site new EV charging stations in multifamily housing developments. The bill was approved 78-0!",,,#AB684,1171883711073271810,https://twitter.com/AsmMarcLevine/status/1171883711073271810
2019-09-11 17:06:11,AsmMarcLevine,,0,1,5,"Thank you @NovatoFireDist for leading today's memorial service to those lost on September 11, 2001. We honor their memory.",,@NovatoFireDist,,1171832320388673536,https://twitter.com/AsmMarcLevine/status/1171832320388673536
2019-09-10 23:40:04,AsmMarcLevine,,1,1,3,"It’s been a busy week at the State Capitol. I just stepped out of the Assembly Chambers to update you on a few legislative victories over the past few days. #ab1130 #ab1699 #ab1440 #caleg",,,#ab1130 #ab1699 #ab1440 #caleg,1171569055641325570,https://twitter.com/AsmMarcLevine/status/1171569055641325570
2019-09-10 22:53:27,AsmMarcLevine,,0,0,2,"ICYMI, here is the floor speech for my #AB1699, prohibiting mobile data service providers from limiting internet traffic to first responders during an emergency. The bill is now on its way to the governor's desk.",,,#AB1699,1171557323656978433,https://twitter.com/AsmMarcLevine/status/1171557323656978433
2019-09-10 21:56:41,AsmMarcLevine,,0,1,2,"When seconds can mean the difference between life and death, #firstresponders must have unfettered access to the telecommunication services they need to protect the lives and property of Californians. #AB1699 Read more: https://a10.asmdc.org/press-releases/20190910-levine-measure-prevent-data-throttling-first-responders-approved-state",,,#firstresponders #AB1699,1171543037798797312,https://twitter.com/AsmMarcLevine/status/1171543037798797312
2019-09-10 20:29:52,AsmMarcLevine,,0,1,1,"California must prioritize protection of the environment & public health over big oil profits. T/y @marinij for highlighting my #AB1440, which is now on @CAgovernor @GavinNewsom 's desk. Please contact him &amp; ask him to sign this important bill into law!",,@marinij @CAgovernor @GavinNewsom,#AB1440,1171521192542359552,https://twitter.com/AsmMarcLevine/status/1171521192542359552
2019-09-10 19:33:53,AsmMarcLevine,,0,1,1,"A quick update as we enter the final days of the 2019 legislative year. Thank you to all the North Bay residents that have called, emailed & posted about legislation you care about. Keep it up! #caleg #endofsession",,,#caleg #endofsession,1171507102726049792,https://twitter.com/AsmMarcLevine/status/1171507102726049792
2019-09-10 03:34:35,AsmMarcLevine,,0,0,4,"Tonight, the State Senate approved my #AB1699 to prevent data throttling of #firstresponders during a state of emergency. T/y to @SenHannahBeth for managing the bill on the floor &amp; #SenAndreasBorgeas for your bi-partisan support!",,@SenHannahBeth,#AB1699 #firstresponders #SenAndreasBorgeas,1171265685688856576,https://twitter.com/AsmMarcLevine/status/1171265685688856576
2019-09-10 03:08:46,AsmMarcLevine,,0,0,7,"With the long days & hard work that comes with the Legislature's #endofsession, it was very kind of @BauerKahan &amp; my colleagues to take a moment to offer a mazel tov &amp; recognize my son's #BarMitzvah this past weekend. This proud dad thanks you!",,@BauerKahan,#endofsession #BarMitzvah,1171259191476068352,https://twitter.com/AsmMarcLevine/status/1171259191476068352
2019-09-09 23:46:55,AsmMarcLevine,,1,0,1,"As the market evolves, it is important to support entry-level & social equity cultivators looking to enter the legal #cannabis marketplace. My #AB858 will help cottage growers in the North Bay &amp; across California compete in our state's other green economy.",,,#cannabis #AB858,1171208391118770176,https://twitter.com/AsmMarcLevine/status/1171208391118770176
2019-09-09 23:24:06,AsmMarcLevine,,0,0,1,"California is in need of over $800 billion of infrastructure investments in the next decade alone. My #AB1212 was approved by the #caleg today &amp; will help encourage investment by our state's pension funds #CalPERS &amp; #CalSTRS to meet California's future infrastructure needs.",,,#AB1212 #caleg #CalPERS #CalSTRS,1171202650827821057,https://twitter.com/AsmMarcLevine/status/1171202650827821057
2019-09-09 17:20:00,AsmMarcLevine,,1,0,3,"We must all do more to keep trash out of our streams, rivers, waterways & coastlines. This grant to @maringov is an important step towards helping communities throughout Marin County accomplish this goal.",,@maringov,,1171111022855413760,https://twitter.com/AsmMarcLevine/status/1171111022855413760
2019-09-08 16:56:57,AsmMarcLevine,,0,0,4,"Gates are open for @CountyofSonoma Ready Day! Lots of emergency kits to giveaway, resources to better prepare you for any emergency, and great lineup of speakers throughout the day.",,@CountyofSonoma,,1170742835013804032,https://twitter.com/AsmMarcLevine/status/1170742835013804032
2019-09-05 22:37:07,AsmMarcLevine,,1,0,6,"Businesses must do more to protect personal data & I am proud to stand with @AGBecerra in demanding greater disclosure when a data breach has occurred. #AB1130 affirms our commitment to demand the strongest consumer protections in the nation. Read more: https://a10.asmdc.org/press-releases/20190905-levine-measure-protect-californians-personal-data%C2%A0approved-state-legislature",,@AGBecerra,#AB1130,1169741274041212928,https://twitter.com/AsmMarcLevine/status/1169741274041212928
2019-09-04 22:10:53,AsmMarcLevine,,0,0,5,"Maria Isabel Bueso has been a friend of mine for several years, battling a rare genetic disorder. Thanks to the actions of legislators, the governor & others I’m relieved that Maria will be able to stay in the US & receive the life saving help she needs. http://ow.ly/wgq230ptFQe",,,,1169372286622797832,https://twitter.com/AsmMarcLevine/status/1169372286622797832
2019-09-04 03:46:57,AsmMarcLevine,,1,0,3,"I've worked since I was elected to protect California from unscrupulous oil companies. Today, the Legislature sent my bill to prioritize the environment and public health over oil industry profits to @GavinNewsom. We can do this!",,@GavinNewsom,,1169094472510005249,https://twitter.com/AsmMarcLevine/status/1169094472510005249
2019-09-03 23:13:01,AsmMarcLevine,,0,0,0,"An important start, but not the end of actions needed to #endgunviolence in our nation. #AB18",,,#endgunviolence #AB18,1169025535080640512,https://twitter.com/AsmMarcLevine/status/1169025535080640512
2019-09-02 20:41:18,AsmMarcLevine,,2,0,5,"Thank you to all the hardworking women and men in the North Bay who keep the region moving. #LaborDay2019",,,#LaborDay2019,1168624965551157248,https://twitter.com/AsmMarcLevine/status/1168624965551157248
2019-09-02 16:25:04,AsmMarcLevine,,1,0,1,"This #LaborDay, as we celebrate with parades, barbeques, picnics and pools, let’s also remember those who fought to make our work places safe for employees across #California. #LaborDay2019",,,#LaborDay #California #LaborDay2019,1168560483823214594,https://twitter.com/AsmMarcLevine/status/1168560483823214594
2019-09-01 19:25:04,AsmMarcLevine,,0,0,3,"Celebrate #CaliforniaWineMonth with your favorite vintage, and give a shout out to your favorite North Bay growers, vintners, wineries, workers and wine lovers! #wine #winemakers #CAWM19",,,#CaliforniaWineMonth #wine #winemakers #CAWM19,1168243391269879808,https://twitter.com/AsmMarcLevine/status/1168243391269879808
2019-08-31 23:50:44,AsmMarcLevine,latimes,0,0,0,"Demand action to end #gunviolence in our nation. #ab18",,,#gunviolence #ab18,1167947862140846081,https://twitter.com/AsmMarcLevine/status/1167947862140846081
2019-08-30 21:59:47,AsmMarcLevine,,4,1,6,"Pleased to announce that #AB684 #AB1130 #AB1166 &amp; #AB1718 passed the Senate Appropriations Committee today &amp; are headed to the Senate Floor. Lots of work ahead of us as we head towards the end of session. Comment &amp; let me know your thoughts on bills the #caleg will be voting on.",,,#AB684 #AB1130 #AB1166 #AB1718 #caleg,1167557552776863744,https://twitter.com/AsmMarcLevine/status/1167557552776863744
2019-08-30 18:29:45,AsmMarcLevine,,2,3,8,"Excited to announce that my #AB902 to increase campaign finance transparency was unanimously approved by the California Legislature today and is now on its way to the Governor's desk. Open, fair &amp; transparent elections are central to a strong democracy. #caleg",,,#AB902 #caleg,1167504698565435394,https://twitter.com/AsmMarcLevine/status/1167504698565435394
2019-08-29 17:13:11,AsmMarcLevine,,0,0,0,"I am proud to have helped secure over $3.5 million to support the Sonoma Development Center's next chapter in serving the North Bay. Members of the public interested in serving on the planning advisory team can apply here: http://sonomacounty.ca.gov/permit/sdc",,,,1167123041773588480,https://twitter.com/AsmMarcLevine/status/1167123041773588480
2019-08-28 23:17:23,AsmMarcLevine,,0,0,0,"As @CHP_HQ turns 90 years young, we celebrate all the brave women and men who serve and have served in the North Bay and our state. We especially honor our fallen heroes who sacrificed their lives for #SafetyServiceSecurity for California",,@CHP_HQ,#SafetyServiceSecurity,1166852305586515968,https://twitter.com/AsmMarcLevine/status/1166852305586515968
2019-08-28 17:57:04,AsmMarcLevine,,0,2,1,"Many North Bay communities need better evacuation plans in the event of a disaster. My #AB747 will require local govt general plans to clearly identify evacuation routes &amp; their capacity necessary to save lives. Thanks @marinij for highlighting the issue.",,@marinij,#AB747,1166771694134071302,https://twitter.com/AsmMarcLevine/status/1166771694134071302
2019-08-26 23:42:49,AsmMarcLevine,,1,0,2,"It was a beautiful day to celebrate heritage and bring the community together at China Camp this weekend. So great to have this @CAStateParks so rich in history right in our backyard.",,@CAStateParks,,1166133932036771841,https://twitter.com/AsmMarcLevine/status/1166133932036771841
2019-08-26 19:15:10,AsmMarcLevine,,0,1,5,"Do you have powerful women in your life that are challenging norms and inspiring others to be their best? I do. This #WomensEqualityDay let's remember the work &amp; sacrifice of those who fought for women's empowerment &amp; equal voting rights for women in the US. #19thAmendment",,,#WomensEqualityDay #19thAmendment,1166066574593351680,https://twitter.com/AsmMarcLevine/status/1166066574593351680
2019-08-26 16:59:53,AsmMarcLevine,,1,0,0,"I'm grateful for Governor @GavinNewsom &amp; the @CAJewishCaucus leadership to make necessary changes to the proposed ethnic studies curriculum.",,@GavinNewsom @CAJewishCaucus,,1166032529033441283,https://twitter.com/AsmMarcLevine/status/1166032529033441283
2019-08-23 17:09:02,AsmMarcLevine,,0,1,1,"I understand the politics of guns and taxes. I think there was reticence to engage in that this year. That is flawed thinking. It’s an old way of thinking. We need to act now. #ab18 #endgunviolence #caleg",,,#ab18 #endgunviolence #caleg,1164947667803398145,https://twitter.com/AsmMarcLevine/status/1164947667803398145
2019-08-22 20:07:42,AsmMarcLevine,,0,0,1,"Did you know China Camp State Park was once a shrimp-fishing village in the 1880s? Learn more about its rich history this Saturday at the Annual Heritage Day Celebration! A Lion Dance will kickoff the event at 11am.",,,,1164630243958673408,https://twitter.com/AsmMarcLevine/status/1164630243958673408
2019-08-21 18:00:10,AsmMarcLevine,,0,2,11,"Middle school can be awkward, especially on the first day of school. So I spent my morning at Larkspur’s @HallMiddle talking about my own awkward years &amp; the importance of being curious, demonstrating commitment &amp; lifting up our community. Have a great school year!",,@HallMiddle,,1164235759500419074,https://twitter.com/AsmMarcLevine/status/1164235759500419074
2019-08-21 17:15:11,AsmMarcLevine,,1,1,3,"Do Vaccines prevent disease? The answer is yes. August is national immunization awareness month. Make sure your kids get the vaccines they need. #vaccines #diseases #children #health",,,#vaccines #diseases #children #health,1164224439187320838,https://twitter.com/AsmMarcLevine/status/1164224439187320838
2019-08-20 17:43:31,AsmMarcLevine,,0,0,3,"Excited to welcome North Bay constituents to the State Capitol and take them into the Assembly Chambers to see where our state’s laws are made. Thank you for visiting! #caleg",,,#caleg,1163869184234852358,https://twitter.com/AsmMarcLevine/status/1163869184234852358
2019-08-15 22:44:06,AsmMarcLevine,,1,3,10,"Here comes @smarttrain. Thanks for tagging along on our adventure. If you're looking for more things to do and places to see, check out @VisitPetalumaCA",,@smarttrain @VisitPetalumaCA,,1162132888613113856,https://twitter.com/AsmMarcLevine/status/1162132888613113856
2019-08-15 19:55:57,AsmMarcLevine,,0,0,2,"Did you know Lyman C. Bryce helped Petaluma become the chicken capital of the world by inventing the chicken incubator 1879? By 1920, 22 million dozen eggs were being shipped world-wide from the city!",,,,1162090572087091200,https://twitter.com/AsmMarcLevine/status/1162090572087091200
2019-08-15 19:41:26,AsmMarcLevine,,0,0,1,"This neoclassical style building opened in 1906 and served as the Petaluma Library until 1976. Since then it's been the home of the Petaluma Historical Library & Museum. This Carnegie library is on the National Register of Historic Places.",,,,1162086916461699072,https://twitter.com/AsmMarcLevine/status/1162086916461699072
2019-08-15 17:37:38,AsmMarcLevine,,0,3,3,"What a view! These wetlands not only provide flood protection but is a natural habitat for wildlife and native plants.",,,,1162055764522852352,https://twitter.com/AsmMarcLevine/status/1162055764522852352
2019-08-15 17:12:48,AsmMarcLevine,,1,3,7,"Team Levine district office here. Follow our #TwitterTakeover as we travel to Petaluma today. @smarttrain is here at the Civic Center station and on time!",,@smarttrain,#TwitterTakeover,1162049515307687941,https://twitter.com/AsmMarcLevine/status/1162049515307687941
2019-08-14 19:40:26,AsmMarcLevine,,0,2,5,"California’s students are best served when school curriculum respects and reflects the contributions of all people. Read more: http://ow.ly/IT3b50vxKfG Proud to be a member of the @CAJewishCaucus &amp; lead on this important issue.",,@CAJewishCaucus,,1161724280431947776,https://twitter.com/AsmMarcLevine/status/1161724280431947776
2019-08-14 15:15:08,AsmMarcLevine,,1,2,7,"Thank you San Jose Mayor Sam Liccardo @sliccardo for supporting #AB18 and your work to end gun violence in our communities.",,@sliccardo,#AB18,1161657514515206145,https://twitter.com/AsmMarcLevine/status/1161657514515206145
2019-08-14 03:33:32,AsmMarcLevine,,0,0,1,"Thank you Oakland Mayor @LibbySchaaf for supporting #AB18 and your work to end gun violence in our communities.",,@LibbySchaaf,#AB18,1161480950074601472,https://twitter.com/AsmMarcLevine/status/1161480950074601472
2019-08-13 23:15:04,AsmMarcLevine,,0,0,0,"Los Angeles Mayor @MayorOfLA @ericgarcetti joins mayors across California supporting #AB18. Thank you Mayor Garcetti for your work to end gun violence in our communities.",,@MayorOfLA @ericgarcetti,#AB18,1161415904485347330,https://twitter.com/AsmMarcLevine/status/1161415904485347330
2019-08-13 23:01:48,AsmMarcLevine,MyDesert,0,1,1,"We need to ensure that the state’s oil and gas extraction permitting agency doesn’t skirt the rules. My bill #AB1440 updates state law to help do just that. Let’s prioritize public health and the environment over corporate profits.",,,#AB1440,1161412567769575424,https://twitter.com/AsmMarcLevine/status/1161412567769575424
2019-08-13 21:36:06,AsmMarcLevine,,0,0,3,"Thank you San Francisco Mayor London Breed @LondonBreed for supporting #AB18 and your work to end gun violence in our communities.",,@LondonBreed,#AB18,1161391001417715712,https://twitter.com/AsmMarcLevine/status/1161391001417715712
2019-08-13 21:02:01,AsmMarcLevine,,0,0,0,"California’s mayors work on the front lines every day to keep our communities safe. The Legislature & the Governor should listen to their call for action to prevent gun violence. With only weeks until we adjourn for the year, the time for action is now. http://ow.ly/JnaQ50vwBEG",,,,1161382421683740672,https://twitter.com/AsmMarcLevine/status/1161382421683740672
2019-08-12 22:35:43,AsmMarcLevine,,0,0,2,"Busy first day back from the legislative recess speaking to @UnivisionNews about my #ab18 &amp; the need for the Legislature to take action this year to end #gunviolence in California.",,@UnivisionNews,#ab18 #gunviolence,1161043613398102016,https://twitter.com/AsmMarcLevine/status/1161043613398102016
2019-08-10 20:39:31,AsmMarcLevine,,4,2,4,"Strong editorial from the LA Times on my #ab18, which would levy a $25 tax on guns to pay for violence prevention programs. As they note, “Making gun owners shoulder a little more of the cost of gun violence is an interesting idea worthy of consideration.”",,,#ab18,1160289596300845056,https://twitter.com/AsmMarcLevine/status/1160289596300845056
2019-08-07 18:08:54,AsmMarcLevine,,0,1,1,"Please read this. These are the victims of the El Paso domestic terror attack. Remember them. Commit to action needed to end #gunviolence &amp; #gunterror in California and across the US.",,,#gunviolence #gunterror,1159164526706724864,https://twitter.com/AsmMarcLevine/status/1159164526706724864
2019-08-07 17:15:11,AsmMarcLevine,,0,0,1,"The Purple Heart has been awarded to more than 1.8 million heroes and sheroes. Let us recognize their bravery this #purpleheartday and everyday. #thankyou #respect #courage #veteran #veteranssupport #honor",,,#purpleheartday #thankyou #thankyou #respect #courage #veteran #veteranssupport #honor,1159151010859880448,https://twitter.com/AsmMarcLevine/status/1159151010859880448
2019-08-07 02:13:43,AsmMarcLevine,,0,0,0,"#NationalNightOut2019 is in full swing throughout the North Bay. Thank you to all our law enforcement and public safety partners and neighbors who made this evening a fun one!",,,#NationalNightOut2019,1158924148283809792,https://twitter.com/AsmMarcLevine/status/1158924148283809792
2019-08-06 20:15:08,AsmMarcLevine,,0,0,1,"This year's #NationalNightOut is Aug. 6. Safer communities are a result of law enforcement and communities working together. Find a #NNO event near you at: http://ow.ly/bbss50vhfnk",,,#NationalNightOut #NNO,1158833907950858240,https://twitter.com/AsmMarcLevine/status/1158833907950858240
2019-08-06 16:15:15,AsmMarcLevine,,1,1,2,"The Voting Rights Act was passed on August 6,1965 after civil rights activists marched from Selma to the Alabama State Capitol in Montgomery demanding the right to #vote. The Voting Rights Act will always be needed to protect the #votingrights of all Americans. #restoretheVRA",,,#vote #votingrights #restoretheVRA,1158773541699039232,https://twitter.com/AsmMarcLevine/status/1158773541699039232
2019-08-05 19:44:48,AsmMarcLevine,,4,1,0,"No more thoughts and prayers. The time for action is now. #AB18 As Gun Terror Spreads Across the United States, Levine Adds Urgency to Legislation That Will Reduce Gun Violence",,,#AB18,1158463885726375936,https://twitter.com/AsmMarcLevine/status/1158463885726375936
2019-08-04 20:15:06,AsmMarcLevine,,0,0,1,"Is an eye exam for your child on their back to school list? August is children’s eye health and safety month. Perfect timing right? Schedule your child’s eye exam today! #parents #eyehealth #school #backtoschool #children Learn more: http://ow.ly/zwPt50vhdyp",,,#parents #eyehealth #school #backtoschool #children,1158109123776602112,https://twitter.com/AsmMarcLevine/status/1158109123776602112
2019-08-04 02:13:40,AsmMarcLevine,,0,0,1,"California stands with our friends and neighbors in El Paso. How many more must lose their lives before our national leaders do something, anything, to alleviate this epidemic?",,,,1157836973756694528,https://twitter.com/AsmMarcLevine/status/1157836973756694528
2019-08-03 19:15:07,AsmMarcLevine,,1,0,0,"The North Bay is home to some of the greatest breweries in the world. Where will you celebrate #InternationalBeerDay? Raise a glass and reply with your favorite local brewery. #craftbeer #cerveza #brewery #craftbeerlover",,,#InternationalBeerDay #craftbeer #cerveza #brewery #craftbeerlover,1157731642376671232,https://twitter.com/AsmMarcLevine/status/1157731642376671232
2019-08-01 20:04:20,AsmMarcLevine,,0,0,1,"Proud to collaborate with the California Coastal Commission and the @CAFarmBureau to get #AB1644 signed into law! More:",,@CAFarmBureau,#AB1644,1157019252542582785,https://twitter.com/AsmMarcLevine/status/1157019252542582785
2019-08-01 17:46:40,AsmMarcLevine,,0,1,1,"The North Bay is home to some of the most productive & delicious agriculture in California. I am proud to announce that @CAgovernor Newsom has signed my #AB1644, which will have the CA Coastal Commission work with ag experts to address sea level rise &amp; other impacts to the coast.",,@CAgovernor,#AB1644,1156984607813832706,https://twitter.com/AsmMarcLevine/status/1156984607813832706
2019-07-31 22:02:30,AsmMarcLevine,,0,1,3,"Proud to welcome #KamsonCoffee to the North Bay. Founder and owner Lina Kamson sources sustainably grown coffee beans directly from Thailand. Check them out at 819 Francisco Blvd West, off of Andersen exit in San Rafael.",,,#KamsonCoffee,1156686600530587648,https://twitter.com/AsmMarcLevine/status/1156686600530587648
2019-07-30 21:15:41,AsmMarcLevine,,0,0,0,"How has public service impacted you? Let us know in comments!",,,,1156312430114295808,https://twitter.com/AsmMarcLevine/status/1156312430114295808
