date,username,to,replies,retweets,favorites,text,geo,mentions,hashtags,id,permalink
2019-09-13 01:05:50,Gupta4Assembly,,0,1,1,"Time to get those signatures y’all. #LeadTheFight Make sure you get folks to come this Saturday! https://www.eventbrite.com/e/campaign-kickoff-natasha-gupta-for-assembly-2020-tickets-71825854063?ref=eios",,,#LeadTheFight,1172315414509961223,https://twitter.com/Gupta4Assembly/status/1172315414509961223
2019-09-11 23:10:31,Gupta4Assembly,,0,0,1,"Ok, this was supposed to say “signup here,” but yes, please also “herd” your friends, family and community to come and join us this Saturday! ",,,,1171924006192041984,https://twitter.com/Gupta4Assembly/status/1171924006192041984
2019-09-11 23:09:25,Gupta4Assembly,,1,1,1,"We are THREE DAYS away from kicking off the Gupta 2020 campaign! You better be there. Sign up herd &amp; retweet:",,,,1171923731070910465,https://twitter.com/Gupta4Assembly/status/1171923731070910465
2019-09-11 17:04:32,Gupta4Assembly,,1,0,2,"I was in fifth grade when 9/11 happened. Every kid in my class had a parent call someone that morning to make sure they were OK. And it was the first time in my life that I had ever seen what it is like for an entire country to be hit by a common tragedy. #NeverForget",,,#NeverForget,1171831905060155393,https://twitter.com/Gupta4Assembly/status/1171831905060155393
2019-09-11 07:05:22,Gupta4Assembly,davidcicilline,0,1,1,"This is LONG OVERDUE and a necessary first step to curbing the epidemic of gun violence. Hoping to see it will expand to include membership in hate groups as a criteria to disqualify. #DisarmHate #MoralLeadership",,,#DisarmHate #MoralLeadership,1171681121471365121,https://twitter.com/Gupta4Assembly/status/1171681121471365121
2019-09-11 05:43:59,Gupta4Assembly,,0,0,1,"Participating in democracy has never been so melodious. #RegisterToVote #Democracy https://www.instagram.com/p/B2M-u3VD7jm/?igshid=900ek2bbpuzn",,,#RegisterToVote #Democracy,1171660638025859074,https://twitter.com/Gupta4Assembly/status/1171660638025859074
2019-09-10 20:23:03,Gupta4Assembly,MotherJones,0,0,2,"It’s time for Democrats to get their act together and make it clear where we stand! #LeadTheFight",,,#LeadTheFight,1171519477218807813,https://twitter.com/Gupta4Assembly/status/1171519477218807813
2019-09-10 16:03:45,Gupta4Assembly,,0,0,1,"",,,,1171454219154362368,https://twitter.com/Gupta4Assembly/status/1171454219154362368
2019-09-09 22:18:18,Gupta4Assembly,MSNBC,1,3,6,"Wow! I first became a fan of Rachel’s when she regularly came as a correspondent on Keith Olberman, and still remember watching the first episode of her eponymous show! 11 years of whip smart journalism with no BS. @maddow",,@maddow,,1171186091652571136,https://twitter.com/Gupta4Assembly/status/1171186091652571136
2019-09-08 17:00:03,Gupta4Assembly,,0,0,1,"Be there to JOIN THE FIGHT! RSVP and then retweet to your friends! ",,,,1170743614953029633,https://twitter.com/Gupta4Assembly/status/1170743614953029633
2019-09-08 16:55:10,Gupta4Assembly,,0,0,0,"The height of irony: living like the homeless to protest the one initiative that gives them a pathway to thrive—",,,,1170742386600792064,https://twitter.com/Gupta4Assembly/status/1170742386600792064
2019-09-08 02:59:16,Gupta4Assembly,chefjoseandres,0,0,0,"It’s easy to feel like we are hard pressed to find humanity and empathy in the Trump era— but often at the highest point of crisis, we see the true depths of human compassion.",,,,1170532023405989888,https://twitter.com/Gupta4Assembly/status/1170532023405989888
2019-09-07 19:52:00,Gupta4Assembly,,0,1,0,"It’s canvassing day, y’all. #LeadTheFight #GrassrootswithGupta",,,#LeadTheFight #GrassrootswithGupta,1170424497352036352,https://twitter.com/Gupta4Assembly/status/1170424497352036352
2019-09-07 05:06:00,Gupta4Assembly,MotherJones,0,1,1,"We can’t wait to “grow up” to take over as the adults we need in the room! Because with the climate crisis, it might be too late.",,,,1170201530458238976,https://twitter.com/Gupta4Assembly/status/1170201530458238976
2019-09-06 19:20:35,Gupta4Assembly,,0,0,1,"RSVP here: https://www.eventbrite.com/e/campaign-kickoff-natasha-gupta-for-assembly-2020-tickets-71825854063",,,,1170054205828001792,https://twitter.com/Gupta4Assembly/status/1170054205828001792
2019-09-06 19:19:47,Gupta4Assembly,,0,1,0,"The big day is almost here! RSVP TODAY for our Campaign Kickoff on Sep 14th from 5-7 PM in Milpitas! Join us for food, drinks, and meet Natasha. Featuring guest speaker Councilmember Rishi Kumar of Saratoga. @rishikumar1 @SCCDP @SV_DSA @AlamedaCoDem https://www.eventbrite.com/e/campaign-kickoff-natasha-gupta-for-assembly-2020-tickets-71825854063",,@rishikumar1 @SCCDP @SV_DSA @AlamedaCoDem,,1170054001926107136,https://twitter.com/Gupta4Assembly/status/1170054001926107136
2019-09-06 00:54:51,Gupta4Assembly,BernieSanders,0,0,0,"What he said. ",,,,1169775938046812160,https://twitter.com/Gupta4Assembly/status/1169775938046812160
2019-09-05 17:04:43,Gupta4Assembly,SJSpotlight,0,0,1,"What we don’t realize about solving homelessness is that it is not just about ensuring a basic necessity like shelter— it’s about rehabilitating the loss of one’s sense of self-identity and dignity. To do that, our government needs to start caring beyond the surface.",,,,1169657622322003968,https://twitter.com/Gupta4Assembly/status/1169657622322003968
2019-09-05 07:55:31,Gupta4Assembly,,0,1,0,"",,,,1169519415563411456,https://twitter.com/Gupta4Assembly/status/1169519415563411456
2019-09-04 21:22:57,Gupta4Assembly,,0,0,0,"A hot day doesn’t stop #TeamGupta from hitting the streets and chatting up constituents! #Gupta2020 #LeadTheFight",,,#TeamGupta #Gupta2020 #LeadTheFight,1169360221006811137,https://twitter.com/Gupta4Assembly/status/1169360221006811137
2019-09-04 17:16:41,Gupta4Assembly,AOC,0,0,0,"There’s also another backdrop to this whole conversation by @DanCrenshawTX — the premise that it’s perfectly acceptable in our society to “lend weapons” to each other. You know, like lending a library book? ",,@DanCrenshawTX,,1169298247166283776,https://twitter.com/Gupta4Assembly/status/1169298247166283776
2019-09-04 07:20:11,Gupta4Assembly,,0,1,1,"We are running a 100% people powered campaign, and that means volunteers are the lifeblood of our movement ! So happy that we had such an amazing turnout of support at our first all-hands meetings. #Gupta2020 #LeadTheFight",,,#Gupta2020 #LeadTheFight,1169148132103512065,https://twitter.com/Gupta4Assembly/status/1169148132103512065
2019-09-04 07:14:41,Gupta4Assembly,,0,0,0,"Listening and learning. #Gupta2020 #LeadTheFight",,,#Gupta2020 #LeadTheFight,1169146748540981248,https://twitter.com/Gupta4Assembly/status/1169146748540981248
2019-09-04 07:12:52,Gupta4Assembly,,0,0,0,"A long and warm day chatting with constituents at the San Jose Flea market, but we made time to pick up a few groceries! #Gupta2020 #LeadTheFight",,,#Gupta2020 #LeadTheFight,1169146293765201921,https://twitter.com/Gupta4Assembly/status/1169146293765201921
2019-09-04 07:05:28,Gupta4Assembly,CNN,0,0,0,"Climate deniers can keep burying their heads in the sand, pretending the science is just not convincing enough...and ignore that nature doesn’t pick a political party, a race, or a community when it strikes.",,,,1169144430365937669,https://twitter.com/Gupta4Assembly/status/1169144430365937669
