date,username,to,replies,retweets,favorites,text,geo,mentions,hashtags,id,permalink
2019-11-19 16:41:44,Gupta4Assembly,,1,1,3,"I applaud @SusanEllenberg and @SupCindyChavez for fighting for more investment in Santa Clara’s childcare facilities. Skyrocketing childcare costs are the most direct hit at our working poor.",,@SusanEllenberg @SupCindyChavez,,1196830931329245184,https://twitter.com/Gupta4Assembly/status/1196830931329245184
2019-11-19 05:36:41,Gupta4Assembly,,1,0,0,"Also, the initial blueprint for what they plan to do with Diridon Station in greatly expanding the BART connections into SJ is going to be an amazing step forward in connecting the greater Bay Area to Silicon Valley— with connections from East Bay + Stockton!",,,,1196663563575652352,https://twitter.com/Gupta4Assembly/status/1196663563575652352
2019-11-19 05:31:56,Gupta4Assembly,,1,0,0,"I pressed on the issue of affordable units. Currently they have proposed that for the 3000-5000 units which will be built, about 25% will be affordable housing.",,,,1196662367813156864,https://twitter.com/Gupta4Assembly/status/1196662367813156864
2019-11-19 05:30:28,Gupta4Assembly,,0,0,0,"One major initiative is developing a Workforce Development Center where low-income residents will be able to access job retraining and placement opportunities. They are working with @YearUpBayArea to help develop a career growth path for our city’s most vulnerable.",,@YearUpBayArea,,1196662001344212995,https://twitter.com/Gupta4Assembly/status/1196662001344212995
2019-11-19 05:28:32,Gupta4Assembly,,0,0,0,"I had a long chat with the representative from Google regarding the concerns I have heard from San Jose residents about the Google project increasing the rate of homelessness. He mentioned several initiatives they will be partnering with local non-profits to help the displaced.",,,,1196661512288387072,https://twitter.com/Gupta4Assembly/status/1196661512288387072
2019-11-19 05:25:35,Gupta4Assembly,,0,0,0,"Every effort was made to make this an engaging experience for constituents to voice their concerns and understand the details of this project’s impact.",,,,1196660772627107840,https://twitter.com/Gupta4Assembly/status/1196660772627107840
2019-11-19 05:25:34,Gupta4Assembly,,4,1,6,"An informative meeting with @SVatHome for the #GoogleSJ project! They had breakout sessions with different groups of the planning commissions which included affordable housing, parks, transit and also representatives from Google. They also had translators + food!",,@SVatHome,#GoogleSJ,1196660768399216640,https://twitter.com/Gupta4Assembly/status/1196660768399216640
2019-11-19 02:27:21,Gupta4Assembly,,0,0,0,"If you want to know about the ongoing plan, go to http://diridonsj.org ! They keep this updated with all details regarding Google’s mixed use development.",,,,1196615919448936448,https://twitter.com/Gupta4Assembly/status/1196615919448936448
2019-11-19 02:24:40,Gupta4Assembly,,0,0,4,"One tidbit from today’s Google development meeting: SJ will do a city wide anti-displacement plan for both residences and small businesses. They are using a commercial linkage fee to fund more affordable housing. @SVatHome #googledevproject",,@SVatHome,#googledevproject,1196615241250918401,https://twitter.com/Gupta4Assembly/status/1196615241250918401
2019-11-18 23:32:47,Gupta4Assembly,,0,0,0,"Here’s a radical idea: if a quick “social media screening check” of your online habits produces links to you liking extremist groups and content, you should not be able to get a gun in California. Plain and simple.",,,,1196571988203933697,https://twitter.com/Gupta4Assembly/status/1196571988203933697
2019-11-18 23:31:05,Gupta4Assembly,MFOLSJ,1,0,1,"In the Assembly, we need to stand by orgs like @MFOLSJ to not just end gun violence but the sources of it. Why does an abusive partner even POSSESS a gun? Why does the shooting of 16 year old Isiah Murrieta Golding qualify as “within department policy?”",,@MFOLSJ,,1196571559923613696,https://twitter.com/Gupta4Assembly/status/1196571559923613696
2019-11-18 18:23:57,Gupta4Assembly,,0,0,0,"Taking to the streets is only one part of activism-- these meetings are critical arenas to engage with lawmakers to make real change. I am eager to hear what our city and Google will be doing to make this development inclusive of our long-time San Joes residents. #HousingMatters",,,#HousingMatters,1196494267134271490,https://twitter.com/Gupta4Assembly/status/1196494267134271490
2019-11-18 18:23:57,Gupta4Assembly,,1,0,3,"Friends, I will be attending @SVatHome's event tonight at Diridon Station for discussing the Google Development project downtown with our city staff. I encourage all Milpitas and N. San Jose residents to attend.",,@SVatHome,,1196494265699819522,https://twitter.com/Gupta4Assembly/status/1196494265699819522
2019-11-17 22:00:10,Gupta4Assembly,Gupta4Assembly,0,0,0,"#communityseva #homelessness",,,#communityseva #homelessness,1196186291236265985,https://twitter.com/Gupta4Assembly/status/1196186291236265985
2019-11-17 21:59:17,Gupta4Assembly,,0,0,1,"“The simple loud and clear conclusion is this: homelessness is NOT a choice.” Nathan Ganeshan, Community Seva",,,,1196186069126877185,https://twitter.com/Gupta4Assembly/status/1196186069126877185
2019-11-17 21:52:25,Gupta4Assembly,,0,1,1,"Shaunn Cartwright: “You will never find a more empathetic group than our homeless. If you offer them a super sized Subway sandwich, they will walk over to another homeless person and share it. If another goes without, they will give what they have.”",,,,1196184339429515266,https://twitter.com/Gupta4Assembly/status/1196184339429515266
2019-11-17 21:43:17,Gupta4Assembly,,0,0,1,"“If you are homeless and a woman, there are so many factors that the system can exert control over you.” A gripping account of real-life challenges of our homeless at the Community Seva Panel today.",,,,1196182042637033472,https://twitter.com/Gupta4Assembly/status/1196182042637033472
2019-11-17 01:16:36,Gupta4Assembly,,0,0,2,"",,,,1195873339190865920,https://twitter.com/Gupta4Assembly/status/1195873339190865920
2019-11-15 20:19:38,Gupta4Assembly,,0,0,0,"This article completely confirms the false narrative that California is immune to the rise of hate crimes because we are a diverse state. It also confirms that injustice to any group is a threat to justice for EVERY group.",,,,1195436216734248960,https://twitter.com/Gupta4Assembly/status/1195436216734248960
2019-11-15 20:19:38,Gupta4Assembly,IndiaWest,1,0,0,"“Interestingly, California had the highest number of reported hate crimes in 2018. A total of 736 agencies participated in the collection of data, covering a population of more than 39 million, 220 agencies in California reported 1,063 bias-related incidents.”",,,,1195436214548979712,https://twitter.com/Gupta4Assembly/status/1195436214548979712
2019-11-15 04:49:11,Gupta4Assembly,,0,0,1,"Bon appetit! Thanks for joining us tonight guys! #chickentikkamasala",,,#chickentikkamasala,1195202060704051201,https://twitter.com/Gupta4Assembly/status/1195202060704051201
2019-11-15 01:36:05,Gupta4Assembly,,0,0,0,"I have a feeling this is going to be a lot tougher than it looks....but will make a valiant effort here ",,,,1195153466101878784,https://twitter.com/Gupta4Assembly/status/1195153466101878784
2019-11-15 01:35:12,Gupta4Assembly,,1,0,1,"Alright guys, I am going to hold a Cooking Q&A tonight at 7:30 PM on Facebook live! Follow us at @Gupta4Assembly on Facebook as I try to put together a homemade chicken tikka masala and answer some questions we have been getting on the trail!",,@Gupta4Assembly,,1195153241685843969,https://twitter.com/Gupta4Assembly/status/1195153241685843969
2019-11-14 16:50:34,Gupta4Assembly,,1,1,0,"There are so many days you watch this, until one day it just feels numb. I feel like I literally typed a tweet on this barely a month ago. We have a crisis on our hands that goes far beyond guns at this point-- we have a crisis of government inaction.",,,,1195021214076399618,https://twitter.com/Gupta4Assembly/status/1195021214076399618
2019-11-14 01:28:12,Gupta4Assembly,SJSU,1,0,0,"This is how we make the dialogue constructive in engaging every stakeholder in solving our crisis.",,,,1194789094749900803,https://twitter.com/Gupta4Assembly/status/1194789094749900803
2019-11-14 00:58:17,Gupta4Assembly,TheDamageReport,0,2,5,"Thank you to @TheDamageReport for having me on today!",,@TheDamageReport,,1194781563671629824,https://twitter.com/Gupta4Assembly/status/1194781563671629824
2019-11-13 18:55:58,Gupta4Assembly,Rhoda_Jordan,0,2,4,"@Rhoda_Jordan you were an excellent moderator and coordinated the whole evening with poise and grace, while keeping all of us on time! Thank you and @SouthBayYIMBY for inviting us. It was a substantive exchange of ideas on how to solve our state’s crisis.",,@Rhoda_Jordan @SouthBayYIMBY,,1194690384791654400,https://twitter.com/Gupta4Assembly/status/1194690384791654400
2019-11-13 16:11:56,Gupta4Assembly,rf_mehlinger,0,1,8,"Our city governments need a direct mandate from our state to keep the planning process clear. It’s shameful that we are punishing a small business for no fault of their own.",,,,1194649105022119939,https://twitter.com/Gupta4Assembly/status/1194649105022119939
2019-11-13 06:44:33,Gupta4Assembly,,0,0,1,"oh and single ladies, heyyy :-)",,,,1194506317643182080,https://twitter.com/Gupta4Assembly/status/1194506317643182080
2019-11-13 06:43:41,Gupta4Assembly,aceckhouse,0,1,5,"@NancySkinnerCA is a fearless champion in our debate on housing. SB 330 was a pivotal part in the state's discussion on ending moratoriums and turbocharging housing supply. I did not get to mention this-- but she has also championed key legislation on student housing as well!",,@NancySkinnerCA,,1194506098331439104,https://twitter.com/Gupta4Assembly/status/1194506098331439104
2019-11-13 06:41:14,Gupta4Assembly,aceckhouse,0,0,8,"A part of the transit debate which often goes ignored! Not only cost effective, but go a long way to serve some of our most vulnerable areas.",,,,1194505480430731264,https://twitter.com/Gupta4Assembly/status/1194505480430731264
2019-11-13 06:38:47,Gupta4Assembly,SouthBayYIMBY,1,0,1,"Yes, it was a trying task to get a home loan! They even asked for my college GPA. It was eye opening to see how difficult the process of home ownership-- from the financing to making an offer-- is for any first-time home buyer, let alone us new grads.",,,,1194504866648870912,https://twitter.com/Gupta4Assembly/status/1194504866648870912
2019-11-12 19:51:51,Gupta4Assembly,SJSpotlight,0,0,3,"And yet again! Corporations are stepping up to do their part. Let’s follow up with real government action!",,,,1194342061102624768,https://twitter.com/Gupta4Assembly/status/1194342061102624768
2019-11-12 06:45:55,Gupta4Assembly,,0,1,3,"",,,,1194144272632573952,https://twitter.com/Gupta4Assembly/status/1194144272632573952
2019-11-11 19:24:56,Gupta4Assembly,TECollab,0,2,1,"Catch me here tomorrow! I’ll be joining the other AD-25 candidates for a forum on housing.",,,,1193972898005827585,https://twitter.com/Gupta4Assembly/status/1193972898005827585
2019-11-11 19:08:11,Gupta4Assembly,,0,0,2,"Happy Veteran's Day to the brave women and men who have served our country.",,,,1193968682495434752,https://twitter.com/Gupta4Assembly/status/1193968682495434752
2019-11-10 06:16:44,Gupta4Assembly,,0,0,0,"@GinaDalma reminds us that setting an example for our nation on championing our most vulnerable should start at home. In a district of enormous wealth and innovation, we need to put our resources toward challenges that don’t just translate to profit.",,@GinaDalma,,1193412152436166657,https://twitter.com/Gupta4Assembly/status/1193412152436166657
2019-11-10 06:14:30,Gupta4Assembly,,1,0,0,"“We raise incredible amounts of money for all presidential candidates who espouse progressive values, feel really good when we do, but then turn away or don't care when our own community has become more segregated, less caring....”",,,,1193411590579605505,https://twitter.com/Gupta4Assembly/status/1193411590579605505
2019-11-08 17:39:29,Gupta4Assembly,TheAtlantic,0,1,0,"Interesting parallels in British politics with what we see on the local level here at home. “Populist extremes generally have very little to do with governing. It’s to do with radical and often extremely unrealistic fairy stories about your country and its future.”",,,,1192859196921765888,https://twitter.com/Gupta4Assembly/status/1192859196921765888
2019-11-08 00:32:41,Gupta4Assembly,,0,0,0,"",,,,1192600792647077888,https://twitter.com/Gupta4Assembly/status/1192600792647077888
2019-11-07 17:57:23,Gupta4Assembly,nowthisnews,0,0,0,"When we were teenagers, parents were telling us to get off of Facebook and focus on our homework.... now the kids are telling the parents to get off Facebook! ",,,,1192501315143757829,https://twitter.com/Gupta4Assembly/status/1192501315143757829
2019-11-07 07:49:44,Gupta4Assembly,,0,4,4,"We did it, Team Gupta! Using 100% volunteer circulators through every city in District 25, we made it to 1000 signatures! And now, it's time to finish the job. Let's get to the Assembly! Volunteer-- http://gupta2020.com #leadthefight #gupta2020",,,#leadthefight #gupta2020,1192348395282714625,https://twitter.com/Gupta4Assembly/status/1192348395282714625
2019-11-06 21:26:20,Gupta4Assembly,Scott_Wiener,0,1,2,"@Scott_Wiener is spot on here. Getting corporations to “pay their fair share” &amp; recognize the need to contribute to the community of their labor force is only tackling part of the problem. Our gov needs to follow up with concrete plans for the $.",,@Scott_Wiener,,1192191508306259968,https://twitter.com/Gupta4Assembly/status/1192191508306259968
2019-11-05 19:06:55,Gupta4Assembly,metronewspaper,0,0,0,"Significant development in tackling systemic issues to tenant’s rights and expanding affordable housing.",,,,1191794036912189440,https://twitter.com/Gupta4Assembly/status/1191794036912189440
2019-11-04 18:27:57,Gupta4Assembly,metronewspaper,0,0,0,"No matter what it is— Halloween, fraternity hazing, college party, whatever, wearing blackface is NEVER ok. Cannot believe that this is 2019.",,,,1191421844353474560,https://twitter.com/Gupta4Assembly/status/1191421844353474560
2019-11-04 02:53:25,Gupta4Assembly,,0,0,1,"Today was a great session at the AD-25 candidate forum, sponsored by the Milpitas Democratic Club! Keep checking back our Facebook for clips. So grateful to all our campaign volunteers who canvassed, showed up to the forum, and then canvassed after! #leadthefight #gupta2020",,,#leadthefight #gupta2020,1191186660047773697,https://twitter.com/Gupta4Assembly/status/1191186660047773697
2019-11-03 01:44:48,Gupta4Assembly,AforKamala,0,0,1,"I must say, #KamalaHarris has a great sense of rhythm! Perhaps this calls for a Dem presidential dance-off? :-D",,,#KamalaHarris,1190807002437439488,https://twitter.com/Gupta4Assembly/status/1190807002437439488
2019-11-03 01:31:09,Gupta4Assembly,,0,0,1,"""I don't envy what my kids will have to go through to continue to be able to own a home in California. It feels like you're one missed paycheck away from losing it all.""",,,,1190803566862069766,https://twitter.com/Gupta4Assembly/status/1190803566862069766
2019-11-03 01:31:07,Gupta4Assembly,,1,1,2,"During canvassing today, I met Betty, a homeowner in the district who has lived here for 50 years. We had a long conversation about how her children have been affected by the rising cost of home ownership in California. One thing stood out to me from our exchange:",,,,1190803561719853056,https://twitter.com/Gupta4Assembly/status/1190803561719853056
2019-11-02 22:48:08,Gupta4Assembly,,0,0,1,"Canvassing moment of the day: unsuspectedly, I knocked on the door of an old coworker! Was great catching up, and getting to sign our petition :-)",,,,1190762544421453824,https://twitter.com/Gupta4Assembly/status/1190762544421453824
2019-11-02 04:37:16,Gupta4Assembly,,0,3,5,"Getting into the Diwali spirit ! @OhloneCollege #diwali",,@OhloneCollege,#diwali,1190488018966069248,https://twitter.com/Gupta4Assembly/status/1190488018966069248
2019-11-01 23:51:10,Gupta4Assembly,,0,1,0,"Racking up those signatures at @OhloneCollege !",,@OhloneCollege,,1190416019472314369,https://twitter.com/Gupta4Assembly/status/1190416019472314369
2019-11-01 23:28:22,Gupta4Assembly,,0,1,3,"Volunteer shirts? Check. Petition sheets? check. Flyers? Check. Lunch? Um....maybe just eat a big dinner? Realities of campaigning on the go...",,,,1190410283488931840,https://twitter.com/Gupta4Assembly/status/1190410283488931840
2019-11-01 17:15:55,Gupta4Assembly,monicamallon,0,0,1,"Sen. Beall is incredibly warm and very receptive to young activists from my experience. I had a chance to speak with him at the Democratic Picnic and we had a wonderful conversation about the national political dialogue. Glad you had a good exchange!",,,,1190316552131764224,https://twitter.com/Gupta4Assembly/status/1190316552131764224
2019-10-31 21:03:36,Gupta4Assembly,,0,2,5,"Happy #halloween2019 everyone! A throwback to my first Halloween with Michael. I marvel at how Elizabeth Taylor threw on this look everyday when she played Cleopatra—those eyes easily took me an hour to get right. ",,,#halloween2019,1190011462997004288,https://twitter.com/Gupta4Assembly/status/1190011462997004288
2019-10-31 19:41:50,Gupta4Assembly,,0,0,2,"This is not a warning sign to step back and ask if this is a path you really want to go down— it is a battle cry for every young woman, as many of us as we can send, to jump in into politics and change our culture.",,,,1189990883355066368,https://twitter.com/Gupta4Assembly/status/1189990883355066368
2019-10-31 19:41:49,Gupta4Assembly,kylegriffin1,1,1,0,"@KatieHill4CA shows the hypocrisy outright in the unequal and impossible standards we set for women in power vs. men. Women of my generation see us shrugging off Bill Clinton and Donald Trump, yet sending a formidable rising star back home for a few pictures.",,@KatieHill4CA,,1189990881463394304,https://twitter.com/Gupta4Assembly/status/1189990881463394304
2019-10-31 07:24:04,Gupta4Assembly,,0,2,0,"Join me with the other AD-25 candidates THIS SUNDAY from 1-3 PM at the Milpitas Democratic Club! Sign up here: https://m.facebook.com/events/3174638149245459/",,,,1189805218730430465,https://twitter.com/Gupta4Assembly/status/1189805218730430465
2019-10-31 00:38:09,Gupta4Assembly,monicamallon,0,0,1,"Congratulations!!!",,,,1189703067488272384,https://twitter.com/Gupta4Assembly/status/1189703067488272384
2019-10-30 19:36:59,Gupta4Assembly,,0,0,1,"One possible solution I can suggest: a social media page sign up and declaration form associated with your official 501 filing as a candidate. Register with the state, have it as a regulated entity.",,,,1189627274489761792,https://twitter.com/Gupta4Assembly/status/1189627274489761792
2019-10-30 19:35:31,Gupta4Assembly,grace_hase,1,0,0,"It’s only a matter of time before cracks in our national races trickle down to local races in the social media sphere. This is why putting the entire onus on “Zuckerberg fixing it” isn’t the right approach. Lawmakers need to actually offer solutions.",,,,1189626907400101889,https://twitter.com/Gupta4Assembly/status/1189626907400101889
2019-10-30 04:27:24,Gupta4Assembly,,0,0,3,"Thank you, @BarackObama, for highlighting the larger virtues and actions of our public officials and calling out these arbitrary purity tests of party loyalty. We need to unify again.",,@BarackObama,,1189398372530061313,https://twitter.com/Gupta4Assembly/status/1189398372530061313
2019-10-29 21:53:00,Gupta4Assembly,,0,0,0,"They’re here. ;-)",,,,1189299117752770562,https://twitter.com/Gupta4Assembly/status/1189299117752770562
2019-10-29 18:17:17,Gupta4Assembly,,0,0,0,"For those who don’t know, The Kelsey advocates for inclusive housing for both those with and without disabilities. They have worked proactively to champion diverse community building in SJ and SF.",,,,1189244830959968260,https://twitter.com/Gupta4Assembly/status/1189244830959968260
2019-10-29 18:17:17,Gupta4Assembly,grace_hase,1,0,0,"Google sets an example here of how we can engage our corporations in community building. We don’t talk enough about how taking care of our disabled is not just about adequately funding services, but also integrating them with our society.",,,,1189244829299105793,https://twitter.com/Gupta4Assembly/status/1189244829299105793
2019-10-28 20:42:51,Gupta4Assembly,,0,0,2,"These are incredibly sensible measures we can take to start the cleanup of our online platforms and regulating political media. Particularly compelling are the limits on PAC + individual campaign ad spend and the proposals for fact checking.",,,,1188919074647986176,https://twitter.com/Gupta4Assembly/status/1188919074647986176
2019-10-28 20:17:15,Gupta4Assembly,JasonLeopold,0,0,0,"Knew it",,,,1188912635116314624,https://twitter.com/Gupta4Assembly/status/1188912635116314624
2019-10-28 19:56:54,Gupta4Assembly,MFOLSJ,1,0,2,"To this day I can’t find words to explain to constituents why this has become such an accepted way of life in our country and our own community. The work of @MFOLSJ is more important than ever.",,@MFOLSJ,,1188907512205959168,https://twitter.com/Gupta4Assembly/status/1188907512205959168
2019-10-28 07:58:35,Gupta4Assembly,zepy32,0,0,1,"My apologies @zepy32 for this oversight. Won’t use it for any other tweets on the matter. In the meantime, we will be keeping an eye out for anything those of us in safe areas can do to either donate to/volunteer to help the victims.",,@zepy32,,1188726743487500288,https://twitter.com/Gupta4Assembly/status/1188726743487500288
2019-10-28 07:24:26,Gupta4Assembly,,0,0,0,"Furthermore, it points to where we need to have a fair free market solution when it comes to our energy sources rather than continuously bailing out PG&E",,,,1188718146225459201,https://twitter.com/Gupta4Assembly/status/1188718146225459201
2019-10-28 07:23:26,Gupta4Assembly,scheplick,1,0,2,"Exactly! @scheplick points to the heart of how we don’t have a fair system of alternatives when it comes to energy sources and allow for a perfect storm of rendering thousands of Californians literally w/o power.",,@scheplick,,1188717895037018112,https://twitter.com/Gupta4Assembly/status/1188717895037018112
2019-10-28 07:16:58,Gupta4Assembly,,1,1,5,"It seems like smelling smoke in the air around our house and feeling a scratchy throat happens a lot more than it used to... #ClimateChangeIsReal #KincadeFire",,,#ClimateChangeIsReal #KincadeFire,1188716268272013312,https://twitter.com/Gupta4Assembly/status/1188716268272013312
2019-10-28 06:35:16,Gupta4Assembly,,0,1,1,"Lighting the dia and celebrating Diwali An amazing day with the @BAPSwaminarayan and Gurdwara Sahib Fremont!",,@BAPSwaminarayan,,1188705773448130560,https://twitter.com/Gupta4Assembly/status/1188705773448130560
2019-10-27 22:01:12,Gupta4Assembly,,1,1,5,"A very happy Diwali to all! Stopping by the Fremont Mandir for a traditional Diwali “langar” (lunch) and meeting families!",,,,1188576405568679936,https://twitter.com/Gupta4Assembly/status/1188576405568679936
2019-10-27 03:36:04,Gupta4Assembly,,1,3,6,"It's The Last Mile for #TeamGupta ! From Fremont to Santa Clara, we are pounding the pavement and earning that vote! If I look grumpy in that picture, it's because it was the last hour of canvassing for the day. :-D #LeadTheFight #Gupta2020",,,#TeamGupta #LeadTheFight #Gupta2020,1188298288660770817,https://twitter.com/Gupta4Assembly/status/1188298288660770817
2019-10-26 22:55:04,Gupta4Assembly,,0,1,0,"@ericksoto380 is clearly done with canvassing for today Great work #teamgupta !",,@ericksoto380,#teamgupta,1188227575430012928,https://twitter.com/Gupta4Assembly/status/1188227575430012928
2019-10-26 21:31:42,Gupta4Assembly,,0,0,0,"Favorite moment with a constituent I met today: “I like the diversity that I see on your team.” ",,,,1188206595718569984,https://twitter.com/Gupta4Assembly/status/1188206595718569984
2019-10-26 16:57:31,Gupta4Assembly,haezeyTran,1,0,0,"She has paid so much of a price for that incident and many ignore the larger story of activism she has championed all her life. She is a true inspiration!",,,,1188137593109499904,https://twitter.com/Gupta4Assembly/status/1188137593109499904
2019-10-26 06:03:07,Gupta4Assembly,,1,0,1,"Fashion aside, the urgency of #climatechange requires an uproar from every one of us till it is fixed, and an inter generational alliance that challenges inaction!",,,#climatechange,1187972908980695040,https://twitter.com/Gupta4Assembly/status/1187972908980695040
2019-10-26 05:59:29,Gupta4Assembly,hcjewell,2,0,2,"I have to say, Jane Fonda and her red coat really bring panache to the protest ",,,,1187971993083105280,https://twitter.com/Gupta4Assembly/status/1187971993083105280
2019-10-26 03:42:48,Gupta4Assembly,,0,1,6,"We are taking charge and taking action. Never stop fighting for what we believe in! Loved today’s State of the Youth Conference and seeing our local community leaders. #StateofYouth2019 #LeadTheFight",,,#StateofYouth2019 #LeadTheFight,1187937597487632385,https://twitter.com/Gupta4Assembly/status/1187937597487632385
2019-10-25 18:41:09,Gupta4Assembly,,0,1,1,"We are holding events in Fremont and Santa Clara this weekend— sign up now and help us #makeitto1500 ! http://facebook.com/Gupta4Assembly",,,#makeitto1500,1187801284583161857,https://twitter.com/Gupta4Assembly/status/1187801284583161857
2019-10-25 04:33:42,Gupta4Assembly,,0,0,0,"And, for the die-hard capitalists: 3. This kind of power outage is going to REALLY hurt business— whether it is small restaurants or big co’s. The cost of inaction is much too high. #ClimateChangeIsReal",,,#ClimateChangeIsReal,1187588016379838465,https://twitter.com/Gupta4Assembly/status/1187588016379838465
