date,username,to,replies,retweets,favorites,text,geo,mentions,hashtags,id,permalink
2019-10-25 04:33:41,Gupta4Assembly,passantino,1,0,0,"To all who doubt that climate change requires a special urgency that looks beyond the starting costs, see for yourself here. This blackout is going to: 1. Hurt low income homes the most 2. Involve a MASSIVE disruption to city operations & services",,,,1187588014727319553,https://twitter.com/Gupta4Assembly/status/1187588014727319553
2019-10-24 20:26:14,Gupta4Assembly,GovofCO,1,1,0,"Ahahaha good one!!!",,,,1187465343763005441,https://twitter.com/Gupta4Assembly/status/1187465343763005441
2019-10-23 02:55:17,Gupta4Assembly,neil_park_,0,0,0,"Um.....what the !",,,,1186838473619075073,https://twitter.com/Gupta4Assembly/status/1186838473619075073
2019-10-22 23:40:19,Gupta4Assembly,m_w_official,0,1,2,"My friend was literally texting me *this morning* that he knew someone staying home from school b/c of #SantaRosa today. #GunViolence is in our backyard and sooner or later, it will affect someone near to you. We cannot accept this as normal.",,,#SantaRosa #GunViolence,1186789411045773312,https://twitter.com/Gupta4Assembly/status/1186789411045773312
2019-10-22 23:28:30,Gupta4Assembly,,0,1,2,"Had a great time on @radiozindagi today w/ the fabulous Isha Dubey! Missed the interview? Catch it here: https://m.facebook.com/RadioZindagi/posts/",,@radiozindagi,,1186786435170390016,https://twitter.com/Gupta4Assembly/status/1186786435170390016
2019-10-22 00:18:04,Gupta4Assembly,,0,0,5,"Exciting news for #TeamGupta ! Catch me TOMORROW at 3:15 PM on @radiozindagi for an interview with RJ Isha Dubey! Tell your District 25 friends and pass it on. :-)",,@radiozindagi,#TeamGupta,1186436523199057920,https://twitter.com/Gupta4Assembly/status/1186436523199057920
2019-10-21 08:50:33,Gupta4Assembly,,0,1,6,"Honored to have a chance to speak at the @FUNProgressives candidate forum today with Asm. Bill Quirk, Vipan Bajwa and Alexis Villalobos! A short clip from today.",,@FUNProgressives,,1186203105358045184,https://twitter.com/Gupta4Assembly/status/1186203105358045184
2019-10-19 02:33:39,Gupta4Assembly,m_w_official,0,0,1,"Captures the complacency of our establishment well!",,,,1185383480047202304,https://twitter.com/Gupta4Assembly/status/1185383480047202304
2019-10-18 16:36:46,Gupta4Assembly,,0,0,0,"Cities should not have to take it upon themselves to solve this problem alone. We need our state government to cooperate with this effort, and ensure we don't keep giving #PG4E a pass.",,,#PG4E,1185233270385999873,https://twitter.com/Gupta4Assembly/status/1185233270385999873
2019-10-17 21:08:04,Gupta4Assembly,MarisaKendall,0,1,0,"Our tech giants should be a part of rebuilding our communities and repairing income inequality. While much is questionable about some of Facebook’s platform practices, applaud their decision to put our teachers first.",,,,1184939157480562688,https://twitter.com/Gupta4Assembly/status/1184939157480562688
2019-10-17 19:08:33,Gupta4Assembly,MaxBoot,0,0,0,"This is precisely the issue with our partisan divide now. On both sides, voters more and more feel a sense of “hold my nose and vote for ____ “ instead of an enthusiasm to embrace the nomineee. What this eventually will mean is less voter turnout and civic participation.",,,,1184909076930555905,https://twitter.com/Gupta4Assembly/status/1184909076930555905
2019-10-17 19:04:38,Gupta4Assembly,Slate,0,1,1,"People often say experience is a necessary stepping stone to serving in government. It doesn’t help that those who serve in our government are woefully inexperienced in tech to legislate this the right way.",,,,1184908094259679232,https://twitter.com/Gupta4Assembly/status/1184908094259679232
2019-10-17 11:57:24,Gupta4Assembly,emarvelous,0,0,2,"A fighter till the very end. Elijah Cummings was a shining example of having the guts to stand up. It is painful to lose him at this particular juncture we are in as a country, the blowback of which he directly received in recent months.",,,,1184800574740418560,https://twitter.com/Gupta4Assembly/status/1184800574740418560
2019-10-17 06:48:53,Gupta4Assembly,LopezforCA,0,0,1,"Love love love Luna’s!!! Wonderful that Campbell will get to enjoy some of the best Mexican food this side of the Bay.",,,,1184722933203161089,https://twitter.com/Gupta4Assembly/status/1184722933203161089
2019-10-15 22:13:20,Gupta4Assembly,,0,0,0,"We are now at the point where we are training teachers, church staff, and Walmart employees how to deal with a situation of war. We can’t have to accept this as a new normal. We just can’t. #EndGunViolence https://www.pnj.com/story/news/2019/10/15/santa-rosa-county-school-district-uses-hyper-realistic-active-shooter-training/3974800002/ via @pnj",,@pnj,#EndGunViolence,1184230806090211328,https://twitter.com/Gupta4Assembly/status/1184230806090211328
2019-10-15 14:28:28,Gupta4Assembly,,0,0,1,"An example of how we can work with the private sector to resolve our student debt crisis and tackle college affordability.",,,,1184113815778033664,https://twitter.com/Gupta4Assembly/status/1184113815778033664
2019-10-15 03:49:22,Gupta4Assembly,,0,2,4,"One of my favorite moments today from the campaign trail— sharing a laugh with the residents of the Priya Living Center in Santa Clara. One of the most central values we learn when growing up in an Asian home is how much we honor our elders everyday.",,,,1183952982779387905,https://twitter.com/Gupta4Assembly/status/1183952982779387905
2019-10-14 03:52:19,Gupta4Assembly,,0,1,4,"So proud of how hard our team worked to mobilize District 25 on our Day of Action! Crushing doors and earning the vote. ;-) #leadthefight",,,#leadthefight,1183591335799873536,https://twitter.com/Gupta4Assembly/status/1183591335799873536
2019-10-13 15:58:34,Gupta4Assembly,,0,0,2,"Our moment on the trail from canvassing yesterday ! Join us TODAY for our Day of Action in Fremont! Meet at 12 PM at the Fremont BART Station.",,,,1183411715553153025,https://twitter.com/Gupta4Assembly/status/1183411715553153025
2019-10-12 19:11:46,Gupta4Assembly,,0,1,1,"Our Day of Action is TOMORROW from 12-4 PM! Come and join us to mobilize our community! (And won a free t-shirt :-) ) #MakeItTo1500 #leadthefight",,,#MakeItTo1500 #leadthefight,1183097949850484738,https://twitter.com/Gupta4Assembly/status/1183097949850484738
2019-10-12 06:28:43,Gupta4Assembly,BuzzFeedNews,0,0,2,"It is unacceptable. How we allowed millions to be held hostage w/o basic utilities, and giving PG&E pass after pass on taking care of a basic infrastructure issue, is not just reflective of their inefficiency, but our state’s as well.",,,,1182905920646332417,https://twitter.com/Gupta4Assembly/status/1182905920646332417
2019-10-12 06:20:54,Gupta4Assembly,DaveCortese,0,0,0,"Glad that local leaders are standing up for protecting democracy right here at home. The Fair Elections Initiative goes a long way in ensuring we make voting streamlined and accessible for more of our races!",,,,1182903953157062658,https://twitter.com/Gupta4Assembly/status/1182903953157062658
2019-10-11 04:06:27,Gupta4Assembly,,0,0,0,"Check out our LIVE interview with Radio Mirchi right now on http://radiomirchi310.com !",,,,1182507729430036480,https://twitter.com/Gupta4Assembly/status/1182507729430036480
2019-10-11 01:19:54,Gupta4Assembly,,0,0,1,"Racking up those signatures! #makeitto1500 #leadthefight",,,#makeitto1500 #leadthefight,1182465818048614400,https://twitter.com/Gupta4Assembly/status/1182465818048614400
2019-10-10 16:56:40,Gupta4Assembly,GavinNewsom,0,0,0," ",,,,1182339173904044032,https://twitter.com/Gupta4Assembly/status/1182339173904044032
2019-10-10 16:32:51,Gupta4Assembly,,0,0,0,"Join us THIS SUNDAY to mobilize District 25 and stand up for change! Sign up here: https://m.facebook.com/events/392594004763455 #MakeItTo1500 #LeadTheFight",,,#MakeItTo1500 #LeadTheFight,1182333180830871552,https://twitter.com/Gupta4Assembly/status/1182333180830871552
2019-10-10 01:09:35,Gupta4Assembly,BuzzFeedNews,0,2,2,"The epidemic of gun violence has shaken our generation to take action. I have spoken a lot about how Gilroy sparked my run. Great to see Marcel channeling his activism into going into public service.",,,,1182100832235311104,https://twitter.com/Gupta4Assembly/status/1182100832235311104
2019-10-09 23:06:07,Gupta4Assembly,Gupta4Assembly,0,0,0,"@kaykas I would love to have a chance to talk about what it’s like to start a “different” kind of startup— a political campaign— and the spotlight on big tech in the current assembly race in the 25th. It’s right in the heart of SV.",,@kaykas,,1182069762718724096,https://twitter.com/Gupta4Assembly/status/1182069762718724096
2019-10-09 23:03:51,Gupta4Assembly,kaykas,1,0,0,"eye opening on how we still have ways to go on tackling the next tier of gender equality in Silicon Valley. As a woman in tech, while I see improvements to putting us on a path to mgmt, it’s quite another when trying to start a business!",,,,1182069192121389056,https://twitter.com/Gupta4Assembly/status/1182069192121389056
2019-10-09 22:37:55,Gupta4Assembly,pulcrano,0,0,1,"What he said",,,,1182062662718353408,https://twitter.com/Gupta4Assembly/status/1182062662718353408
2019-10-09 17:37:51,Gupta4Assembly,Gupta4Assembly,0,0,1,"Thank you @bayarea_beat for featuring me on your program! If you missed the interview, check out the podcast recording on the link below.",,@bayarea_beat,,1181987148364312576,https://twitter.com/Gupta4Assembly/status/1181987148364312576
2019-10-09 17:10:21,Gupta4Assembly,,0,3,1,"We are live on the Bay Area Beat! Tune in now to hear my interview on the most pressing issues in California!",,,,1181980228400209920,https://twitter.com/Gupta4Assembly/status/1181980228400209920
2019-10-09 16:54:44,Gupta4Assembly,,0,0,0,"Cutting power due to high winds potentially starting wildfires indicates California has to address *adjusting* to our climate crisis. BTW, a risk of wildfires in OCTOBER? The #pgeshutoff will start at 12 PM. https://www.pge.com/…/wildfires/psps-service-impact-map.page",,,#pgeshutoff,1181976301436993536,https://twitter.com/Gupta4Assembly/status/1181976301436993536
2019-10-09 00:13:31,Gupta4Assembly,RobBontaCA,0,0,3,"Proud of our legislature for protecting tenants and taking a huge step in setting a moral imperative for housing.",,,,1181724333434998784,https://twitter.com/Gupta4Assembly/status/1181724333434998784
2019-10-08 20:05:46,Gupta4Assembly,michael_hendrix,0,0,1,"Why did we fail to deliver here? Where is the accountability? The intention alone is not enough. We need efficient and swift action for our homeless. We owe it to our taxpayers!",,,,1181661988486692864,https://twitter.com/Gupta4Assembly/status/1181661988486692864
2019-10-08 18:23:41,Gupta4Assembly,TIME,0,4,8,"Some of our CEOs are frankly displaying more political will than our elected officials. This is what taking a real stand looks like. #banassaultweapons #leadthefight",,,#banassaultweapons #leadthefight,1181636296113999873,https://twitter.com/Gupta4Assembly/status/1181636296113999873
2019-10-08 06:51:59,Gupta4Assembly,,0,0,1,"An outsider campaign doesn't get votes the insider way. Join us THIS SUNDAY to mobilize District 25 and win a FREE Gupta 2020 t-shirt! Help us #MakeItTo1500 and sign up on FB below! https://www.facebook.com/events/392594004763455/",,,#MakeItTo1500,1181462226525278208,https://twitter.com/Gupta4Assembly/status/1181462226525278208
2019-10-08 03:46:06,Gupta4Assembly,nowthisnews,0,0,0,"This.",,,,1181415446949453825,https://twitter.com/Gupta4Assembly/status/1181415446949453825
2019-10-07 15:32:13,Gupta4Assembly,CNBC,0,0,1,"What do we expect when our youngest are saddled with student debt? Our economy is now seeing the ramifications of price gouging education. It’s time for Comprehensive College Cost Reform. #leadthefight",,,#leadthefight,1181230759064952832,https://twitter.com/Gupta4Assembly/status/1181230759064952832
2019-10-07 05:49:42,Gupta4Assembly,,0,1,6,"We go where no campaign will go, because we are working for *every* constituent’s vote! Today’s moment on the trail from canvassing. #leadthefight #makeitto1500",,,#leadthefight #makeitto1500,1181084162507206657,https://twitter.com/Gupta4Assembly/status/1181084162507206657
2019-10-06 03:21:06,Gupta4Assembly,,1,1,4,"#TeamGupta hits Newark today to mobilize for action! Countdown: 1300 to go! An outsider campaign doesn’t get votes the insider way. ;-) #leadthefight #makeitto1500",,,#TeamGupta #leadthefight #makeitto1500,1180684376683634689,https://twitter.com/Gupta4Assembly/status/1180684376683634689
2019-10-03 17:08:05,Gupta4Assembly,publicbankla,0,0,4,"A monumental victory for taking on big money and championing everyday people. #AB857 #LeadTheFight",,,#AB857 #LeadTheFight,1179805332937166848,https://twitter.com/Gupta4Assembly/status/1179805332937166848
2019-10-02 19:58:43,Gupta4Assembly,,0,1,4,"In one of the wealthiest counties in the country, it is unconscionable for us to strip services from our most vulnerable due to “budgeting.” Proud of the SEIU for their activism today. Now it’s up to us to help them #LeadTheFight.",,,#LeadTheFight,1179485886888628224,https://twitter.com/Gupta4Assembly/status/1179485886888628224
2019-10-02 15:12:36,Gupta4Assembly,NBCNews,0,0,1,"Wishing @SenSanders a full recovery.",,@SenSanders,,1179413882336620547,https://twitter.com/Gupta4Assembly/status/1179413882336620547
2019-09-30 15:32:12,Gupta4Assembly,,0,0,3,"An incredible victory for college athletes! Ensuring compensation for their hard work is a reflection of how we champion fairness for all. #MoralLeadership #FairPayToPlayAct https://www-m.cnn.com/2019/09/30/sport/california-sb-206-ncaa-trnd/index.html?r=https%3A%2F%2Fwww.cnn.com%2F",,,#MoralLeadership #FairPayToPlayAct,1178694039966629888,https://twitter.com/Gupta4Assembly/status/1178694039966629888
2019-09-29 20:25:51,Gupta4Assembly,,0,0,2,"#TeamGupta hard at work today, canvassing at Lake Elizabeth! #LeadTheFight #MakeItTo1500",,,#TeamGupta #LeadTheFight #MakeItTo1500,1178405551333617664,https://twitter.com/Gupta4Assembly/status/1178405551333617664
2019-09-29 18:32:39,Gupta4Assembly,,0,0,3,"A very happy #RoshHashanah to all, hope you are enjoying apples, honey and good times with your family and friends today. May the new year bring prosperity and good fortune! #ShanaTova",,,#RoshHashanah #ShanaTova,1178377061334994945,https://twitter.com/Gupta4Assembly/status/1178377061334994945
2019-09-26 09:53:56,Gupta4Assembly,Weinsteinlaw,0,0,2,"What he said....",,,,1177159357974421504,https://twitter.com/Gupta4Assembly/status/1177159357974421504
2019-09-26 02:58:09,Gupta4Assembly,shannonrwatts,0,0,3,"Exactly HOW is this OK??? This is crazy that university officials allowed this. What ever happened to having the right to go to a safe school? #BanAssaultWeapons #LeadTheFight",,,#BanAssaultWeapons #LeadTheFight,1177054723725303812,https://twitter.com/Gupta4Assembly/status/1177054723725303812
2019-09-26 02:38:39,Gupta4Assembly,,0,2,1,"Who's ready to get those signatures? :-) Join us THIS SUNDAY for canvassing at Lake Elizabeth in Fremont. Details here: https://www.facebook.com/events/523389695081455/ #GrassrootswithGupta #LeadTheFight",,,#GrassrootswithGupta #LeadTheFight,1177049815898906624,https://twitter.com/Gupta4Assembly/status/1177049815898906624
2019-09-24 20:11:50,Gupta4Assembly,,0,1,3,"Attention Milpitas-- it's time to make our voices heard for fair housing TONIGHT! Join the City Council Housing Subcommittee and the Milpitas City Council at 6:00 p.m. Where: Barbara Lee Senior Center - Denny Weisgerber Room, 40 N. Milpitas Boulevard http://www.ci.milpitas.ca.gov/_pdfs/council/2019/092419/Agenda.pdf",,,,1176590082956021760,https://twitter.com/Gupta4Assembly/status/1176590082956021760
2019-09-24 13:22:33,Gupta4Assembly,Gupta4Assembly,0,0,0,"For every time the Right has had issues with worker’s rights laws in California, it doesn’t seem to hamper us having the largest economy and one of the top places to work in the US. Please explain the “socialist” panic in what looks like healthy capitalism.",,,,1176487085236215808,https://twitter.com/Gupta4Assembly/status/1176487085236215808
2019-09-24 13:16:09,Gupta4Assembly,RightyJim,2,0,0,"The facts are this— for all this hot air, you have not cited one line from the actual bill about contractor’s unionizing. You’ve stated a lot about union endorsers and a quote from a politician.",,,,1176485473520443392,https://twitter.com/Gupta4Assembly/status/1176485473520443392
2019-09-23 21:04:03,Gupta4Assembly,,0,0,2,"His words from back then are a staunch reminder to us all in these unusual times. ""In the good American tradition I decided not to moan or complain, but to take intelligent action."" --Rep. Dalip Singh Saund",,,,1176240834175524864,https://twitter.com/Gupta4Assembly/status/1176240834175524864
2019-09-23 21:04:02,Gupta4Assembly,CAPAC,1,1,1,"Many don't know that long before prominent Indian American politicians like Kamala Harris, Pramila Jayapal, Ro Khanna, there was Rep. Saund, a true trailblazer. Upon attaining American citizenship, he immediately sought to go into public service and give back to his country.",,,,1176240832447504391,https://twitter.com/Gupta4Assembly/status/1176240832447504391
2019-09-23 19:05:16,Gupta4Assembly,CNN,0,0,2,"She puts it so plainly, and so succinctly. “All you can talk about is money and eternal economic growth.” #ClimateStrike #GreenNewDealNOW",,,#ClimateStrike #GreenNewDealNOW,1176210942314582018,https://twitter.com/Gupta4Assembly/status/1176210942314582018
2019-09-22 08:20:46,Gupta4Assembly,,0,1,1,"A Garlic Festival. And now, our own university. It’s not just another sad day. It is a gradual hijack on our way of life. This. Has. To. Stop. #EndGunViolence #SJSU",,,#EndGunViolence #SJSU,1175686360642068480,https://twitter.com/Gupta4Assembly/status/1175686360642068480
2019-09-21 08:02:42,Gupta4Assembly,bellobiciduo,1,0,0,"Also, no, white nationalism doesn’t equal being a Republican. In fact, one of the most prominent sympathizers of the KKK was President Woodrow Wilson, a Democrat.",,,,1175319426075435008,https://twitter.com/Gupta4Assembly/status/1175319426075435008
2019-09-21 07:59:44,Gupta4Assembly,bellobiciduo,1,0,0,"Absolutely. We need to do something about being more inclusive as a society— loneliness is now one of the biggest issues that plagues millennials.",,,,1175318680705675265,https://twitter.com/Gupta4Assembly/status/1175318680705675265
2019-09-21 07:35:05,Gupta4Assembly,bellobiciduo,1,0,0,"Hey @bellobiciduo, thanks for your compliments on our video. We may disagree on the label, but I am w/ you that a guy who keeps an arsenal in his house + posts an anti-Semitic manifesto is a certified “crazy” who shouldn’t have a gun.",,@bellobiciduo,,1175312479070670849,https://twitter.com/Gupta4Assembly/status/1175312479070670849
2019-09-21 06:38:41,Gupta4Assembly,RightyJim,1,0,0,"As a candidate with actual private sector experience btw, my view is stifling entrepreneurship and over-inflating gov doesn’t work. But rampant greed is unacceptable.",,,,1175298281943044097,https://twitter.com/Gupta4Assembly/status/1175298281943044097
2019-09-21 06:32:17,Gupta4Assembly,RightyJim,1,0,0,"@rightyjim let me clear up a few misconceptions here: #AB1482 is really introducing a form of rent stabilization. It recognizes rents will continue to rise w/ market conditions, but caps hikes at 5% per year, which w/ 2.5% wage growth is fair. #AB5 says nothing about unions...",,@RightyJim,#AB1482 #AB5,1175296675075768321,https://twitter.com/Gupta4Assembly/status/1175296675075768321
2019-09-21 04:05:18,Gupta4Assembly,,0,0,2,"The reality of plastics in drinking water, sinking cities and natural disasters decimating whole regions is not a freak accident to be hand waved off. And a whole generation believes science over spin. #ClimateStrike #MoralLeadership #LeadTheFight",,,#ClimateStrike #MoralLeadership #LeadTheFight,1175259684443500544,https://twitter.com/Gupta4Assembly/status/1175259684443500544
2019-09-21 04:05:18,Gupta4Assembly,,1,0,4,"From country to country and city to city, young people took to the streets and said “Enough.” From our own city of San Jose:",,,,1175259682556059648,https://twitter.com/Gupta4Assembly/status/1175259682556059648
2019-09-20 20:46:25,Gupta4Assembly,,0,0,4,"Today’s #ClimateStrike shows that young generations will raise hell if we refuse to act. Take part in your local strike today! San Jose Diridon will have a climate protest at 2:45 PM— make your voice heard for change and a #CAGreenNewDeal",,,#ClimateStrike #CAGreenNewDeal,1175149234053701632,https://twitter.com/Gupta4Assembly/status/1175149234053701632
2019-09-20 15:55:00,Gupta4Assembly,marykcunningham,0,0,2,"Specifically the kind of common sense reform that we need!",,,,1175075899642920960,https://twitter.com/Gupta4Assembly/status/1175075899642920960
2019-09-20 09:40:27,Gupta4Assembly,,1,1,5,"Proud of our state for showing what it means to walk the walk. A short summary of September's achievements for the California Legislature-- #AB5 #AB1482 #AB32 #MoralLeadership #LeadTheFight",,,#AB5 #AB1482 #AB32 #MoralLeadership #LeadTheFight,1174981640382058499,https://twitter.com/Gupta4Assembly/status/1174981640382058499
2019-09-20 07:45:07,Gupta4Assembly,sf4pete,0,1,2,"Like us on FB: @Gupta4Assembly Instagram: @natashagupta2020",,@Gupta4Assembly,,1174952615739674626,https://twitter.com/Gupta4Assembly/status/1174952615739674626
2019-09-19 10:50:07,Gupta4Assembly,,0,2,4,"Our amazing, 100% volunteer policy team is made up of the most passionate and knowledgeable folks. Read our plans for a bold California agenda! http://gupta2020.com/platform So grateful for their hard work in making this happen. Keep checking back for more!",,,,1174636783495196672,https://twitter.com/Gupta4Assembly/status/1174636783495196672
2019-09-18 06:12:54,Gupta4Assembly,,0,0,1,"I take those lessons with me everyday in our 100% people powered effort—one of which being that the viability of a campaign is shown in how many people you touch who willingly go out & help because you fight for what is right.",,,,1174204630936502272,https://twitter.com/Gupta4Assembly/status/1174204630936502272
2019-09-18 06:12:53,Gupta4Assembly,sf4pete,1,0,3,"SV for Pete was my first time doing full-scale community organizing, and I learned a great deal from my friend, Joe Rodriguez, who runs @sf4pete and is a lifelong activist and champion of the Democratic Party, and one of the best in the business when it comes to grassroots!",,@sf4pete,,1174204626935132160,https://twitter.com/Gupta4Assembly/status/1174204626935132160
2019-09-17 23:02:59,Gupta4Assembly,,1,0,2,"Btw, the philosophy of state’s rights is a long-held belief of conservatism and small government.",,,,1174096439535816704,https://twitter.com/Gupta4Assembly/status/1174096439535816704
2019-09-17 23:02:58,Gupta4Assembly,,1,1,5,"This is serious on two counts: 1) undermining our state’s rights, 2) complete inability to recognize the urgency of climate change, or allow others to do something about it. Proud that @GavinNewsom is standing up to #LeadTheFight. #CAGreenNewDeal",,@GavinNewsom,#LeadTheFight #CAGreenNewDeal,1174096436662718464,https://twitter.com/Gupta4Assembly/status/1174096436662718464
2019-09-17 11:12:10,Gupta4Assembly,,0,0,2,"Apparently, *you-know-who* is paying a visit soon to the liberal bastion of California, the South Bay Area. Here’s what I’d like to know—how is he getting a crowd here?! ",,,,1173917557947953152,https://twitter.com/Gupta4Assembly/status/1173917557947953152
2019-09-16 18:02:09,Gupta4Assembly,,0,2,4,"Check us out in the @MilpitasBeat today ! Onward. #LeadTheFight",,@MilpitasBeat,#LeadTheFight,1173658345649012736,https://twitter.com/Gupta4Assembly/status/1173658345649012736
2019-09-16 09:23:45,Gupta4Assembly,Slate,0,0,0,"As a self-avowed Chopin fanatic, it’s great to see he’s been made hip again!",,,,1173527886692638720,https://twitter.com/Gupta4Assembly/status/1173527886692638720
2019-09-16 07:27:21,Gupta4Assembly,,0,0,1,"Yee yee guys! We've already made some buzz in the press. :-) #LeadTheFight #Gupta2020 #MoralLeadership",,,#LeadTheFight #Gupta2020 #MoralLeadership,1173498590213197825,https://twitter.com/Gupta4Assembly/status/1173498590213197825
2019-09-15 21:27:17,Gupta4Assembly,,4,8,15,"Our official campaign video which premiered at yesterday’s launch! Share, retweet, donate to a 100% people powered campaign. http://secure.actblue.com/donate/gupta2020 #LeadTheFight #Gupta2020",,,#LeadTheFight #Gupta2020,1173347579502841856,https://twitter.com/Gupta4Assembly/status/1173347579502841856
2019-09-15 18:06:37,Gupta4Assembly,,0,1,2,"In a packed house of 85 people yesterday, we started our movement to lead the fight for moral leadership. Thank you to our 100% volunteer staff for making our launch a success. We are in this together— let’s roll up our sleeves and get to work! #LeadTheFight #Gupta2020",,,#LeadTheFight #Gupta2020,1173297081651347457,https://twitter.com/Gupta4Assembly/status/1173297081651347457
2019-09-14 17:00:12,Gupta4Assembly,,0,1,2,"",,,,1172917977785585664,https://twitter.com/Gupta4Assembly/status/1172917977785585664
2019-09-14 02:28:20,Gupta4Assembly,,0,0,1,"This is our chance. And we're going to #LeadTheFight together. RSVP: https://www.eventbrite.com/e/campaign-kickoff-natasha-gupta-for-assembly-2020-tickets-71825854063",,,#LeadTheFight,1172698567191846913,https://twitter.com/Gupta4Assembly/status/1172698567191846913
2019-09-14 01:10:11,Gupta4Assembly,Newsweek,0,1,1,"California sets an example for the rest of our nation on what it means to stand up for our most vulnerable. Proud that we have flexed our state’s rights and finally put an end to the corruption of an industry that profits off of suffering and human rights abuses. #LeadTheFight",,,#LeadTheFight,1172678898015854592,https://twitter.com/Gupta4Assembly/status/1172678898015854592
