date,username,to,replies,retweets,favorites,text,geo,mentions,hashtags,id,permalink
2020-03-01 07:07:20,JoshBeckerSV,,0,0,1,"Luxembourg is first country to make all public transport free | Luxembourg | The Guardian",,,,1234012329068490752,https://twitter.com/JoshBeckerSV/status/1234012329068490752
2020-02-29 06:16:25,JoshBeckerSV,,1,0,0,"Senator Jerry Hill received the Community Leadership Award at the San Mateo PAL recognition event tonight, presented by @MaureenFreschet!Great to see @ChiefSM and Papia.",,@MaureenFreschet @ChiefSM,,1233637127507734528,https://twitter.com/JoshBeckerSV/status/1233637127507734528
2020-02-26 08:43:23,JoshBeckerSV,,0,0,0,"People often ask me ‘where is the lottery money’ -this is part of the answer...California Lottery officials shortchanged schools by millions, state audit says - Los Angeles Times",,,,1232586947635245056,https://twitter.com/JoshBeckerSV/status/1232586947635245056
2020-02-23 05:21:47,JoshBeckerSV,,0,0,0,"Fun sports story: Zamboni driver, 42, stars as emergency goalie for Hurricanes",,,,1231449051075268609,https://twitter.com/JoshBeckerSV/status/1231449051075268609
2020-02-22 12:38:05,JoshBeckerSV,,0,0,0,"California denies Trump administration claim on abortion coverage - Los Angeles Times",,,,1231196459627712513,https://twitter.com/JoshBeckerSV/status/1231196459627712513
2020-02-19 23:12:50,JoshBeckerSV,,0,2,2,"Judge rips PG&E for poor safety record leading to wildfires",,,,1230269038162395136,https://twitter.com/JoshBeckerSV/status/1230269038162395136
2020-02-17 21:15:46,JoshBeckerSV,,0,4,12,"Thrilled to have the support of @KamalaHarris! This photo is from one of our Full Circle events over a decade ago.",,@KamalaHarris,,1229514799345586176,https://twitter.com/JoshBeckerSV/status/1229514799345586176
2020-02-17 16:49:50,JoshBeckerSV,,0,0,0,"Success for homeless veterans and references Menlo Park project - https://www.nytimes.com/2020/02/16/us/politics/homeless-los-angeles-veterans.html?smid=nytcore-ios-share via @NYTimes",,@nytimes,,1229447875014193152,https://twitter.com/JoshBeckerSV/status/1229447875014193152
2020-02-15 13:22:39,JoshBeckerSV,,0,0,0,"Could you live in 350 square feet? Southland cities hope micro-housing can help tackle affordability – Press Telegram",,,,1228670963081809920,https://twitter.com/JoshBeckerSV/status/1228670963081809920
2020-02-15 13:22:10,JoshBeckerSV,,1,0,0,"Backyard landlord: What to know before building an ADU or granny flat - Los Angeles Times",,,,1228670840310382593,https://twitter.com/JoshBeckerSV/status/1228670840310382593
2020-02-14 08:30:14,JoshBeckerSV,,0,0,0,"Cool! Giant turtle fossil: Car-sized Stupendemys geographicus once roamed the earth - The Washington Post",,,,1228234986102243329,https://twitter.com/JoshBeckerSV/status/1228234986102243329
2020-02-12 15:52:00,JoshBeckerSV,,1,0,8,"Huge News!! Editorial: Josh Becker is best choice in District 13 Senate race",,,,1227621383296831494,https://twitter.com/JoshBeckerSV/status/1227621383296831494
2020-02-11 22:00:30,JoshBeckerSV,,0,1,6,"Very proud that the Mercury News published my Op-ed today about how CA and our Peninsula cities can lead the world fighting climate change. Thank you Daniel Yost for your collaboration! https://www.mercurynews.com/2020/02/11/opinion-becker-climate-change/?fbclid=IwAR2Lv2JwoM7AearJ1zCIr0T-3lAh9G-Lmg3lswlCM7np0xSfZUkZNc4dimg @idarose @margaretabekoga @AimeeGlobal @ianbaintech @MaryHodder",,@idarose @margaretabekoga @AimeeGlobal @ianbaintech @MaryHodder,,1227351729982726144,https://twitter.com/JoshBeckerSV/status/1227351729982726144
2020-02-07 19:24:59,JoshBeckerSV,,0,0,4,"I took the time to complete @Ballotpedia's candidate survey to share my vision and goals. You'll be able to see the responses on my profile shortly.",,@ballotpedia,,1225863044116275201,https://twitter.com/JoshBeckerSV/status/1225863044116275201
2020-02-05 22:40:52,JoshBeckerSV,,0,0,0,"Join me tonight for the Embarcadero Media Debate at 7:30 PM – at Palo Alto Art Center",,,,1225187562228043778,https://twitter.com/JoshBeckerSV/status/1225187562228043778
2020-02-05 16:54:47,JoshBeckerSV,,0,0,9,"Some personal news - Thank you Senator Hill for your endorsement! It’s an honor!",,,,1225100469304868864,https://twitter.com/JoshBeckerSV/status/1225100469304868864
2020-02-05 07:40:54,JoshBeckerSV,JoshBeckerSV,0,0,0,"Meant to say 20",,,,1224961077663813633,https://twitter.com/JoshBeckerSV/status/1224961077663813633
2020-02-04 02:25:12,JoshBeckerSV,,0,0,2,"In Iraq, Where Beauty Was Long Suppressed, Art Flowers Amid Protests - The New York Times",,,,1224519242407653376,https://twitter.com/JoshBeckerSV/status/1224519242407653376
2020-02-02 10:04:40,JoshBeckerSV,downloadcue,0,0,0,"Yeah I’m not sure of that. Most people I know for Web 1.0 and Web 2.0 have stayed. Many have moved down to the Peninsula and have families and are engaged in their local communities.",,,,1223910094108102657,https://twitter.com/JoshBeckerSV/status/1223910094108102657
2020-02-02 10:00:37,JoshBeckerSV,socialimpactvc,1,0,0,"There is a local giving movement. Check out Magnify Communities - a local giving pledge. And http://Www.fullcirclefund.org and SV2 have been doing it for almost 2 years",,,,1223909077480198146,https://twitter.com/JoshBeckerSV/status/1223909077480198146
2020-02-02 09:56:46,JoshBeckerSV,nabeel,0,0,0,"Check out http://www.fullcirclefund.org - we’ve been doing this for 19 years!!!!",,,,1223908105139834880,https://twitter.com/JoshBeckerSV/status/1223908105139834880
2020-02-02 03:10:36,JoshBeckerSV,,0,1,8,"Thanks to my wonderful friends in East Palo Alto who can out to meet me tonight",,,,1223805893663326208,https://twitter.com/JoshBeckerSV/status/1223805893663326208
2020-01-31 21:18:55,JoshBeckerSV,,0,1,1,"Power of policy and technology. Proud Barry endorsed me and my climate plan",,,,1223355000899768320,https://twitter.com/JoshBeckerSV/status/1223355000899768320
2020-01-31 21:10:34,JoshBeckerSV,,0,0,5,"Big News: endorsed by API leaders at a press conference today! Including @Evan_Low @margaretabekoga @GilbertWongnz @DavidChiu",,@Evan_Low @margaretabekoga @GilbertWongnz @DavidChiu,,1223352896684580864,https://twitter.com/JoshBeckerSV/status/1223352896684580864
2020-01-31 06:38:41,JoshBeckerSV,,0,1,5,"It's always fun to spend the evening with the @SMCDEMS!",,@SMCDEMS,,1223133481296781312,https://twitter.com/JoshBeckerSV/status/1223133481296781312
2020-01-29 15:27:38,JoshBeckerSV,YadinShemmer,0,0,0,"Amen",,,,1222541820166410246,https://twitter.com/JoshBeckerSV/status/1222541820166410246
2020-01-29 15:17:31,JoshBeckerSV,termscout,0,0,1,"Terrific, congrats!",,,,1222539274328756224,https://twitter.com/JoshBeckerSV/status/1222539274328756224
2020-01-24 22:09:29,JoshBeckerSV,,0,3,0,"Must read when you have time. While banks were getting bailed out they were literally stealing $Bs from governments. Thanks to the whistle blowers who came forward: It May Be the Biggest Tax Heist Ever. And Europe Wants Justice. - The New York Times",,,,1220831012227170305,https://twitter.com/JoshBeckerSV/status/1220831012227170305
2020-01-24 07:09:31,JoshBeckerSV,marcus_ismael,0,0,1,"Thank you Marcus! Great job tonight.",,,,1220604527465730050,https://twitter.com/JoshBeckerSV/status/1220604527465730050
2020-01-23 02:07:15,JoshBeckerSV,,0,0,0,"",,,,1220166072277422084,https://twitter.com/JoshBeckerSV/status/1220166072277422084
2020-01-20 20:59:12,JoshBeckerSV,normankline,0,0,0,"Yes I love that hotel",,,,1219363771107270656,https://twitter.com/JoshBeckerSV/status/1219363771107270656
2020-01-15 16:21:07,JoshBeckerSV,,0,0,1,"Nice! Bruce Springsteen’s Son Becomes a Jersey City Firefighter - The New York Times",,,,1217481851217956864,https://twitter.com/JoshBeckerSV/status/1217481851217956864
2020-01-14 15:15:58,JoshBeckerSV,,0,0,1,"Oldest thing on Earth is 7-billion-year-old stardust from Murchison meteorite - The Washington Post",,,,1217103068040314881,https://twitter.com/JoshBeckerSV/status/1217103068040314881
2020-01-13 21:08:27,JoshBeckerSV,corilucero,0,0,0,"Great News",,,,1216829385749123073,https://twitter.com/JoshBeckerSV/status/1216829385749123073
2020-01-13 21:08:13,JoshBeckerSV,corilucero,0,0,0,"Fantastic!!",,,,1216829327032995840,https://twitter.com/JoshBeckerSV/status/1216829327032995840
2020-01-13 16:19:40,JoshBeckerSV,cafedujord,1,0,3,"Said I haven’t so far & raised a few questions, including that if HCD has until July of 2021 to define Local Flexibility Plans & then cities 6mos? 1 yr? to develop those plans, how is it diff from the housing element in 2022 RENA and we are losing low/middle income residents now",,,,1216756707851767808,https://twitter.com/JoshBeckerSV/status/1216756707851767808
2020-01-13 08:51:37,JoshBeckerSV,John4SSFUSD,1,0,1,"Good to see you John!",,,,1216643952226422784,https://twitter.com/JoshBeckerSV/status/1216643952226422784
2020-01-12 15:55:25,JoshBeckerSV,SupDavePine,0,1,1,"Go PCE! Terrific leadership from our county",,,,1216388217265475584,https://twitter.com/JoshBeckerSV/status/1216388217265475584
2020-01-11 15:52:34,JoshBeckerSV,johnolilly,0,0,1,"We had much more luck with the Simpsons. Aaron had a Simpson-themed bar mitzvah! Rush was no match for rap.",,,,1216025115407736833,https://twitter.com/JoshBeckerSV/status/1216025115407736833
2020-01-09 17:02:29,JoshBeckerSV,tfadell,0,0,1,"Great news!",,,,1215317933070508032,https://twitter.com/JoshBeckerSV/status/1215317933070508032
2020-01-09 06:55:27,JoshBeckerSV,,0,4,5,"Group raises nearly $16 million to buy Alder Creek giant sequoia grove",,,,1215165168373530625,https://twitter.com/JoshBeckerSV/status/1215165168373530625
2020-01-08 17:00:24,JoshBeckerSV,ACMelendrez,1,0,2,"Glad you found the picture!",,,,1214955022171037696,https://twitter.com/JoshBeckerSV/status/1214955022171037696
2020-01-08 16:54:35,JoshBeckerSV,skupor,0,0,1,"Good news today",,,,1214953558136672256,https://twitter.com/JoshBeckerSV/status/1214953558136672256
2020-01-08 16:51:09,JoshBeckerSV,openculture,0,0,0,"Something positive for today",,,,1214952693061435393,https://twitter.com/JoshBeckerSV/status/1214952693061435393
2020-01-08 00:47:40,JoshBeckerSV,sgelfond,0,0,0,"Sorry I missed this! Billy, hope it was a good one!",,,,1214710223979474944,https://twitter.com/JoshBeckerSV/status/1214710223979474944
2020-01-06 20:55:25,JoshBeckerSV,,0,0,2,"Thank you to Los Altos Mayor Jan Pepper for joining us in canvassing across Los Altos this weekend! Grateful to have passionate and experienced local change-makers on our team.",,,,1214289389825585152,https://twitter.com/JoshBeckerSV/status/1214289389825585152
2020-01-06 20:55:05,JoshBeckerSV,,0,0,0,"So excited to hit the ground running in 2020 with our wonderful volunteers! More canvassing adventures to come as we fight to bring positive change to our state! #PrimaryCountdown: 57 days",,,#PrimaryCountdown,1214289307579453441,https://twitter.com/JoshBeckerSV/status/1214289307579453441
2020-01-03 07:50:28,JoshBeckerSV,johnolilly,0,0,1,"I hear you!",,,,1213004685264609281,https://twitter.com/JoshBeckerSV/status/1213004685264609281
2019-12-29 22:24:44,JoshBeckerSV,,0,0,0,"wisdom on National Service from my friend @SchwabClarence",,@SchwabClarence,,1211412763156733952,https://twitter.com/JoshBeckerSV/status/1211412763156733952
2019-12-27 15:32:23,JoshBeckerSV,,0,0,0,"In a Year of Notable Deaths, a World of Women Who Shattered Ceilings - The New York Times",,,,1210584217106538496,https://twitter.com/JoshBeckerSV/status/1210584217106538496
2019-12-27 06:01:32,JoshBeckerSV,zackbogue,1,1,0,"http://Thirdway.org or another group? I’m very interested in supporting advanced nuclear in the CA State Senate",,,,1210440557060743168,https://twitter.com/JoshBeckerSV/status/1210440557060743168
2019-12-23 22:59:12,JoshBeckerSV,yangszechoo,1,0,1,"So exciting!!",,,,1209247109351952386,https://twitter.com/JoshBeckerSV/status/1209247109351952386
2019-12-23 16:45:53,JoshBeckerSV,,0,0,0,"Rebuilding homes for a better lives in Silicon Valley",,,,1209153162084405248,https://twitter.com/JoshBeckerSV/status/1209153162084405248
2019-12-20 04:15:28,JoshBeckerSV,discovery_genie,0,0,4,"Miss you all too!!",,,,1207877151749373953,https://twitter.com/JoshBeckerSV/status/1207877151749373953
2019-12-20 04:15:04,JoshBeckerSV,sameweigel,0,0,0,"That’s awesome!",,,,1207877050570117120,https://twitter.com/JoshBeckerSV/status/1207877050570117120
2019-12-17 02:34:59,JoshBeckerSV,,0,0,2,"Opinion | I Headed the F.B.I. and C.I.A. There’s a Dire Threat to the Country I Love. - The New York Times",,,,1206764697950683136,https://twitter.com/JoshBeckerSV/status/1206764697950683136
2019-12-13 08:51:17,JoshBeckerSV,lacymjohnson,0,0,0,"This on student loans",,,,1205409846553497600,https://twitter.com/JoshBeckerSV/status/1205409846553497600
2019-12-13 08:47:55,JoshBeckerSV,John4SSFUSD,0,0,1,"Congrats! And glad it fit in your bag!",,,,1205408997542486016,https://twitter.com/JoshBeckerSV/status/1205408997542486016
2019-12-12 05:49:50,JoshBeckerSV,,0,0,0,"Without urgent action, California’s sea-level rise a threat to housing, economy, report says | CalMatters",,,,1205001795962953730,https://twitter.com/JoshBeckerSV/status/1205001795962953730
2019-12-12 04:51:59,JoshBeckerSV,,0,0,0,"PG&E diverted millions from putting lines underground, audit finds - http://SFChronicle.com",,,,1204987238737534976,https://twitter.com/JoshBeckerSV/status/1204987238737534976
2019-12-08 01:59:06,JoshBeckerSV,,0,0,2,"Scary stuff: Video Games and Online Chats Are ‘Hunting Grounds’ for Sexual Predators",,,,1203494176182030336,https://twitter.com/JoshBeckerSV/status/1203494176182030336
2019-12-08 01:14:48,JoshBeckerSV,,0,0,0,"Long article worth reading: Finland Is a Capitalist Paradise",,,,1203483031132000258,https://twitter.com/JoshBeckerSV/status/1203483031132000258
2019-12-07 10:22:51,JoshBeckerSV,DwyaneWade,0,0,0,"Inspired by DWade here...",,,,1203258564619333633,https://twitter.com/JoshBeckerSV/status/1203258564619333633
2019-12-07 09:47:40,JoshBeckerSV,,0,0,0,"Florida Keys Deliver a Hard Message: As Seas Rise, Some Places Can't Be Saved https://news.yahoo.com/florida-keys-deliver-hard-message-131505781.html",,,,1203249708891688962,https://twitter.com/JoshBeckerSV/status/1203249708891688962
2019-12-07 06:35:04,JoshBeckerSV,,0,0,2,"A terrific night celebrating Chief Susan Manheimer! ⁦⁦@MaureenFreschet⁩",,@MaureenFreschet,,1203201237925056512,https://twitter.com/JoshBeckerSV/status/1203201237925056512
2019-12-03 05:25:09,JoshBeckerSV,,0,0,1,"Greenland melt involves massive waterfalls encased in ice, raising fears about sea level rise - The Washington Post",,,,1201734094532427776,https://twitter.com/JoshBeckerSV/status/1201734094532427776
2019-12-02 15:17:03,JoshBeckerSV,,0,0,0,"This is so sad...The Class of 2000 ‘Could Have Been Anything.’ Until Opioids Hit. - The New York Times",,,,1201520659773263872,https://twitter.com/JoshBeckerSV/status/1201520659773263872
2019-12-02 13:15:57,JoshBeckerSV,,0,0,0,"Technology to keep lights on could help prevent wildfires",,,,1201490184971284481,https://twitter.com/JoshBeckerSV/status/1201490184971284481
2019-12-01 09:24:58,JoshBeckerSV,alackerlyons,0,0,1,"Well done",,,,1201069670561800195,https://twitter.com/JoshBeckerSV/status/1201069670561800195
2019-11-28 23:19:12,JoshBeckerSV,dgp,0,0,1,"awesome! excited for it",,,,1200192448502231040,https://twitter.com/JoshBeckerSV/status/1200192448502231040
2019-11-27 05:32:59,JoshBeckerSV,,1,0,1,"Hmmm pies...8 Spectacular Pies That Taste as Good as They Look - The New York Times",,,,1199561737504092160,https://twitter.com/JoshBeckerSV/status/1199561737504092160
2019-11-26 23:44:13,JoshBeckerSV,,0,0,0,"Elite climber survives El Capitan fall at Yosemite with help of ‘Free Solo’ climber - http://SFChronicle.com",,,,1199473964755513344,https://twitter.com/JoshBeckerSV/status/1199473964755513344
2019-11-26 19:44:43,JoshBeckerSV,,0,0,0,"Don’t forget Trump’s devastating impact on reproductive freedom - The Washington Post",,,,1199413694318272512,https://twitter.com/JoshBeckerSV/status/1199413694318272512
2019-11-23 02:50:11,JoshBeckerSV,,0,0,4,"Honored to be at LaRaza Roundtable tonight",,,,1198071214117244929,https://twitter.com/JoshBeckerSV/status/1198071214117244929
2019-11-22 22:09:21,JoshBeckerSV,laikentett,0,0,2,"Glad you got a lot out of it!",,,,1198000540925317120,https://twitter.com/JoshBeckerSV/status/1198000540925317120
2019-11-22 09:20:40,JoshBeckerSV,GinaPapan,0,0,0,"Thank you @GinaPapan and @SupDavePine !",,@GinaPapan @SupDavePine,,1197807093874479104,https://twitter.com/JoshBeckerSV/status/1197807093874479104
2019-11-22 03:24:35,JoshBeckerSV,LNAccelerator,0,1,5,"Got to lead a discussion with @miriamulu1 for our Legal Accelerator participants today. They got so much out it. Thanks Miriam!!",,@miriamulu1,,1197717483404181505,https://twitter.com/JoshBeckerSV/status/1197717483404181505
2019-11-22 02:54:18,JoshBeckerSV,,0,4,14,"Terrific product design session for our Legal Startup Accelerator participants today ⁦@LNAccelerator⁩ ⁦@LexisNexis⁩ ⁦@JeffPfeifer⁩ ⁦@owenbyrd⁩",,@LNAccelerator @LexisNexis @JeffPfeifer @owenbyrd,,1197709865105289216,https://twitter.com/JoshBeckerSV/status/1197709865105289216
2019-11-22 00:42:00,JoshBeckerSV,dgp,0,0,1,"!!!!!!",,,,1197676568048332801,https://twitter.com/JoshBeckerSV/status/1197676568048332801
2019-11-21 15:38:07,JoshBeckerSV,,0,0,1,"The Cost of Battery Storage Plummets at the Right Moment for California | KQED Science https://www.kqed.org/science/1951005/the-cost-of-battery-storage-plummets-at-the-right-moment-for-california",,,,1197539697460838405,https://twitter.com/JoshBeckerSV/status/1197539697460838405
2019-11-21 08:00:34,JoshBeckerSV,,0,0,0,"Wow: Arab Thinkers Call to Abandon Boycotts and Engage With Israel",,,,1197424549186326530,https://twitter.com/JoshBeckerSV/status/1197424549186326530
2019-11-20 19:46:09,JoshBeckerSV,LKhere,0,0,1,"Hi Laurie! Thanks for joining this conversation.",,,,1197239729231552512,https://twitter.com/JoshBeckerSV/status/1197239729231552512
2019-11-20 19:45:04,JoshBeckerSV,NickJRishwain,1,0,1,"Great point!",,,,1197239456895389696,https://twitter.com/JoshBeckerSV/status/1197239456895389696
2019-11-20 17:56:26,JoshBeckerSV,marcwva,0,0,1,"Just shared this advice with all of the startups in our legal tech cohort. Great place to start.",,,,1197212116429631494,https://twitter.com/JoshBeckerSV/status/1197212116429631494
2019-11-20 17:48:52,JoshBeckerSV,glambert,0,0,0,"Good point Greg, agree that authenticity is critical.",,,,1197210214568624128,https://twitter.com/JoshBeckerSV/status/1197210214568624128
2019-11-20 17:45:24,JoshBeckerSV,marcwva,0,0,0,"That's great to hear. It's good to know that subject-matter expertise is recognized on social media.",,,,1197209341113196544,https://twitter.com/JoshBeckerSV/status/1197209341113196544
2019-11-20 17:44:22,JoshBeckerSV,marcwva,0,0,0,"That's great advice!",,,,1197209079002750976,https://twitter.com/JoshBeckerSV/status/1197209079002750976
2019-11-20 17:43:59,JoshBeckerSV,JeffPfeifer,1,0,6,"Social media best practices for legal start ups. What works, what doesn't? Should you even spend time on it? Join the conversation now at #Law360SocialChat",,,#Law360SocialChat,1197208984668622848,https://twitter.com/JoshBeckerSV/status/1197208984668622848
2019-11-15 05:11:41,JoshBeckerSV,RepSpeier,0,0,0,"Thank you Congresswoman Speier!",,,,1195207723593256960,https://twitter.com/JoshBeckerSV/status/1195207723593256960
2019-11-15 05:06:23,JoshBeckerSV,CaroleSanMateo,0,0,0,"Yes so heartbreaking",,,,1195206387099242498,https://twitter.com/JoshBeckerSV/status/1195206387099242498
2019-11-15 04:29:43,JoshBeckerSV,,0,0,8,"Had fun talking to the Stanford Democrats tonight. Lots of energy and enthusiasm and excited to get them involved with my campaign. When I asked who wanted to run for office some day it was great to have so many women raise their hands!! Thanks ⁦⁦@RiaCalcagno⁩",,@RiaCalcagno,,1195197162310602752,https://twitter.com/JoshBeckerSV/status/1195197162310602752
2019-11-14 08:00:52,JoshBeckerSV,penforeveryone,0,0,4,"Thanks for the reporting and commentary!",,,,1194887909167419392,https://twitter.com/JoshBeckerSV/status/1194887909167419392
2019-11-13 03:32:00,JoshBeckerSV,,0,1,5,"Important piece @RosanneFoust about solving the county’s child care and preschool shortage. Proud to be on the Child Care Partnerships Council supporting #buildup. @SupDavePine https://www.smdailyjournal.com/opinion/guest_perspectives/solving-the-county-s-child-care-and-preschool-shortage/article_54a1bba8-04b0-11ea-be49-07bf22da5f05.html?utm_medium=social&amp;utm_source=twitter&amp;utm_campaign=user-share via @smdailyjournal",,@RosanneFoust @SupDavePine @smdailyjournal,#buildup,1194457861264269312,https://twitter.com/JoshBeckerSV/status/1194457861264269312
2019-11-10 18:30:43,JoshBeckerSV,,0,0,3,"Terrific discussion of the issues at Becker for Senate event in San Mateo at the house of @EricRodriguez. Thank you to Eric and Shirley and @MaureenFreschet for hosting!",,@EricRodriguez @MaureenFreschet,,1193596868074164224,https://twitter.com/JoshBeckerSV/status/1193596868074164224
2019-11-10 18:28:29,JoshBeckerSV,DianePapan,0,0,1,"I liked the trivia night! Congrats on a successful series of events for the community.",,,,1193596302459691008,https://twitter.com/JoshBeckerSV/status/1193596302459691008
2019-11-10 05:43:54,JoshBeckerSV,dgp,0,0,1,"Well done",,,,1193403891372609538,https://twitter.com/JoshBeckerSV/status/1193403891372609538
2019-11-09 01:06:47,JoshBeckerSV,,0,0,2,"Honoring Nirmala Dillman for her tireless work on behalf of Early Childhood Education - I’ve learned so much from her during my time on the Childcare Partnerships Council of San Mateo County. We will miss her so much!!!! – at San Mateo County Office Of Education",,,,1192971764126498816,https://twitter.com/JoshBeckerSV/status/1192971764126498816
2019-11-08 16:01:35,JoshBeckerSV,,0,0,0,"University of California heads to Supreme Court to defend protections for undocumented immigrants http://edsource.org/?page_id=619634 via @edsource",,@EdSource,,1192834559974338566,https://twitter.com/JoshBeckerSV/status/1192834559974338566
2019-11-08 03:41:39,JoshBeckerSV,,0,0,2,"San Mateo Police Activities League Appreciation event tonight at the beautiful Carolands. With Mayor ⁦⁦@DianePapan⁩ , former Mayor ⁦@MaureenFreschet⁩ and Executive Director Tracy Unga",,@DianePapan @MaureenFreschet,,1192648347690995713,https://twitter.com/JoshBeckerSV/status/1192648347690995713
2019-11-07 06:52:32,JoshBeckerSV,,0,0,0,"Love this article title: They Didn’t Find Life in a Hopeless Place - The New York Times",,,,1192333998887821321,https://twitter.com/JoshBeckerSV/status/1192333998887821321
2019-11-06 21:55:04,JoshBeckerSV,evan_adams,0,0,0,"Oh my",,,,1192198742851518465,https://twitter.com/JoshBeckerSV/status/1192198742851518465
2019-11-06 21:54:45,JoshBeckerSV,davidcanepa,0,0,2,"As an unincorporated resident, Thank you!!",,,,1192198661641363456,https://twitter.com/JoshBeckerSV/status/1192198661641363456
2019-11-06 21:53:27,JoshBeckerSV,,0,0,0,"Excited for our panel coming up on Re-entry from prison into Entrepreneurship!",,,,1192198335198720000,https://twitter.com/JoshBeckerSV/status/1192198335198720000
2019-11-06 15:57:57,JoshBeckerSV,SanMateoKen,0,0,0,"Congrats ken! Looking good",,,,1192108870547623937,https://twitter.com/JoshBeckerSV/status/1192108870547623937
2019-11-06 15:57:15,JoshBeckerSV,_lala_wu_,0,0,1,"Thanks for all of your amazing work. Seeing the energy and enthusiasm of the Sister District teams in this area has been been so inspiring. Congrats to all!!!",,,,1192108693237587968,https://twitter.com/JoshBeckerSV/status/1192108693237587968
2019-11-06 15:50:13,JoshBeckerSV,alevin,0,0,0,"Wow lots to digest here, thanks!",,,,1192106923228708865,https://twitter.com/JoshBeckerSV/status/1192106923228708865
2019-11-06 15:25:58,JoshBeckerSV,Lenny_Mendonca,0,0,1,"Great news!",,,,1192100821233594371,https://twitter.com/JoshBeckerSV/status/1192100821233594371
2019-11-06 15:22:39,JoshBeckerSV,phwerner,1,0,2,"Congrats @phwerner and Cooley team!",,@phwerner,,1192099987930267654,https://twitter.com/JoshBeckerSV/status/1192099987930267654
2019-11-06 15:17:33,JoshBeckerSV,costareports,0,0,1,"One of my friends in Delaware county called me last night on this...",,,,1192098703567290368,https://twitter.com/JoshBeckerSV/status/1192098703567290368
2019-11-06 15:15:28,JoshBeckerSV,RepSpeier,0,0,0,"With victory in Virginia comes a historic opportunity!...",,,,1192098178037739520,https://twitter.com/JoshBeckerSV/status/1192098178037739520
2019-11-05 19:19:07,JoshBeckerSV,johnolilly,0,0,0,"Yes!",,,,1191797106425483264,https://twitter.com/JoshBeckerSV/status/1191797106425483264
2019-11-03 20:30:53,JoshBeckerSV,,0,0,1,"Super fun Moving Equality Forward event for #baymec with Rick Welts of the Warriors - the first openly LGBT senior sports exec in the country",,,#baymec,1191090391786745857,https://twitter.com/JoshBeckerSV/status/1191090391786745857
2019-11-03 17:38:07,JoshBeckerSV,,0,0,0,"Why is Iran so afraid of Iraqi and Lebanese anti-government protests?",,,,1191046914717802497,https://twitter.com/JoshBeckerSV/status/1191046914717802497
2019-11-03 14:33:38,JoshBeckerSV,evan_adams,0,0,0,"Wow",,,,1191000487497089024,https://twitter.com/JoshBeckerSV/status/1191000487497089024
2019-10-31 20:07:24,JoshBeckerSV,JeffPfeifer,0,0,5,"Human Piñata! - that’s courageous for a manager :)",,,,1189997318784733184,https://twitter.com/JoshBeckerSV/status/1189997318784733184
2019-10-31 07:45:13,JoshBeckerSV,aaref,0,0,1,"Congrats aaref, that’s a strong team",,,,1189810541566365697,https://twitter.com/JoshBeckerSV/status/1189810541566365697
2019-10-31 02:28:19,JoshBeckerSV,,0,0,0,"Wow this is intense to watch: Kincade Fire Video: Incredible images show battle to save Windsor in Sonoma County | http://abc7news.com",,,,1189730790533320704,https://twitter.com/JoshBeckerSV/status/1189730790533320704
