date,username,to,replies,retweets,favorites,text,geo,mentions,hashtags,id,permalink
2019-05-17 03:05:12,JoshBeckerSV,,0,0,1,"Learn about #talkingpointsed, one of Full Circle Fund’s new grantees. Talking Points drives student success in low-income diverse areas through building strong partnerships across parents, schools, and communities",,,#talkingpointsed,1129221297936801792,https://twitter.com/JoshBeckerSV/status/1129221297936801792
2019-05-13 23:12:16,JoshBeckerSV,,0,1,0,"Supreme Court's conservative majority overturns 41-year-old precedent, prompting warning from liberal justices - The Washington Post",,,,1128075518442491904,https://twitter.com/JoshBeckerSV/status/1128075518442491904
2019-05-12 22:26:36,JoshBeckerSV,chelseabonini,0,0,1,"Go Chelsea!",,,,1127701638590812160,https://twitter.com/JoshBeckerSV/status/1127701638590812160
2019-05-11 23:10:06,JoshBeckerSV,,0,0,0,"How a Chinese scientist broke the rules to create the first gene-edited babies - The Wall Street Journal",,,,1127350195191050240,https://twitter.com/JoshBeckerSV/status/1127350195191050240
2019-05-11 07:20:47,JoshBeckerSV,jdh,0,0,1,"Cool!",,,,1127111292693516288,https://twitter.com/JoshBeckerSV/status/1127111292693516288
2019-05-11 07:16:41,JoshBeckerSV,,0,0,0,"How a Los Angeles mansion became an arsenal for more than 1,000 weapons",,,,1127110261742100480,https://twitter.com/JoshBeckerSV/status/1127110261742100480
2019-05-08 04:56:31,JoshBeckerSV,,0,0,4,"Important! In Trump vs. California, the state is winning nearly all its environmental cases - Los Angeles Times",,,,1125987822932901888,https://twitter.com/JoshBeckerSV/status/1125987822932901888
2019-05-04 06:46:51,JoshBeckerSV,,0,0,1,"Court declares Ohio congressional map an unconstitutional partisan gerrymander",,,,1124566037964283905,https://twitter.com/JoshBeckerSV/status/1124566037964283905
2019-05-02 02:39:22,JoshBeckerSV,,0,0,0,"Check out ""Board Match San Francisco 2019"" https://www.eventbrite.com/e/board-match-san-francisco-2019-registration-52124888946?utm-medium=discovery&amp;utm-campaign=social&amp;utm-content=attendeeshare&amp;aff=estw&amp;utm-source=tw&amp;utm-term=listing @Eventbrite",,@eventbrite,,1123778980455362561,https://twitter.com/JoshBeckerSV/status/1123778980455362561
2019-04-26 06:34:11,JoshBeckerSV,,0,0,2,"Important ruling: Judges Rule Michigan Congressional Districts Are Unconstitutionally Gerrymandered https://nyti.ms/2IJq0yk",,,,1121663745594236929,https://twitter.com/JoshBeckerSV/status/1121663745594236929
2019-04-25 14:17:38,JoshBeckerSV,,0,0,0,"SF Mayor Breed wants to use public land to build affordable housing https://www.sfchronicle.com/bayarea/article/SF-Mayor-Breed-wants-to-use-public-land-to-build-13790002.php?utm_campaign=CMS%20Sharing%20Tools%20(Premium)&amp;utm_source=t.co&amp;utm_medium=referral",,,,1121417989708890112,https://twitter.com/JoshBeckerSV/status/1121417989708890112
2019-04-22 00:54:59,JoshBeckerSV,,0,0,1,"Are accessory dwelling units an answer to Bay Area housing crisis? Yes and no - San Francisco Chronicle https://www.sfchronicle.com/bayarea/article/Are-accessory-dwelling-units-an-answer-to-Bay-13776416.php",,,,1120128831203893248,https://twitter.com/JoshBeckerSV/status/1120128831203893248
2019-04-21 22:59:45,JoshBeckerSV,,0,0,0,"Why is our ‘achievement gap’ so stubborn? https://calmatters.org/articles/commentary/why-is-our-achievement-gap-so-stubborn/ via @calmatters",,@CalMatters,,1120099835040788480,https://twitter.com/JoshBeckerSV/status/1120099835040788480
2019-04-20 16:36:47,JoshBeckerSV,Pulsipher_WGU,1,0,2,"Terrific workforce development program..",,,,1119641068608245760,https://twitter.com/JoshBeckerSV/status/1119641068608245760
2019-04-20 16:31:32,JoshBeckerSV,Lenny_Mendonca,0,0,1,"So important, thank you!",,,,1119639749067563008,https://twitter.com/JoshBeckerSV/status/1119639749067563008
2019-04-12 06:09:20,JoshBeckerSV,,0,0,2,"Scott Kelly Spent a Year in Orbit. His Body Is Not Quite the Same. - The New York Times https://www.nytimes.com/2019/04/11/science/scott-mark-kelly-twins-space-nasa.html",,,,1116584064037687297,https://twitter.com/JoshBeckerSV/status/1116584064037687297
2019-03-27 17:49:26,JoshBeckerSV,thestartupsquad,1,0,1,"I just donated to this! Give a book and help inspire and empower girls today @thestartupsquad",,@thestartupsquad,,1110962045367652352,https://twitter.com/JoshBeckerSV/status/1110962045367652352
2019-03-26 01:49:52,JoshBeckerSV,,0,0,0,"Best headline ever? Trump’s Kakistocracy Is Also a Hackistocracy https://nyti.ms/2HXTjfk",,,,1110358174102503424,https://twitter.com/JoshBeckerSV/status/1110358174102503424
2019-03-23 13:57:35,JoshBeckerSV,dgp,0,0,2,"That’s terrific!",,,,1109454144337633282,https://twitter.com/JoshBeckerSV/status/1109454144337633282
2019-03-21 18:56:39,JoshBeckerSV,,1,0,1,"How New Zealand was able to ban assault weapons after one mass shooting - Vox https://apple.news/AGpJTeTc_Sku3zt8Bqlc78A",,,,1108804633932099585,https://twitter.com/JoshBeckerSV/status/1108804633932099585
2019-03-21 15:06:07,JoshBeckerSV,,0,0,0,"California wildfire season looms: How can technology help? https://bayareane.ws/2HJg32z via @mercnews",,@mercnews,,1108746615790043136,https://twitter.com/JoshBeckerSV/status/1108746615790043136
2019-03-20 06:18:00,JoshBeckerSV,,0,0,1,"Meet the 27-year-old mayor about to double her Bay Area city's population https://bayareane.ws/2N8ykqJ via @mercnews",,@mercnews,,1108251324024414208,https://twitter.com/JoshBeckerSV/status/1108251324024414208
2019-03-15 07:17:14,JoshBeckerSV,,0,0,0,"Sandy Hook Massacre: Remington and Other Gun Companies Lose Major Ruling Over Liability - The New York Times https://www.nytimes.com/2019/03/14/nyregion/sandy-hook-supreme-court.html",,,,1106454290787258368,https://twitter.com/JoshBeckerSV/status/1106454290787258368
2019-03-14 06:38:01,JoshBeckerSV,,0,0,0,"How the Icefish Got Its Transparent Blood and See-Through Skull https://nyti.ms/2EEQVbv",,,,1106082031673335812,https://twitter.com/JoshBeckerSV/status/1106082031673335812
2019-03-05 11:50:20,JoshBeckerSV,dilawar,0,0,1,"Fantastic!!!",,,,1102899141053575168,https://twitter.com/JoshBeckerSV/status/1102899141053575168
2019-03-05 11:47:16,JoshBeckerSV,,0,0,0,"H.I.V. Is Reported Cured in a Second Patient, a Milestone in the Global AIDS Epidemic https://nyti.ms/2EMBHRC",,,,1102898366936100864,https://twitter.com/JoshBeckerSV/status/1102898366936100864
