date,username,to,replies,retweets,favorites,text,geo,mentions,hashtags,id,permalink
2019-10-29 03:31:58,JoshBeckerSV,,0,0,0,"State Court Bars Using North Carolina House Map in 2020 Elections",,,,1189022033549680640,https://twitter.com/JoshBeckerSV/status/1189022033549680640
2019-10-28 21:30:10,JoshBeckerSV,,0,0,0,"Looking forward to seeing folks tomorrow at Unite! Full Circle Fund presents UNITE 2019: Innovation for All Tickets, Tue, Oct 29, 2019 at 5:30 PM | Eventbrite",,,,1188930984957353989,https://twitter.com/JoshBeckerSV/status/1188930984957353989
2019-10-28 11:32:44,JoshBeckerSV,,1,0,1,"“PG&E is a failure at every level,” said State Senator Jerry Hill, a Bay Area Democrat who said the courts should take control of the company. “PG&E should no longer be allowed to do business in California.”",,,,1188780633742548992,https://twitter.com/JoshBeckerSV/status/1188780633742548992
2019-10-28 11:25:43,JoshBeckerSV,evan_adams,0,0,0,"Those pictures were crazy!",,,,1188778867118481409,https://twitter.com/JoshBeckerSV/status/1188778867118481409
2019-10-24 21:35:32,JoshBeckerSV,,0,0,1,"Hearing from Stanford Prof Jennifer Eberhardt and my friend Daryl Dodson about implicit racial bias and it’s effect on the entrepreneurial ecosystem. Thank you Miriam Rivera and Ulu Ventures for this important conversation and for a copy of Jennifer’s book.",,,,1187482782190071809,https://twitter.com/JoshBeckerSV/status/1187482782190071809
2019-10-22 18:54:26,JoshBeckerSV,LeighAnne3000,0,0,0,"great!",,,,1186717466119925760,https://twitter.com/JoshBeckerSV/status/1186717466119925760
2019-10-22 05:59:52,JoshBeckerSV,EricRodriguez,0,0,1,"Yes, thank you @MaureenFreschet",,@MaureenFreschet,,1186522538110664704,https://twitter.com/JoshBeckerSV/status/1186522538110664704
2019-10-22 05:08:08,JoshBeckerSV,,0,0,3,"Great to be in San Mateo celebrating Deputy Mayor ⁦@MaureenFreschet⁩ for her 8 years of tremendous dedicated and effective service on the San Mateo City Council. Many wonderful tributes to her! Thank you Maureen! Here with Councilmember ⁦@EricRodriguez⁩",,@MaureenFreschet @EricRodriguez,,1186509519330824193,https://twitter.com/JoshBeckerSV/status/1186509519330824193
2019-10-21 07:36:58,JoshBeckerSV,tonywest,0,0,2,"Happy Birthday Meena! (and congrats Dad)",,,,1186184586268573696,https://twitter.com/JoshBeckerSV/status/1186184586268573696
2019-10-21 07:36:23,JoshBeckerSV,bobambrogi,0,0,0,"It has worked for me!",,,,1186184441380519936,https://twitter.com/JoshBeckerSV/status/1186184441380519936
2019-10-20 16:43:33,JoshBeckerSV,,0,0,0,"Must read piece from Hamilton author...Alexander Hamilton pushed for impeachment powers. Donald Trump is what he had in mind. - The Washington Post",,,,1185959753207304192,https://twitter.com/JoshBeckerSV/status/1185959753207304192
2019-10-19 06:11:42,JoshBeckerSV,ronfriedmann,0,0,1,"Thanks Ron!",,,,1185438351752486914,https://twitter.com/JoshBeckerSV/status/1185438351752486914
2019-10-18 19:18:49,JoshBeckerSV,,0,0,0,"Great role open with my friend Patrick at CZI... Job Application for Associate, Criminal Justice Reform at Chan Zuckerberg Initiative",,,,1185274050479677440,https://twitter.com/JoshBeckerSV/status/1185274050479677440
2019-10-17 06:06:22,JoshBeckerSV,,0,0,1,"Message to conspiracy theorists and hoaxers...Jury awards $450,000 to father of Sandy Hook victim in defamation case - The Washington Post",,,,1184712236826148865,https://twitter.com/JoshBeckerSV/status/1184712236826148865
2019-10-13 16:00:18,JoshBeckerSV,,0,0,0,"José Andrés: How we’ve served 1 million meals to Hurricane Dorian survivors in the Bahamas - The Washington Post",,,,1183412150989012992,https://twitter.com/JoshBeckerSV/status/1183412150989012992
2019-10-13 15:50:59,JoshBeckerSV,ChrisJZullo,0,0,0,"Extraordinary to see this laid out",,,,1183409807912398848,https://twitter.com/JoshBeckerSV/status/1183409807912398848
2019-10-12 04:47:59,JoshBeckerSV,GirlsWhoCode,0,0,1,"This is terrific. Go @GirlsWhoCode !",,@GirlsWhoCode,,1182880569232805890,https://twitter.com/JoshBeckerSV/status/1182880569232805890
2019-09-26 17:42:33,JoshBeckerSV,LexisNexis,0,0,1,"Rule Of Law, the driving mission of LexisNexis",,,,1177277291715448832,https://twitter.com/JoshBeckerSV/status/1177277291715448832
2019-09-26 17:41:35,JoshBeckerSV,RepSpeier,0,0,1,"Thank you @RepSpeier for focusing attention on this.",,@RepSpeier,,1177277047422377984,https://twitter.com/JoshBeckerSV/status/1177277047422377984
2019-09-24 21:12:15,JoshBeckerSV,,0,0,2,"Please see my OpEd in the Mercury News today. Opinion: Trump attacks California, clean cars and clean air",,,,1176605288192864256,https://twitter.com/JoshBeckerSV/status/1176605288192864256
2019-09-22 00:04:22,JoshBeckerSV,EricRodriguez,0,0,0,":)",,,,1175561440335261696,https://twitter.com/JoshBeckerSV/status/1175561440335261696
2019-09-22 00:04:08,JoshBeckerSV,alackerlyons,0,0,1,"Agree",,,,1175561381539667973,https://twitter.com/JoshBeckerSV/status/1175561381539667973
2019-09-22 00:03:41,JoshBeckerSV,LeighAnne3000,0,0,0,"Wow!",,,,1175561265755738112,https://twitter.com/JoshBeckerSV/status/1175561265755738112
2019-09-21 02:38:37,JoshBeckerSV,SupDavePine,0,0,1,"Must read piece on the future of Caltrain @SupDavePine",,@SupDavePine,,1175237868895137792,https://twitter.com/JoshBeckerSV/status/1175237868895137792
2019-09-20 02:50:28,JoshBeckerSV,,0,1,4,"⁦Celebrating the 125th Anniverary of San Mateo with trivia with the Mayor ⁦@DianePapan⁩ and Councilmember ⁦@EricRodriguez⁩ #SeptemberNightsonBStreet",,@DianePapan @EricRodriguez,#SeptemberNightsonBStreet,1174878462584049664,https://twitter.com/JoshBeckerSV/status/1174878462584049664
2019-09-18 16:20:23,JoshBeckerSV,twang,0,0,1,"That was so cool",,,,1174357510959980544,https://twitter.com/JoshBeckerSV/status/1174357510959980544
2019-09-18 16:20:08,JoshBeckerSV,eric_budin,0,0,1,"Congratulations! Exciting to have investment in this important area",,,,1174357446296367104,https://twitter.com/JoshBeckerSV/status/1174357446296367104
2019-09-18 16:19:09,JoshBeckerSV,SupDavePine,0,0,2,"Thank you to our Board of Supervisors for taking this action!! @SupDavePine @HorsleyBits @CaroleSanMateo @warrenslocum @davidcanepa",,@SupDavePine @HorsleyBits @CaroleSanMateo @warrenslocum @davidcanepa,,1174357201483227137,https://twitter.com/JoshBeckerSV/status/1174357201483227137
2019-09-18 06:59:39,JoshBeckerSV,,0,0,0,"UC to dump fossil fuels holdings in pension and endowment funds worth $83 billion - The San Diego Union-Tribune",,,,1174216396248682499,https://twitter.com/JoshBeckerSV/status/1174216396248682499
2019-09-16 07:17:48,JoshBeckerSV,,0,0,0,"Netanyahu’s Fate May Depend on Israeli Arab Voters. Will They Turn Out?",,,,1173496189821411329,https://twitter.com/JoshBeckerSV/status/1173496189821411329
2019-09-13 13:36:53,JoshBeckerSV,,0,0,0,"California college students struggle with costs, survey finds - Los Angeles Times",,,,1172504426302468102,https://twitter.com/JoshBeckerSV/status/1172504426302468102
2019-09-11 16:25:54,JoshBeckerSV,,0,0,0,"Dangerous new hot zones are spreading around the world",,,,1171822184332812288,https://twitter.com/JoshBeckerSV/status/1171822184332812288
2019-09-10 20:27:14,JoshBeckerSV,,0,0,1,"Please see my Op-ed today with @citizenross in the Daily Journal today!",,@CitizenRoss,,1171520526835019784,https://twitter.com/JoshBeckerSV/status/1171520526835019784
2019-09-10 18:08:41,JoshBeckerSV,LexisNexis,0,3,4,"Exciting group of legal innovators in the 4th round of our LexisNexis Accelerator program!!",,,,1171485661762686976,https://twitter.com/JoshBeckerSV/status/1171485661762686976
2019-09-07 13:52:34,JoshBeckerSV,,0,0,0,"Program To Erase Old Pot Charges Aids 58 California Counties - http://capradio.org #legaltech",,,#legaltech,1170334042249560064,https://twitter.com/JoshBeckerSV/status/1170334042249560064
2019-09-05 19:59:40,JoshBeckerSV,SupDavePine,0,0,0,"Can’t wait!",,,,1169701650547634176,https://twitter.com/JoshBeckerSV/status/1169701650547634176
2019-09-05 07:35:24,JoshBeckerSV,,0,0,0,"Three North Carolina Judges Step In Where the Supreme Court Refuses",,,,1169514352241594369,https://twitter.com/JoshBeckerSV/status/1169514352241594369
2019-09-05 07:34:40,JoshBeckerSV,,0,0,0,"Opinion | That Assault Weapon Ban? It Really Did Work - The New York Times",,,,1169514167360876544,https://twitter.com/JoshBeckerSV/status/1169514167360876544
2019-09-03 18:20:07,JoshBeckerSV,,0,0,0,"Walmart ends all handgun ammunition sales and asks customers not to carry guns into stores - CNN",,,,1168951823752990727,https://twitter.com/JoshBeckerSV/status/1168951823752990727
2019-09-03 17:53:04,JoshBeckerSV,,0,0,5,"So this was my Fortune last night :-)",,,,1168945016393351175,https://twitter.com/JoshBeckerSV/status/1168945016393351175
2019-09-02 07:29:25,JoshBeckerSV,,0,0,1,"Test of UBI...Springboard to Opportunities program in Jackson, Miss., gives moms $1,000 a month as part of a “universal basic income” experiment - The Washington Post",,,,1168425681832697857,https://twitter.com/JoshBeckerSV/status/1168425681832697857
2019-08-28 02:42:33,JoshBeckerSV,,0,0,0,"Lots of good information at HLC panel tonight on Inclusionary Zoning. San Mateo County lost 78% of state and federal funding for housing production from FY08/09 to FY 17/18",,,,1166541549565435904,https://twitter.com/JoshBeckerSV/status/1166541549565435904
2019-08-27 03:33:45,JoshBeckerSV,SupCindyChavez,0,0,0,"Thanks @SupCindyChavez and team for organizing a terrific Women’s Equality Day march/celebration kicking off a year of activities!",,@SupCindyChavez,,1166192048061345794,https://twitter.com/JoshBeckerSV/status/1166192048061345794
2019-08-27 03:17:27,JoshBeckerSV,,0,0,0,"Big news: Johnson & Johnson Ordered to Pay $572 Million in Landmark Opioid Trial - The New York Times",,,,1166187945100861440,https://twitter.com/JoshBeckerSV/status/1166187945100861440
2019-08-25 01:05:34,JoshBeckerSV,JonMays,0,0,1,"My gmail is at about 300,000 :-)",,,,1165429980718743552,https://twitter.com/JoshBeckerSV/status/1165429980718743552
2019-08-25 01:04:46,JoshBeckerSV,JonMays,0,0,0,"Impressed!!",,,,1165429779467624448,https://twitter.com/JoshBeckerSV/status/1165429779467624448
2019-08-25 01:00:40,JoshBeckerSV,David_Lark,0,0,1,"Signed this petition and donated",,,,1165428746993590272,https://twitter.com/JoshBeckerSV/status/1165428746993590272
2019-08-21 20:58:05,JoshBeckerSV,alackerlyons,0,0,1,"Need to improve CA!!",,,,1164280534932971520,https://twitter.com/JoshBeckerSV/status/1164280534932971520
2019-08-21 16:06:58,JoshBeckerSV,dpatil,0,0,1,"Go DJ and team!",,,,1164207272098054145,https://twitter.com/JoshBeckerSV/status/1164207272098054145
2019-08-21 16:05:42,JoshBeckerSV,peterdelevett,0,0,1,"I hear you!",,,,1164206953259626498,https://twitter.com/JoshBeckerSV/status/1164206953259626498
2019-08-21 16:05:11,JoshBeckerSV,Lenny_Mendonca,0,0,1,"More reasons I’m proud of our work at UC Merced",,,,1164206824821624832,https://twitter.com/JoshBeckerSV/status/1164206824821624832
2019-08-21 15:35:31,JoshBeckerSV,,0,0,2,"California has 5x more clean energy jobs than fossil fuel jobs",,,,1164199358268502016,https://twitter.com/JoshBeckerSV/status/1164199358268502016
2019-08-21 15:09:47,JoshBeckerSV,CaroleSanMateo,0,0,0,"Yes, Best Wishes Maureen and thank you for your dedicated and effective service!!",,,,1164192884020535303,https://twitter.com/JoshBeckerSV/status/1164192884020535303
2019-08-20 23:01:04,JoshBeckerSV,,0,0,0,"Great piece: did you know 29% of physicians are foreign born? Stephen Miller is right about immigration — but not in the way that he means - The Washington Post",,,,1163949096991772673,https://twitter.com/JoshBeckerSV/status/1163949096991772673
2019-08-20 05:01:34,JoshBeckerSV,,0,0,1,"Interesting! Distracted students? San Mateo High is locking up cell phones",,,,1163677432722837504,https://twitter.com/JoshBeckerSV/status/1163677432722837504
2019-08-19 23:46:30,JoshBeckerSV,,0,0,0,"Great story: Fan who signed with A's, Nathan Patterson, strikes out side in minor league debut https://www.usatoday.com/story/sports/mlb/athletics/2019/08/18/mlb-nathan-patterson-fans-three-oakland-as-minor-league-debut/2047016001/ via @usatoday",,@USATODAY,,1163598142530392065,https://twitter.com/JoshBeckerSV/status/1163598142530392065
2019-08-19 04:19:21,JoshBeckerSV,,0,0,0,"If anyone had listened this could have been stopped much earlier... A Nun, a Doctor and a Lawyer — and Deep Regret Over the Nation’s Handling of Opioids - The New York Times",,,,1163304419158396929,https://twitter.com/JoshBeckerSV/status/1163304419158396929
2019-08-18 16:38:31,JoshBeckerSV,,0,0,1,"Reading Bryan Stevenson in the New York Times today. We represent 4% of the planets population but 22% of it’s imprisoned",,,,1163128048461369347,https://twitter.com/JoshBeckerSV/status/1163128048461369347
2019-08-18 16:37:37,JoshBeckerSV,drogier,0,0,0,"I do ‘2’ :-) . I see folks do ‘1’ all the time,",,,,1163127823583739904,https://twitter.com/JoshBeckerSV/status/1163127823583739904
2019-08-15 15:10:16,JoshBeckerSV,,0,0,0,"National college dropout rates are a scandal, UC author says http://edsource.org/?page_id=616248 via @edsource",,@EdSource,,1162018676305887232,https://twitter.com/JoshBeckerSV/status/1162018676305887232
2019-08-12 07:34:05,JoshBeckerSV,ASDem,0,0,1,"This is incredible",,,,1160816710204575744,https://twitter.com/JoshBeckerSV/status/1160816710204575744
2019-08-12 02:28:19,JoshBeckerSV,,0,0,0,"This shows the craziness of our health care system: A Mexican Hospital, an American Surgeon, and a $5,000 Check (Yes, a Check)",,,,1160739760391933952,https://twitter.com/JoshBeckerSV/status/1160739760391933952
2019-08-09 06:26:52,JoshBeckerSV,SupDavePine,0,0,0,"Love that there is an Inclusion Fest! Congrats to Magical Bridge",,,,1159712633534070784,https://twitter.com/JoshBeckerSV/status/1159712633534070784
2019-07-26 08:42:56,JoshBeckerSV,,0,0,0,"Equifax owes you a lot more, but here’s how to get $125 from this week’s settlement - The Verge",,,,1154673443838672896,https://twitter.com/JoshBeckerSV/status/1154673443838672896
2019-07-26 07:54:26,JoshBeckerSV,,0,0,0,"Piper Kerman: I hope “Orange Is the New Black” will prove how dysfunctional our criminal justice system is - The Washington Post",,,,1154661237201879040,https://twitter.com/JoshBeckerSV/status/1154661237201879040
2019-07-21 04:41:44,JoshBeckerSV,,0,0,0,"This is amazing!!",,,,1152800802773188609,https://twitter.com/JoshBeckerSV/status/1152800802773188609
2019-07-20 21:42:51,JoshBeckerSV,Ash_Kalra,0,0,2,"Great to see you!",,,,1152695389671133184,https://twitter.com/JoshBeckerSV/status/1152695389671133184
2019-07-20 13:42:00,JoshBeckerSV,Lenny_Mendonca,0,0,1,"Good piece about growth in Bakersfield",,,,1152574378116182018,https://twitter.com/JoshBeckerSV/status/1152574378116182018
2019-07-18 08:04:29,JoshBeckerSV,SupDavePine,0,0,0,"Innovative thinking...",,,,1151764664319037440,https://twitter.com/JoshBeckerSV/status/1151764664319037440
2019-07-15 19:12:36,JoshBeckerSV,dgp,0,0,0,"Yes!",,,,1150845639741333504,https://twitter.com/JoshBeckerSV/status/1150845639741333504
2019-07-15 14:24:43,JoshBeckerSV,JeffPfeifer,0,0,1,"Looking to make the law more transparent/efficient/better? Increase access to the law? Have a new analytics tool? The next cohort of our Legal Tech Accelerator is taking applications...",,,,1150773191067017216,https://twitter.com/JoshBeckerSV/status/1150773191067017216
2019-07-14 17:47:08,JoshBeckerSV,RepSpeier,0,0,3,"Breaks my heart. Makes me think about the kids I taught in El Salvador and kids I was just with in Guatemala.",,,,1150461740909551616,https://twitter.com/JoshBeckerSV/status/1150461740909551616
2019-07-13 16:05:48,JoshBeckerSV,JonMays,0,0,0,"Makes sense!",,,,1150073854162640896,https://twitter.com/JoshBeckerSV/status/1150073854162640896
2019-07-13 16:05:11,JoshBeckerSV,AllisonMetro,0,0,0,"Excellent!",,,,1150073696997920770,https://twitter.com/JoshBeckerSV/status/1150073696997920770
2019-07-13 16:04:43,JoshBeckerSV,,1,0,1,"It is time to explore new ideas: Radical thinking needed to solve South Bay traffic woes https://bayareane.ws/2YCjTR3 via @mercnews",,@mercnews,,1150073579511246849,https://twitter.com/JoshBeckerSV/status/1150073579511246849
2019-07-12 07:04:07,JoshBeckerSV,LANow,0,0,0,"Need to prepare",,,,1149575144307712001,https://twitter.com/JoshBeckerSV/status/1149575144307712001
2019-07-11 05:15:26,JoshBeckerSV,JohnWoodell,0,0,1,"Good comparison!",,,,1149185405704531969,https://twitter.com/JoshBeckerSV/status/1149185405704531969
2019-07-11 04:29:00,JoshBeckerSV,,1,0,0,"Doesn’t it seem that money often spills out of Armored Trucks meant to secure money...An Armored Truck Spilled Thousands of Dollars on an Atlanta Highway. What Would You Do?",,,,1149173721464049664,https://twitter.com/JoshBeckerSV/status/1149173721464049664
2019-07-09 04:06:32,JoshBeckerSV,,0,0,0,"Excited the Warriors got former Villanova Wildcat, Omari Spellman (joining teammate Eric Paschall). He’s a big guy who can rebound, block shots and has a sweet stroke from the outside. A lot to like. #NovaNation #Warriors",,,#NovaNation #Warriors,1148443292725477376,https://twitter.com/JoshBeckerSV/status/1148443292725477376
2019-07-09 03:47:46,JoshBeckerSV,,0,0,0,"Seems like an Onion headline but this is sick stuff...Former ICE Chief Counsel Gets 4 Years In Prison For Stealing Immigrants' Identities : NPR",,,,1148438569490325504,https://twitter.com/JoshBeckerSV/status/1148438569490325504
2019-07-09 00:59:28,JoshBeckerSV,sanmateoco,0,0,0,"Great resource here...",,,,1148396215094038528,https://twitter.com/JoshBeckerSV/status/1148396215094038528
2019-07-05 21:54:41,JoshBeckerSV,,0,0,0,"The future of America was on display in Alaska this week, not D.C. - The Washington Post",,,,1147262547852029952,https://twitter.com/JoshBeckerSV/status/1147262547852029952
2019-07-05 21:50:28,JoshBeckerSV,innocence,0,0,0,"Just watched the trailer and looking forward to the series",,,,1147261486961582080,https://twitter.com/JoshBeckerSV/status/1147261486961582080
2019-07-03 18:27:34,JoshBeckerSV,dgp,0,0,0,"Don’t cross the streams",,,,1146485650075504641,https://twitter.com/JoshBeckerSV/status/1146485650075504641
2019-07-03 17:30:12,JoshBeckerSV,,0,0,0,"A tip from the highway patrol: Carpooling with the dead doesn't mean you get to use the HOV lane",,,,1146471215726391296,https://twitter.com/JoshBeckerSV/status/1146471215726391296
2019-07-02 14:14:59,JoshBeckerSV,,0,0,0,"30 for 30: The Good, The Bad, The Hungry - Trailer",,,,1146059700145799181,https://twitter.com/JoshBeckerSV/status/1146059700145799181
2019-07-02 04:44:59,JoshBeckerSV,senrobportman,0,0,2,"This is something I know a little bit about, making court records accessible!!!",,,,1145916253560639488,https://twitter.com/JoshBeckerSV/status/1145916253560639488
2019-07-01 20:08:43,JoshBeckerSV,evan_adams,1,1,8,"Thank you for posting. Yes he should resign!",,,,1145786328660922369,https://twitter.com/JoshBeckerSV/status/1145786328660922369
2019-06-25 14:39:39,JoshBeckerSV,SMCPolitical,0,0,0,"Go @SupDavePine!",,@SupDavePine,,1143529190471262208,https://twitter.com/JoshBeckerSV/status/1143529190471262208
2019-06-24 22:10:07,JoshBeckerSV,Lenny_Mendonca,0,0,2,"Yes!",,,,1143280167680299011,https://twitter.com/JoshBeckerSV/status/1143280167680299011
2019-06-20 04:47:53,JoshBeckerSV,,0,0,0,"Great true life story. People are good..Hedge fund founder says Colts' Kenny Moore saved a dog's life, and by extension, his son's https://sports.yahoo.com/heartwarming-hedge-fund-founder-says-colts-kenny-moore-saved-a-dogs-life-and-by-extension-his-sons-154453867.html?soc_src=community&amp;soc_trk=tw via @YahooSports",,@YahooSports,,1141568327300472832,https://twitter.com/JoshBeckerSV/status/1141568327300472832
2019-06-19 13:22:39,JoshBeckerSV,,0,0,0,"Fascinating....18 Questions. 21 Candidates. Here’s What They Said.",,,,1141335485760995328,https://twitter.com/JoshBeckerSV/status/1141335485760995328
2019-06-19 04:00:48,JoshBeckerSV,,0,0,1,"And you think you are working hard...In Japan, It’s a Riveting TV Plot: Can a Worker Go Home on Time? - The New York Times",,,,1141194091436244992,https://twitter.com/JoshBeckerSV/status/1141194091436244992
2019-06-18 04:59:16,JoshBeckerSV,,0,0,0,"Comedian Wins $4.1 Million in Lawsuit Against The Daily Stormer",,,,1140846418925510657,https://twitter.com/JoshBeckerSV/status/1140846418925510657
2019-06-17 23:26:41,JoshBeckerSV,bgarlinghouse,0,0,0,"Congrats!!",,,,1140762721232625664,https://twitter.com/JoshBeckerSV/status/1140762721232625664
2019-06-14 04:36:04,JoshBeckerSV,SupDavePine,0,0,0,"Weigh in on projects for Measure W funding!",,,,1139391026227867648,https://twitter.com/JoshBeckerSV/status/1139391026227867648
2019-06-12 06:21:54,JoshBeckerSV,Erika_D_Smith,0,0,0,"Imp piece",,,,1138692885962878977,https://twitter.com/JoshBeckerSV/status/1138692885962878977
2019-06-10 03:41:03,JoshBeckerSV,Lenny_Mendonca,0,1,4,"Let’s build a world-class transit system in the Bat Area!",,,,1137927631565836288,https://twitter.com/JoshBeckerSV/status/1137927631565836288
2019-06-10 03:39:46,JoshBeckerSV,,0,0,0,"Prayers for Big Papi! Red Sox legend Ortiz shot in DR, father says",,,,1137927307966918657,https://twitter.com/JoshBeckerSV/status/1137927307966918657
2019-06-08 20:21:00,JoshBeckerSV,,0,0,0,"This is crazy: “Can’t pay their bills with love”: In many teaching jobs, teachers’ salaries can’t cover rent - USA TODAY",,,,1137454498941554688,https://twitter.com/JoshBeckerSV/status/1137454498941554688
2019-06-08 19:36:11,JoshBeckerSV,vicetorr,0,0,0,"Check out this Living Wage Calculator",,,,1137443223092121600,https://twitter.com/JoshBeckerSV/status/1137443223092121600
2019-06-08 14:07:40,JoshBeckerSV,,0,0,0,"Looks like a neat design! South San Francisco officials admire new Civic Center https://www.smdailyjournal.com/news/local/south-san-francisco-officials-admire-new-civic-center/article_b832cf1e-8994-11e9-85b5-7f80a9c2c633.html?utm_medium=social&amp;utm_source=twitter&amp;utm_campaign=user-share via @smdailyjournal",,@smdailyjournal,,1137360546359988225,https://twitter.com/JoshBeckerSV/status/1137360546359988225
2019-06-08 14:05:21,JoshBeckerSV,,0,0,0,"San Mateo County fair starts today! https://www.smdailyjournal.com/arts_and_entertainment/san-mateo-county-fair-returns/article_b6c09b5c-8994-11e9-8081-57db4750a584.html?utm_medium=social&amp;utm_source=twitter&amp;utm_campaign=user-share via @smdailyjournal",,@smdailyjournal,,1137359963217489921,https://twitter.com/JoshBeckerSV/status/1137359963217489921
2019-06-06 23:21:15,JoshBeckerSV,,0,0,0,"Automakers Say Trump Pollution Rules Could Mean ‘Untenable’ Instability and Lower Profits",,,,1136775085136572416,https://twitter.com/JoshBeckerSV/status/1136775085136572416
2019-06-06 06:51:34,JoshBeckerSV,,0,0,1,"Learning What Vets Could Not Tell: What They Did in World War II",,,,1136526023690866688,https://twitter.com/JoshBeckerSV/status/1136526023690866688
2019-06-06 05:52:12,JoshBeckerSV,,0,0,0,"Solar panels at its high schools should save Capistrano Unified School District millions over the next two decades",,,,1136511082636357632,https://twitter.com/JoshBeckerSV/status/1136511082636357632
2019-06-03 05:24:20,JoshBeckerSV,Chasten,0,0,1,"This was from event I was at today. Funny moment!",,,,1135416905701834754,https://twitter.com/JoshBeckerSV/status/1135416905701834754
2019-06-02 07:56:54,JoshBeckerSV,,0,0,0,"What I Learned Leading the Tiananmen Protests",,,,1135092913086406656,https://twitter.com/JoshBeckerSV/status/1135092913086406656
2019-06-01 18:56:16,JoshBeckerSV,,0,0,3,"Great to see my longtime friend from many climate battles @JayInslee. His 58 page proposal on #climatechange is something I hope all candidates will support #CADem2019",,@JayInslee,#climatechange #CADem2019,1134896461026435072,https://twitter.com/JoshBeckerSV/status/1134896461026435072
2019-06-01 15:48:04,JoshBeckerSV,,0,0,0,"Does ‘Never Again!’ mean anything if we do nothing about China’s concentration camps? | Will Bunch",,,,1134849100631891969,https://twitter.com/JoshBeckerSV/status/1134849100631891969
2019-06-01 08:41:56,JoshBeckerSV,,0,0,0,"Check out the words they had to spell in the last round…National Spelling Bee, at a Loss for Words, Crowns 8 Co-Champions",,,,1134741861745082368,https://twitter.com/JoshBeckerSV/status/1134741861745082368
2019-05-31 05:37:54,JoshBeckerSV,PodcastbytheBay,1,0,6,"Thanks @PodcastbytheBay for the opportunity to share some thoughts and ideas!",,@PodcastbytheBay,,1134333159233937409,https://twitter.com/JoshBeckerSV/status/1134333159233937409
2019-05-30 22:52:32,JoshBeckerSV,,0,0,4,"Excited to be doing a Q&A with @Lenny_Mendonca at the GSB today after his class on US Inequality",,@Lenny_Mendonca,,1134231143291604992,https://twitter.com/JoshBeckerSV/status/1134231143291604992
2019-05-29 06:11:14,JoshBeckerSV,,0,0,1,"Positive development: David Whitley, Texas Secretary of State, Resigns After Questioning Voters’ Citizenship",,,,1133616769891856384,https://twitter.com/JoshBeckerSV/status/1133616769891856384
2019-05-27 14:17:27,JoshBeckerSV,Lenny_Mendonca,0,0,2,"Imp piece on student loan debt",,,,1133014354134048773,https://twitter.com/JoshBeckerSV/status/1133014354134048773
2019-05-27 06:56:39,JoshBeckerSV,edxavez,0,0,1,"What a terrific event!!",,,,1132903425975308290,https://twitter.com/JoshBeckerSV/status/1132903425975308290
2019-05-20 07:57:06,JoshBeckerSV,eugene_zhang,0,0,0,"Did your son graduate already???",,,,1130381924227092481,https://twitter.com/JoshBeckerSV/status/1130381924227092481
2019-05-18 06:12:14,JoshBeckerSV,,0,0,2,"West Point graduates largest class of black women",,,,1129630756051906566,https://twitter.com/JoshBeckerSV/status/1129630756051906566
