date,username,to,replies,retweets,favorites,text,geo,mentions,hashtags,id,permalink
2019-04-27 08:16:32,mariacadenas,,0,0,0,"Fallece Rocío González, reconocida escritora y poeta zapoteca - La Jornada http://www.jornada.com.mx/ultimas/2019/04/25/fallece-rocio-gonzalez-escritora-y-poeta-oaxaquena-216.html",,,,1122051893428047872,https://twitter.com/mariacadenas/status/1122051893428047872
2019-04-26 19:31:34,mariacadenas,,0,0,2,"Seeing my fellow @womensfoundca #WPI sister at #LIVEPajaroValley",,@womensfoundca,#WPI #LIVEPajaroValley,1121859382822625280,https://twitter.com/mariacadenas/status/1121859382822625280
2019-04-26 16:15:34,mariacadenas,Lesbicanarias,0,0,0,"Gracias!",,,,1121810057404903424,https://twitter.com/mariacadenas/status/1121810057404903424
2019-04-26 03:57:03,mariacadenas,KamalaHarris,0,0,0,"Say it loud @KamalaHarris",,@KamalaHarris,,1121624205265494022,https://twitter.com/mariacadenas/status/1121624205265494022
2019-04-26 00:39:39,mariacadenas,,0,3,1,"Soledad Pastorutti Live in Concert — Brava for Women in the Arts",,,,1121574527308189696,https://twitter.com/mariacadenas/status/1121574527308189696
2019-04-25 02:28:22,mariacadenas,Lesbicanarias,0,0,0,"Exactamente",,,,1121239496572321792,https://twitter.com/mariacadenas/status/1121239496572321792
2019-04-24 17:06:50,mariacadenas,Maria_Hinojosa,1,2,13,"#IAmStillHere “I’m still here, cabrones!” @Maria_Hinojosa You just made my day. Thank you!",,@Maria_Hinojosa,#IAmStillHere,1121098181754757120,https://twitter.com/mariacadenas/status/1121098181754757120
2019-04-24 04:10:45,mariacadenas,,0,0,0,"The company that sells love to America had a dark secret - The New York Times https://apple.news/AwPtCZFkpRcyiLiCqpuKecQ",,,,1120902875658346496,https://twitter.com/mariacadenas/status/1120902875658346496
2019-04-24 02:50:26,mariacadenas,SCCVonline,0,0,0,"We are on our way #SantaCruzCounty !",,,#SantaCruzCounty,1120882664855072769,https://twitter.com/mariacadenas/status/1120882664855072769
2019-04-21 03:43:52,mariacadenas,politico,0,0,0,"Not caging kids and stopping the kidnapping of asylum seekers is top priority #FamiliesBelongTogether",,,#FamiliesBelongTogether,1119808947748102145,https://twitter.com/mariacadenas/status/1119808947748102145
2019-04-20 13:06:41,mariacadenas,,0,0,0,"Mortgage Lenders 73% More Likely to Deny Gay Borrowers: Study - Bloomberg https://www.bloomberg.com/news/articles/2019-04-16/u-s-mortgage-lenders-are-73-more-likely-to-deny-gay-borrowers",,,,1119588195610402817,https://twitter.com/mariacadenas/status/1119588195610402817
2019-04-20 12:57:42,mariacadenas,,0,0,0,"HUD moves to crack down on undocumented immigrants in public housing - ⁦@politico⁩ https://www.politico.com/story/2019/04/18/hud-immigrants-public-housing-1367559",,@politico,,1119585933223809025,https://twitter.com/mariacadenas/status/1119585933223809025
2019-04-20 12:50:18,mariacadenas,,0,1,1,"Progressive Capitalism Is Not an Oxymoron https://nyti.ms/2GpsQoQ",,,,1119584073276514305,https://twitter.com/mariacadenas/status/1119584073276514305
2019-04-20 12:38:47,mariacadenas,,0,0,0,"“Kamala Harris CNN Town Hall Watching Party” in Santa Cruz https://www.mobilize.us/kamalaharris/event/90565/?referring_vol=512346&amp;rname=Maria&amp;share_context=signup-form-modal&amp;share_medium=twitter&amp;timeslot=539498&amp;utm_campaign=190422cnntownhall&amp;utm_medium=email&amp;utm_source=190418dist-email",,,,1119581175587016705,https://twitter.com/mariacadenas/status/1119581175587016705
2019-04-20 02:14:20,mariacadenas,,0,0,0,"Bumble - We're Launching Bumble Fund to Invest in Women Founders https://bumble.com/the-buzz/bumble-fund/",,,,1119424025455783936,https://twitter.com/mariacadenas/status/1119424025455783936
2019-04-20 01:17:46,mariacadenas,,0,0,0,"Student, Sales Clerk, New Mom: This 20-Year-Old Is Not Your Average City Council Member https://www.kqed.org/news/11734152/student-sales-clerk-new-mom-this-20-year-old-is-not-your-average-city-council-member",,,,1119409789765705729,https://twitter.com/mariacadenas/status/1119409789765705729
2019-04-18 03:22:12,mariacadenas,NPR,0,0,0,"This applies to most nonprofits and organizations",,,,1118716328024494080,https://twitter.com/mariacadenas/status/1118716328024494080
2019-04-18 03:18:49,mariacadenas,IAImpactFund,0,1,1,"Congratulations @KamalaHarris #Harris2020",,@KamalaHarris,#Harris2020,1118715478367543296,https://twitter.com/mariacadenas/status/1118715478367543296
2019-04-17 03:49:20,mariacadenas,,0,0,0,"In New Effort to Deter Migrants, Barr Withholds Bail to Asylum Seekers https://nyti.ms/2VNbEjy",,,,1118360772050968576,https://twitter.com/mariacadenas/status/1118360772050968576
2019-04-16 20:54:13,mariacadenas,,0,0,0,"En medio de un “mini-concierto” de @Al3jandraGuzman en la oficina...su música siempre me salva! Gracias, mi Ale.",,@Al3jandraGuzman,,1118256303938269184,https://twitter.com/mariacadenas/status/1118256303938269184
2019-04-16 19:17:49,mariacadenas,,0,0,0,"Reimagining the Economy: The Social Justice Enterprise - Non Profit News | Nonprofit Quarterly",,,,1118232043899383808,https://twitter.com/mariacadenas/status/1118232043899383808
2019-04-16 17:43:48,mariacadenas,,0,0,0,"Mis Favoritas de #LaVozUS son #LaVozMava #LaVozMayre #LaVozDunia y #LaVozGenesis",,,#LaVozUS #LaVozMava #LaVozMayre #LaVozDunia #LaVozGenesis,1118208384388308992,https://twitter.com/mariacadenas/status/1118208384388308992
2019-04-14 06:04:24,mariacadenas,,0,0,0,"Someone just parked in front of my house and is blasting @RomeoSantosPage ...I'll accept my unexpected serenata.",,@RomeoSantosPage,,1117307599399964672,https://twitter.com/mariacadenas/status/1117307599399964672
2019-04-13 14:41:14,mariacadenas,,0,0,0,"Canción del día https://www.youtube.com/watch?v=iovlKJkW8zI&amp;feature=share",,,,1117075275425009664,https://twitter.com/mariacadenas/status/1117075275425009664
2019-04-13 01:05:04,mariacadenas,KamalaHarris,0,0,0,"Go @KamalaHarris !",,@KamalaHarris,,1116869880471416834,https://twitter.com/mariacadenas/status/1116869880471416834
2019-04-12 18:28:50,mariacadenas,,0,0,0,"Gloria Gaynor – Amazing Grace [Official Audio] https://youtu.be/eH6hR7nJTss via @YouTube",,@YouTube,,1116770165440385024,https://twitter.com/mariacadenas/status/1116770165440385024
2019-04-12 17:38:27,mariacadenas,,0,0,0,"We needed this! https://www.latinxtherapistsactionnetwork.org/home",,,,1116757483458924545,https://twitter.com/mariacadenas/status/1116757483458924545
2019-04-12 17:02:31,mariacadenas,,0,0,0,"So much hate and harm from this administration. #Resist https://apple.news/Aog5Tfq11T9-BVQvUxI7zZg",,,#Resist,1116748443207135232,https://twitter.com/mariacadenas/status/1116748443207135232
2019-04-12 04:08:48,mariacadenas,,0,1,1,"“Using human beings — including little children — as pawns in their warped game to perpetuate fear and demonize immigrants is despicable” https://apple.news/ATheIE0zfRtSEGGRKzl6v3g",,,,1116553731003146241,https://twitter.com/mariacadenas/status/1116553731003146241
2019-04-11 14:50:47,mariacadenas,,0,0,0,"BBC News - Katie Bouman: The woman behind the first black hole image https://www.bbc.com/news/science-environment-47891902",,,,1116352903340363776,https://twitter.com/mariacadenas/status/1116352903340363776
2019-04-11 07:05:48,mariacadenas,LaVozUS,0,0,0,"Fue espectacular! #LaVozMayre",,,#LaVozMayre,1116235886843195392,https://twitter.com/mariacadenas/status/1116235886843195392
2019-04-11 07:04:36,mariacadenas,,0,0,0,"According to the 2019 World Happiness Report, negative feelings are rising around the world—and the United States is particularly hard hit with an “epidemic of addictions.” https://www.yesmagazine.org/happiness/health-world-happiness-report-reveals-most-satisfied-countries-20190402 via @yesmagazine",,@yesmagazine,,1116235582416408577,https://twitter.com/mariacadenas/status/1116235582416408577
2019-04-10 23:32:20,mariacadenas,,0,0,0,"Trump Wants Former “Hate Group” Leader for Top Immigration Job - Vanity Fair https://apple.news/A75ku0y42RFGGcD2XZ159oQ",,,,1116121768714858496,https://twitter.com/mariacadenas/status/1116121768714858496
2019-04-10 22:36:41,mariacadenas,,0,0,1,"'The Farmworkers Who Pick Your Halo Mandarins Just Organized a Massive Labor Strike' via Civil Eats - https://civileats.com/2019/04/08/the-farmworkers-who-pick-your-halo-mandarins-just-organized-a-massive-labor-strike-wonderful-company/",,,,1116107764101574656,https://twitter.com/mariacadenas/status/1116107764101574656
2019-04-10 16:22:03,mariacadenas,,0,1,1,"Happy @DoloresHuerta Day! Organize, mobilize, and fight for justice!",,@DoloresHuerta,,1116013482011271168,https://twitter.com/mariacadenas/status/1116013482011271168
2019-04-09 20:48:14,mariacadenas,,1,0,0,"Trump hotels exempted from ban on foreign payments under new stance | US news | The Guardian https://www.theguardian.com/us-news/2019/apr/09/dojs-new-stance-on-foreign-payments-or-gifts-to-trump-blurs-lines-experts",,,,1115718082352128000,https://twitter.com/mariacadenas/status/1115718082352128000
2019-04-09 15:05:39,mariacadenas,,0,0,0,"Photos of Lesbian Lives Meant to Inspire a Movement - The New York Times https://www.nytimes.com/2019/04/08/lens/lesbian-lives-movement-jeb.html",,,,1115631869280653312,https://twitter.com/mariacadenas/status/1115631869280653312
2019-04-09 15:04:48,mariacadenas,,0,0,1,"Photos of Lesbian Lives Meant to Inspire a Movement - The New York Times https://www.nytimes.com/2019/04/08/lens/lesbian-lives-movement-jeb.html",,,,1115631655895437313,https://twitter.com/mariacadenas/status/1115631655895437313
2019-04-09 13:54:02,mariacadenas,,0,0,0,"La activista Dolores Huerta cumple años y habló con Telemundo https://www.telemundo.com/noticias/2019/04/07/la-activista-dolores-huerta-cumple-anos-y-hablo-con-telemundo?fbclid=IwAR1gxQ7jNfvBGacC3uKmNcbrP2ERslhVQPSM6OrJaboJMumDvdUUpo_qF_I",,,,1115613847425966081,https://twitter.com/mariacadenas/status/1115613847425966081
2019-04-09 02:35:48,mariacadenas,,0,0,0,"Billionaires call for changes to capitalism, starting with higher taxes on themselves - CNBC https://apple.news/A8Q4aeTL6Sh2TBNZ4A1bKag",,,,1115443161545887744,https://twitter.com/mariacadenas/status/1115443161545887744
2019-04-08 20:46:28,mariacadenas,,0,0,0,"‘License to Discriminate’: Texas Senate Advances Anti-LGBTQ Bill https://www.texasobserver.org/sb-17-license-to-discrimate-passes-senate-lgbtq/",,,,1115355251702243328,https://twitter.com/mariacadenas/status/1115355251702243328
2019-04-08 20:11:06,mariacadenas,,0,0,0,"Viste a #mayremartinez en #LaVozUS? WOW! #LaVozUsMayre https://youtu.be/Cbv-vt1_bdA",,,#mayremartinez #LaVozUS #LaVozUsMayre,1115346348876881921,https://twitter.com/mariacadenas/status/1115346348876881921
2019-04-08 14:18:03,mariacadenas,,0,0,0,"Virgin Australia ends deal with Royal Brunei Airlines after country introduces anti-LGBT+ laws | The Independent https://www.independent.co.uk/travel/news-and-advice/virgin-australia-royal-brunei-airlines-lgbt-gay-stoning-a8854251.html",,,,1115257503569203200,https://twitter.com/mariacadenas/status/1115257503569203200
2019-04-08 05:15:40,mariacadenas,,0,0,1,"Vegan Chef Uses Indigenous Ingredients to Decolonize Mexican Food https://hiplatina.com/vegan-chef-decolonizes-mexican-food/?fbclid=IwAR06tawDRAQsxUi2PBv_A4Sace-iy_otTLLQ2Q1V0tGCw1T_A5DJ5zCCuVk",,,,1115121006077550592,https://twitter.com/mariacadenas/status/1115121006077550592
2019-04-08 02:22:05,mariacadenas,,0,0,0,"U.S. Says It Could Take 2 Years to Identify Up to Thousands of Separated Immigrant Families - The New York Times",,,,1115077321612861441,https://twitter.com/mariacadenas/status/1115077321612861441
2019-04-06 00:56:21,mariacadenas,,0,0,1,"Bill would streamline farmworker housing https://register-pajaronian.com/article/bill-would-streamline-farmworker-housing?fbclid=IwAR1R7JVX6Pg9k2L_18xaGB3DwcMSEvdq6KKpuz4q7a4_mEh0IPPvG-TSEFA",,,,1114330972944654336,https://twitter.com/mariacadenas/status/1114330972944654336
2019-04-02 17:56:01,mariacadenas,,0,0,0,"Plastic Bags to Be Banned in New York; Second Statewide Ban, After California - The New York Times https://www.nytimes.com/2019/03/28/nyregion/plastic-bag-ban-.html",,,,1113138026111152129,https://twitter.com/mariacadenas/status/1113138026111152129
2019-04-02 14:57:57,mariacadenas,,0,0,0,"America's Forgotten Mass Imprisonment of Women Believed to Be Sexually Immoral - HISTORY https://www.history.com/news/chamberlain-kahn-act-std-venereal-disease-imprisonment-women",,,,1113093215945547778,https://twitter.com/mariacadenas/status/1113093215945547778
2019-04-02 10:02:03,mariacadenas,,0,0,0,"The Supreme Court’s conservatives just legalized torture. https://slate.com/news-and-politics/2019/04/supreme-court-neil-gorsuch-eighth-amendment-death-penalty-torture.html",,,,1113018750746279936,https://twitter.com/mariacadenas/status/1113018750746279936
2019-03-31 00:19:39,mariacadenas,,0,0,0,"The U.S. Treasury Doesn't Care About Your Retirement - The Atlantic https://www.theatlantic.com/ideas/archive/2019/03/how-government-gave-retirement-security/585790/",,,,1112147406315905024,https://twitter.com/mariacadenas/status/1112147406315905024
2019-03-30 15:08:42,mariacadenas,,0,0,0,"An Awkward Kiss Changed How I Saw Joe Biden https://www.thecut.com/2019/03/an-awkward-kiss-changed-how-i-saw-joe-biden.html",,,,1112008757226016770,https://twitter.com/mariacadenas/status/1112008757226016770
2019-03-30 15:02:23,mariacadenas,,0,0,0,"What Happens If You Find Cameras in Your Airbnb - The Atlantic https://www.theatlantic.com/technology/archive/2019/03/what-happens-when-you-find-cameras-your-airbnb/585007/",,,,1112007166506885121,https://twitter.com/mariacadenas/status/1112007166506885121
2019-03-30 14:28:48,mariacadenas,,0,0,1,"Mexican Food Museum And Educational Kitchen To Open In Los Angeles https://www.forbes.com/sites/teresafinney/2019/01/28/mexican-food-museum-and-educational-kitchen-to-open-in-los-angeles/",,,,1111998716532056067,https://twitter.com/mariacadenas/status/1111998716532056067
2019-03-30 14:10:16,mariacadenas,,0,2,1,"Trump admin grants $1.7M to anti-abortion clinics, cuts funds to Planned Parenthood affiliates - The Hill https://apple.news/AGgcjSqhQRLCYc-Mtp-5Epw",,,,1111994053342617600,https://twitter.com/mariacadenas/status/1111994053342617600
2019-03-30 08:56:40,mariacadenas,,0,0,0,"U.S. border authorities hold migrant families in a pen under an El Paso bridge - Los Angeles Times https://www.latimes.com/world/mexico-americas/la-na-asylum-migrants-el-paso-camp-20190329-htmlstory.html",,,,1111915132458663937,https://twitter.com/mariacadenas/status/1111915132458663937
2019-03-29 15:09:12,mariacadenas,,0,0,0,"EPA Science Panel Considering Guidelines That Upend Basic Air Pollution Science https://n.pr/2TD00pl",,,,1111646494166122498,https://twitter.com/mariacadenas/status/1111646494166122498
2019-03-29 12:28:36,mariacadenas,,0,0,0,"Homeland Security to ask for sweeping authority to deport unaccompanied migrant children - NBC News https://apple.news/AgyRokK6JT4GkpZlgjh1ghA",,,,1111606077924085765,https://twitter.com/mariacadenas/status/1111606077924085765
2019-03-29 10:22:38,mariacadenas,,0,0,0,"Working full time, still homeless: Inside America’s rising tent encampments - The Washington Post https://apple.news/AntvH7fIvTTi9giXlrTgRXQ",,,,1111574378158804992,https://twitter.com/mariacadenas/status/1111574378158804992
2019-03-29 01:49:51,mariacadenas,,0,0,0,"Trump administration keeps Congress in dark over secret nuclear tech deal with Saudi Arabia, despite Khashoggi murder http://www.newsweek.com/trump-administration-keeps-congress-dark-over-secret-nuclear-tech-deal-saudi-1378275",,,,1111445334067040257,https://twitter.com/mariacadenas/status/1111445334067040257
2019-03-29 01:47:07,mariacadenas,,0,0,0,"Can We Overcome Racial Bias? 'Biased' Author Jennifer Eberhardt Says To Start By Acknowledging It : NPR https://www.npr.org/2019/03/28/705113639/can-we-overcome-racial-bias-biased-author-says-to-start-by-acknowledging-it",,,,1111444646087950336,https://twitter.com/mariacadenas/status/1111444646087950336
2019-03-28 04:13:31,mariacadenas,,0,0,0,"U.S. approved secret nuclear power work for Saudi Arabia https://reut.rs/2WrU7gz",,,,1111119098778288128,https://twitter.com/mariacadenas/status/1111119098778288128
2019-03-28 00:21:38,mariacadenas,,0,0,0,"Chick-fil-A Donated $1.8 Million to Anti-LGBTQ Groups in 2017 - The Intellectualist https://mavenroundtable.io/theintellectualist/atheism-secularism/chick-fil-a-donated-1-8-million-to-anti-lgbtq-groups-in-2017-AceiChauHUSjFVX70l-fDQ/",,,,1111060745410633728,https://twitter.com/mariacadenas/status/1111060745410633728
2019-03-28 00:18:22,mariacadenas,,0,0,0,"I needed this today! - Major Female ""Star Trek"" Character, Ranked By Lesbianism - Autostraddle https://www.autostraddle.com/every-major-star-trek-character-ranked-by-lesbianism-452811/",,,,1111059923398356992,https://twitter.com/mariacadenas/status/1111059923398356992
2019-03-28 00:15:35,mariacadenas,,0,0,0,"Migrant Children Are Being Given To An Adoption Agency Linked To Betsy DeVos - The Intellectualist https://mavenroundtable.io/theintellectualist/news/migrant-children-are-being-given-to-an-adoption-agency-linked-to-betsy-devos-9j_wI0EkdEuS55b6qnzwsA/",,,,1111059220697214976,https://twitter.com/mariacadenas/status/1111059220697214976
2019-03-27 21:37:40,mariacadenas,,0,0,0,"Co-Working Spaces for Parents Offer Child Care, Too - CityLab https://www.citylab.com/life/2019/03/coworking-day-care-parenting-freelance-worker-children-elemeno/585787/",,,,1111019478605717505,https://twitter.com/mariacadenas/status/1111019478605717505
2019-03-27 18:44:19,mariacadenas,,0,0,0,"Opinion | It’s Bigger Than Mueller and Trump - The New York Times https://www.nytimes.com/2019/03/24/opinion/trump-mueller-white-supremacy.html",,,,1110975855268773888,https://twitter.com/mariacadenas/status/1110975855268773888
2019-03-27 18:32:30,mariacadenas,,0,0,1,"Minimum wage would be $33 today if it grew like Wall Street bonuses have - CBS News https://www.cbsnews.com/news/minimum-wage-would-be-33-today-if-it-grew-like-wall-street-bonuses-have/",,,,1110972880089575424,https://twitter.com/mariacadenas/status/1110972880089575424
2019-03-27 18:30:33,mariacadenas,,0,0,0,"Facebook bans white nationalism from platform after pressure from civil rights groups https://www.nbcnews.com/tech/tech-news/facebook-bans-white-nationalism-after-pressure-civil-rights-groups-n987991",,,,1110972389574111237,https://twitter.com/mariacadenas/status/1110972389574111237
2019-03-27 17:32:30,mariacadenas,,0,0,0,"Governor Newsom Addresses Child Poverty with Tax-Credit, Expanding Public Assistance | Forum | Forum | KQED https://www.kqed.org/forum/2010101870181/governor-newsom-addresses-child-poverty-with-tax-credit-expanding-public-assistance",,,,1110957782277054465,https://twitter.com/mariacadenas/status/1110957782277054465
2019-03-27 04:23:53,mariacadenas,,0,0,0,"How to Negotiate Down Your Hospital Bills - The Atlantic https://www.theatlantic.com/health/archive/2019/03/hospital-bills-medical-debt-bankruptcy/584998/",,,,1110759322135326722,https://twitter.com/mariacadenas/status/1110759322135326722
2019-03-27 04:22:44,mariacadenas,,0,0,0,"Yalitza trabajará con ONU para combatir el racismo https://www.abcnoticias.mx/yalitza-trabajara-con-onu-para-combatir-el-racismo/131008",,,,1110759029389688832,https://twitter.com/mariacadenas/status/1110759029389688832
2019-03-27 04:19:00,mariacadenas,CityofSalinas,0,0,0,"I’m wondering how AgTech is looking at or including discussions on its role in wage equity and moving Ag from a poverty dependent model?",,,,1110758089584578560,https://twitter.com/mariacadenas/status/1110758089584578560
2019-03-27 04:15:39,mariacadenas,,0,0,0,"women and girls of color receive only 2% of philanthropic pie, even though they make up 19% of the U.S. population. That’s not up to women of color to fix @Forbes. That’s up to philanthropy taking a real hard look at the inequity it perpetuates. http://www.forbes.com/sites/bonniechiu/2019/03/20/do-women-of-color-philanthropists-give-differently-from-their-white-counterparts/",,@Forbes,,1110757246491779072,https://twitter.com/mariacadenas/status/1110757246491779072
2019-03-27 04:09:20,mariacadenas,,0,0,0,"Tech Is Splitting the U.S. Work Force in Two - The New York Times https://www.nytimes.com/2019/02/04/business/economy/productivity-inequality-wages.html?mc=aud_dev&amp;ad-keywords=auddevgate&amp;subid1=TAFI&amp;ad_name=INTER_20_XXXX_XXX_1P_CD_XX_XX_SITEVISITXREM_X_XXXX_COUSA_P_X_X_EN_FBIG_OA_XXXX_00_EN_JP_NFLINKS&amp;adset_name=https%3A%2F%2Fwww.nytimes.com%2F2019%2F02%2F04%2Fbusiness%2Feconomy%2Fproductivity-inequality-wages.html&amp;campaign_id=23843395559380358&amp;fbclid=IwAR0Vu2mfZVJLQt5v1EyjXegBGpADL2Hnewn9mHCxTpBVxYYwhmQz0DKeVrk",,,,1110755657156722688,https://twitter.com/mariacadenas/status/1110755657156722688
2019-03-27 03:16:44,mariacadenas,,0,0,0,"Affordable Care Act: 20M could lose insurance if Obamacare tossed https://www.usatoday.com/story/news/health/2019/03/26/affordable-care-act-obamacare-20-million-could-lose-insurance/3277117002/",,,,1110742423355846656,https://twitter.com/mariacadenas/status/1110742423355846656
2019-03-27 02:19:46,mariacadenas,briantylercohen,0,0,1,"Yes!!!",,,,1110728085626716160,https://twitter.com/mariacadenas/status/1110728085626716160
2019-03-26 12:23:16,mariacadenas,,0,0,0,"Confronting the Great American Myth https://www.yesmagazine.org/people-power/confronting-the-great-american-myth-20190201 via @yesmagazine",,@yesmagazine,,1110517574620471296,https://twitter.com/mariacadenas/status/1110517574620471296
2019-03-24 14:13:33,mariacadenas,,0,0,0,"9-Year-Old Girl Was Detained at Border for 30 Hours Despite Being a U.S. Citizen - The New York Times https://www.nytimes.com/2019/03/22/us/julia-isabel-amparo-medina.html?smid=fb-nytimes&amp;smtyp=cur&amp;fbclid=IwAR2k6jO8AcUfvsD2DbGadOR0EhhBdc7UczkcLqWLxwSBls50Iwu9iUuNHzw",,,,1109820548979187712,https://twitter.com/mariacadenas/status/1109820548979187712
2019-03-24 07:06:55,mariacadenas,,0,0,0,"Knowing the Right Time to Say Goodbye to a Pet - The New York Times https://www.nytimes.com/2019/03/19/well/family/pet-dog-cat-death-euthanasia.html?smid=fb-nytimes&amp;smtyp=cur&amp;fbclid=IwAR2ilyEOck2tfHpyh47eEL4G-2wjV6KGXuB71nSML_zRPkKf9jLw0ZGg7xM",,,,1109713186876317697,https://twitter.com/mariacadenas/status/1109713186876317697
2019-03-24 04:52:04,mariacadenas,,0,0,3,"Dolores Huerta’s exhibit now open at the California Museum as part of a five-year national tour. | Vida en el Valle",,,,1109679251089833984,https://twitter.com/mariacadenas/status/1109679251089833984
2019-03-23 14:37:10,mariacadenas,,0,0,0,"This Library Takes an Indigenous Approach to Categorizing Books by Sydney Worth — YES! Magazine https://www.yesmagazine.org/peace-justice/decolonize-western-bias-indigenous-library-books-20190322?fbclid=IwAR0GGe6446QaVcVr9rR-1QKoHfzLHb51s9rqtvQ3zdJdI7szj2mayz9Xoo0",,,,1109464105142738944,https://twitter.com/mariacadenas/status/1109464105142738944
2019-03-23 14:36:45,mariacadenas,,0,0,0,"Hate crimes increased 226% in places Trump held campaign rally, study - Business Insider https://www.businessinsider.com/trump-campaign-rally-hate-crimes-study-maga-2019-3",,,,1109464002713706497,https://twitter.com/mariacadenas/status/1109464002713706497
2019-03-22 06:01:27,mariacadenas,,0,0,0,"Anyone Speak K’iche’ or Mam? Immigration Courts Overwhelmed by Indigenous Languages https://nyti.ms/2TK6Ezl",,,,1108971934950150145,https://twitter.com/mariacadenas/status/1108971934950150145
2019-03-22 05:57:49,mariacadenas,,0,0,0,"Lesbians battled for their place in 1960s feminism – Timeline https://timeline.com/lesbians-battled-for-their-place-in-1960s-feminism-25082853be90",,,,1108971020562530305,https://twitter.com/mariacadenas/status/1108971020562530305
2019-03-20 18:50:30,mariacadenas,,0,0,0,"Voting Records of the Parties http://politicsthatwork.com/voting-record/",,,,1108440697470771200,https://twitter.com/mariacadenas/status/1108440697470771200
2019-03-20 18:45:32,mariacadenas,,0,0,1,"The College Admissions Scandal Should Remind Grads Of Color We Were Always Good Enough https://www.bustle.com/p/the-college-admissions-scandal-should-remind-grads-of-color-we-were-always-good-enough-16952921",,,,1108439447954055169,https://twitter.com/mariacadenas/status/1108439447954055169
2019-03-20 13:34:51,mariacadenas,,0,0,0,"German opposition politician calls for US ambassador to be expelled https://thehill.com/policy/international/434757-top-german-opposition-politician-calls-for-us-ambassador-to-be-expelled",,,,1108361259462713345,https://twitter.com/mariacadenas/status/1108361259462713345
2019-03-20 12:07:57,mariacadenas,,0,0,0,"BBC News - Christchurch shootings: Jacinda Ardern calls for global anti-racism fight https://www.bbc.com/news/world-asia-47634132",,,,1108339390311337984,https://twitter.com/mariacadenas/status/1108339390311337984
2019-03-20 05:37:15,mariacadenas,,0,0,0,"For third year in a row, Trump’s budget plan eliminates arts, public TV and library funding http://a.msn.com/01/en-us/BBUW3Tw?ocid=st",,,,1108241070318469122,https://twitter.com/mariacadenas/status/1108241070318469122
2019-03-19 23:34:30,mariacadenas,,0,0,0,"Why judges matter. https://apple.news/Ag5hMgXzHRxOkI4UF_9auHg",,,,1108149777424773120,https://twitter.com/mariacadenas/status/1108149777424773120
2019-03-19 03:24:07,mariacadenas,,0,0,0,"This Is How Borrowing Things From Our Neighbors Strengthens Society by Sarah Lazarovic — YES! Magazine https://lm.facebook.com/l.php?u=https%3A%2F%2Fwww.yesmagazine.org%2Fissues%2Fdirt%2Fcommunity-relationships-borrowing-from-neighbors-strengthens-democracy-20190318%3Ffbclid%3DIwAR0snn7t8Rxq0x0XXKuX7oDUqoGoUK0OtWNOFT9Mg7IRyuUN3GhGEVqEFSc&amp;h=AT2eeIjwX531pL0BadAG-ngmo2z0P3qPolWRmOfw3XxZ_W85CuTAoz_g2wpLyJWJj_fj201gQ6xFAIHvrLEP2klVeJQMeCDjOPnvFJWnMSThVtmz3DTPnVv1cnlGca5g0XmpEzGheqpJ1BunJgfE6r31oL7xRLI",,,,1107845176251146241,https://twitter.com/mariacadenas/status/1107845176251146241
