date,username,to,replies,retweets,favorites,text,geo,mentions,hashtags,id,permalink
2020-03-02 15:04:02,mariacadenas,,0,0,1,"Check out this video from @PBS: PBS Presents, Rise Up: Songs of the Women's Movement",,@PBS,,1234494683419570182,https://twitter.com/mariacadenas/status/1234494683419570182
2020-03-02 01:30:41,mariacadenas,,1,0,3,"#votemaria2020",,,#votemaria2020,1234289997122899968,https://twitter.com/mariacadenas/status/1234289997122899968
2020-02-28 15:02:50,mariacadenas,,0,4,7,"""Given the power instilled in local electeds, it is crucial that these leaders reflect the diversity of the communities they represent."" - Despite Progress Since 2018, Bay Area Diversity Not Reflected Among Top Local Electeds | Bay Area Equity Atlas https://bayareaequityatlas.org/Electeds2020",,,,1233407216352284672,https://twitter.com/mariacadenas/status/1233407216352284672
2020-02-28 14:46:27,mariacadenas,,0,0,1,"""Money in politics influences who runs for office, who they talk to on their campaigns, who wins, and what policies get enacted"" -",,,,1233403091271073792,https://twitter.com/mariacadenas/status/1233403091271073792
2020-02-28 08:18:04,mariacadenas,,0,0,1,"#votemaria2020 March 3rd",,,#votemaria2020,1233305351803432961,https://twitter.com/mariacadenas/status/1233305351803432961
2020-02-27 23:53:12,mariacadenas,CAWomensList,0,0,1,"Honored to have the endorsement of @CAWomensList #votemaria2020",,@CAWomensList,#votemaria2020,1233178297829249024,https://twitter.com/mariacadenas/status/1233178297829249024
2020-02-27 18:02:02,mariacadenas,,0,1,2,"With five days to go I take a moment to reflect on the gifts of being a candidate for office",,,,1233089925899149312,https://twitter.com/mariacadenas/status/1233089925899149312
2020-02-25 22:12:00,mariacadenas,,0,2,2,"Throwback to a conversation I had on why a #neweconomy and the role of #cooperative structures",,,#neweconomy #cooperative,1232428055676649473,https://twitter.com/mariacadenas/status/1232428055676649473
2020-02-23 16:57:51,mariacadenas,,0,1,1,"craving is pan dulce y champurrado #SundayMorning",,,#SundayMorning,1231624222763450368,https://twitter.com/mariacadenas/status/1231624222763450368
2020-02-22 20:42:29,mariacadenas,,0,0,0,"#HousingForAll",,,#HousingForAll,1231318365077045250,https://twitter.com/mariacadenas/status/1231318365077045250
2020-02-22 16:56:07,mariacadenas,,0,0,0,"Song of the day is #wonder with @emelisande",,@emelisande,#wonder,1231261398845444096,https://twitter.com/mariacadenas/status/1231261398845444096
2020-02-22 01:46:01,mariacadenas,,0,4,15,"Uplift each other. Elevate each other’s work. Center our work in our shared humanity. Dare to bet on our dreams and a future we deserve. Have those difficult conversations. And be sure you take care of yourself. #ThrivingImmigrantsCollaborative",,,#ThrivingImmigrantsCollaborative,1231032363045380096,https://twitter.com/mariacadenas/status/1231032363045380096
2020-02-19 07:45:23,mariacadenas,,0,0,1,"Made it to @anidifranco #Santacruz show. An hour late, but here. An on-the-campaign-trail version of #selfcare",,@anidifranco,#Santacruz #selfcare,1230035637253705728,https://twitter.com/mariacadenas/status/1230035637253705728
2020-02-16 23:45:39,mariacadenas,,0,0,0,"Former Justice Dept. Lawyers Press for Barr to Step Down #resist",,,#resist,1229190133011763200,https://twitter.com/mariacadenas/status/1229190133011763200
2020-02-14 16:25:13,mariacadenas,CharlesVaske,0,0,2,"Looking good!",,,,1228354516157784064,https://twitter.com/mariacadenas/status/1228354516157784064
2020-02-14 14:19:40,mariacadenas,,0,2,6,"My heart goes “Bidi bidi bom bom” every time someone tells me they voted / Mi corazón dice “Bidi bidi bom bom” cada vez que alguien me dice que votaron #HappyValentinesDay #votemaria2020 #Selena",,,#HappyValentinesDay #votemaria2020 #Selena,1228322922642595840,https://twitter.com/mariacadenas/status/1228322922642595840
2020-02-10 05:35:21,mariacadenas,,0,0,0,"Introducing my #sister to @DarWilliamsTour and one of my favorite songs #AfterAll",,@DarWilliamsTour,#sister #AfterAll,1226741424109973507,https://twitter.com/mariacadenas/status/1226741424109973507
2020-02-08 20:20:50,mariacadenas,,0,0,0,"Mi canción está mañanita, para todas la madres le mundo. Y con esta me despido y le sigo al traqueteo, como dice mi mamá a #votar, mi gente - #loscaminosdelavida",,,#votar #loscaminosdelavida,1226239486083751936,https://twitter.com/mariacadenas/status/1226239486083751936
2020-02-08 18:08:06,mariacadenas,,0,0,1,"At the #ParentPowerSummit this morning for the Central Coast Early Childhood Advocacy Network",,,#ParentPowerSummit,1226206081279352832,https://twitter.com/mariacadenas/status/1226206081279352832
2020-02-08 01:08:02,mariacadenas,nytimes,1,1,3,"Just leaving this right here...",,,,1225949374804414464,https://twitter.com/mariacadenas/status/1225949374804414464
2020-02-04 02:37:43,mariacadenas,CBSThisMorning,0,0,0,"It’s time for a #NewEconomy",,,#NewEconomy,1224522393114136576,https://twitter.com/mariacadenas/status/1224522393114136576
2020-02-04 01:47:44,mariacadenas,CAgovernor,0,0,0,"This is great! Now expand it to cover mixed status households",,,,1224509812718784512,https://twitter.com/mariacadenas/status/1224509812718784512
2020-02-04 01:46:59,mariacadenas,,0,1,3,"I was just sent a photo by a voter of their voter guide highlighting my name for State Senate. #ItsTime #votemaria2020",,,#ItsTime #votemaria2020,1224509624163823616,https://twitter.com/mariacadenas/status/1224509624163823616
2020-01-28 18:18:36,mariacadenas,,0,0,1,"Honored to have the support of #voters like Caitlin https://youtu.be/1cfulIOlq64 via @YouTube",,@YouTube,#voters,1222222460151418880,https://twitter.com/mariacadenas/status/1222222460151418880
2020-01-27 20:02:57,mariacadenas,GregStohr,0,0,0,"This is a shameful and harmful decision. We are better than this",,,,1221886331699122176,https://twitter.com/mariacadenas/status/1221886331699122176
2020-01-23 17:10:45,mariacadenas,,0,0,0,"World's 2,153 billionaires hold more wealth than poorest 4.6 billion combined: research",,,,1220393442628341760,https://twitter.com/mariacadenas/status/1220393442628341760
2020-01-22 00:34:31,mariacadenas,,0,0,1,"We must address our broken economic system to address climate change. We cannot consume our way to wellbeing. We need a system that works for ALL, regardless of race, gender, sexual orientation, or immigration status. There is no other way. We don’t have time to wait.",,,,1219780344603299840,https://twitter.com/mariacadenas/status/1219780344603299840
2020-01-10 13:18:13,mariacadenas,TeamLPAC,0,0,1,"Thanks for the support!",,,,1215623882998083585,https://twitter.com/mariacadenas/status/1215623882998083585
2020-01-09 23:28:05,mariacadenas,,0,0,0,"My go-to burrito place is #ElFrijolito in #Watsonville. Which one is yours?",,,#ElFrijolito #Watsonville,1215414974467600385,https://twitter.com/mariacadenas/status/1215414974467600385
2020-01-09 04:52:11,mariacadenas,VoteMaria2020,0,0,0,"This was the highlight of my day while hanging out with #voters and getting our story out. This and a lovely puppy named Lola!",,,#voters,1215134145531109377,https://twitter.com/mariacadenas/status/1215134145531109377
2020-01-07 23:55:39,mariacadenas,,0,1,2,"These words have always guided my journey: “Entre individuos, como entre naciones, el respeto al derecho ajeno es la paz (Among individuals, as among nations, respect for the rights of others is peace) - Benito Juárez",,,,1214697133523136514,https://twitter.com/mariacadenas/status/1214697133523136514
2020-01-07 20:18:19,mariacadenas,chelseahandler,0,0,0,"Thanks for the shout out @chelseahandler",,@chelseahandler,,1214642441690574848,https://twitter.com/mariacadenas/status/1214642441690574848
2020-01-07 18:50:46,mariacadenas,,0,0,3,"Two signs you’re tired: 1) you forget to drink your pour over #coffee which you meticulously made and left on the kitchen counter and 2) you forget your work bag at the coffee shop you went to to get much needed coffee after mistake #1. Still not enough to stop. We #KeepGoing",,,#coffee #KeepGoing,1214620407975727104,https://twitter.com/mariacadenas/status/1214620407975727104
2020-01-06 16:26:40,mariacadenas,,0,0,1,"A planear los tamales #felizdiadereyes",,,#felizdiadereyes,1214221756598112264,https://twitter.com/mariacadenas/status/1214221756598112264
2020-01-06 01:15:56,mariacadenas,,0,0,0,"So my laptop locked itself and deleted my user...yep, that happened. Luckily I had my canvassing lists on my phone so even that is not stopping us #votemaria2020",,,#votemaria2020,1213992561620111363,https://twitter.com/mariacadenas/status/1213992561620111363
2020-01-03 06:18:52,mariacadenas,,0,0,0,"#NoWarWithIran",,,#NoWarWithIran,1212981633210445827,https://twitter.com/mariacadenas/status/1212981633210445827
2020-01-03 02:57:44,mariacadenas,,0,0,0,"Escuchando a @_VicenteFdez cantar #mujeresdivinas y pensando en #loscaminosdelavida y así empieza este #AnoNuevo2020",,@_VicenteFdez,#mujeresdivinas #loscaminosdelavida #AnoNuevo2020,1212931017587081216,https://twitter.com/mariacadenas/status/1212931017587081216
2020-01-02 20:31:18,mariacadenas,prosperitynow,0,0,0,"I’m so excited to make this a reality in #SantaCruz Join me by making a donation to @SCCVonline and learn more at https://www.santacruzseeds.org/",,@SCCVonline,#SantaCruz,1212833770866266117,https://twitter.com/mariacadenas/status/1212833770866266117
2020-01-02 04:26:40,mariacadenas,VoteMaria2020,0,0,1,"A #NewYear and a photo reflection of the amazing people making my run for Senate possible!",,,#NewYear,1212591011811090432,https://twitter.com/mariacadenas/status/1212591011811090432
2020-01-01 06:57:50,mariacadenas,,0,0,0,"And in all that hilarity of the last seconds of the current year and first minutes of the #NewYear we are reminded of how much we belong and are cared for. Wishing you all an amazing #NewYear any way you celebrate ",,,#NewYear #NewYear,1212266663262863360,https://twitter.com/mariacadenas/status/1212266663262863360
2020-01-01 06:57:49,mariacadenas,,1,0,1,"In my family #NewYearsEve is full of superstition and magic. From 12 grapes to colorful candles and money in the pocket and running in and out of the house with luggage...and so much more.",,,#NewYearsEve,1212266660989521920,https://twitter.com/mariacadenas/status/1212266660989521920
2020-01-01 02:24:08,mariacadenas,,0,0,1,"¡Lista para el Año Nuevo! #uvas #2020NewYear",,,#uvas #2020NewYear,1212197786755534850,https://twitter.com/mariacadenas/status/1212197786755534850
2019-12-31 20:36:09,mariacadenas,nprpolitics,0,0,0,"I’m tired of our democracy going to the highest bidder. Time for #publicly funded #elections. #votemaria2020",,,#publicly #elections #votemaria2020,1212110213647437824,https://twitter.com/mariacadenas/status/1212110213647437824
2019-12-31 20:12:29,mariacadenas,,0,1,0,"Whoa! Look at this beauty! Pure @sliceproject pizza magic! Makes the work day go faster #Watsonville",,@sliceproject,#Watsonville,1212104256183910401,https://twitter.com/mariacadenas/status/1212104256183910401
2019-12-18 02:27:25,mariacadenas,,0,0,3,"Spending my evening sharing the basics of #credit to help #consumers build and protect their #wealth",,,#credit #consumers #wealth,1207125181560311809,https://twitter.com/mariacadenas/status/1207125181560311809
2019-12-18 01:36:14,mariacadenas,,0,0,0,"One of the best parts of the work we do @SCCVonline is meeting with amazing local businesses. Thank @NewNativesSC for your time and amazing products!",,@SCCVonline @NewNativesSC,,1207112300894703616,https://twitter.com/mariacadenas/status/1207112300894703616
2019-12-18 00:21:30,mariacadenas,,0,1,1,"40% of #Salinas #Students are homeless. They are our kids and they deserve better. #vote",,,#Salinas #Students #vote,1207093494352736257,https://twitter.com/mariacadenas/status/1207093494352736257
2019-12-17 23:57:47,mariacadenas,,0,0,0,"So proud of my Women Policy Institute @womensfoundca sister, Alma, speaking on housing issues in #Salinas",,@womensfoundca,#Salinas,1207087527745605633,https://twitter.com/mariacadenas/status/1207087527745605633
2019-12-16 20:54:33,mariacadenas,,0,1,0,"“Now women, I just want you to know; you are not perfect, but what I can say pretty indisputably is that you're better than us [men],"" Obama said, according to the BBC",,,,1206679024900222976,https://twitter.com/mariacadenas/status/1206679024900222976
2019-12-15 02:24:54,mariacadenas,,0,0,0," El corazón que a Triana va nunca volverá #Sevilla #MiguelBose",,,#Sevilla #MiguelBose,1206037384317435905,https://twitter.com/mariacadenas/status/1206037384317435905
2019-12-12 19:13:03,mariacadenas,,0,1,1,"Spent the morning with the @pvhealthtrust team sharing @SCCVonline work and vision. So proud of my team and theirs and the efforts to create wellbeing!",,@pvhealthtrust @SCCVonline,,1205203930231132160,https://twitter.com/mariacadenas/status/1205203930231132160
2019-12-11 04:13:51,mariacadenas,,1,1,4,"History made! #Watsonville swears in its 3rd #latina Mayor in 150 years. Congratulations #RebeccaGarcia !",,,#Watsonville #latina #RebeccaGarcia,1204615254279221248,https://twitter.com/mariacadenas/status/1204615254279221248
2019-12-10 22:08:33,mariacadenas,,0,0,0,"Support #Watsonville businesses this holiday season: Check out ""El Pájaro CDC's Kitchen Gift Box"" https://www.eventbrite.com/e/el-pajaro-cdcs-kitchen-gift-box-tickets-85169220431?utm-medium=discovery&amp;utm-campaign=social&amp;utm-content=attendeeshare&amp;aff=estw&amp;utm-source=tw&amp;utm-term=listing @Eventbrite",,@eventbrite,#Watsonville,1204523321435406336,https://twitter.com/mariacadenas/status/1204523321435406336
2019-12-09 22:41:13,mariacadenas,,0,0,0,"Song of the day @tonesandimusic #TheKidsAreComing",,@tonesandimusic,#TheKidsAreComing,1204169155546697728,https://twitter.com/mariacadenas/status/1204169155546697728
2019-12-07 03:54:31,mariacadenas,,0,0,2,"Made it to #Sacramento today and grateful for local coffee shops #ShiftCoffee",,,#Sacramento #ShiftCoffee,1203160834051993600,https://twitter.com/mariacadenas/status/1203160834051993600
2019-12-01 22:33:01,mariacadenas,,1,0,0,"A holiday weekend full of rain and chill in the air...yes, it is time for #TheSoundOfMusic while cuddled in blankets",,,#TheSoundOfMusic,1201267988508205057,https://twitter.com/mariacadenas/status/1201267988508205057
2019-11-30 21:42:06,mariacadenas,,0,0,1,"Disfrutando http://KKUP.org y Alma Latina esta mañana con canciones que me alegran el alma",,,,1200892785206820864,https://twitter.com/mariacadenas/status/1200892785206820864
2019-11-25 04:12:30,mariacadenas,thehill,0,0,0,"Good. Now let’s make sure that as we tackle #housing we consider climate impacts and ensure that we allow pathways to home ownership to those usually left out of this key wealth building tool #HousingForAll",,,#housing #HousingForAll,1198816706866475008,https://twitter.com/mariacadenas/status/1198816706866475008
2019-11-25 01:52:55,mariacadenas,,0,0,0,"On a Sunday random note, why did @DreamWorksSheRa have to change #Glimmer ?",,@DreamWorksSheRa,#Glimmer,1198781578932969474,https://twitter.com/mariacadenas/status/1198781578932969474
2019-11-22 20:08:24,mariacadenas,scsentinel,0,0,0,"You can find me putting people and planet first here, on the ground, in our communities. We all have an uphill battle to mitigate climate chaos. Walk with me as we say this is a hill worth climbing. Together. @VoteMaria2020",,@VoteMaria2020,,1197970105398784000,https://twitter.com/mariacadenas/status/1197970105398784000
2019-11-21 16:22:54,mariacadenas,,0,0,0,"Starting the morning right #LivePajaroValley",,,#LivePajaroValley,1197550968335785984,https://twitter.com/mariacadenas/status/1197550968335785984
2019-11-20 18:30:40,mariacadenas,,0,0,1,"Did you know that Latinas in California earn less than 43 cents for every dollar earned by white, non-Hispanic, men? It's time to end the #wagegap #LatinaEqualPayDay",,,#wagegap #LatinaEqualPayDay,1197220734151512064,https://twitter.com/mariacadenas/status/1197220734151512064
2019-11-20 06:12:17,mariacadenas,,0,0,0,"La canción de día (noche) @AlejandroSanz #Contigo http://youtu.be/DLvgiNW5oDM via @YouTube",,@AlejandroSanz @YouTube,#Contigo,1197034910139072517,https://twitter.com/mariacadenas/status/1197034910139072517
2019-11-16 16:43:03,mariacadenas,,0,0,2,"#equalPay for ALL",,,#equalPay,1195744098482675712,https://twitter.com/mariacadenas/status/1195744098482675712
2019-11-15 16:31:24,mariacadenas,,0,0,0,"“it would still be a sad indictment that only the Western European art mattered, rather than the millions or billions of people (often poor, often non-white) whose lives are threatened by a climate crisis largely of the West's making. “",,,,1195378780274970625,https://twitter.com/mariacadenas/status/1195378780274970625
2019-11-14 21:25:17,mariacadenas,,0,0,1,"And isn’t ironic, don’t you think?",,,,1195090346637545472,https://twitter.com/mariacadenas/status/1195090346637545472
2019-11-14 19:45:14,mariacadenas,,0,0,4,"Low Income students have to work 20 or more hours to meet financial needs. Detrimental to their academic success #CACollegeAffordability",,,#CACollegeAffordability,1195065171221237760,https://twitter.com/mariacadenas/status/1195065171221237760
2019-11-14 19:26:50,mariacadenas,,0,0,1,"“Creating and fostering learning experiences that honor students humanity” what a great framework to designing our educational culture #CACollegeAffordability @LaraMayralara1",,@LaraMayralara1,#CACollegeAffordability,1195060538830540800,https://twitter.com/mariacadenas/status/1195060538830540800
2019-11-14 16:25:38,mariacadenas,latimes,0,1,3,"My heart breaks for the kids and their families and us. We are better than this. Our kids deserve better than this. We need to do more. #gunsense",,,#gunsense,1195014938999214080,https://twitter.com/mariacadenas/status/1195014938999214080
2019-11-14 00:12:04,mariacadenas,kmtrangel,1,0,1,"Yasss",,,,1194769932476547072,https://twitter.com/mariacadenas/status/1194769932476547072
2019-11-13 22:31:04,mariacadenas,,0,0,0,"Song of the day #Bravo by @ledisi",,@ledisi,#Bravo,1194744515627630593,https://twitter.com/mariacadenas/status/1194744515627630593
2019-11-13 22:29:53,mariacadenas,,0,0,2,"Looking across the room and seeing amazing women doing what amazing women do...and they are all on the @SCCVonline Board! Thanks for always doing great work to make sure our communities thrive! #WomenatWork #WomenWednesday",,@SCCVonline,#WomenatWork #WomenWednesday,1194744219828551681,https://twitter.com/mariacadenas/status/1194744219828551681
2019-11-13 21:52:38,mariacadenas,UNITEDWEDREAM,0,1,2,"El pueblo unido jamas será vencido. A unirse mi gente #HomeIsHere #vota",,,#HomeIsHere #vota,1194734843923316736,https://twitter.com/mariacadenas/status/1194734843923316736
2019-11-12 17:59:26,mariacadenas,,0,0,1,"Standing by our #dreamers whose case is in front of #SCOTUS today.",,,#dreamers #SCOTUS,1194313767695179776,https://twitter.com/mariacadenas/status/1194313767695179776
2019-11-09 18:03:14,mariacadenas,,0,1,0,"Veterans Day disgrace: Stop deporting immigrants who served, make them American citizens https://www.usatoday.com/story/opinion/2019/11/09/veterans-day-stop-deporting-veterans-make-them-citizens-column/2527994001/ via @usatoday",,@USATODAY,,1193227562492645377,https://twitter.com/mariacadenas/status/1193227562492645377
2019-11-09 01:04:06,mariacadenas,,0,0,1,"Can someone with slightly more tech skill and time update the Wikipedia article on #Prop187 to change ""illegal"" to ""undocumented""? Thank you",,,#Prop187,1192971089019686912,https://twitter.com/mariacadenas/status/1192971089019686912
2019-11-08 19:33:51,mariacadenas,,0,0,0,"Song of the day @Santigold #GO! (feat. @KarenO ) https://youtu.be/WKzPrlKtuP8 via @YouTube",,@Santigold @KarenO @YouTube,#GO,1192887976809730049,https://twitter.com/mariacadenas/status/1192887976809730049
2019-11-07 15:50:53,mariacadenas,,0,0,0,"",,,,1192469478765785088,https://twitter.com/mariacadenas/status/1192469478765785088
2019-11-07 15:21:55,mariacadenas,,0,1,0,"The Farmworkers Who Pick Your Food Don’t Get Paid Overtime",,,,1192462188398567424,https://twitter.com/mariacadenas/status/1192462188398567424
2019-11-06 15:06:41,mariacadenas,SCCVonline,0,0,1,"A good first step, and wondering, does anyone know if they are providing living wages for all their workers, including janitors and food workers?",,,,1192095968356790273,https://twitter.com/mariacadenas/status/1192095968356790273
2019-11-06 15:02:40,mariacadenas,,0,1,0,"""cultural and linguistic gaps in emergency response exist all over California."" We can do better and ensure everyone's safety #vote Column: Why did no one warn the housekeepers about the Getty fire?",,,#vote,1192094956145369088,https://twitter.com/mariacadenas/status/1192094956145369088
2019-11-06 01:33:40,mariacadenas,pajaronian,0,0,0,"Great news for our community",,,,1191891365556146182,https://twitter.com/mariacadenas/status/1191891365556146182
2019-11-05 20:34:57,mariacadenas,SantaCruzYIMBY,1,0,3,"It passed ",,,,1191816189351092224,https://twitter.com/mariacadenas/status/1191816189351092224
2019-11-05 19:30:14,mariacadenas,,0,0,2,"26% of kids in #LiveOak are considered homeless. We are better than this. Let’s make sure families have a home #HousingForAll",,,#LiveOak #HousingForAll,1191799904126943232,https://twitter.com/mariacadenas/status/1191799904126943232
2019-11-05 00:15:55,mariacadenas,ninaksimon,0,0,0,"And right back at you!",,,,1191509412063563777,https://twitter.com/mariacadenas/status/1191509412063563777
2019-11-05 00:15:43,mariacadenas,ninaksimon,0,0,0,"Thank you, Nina!",,,,1191509359789932544,https://twitter.com/mariacadenas/status/1191509359789932544
2019-11-04 22:53:20,mariacadenas,,0,0,8,"Today I’m holding on to and being driven by @ninaksimon defition of who I am: “a badass fighter for equity and inclusion in our region.”",,@ninaksimon,,1191488626544136193,https://twitter.com/mariacadenas/status/1191488626544136193
2019-11-03 15:43:43,mariacadenas,,0,0,1,"Nothing like a false fire alarm at 6am to get your creativity going",,,,1191018124780302337,https://twitter.com/mariacadenas/status/1191018124780302337
2019-11-02 14:49:29,mariacadenas,,0,0,0,"This Día de Los Muertos I’m reflecting on all that came before me and how to best lift those that come next. In the words of @hollynear",,@hollynear,,1190642087907119105,https://twitter.com/mariacadenas/status/1190642087907119105
2019-11-02 04:27:35,mariacadenas,,0,1,3,"Chicana Punks Fea Rally Against Wage Gaps in Video for New Single “Ya Se”",,,,1190485582998163458,https://twitter.com/mariacadenas/status/1190485582998163458
2019-11-02 03:50:12,mariacadenas,,0,0,6,"Met a fellow Beloiter, @PegKlaus The magic of this is always amazing! Thanks @EmergeCA for making this possible. @Beloit_College",,@PegKlaus @EmergeCA @Beloit_College,,1190476171986685952,https://twitter.com/mariacadenas/status/1190476171986685952
2019-11-01 01:25:45,mariacadenas,,0,0,4,"Found a use for all those leftover lanyards I refused to have land in the landfills #reuse",,,#reuse,1190077435162710017,https://twitter.com/mariacadenas/status/1190077435162710017
2019-10-31 03:50:30,mariacadenas,,0,0,1,"I’m always thankful for the hearts, wisdom, and joy of the people that make this world a better place. Thanks #MichaelMeara for your guidance as Board Chair of @SCCVonline",,@SCCVonline,#MichaelMeara,1189751474974162945,https://twitter.com/mariacadenas/status/1189751474974162945
2019-10-26 14:15:47,mariacadenas,,0,0,1,"Excited to be part of @EmergeCA 2019 Fall Boot Camp!",,@EmergeCA,,1188096893315768320,https://twitter.com/mariacadenas/status/1188096893315768320
2019-10-26 03:09:36,mariacadenas,,0,0,1,"Our Reality: Community Voices on the Thermal Fire https://youtu.be/fzCZVweAP4g via @YouTube",,@YouTube,,1187929240299163648,https://twitter.com/mariacadenas/status/1187929240299163648
2019-10-23 05:12:26,mariacadenas,,0,0,1,"Proud of the partnership and community engagement to bring this issue to light Report: Watsonville dense in ‘predatory’ lenders https://pajaronian.com/report-watsonville-dense-in-predatory-lenders/ via @pajaronian",,@pajaronian,,1186872990501236741,https://twitter.com/mariacadenas/status/1186872990501236741
2019-10-23 02:16:54,mariacadenas,,0,2,5,"Today I read the best quote: ""Those who say it cannot be done, shouldn't interrupt the people doing it."" Ay les voy!",,,,1186828816498323456,https://twitter.com/mariacadenas/status/1186828816498323456
2019-10-21 22:20:10,mariacadenas,,0,1,2,"I’m having a Monday where being a single mom, working full time, and running for office have come to a full head on collision. And yet, I #persist! This is the only way we can bring change! Echa Pa’lante",,,#persist,1186406851853746176,https://twitter.com/mariacadenas/status/1186406851853746176
2019-10-18 19:25:02,mariacadenas,,0,0,1,"So many questions...",,,,1185275616364384256,https://twitter.com/mariacadenas/status/1185275616364384256
2019-10-17 21:49:04,mariacadenas,,0,0,0,"Do you want to volunteer to be part of Team @VoteMaria2020 ? We are looking for some great interns, go check it out! https://www.indeedjobs.com/maria-cadenas-for-senate-2020/_hl/en?cpref=JXWAtnzf3XWjLOi4YeVNLm2bgyBz8ZTNCn3FbFD8ZU0",,@VoteMaria2020,,1184949472616501249,https://twitter.com/mariacadenas/status/1184949472616501249
2019-10-17 12:59:25,mariacadenas,,0,0,3,"I’m running because legislation is about people’s lives and we must do better to make sure it is about ALL people #rural #women #immigrant #latino @VoteMaria2020 #votemaria2020",,@VoteMaria2020,#rural #women #immigrant #latino #votemaria2020,1184816181838057473,https://twitter.com/mariacadenas/status/1184816181838057473
2019-10-17 11:31:10,mariacadenas,,0,1,1,"Starting early #AllInData4Health",,,#AllInData4Health,1184793975582007297,https://twitter.com/mariacadenas/status/1184793975582007297
