date,username,to,replies,retweets,favorites,text,geo,mentions,hashtags,id,permalink
2019-10-16 16:18:24,mariacadenas,kmtrangel,0,0,0,"Gracias! Hey, will consider a contribution?",,,,1184503870598156288,https://twitter.com/mariacadenas/status/1184503870598156288
2019-10-15 22:19:02,mariacadenas,,0,0,0,"",,,,1184232238457573376,https://twitter.com/mariacadenas/status/1184232238457573376
2019-10-15 15:47:49,mariacadenas,,0,0,1,"I’m ready to discuss #PredatoryLending and what we can do about it this morning. Join me at the #Watsonville City Community room at 9am Find our more at http://www.sccvonline.com",,,#PredatoryLending #Watsonville,1184133786600009728,https://twitter.com/mariacadenas/status/1184133786600009728
2019-10-14 21:19:28,mariacadenas,kmtrangel,0,0,1,"not quite, but it was such a treat to see the cars!",,,,1183854862674432001,https://twitter.com/mariacadenas/status/1183854862674432001
2019-10-14 13:26:54,mariacadenas,,0,1,5,"Today we celebrate the wisdom and gifts of our indigenous communities. Let us celebrate and continue the work towards justice. Happy #IndigenousPeoplesDay",,,#IndigenousPeoplesDay #IndigenousPeoplesDay,1183735933918515202,https://twitter.com/mariacadenas/status/1183735933918515202
2019-10-14 00:20:47,mariacadenas,,1,0,3,"From #rollsroyce to #lowriderstoday was a day of community and shared vision! Gracias #Gilroy and #MorganHill #votemaria2020",,,#rollsroyce #lowriderstoday #Gilroy #MorganHill #votemaria2020,1183538105036361730,https://twitter.com/mariacadenas/status/1183538105036361730
2019-10-12 15:12:40,mariacadenas,GavinNewsom,0,0,0,"No more",,,,1183037779183194113,https://twitter.com/mariacadenas/status/1183037779183194113
2019-10-11 18:05:19,mariacadenas,,0,0,1,"We are interconnected and our lives are lived beyond the labels every day. Watch “Girls Breaking Borders: International Day of the Girl” #InternationalDayoftheGirl #Vimeo",,,#InternationalDayoftheGirl #Vimeo,1182718839710027776,https://twitter.com/mariacadenas/status/1182718839710027776
2019-10-11 17:11:02,mariacadenas,,0,0,2,"Happy #NationalComingOutDay",,,#NationalComingOutDay,1182705176022413313,https://twitter.com/mariacadenas/status/1182705176022413313
2019-10-11 04:31:48,mariacadenas,,0,0,1,"The End Of Capitalism Is Already Starting–If You Know Where To Look - Fast Company - Pocket",,,,1182514108119146497,https://twitter.com/mariacadenas/status/1182514108119146497
2019-10-09 19:16:05,mariacadenas,,0,0,0,"Starting my morning learning and talking about #housing, #affordability, and the impact on #farmworkers in #Watsonville",,,#housing #affordability #farmworkers #Watsonville,1182011870359650304,https://twitter.com/mariacadenas/status/1182011870359650304
2019-10-09 06:02:39,mariacadenas,,0,0,0,"Atención y manténganse informados",,,,1181812196935749632,https://twitter.com/mariacadenas/status/1181812196935749632
2019-10-08 19:58:17,mariacadenas,,0,0,1,"“Another day, another dream but always you” - soundtrack to economic justice and the common threads that tie us all together",,,,1181660102220115968,https://twitter.com/mariacadenas/status/1181660102220115968
2019-10-08 18:01:29,mariacadenas,,0,0,0,"Happy International Lesbian Day!",,,,1181630707702984709,https://twitter.com/mariacadenas/status/1181630707702984709
2019-10-08 00:35:14,mariacadenas,,1,0,4,"Just dropped my phone into my chicken soup...two lessons learned #1 don't eat soup while making work calls #2 don't make work calls while sick. I hear you Universe. I hear you.",,,,1181367411557027840,https://twitter.com/mariacadenas/status/1181367411557027840
2019-10-06 02:40:33,mariacadenas,,0,0,1,"Recuerda “Soñar es solo para los valientes” #Dreamers",,,#Dreamers,1180674172449521664,https://twitter.com/mariacadenas/status/1180674172449521664
2019-10-05 21:48:39,mariacadenas,,0,0,0,"Great things are possible when we work together- Program invests in Watsonville’s young people ⁦@pajaronian⁩ https://www.register-pajaronian.com/article/program-invests-in-watsonvilles-young-people",,@pajaronian,,1180600715355381762,https://twitter.com/mariacadenas/status/1180600715355381762
2019-10-05 21:33:39,mariacadenas,NPR,0,0,0,"Just another way for the administration to build a wall. We have to stand against this and other policies, the US was never meant to be a gated community.",,,,1180596938808283136,https://twitter.com/mariacadenas/status/1180596938808283136
2019-10-05 21:30:20,mariacadenas,,0,0,0,"Sitting here wishing for a paletero to pass by my street or a person selling tamales...#SaturdayThoughts",,,#SaturdayThoughts,1180596105609744384,https://twitter.com/mariacadenas/status/1180596105609744384
2019-10-04 07:29:28,mariacadenas,,0,0,2,"So, I may be running for State Senate, but when my daughter calls in the mist of a Democratic Club meeting I find myself two minutes later talking about hamsters in the hallway... ‘cause that’s what we do. #parenting",,,#parenting,1180022107360481281,https://twitter.com/mariacadenas/status/1180022107360481281
2019-10-03 19:42:18,mariacadenas,justicefunders,0,0,1,"Let’s elect leaders that get this.",,,,1179844143029219328,https://twitter.com/mariacadenas/status/1179844143029219328
2019-10-03 19:11:57,mariacadenas,PHIdotorg,0,0,1,"Housing affordability impacts us all, but especially our vulnerable communities, including our seniors. We must do better",,,,1179836502559248384,https://twitter.com/mariacadenas/status/1179836502559248384
2019-10-03 19:10:59,mariacadenas,ACLU,0,0,0,"We need to stand strong and loud for families. #FamiliesBelongTogether",,,#FamiliesBelongTogether,1179836259499249665,https://twitter.com/mariacadenas/status/1179836259499249665
2019-10-03 13:26:53,mariacadenas,latimes,0,0,1,"Exciting times!",,,,1179749665387859969,https://twitter.com/mariacadenas/status/1179749665387859969
2019-10-03 05:14:53,mariacadenas,CharlesVaske,0,0,1,"Thanks for joining us!",,,,1179625850611781632,https://twitter.com/mariacadenas/status/1179625850611781632
2019-10-03 05:13:56,mariacadenas,,0,1,2,"Only 153 days until election day! The time is now. This March 3rd, let's get some representation into our representative government!",,,,1179625610559152128,https://twitter.com/mariacadenas/status/1179625610559152128
2019-10-02 19:28:27,mariacadenas,,0,0,3,"The gap between Californians with low incomes and high incomes continues to grow. Read @CalBudgetCenter's day-of analysis to learn what the new #CensusData means for Californians.",,@CalBudgetCenter,#CensusData,1179478269407576064,https://twitter.com/mariacadenas/status/1179478269407576064
2019-10-01 17:56:53,mariacadenas,,0,0,0,"Y @GloriaTrevi #PeloSuelto en serio este viaje a los 80s y 90s es exactamente lo que necesitaba...ahora por favor una de @Al3jandraGuzman",,@GloriaTrevi @Al3jandraGuzman,#PeloSuelto,1179092835854733313,https://twitter.com/mariacadenas/status/1179092835854733313
2019-10-01 17:52:04,mariacadenas,,1,0,0,"Y ahora ponen a @Timbiriche_35 ¿quien está al mando de la música? We could be friends",,@Timbiriche_35,,1179091624720134144,https://twitter.com/mariacadenas/status/1179091624720134144
2019-10-01 17:47:11,mariacadenas,,1,0,1,"Followed by @kabah_oficial #LaCalledelasSirenas, ahora si se puso buena la cosa #BuenosDias",,@kabah_oficial,#LaCalledelasSirenas #BuenosDias,1179090396678213633,https://twitter.com/mariacadenas/status/1179090396678213633
2019-10-01 17:45:42,mariacadenas,,0,0,0,"An unexpected and welcome surprise- @PaulinaRubio #CausayEfecto as background at a local coffee shop",,@PaulinaRubio,#CausayEfecto,1179090020868579328,https://twitter.com/mariacadenas/status/1179090020868579328
2019-09-28 20:38:43,mariacadenas,,0,0,0,"Vote for our health center to win the CPCA ""Beyond These Walls"" Video Contest. https://cpcabeyondthesewalls.com/video/moving-health-care-upstream via @CPCA",,@CPCA,,1178046399079780352,https://twitter.com/mariacadenas/status/1178046399079780352
2019-09-20 17:35:33,mariacadenas,,0,3,8,"We all need to stand up and do our part #GlobalClimateStrike https://www.usatoday.com/story/news/nation/2019/09/20/global-climate-strike-students-school-walkout-new-york-chicago-san-francisco/2373323001/ via @usatoday",,@USATODAY,#GlobalClimateStrike,1175101203144822784,https://twitter.com/mariacadenas/status/1175101203144822784
2019-09-19 21:36:07,mariacadenas,kmtrangel,1,0,1,"Los unicornios existen, Kat. Suerte!",,,,1174799353635995648,https://twitter.com/mariacadenas/status/1174799353635995648
2019-09-15 16:05:45,mariacadenas,KQED,0,0,1,"I just want toy makers to really value children and use biodegradable materials.",,,,1173266661761110016,https://twitter.com/mariacadenas/status/1173266661761110016
2019-09-13 05:51:48,mariacadenas,,0,0,0,"Our children need us to be vocal, visible, and intentional in efforts to address the climate crisis and the impacts it is creating in our region.",,,,1172387383339188224,https://twitter.com/mariacadenas/status/1172387383339188224
2019-09-12 16:54:07,mariacadenas,LatinoUSA,0,0,0,"Any of those proceeds going to indigenous communities?",,,,1172191673272721408,https://twitter.com/mariacadenas/status/1172191673272721408
2019-09-12 13:13:28,mariacadenas,,0,0,0,"We have to hold and love each other and our planet. And most importantly, we have to try, urgently and boldly. We cannot lie complacent, we cannot wait in comfort, we cannot do the same we have always done.",,,,1172136141505515521,https://twitter.com/mariacadenas/status/1172136141505515521
2019-09-12 04:19:03,mariacadenas,,0,0,2,"I’m excited to vote for the primaries on March 3rd ",,,,1172001653207121921,https://twitter.com/mariacadenas/status/1172001653207121921
2019-09-11 13:34:35,mariacadenas,,0,0,1,"This morning is always one of remembrance and healing. For the families gone too soon and the families hurt by policies of fear and acts of hate that followed. May we stand together with love in memory and respect, and may our actions reflect the best of who we are as a people.",,,,1171779071606317057,https://twitter.com/mariacadenas/status/1171779071606317057
2019-09-10 15:47:04,mariacadenas,nytimes,0,0,1,"Healthcare is a human right.",,,,1171450023831162882,https://twitter.com/mariacadenas/status/1171450023831162882
2019-09-09 05:03:44,mariacadenas,,0,0,1,"Canción del día: @Al3jandraGuzman⁩ - #LuchaDeGigantes (Live At The Roxy)",,@Al3jandraGuzman,#LuchaDeGigantes,1170925735722139648,https://twitter.com/mariacadenas/status/1170925735722139648
2019-09-08 02:11:55,mariacadenas,,0,0,2,"Celebrating 40 years of #SaludParaLaGente with amazing leaders working every day to make lives better for everyone",,,#SaludParaLaGente,1170520105714774016,https://twitter.com/mariacadenas/status/1170520105714774016
2019-09-06 02:22:30,mariacadenas,,0,0,1,"One of the greatest gifts of living in Santa Cruz is the scent of the ocean in the evening breeze.",,,,1169797996432592897,https://twitter.com/mariacadenas/status/1169797996432592897
2019-09-01 17:18:54,mariacadenas,apbenven,0,0,0,"What we do when we hold and lift each other is amazing. Thank you for the reminder and example of what is possible.",,,,1168211640321339392,https://twitter.com/mariacadenas/status/1168211640321339392
2019-08-31 14:22:47,mariacadenas,,0,0,1,"Our #LaborDayWeekend is a celebration and recognition of the economic and social gains achieved for and by working people. In today's #gigeconomy and historic #wealthgaps, let's use our ability to organize and use collective action to advance workers' rights and achieve #equalpay",,,#LaborDayWeekend #gigeconomy #wealthgaps #equalpay,1167804932151316482,https://twitter.com/mariacadenas/status/1167804932151316482
2019-08-29 13:45:43,mariacadenas,kmtrangel,0,0,1,"Thanks! I’m excited, too! @VoteMaria2020",,@VoteMaria2020,,1167070829953220608,https://twitter.com/mariacadenas/status/1167070829953220608
2019-08-29 01:53:47,mariacadenas,Quagmilia,0,0,0,"Thank you!",,,,1166891664834621441,https://twitter.com/mariacadenas/status/1166891664834621441
2019-08-28 21:44:33,mariacadenas,,0,0,0,"",,,,1166828943288070144,https://twitter.com/mariacadenas/status/1166828943288070144
2019-08-26 20:25:01,mariacadenas,,0,0,0,"Happy #WomensEqualityDay2019 ! To celebrate make sure you support a woman candidate for political office that will fight for gender equity - in our wages and in our healthcare",,,#WomensEqualityDay2019,1166084154821185536,https://twitter.com/mariacadenas/status/1166084154821185536
2019-08-25 15:44:18,mariacadenas,,0,0,1,"I’m ready for the music! You? Tune in @kzsc 88.1fm",,@kzsc,,1165651119260848128,https://twitter.com/mariacadenas/status/1165651119260848128
2019-08-25 02:34:39,mariacadenas,NPR,0,1,1,"#CloseTheCamps",,,#CloseTheCamps,1165452397121982464,https://twitter.com/mariacadenas/status/1165452397121982464
2019-08-24 23:53:51,mariacadenas,,0,0,1,"It’s the small things that make one feel welcomed",,,,1165411930619539456,https://twitter.com/mariacadenas/status/1165411930619539456
2019-08-24 19:53:28,mariacadenas,domesticworkers,0,0,5,"Yes, we do. All workers deserve protection.",,,,1165351436424597505,https://twitter.com/mariacadenas/status/1165351436424597505
2019-08-24 17:56:50,mariacadenas,,0,0,1,"Starting my Saturday",,,,1165322086648205312,https://twitter.com/mariacadenas/status/1165322086648205312
2019-08-24 15:11:43,mariacadenas,SCCVonline,0,0,0,"Tune in today as we talk predatory lending and it’s negative impact in our community",,,,1165280533816823808,https://twitter.com/mariacadenas/status/1165280533816823808
2019-08-24 04:33:58,mariacadenas,,0,1,3,"It’s 9:30pm and I’m talking about our need to be bold in making the world we want",,,,1165120035636953088,https://twitter.com/mariacadenas/status/1165120035636953088
2019-08-23 21:48:44,mariacadenas,,0,0,1,"My calendar is marked!",,,,1165018057682456576,https://twitter.com/mariacadenas/status/1165018057682456576
2019-08-23 21:01:46,mariacadenas,,0,1,8,"The Latina power is strong! ⁦⁦@HOPELatinas⁩ #LADSanJose",,@HOPELatinas,#LADSanJose,1165006238922375168,https://twitter.com/mariacadenas/status/1165006238922375168
2019-08-23 19:11:18,mariacadenas,,0,0,2,"Doing a morning meeting breakfast food right! This is the best start for a conversation on #Latina issues and policy work relating to #housing and #microenterprises @HOPELatinas",,@HOPELatinas,#Latina #housing #microenterprises,1164978439041908737,https://twitter.com/mariacadenas/status/1164978439041908737
2019-08-22 22:51:32,mariacadenas,ACLU,0,0,0,"Thank you",,,,1164671474503831554,https://twitter.com/mariacadenas/status/1164671474503831554
2019-08-20 04:26:38,mariacadenas,commonfutureco,0,0,0,"Our local and equitable economies are the foundation to our prosperous future",,,,1163668641851691009,https://twitter.com/mariacadenas/status/1163668641851691009
2019-08-16 18:09:50,mariacadenas,,0,0,1,"#QueridaFamilia si se puede y juntos we carry the light and power to do what must be done. Adelante!",,,#QueridaFamilia,1162426254009630721,https://twitter.com/mariacadenas/status/1162426254009630721
2019-08-15 20:26:48,mariacadenas,,0,0,0,"Trump rule: Businesses could bar LGBT workers",,,,1162098334389006336,https://twitter.com/mariacadenas/status/1162098334389006336
2019-08-15 11:45:08,mariacadenas,,0,2,5,"Why Doesn’t America Have Universal Health Care? One Word: Race",,,,1161967055412686848,https://twitter.com/mariacadenas/status/1161967055412686848
2019-08-13 16:45:19,mariacadenas,,0,0,0,"",,,,1161317820606504960,https://twitter.com/mariacadenas/status/1161317820606504960
2019-08-13 16:14:34,mariacadenas,,0,0,2,"When the journey takes you to a meeting in comic book coffee shop, you know you’re doing ok.",,,,1161310080865669120,https://twitter.com/mariacadenas/status/1161310080865669120
2019-08-13 16:10:06,mariacadenas,ACLU,0,0,1,"Losing cash puts those already on the economic margin further behind.",,,,1161308960651038723,https://twitter.com/mariacadenas/status/1161308960651038723
2019-08-12 15:53:09,mariacadenas,,0,0,0,"This is the continuation of the administration’s climate of terror strategy targeting immigrants, specifically Latino immigrants. And with it, putting the health and well-being of our communities at risk. #Resist https://www.huffpost.com/entry/public-charge-department-of-homeland-security-final-rule_n_5d449198e4b0ca604e31fb51 #via @HuffPostPol",,@HuffPostPol,#Resist,1160942305886363648,https://twitter.com/mariacadenas/status/1160942305886363648
2019-08-12 04:27:05,mariacadenas,,0,0,2,"In the mist of all hatred and trauma being directed at Latinos, I really really enjoyed and valued #doratheexplorer @DoraMovie",,@DoraMovie,#doratheexplorer,1160769651103555585,https://twitter.com/mariacadenas/status/1160769651103555585
2019-08-09 12:01:28,mariacadenas,calassets,0,0,1,"So proud of #Kiana. A true honor having her be part of our team.",,,#Kiana,1159796837546520576,https://twitter.com/mariacadenas/status/1159796837546520576
2019-08-09 01:07:37,mariacadenas,,0,0,0,"The intentional lack of humane treatment and harm being perpetuated to our families is terrorism. “They're going to lose everything”: Families are devastated after Mississippi ICE raids - USA TODAY",,,,1159632287887048704,https://twitter.com/mariacadenas/status/1159632287887048704
2019-08-06 15:46:24,mariacadenas,,0,0,2,"Waking up to the loss of #ToniMorrison whose words brought peace, richness, and growth. A day of sadness in a world made less bright. May she rest In peace and may each of us find a way to reflect the light she brought.",,,#ToniMorrison,1158766278569426944,https://twitter.com/mariacadenas/status/1158766278569426944
2019-08-05 20:23:06,mariacadenas,SCCVonline,0,0,0,"So honored to be part of this effort.",,,,1158473526099075072,https://twitter.com/mariacadenas/status/1158473526099075072
2019-08-04 04:48:35,mariacadenas,AymanM,0,0,0,"We need policy makers that understand this reality",,,,1157875956586971137,https://twitter.com/mariacadenas/status/1157875956586971137
2019-08-04 03:50:44,mariacadenas,,0,0,0,"My heart is heavy. Too much violence. Too much hatred. We must address the harm of racism. We can’t turn a blind eye to the structures that allow it and the #DomesticTerrorists to continue unabated. It is not only #GunControlNow it is an equity informed policy.",,,#DomesticTerrorists #GunControlNow,1157861401970352129,https://twitter.com/mariacadenas/status/1157861401970352129
2019-08-03 02:53:08,mariacadenas,,0,0,1,"En #Watsonville celebrando la fresa y recordando que unidos ganamos ",,,#Watsonville,1157484516719509505,https://twitter.com/mariacadenas/status/1157484516719509505
2019-08-02 06:01:57,mariacadenas,,0,1,4,"Mood: @Al3jandraGuzman #NoVoyEnTren (Live At The @theroxy) https://youtu.be/RCtzdE2cosw via @YouTube",,@Al3jandraGuzman @theroxy @YouTube,#NoVoyEnTren,1157169646904102913,https://twitter.com/mariacadenas/status/1157169646904102913
2019-07-28 15:57:23,mariacadenas,,0,1,0,"The music is ready. Are you? Tune in @kzsc for Breakfast in Bed: Music by Women for Everyone",,@kzsc,,1155507552710356997,https://twitter.com/mariacadenas/status/1155507552710356997
2019-07-27 08:27:02,mariacadenas,pajaronian,0,0,1,"It is not ok for children and families living in rural and low-income areas to have to suffer poorer health and decreased quality of life to allow for hemp production. We can and must do better.",,,,1155031828790513664,https://twitter.com/mariacadenas/status/1155031828790513664
2019-07-26 21:00:05,mariacadenas,,0,0,0,"In #Seaside enjoying great Oaxacan food, wisdom, and friendship with #AnaVentura",,,#Seaside #AnaVentura,1154858955304132608,https://twitter.com/mariacadenas/status/1154858955304132608
2019-07-26 02:22:01,mariacadenas,nprpolitics,0,0,0,"The last thing we need is more death.",,,,1154577582752296960,https://twitter.com/mariacadenas/status/1154577582752296960
2019-07-24 23:47:53,mariacadenas,,0,0,0,"Podiatrists are begging you to live by these 5 feet rules for summer - Well+Good",,,,1154176407326490624,https://twitter.com/mariacadenas/status/1154176407326490624
2019-07-23 13:34:26,mariacadenas,afabc_la,0,0,0,"No te olvides de aplicar, necesitamos tu voz!",,,,1153659640623669248,https://twitter.com/mariacadenas/status/1153659640623669248
2019-07-23 13:29:15,mariacadenas,,0,0,0,"BBC News - Russian LGBT activist Yelena Grigoryeva murdered in St Petersburg",,,,1153658335951851520,https://twitter.com/mariacadenas/status/1153658335951851520
2019-07-20 21:27:00,mariacadenas,,0,0,0,"There is magic in youth theater. Spending Saturday afternoon watching young actors bring Harry Potter to life.",,,,1152691402062516224,https://twitter.com/mariacadenas/status/1152691402062516224
2019-07-20 15:59:03,mariacadenas,,0,0,0,"Every member of Trump’s new human rights commission is an anti-LGBTQ activist / LGBTQ Nation",,,,1152608867576008707,https://twitter.com/mariacadenas/status/1152608867576008707
2019-07-20 14:05:48,mariacadenas,,0,0,2,"Republicans' Quest for a White America Is Destroying America | Time",,,,1152580368484093952,https://twitter.com/mariacadenas/status/1152580368484093952
2019-07-20 00:25:31,mariacadenas,phoenikera,0,0,0,"Lol ",,,,1152373937415655429,https://twitter.com/mariacadenas/status/1152373937415655429
2019-07-19 17:57:50,mariacadenas,pajaronian,0,0,0,"Great news! Bringing Watsonville’s healthcare back to local ownership",,,,1152276372049428485,https://twitter.com/mariacadenas/status/1152276372049428485
2019-07-08 19:53:21,mariacadenas,,0,0,0,"“there is — without question and for whatever reasons — still a massive gap between men’s and women’s World Cup bonuses.” #EqualPay",,,#EqualPay,1148319177008021504,https://twitter.com/mariacadenas/status/1148319177008021504
2019-07-07 18:54:10,mariacadenas,,0,0,0,"@SCCVonline is hiring a Program Manager and Administrative Assistant. Take a look and share among your networks. https://www.sccvonline.org/jobs.html",,@SCCVonline,,1147941897735983105,https://twitter.com/mariacadenas/status/1147941897735983105
2019-07-07 01:40:25,mariacadenas,,0,0,0,"Song of the day @SeinaboSey #IOweYouNothing",,@SeinaboSey,#IOweYouNothing,1147681745526910977,https://twitter.com/mariacadenas/status/1147681745526910977
2019-07-06 18:48:44,mariacadenas,SenFeinstein,0,0,2,"With all due respect, accountability measures should have been negotiated before signing off the equivalent of a blank check.",,,,1147578141310779392,https://twitter.com/mariacadenas/status/1147578141310779392
2019-07-05 18:48:21,mariacadenas,,0,2,6,"Why Should Immigrants ‘Respect Our Borders’? The West Never Respected Theirs",,,,1147215657009741824,https://twitter.com/mariacadenas/status/1147215657009741824
2019-07-05 18:01:15,mariacadenas,nytimes,1,0,4,"Thanks for reminding me to make a contribution to @KamalaHarris #KamalaHarris2020 President",,@KamalaHarris,#KamalaHarris2020,1147203804745482240,https://twitter.com/mariacadenas/status/1147203804745482240
2019-07-04 14:34:17,mariacadenas,,0,0,0,"A Mexico City queer bar resists attacks with love and cumbia - Los Angeles Times",,,,1146789329194242049,https://twitter.com/mariacadenas/status/1146789329194242049
2019-07-04 03:36:02,mariacadenas,,0,0,0,"Drawings by migrant children who were in detention show them in cages https://www.nbcnews.com/news/latino/drawings-migrant-children-detention-show-them-cages-n1026311 via @nbcnews",,@NBCNews,,1146623676453834753,https://twitter.com/mariacadenas/status/1146623676453834753
2019-07-03 22:07:15,mariacadenas,nprpolitics,0,0,1,"Gaslighting in action.",,,,1146540938027655172,https://twitter.com/mariacadenas/status/1146540938027655172
2019-07-03 17:41:43,mariacadenas,,0,2,3,"This 4th of July, help reunite families by freeing imprisoned migrants held on bond. #FreedomDay #FamiliesBelongTogether #CloseTheCamps",,,#FreedomDay #FamiliesBelongTogether #CloseTheCamps,1146474114212757505,https://twitter.com/mariacadenas/status/1146474114212757505
2019-07-03 03:02:24,mariacadenas,,0,0,1,"So the President F*cking Hates My Girlfriend | By Sue Bird",,,,1146252825472593921,https://twitter.com/mariacadenas/status/1146252825472593921
2019-07-02 22:05:14,mariacadenas,nprpolitics,1,0,4,"Wait, let me guess, next up debtor’s prisons run by private companies",,,,1146178042017931264,https://twitter.com/mariacadenas/status/1146178042017931264
2019-07-02 04:22:55,mariacadenas,Reuters,16,0,9,"We all should be outraged #CloseTheConcentrationCamps",,,#CloseTheConcentrationCamps,1145910700025344001,https://twitter.com/mariacadenas/status/1145910700025344001
2019-07-01 22:56:20,mariacadenas,,0,0,0,"Playing a 2013 playlist I did for @kzsc “Breakfast in Bed”. It holds against the test of time ",,@kzsc,,1145828511568891904,https://twitter.com/mariacadenas/status/1145828511568891904
2019-07-01 18:10:31,mariacadenas,nprpolitics,0,0,2,"If by an economy doing well you mean people can actually afford rent without holding three jobs, then yes, it can be better.",,,,1145756585643261952,https://twitter.com/mariacadenas/status/1145756585643261952
2019-07-01 18:08:38,mariacadenas,nprpolitics,0,0,2,"You know how it will be better? When my very existence is not threaten every day #lgbt #immigrant #woman #uscitizen",,,#lgbt #immigrant #woman #uscitizen,1145756110223073281,https://twitter.com/mariacadenas/status/1145756110223073281
2019-07-01 15:31:02,mariacadenas,,0,0,0,"We're headed for 'climate apartheid,' in which the poor will suffer while the rich save themselves, warns a chilling UN report https://www.businessinsider.com/climate-apartheid-united-nations-report-2019-6?utm_content=bufferf74bb&amp;fbclid=IwAR2JpCFLqq5ci9506ZzRpFQEsUpNroMUmvsjF6AgrGkO7e8Ig5CqGjBvpXE?utm_source=twitter&amp;utm_medium=referral&amp;utm_content=topbar&amp;utm_term=mobile&amp;referrer=twitter via @businessinsider",,@businessinsider,,1145716449962422273,https://twitter.com/mariacadenas/status/1145716449962422273
2019-07-01 05:14:20,mariacadenas,,0,0,1,"The Future Is Fresno: Meet The Latina Behind the Valley's Largest Ever Series A via @forbes",,@Forbes,,1145561249410715648,https://twitter.com/mariacadenas/status/1145561249410715648
