date,username,to,replies,retweets,favorites,text,geo,mentions,hashtags,id,permalink
2019-08-28 03:43:01,NikkaGOP,PardesSeleh,0,0,1,"Cannabinoids, the best and safest alternative to opiods, are still illegal at the federal level and not covered by any major healthcare providers including Medicare/Medicaid and the Veterans Affairs clinics",,,,1166556766315921408,https://twitter.com/NikkaGOP/status/1166556766315921408
2019-08-28 02:32:27,NikkaGOP,AOC,0,0,3,"Why even have a Congress then? Why not just have EVERYTHING be a popular vote?",,,,1166539009654345728,https://twitter.com/NikkaGOP/status/1166539009654345728
2019-08-27 14:08:01,NikkaGOP,MahgdalenRose,0,0,0,"In 2018, Republicans lacked the leadership to put candidates forth in 40 congressional districts. Democrats- only 12. Every race without a R is an immediate loss. I am in the 3rd bluest district. I don’t want your money... I just need our party to have a voice in every district!",,,,1166351666137849857,https://twitter.com/NikkaGOP/status/1166351666137849857
2019-08-27 04:44:27,NikkaGOP,,0,1,2,"Ask yourself this: why do @SenSanders and @ewarren want to give “free” college education instead of improved elementary, middle &amp; high school? The same reason @AndrewYang wants to give UBI to Americans who are 18 and up ONLY. It is because those are the people who vote! #MAGA",,@SenSanders @ewarren @AndrewYang,#MAGA,1166209837841010688,https://twitter.com/NikkaGOP/status/1166209837841010688
2019-08-27 02:59:04,NikkaGOP,JRubinBlogger,0,0,0,"“There was never a genius without a tincture of madness.” -Aristotle",,,,1166183318372536320,https://twitter.com/NikkaGOP/status/1166183318372536320
2019-08-27 01:37:52,NikkaGOP,,1,0,1,"@Kevinloves3d how far off are we from graphene-based 3D printing?",,@Kevinloves3d,,1166162886080651265,https://twitter.com/NikkaGOP/status/1166162886080651265
2019-08-27 00:31:03,NikkaGOP,,0,0,0,".@realDonaldTrump you should get a dog! I am personally a huge fan of GREAT DANES. They will guard Barron and Melania better than the Secret Service. (Here’s a photo of Zeus and Kali with their buddy Tessa)",,@realDonaldTrump,,1166146069656289280,https://twitter.com/NikkaGOP/status/1166146069656289280
2019-08-27 00:17:52,NikkaGOP,paulsperry_,0,0,0,"Negative $280,000 is technically more than negative $300,000 ",,,,1166142751269765120,https://twitter.com/NikkaGOP/status/1166142751269765120
2019-08-26 23:50:33,NikkaGOP,,0,0,0,"It is weird that @AOC supports abolishing the electoral college since @SenSanders represents the 2nd smallest state in the country. He represents 600,000 people, California senators 40 Million. My question to Congresswoman Cortez is: do you also support abolishing the Senate?",,@AOC @SenSanders,,1166135879091359754,https://twitter.com/NikkaGOP/status/1166135879091359754
2019-08-26 18:40:56,NikkaGOP,MahgdalenRose,1,0,3,"Constituents in my district have told me that they fear for their safety when wearing their “Women for Trump” clothes in public. Nobody wants to be ambushed like @kiarabickers",,@kiarabickers,,1166057957466857474,https://twitter.com/NikkaGOP/status/1166057957466857474
2019-08-26 18:27:44,NikkaGOP,Jordan_Sather_,0,0,0,"My grandfather was a brilliant Sikh American who worked for @LockheedMartin @SETIInstitute and @NASA sending radio signals into space in hopes of our messages being received and decoded by inteligent life. He was a professor at @Stanford... even Europa may have intelligent life!",,@LockheedMartin @SETIInstitute @NASA @Stanford,,1166054637322919942,https://twitter.com/NikkaGOP/status/1166054637322919942
2019-08-26 18:10:05,NikkaGOP,,0,0,1,"@Jordan_Sather_ there are a bunch of fools (@TMclaughlin3 @jaredlholt and @benFranklin2018) that are putting out some bizarre statements regarding the Hong Kong video you shared. They want us to report you and share their tweet... they are weak men who rely on censorship #QAnon",,@Jordan_Sather_ @TMclaughlin3 @jaredlholt @benFranklin2018,#QAnon,1166050196335161344,https://twitter.com/NikkaGOP/status/1166050196335161344
2019-08-26 17:44:37,NikkaGOP,FuctupMike,0,1,2,"An index of the S&P 500 is a Safe investment. Averages 7-10% per year. You should treat your brockerage account like a Piggy Bank. If you hold a stock for more than 1 year, it is taxed at the capital gains rate instead of personal income tax. Also, invest in US companies you like",,,,1166043786578841600,https://twitter.com/NikkaGOP/status/1166043786578841600
2019-08-26 16:47:51,NikkaGOP,charliekirk11,0,0,0,"Confucius say, man who wants Free Speech will Pay the price of hypocrisy",,,,1166029502243192832,https://twitter.com/NikkaGOP/status/1166029502243192832
2019-08-26 00:15:29,NikkaGOP,AddictedToBrass,0,0,1,"Drink some water and go on a run, maybe visit a dog park... you have too much going for you! Please, look to brighter horizons, these emotions are only transient. Godspeed!",,,,1165779764876984320,https://twitter.com/NikkaGOP/status/1165779764876984320
2019-08-25 16:58:14,NikkaGOP,,0,2,1,"This is why all techies should be voting for @realDonaldTrump and not @AndrewYang or @ewarren, two candidates who are afraid of Artificial Intelligence. If you fear Intelligence, you are unintelligent!",,@realDonaldTrump @AndrewYang @ewarren,,1165669728016195585,https://twitter.com/NikkaGOP/status/1165669728016195585
2019-08-25 16:39:06,NikkaGOP,WalshFreedom,0,2,2,"I pity the fool... if only you understood the first thing about central banking and the risks of an inverted yield curve. @realDonaldTrump is right, rates were raised too fast for too long. 2 year was yielding more than 30 year T-bonds. Inverted yield curve = recession predictor",,@realDonaldTrump,,1165664912036597760,https://twitter.com/NikkaGOP/status/1165664912036597760
2019-08-25 01:04:50,NikkaGOP,DavidJHarrisJr,0,0,9,"For anyone confused about why the electoral college exists, I highly recommend reading up on the formation of the 12th amendment as well as the 1796 and 1800 elections...",,,,1165429793468239872,https://twitter.com/NikkaGOP/status/1165429793468239872
2019-08-25 00:58:28,NikkaGOP,JackPosobiec,0,0,0,"Luke already went to the dark side when he attempted to murder his nephew in his sleep. Kylo had to finish what Anakin started... anakin got close to the empreror before throwing him to the abyss, and Kylo had to get close to Snoke before ambushing him. Rey naturally hates jedi",,,,1165428194314375168,https://twitter.com/NikkaGOP/status/1165428194314375168
2019-08-25 00:49:45,NikkaGOP,,0,0,0,"Idaho Court orders taxpayer-funded gender reassignment surgery for convicted pedophile! “Edmo is serving a sentence of three to ten years for sexual abuse of a child under 16 years of age in Bannock County”",,,,1165425998172573696,https://twitter.com/NikkaGOP/status/1165425998172573696
2019-08-24 22:26:35,NikkaGOP,,0,0,0,"Taxes have a negative effect on the velocity of money. Instead of being invested and spent, capital sits idle until April of each year. Sales taxes reduce gross sales by not only raising the cost of the goods sold but by “retiring” capital from circulation...",,,,1165389970577608709,https://twitter.com/NikkaGOP/status/1165389970577608709
2019-08-24 16:26:24,NikkaGOP,,0,0,0," My name is Alexander Hamilton what a legendary musical... if you ever have the chance, you must see it.",,,,1165299326999904256,https://twitter.com/NikkaGOP/status/1165299326999904256
2019-08-24 03:25:46,NikkaGOP,,0,0,0,"The friendship fostered between @realDonaldTrump and Kim Jong Un is amazing. North Korea has an extremely bright future!",,@realDonaldTrump,,1165102874306547712,https://twitter.com/NikkaGOP/status/1165102874306547712
2019-08-24 00:33:33,NikkaGOP,rondeaulivia,0,0,0,"The key to succeeding in college is office hours. Go to as many as you have time for, even if you just have vague questions about something from lecture. Most professors are eager to share their wisdom.",,,,1165059534756335616,https://twitter.com/NikkaGOP/status/1165059534756335616
2019-08-23 17:39:30,NikkaGOP,,0,0,0,"It is 2019... @Apple should be releasing the Apple Car, not the Apple Card.",,@Apple,,1164955334114332672,https://twitter.com/NikkaGOP/status/1164955334114332672
2019-08-23 16:40:15,NikkaGOP,robreiner,0,0,0,"Are these the opening lines to your flop about LBJ? You made the cut for the top 200 Worst Wide Openings with that film, even with the great Woody Harrelson starring in your film, $2.5M in box office on a budget of $20M... people don’t buy your historical revisionism",,,,1164940423313293313,https://twitter.com/NikkaGOP/status/1164940423313293313
2019-08-23 16:03:42,NikkaGOP,,0,1,1,"“In all criminal prosecutions, the accused shall enjoy the right to a speedy and public trial, by an impartial jury of the State and district wherein the crime shall have been committed” emphasis on Public... rubber-stamp surveillance courts are a threat to our democracy.",,,,1164931226274107392,https://twitter.com/NikkaGOP/status/1164931226274107392
2019-08-23 16:01:09,NikkaGOP,,1,1,1,"It is now clear that @realDonaldTrump was spied on for months and had wiretapped aides. This is objectively far worse than the watergate scandal and for a much greater duration. How did Obama get away with this? Secret FISA courts are unconstitutional per the 6th Amendment.",,@realDonaldTrump,,1164930583899729920,https://twitter.com/NikkaGOP/status/1164930583899729920
2019-08-23 14:53:15,NikkaGOP,,0,0,0,"I believe the policies of the Democrats accelerate global warming. Anyone remember when @BarackObama’s Department of Energy squandered over half a billion on Solyndra? The best way to encourage renewable energy is by cutting taxes so people can afford to upgrade infrastructure",,@BarackObama,,1164913497097900033,https://twitter.com/NikkaGOP/status/1164913497097900033
2019-08-22 15:20:25,NikkaGOP,BernieSanders,0,0,0,"Here is bernie with his comprehensive _______ reform. Now we just gotta wait for his common-sense _______ laws.",,,,1164557946371497985,https://twitter.com/NikkaGOP/status/1164557946371497985
2019-08-21 20:05:46,NikkaGOP,realDonaldTrump,0,0,0,"Mr. President, with due respect I believe 50 miles per gallon by 2025 is a pretty low bar of success. Our auto industry is capable of delivering more than 3x the efficiency today. Think about the healthcare savings due to respiratory improvement... by 2025 market will be 100% EV",,,,1164267370539442176,https://twitter.com/NikkaGOP/status/1164267370539442176
2019-08-21 19:44:34,NikkaGOP,RealAMPeople,0,0,1,"“Hang up, I’m reading emails!”",,,,1164262031928651777,https://twitter.com/NikkaGOP/status/1164262031928651777
2019-08-21 18:13:15,NikkaGOP,BlueStateSOS,1,1,6,"The way that elephant smashed that girl’s cell phone you’d think it worked for Hillary Clinton",,,,1164239053560012800,https://twitter.com/NikkaGOP/status/1164239053560012800
2019-08-21 15:21:45,NikkaGOP,,0,0,0,"""A living thing desires above all to vent its strength—life as such is will to power—: self-preservation is only one of the indirect and most frequent consequences of it"" Nietzsche",,,,1164195892309532672,https://twitter.com/NikkaGOP/status/1164195892309532672
2019-08-21 03:48:23,NikkaGOP,JackPosobiec,0,0,1,"He was also teaching people HTML...",,,,1164021402782978048,https://twitter.com/NikkaGOP/status/1164021402782978048
2019-08-20 23:54:50,NikkaGOP,RealSarahIdan,1,4,9,"More than $3 million? Doesn’t Ilhan mean more than $3 billion? Also, Kenya and Somalia receive over $1.5 billion per year... two countries where Ilhan has lived. If democracy were the prerequisite for foreign aid, shouldn’t she be calling to “Boycott, Divest & Sanction” Somalia?",,,,1163962628030386176,https://twitter.com/NikkaGOP/status/1163962628030386176
2019-08-19 21:44:51,NikkaGOP,KamalaHarris,0,0,5,"Awesome... be sure to Thank the @GOP for the 19th Amendment, Kamala!",,@GOP,,1163567528360042496,https://twitter.com/NikkaGOP/status/1163567528360042496
2019-08-18 23:35:13,NikkaGOP,,0,0,0,"Can you guess what happened to Dean Lorich?",,,,1163232917222379520,https://twitter.com/NikkaGOP/status/1163232917222379520
2019-08-18 23:34:33,NikkaGOP,,1,0,0,"Dean Lorich also criticized the Clintons saying ""the Clintons only portended the difficulties we would have once we arrived."" He also said there was ""zero security” despite promises.",,,,1163232745620832257,https://twitter.com/NikkaGOP/status/1163232745620832257
2019-08-18 23:33:55,NikkaGOP,,1,0,0,"There was an email leaked by WikiLeaks from Dean to Christopher Born. In the emails, he complained about the unorganized Haiti crisis response. He was part of a team that had mobilized to help those impacted by the 2010 Haiti earthquake.",,,,1163232587831136256,https://twitter.com/NikkaGOP/status/1163232587831136256
2019-08-18 18:21:58,NikkaGOP,SenSanders,0,0,2,"If only you, the Clintons and Joe Biden had been in congress & the white house during the past 3 decades, you could’ve fixed it... oh wait, you all were! @Hickenlooper was right about one thing, for such a senior politician you sure do a lot of finger pointing!",,@Hickenlooper,,1163154084121022465,https://twitter.com/NikkaGOP/status/1163154084121022465
2019-08-18 17:22:20,NikkaGOP,NikkaGOP,0,0,0,"",,,,1163139077492707330,https://twitter.com/NikkaGOP/status/1163139077492707330
2019-08-18 17:21:14,NikkaGOP,YAAS_America,1,0,0,"",,,,1163138799766888448,https://twitter.com/NikkaGOP/status/1163138799766888448
2019-08-17 22:59:33,NikkaGOP,,0,0,0,"@Jesus_porvida California has had a “Trifecta” for years now. Governor since 2011, State Senate and State Assembly for 25+ years... why is it that we have 20% of the country’s homeless population? People I ask says its the weather... I don’t buy it",,@Jesus_porvida,,1162861551952379904,https://twitter.com/NikkaGOP/status/1162861551952379904
2019-08-17 08:52:01,NikkaGOP,,0,0,0,"I really respect @aplusk... facial recognition and big data of hotel rooms to track down human traffickers is probably the best use of Artificial Intelligence today.",,@aplusk,,1162648261502459904,https://twitter.com/NikkaGOP/status/1162648261502459904
2019-08-17 08:40:09,NikkaGOP,madwestafrican,0,2,5,"Medical marijuana should be legal in every state. Recreational should be each state’s right to decide. Commute sentences for non-violent drug offenses on case by case basis. Oppose any additional taxes placed on marijuana. Because THC & CBD cure many cancers...",,,,1162645278203117568,https://twitter.com/NikkaGOP/status/1162645278203117568
2019-08-16 18:34:00,NikkaGOP,,0,1,1,"No one should have to fight off crackheads to get into their home. @paneezkosarian we stand with you. He probably was shooting up stimulants using @GavinNewsom SF’s Department of Public Health’s 25-year-old Free Needle Exchange program if you made me guess... 5M syringes per year",,@GavinNewsom,,1162432337121931264,https://twitter.com/NikkaGOP/status/1162432337121931264
2019-08-15 17:34:57,NikkaGOP,,0,0,0,"Take a second and go follow the prolific @MaElviraSalazar... she is going to win back #FL27 mark my words!",,@MaElviraSalazar,#FL27,1162055088157814785,https://twitter.com/NikkaGOP/status/1162055088157814785
2019-08-15 16:59:47,NikkaGOP,,0,2,3,"Had a GREAT time registering new Republicans after their citizenship ceremony. Met Americans from all around the world... Egypt, India, Mexico, Namibia, Spain... really proud of them for going the legal route. Big thank you to @COCOGOP and @SFGOP for organizing this!",,@COCOGOP @SFGOP,,1162046238360928263,https://twitter.com/NikkaGOP/status/1162046238360928263
2019-08-15 03:27:25,NikkaGOP,,0,0,1,"Artificial Inteligence creates more jobs than it displaces. If AI takes jobs from humans, why do we have the highest employment numbers in decades AND the best AI of all-time? This is why @AndrewYang operates under a false pretense. AI creates jobs, and @realDonaldTrump gets it.",,@AndrewYang @realDonaldTrump,,1161841798282481664,https://twitter.com/NikkaGOP/status/1161841798282481664
2019-08-15 00:52:33,NikkaGOP,SenSanders,0,0,0,"Bernie... we keep hearing about your “comprehensive ________ reforml and “common-sense _________ laws” but you never get into specifics. Trump’s drug price transparency and right to try are more than you’ve done for healthcare in your long career...",,,,1161802823517925376,https://twitter.com/NikkaGOP/status/1161802823517925376
2019-08-14 22:35:50,NikkaGOP,Cernovich,0,0,0,"He is a legend. Very professional.",,,,1161768417860304896,https://twitter.com/NikkaGOP/status/1161768417860304896
2019-08-14 20:15:08,NikkaGOP,williamlegate,1,0,0,"Put your money where your mouth is... You won’t short the S&P, will you? Until then, you’re just provoking hysteria.",,,,1161733013106905088,https://twitter.com/NikkaGOP/status/1161733013106905088
2019-08-14 17:14:52,NikkaGOP,williamlegate,3,0,0,"I see you’re taking a note from @billmaher’s book? Hoping for a recession to get Trump out of office... how unamerican. In any case, recessions are two quarters of negative growth so it will have recovered by november 2020. Three or more quarters is considered a depression.",,@billmaher,,1161687643630927872,https://twitter.com/NikkaGOP/status/1161687643630927872
2019-08-14 08:26:32,NikkaGOP,williamlegate,0,0,0,"Of course. I mean, it’s not like Republicans ratified the 24th Amendment ending the Democrats’ poll tax...",,,,1161554684294914048,https://twitter.com/NikkaGOP/status/1161554684294914048
2019-08-13 19:35:53,NikkaGOP,,0,0,1,"I saw the brightest meteor I’ve ever seen last night. It was like a paintbrush across the sky. Be sure to catch the Perseid Meteor Shower tonight if you missed it yesterday.",,,,1161360746124460032,https://twitter.com/NikkaGOP/status/1161360746124460032
2019-08-13 15:43:08,NikkaGOP,,0,0,0,"USA needs to solidify itself as the world leader in cannabinoid-based medical treatment. The potential in oncology is too promising for our country to pass up on this. #LegalizeCannabis",,,#LegalizeCannabis,1161302173629612032,https://twitter.com/NikkaGOP/status/1161302173629612032
2019-08-13 08:17:35,NikkaGOP,williamlegate,2,0,0,"You’re putting words in my mouth. Besides, you are missing the point. Sales taxes are regressive. Higher portion of earnings from low-income individuals go to pay the sales tax than rich. The rich don’t notice the sales tax, homeless ppl buying food & a car to live in do notice.",,,,1161190045128151040,https://twitter.com/NikkaGOP/status/1161190045128151040
2019-08-13 08:08:07,NikkaGOP,NikkaGOP,0,0,2,"Even if you had to replace three blades anually, $300,000 in running cost would be covered by income. If it runs at 20% and only makes $1,000 per day, it would still be making $365,000 and “turn” a slight profit. Much longer ROI in this case but still economical w insurance",,,,1161187665590358016,https://twitter.com/NikkaGOP/status/1161187665590358016
2019-08-13 06:38:56,NikkaGOP,williamlegate,2,0,0,"You’re right, you have a sales tax of 10.25% in Santa Monica. My source is this fringe organization called the California Department of Tax and Fee Administration. Not sure if Snopes has fact-checked it yet though. You must not shop much? https://www.cdtfa.ca.gov/taxes-and-fees/rates.aspx",,,,1161165219743203334,https://twitter.com/NikkaGOP/status/1161165219743203334
2019-08-13 03:51:23,NikkaGOP,MahgdalenRose,0,0,1,"In the early 20th century, the Bank of Italy was established to do business with Italians who had been refused business at existing financial institutions due to some of those stereotypes. In 1930, founder Amadeo Giannini renamed it to @BankofAmerica",,@BankofAmerica,,1161123053880745986,https://twitter.com/NikkaGOP/status/1161123053880745986
2019-08-13 02:35:57,NikkaGOP,GregNorberg,3,0,8,"Assuming it is making 2,000 Kw/h and can sell electricity at $0.10 per kw/h, that is $200 per hour and almost $5,000 per day. If the $4 million turbine lasts more than 1,000 days then it would be netting profit. That seems like a pretty good Return On Investment.",,,,1161104069189967873,https://twitter.com/NikkaGOP/status/1161104069189967873
2019-08-12 23:50:54,NikkaGOP,williamlegate,1,0,1,"There is nothing good about having 20% of the nation’s homeless population. Sales tax of 10%, property taxes up to 3% and extremely burdensome permits have contributed to this despair. @SecretaryCarson HUD should be encouraging home ownership, less rent https://www.usich.gov/homelessness-statistics/ca/",,@SecretaryCarson,,1161062536671682561,https://twitter.com/NikkaGOP/status/1161062536671682561
2019-08-12 18:56:09,NikkaGOP,,0,0,1,"",,,,1160988356760571904,https://twitter.com/NikkaGOP/status/1160988356760571904
2019-08-12 18:52:45,NikkaGOP,,1,0,0,"The key to preventing a large asteroid from colliding with Earth is early detection. The sooner our telescopes observe these objects near Earth’s orbit, the faster we can deflect the asteroids off their course. One method is to use a laser to affect the body’s spin & course.",,,,1160987501948858369,https://twitter.com/NikkaGOP/status/1160987501948858369
2019-08-12 18:45:25,NikkaGOP,,1,0,1,"For the next week, if you look at the sky, you will see shooting stars every couple minutes. While the annual Perseid meteor shower is beautiful, it is a constant reminder of the inevitability of Earth’s collision with Asteroids. The US Space Force will solve these threats.",,,,1160985657709195264,https://twitter.com/NikkaGOP/status/1160985657709195264
2019-08-12 18:37:13,NikkaGOP,,0,0,0,"I find it hilarious that @SenSanders has hijacked the Democratic Party and turned it into the Socialist/Communist Party. Why @TheDemocrats would let an independent like Bernie in their primary race is beyond me...",,@SenSanders @TheDemocrats,,1160983592077369344,https://twitter.com/NikkaGOP/status/1160983592077369344
2019-08-12 18:28:33,NikkaGOP,SharkFriend3,0,0,0,"Well, give Bernie another 30 years in the Senate maybe he will get it through!",,,,1160981413614612483,https://twitter.com/NikkaGOP/status/1160981413614612483
2019-08-12 15:16:01,NikkaGOP,,0,0,0,"https://www.youtube.com/watch?v=7qYckI0YV-0 “poor kids are just as bright and just as talented as white kids” @JoeBiden the opposite of “poor” isn’t “white”... pick up a thesaurus because you have forgotten how antonyms work!",,@JoeBiden,,1160932960876367875,https://twitter.com/NikkaGOP/status/1160932960876367875
2019-08-12 07:14:34,NikkaGOP,BernieSanders,0,5,37,"Protect our democracy! We need to #DemandVoterID",,,#DemandVoterID,1160811797529550848,https://twitter.com/NikkaGOP/status/1160811797529550848
2019-08-10 17:22:52,NikkaGOP,rondeaulivia,0,0,0,"Repeal the 16th amendment? I like the sound of that, Olivia.",,,,1160240108232044545,https://twitter.com/NikkaGOP/status/1160240108232044545
2019-08-09 17:41:23,NikkaGOP,SonnyTheGreat_,0,0,0,"I once met a liberal bigoteer in Berkeley who did not know who Justice Clarence Thomas was, and had the gall to insult ME!",,,,1159882380808556544,https://twitter.com/NikkaGOP/status/1159882380808556544
2019-08-08 22:56:30,NikkaGOP,,0,0,0,"Do you realize that there is a 14.5% Payroll tax on every worker in this country? Wages & Employment would skyrocket in the absence of this tax! Make it voluntary and see how many people choose to continue paying in...",,,,1159599291515588609,https://twitter.com/NikkaGOP/status/1159599291515588609
2019-08-08 16:02:37,NikkaGOP,Luckytobeme3,3,0,3,"",,,,1159495134997708800,https://twitter.com/NikkaGOP/status/1159495134997708800
2019-08-08 13:11:25,NikkaGOP,TomFitton,0,1,1,"It was just a waste of money. Parkland’s Nikolas Cruz was tipped off to the FBI multiple times prior to his heinous act! Opportunity cost always is a factor.",,,,1159452050364567553,https://twitter.com/NikkaGOP/status/1159452050364567553
2019-08-08 01:55:32,NikkaGOP,SenSanders,0,0,0,"Double NASA’s funding for 50 years or make partying at college “free”",,,,1159281960830717952,https://twitter.com/NikkaGOP/status/1159281960830717952
2019-08-07 18:47:14,NikkaGOP,PardesSeleh,0,0,0,"",,,,1159174174260125696,https://twitter.com/NikkaGOP/status/1159174174260125696
2019-08-07 18:45:24,NikkaGOP,,0,0,0,"Saw a misleading cut of this Trump rally. The audio was taken out of context. Let's clear the mist on how @realDonaldTrump reacted: 1) stopped his rally 2) walked over to reprimand until gone 3) complain that the KKK-sympathizer was not thrown out fast enough due to PC-culture",,@realDonaldTrump,,1159173712765001728,https://twitter.com/NikkaGOP/status/1159173712765001728
2019-08-07 04:12:33,NikkaGOP,madwestafrican,0,0,0,"",,,,1158954054678040577,https://twitter.com/NikkaGOP/status/1158954054678040577
2019-08-07 03:36:11,NikkaGOP,DukeT49834039,0,0,1,"The United Socialist Party of Venezuela is socialist. Not sure how you have convinced yourself otherwise but I am somewhat impressed by your mental gymnastics.",,,,1158944903159697408,https://twitter.com/NikkaGOP/status/1158944903159697408
2019-08-06 21:40:28,NikkaGOP,erinturmelle,0,0,0,"Poor @CoryBooker talks big but is too afraid to go where the “boogeyman” will be! Wants @realDonaldTrump to cancel his rally because Booker is going to the same state 2 days later. #snowflake",,@CoryBooker @realDonaldTrump,#snowflake,1158855382673969152,https://twitter.com/NikkaGOP/status/1158855382673969152
2019-08-06 00:57:06,NikkaGOP,TamikaGHamilton,0,0,0,"Beautiful family, Tamika. #CA3",,,#CA3,1158542481580941312,https://twitter.com/NikkaGOP/status/1158542481580941312
2019-08-05 18:37:33,NikkaGOP,Cernovich,0,0,0,"Unflavored creatine mixed with 100% juice",,,,1158446963940925441,https://twitter.com/NikkaGOP/status/1158446963940925441
2019-08-04 17:59:05,NikkaGOP,FuctupMike,0,0,0,"More frightened than frightening",,,,1158074893457428480,https://twitter.com/NikkaGOP/status/1158074893457428480
2019-08-04 08:42:46,NikkaGOP,stclairashley,0,0,0,"As long as you don’t lick the ice cream and put it back, yes",,,,1157934894078541824,https://twitter.com/NikkaGOP/status/1157934894078541824
