date,username,to,replies,retweets,favorites,text,geo,mentions,hashtags,id,permalink
2020-03-02 19:53:34,NikkaGOP,,0,0,0,"I am a music teacher at several elementary schools in San Francisco. I just informed my employer that I will be going on STRIKE until the outbreak of the coronavirus subsists. US schools must preemptively shut down!",,,,1234567546226925575,https://twitter.com/NikkaGOP/status/1234567546226925575
2020-03-02 16:43:33,NikkaGOP,V8POW,0,0,0,"What kinda fake news is this?",,,,1234519725658402817,https://twitter.com/NikkaGOP/status/1234519725658402817
2020-03-02 16:21:41,NikkaGOP,MarDBallJr,2,0,1,"I think they are big trading partners so transmission probably occurred from trade not tourism or casual travel.",,,,1234514222165348352,https://twitter.com/NikkaGOP/status/1234514222165348352
2020-03-02 04:46:42,NikkaGOP,,0,0,0,"Bernie is not a Democrat. He’s an independent. Why would DNC give him the nomination when he won’t even rep his colors?",,,,1234339324851699712,https://twitter.com/NikkaGOP/status/1234339324851699712
2020-02-28 21:15:05,NikkaGOP,,0,0,0,"",,,,1233500893854621696,https://twitter.com/NikkaGOP/status/1233500893854621696
2020-02-27 22:43:06,NikkaGOP,mitchellvii,0,1,6,"What are you talking about? 28 new cases reported in California alone. 8400 being watched but we’re out of test kits.",,,,1233160656699871233,https://twitter.com/NikkaGOP/status/1233160656699871233
2020-02-27 17:46:28,NikkaGOP,Cernovich,2,2,61,"The worst part about this is that “Dude” is a noun and not a pronoun",,,,1233086007693627398,https://twitter.com/NikkaGOP/status/1233086007693627398
2020-02-27 14:54:25,NikkaGOP,,1,0,0,"I am going to write formal letters to the 4 schools in SF that I currently teach at, asking that they close schools until we have a better containment of the virus. Frankly this should have been done weeks ago.",,,,1233042708005969920,https://twitter.com/NikkaGOP/status/1233042708005969920
2020-02-26 22:06:47,NikkaGOP,Cernovich,0,0,0,"Yeah do people not realize that Spanish flu killed 3% of the world? It killed more people in 24 weeks than HIV/AIDS did in 24 years...",,,,1232789131941400577,https://twitter.com/NikkaGOP/status/1232789131941400577
2020-02-25 17:10:05,NikkaGOP,Cernovich,0,0,0,"There is already huge mask shortage... in the Bay Area, we witnessed price gouging of at least 300% and there’s a reason all these tech conferences are being cancelled. My guess is social media has the best figures on the true infection count",,,,1232352075830284289,https://twitter.com/NikkaGOP/status/1232352075830284289
2020-02-25 16:47:44,NikkaGOP,,0,3,1,"My representative, Congresswoman Lee, has only sponsored 1 bill that was enacted into law throughout the 22 years she has been in the House. I am almost impressed! https://www.govtrack.us/congress/bills/browse?sponsor=400314#enacted_ex=on&amp;sponsor=400237",,,,1232346451260276736,https://twitter.com/NikkaGOP/status/1232346451260276736
2020-02-25 16:36:41,NikkaGOP,,0,0,0,"I've never been able to stomach listening to @JerryNadler and it finally clicked why! he wants more tummy tucks... no wonder he wants free healthcare! #MakeAmericaStronger",,@JerryNadler,#MakeAmericaStronger,1232343670742863877,https://twitter.com/NikkaGOP/status/1232343670742863877
2020-02-25 16:24:35,NikkaGOP,,1,2,3,"@RealJohnDennis get a load of this... it looks like in 33 years Nancy Pelosi has only sponsored 7 bills that were enacted into law! https://www.govtrack.us/congress/bills/browse?sponsor=400314#enacted_ex=on",,@RealJohnDennis,,1232340624407318528,https://twitter.com/NikkaGOP/status/1232340624407318528
2020-02-25 16:23:46,NikkaGOP,,0,0,0,"@DeAnna4Congress have you seen this? it looks like in 33 years Nancy Pelosi has only sponsored 7 bills that were enacted into law! https://www.govtrack.us/congress/bills/browse?sponsor=400314#enacted_ex=on",,@DeAnna4Congress,,1232340421692444672,https://twitter.com/NikkaGOP/status/1232340421692444672
2020-02-24 18:20:40,NikkaGOP,Cernovich,1,0,1,"That’s a good policy. I’m obligated to disclose my holdings http://clerk.house.gov/public_disc/financial-pdfs/2019/10032292.pdf",,,,1232007450695327744,https://twitter.com/NikkaGOP/status/1232007450695327744
2020-02-24 18:16:19,NikkaGOP,Cernovich,3,0,2,"Did you short the markets?",,,,1232006357621993472,https://twitter.com/NikkaGOP/status/1232006357621993472
2020-02-22 19:11:48,NikkaGOP,Nichola86948411,0,0,0,"He basically said girls are being violated and killed on these caravans until Trump put a stop to it so now he’s screaming “maga 2020”",,,,1231295543843799040,https://twitter.com/NikkaGOP/status/1231295543843799040
2020-02-22 16:58:44,NikkaGOP,,0,0,0,"“I've missed more than 9000 shots in my career. I've lost almost 300 games. 26 times, I've been trusted to take the game winning shot and missed. I've failed over and over and over again in my life. And that is why I succeed.” Michael Jordan (1963-Present) #BlackHistoryMonth",,,#BlackHistoryMonth #BlackHistoryMonth,1231262057116229632,https://twitter.com/NikkaGOP/status/1231262057116229632
2020-02-22 16:42:32,NikkaGOP,,0,0,0,"“It is easier to build strong children than to repair broken men” Frederick Douglass (1818-1895) #BlackHistoryMonth",,,#BlackHistoryMonth #BlackHistoryMonth,1231257978382143488,https://twitter.com/NikkaGOP/status/1231257978382143488
2020-02-22 16:38:27,NikkaGOP,,3,11,31,"https://open.spotify.com/track/4Lh6fUEpWi234LycnBpF7B?si=nmU0w29QT8KNs3xWJGedcA @SuriusVsVodka halfway thru your album and this track just blew my mind... legendary",,,,1231256950572118018,https://twitter.com/NikkaGOP/status/1231256950572118018
2020-02-21 19:54:24,NikkaGOP,LisaSmith4680,0,0,4,"Bloomberg has one of his butlers chew it for him",,,,1230943875432247296,https://twitter.com/NikkaGOP/status/1230943875432247296
2020-02-21 17:46:45,NikkaGOP,,0,0,0,"Sorry DC but until Puerto Rico is a state there’s no way I’d even consider making you one. Even so, you’re not even 1/50th the size of California. And DC is DARK blue, why would we just give the Democrats two senators and create the smallest state of the union? #PuertoRico51",,,#PuertoRico51,1230911752667185152,https://twitter.com/NikkaGOP/status/1230911752667185152
2020-02-20 18:20:06,NikkaGOP,,0,0,0,"",,,,1230557757608062980,https://twitter.com/NikkaGOP/status/1230557757608062980
2020-02-19 23:45:31,NikkaGOP,jthomps86,1,0,0,"Nothing, I have a minor in Music and make good money teaching piano. So many students are signing up for lessons that I am running out of time & will soon have to hire other teachers! I don't feel ENTITLED to free education, let alone taxing people who never went to college 4 it",,,,1230277261804204032,https://twitter.com/NikkaGOP/status/1230277261804204032
2020-02-19 23:35:37,NikkaGOP,,0,0,0,"@RepTomEmmer please audit the @NRCC's expenditures in the 2018 election. It seems like @PaulSMG is a person of interest in this scheme to divert funds away from Republicans running for office towards his fraudulent businesses.",,@RepTomEmmer @NRCC @PaulSMG,,1230274769481654272,https://twitter.com/NikkaGOP/status/1230274769481654272
2020-02-19 22:59:47,NikkaGOP,,1,0,0,"For instance, the greatest expenditure by the @NRCC during the last election was at Del Ray Media, a subsidiary of Smart Media Group. $65M was spent there. When you try contacting their phone number, it is disconnected/out of service. http://www.delraymediabuying.com/",,@NRCC,,1230265753309306883,https://twitter.com/NikkaGOP/status/1230265753309306883
2020-02-19 22:55:19,NikkaGOP,,1,0,0,"PSA: when you receive texts promising 4x contributions being matched and so forth, do not fall for it. I believe there are large-scale money laundering schemes involved... almost none of the money reaches the political campaigns, it often ends up spent at “shell” companies.",,,,1230264631161053184,https://twitter.com/NikkaGOP/status/1230264631161053184
2020-02-19 22:51:28,NikkaGOP,,0,0,0,"#NowPlaying “Say You, Say Me” by @LionelRichie",,@LionelRichie,#NowPlaying,1230263658908749824,https://twitter.com/NikkaGOP/status/1230263658908749824
2020-02-19 22:29:08,NikkaGOP,IndigotheCat,1,0,0,"I’m much more concerned about the inevitable asteroid impact than aliens. Fun fact: an estimated 100,000kg of meteorites burn up in our atmosphere every day. The big one is coming https://www.nasa.gov/mission_pages/asteroids/overview/fastfacts.html",,,,1230258039459999744,https://twitter.com/NikkaGOP/status/1230258039459999744
2020-02-19 19:38:33,NikkaGOP,myerscb,2,0,0,"The big investment into education which I support would be the formation of the United States Space Academy, preferably at Alameda Point. If it is similar to West Point, Air Force Academy & the US Naval Academy, the cost would be around $250M per year.",,,,1230215111589031937,https://twitter.com/NikkaGOP/status/1230215111589031937
2020-02-19 19:07:57,NikkaGOP,,0,1,1,"I am blessed to have had parents who paid for my education. We are in-state, so tuition was 1/3 the price and I saved on housing by living at home... would I go into debt if they didn’t support me? Probably, but I wouldn’t expect people who didn’t go to school to pay off my debt!",,,,1230207412251979776,https://twitter.com/NikkaGOP/status/1230207412251979776
2020-02-19 18:59:02,NikkaGOP,westonpagano,2,0,17,"Sure thing! My alma mater, UC Berkeley, is going to run you $69,000 per year, which equals roughly $300,000 per art degree http://admissions.berkeley.edu/cost You could always try somewhere cheaper like University of Michigan at $51,200 per year, just over $200,000, assuming no interest...",,,,1230205166214766592,https://twitter.com/NikkaGOP/status/1230205166214766592
2020-02-19 18:35:42,NikkaGOP,westonpagano,2,0,1,"Sure thing! My alma mater, UC Berkeley, is going to run you $69,000 per year, which equals roughly $300,000 per art degree https://admissions.berkeley.edu/cost You could always try somewhere cheaper like University of Michigan at $51,200 per year, just over $200,000, assuming no interest...",,,,1230199294667288576,https://twitter.com/NikkaGOP/status/1230199294667288576
2020-02-19 17:30:54,NikkaGOP,Julio_Rosas11,15,3,84,"Cutting military so people can get $300,000 art degrees for free = bad policy.",,,,1230182988299689984,https://twitter.com/NikkaGOP/status/1230182988299689984
2020-02-19 10:12:36,NikkaGOP,,0,0,0,"Please message me noteworthy republicans on the 2020 ballot. I am going to be donating to several campaigns this week!",,,,1230072683380916224,https://twitter.com/NikkaGOP/status/1230072683380916224
2020-02-19 09:46:35,NikkaGOP,,1,5,5,"If Trump gets re-elected, we will witness the true rebirth of the American Dream.",,,,1230066136319840257,https://twitter.com/NikkaGOP/status/1230066136319840257
2020-02-18 18:43:22,NikkaGOP,,0,0,0,"Thanks for shouting out millennials @SullyCNBC the haters are just jealous.",,@SullyCNBC,,1229838838022848512,https://twitter.com/NikkaGOP/status/1229838838022848512
2020-02-18 17:11:49,NikkaGOP,KashJackson2018,0,0,0,"Y’all better quit playing with Queen Bennett! @KaitMarieox I salute your bravery. President @realDonaldTrump should invite Kait to the next State of the Union &amp; give #InfoWars a press pass. Kait is putting her life on the line doing real journalism unlike wimpy @Acosta",,@KaitMarieox @realDonaldTrump @Acosta,#InfoWars,1229815797368770560,https://twitter.com/NikkaGOP/status/1229815797368770560
2020-02-18 03:24:25,NikkaGOP,,0,0,0,"Happy President’s Day!",,,,1229607573977911296,https://twitter.com/NikkaGOP/status/1229607573977911296
2020-02-18 03:02:12,NikkaGOP,allidoisowen,0,0,0,"My platform will finally liberate the 3.5 million Americans in Puerto Rico who have no suffrage! #PuertoRico51",,,#PuertoRico51,1229601984337997824,https://twitter.com/NikkaGOP/status/1229601984337997824
2020-02-18 02:19:09,NikkaGOP,chasestrangio,0,0,1,"Listen here, just because you’re weaker than the average woman doesn’t mean that people born male do not have an advantage over people born female in contact sports. Weight, strength, T levels, broadness of shoulders, speed... completely uneven playing field! #MakeAmericaStronger",,,#MakeAmericaStronger,1229591148257103873,https://twitter.com/NikkaGOP/status/1229591148257103873
2020-02-18 00:58:27,NikkaGOP,KaitMarieox,0,0,0,"Disgusting behavior from these students! Let me guess, they want @ewarren and @SenSanders’s $1.4T college debt forgiveness plan... I don’t think most of these ingrates deserve free college. #KeepAmericaGreat #MakeAmericaStronger",,@ewarren @SenSanders,#KeepAmericaGreat #MakeAmericaStronger,1229570842561892352,https://twitter.com/NikkaGOP/status/1229570842561892352
2020-02-17 23:18:35,NikkaGOP,RitaPanahi,0,0,0,"But TransCanada can spill MILLIONS of liters of crude oil and you don’t care...? Frankly they should do this at Oxford next... maybe they’ll strike oil! https://www.usatoday.com/story/news/nation/2019/11/01/keystone-pipeline-leak-oil-spilled-north-dakota/4121954002/ https://www.npr.org/sections/thetwo-way/2017/11/16/564705368/keystone-pipeline-oil-spill-reported-in-south-dakota",,,,1229545708618780674,https://twitter.com/NikkaGOP/status/1229545708618780674
2020-02-17 19:18:53,NikkaGOP,,0,0,0,"I am concerned for the health and safety of athletes in contact sports. Young men and women are emerging with huge amounts of brain damage. Athletes are getting bigger and so are their hits. We should examine ways to curb this, starting in high school and below!",,,,1229485387048833025,https://twitter.com/NikkaGOP/status/1229485387048833025
2020-02-17 06:52:51,NikkaGOP,,3,4,8,"Men are wearing skirts and high heels in public and you are afraid to wear your Trump hat? #MakeAmericaStronger #KeepAmericaGreat",,,#MakeAmericaStronger #KeepAmericaGreat,1229297641034379265,https://twitter.com/NikkaGOP/status/1229297641034379265
2020-02-17 02:44:37,NikkaGOP,NYBackpacker,0,1,0,"The irony is that farmers are using drones to survey crops instead of shoot vlogs... they monitor pH of water & soil, they used genetically engineered crops to meet evolving demands... water storage, matter decomposition, automated tilling... It’s getting so much more intricate!",,,,1229235173025173506,https://twitter.com/NikkaGOP/status/1229235173025173506
2020-02-16 19:51:30,NikkaGOP,,0,0,0,"I propose allocating 5% of the Defense Budget towards the US Space Force. Our generation will colonize the Moon and Mars! #MakeAmericaStronger",,,#MakeAmericaStronger,1229131206249172992,https://twitter.com/NikkaGOP/status/1229131206249172992
2020-02-15 00:48:36,NikkaGOP,Cernovich,4,0,12,"They had several warnings about Nikolas Cruz before Parkland... some foreign intel may have even tried to warn the FBI before 9/11! As I recall, @RealJamesWoods flew with some of the terrorists on their practice run?",,@RealJamesWoods,,1228481196889231360,https://twitter.com/NikkaGOP/status/1228481196889231360
2020-02-13 19:51:40,NikkaGOP,,1,1,1,"“I was the conductor of the Underground Railroad for eight years, and I can say what most conductors can't say; I never ran my train off the track and I never lost a passenger.” Harriet Tubman (1820-1913) #BlackHistoryMonth",,,#BlackHistoryMonth #BlackHistoryMonth,1228044084226322432,https://twitter.com/NikkaGOP/status/1228044084226322432
2020-02-13 19:07:33,NikkaGOP,,0,0,0,"Under President @realDonaldTrump my stock portfolio is up 108%... commie @SenSanders wants to put a 0.5% financial transaction fee. That alone would have slashed my returns in half, maybe more! Market volume reduces volatility... bid-ask spreads would be so wide!",,@realDonaldTrump @SenSanders,,1228032982134321152,https://twitter.com/NikkaGOP/status/1228032982134321152
2020-02-13 15:58:53,NikkaGOP,twiterp8,2,2,4,"Puerto Rico has a Republican Governor, Republican representative-at-large... @wandavazquezg @RepJenniffer Puerto Ricans hate taxes! #PuertoRico51",,@wandavazquezg @RepJenniffer,#PuertoRico51,1227985502231416832,https://twitter.com/NikkaGOP/status/1227985502231416832
2020-02-13 15:56:43,NikkaGOP,,1,0,0,"The great Republican President McKinley wanted to make Puerto Rico a member of the United States of America’s. He would have done this more than a century ago, however, a crazed anarchist assassinated him 6 months into his second term. #PuertoRico51",,,#PuertoRico51,1227984956049113089,https://twitter.com/NikkaGOP/status/1227984956049113089
2020-02-13 15:49:19,NikkaGOP,charliekirk11,13,1,16,"It’s time to recognize Puerto Rico as a US State! That will be the best way to root out the corruption. McKinley would have done this 100+ years ago...",,,,1227983097666211841,https://twitter.com/NikkaGOP/status/1227983097666211841
2020-02-12 01:13:43,NikkaGOP,,0,1,2,"AI developers will breathe a sigh of relief knowing Yang is out of the race. Yang was scared of Artificial Intelligence because “robots were coming for our jobs...” under Trump there are more job openings than workers! Wages will continue to rise as long as that is the case.",,,,1227400356910419968,https://twitter.com/NikkaGOP/status/1227400356910419968
2020-02-11 01:13:25,NikkaGOP,Camellia_Alexan,0,1,2,"Baby girls are the real ones being discriminated against due to sex-selective abortions.",,,,1227037891437551617,https://twitter.com/NikkaGOP/status/1227037891437551617
2020-02-10 21:01:26,NikkaGOP,,0,1,1,"""If you’re white and you’re wrong, then you’re wrong; if you’re black and you’re wrong, you’re wrong. People are people. Black, blue, pink, green – God make no rules about color"" Bob Marley (1945-1981) #BlackHistoryMonth",,,#BlackHistoryMonth #BlackHistoryMonth,1226974480012107776,https://twitter.com/NikkaGOP/status/1226974480012107776
2020-02-10 20:12:23,NikkaGOP,,0,0,1,"Last year, @ExpeditionLive &amp; her team of paleontologists discovered the ""Moros Intrepidus"", meaning Harbinger of Doom. This North American dinosaur from the Early Cretaceous period may have been an ancestor to the T-Rex! https://www.newsobserver.com/news/local/article226512340.html #STEM",,@ExpeditionLive,#STEM,1226962133113503744,https://twitter.com/NikkaGOP/status/1226962133113503744
2020-02-10 00:13:18,NikkaGOP,,0,2,3,"One of these yearbook photos upset the Democrats... can you guess which one?",,,,1226660376483205121,https://twitter.com/NikkaGOP/status/1226660376483205121
2020-02-08 16:55:25,NikkaGOP,,0,0,0,"“My mother said I must always be intolerant of ignorance but understanding of illiteracy. That some people, unable to go to school, were more educated and more intelligent than college professors.” Maya Angelou (1928-2014) #BlackHistoryMonth",,,#BlackHistoryMonth #BlackHistoryMonth,1226187791261818881,https://twitter.com/NikkaGOP/status/1226187791261818881
2020-02-08 16:52:13,NikkaGOP,,0,0,0,"Europa, Jupiter’s Icy moon, is likely to be teeming with life. Some researchers think it may be home to Krakens.",,,,1226186984281931776,https://twitter.com/NikkaGOP/status/1226186984281931776
2020-02-07 19:08:34,NikkaGOP,bennyjohnson,0,0,0,"I’m sorry but why the hell would you want deport a child rapist @TuckerCarlson? Shouldn’t they be getting serious time/death penalty, not a free international flight home? They’ll keep terrorizing children and eventually sneak back into USA.",,@TuckerCarlson,,1225858912324177920,https://twitter.com/NikkaGOP/status/1225858912324177920
2020-02-07 18:32:24,NikkaGOP,,0,0,1,"Should the FDA ban petroleum-based food coloring? These additives provide 0 nutritional value and there are signs that artificial coloring disrupts the endocrine system...",,,,1225849811011719169,https://twitter.com/NikkaGOP/status/1225849811011719169
2020-02-07 18:08:36,NikkaGOP,SecPompeo,0,0,2,"We love China! Praying for the Chinese people during this tragic and difficult time. The whole world is rooting for the #coronavirus eradication!",,,#coronavirus,1225843818714370048,https://twitter.com/NikkaGOP/status/1225843818714370048
2020-02-07 09:18:24,NikkaGOP,,0,1,0,"The 2019 #coronavirus may be worse than expected. Be sure to protect your immune system with general multivitamins and a Vitamin C supplemental boost. Wash your hands thoroughly and often... we must eradicate this disease!",,,#coronavirus,1225710391247790081,https://twitter.com/NikkaGOP/status/1225710391247790081
2020-02-07 07:58:59,NikkaGOP,,0,0,0,"My model 3 prevented a rear-end accident tonight while in traffic. Thank you @Tesla team &amp; @elonmusk you are doing God’s work.",,@Tesla @elonmusk,,1225690404835606528,https://twitter.com/NikkaGOP/status/1225690404835606528
2020-02-07 05:38:24,NikkaGOP,,0,0,1,"Inventor Nikola Tesla has always fascinated me, especially his ideas surrounding so-called ""free energy"". Check out this interesting experiment where one of his ""free energy devices"" was recreated:",,,,1225655027353567232,https://twitter.com/NikkaGOP/status/1225655027353567232
2020-02-06 21:05:48,NikkaGOP,Cernovich,0,8,38,"“When you take visionary risks, people will laugh at you, as you appear literally insane to them. Visionaries see what others can’t or won’t see.” Being 25 now, this was especially useful advice. Thanks for sharing, Cerno!",,,,1225526027725746179,https://twitter.com/NikkaGOP/status/1225526027725746179
2020-02-06 20:57:39,NikkaGOP,PetiteNicoco,0,0,0,"Back in my day, e-girls only sold their used bath water. if only Simps like @eltonofficial would stop buying out these products singlehandedly...",,@eltonofficial,,1225523974588772365,https://twitter.com/NikkaGOP/status/1225523974588772365
2020-02-06 02:00:13,NikkaGOP,,0,2,0,"“The battles that count aren’t the ones for gold medals. The struggles within yourself-the invisible, inevitable battles inside all of us— that’s where it’s at.” Jesse Owens (1913-1980) winner of 100m, 200m, Long Jump and 4x100m relay in 1936 Berlin Olympics. #BlackHistoryMonth",,,#BlackHistoryMonth #BlackHistoryMonth,1225237729358671872,https://twitter.com/NikkaGOP/status/1225237729358671872
2020-02-05 22:11:41,NikkaGOP,,1,3,1,"I am proud to say that I never voted for @SenatorRomney... I voted for @RonPaul in the primary and Libertarian @GovGaryJohnson in the 2012 general election. Why? Because I never trusted Mitt. He was a duplicitous puppet to the big banks. #MakeAmericaStronger #KeepAmericaGreat",,@SenatorRomney @RonPaul @GovGaryJohnson,#MakeAmericaStronger #KeepAmericaGreat,1225180219440451584,https://twitter.com/NikkaGOP/status/1225180219440451584
2020-02-05 08:52:14,NikkaGOP,,1,0,1,"Bringing out the President of Venezuela Juan Guaidó at #SOTU was historic in itself.",,,#SOTU,1224979029268164608,https://twitter.com/NikkaGOP/status/1224979029268164608
2020-02-05 05:10:54,NikkaGOP,,0,0,1,"Born at just 21 weeks! Look how healthy she was 2 years later...I am overwhelmed and humbled. Praise the lord! #ProLife #SOTU",,,#ProLife #SOTU,1224923328718131201,https://twitter.com/NikkaGOP/status/1224923328718131201
2020-02-05 05:08:54,NikkaGOP,,0,1,4,"Glorious address Mr. President. You have shown the light to millions of Americans tonight. Our viewing party in San Francisco was packed to the brim. You are truly a magnificent leader and a historic President... I was moved to tears yet again. #ProLife #BringOurTroopsHome #SOTU",,,#ProLife #BringOurTroopsHome #SOTU,1224922827393884160,https://twitter.com/NikkaGOP/status/1224922827393884160
2020-02-05 00:21:41,NikkaGOP,,0,0,0,"Ray Charles (1930-2004) nicknamed The Genius, is revered as one of the greatest performers in soul music. His mother was a sharecropper.Ray lost his vision by age 7,learning classics like Bach, Beethoven & Mozart on the piano at school. #BlackHistoryMonth https://open.spotify.com/user/121444918/playlist/7KWwklt0SQWxvUV6xuZAKh?si=q0w1RvQeT8enMGTyIkQiBw",,,#BlackHistoryMonth #BlackHistoryMonth,1224850544642052098,https://twitter.com/NikkaGOP/status/1224850544642052098
2020-02-05 00:13:34,NikkaGOP,NikkaGOP,0,0,0,"Hint: Free College might have something to do with it.",,,,1224848505610485760,https://twitter.com/NikkaGOP/status/1224848505610485760
2020-02-04 22:37:52,NikkaGOP,_ericblanc,19,1,175,"He won all the college towns gee I wonder why",,,,1224824418867638272,https://twitter.com/NikkaGOP/status/1224824418867638272
2020-02-04 20:59:22,NikkaGOP,AOC,0,0,2,"but we only have 11 years left",,,,1224799633244749824,https://twitter.com/NikkaGOP/status/1224799633244749824
2020-02-04 20:57:40,NikkaGOP,,1,0,0,"This Iowa debacle is proving to very disheartening to many patriots. I'm expecting a nice #WalkAway surge from this!",,,#WalkAway,1224799204020645888,https://twitter.com/NikkaGOP/status/1224799204020645888
2020-02-04 17:58:27,NikkaGOP,,0,1,0,"Mary Wallace made history in 1974 as the 1st female bus driver for Chicago Transit. She worked dangerous shifts at strange hours, sometimes physically defending herself & her passengers. Mary became an icon in the city, driving for 33 years before retiring. #BlackHistoryMonth",,,#BlackHistoryMonth #BlackHistoryMonth,1224754103026253824,https://twitter.com/NikkaGOP/status/1224754103026253824
2020-02-04 14:26:28,NikkaGOP,,0,0,0,"Iowa Democrats must be looking for their Superdelegates... maybe they didn’t get the memo!",,,,1224700753270337537,https://twitter.com/NikkaGOP/status/1224700753270337537
2020-02-04 03:32:59,NikkaGOP,,0,1,2,"After winning a suit against Chesapeake & Ohio Railroad, the ruling was later overturned & Wells was ordered to pay court costs. It would be another 59 years before Rosa Parks would lead the historic bus boycott, facing similar discrimination based on her race. #BlackHistoryMonth",,,#BlackHistoryMonth #BlackHistoryMonth,1224536299975000064,https://twitter.com/NikkaGOP/status/1224536299975000064
2020-02-04 03:27:11,NikkaGOP,,1,0,0,"In 1878, when she was only 16, both of her parents died of yellow fever along with a sibling. Ida became a school teacher and the family matriarch among her 6 siblings. Over her lifetime, she fought segregation, being thrown off a train for refusing to move to the smoking car.",,,,1224534842332704769,https://twitter.com/NikkaGOP/status/1224534842332704769
