date,username,to,replies,retweets,favorites,text,geo,mentions,hashtags,id,permalink
2019-11-05 22:22:19,NikkaGOP,PoliticalKathy,1,0,0,"Whoever they want? Including children...? Obviously you want the government to have SOME role in marriage contracts.",,,,1191843209145532416,https://twitter.com/NikkaGOP/status/1191843209145532416
2019-11-05 20:55:35,NikkaGOP,,0,0,0,"Was @ABC seriously afraid of exposing the pedophile network Prince Andrew belonged to? Isn’t this what USA fought against when we gained our own sovereignty? #EpsteinCoverup",,@ABC,#EpsteinCoverup,1191821382364975104,https://twitter.com/NikkaGOP/status/1191821382364975104
2019-11-05 20:51:56,NikkaGOP,JamesOKeefeIII,0,0,0,"Really good job James. This is freaky... You have me all ‘National Treasure’ looking for clues in the background!",,,,1191820463984369664,https://twitter.com/NikkaGOP/status/1191820463984369664
2019-11-05 17:57:44,NikkaGOP,PrisonPlanet,0,0,0,"It also featured a former Republican governor as a supporting actor. Think harder Paul... Use critical thinking. You have become too dogmatic.",,,,1191776624473018368,https://twitter.com/NikkaGOP/status/1191776624473018368
2019-11-05 04:40:17,NikkaGOP,,0,0,0,"Great News! The #MakeAmericaStronger T-Shirt now comes in XXL. Only $20.20!",,,#MakeAmericaStronger,1191575941761269765,https://twitter.com/NikkaGOP/status/1191575941761269765
2019-11-05 02:33:14,NikkaGOP,KaitMarieox,48,82,472,"I can imagine the police report... “suspect is either male or female, possibly neither, caucasian, wearing a plaid shirt, 6 feet tall 145 pounds” I hope we find they/them",,,,1191543970142117890,https://twitter.com/NikkaGOP/status/1191543970142117890
2019-11-05 02:27:38,NikkaGOP,ABC7,2,2,1,"Horrible! Perpetrator must be persecuted for attempted murder, aggravated assault, assault with a deadly weapon... disgusting attack on a US citizen.",,,,1191542559505403904,https://twitter.com/NikkaGOP/status/1191542559505403904
2019-11-04 21:22:40,NikkaGOP,JackPosobiec,0,1,1,"Jack is 100% right... the right needs to build its own culture instead of being passive consumers to the hyper leftist media. Let’s make the Agent Poso comic a worldwide sensation! #TaskForceAEGIS https://www.indiegogo.com/projects/agent-poso-issue-1-presented-by-jack-posobiec#/",,,#TaskForceAEGIS,1191465809832337409,https://twitter.com/NikkaGOP/status/1191465809832337409
2019-11-04 08:34:01,NikkaGOP,NotQuiteGenie,0,0,0,"Puerto Rico chose to join USA in 2012 referendum. Investigate corruption in disaster relief. Negligence, Wasted resources, “Six government officials were recently charged with embezzling $15 million in hurricane reconstruction money”... #DrainTheSwamp",,,#DrainTheSwamp,1191272375699918848,https://twitter.com/NikkaGOP/status/1191272375699918848
2019-11-04 08:00:36,NikkaGOP,thehill,1,0,0,"If I am elected, Puerto Rico will become the 51st state!",,,,1191263965948473345,https://twitter.com/NikkaGOP/status/1191263965948473345
2019-11-04 00:38:31,NikkaGOP,,0,0,0,"I can already tell this is going to be incredible @JackPosobiec can’t wait for the first issue!",,@JackPosobiec,,1191152711338614784,https://twitter.com/NikkaGOP/status/1191152711338614784
2019-11-03 17:13:30,NikkaGOP,,0,0,0,"@williamlegate Donald Trump lives inside your head, rent-free. Cheapest housing in Santa Monica! #ArtOfTheDeal",,@williamlegate,#ArtOfTheDeal,1191040717159714816,https://twitter.com/NikkaGOP/status/1191040717159714816
2019-11-03 05:24:32,NikkaGOP,,0,0,0,"The future of this country will be far more technical and advanced if we make a simple commitment to adopt the metric system.",,,,1190862300275560448,https://twitter.com/NikkaGOP/status/1190862300275560448
2019-11-02 17:15:31,NikkaGOP,TheOfficerTatum,1,0,0,"“Let he who hath not sin cast the first stone” John 8:7",,,,1190678838700699648,https://twitter.com/NikkaGOP/status/1190678838700699648
2019-11-02 16:59:15,NikkaGOP,charliekirk11,1,0,1,"Why are your volunteers being so beta? They should be carrying some form of self-defense... pepper spray, taser at least. I know damn well nobody is doing this to @KaitMarieox xD",,@KaitMarieox,,1190674746544771072,https://twitter.com/NikkaGOP/status/1190674746544771072
2019-11-02 00:03:46,NikkaGOP,,0,0,3,"Capitalism thrives on liberty! “It appears, accordingly from the experience of all ages and nations, I believe, that the work done by freemen comes cheaper in the end than that performed by slaves” -Adam Smith, Wealth of Nations chapter 8",,,,1190419192106717184,https://twitter.com/NikkaGOP/status/1190419192106717184
2019-10-31 18:01:35,NikkaGOP,,1,5,19,"If only we had listened to @MahgdalenRose about @TulsiGabbard ...",,@MahgdalenRose @TulsiGabbard,,1189965655522435073,https://twitter.com/NikkaGOP/status/1189965655522435073
2019-10-31 17:46:40,NikkaGOP,,0,0,0,"@Cernovich Dear Mike, Please run for Congress in 2020. There are a number of seats in our state with NO republicans running, #CA11 #CA14 #CA18 #CA19 #CA29 #CA31 #CA32 #CA34 #CA35 #CA37 #CA38... take your pick, you have the inertia to win ANY of them.",,@Cernovich,#CA11 #CA14 #CA18 #CA19 #CA29 #CA31 #CA32 #CA34 #CA35 #CA37 #CA38,1189961900353675265,https://twitter.com/NikkaGOP/status/1189961900353675265
2019-10-31 17:23:20,NikkaGOP,PrisonPlanet,0,0,1,"Class Action Law Suits against Medical Malpractices on Patients with Gender Dysphoria will be tRemendous in the 2020s.",,,,1189956031448633344,https://twitter.com/NikkaGOP/status/1189956031448633344
2019-10-31 02:43:10,NikkaGOP,tannerguzy,0,0,1,"With wrist wraps you’ll do it easy",,,,1189734527343579138,https://twitter.com/NikkaGOP/status/1189734527343579138
2019-10-31 02:15:24,NikkaGOP,hollandcourtney,0,0,0,"Am I losing my mind or did this actually happen? Somebody pinch me.",,,,1189727541298257922,https://twitter.com/NikkaGOP/status/1189727541298257922
2019-10-31 01:36:24,NikkaGOP,TheOfficerTatum,0,0,0,"It’s freaky how you weren’t the only one who foretold Epstein’s death.",,,,1189717727293800448,https://twitter.com/NikkaGOP/status/1189717727293800448
2019-10-30 15:34:21,NikkaGOP,charliekirk11,0,0,0,"Charlie Kirk likes free speech. Only in English though.",,,,1189566216102236162,https://twitter.com/NikkaGOP/status/1189566216102236162
2019-10-30 15:21:47,NikkaGOP,SonnyTheGreat_,1,0,2,"I agree... what happened to all the #2A and open-carry guys? Im pretty sure they are just filming a music video. Maybe some people have issues with “don’t talk to popo, that’s a Nono, you will get shot now” or them pointing the handguns at each other... accidental discharge",,,#2A,1189563052812693506,https://twitter.com/NikkaGOP/status/1189563052812693506
2019-10-30 04:53:38,NikkaGOP,mattgaetz,0,0,0,"USA needs to secure itself as the world’s largest exporter of cannabis based products. If I recall correctly, it was Obama who locked up millions of Americans for Marijuana possession and it was Obama who opposed gay marriage during his first term in office... #FactsMatter",,,#FactsMatter,1189404973437575168,https://twitter.com/NikkaGOP/status/1189404973437575168
2019-10-30 03:58:52,NikkaGOP,allidoisowen,0,1,2,"You’re right. That’s why I need your support flipping CA-13! I cited InfoWars in an essay on the War in Iraq back in 2010... I’d love to do an interview with you guys. #MakeAmericaStronger",,,#MakeAmericaStronger,1189391190765887488,https://twitter.com/NikkaGOP/status/1189391190765887488
2019-10-30 03:55:30,NikkaGOP,,0,0,0,"My favorite song on @kanyewest new album... the reunion of Clipse! #MakeAmericaStronger",,@kanyewest,#MakeAmericaStronger,1189390346205065216,https://twitter.com/NikkaGOP/status/1189390346205065216
2019-10-30 02:18:29,NikkaGOP,,0,2,4,"“From an operational standpoint the United States military can strike any target, anywhere, anytime” General Milley",,,,1189365929676660736,https://twitter.com/NikkaGOP/status/1189365929676660736
2019-10-30 01:54:58,NikkaGOP,PATRIOT4POTUS,0,0,0,"How about we let the invisible hand do its job and allow this company to continue with bankruptcy? Auction off the grid to more responsible companies who will have to compete instead of PG&E having a state-enforced monopoly",,,,1189360010326753282,https://twitter.com/NikkaGOP/status/1189360010326753282
2019-10-30 01:50:15,NikkaGOP,,0,0,1,"Tax Cuts will be a top priority if I am elected. We need to continue cutting taxes to support even greater economic growth!",,,,1189358822390763520,https://twitter.com/NikkaGOP/status/1189358822390763520
2019-10-29 19:44:10,NikkaGOP,,0,0,0,"My cousin’s 3rd annual pumpkin carving was a massive success! Can you guess which one is mine? ",,,,1189266694474260482,https://twitter.com/NikkaGOP/status/1189266694474260482
2019-10-29 15:16:47,NikkaGOP,realDonaldTrump,0,0,1,"Vote for @DeAnna4Congress to unseat Nancy Pelosi!",,@DeAnna4Congress,,1189199407792578560,https://twitter.com/NikkaGOP/status/1189199407792578560
2019-10-29 03:14:40,NikkaGOP,yournewhomepage,0,0,0,"Poor Andrew Yang has even worse math & approximation skills. Maybe it’s something in the water at Columbia.",,,,1189017680335917056,https://twitter.com/NikkaGOP/status/1189017680335917056
2019-10-29 00:19:00,NikkaGOP,Harry1T6,0,0,0,"Foreshadow of a socialist USA",,,,1188973473554558976,https://twitter.com/NikkaGOP/status/1188973473554558976
2019-10-28 18:56:50,NikkaGOP,Handsomeconser2,1,0,0,"Reminds me of that Jay Z and Nas song",,,,1188892397884723200,https://twitter.com/NikkaGOP/status/1188892397884723200
2019-10-27 15:32:00,NikkaGOP,,0,0,0,"Abu Bakr was named after the child trafficker who sold his 6 year old daughter Aisha to Mohammed in exchange for political power. The fact that Abu Bakr self-detonated taking 3 of his kids down with him should come as no surprise. Thank you to US troops for eliminating this scum!",,,,1188478460794036224,https://twitter.com/NikkaGOP/status/1188478460794036224
2019-10-24 18:50:23,NikkaGOP,,0,0,0,"If Puerto Rico is admitted as a State of the Union, it would continue to grow into the Caribbean paradise it is destined to be!",,,,1187441220923953152,https://twitter.com/NikkaGOP/status/1187441220923953152
2019-10-24 15:20:37,NikkaGOP,MicheleEGwynn,0,0,17,"Does this apply to Spartacus too?",,,,1187388430721794048,https://twitter.com/NikkaGOP/status/1187388430721794048
2019-10-24 14:55:35,NikkaGOP,AndrewYang,0,0,0,"Foolish and dangerous. On the bright side you would be incapable of making any sort of political advertisement since you claim you have a way to pay for > $3.2T in additional expenditures which is the biggest lie of the year.",,,,1187382133909684224,https://twitter.com/NikkaGOP/status/1187382133909684224
2019-10-24 01:10:29,NikkaGOP,,0,0,0,"Really great hearing today with Mark Zuckerberg. I thought Chairwoman @RepMaxineWaters did a great job leading a fair and smooth hearing on Libra &amp; @facebook venture into cryptocurrency. If elected, I would encourage blockchain and token businesses to develop &amp; release in the US",,@RepMaxineWaters @Facebook,,1187174488980389888,https://twitter.com/NikkaGOP/status/1187174488980389888
2019-10-23 23:32:17,NikkaGOP,FuctupMike,1,0,18,"Go to Joe 30330",,,,1187149777399468032,https://twitter.com/NikkaGOP/status/1187149777399468032
2019-10-23 16:18:36,NikkaGOP,,0,0,1,"It’s time to dispel the myth that lifting weights makes women “bulky”... which would you rather have in your body? #MakeAmericaStronger #ObesityEpidemic",,,#MakeAmericaStronger #ObesityEpidemic,1187040638358867968,https://twitter.com/NikkaGOP/status/1187040638358867968
2019-10-23 07:56:31,NikkaGOP,JosoStylish,0,0,0,"It’s not clear to me which one is hotepjesus though",,,,1186914280869744641,https://twitter.com/NikkaGOP/status/1186914280869744641
2019-10-23 04:14:50,NikkaGOP,,0,0,0,"Legalize Medicinal Marijuana Nationally, allow for interstate commerce of cannabis, expunge criminal records of minor drug offenses, become net exporters of hemp products, clemency during air travel & THC/CBD treatments at VA hospitals and Medicare/medical recipients #LegalizeIt",,,#LegalizeIt,1186858495934550017,https://twitter.com/NikkaGOP/status/1186858495934550017
2019-10-23 03:21:36,NikkaGOP,rexjonesnews,0,0,1,"Actually, it’s mostly a matter of whether you have Supermale Vitality or not",,,,1186845096206983169,https://twitter.com/NikkaGOP/status/1186845096206983169
2019-10-22 21:20:15,NikkaGOP,,0,1,0,"Has @SenSanders @ewarren @JoeBiden or @KamalaHarris passed a balanced budget in the past 20 years? National debt is too high to afford their false promises. Only Reaganomics will solve our problems. As long as GDP growth continues above 3-4%, tax revenues will far exceed the cuts",,@SenSanders @ewarren @JoeBiden @KamalaHarris,,1186754162945482752,https://twitter.com/NikkaGOP/status/1186754162945482752
2019-10-22 21:16:39,NikkaGOP,ChrisCoons,0,0,0,"How much money is our country saving daily? Conservatively $100M per day? We need to save up for our Space Missions... Unless you want to annex Syria, why send troops there? Let them come home! It’s Christmas season for crying out loud. Don’t be such a Grinch.",,,,1186753255172214784,https://twitter.com/NikkaGOP/status/1186753255172214784
2019-10-22 20:32:38,NikkaGOP,,0,0,0,"“Princes and sovereign states have frequently fancied that they had a temporary interest to diminish the quantity of pure metal contained in their coins; but they seldom have fancied that they had any to augment it” Adam Smith, The Wealth of Nations",,,,1186742177465921536,https://twitter.com/NikkaGOP/status/1186742177465921536
2019-10-22 19:55:53,NikkaGOP,,0,0,0,"I love asking people to join the Grand Old Party of Lincoln. Who doesn’t like Honest Abe?",,,,1186732931064070144,https://twitter.com/NikkaGOP/status/1186732931064070144
2019-10-22 17:27:10,NikkaGOP,,1,32,26,"There’s even a lynch mob... https://twitter.com/realDonaldTrump/status/1186611272231636992",,,,1186695504651902976,https://twitter.com/NikkaGOP/status/1186695504651902976
2019-10-22 15:53:25,NikkaGOP,Camellia_Alexan,0,0,0,"Transgender MMA Fighter Fallon Fox beat her female opponent Tamika Brents so severely that she suffered a broken skull. Tamika said: “I’ve fought a lot of women and have never felt the strength that I felt in a fight as I did that night... I’ve never felt so overpowered ever”",,,,1186671911167643648,https://twitter.com/NikkaGOP/status/1186671911167643648
2019-10-22 05:01:04,NikkaGOP,goodmangilaa,0,0,0,"Sounds like an incel",,,,1186507742669787137,https://twitter.com/NikkaGOP/status/1186507742669787137
2019-10-22 02:45:23,NikkaGOP,SonnyTheGreat_,0,0,0,"We don’t. Just another false dichotomy. I was marching with Black Lives Matter after Eric Garner was choked to death for selling cigarettes... this was back when it was JUST a hashtag and not an LLC/not-for-profit entity with a hierarchy and lobbyists.",,,,1186473596190748672,https://twitter.com/NikkaGOP/status/1186473596190748672
2019-10-21 16:50:40,NikkaGOP,,0,1,2,"In this live video, @DeAnna4Congress opens up about how the opioid crisis has personally impacted her brother. Very moving! DeAnna has the will and determination to change this country for the better. #DeAnna2020",,@DeAnna4Congress,#DeAnna2020,1186323930987954176,https://twitter.com/NikkaGOP/status/1186323930987954176
2019-10-21 16:19:44,NikkaGOP,Iamdevinnsmart,0,0,1,"This was all I needed to hear this morning! Stay safe out there.",,,,1186316144392597505,https://twitter.com/NikkaGOP/status/1186316144392597505
2019-10-20 22:21:36,NikkaGOP,JackPosobiec,0,0,0,"I love Democrats. I look at every Democrat as a potential Republican.",,,,1186044823611928577,https://twitter.com/NikkaGOP/status/1186044823611928577
2019-10-20 15:43:25,NikkaGOP,,0,0,0,"Poor @RepSwalwell has the worst Botox I have ever seen. He is incapable of smiling! That’s where our tax dollars are going... this dishonest man’s cosmetic treatments. #MakeAmericaStronger",,@RepSwalwell,#MakeAmericaStronger,1185944618816307201,https://twitter.com/NikkaGOP/status/1185944618816307201
2019-10-20 02:41:09,NikkaGOP,JackPosobiec,0,1,0,"Agreed. ‘Upgrade’ did so much with so little! My brother and I were blown away.",,,,1185747753806073857,https://twitter.com/NikkaGOP/status/1185747753806073857
2019-10-20 02:33:21,NikkaGOP,,0,0,0,"There is tremendous significance to this photograph of @realDonaldTrump and @AbeShinzo ... the US and Japan are far stronger allies than adversaries. Never forget that it was Democrat FDR that enslaved Japanese Americans and Democrat Harry Truman that detonated atomic bombs!",,@realDonaldTrump @AbeShinzo,,1185745791048007682,https://twitter.com/NikkaGOP/status/1185745791048007682
2019-10-19 09:49:28,NikkaGOP,SonnyTheGreat_,0,0,0,"Sonny, if you’re not aware of Obama’s “Fast & Furious” program, you should look into it. Arms deals with members of cartels in hopes of tracking the rest.",,,,1185493157900763138,https://twitter.com/NikkaGOP/status/1185493157900763138
2019-10-18 18:59:49,NikkaGOP,Cernovich,2,0,0,"You’re dead wrong. My generation would trample your generation. Do you realize I would have held a world record in track & field during the 1940s, but wasn’t even in the top 3 jumpers at Cal in 2013? We are stronger, faster and tougher than ever before.",,,,1185269269929447424,https://twitter.com/NikkaGOP/status/1185269269929447424
2019-10-17 16:24:20,NikkaGOP,RealBrysonGray,0,1,0,"This has really messed with my head. Can you imagine for a second if Trump had done blackface while at Wharton? Let’s not forget that Governor Ralph “Coonman” Northam is still in office in Virginia!",,,,1184867752416137216,https://twitter.com/NikkaGOP/status/1184867752416137216
2019-10-17 08:07:23,NikkaGOP,DanCrenshawTX,0,0,0,"Unless we are going to ANNEX SYRIA and make it part of USA, keep our troops home. We need the money for moon/mars missions.",,,,1184742689738125312,https://twitter.com/NikkaGOP/status/1184742689738125312
2019-10-16 22:58:35,NikkaGOP,,0,0,0,"I will NEVER understand how @BarackObama can endorse Trudeau, who has donned blackface multiple times while fueling the lie that @realDonaldTrump and his supporters are racists. The mental gymnastics here are beyond belief. &amp; Isn’t this some sort of foreign election interference? https://twitter.com/CNNPolitics/status/1184597416051400704",,@BarackObama @realDonaldTrump,,1184604581851881472,https://twitter.com/NikkaGOP/status/1184604581851881472
2019-10-16 21:53:17,NikkaGOP,,0,1,1,"Poor @KamalaHarris wants President @realDonaldTrump banned from Twitter. She knows that Trump is far more effective at communicating online than her! Truth be told, Trump could delete all his social media accounts and he would still win in 2020! #KeepAmericaGreat",,@KamalaHarris @realDonaldTrump,#KeepAmericaGreat,1184588145700081670,https://twitter.com/NikkaGOP/status/1184588145700081670
2019-10-16 20:32:16,NikkaGOP,,0,0,2,"I’m starting to feel really bad for @AndrewYang because he clearly forgot to carry a 0 when doing his Universal Basic Income equations. He always seems shocked when people tell him it will cost $3.2Trillion. It’s simple math! #UniversalBasicMath",,@AndrewYang,#UniversalBasicMath,1184567758937194496,https://twitter.com/NikkaGOP/status/1184567758937194496
2019-10-16 02:51:25,NikkaGOP,,0,1,2,"I fully support @NASA and the Artemis Program. Just look at the pure joy of everyone in the press conference. Space has the power to unite and inspire awe. I would gladly vote to increase NASA’s budget if elected!",,@NASA,,1184300787955982336,https://twitter.com/NikkaGOP/status/1184300787955982336
2019-10-15 19:06:30,NikkaGOP,AJRummel,1,12,13,"I had to hold my breath walking past crackheads so I wouldn’t catch a whiff of whatever they were smoking. Some of these drugs can have deadly effects as soon as they come in contact with your skin! Mothers pushing baby strollers past crack spots... it’s ludicrous!",,,,1184183787611049984,https://twitter.com/NikkaGOP/status/1184183787611049984
2019-10-15 18:17:27,NikkaGOP,,0,0,0,"#AskNASA when will food be grown on the moon?",,,#AskNASA,1184171443627495424,https://twitter.com/NikkaGOP/status/1184171443627495424
2019-10-15 16:08:00,NikkaGOP,,0,2,4,"Registering people to vote in beautiful UC Berkeley! ",,,,1184138865658847232,https://twitter.com/NikkaGOP/status/1184138865658847232
2019-10-15 02:31:20,NikkaGOP,SonnyTheGreat_,0,0,1,"Agreed. It’s too risky to give the federal government the power to vaccinate people against their will.",,,,1183933345211633664,https://twitter.com/NikkaGOP/status/1183933345211633664
2019-10-14 16:29:51,NikkaGOP,EdGreenberger,0,0,0,"How are you still trying to use the label “pizzagater” to defame Cernovich? He’s already exposed a billionaire pedophile (Jeffrey Epstein), what more do you want from him? And James Alefantis posted a ton of creepy pedo stuff on his instagram, we haven’t heard the end of it.",,,,1183781976118943744,https://twitter.com/NikkaGOP/status/1183781976118943744
2019-10-14 16:26:18,NikkaGOP,Cernovich,0,0,7,"Thanks for standing up for the people of my district. I know plenty of republican women who are afraid to wear their Women for Trump apparel due to the looming threat of Antifa. It makes me sick!",,,,1183781083352944640,https://twitter.com/NikkaGOP/status/1183781083352944640
2019-10-13 21:32:00,NikkaGOP,,0,0,1,"@MahgdalenRose made me realize @Scaramucci is a complete fraud, leading a #followback scheme then unfollowing everyone. I get the feeling he sat there and tapped “unfollow” on his phone tens of thousands of times because there’s no way that man knows how to code.",,@MahgdalenRose @Scaramucci,#followback,1183495628149547008,https://twitter.com/NikkaGOP/status/1183495628149547008
2019-10-13 17:57:38,NikkaGOP,,0,0,2,"President @realDonaldTrump, if we go back to Syria, it should only be for the purposes of Annexation. Otherwise, keep our troops home. #MakeAmericaStronger",,@realDonaldTrump,#MakeAmericaStronger,1183441681036660736,https://twitter.com/NikkaGOP/status/1183441681036660736
2019-10-13 07:25:29,NikkaGOP,Kevinloves3d,0,0,0,"Ranking algorithms across the board have gotten so convoluted. ‘Trending’ section was the tech companies’ way of taking over the narrative and phasing out the ‘Most Viewed’ section. Nefarious... Trending should simply be 1) most tweeted 2) tweeted in most places 3) least time",,,,1183282592826548225,https://twitter.com/NikkaGOP/status/1183282592826548225
2019-10-13 07:17:21,NikkaGOP,SonnyTheGreat_,0,0,0,"Who Does 3 curls on their left arm and 4 curls on their right...?",,,,1183280548497637376,https://twitter.com/NikkaGOP/status/1183280548497637376
2019-10-12 06:17:23,NikkaGOP,Cernovich,0,0,0,"Godwin’s law",,,,1182903067169001473,https://twitter.com/NikkaGOP/status/1182903067169001473
2019-10-12 06:08:46,NikkaGOP,,0,0,0,"@SonnyTheGreat_ Make Sonny Cletus Again",,@SonnyTheGreat_,,1182900901020700673,https://twitter.com/NikkaGOP/status/1182900901020700673
2019-10-12 01:15:28,NikkaGOP,allidoisowen,0,0,1,"“War is Peace, Freedom is Slavery, Ignorance is Strength” George Orwell",,,,1182827090455842816,https://twitter.com/NikkaGOP/status/1182827090455842816
2019-10-12 00:40:14,NikkaGOP,,0,0,0,"Street sweeping is not enough, we need to be doing weekly sidewalk cleanses with industrial soap to reduce the spread of pathogens and eliminate harsh odors",,,,1182818220761174016,https://twitter.com/NikkaGOP/status/1182818220761174016
2019-10-12 00:30:27,NikkaGOP,,1,0,0,"We should be hiring more people to handle waste management. Provides entry-level jobs, functioning as direct stimulus for the economy. No child should have to worry about stepping on used hypodermic needles and crackpipes on their way to school.",,,,1182815761057771520,https://twitter.com/NikkaGOP/status/1182815761057771520
2019-10-12 00:26:14,NikkaGOP,,1,0,0,"Litter takes all forms, though cigarettes tend to be found between every crevice. Needles, food wrapping, human waste and other plastics often end up in the sewer. We need more public restrooms, outdoor showers with soap dispensers, and more trash bins. Higher fines for littering",,,,1182814700515364865,https://twitter.com/NikkaGOP/status/1182814700515364865
2019-10-12 00:23:17,NikkaGOP,,1,0,0,"The Bay Area is one of the coolest places on Earth. We have so many different cultures coalesced into something beautiful. Urban revitalization is key to public health! We need to clean the streets and improve waste management! There should be NO trash on our streets.",,,,1182813954696871936,https://twitter.com/NikkaGOP/status/1182813954696871936
2019-10-12 00:18:06,NikkaGOP,Camellia_Alexan,0,0,1,"You’re one of the lucky ones.",,,,1182812650276737024,https://twitter.com/NikkaGOP/status/1182812650276737024
2019-10-12 00:17:36,NikkaGOP,montaga,1,14,48,"Even the Supreme Court uses the term ‘illegal alien’. It is not pejorative.",,,,1182812528289562625,https://twitter.com/NikkaGOP/status/1182812528289562625
2019-10-11 19:17:04,NikkaGOP,,0,0,0,"California 18, which covers most of Silicon Valley, currently has no Republicans running. Who will step up to the plate? Nov. 6 deadline to get on ballot. RT",,,,1182736895219924992,https://twitter.com/NikkaGOP/status/1182736895219924992
2019-10-11 15:40:26,NikkaGOP,williamlegate,1,0,0,"Will, can you give me a reasonable explanation why the US should not put tariffs on countries which have tariffs on our country? Do you believe trade deficits are neutral/good?",,,,1182682378549940224,https://twitter.com/NikkaGOP/status/1182682378549940224
2019-10-11 15:28:36,NikkaGOP,jerryteixeira,1,0,0,"Naked Protein smoothies have 20 or 30 grams of protein, it’s pretty crazy.",,,,1182679400766029825,https://twitter.com/NikkaGOP/status/1182679400766029825
2019-10-11 15:05:57,NikkaGOP,PoliticalKathy,0,0,0,"You should carry a taser/stun gun. They are dirt cheap.",,,,1182673701029826565,https://twitter.com/NikkaGOP/status/1182673701029826565
