date,username,to,replies,retweets,favorites,text,geo,mentions,hashtags,id,permalink
2019-06-19 00:03:58,NikkaGOP,LevelToPower,2,0,7,"“The person who achieves the finest blend of music and physical training and impresses it on his soul in the most measured way is the one we’d most correctly call harmonious and trained in music, much more so than the one who merely harmonizes the strings of his instrument” 411c",,,,1141134491676602369,https://twitter.com/NikkaGOP/status/1141134491676602369
2019-06-18 22:25:42,NikkaGOP,,0,0,0,"40 shillings for every tub and for every chest of tea; and in case any such person or persons shall refuse or neglect to make such deposit within the time before limited, he, she, or they, shall forfeit and lose six times the value of such deposit directed to be made as aforesaid",,,,1141109762311872512,https://twitter.com/NikkaGOP/status/1141109762311872512
2019-06-18 19:04:00,NikkaGOP,StefanMolyneux,0,0,2,"Stefan, maybe you are proud of being weak because there is no chance of you ever being drafted",,,,1141059000533807104,https://twitter.com/NikkaGOP/status/1141059000533807104
2019-06-18 19:01:17,NikkaGOP,StefanMolyneux,0,0,0,"Survey is the Dumbest thing I have heard in weeks. To everyone reading this: hit the gym today. Foreign invaders want to take away our land and freedom and we have NY post encouraging men to be weak Soy Boys. Get your act together #MakeAmericaStronger",,,#MakeAmericaStronger,1141058317806002176,https://twitter.com/NikkaGOP/status/1141058317806002176
2019-06-17 23:40:24,NikkaGOP,,0,0,0,"College is a choice made by adults. An investment. Elementary school is for all intents and purposes not a choice and Politicians let the classrooms become completely decrepit. They are ok with high schools effectively being prisons because children can’t vote for them.",,,,1140766171781685249,https://twitter.com/NikkaGOP/status/1140766171781685249
2019-06-17 23:37:32,NikkaGOP,,1,0,1,"It is a damn shame that @SenSanders and @SenWarren want to buy votes from college students with a $1T debt forgiveness program. All that money is better spent on elementary school. But they don’t want to do what is right- they just want to say whatever it takes to get elected.",,@SenSanders @SenWarren,,1140765449019224064,https://twitter.com/NikkaGOP/status/1140765449019224064
2019-06-17 13:33:19,NikkaGOP,,0,0,0,"Leftists need to understand that once you give the government dominion over health, and our government says “no birth control or no THC-based treatments...”, you will have no other options than the federal government. Even if private insurers remain, you’ll be forced to pay in!",,,,1140613395831373825,https://twitter.com/NikkaGOP/status/1140613395831373825
2019-06-17 13:29:47,NikkaGOP,,1,0,0,"What happens if @SenSanders or @KamalaHarris do end up eliminating private insurance companies and instilling a National Single Payer system, and then the government refuses to prescribe the medication of your choice? Where do you turn to?",,@SenSanders @KamalaHarris,,1140612504642441216,https://twitter.com/NikkaGOP/status/1140612504642441216
2019-06-17 08:26:22,NikkaGOP,,0,0,0,"Since when is arson = free speech....?",,,,1140536148164411392,https://twitter.com/NikkaGOP/status/1140536148164411392
2019-06-17 02:19:48,NikkaGOP,,0,0,0,"I am so excited about @brave it is hard to put into words what this team is accomplishing. Thank you @brianbondy @BrendanEich and the rest of the team at BAT. Companies like yours are why we need more Republicans in office. In case you missed it, @BradSherman wants to ban you",,@brave @brianbondy @BrendanEich @BradSherman,,1140443900588380160,https://twitter.com/NikkaGOP/status/1140443900588380160
2019-06-17 02:09:09,NikkaGOP,,0,0,0,"Kamala thinks only of herself, not the thousands of family and friends flying from out of state for the ceremony. And she just gave no hoots",,,,1140441218712608768,https://twitter.com/NikkaGOP/status/1140441218712608768
2019-06-17 02:01:29,NikkaGOP,,1,0,0,"Lol... @KamalaHarris is all about University Students except for when it comes to delivering Commencement Speeches to her constituents in @UCBerkeley ... in which case she would rather flake just days before because of her special Union interests. We Cal Bears find it Pathetic.",,@KamalaHarris @UCBerkeley,,1140439288250638336,https://twitter.com/NikkaGOP/status/1140439288250638336
2019-06-15 19:13:58,NikkaGOP,,0,0,0,"I honestly don’t care that you got demonitized @sewernugget because I have been using @brave to block ads for years. You should start accepting @AttentionToken on your videos though, it’s super simple and @BrendanEich is redpilled. @scrowder and @hodgetwins @PhillyD #NewYoutube",,@sewernugget @brave @AttentionToken @BrendanEich @scrowder @hodgetwins @PhillyD,#NewYoutube,1139974345718022144,https://twitter.com/NikkaGOP/status/1139974345718022144
2019-06-15 18:43:23,NikkaGOP,StefanMolyneux,0,0,0,"Wow @jairbolsonaro",,@jairbolsonaro,,1139966650097135616,https://twitter.com/NikkaGOP/status/1139966650097135616
2019-06-15 17:08:42,NikkaGOP,,0,0,0,"I am a Born Again Christian. Spent the first 19 years of my life in relative disbelief, at times adamantly atheist. After a death, I prayed intently for hours and A series of miracles occurred in what I would describe as an apparition. Jesus appeared to me in a physical form.",,,,1139942821308203008,https://twitter.com/NikkaGOP/status/1139942821308203008
2019-06-15 16:34:27,NikkaGOP,KamalaHarris,0,0,0,"Kamala you are all about diversity and women of color in government... getting more WoC into government... Why did you snub @JovankaBeckles and endorse @BuffyWicks then? You say one thing and do the other.",,@JovankaBeckles @BuffyWicks,,1139934201032003584,https://twitter.com/NikkaGOP/status/1139934201032003584
2019-06-15 16:32:50,NikkaGOP,,0,1,1,"“I’ve been influenced by my heroes recently, which is AlphaZero and also one of my 2nds from the World Championship Dubov, who has a lot of these ideas with sacrifices in the opening.” @MagnusCarlsen AI is here to stay!",,@MagnusCarlsen,,1139933793773506561,https://twitter.com/NikkaGOP/status/1139933793773506561
2019-06-15 06:42:39,NikkaGOP,TheRaDR,0,0,0,"Unlike these ILLEGAL IMMIGRANTS, The Jews never chose to get on the train to Auschwitz. (Besides the occasional Zondercommando who would sell out our Hebrew brothers). These people chose to break the law and PAY human traffickers to bring them here. The analogy is so far off.",,,,1139785272449630208,https://twitter.com/NikkaGOP/status/1139785272449630208
2019-06-15 05:20:14,NikkaGOP,thedailybeast,0,0,0,"aren’t Democrats trying to keep Trump off the Ballot in 2020?",,,,1139764528332169216,https://twitter.com/NikkaGOP/status/1139764528332169216
2019-06-15 03:18:21,NikkaGOP,TamikaGHamilton,0,0,0,"It’s funny, Democrats only want Deffered Action for Child Arrivals they don’t want Present Action for Child Arrivals. Republicans are ready to extend residency for 3 years with 10 year pathway to citizenship TODAY! Immigrants who complete high school should get citizenship test",,,,1139733858486640643,https://twitter.com/NikkaGOP/status/1139733858486640643
2019-06-15 02:50:23,NikkaGOP,conservmillen,0,0,0,"The babies in 20 years after their mumsy took Prenatal Vitamins:",,,,1139726817701453825,https://twitter.com/NikkaGOP/status/1139726817701453825
2019-06-15 02:40:20,NikkaGOP,,0,0,0,"Happy birthday @realDonaldTrump hope you got my letter!",,@realDonaldTrump,,1139724291237224450,https://twitter.com/NikkaGOP/status/1139724291237224450
2019-06-15 02:35:20,NikkaGOP,conservmillen,0,0,0,"Gymnastics, diving, ballet, cheerleading, pretty much any dance, and the top female chess players are far better than most Male International Masters. Take the Muzychuk sisters: 2600+ ELO both top 3 chess players and they boycotted @FIDE_chess in Saudi Arabia because forced hijab",,@FIDE_chess,,1139723031687733248,https://twitter.com/NikkaGOP/status/1139723031687733248
2019-06-15 00:04:22,NikkaGOP,,0,0,0,"@lynnehomrich good luck Lynne. Fantastic campaign ad. You are doing God’s work.",,@lynnehomrich,,1139685040579735552,https://twitter.com/NikkaGOP/status/1139685040579735552
2019-06-15 00:02:14,NikkaGOP,,0,0,0,"#MakeAmericaStronger",,,#MakeAmericaStronger,1139684503440412673,https://twitter.com/NikkaGOP/status/1139684503440412673
2019-06-15 00:02:01,NikkaGOP,,0,0,0,"Make America Stronger",,,,1139684446846668801,https://twitter.com/NikkaGOP/status/1139684446846668801
2019-06-14 23:51:36,NikkaGOP,stclairashley,0,0,0,"If elected, I will never ban suppressors/silencers. Tinnitus affects millions of Americans each year and the most common cause is overexposure to high decibels. SIlencers have been around since at least the 19th century and they will not go away even if they get banned!",,,,1139681826253856770,https://twitter.com/NikkaGOP/status/1139681826253856770
2019-06-14 23:44:53,NikkaGOP,morganisawizard,0,0,1,"Motors?",,,,1139680135060193280,https://twitter.com/NikkaGOP/status/1139680135060193280
2019-06-14 21:05:09,NikkaGOP,C4Vi,0,0,0,"",,,,1139639937312030720,https://twitter.com/NikkaGOP/status/1139639937312030720
2019-06-14 21:04:44,NikkaGOP,C4Vi,0,0,0,"",,,,1139639835453321216,https://twitter.com/NikkaGOP/status/1139639835453321216
2019-06-14 10:54:05,NikkaGOP,C4Vi,1,0,0,"This has been some of the most impressive Bad Math I have seen",,,,1139486159870910464,https://twitter.com/NikkaGOP/status/1139486159870910464
2019-06-14 10:50:45,NikkaGOP,,0,0,0,"If we get Medicare, Medicaid and VA to start prescribing more cannabis-based treatments in lieu of Opioids, we can reduce the number of deaths due to overdose. THC and CBD can fill many of the roles of existing medicines in a much safer way.",,,,1139485319785402368,https://twitter.com/NikkaGOP/status/1139485319785402368
2019-06-14 10:27:06,NikkaGOP,,0,0,0,"",,,,1139479367598235648,https://twitter.com/NikkaGOP/status/1139479367598235648
2019-06-14 10:10:49,NikkaGOP,ABC,0,0,0,"Brilliant counterintelligence. You need to think Spy vs. Spy in this world. Gain their trust, trace the source of the espionage... you can’t cover your ears and hide. Plus, FBI is not guaranteed to respond. Anyone remember Nikolas Cruz being reported to FBI multiple times?",,,,1139475271944290304,https://twitter.com/NikkaGOP/status/1139475271944290304
2019-06-14 09:04:13,NikkaGOP,,0,0,0,"Reclassify Marijuana as a Schedule V drug",,,,1139458508930158592,https://twitter.com/NikkaGOP/status/1139458508930158592
2019-06-14 08:06:29,NikkaGOP,AmericanStatham,0,0,4,"All things you can do already",,,,1139443979873746944,https://twitter.com/NikkaGOP/status/1139443979873746944
2019-06-14 03:55:01,NikkaGOP,THeinrich22,0,0,1,"Healthcare dot gov and Solyndra",,,,1139380697645215744,https://twitter.com/NikkaGOP/status/1139380697645215744
2019-06-14 03:06:57,NikkaGOP,,0,0,1,"Rest In Peace, Keith Byrne.",,,,1139368598579765251,https://twitter.com/NikkaGOP/status/1139368598579765251
2019-06-14 02:34:22,NikkaGOP,,0,0,0,"An extremely rare Pepe spotted at Ross today.",,,,1139360402406379520,https://twitter.com/NikkaGOP/status/1139360402406379520
2019-06-13 21:39:55,NikkaGOP,cenkuygur,0,0,0,"It must have been The perfect coverup... 18 months and $50 million FBI investigation, no crime found xD Makes @JussieSmollett look like an amateur! #MAGACountry",,@JussieSmollett,#MAGACountry,1139286301511843840,https://twitter.com/NikkaGOP/status/1139286301511843840
2019-06-13 21:34:30,NikkaGOP,,0,0,0,"Why is a “citizenship question” on US Census even a debate? Obviously ask people if they are US Citizens! Holding @attorneygeneral Barr in contempt over this is truly idiotic, @justinamash",,@attorneygeneral @justinamash,,1139284936928575489,https://twitter.com/NikkaGOP/status/1139284936928575489
2019-06-13 21:27:50,NikkaGOP,TamikaGHamilton,0,0,1,"Ask @facebook and @Google how they feel about China banning their services nationwide! Should that sort of uncompetitive behavior by China go unpunished? They call it “The Great FireWall of China”",,@Facebook @Google,,1139283257235632128,https://twitter.com/NikkaGOP/status/1139283257235632128
2019-06-13 17:30:23,NikkaGOP,AndrewYang,0,0,0,"https://www.businessinsider.com/donald-trump-likes-to-tip-with-100-bills-2016-3 is Trump doing this right...?",,,,1139223501519245312,https://twitter.com/NikkaGOP/status/1139223501519245312
2019-06-13 16:51:44,NikkaGOP,realDonaldTrump,0,0,0,"I am old enough to remember when @RepAdamSchiff tried to buy “kompromat” from Russian trolls involving a nonexistent video showing lewd acts of President Trump! I think that is pretty weird, Adam. #Pissgate",,@RepAdamSchiff,#Pissgate,1139213776572469248,https://twitter.com/NikkaGOP/status/1139213776572469248
2019-06-13 01:54:55,NikkaGOP,MartinaMarkota,0,0,1,"I’m pretty sure you paint your own warhammer figurines so maybe if you looked up any arts and crafts",,,,1138988086887571457,https://twitter.com/NikkaGOP/status/1138988086887571457
2019-06-12 22:44:39,NikkaGOP,,0,0,0,"Everyone say a quick prayer for @KaitMarieox because she is doing God’s work.",,@KaitMarieox,,1138940201194205184,https://twitter.com/NikkaGOP/status/1138940201194205184
2019-06-12 22:36:29,NikkaGOP,JackPosobiec,0,0,1,"It’s because he and Obama locked up and raided Marijuana researchers. Do a quick search on NIH’s PubMed containing keywords like “THC CBD apoptosis cancer antitumoral antimetastatic antiproliferative angiogenesis”... many cannabinoids seem to improve chemotherapy efficacy",,,,1138938145985007616,https://twitter.com/NikkaGOP/status/1138938145985007616
2019-06-12 16:50:23,NikkaGOP,,0,0,0,"Of course, @RonPaul was the only one speaking about this issue in 2012. @realDonaldTrump has long been in favor of medical marijuana. How can you not? It stops little girls from having seizures. It helps veterans relieve their chronic pain. ObamaDidNotCare!",,@RonPaul @realDonaldTrump,,1138851048016162818,https://twitter.com/NikkaGOP/status/1138851048016162818
2019-06-12 16:47:20,NikkaGOP,,1,0,0,"Legalized Marijuana is a States Rights Issue. The fact that @BarackObama and @JoeBiden both used Marijuana yet locked up Millions of innocent Americans for doing the same exact thing really speaks to their hypocrisy. Under them, If you had 100 plants, the DEA raided you!",,@BarackObama @JoeBiden,,1138850280148070400,https://twitter.com/NikkaGOP/status/1138850280148070400
2019-06-12 07:31:59,NikkaGOP,,0,0,1,"I wish @JoeBiden had not been complicit in locking up millions for nonviolent marijuana offenses! @NORML should remember @BarackObama was raiding small marijuana cultivators, distributors and medical clinics. Don’t talk to us about curing cancer when you held the research back!",,@JoeBiden @NORML @BarackObama,,1138710520876290049,https://twitter.com/NikkaGOP/status/1138710520876290049
2019-06-12 07:15:52,NikkaGOP,,0,0,0,"I don’t know why @KamalaHarris thinks the @USWNT should be paid the same as @USMNT ... the women should be paid at least double!",,@KamalaHarris @USWNT @USMNT,,1138706465613524993,https://twitter.com/NikkaGOP/status/1138706465613524993
2019-06-12 06:20:07,NikkaGOP,RealCandaceO,0,0,0,"Nice. Good to know you care about the turtles too. There is a whole food chain that can get contaminated and end up in your baby’s blood from microplastics dissolved throughout the oceans. It’s not just 6-ringed beer-can holders wrapped around their necks...",,,,1138692436585115648,https://twitter.com/NikkaGOP/status/1138692436585115648
2019-06-11 22:27:59,NikkaGOP,ReporterLaurenB,0,0,0,"You’re right, those are rookie numbers. We need to pump those up.",,,,1138573620194697216,https://twitter.com/NikkaGOP/status/1138573620194697216
2019-06-11 07:32:57,NikkaGOP,AndrewYang,0,0,0,"#MATH",,,#MATH,1138348379912622081,https://twitter.com/NikkaGOP/status/1138348379912622081
2019-06-11 00:06:23,NikkaGOP,JackPosobiec,0,0,0,"Luke 22:33 I am prepared to go to prison or death with you",,,,1138235994723905537,https://twitter.com/NikkaGOP/status/1138235994723905537
2019-06-10 17:59:57,NikkaGOP,ARmastrangelo,0,0,0,"Without the bull-market maybe ",,,,1138143781985837056,https://twitter.com/NikkaGOP/status/1138143781985837056
2019-06-10 07:09:02,NikkaGOP,StefanMolyneux,0,0,0,"War is peace, freedom is slavery, ignorance is strength",,,,1137979972813897729,https://twitter.com/NikkaGOP/status/1137979972813897729
2019-06-09 22:41:54,NikkaGOP,KaitMarieox,0,0,0,"Kaitlin deserves a Medal of Honor. Poor soy boy couldn’t even knock the microphone out of Kait’s hand! Buttigieg is not sending his best... it’s weird how the most beta “men” like @Acosta think shoving women makes them tough or part of some #resistance",,@Acosta,#resistance,1137852349186097152,https://twitter.com/NikkaGOP/status/1137852349186097152
2019-06-09 18:06:41,NikkaGOP,PardesSeleh,0,0,0,"@MsBlaireWhite kinda",,@MsBlaireWhite,,1137783086081486849,https://twitter.com/NikkaGOP/status/1137783086081486849
2019-06-09 17:59:08,NikkaGOP,,0,0,0,"We need to truly triple down on water infrastructure and sanitation",,,,1137781187294900224,https://twitter.com/NikkaGOP/status/1137781187294900224
2019-06-09 17:51:55,NikkaGOP,,0,0,0,"@SenFeinstein being spied on by the Chinese for 20 years, her own chauffeur, should be truly concerning to all. It is striking",,@SenFeinstein,,1137779370573963264,https://twitter.com/NikkaGOP/status/1137779370573963264
2019-06-09 16:00:04,NikkaGOP,KaitMarieox,0,0,0,"I mean didn’t he basically give the old “disapprove of what you say, but I will defend to the death your right to say it""?",,,,1137751222994198529,https://twitter.com/NikkaGOP/status/1137751222994198529
2019-06-09 10:17:29,NikkaGOP,PhillyD,0,0,0,"It means you need to double down on @brave",,@brave,,1137665006512689152,https://twitter.com/NikkaGOP/status/1137665006512689152
2019-06-09 01:56:49,NikkaGOP,,0,0,0,"The bracket thresholds were raised by an average of 12% rounded to the nearest hundred.",,,,1137539011608580096,https://twitter.com/NikkaGOP/status/1137539011608580096
2019-06-08 18:25:43,NikkaGOP,,0,0,0,"How does @RottenTomatoes always miss the audience score by 2+ standard deviations?",,@RottenTomatoes,,1137425488748589061,https://twitter.com/NikkaGOP/status/1137425488748589061
2019-06-08 16:31:04,NikkaGOP,,0,0,0,"No ban on silencers. Unless you want gun owners to develop chronic tinnitus.",,,,1137396634097147906,https://twitter.com/NikkaGOP/status/1137396634097147906
2019-06-08 16:29:53,NikkaGOP,MARINE_99ZULU,0,0,1,"500 miles apart... 24 hours... seems like it could be the same perpetrator. Freaky stuff.",,,,1137396338276986881,https://twitter.com/NikkaGOP/status/1137396338276986881
2019-06-08 16:26:06,NikkaGOP,,0,0,0,"“My favorite pedo”, babies for sale and babies taped to tables, a shirt that says “I love children” in French posing next to 2 shirtless men...",,,,1137395386522324992,https://twitter.com/NikkaGOP/status/1137395386522324992
2019-06-08 16:22:30,NikkaGOP,,1,0,0,"When I worked at @Everipedia we got to work very quickly on #Pizzagate and screenshot James Alefantis’ Instagram, revealing some disturbing stuff. MSM has conditioned you to hate anyone who investigates this. They even got @JackPosobiec to ",,@Everipedia @JackPosobiec,#Pizzagate,1137394478329737216,https://twitter.com/NikkaGOP/status/1137394478329737216
2019-06-08 16:15:46,NikkaGOP,GarbHum,0,0,1,"Doctor ‘Pizza’...? Hmm... #Pizzagate",,,#Pizzagate,1137392786137726977,https://twitter.com/NikkaGOP/status/1137392786137726977
2019-06-08 16:11:47,NikkaGOP,BrandonStraka,0,0,0,"I don’t really know conservatives worried about the day white people are less than 50% of Americans. In fact, many point to Planned Parenthood aborting 3x more Black babies as an unethical eugenics!",,,,1137391784508530688,https://twitter.com/NikkaGOP/status/1137391784508530688
2019-06-08 15:56:27,NikkaGOP,RyanHillMI,0,0,0,"He (Trump, in case that pronoun is unclear) seems to live in your head rent-free.",,,,1137387922674442240,https://twitter.com/NikkaGOP/status/1137387922674442240
2019-06-08 15:51:17,NikkaGOP,KaitMarieox,1,0,3,"He must have some deep psychological issue against women that he would threaten a young female activist who is all about empowering women... #2A",,,#2A,1137386624004657152,https://twitter.com/NikkaGOP/status/1137386624004657152
2019-06-08 08:14:25,NikkaGOP,GranvilleReal,0,0,2,"@MaElviraSalazar will you please win her seat in 2020?",,@MaElviraSalazar,,1137271650309758976,https://twitter.com/NikkaGOP/status/1137271650309758976
2019-06-08 08:11:06,NikkaGOP,,0,0,0,"Dark Phoenix exceeded all expectations. @HansZimmer when I saw your name in the credits it all made sense. Truly astounding work and I am inclined to say it was my favorite Marvel movie yet. Visuals and cast were spectacular, emotion was authentic. I’m truly blown away",,@HansZimmer,,1137270814066204672,https://twitter.com/NikkaGOP/status/1137270814066204672
2019-06-08 06:10:55,NikkaGOP,,1,1,0,"Did someone say Tax Cuts? Here are some of my proposed tax cuts: #2020Election",,,#2020Election,1137240570252759040,https://twitter.com/NikkaGOP/status/1137240570252759040
2019-06-08 03:44:41,NikkaGOP,AubieWarEagle,0,0,1,"The needle exchange!",,,,1137203768200552448,https://twitter.com/NikkaGOP/status/1137203768200552448
2019-06-07 19:25:55,NikkaGOP,NikkaGOP,0,0,0,"In retrospect, maybe FiveThirtyEight wasn’t the most timeproof name ",,,,1137078252156010497,https://twitter.com/NikkaGOP/status/1137078252156010497
2019-06-07 19:15:28,NikkaGOP,NateSilver538,1,0,0,"Believe it or not there weren’t always 50 states Nate!",,,,1137075619722694656,https://twitter.com/NikkaGOP/status/1137075619722694656
2019-06-07 19:08:39,NikkaGOP,AOC,0,0,0,"My platform includes a referendum for Puerto Rico to become a state! They will get 2 senators and 4 representatives @RepJenniffer #MAGA",,@RepJenniffer,#MAGA,1137073905477095424,https://twitter.com/NikkaGOP/status/1137073905477095424
2019-06-07 16:45:23,NikkaGOP,,0,0,0,"We cannot ban suppressors! These have been around since the 19th century. Crucial for hunting too.",,,,1137037852460535814,https://twitter.com/NikkaGOP/status/1137037852460535814
2019-06-07 16:32:56,NikkaGOP,,0,0,0,"Venezuela has practically the highest corporate tax rate in the world at 34% with only 7 other countries having higher corporate tax rates...",,,,1137034719147642885,https://twitter.com/NikkaGOP/status/1137034719147642885
2019-06-07 14:23:12,NikkaGOP,mel_faith1,0,0,3,"It’s too early for this ",,,,1137002067652820992,https://twitter.com/NikkaGOP/status/1137002067652820992
2019-06-07 05:42:21,NikkaGOP,,0,0,0,"If we are serious about a Space Force, we need maximum precision. And for that, we need a base 10 model. There is no time to waste when we are in orbit, units need to be standardized for rapid arithmetic.",,,,1136870993035530240,https://twitter.com/NikkaGOP/status/1136870993035530240
2019-06-07 05:39:37,NikkaGOP,,1,0,0,"@TuckerCarlson hey tucker, I am 100% in favor of the metric system. What is amazing is that 1 liter of water = 10 cubic centimeters = 1kg and fraction to decimal/percentage conversion is extremely easy. Do you even know how many feet are in a mile? Ounces per ton?",,@TuckerCarlson,,1136870307136909312,https://twitter.com/NikkaGOP/status/1136870307136909312
2019-06-07 01:03:06,NikkaGOP,DLoesch,0,0,0,"With those kind of numbers you would think Dana worked for Planned Parenthood!",,,,1136800719766376448,https://twitter.com/NikkaGOP/status/1136800719766376448
2019-06-06 22:25:45,NikkaGOP,,0,0,0,"We owe our livelihoods to these heroes",,,,1136761119274487809,https://twitter.com/NikkaGOP/status/1136761119274487809
2019-06-06 22:25:23,NikkaGOP,,1,0,0,"Thank you to all the heroes of Normandy on D-Day. Let us stand against genocide and dictatorship!",,,,1136761029122088961,https://twitter.com/NikkaGOP/status/1136761029122088961
2019-06-06 22:17:59,NikkaGOP,ramonashelburne,0,0,0,"Oh twitter moments... this did not age well",,,,1136759164217090049,https://twitter.com/NikkaGOP/status/1136759164217090049
2019-06-06 22:17:07,NikkaGOP,mgwalks,0,0,0,"In this case, the internet was Twitter Moments...",,,,1136758944888582145,https://twitter.com/NikkaGOP/status/1136758944888582145
2019-06-06 21:36:15,NikkaGOP,thedragstate,0,0,1,"Really? I thought the ice cream and the Asiago were supposed to be good things! xD",,,,1136748662971699201,https://twitter.com/NikkaGOP/status/1136748662971699201
2019-06-06 20:57:01,NikkaGOP,thedragstate,0,0,0,"This is very creative! Can I use them too?",,,,1136738788208545792,https://twitter.com/NikkaGOP/status/1136738788208545792
2019-06-06 20:55:43,NikkaGOP,CarmineZozzora,0,0,0,"It’s so sad... when a van flips at 150km/h with 14 children being trafficked across the border they are completely silent.",,,,1136738460901859328,https://twitter.com/NikkaGOP/status/1136738460901859328
2019-06-06 20:50:21,NikkaGOP,,0,0,0,"My plan calls for a referendum on the inclusion of Puerto Rico as a State of the United States of America. Had Republican President McKinley not been assassinated, this would have happened over 100 years ago! #MAGA #PuertoRico #51st @RepJenniffer",,@RepJenniffer,#MAGA #PuertoRico #51st,1136737109908189184,https://twitter.com/NikkaGOP/status/1136737109908189184
2019-06-06 20:32:08,NikkaGOP,DeplorableChoir,0,0,0,"All the years of Call of Duty desensitized us. They have made our generation into killing machines.",,,,1136732525416419328,https://twitter.com/NikkaGOP/status/1136732525416419328
2019-06-06 16:30:46,NikkaGOP,JohnJamesMI,0,0,0,"Good Luck “Don James” @RudyGiuliani",,@RudyGiuliani,,1136671785888313345,https://twitter.com/NikkaGOP/status/1136671785888313345
2019-06-06 06:46:22,NikkaGOP,RepBarbaraLee,0,0,0,"My brother thought Cuba would be a romantic trip last year. Air and water quality were so dangerous that they had to cut the trip short. The lady he brought had gotten very ill. Bugs in food and drink... could pose serious health risks",,,,1136524717387468800,https://twitter.com/NikkaGOP/status/1136524717387468800
