date,username,to,replies,retweets,favorites,text,geo,mentions,hashtags,id,permalink
2019-10-26 19:08:25,RepHuffman,,3,83,108," ALERT: Healdsburg and Windsor start evacuating NOW. Heed evacuation notices and leave quickly but calmly. Roads will be jammed, don't wait until the last minute! Call 211 for information or go here ",,,,1188170533596286977,https://twitter.com/RepHuffman/status/1188170533596286977
2019-10-26 18:14:43,RepHuffman,,1,9,21,"An evacuation order has been issued for the city of Healdsburg, the town of Windsor, and surrounding unincorporated areas. An evacuation order means you must evacuate NOW. https://socoemergency.org/fire-info/",,,,1188157021067063296,https://twitter.com/RepHuffman/status/1188157021067063296
2019-10-26 16:10:19,RepHuffman,,5,15,19,"Northern Sonoma County: be ready to evacuate. #KincadeFire expected to produce spot fires because of high winds this evening. Check Sheriff's office for latest evacuation orders, but if you're in Alexander Valley, Windsor or Healdsburg be ready to go.",,,#KincadeFire,1188125716984057856,https://twitter.com/RepHuffman/status/1188125716984057856
2019-10-26 00:43:27,RepHuffman,,1,6,27,"5% containment and reports of extremely high winds tomorrow. If you are not currently evacuated but live in close proximity to the #KincadeFire be prepared to evacuate. If in doubt, LEAVE",,,#KincadeFire,1187892461655482368,https://twitter.com/RepHuffman/status/1187892461655482368
2019-10-25 21:58:49,RepHuffman,,0,3,7,"Tune in to @KSRO at 3:15pm PST - I'm joining to give you the latest updates on the PG&amp;E power shut offs and share what I've learned on the scene of the #KincadeFire",,@KSRO,#KincadeFire,1187851028538023936,https://twitter.com/RepHuffman/status/1187851028538023936
2019-10-25 21:24:00,RepHuffman,,2,2,21,"It’s been one year since the horrific shooting at the Tree of Life Synagogue. As we head into Shabbat, I’m standing in solidarity with all those who #ShowupForShabbat and honor the lives that were lost. Hatred, violence, and anti-semitism have no place in our society.",,,#ShowupForShabbat,1187842268708904962,https://twitter.com/RepHuffman/status/1187842268708904962
2019-10-25 20:04:43,RepHuffman,,0,1,18,"I'm on the ground in #SonomaCounty to discuss the #KincadeFire with @CAL_FIRE. Watch live https://www.facebook.com/CALFIRE/videos/1185707934951596/",,@CAL_FIRE,#SonomaCounty #KincadeFire,1187822314731245573,https://twitter.com/RepHuffman/status/1187822314731245573
2019-10-25 19:49:33,RepHuffman,,7,9,20," ALERT: Just got off the phone with PG&amp;E's CEO. Significant power outages planned, including #Marin #Sonoma #Mendocino #Humboldt &amp; #Trinity counties. Please prepare for these outages and heed warnings from local officials. Track outages here ",,,#Marin #Sonoma #Mendocino #Humboldt #Trinity,1187818498694799360,https://twitter.com/RepHuffman/status/1187818498694799360
2019-10-24 20:20:25,RepHuffman,,1,14,19,"Climate change is happening now, and we're already seeing severe impacts on the North Coast. Decimated kelp forests, starving red abalone, and an explosion of purple sea urchins are transforming the coastal ecosystem. We have to take action immediately.",,,,1187463881154859008,https://twitter.com/RepHuffman/status/1187463881154859008
2019-10-24 14:52:13,RepHuffman,KPIXtv,1,10,10,"#KincadeFire evacuation still underway. Evacuation Centers: #Healdsburg Community Center at 1557 Healdsburg Ave and Sonoma County Fairgrounds in #SantaRosa",,,#KincadeFire #Healdsburg #SantaRosa,1187381283661504515,https://twitter.com/RepHuffman/status/1187381283661504515
2019-10-24 13:52:42,RepHuffman,,3,57,52," If you’re in Geyserville, leave now. Geyserville is now under evacuation order. #KincadeFire has crossed Highway 128 near Moody Lane and is heading west. Todo de Geyserville está bajo orden de evacuación obligatoria. ",,,#KincadeFire,1187366308800880640,https://twitter.com/RepHuffman/status/1187366308800880640
2019-10-24 13:29:45,RepHuffman,sonomasheriff,1,9,5," ALERT: Northern Sonoma County: fast moving fire started last night near the Geysers. Please be ready to evacuate and pay attention to @CALFIRELNU and @sonomasheriff for updates on the #KincadeFire",,@CALFIRELNU @sonomasheriff,#KincadeFire,1187360532866719748,https://twitter.com/RepHuffman/status/1187360532866719748
2019-10-24 00:50:00,RepHuffman,,1,4,14,"For National Seafood Month, check out some sustainable seafood practices over at @NOAAFisheries! It's important to remember what we put on the dinner plate has a major impact on the health of our oceans.",,@NOAAFisheries,,1187169333480435712,https://twitter.com/RepHuffman/status/1187169333480435712
2019-10-23 22:27:31,RepHuffman,,21,38,104,".@TransportDems &amp; I heard from experts &amp; concerned Alaskans on the frightening impacts #PebbleMine might have, &amp; I came away with even more concerns. We can’t allow corporate interests to destroy the greatest salmon stronghold left &amp; all those who depend on it #SaveBristolBay",,@TransportDems,#PebbleMine #SaveBristolBay,1187133475956150273,https://twitter.com/RepHuffman/status/1187133475956150273
2019-10-23 21:21:06,RepHuffman,,0,0,0,"¡El periodo de inscripción para el Mercado de Seguros de Salud ya ha empezado! Asegúrate de #Cubrirse en http://CoveredCA.com antes del 31 de enero del 2020.",,,#Cubrirse,1187116761398874114,https://twitter.com/RepHuffman/status/1187116761398874114
2019-10-23 21:20:50,RepHuffman,,3,1,2,"Open Enrollment for the Health Insurance Marketplace has already begun! Make sure you #GetCovered on http://CoveredCA.com for 2020 before it ends on January 31.",,,#GetCovered,1187116696143847426,https://twitter.com/RepHuffman/status/1187116696143847426
2019-10-23 17:09:56,RepHuffman,,0,2,6,"The legal grounds of the “Insular Cases” are an archaic and racist view of United States territories and their inhabitants. I'm joining @NRDems in asking the Supreme Court not to rely on these antiquated rulings in their upcoming decisions.",,@NRDems,,1187053556194533376,https://twitter.com/RepHuffman/status/1187053556194533376
2019-10-23 13:56:49,RepHuffman,,2,10,38,".@portugaltheman -- The Trump admin is still rushing to permit #PebbleMine. We're holding a hearing today on threats to indigenous people, thousands of jobs, and the most valuable salmon watershed in the world. @transportdems #StopPebble #SaveBristolBay",,@portugaltheman @TransportDems,#PebbleMine #StopPebble #SaveBristolBay,1187004956106252288,https://twitter.com/RepHuffman/status/1187004956106252288
2019-10-23 13:17:29,RepHuffman,,2,4,7,"PG&E is considering power shut-offs in Marin, Mendocino, and Sonoma counties, among others, due to potentially strong and dry offshore winds. Found out if you might be impacted by clicking here ",,,,1186995058115002368,https://twitter.com/RepHuffman/status/1186995058115002368
2019-10-23 03:08:33,RepHuffman,,8,18,65,"Did you know that cruelty against animals is NOT a federal offense? Today we voted to change that by passing the #PACTAct. Animal abuse has no place in our society. #ProtectOurPets",,,#PACTAct #ProtectOurPets,1186841815590359040,https://twitter.com/RepHuffman/status/1186841815590359040
2019-10-22 22:47:16,RepHuffman,,0,3,14,"The Trump administration’s reworked biological opinions are a recipe for extinction. See my full statement here https://bit.ly/31wI6sw",,,,1186776061188726785,https://twitter.com/RepHuffman/status/1186776061188726785
2019-10-22 20:21:21,RepHuffman,,0,0,5,".@ShastaTrinityNF is a critical part of my district. I intro'd legislation to make sure it can operate with the funds it needs to improve accessibility &amp; provide educational programs for visitors so everyone can enjoy northern CA's iconic forests &amp; lakes.",,@ShastaTrinityNF,,1186739339767812096,https://twitter.com/RepHuffman/status/1186739339767812096
2019-10-22 15:47:51,RepHuffman,,5,7,31,"Wild salmon are foundational for communities in my district—especially indigenous tribes who have relied on salmon since time immemorial. Read more about my #SalmonFISHAct to protect outstanding salmon rivers &amp; the people whose livelihoods depend on them ",,,#SalmonFISHAct,1186670511004311552,https://twitter.com/RepHuffman/status/1186670511004311552
2019-10-22 01:25:32,RepHuffman,,4,1,13,"Judge Goodman was a man of great integrity who stood up to discrimination against Japanese Americans during WWII. Renaming a federal courthouse after him is a fitting tribute to his courageous rulings.",,,,1186453500676456448,https://twitter.com/RepHuffman/status/1186453500676456448
2019-10-21 22:51:11,RepHuffman,,8,11,47,"Trump’s executive order banning people from traveling to the US on the basis of religion erodes the very values our nation was founded on. My fellow Freethought Caucus members & I are in full support of the #NoBANAct, which upholds America’s role as a beacon of religious liberty.",,,#NoBANAct,1186414656287641600,https://twitter.com/RepHuffman/status/1186414656287641600
2019-10-21 20:20:42,RepHuffman,,6,5,51,".@realdonaldtrump’s abuse of power won’t prevent me from my duties as your congressman. We’ll hold the president accountable while delivering on our promises #ForThePeople: Lower prescription drug costs Defend the integrity of our elections Protect public lands &amp; more",,@realDonaldTrump,#ForThePeople,1186376786856370178,https://twitter.com/RepHuffman/status/1186376786856370178
2019-10-18 14:56:28,RepHuffman,,5,1,27,"#ICYMI, last week I held a town hall in San Rafael where we discussed the power shutoffs, health care, Trump’s failures in Syria, impeachment, and many other issues important to #CA02. Thank you to everyone who came out to engage in our discussion and make your voices heard!",,,#ICYMI #CA02,1185208029375029248,https://twitter.com/RepHuffman/status/1185208029375029248
2019-10-17 23:51:02,RepHuffman,,13,62,154,"We are living in the middle of a mass extinction, with 1 out of every 8 species at risk. Americans are looking to us to fix this; so today, @NRDems &amp; I considered legislation to #RecoverWildlife. No matter your politics, we should all want to help imperiled species thrive.",,@NRDems,#RecoverWildlife,1184980166201806848,https://twitter.com/RepHuffman/status/1184980166201806848
2019-10-17 19:19:28,RepHuffman,,2,9,31,".@NRDems are live NOW considering legislation that responds to the extinction crisis and Trump's wildlife protection budget cuts. Watch as @HouseDemocrats #RecoverWildlife and restore fish, wildlife, and plant species in our backyards http://bit.ly/2BbjJG9",,@NRDems @HouseDemocrats,#RecoverWildlife,1184911826246668289,https://twitter.com/RepHuffman/status/1184911826246668289
2019-10-16 23:49:20,RepHuffman,,3,6,37,"Tonight I had the pleasure of speaking at the International Year of the Salmon Reception. Thank you to all who organized this event for your work supporting this keystone species that communities throughout the Pacific Coast and beyond depend on!",,,,1184617353415397382,https://twitter.com/RepHuffman/status/1184617353415397382
2019-10-16 17:48:40,RepHuffman,,25,109,262,"No one is above the law. Many of my Republican colleagues know what Trump did was wrong, but refuse to act. It’s time they examine their conscience & stand up to Trump in the name of American democracy & our Constitution as we move forward w/ the impeachment inquiry #TruthExposed",,,#TruthExposed,1184526588274249728,https://twitter.com/RepHuffman/status/1184526588274249728
2019-10-16 14:00:42,RepHuffman,,3,26,44,"The Roadless Rule keeps our wildest remaining national forests intact and protects clean air and clean water. Now Trump is green-lighting logging and road-building in these important places. RT to #SaveRoadless and #ProtectTheTongass",,,#SaveRoadless #ProtectTheTongass,1184469217959202816,https://twitter.com/RepHuffman/status/1184469217959202816
2019-10-15 20:25:26,RepHuffman,,1,1,12,".@RepDeSaulnier and I just reintroduced legislation to help cover the high costs associated with special needs education. We need to ensure that schools receive the funding they need to give every child the opportunity to reach their full potential. https://bit.ly/2IU0zsn",,@RepDeSaulnier,,1184203650522079233,https://twitter.com/RepHuffman/status/1184203650522079233
2019-10-15 18:01:00,RepHuffman,,0,2,6,"Last year, I sat down with @RepSpeier, a life-long champion of ending violence against women, to hear her powerful story. On the anniversary of the day that sparked #MeToo momentum, listen to this important conversation as we work to build lasting change.",,@RepSpeier,#MeToo #MeToo,1184167302230614017,https://twitter.com/RepHuffman/status/1184167302230614017
2019-10-11 19:35:13,RepHuffman,,0,1,7," TODAY @4PM: Join me for a town hall in San Rafael -- I want to hear from you! Hope to see you there! More details in the link below ",,,,1182741463274270721,https://twitter.com/RepHuffman/status/1182741463274270721
2019-10-11 13:42:45,RepHuffman,Wilderness,5,41,76,"Trump’s latest appointee is an anti-environment radical who has no place leading @BLMNational and managing its 245 million acres for the public. He’s a climate denier who wants to “sell all lands east of the Mississippi"" and called the Endangered Species Act ""a joke.""",,@BLMNational,,1182652760958930944,https://twitter.com/RepHuffman/status/1182652760958930944
2019-10-11 01:05:29,RepHuffman,,2,7,37,"At best, Trump apologists don’t understand the Constitution’s impeachment clause. At worst, they are actively misleading Americans about the facts. It’s time they stand up to this lawless president. #TruthExposed",,,#TruthExposed,1182462186586853382,https://twitter.com/RepHuffman/status/1182462186586853382
2019-10-10 22:09:54,RepHuffman,,0,2,3,"Today is World Mental Health Day. 1 in 5 U.S. adults experience mental illness each year, but fewer than half receive professional treatment. We have to ensure that everyone can access necessary mental health care and work to destigmatize mental illness.",,,,1182417999942373384,https://twitter.com/RepHuffman/status/1182417999942373384
2019-10-10 19:41:46,RepHuffman,,2,8,25,"Guide dogs provide an important service to veterans & people with disabilities - but driver distractions & non-legitimate service animals can cause safety risks for guide dogs & travelers. Thanks @GDB_Official for inviting me to talk about how we can proactively address this!",,@GDB_official,,1182380723094917120,https://twitter.com/RepHuffman/status/1182380723094917120
2019-10-10 17:00:18,RepHuffman,,6,2,13,"UPDATE: Power is being restored throughout CA02. High, dry winds are still expected through the afternoon. My staff and I are continuing to monitor, and remember - resource centers are still available in your areas! https://www.kqed.org/science/1948809/searchable-map-of-bay-area-power-outages",,,,1182340088069545988,https://twitter.com/RepHuffman/status/1182340088069545988
2019-10-10 16:21:10,RepHuffman,,1,2,5," TOMORROW: Join me for a town hall in San Rafael -- I look forward to hearing from you! Hope to see you there! More details in the link below ",,,,1182330238509965313,https://twitter.com/RepHuffman/status/1182330238509965313
2019-10-09 02:00:14,RepHuffman,,3,3,7,"PSA: With the first of several public safety power outages beginning tomorrow, start preparing by knowing if you're affected. Stock up on batteries and stay connected by keeping phones charged. See if your area is impacted here ",,,,1181751190087970816,https://twitter.com/RepHuffman/status/1181751190087970816
2019-10-09 00:56:31,RepHuffman,,3,5,15,"This Friday, I’m hosting a town hall in San Rafael, CA! Join me for an update on what’s happening in Congress and make your voices heard. Date: Friday, 10/11 Time: 4:00 PM - 5:30 PM PST Place: San Rafael Community Center, 618 B Street, San Rafael, CA. https://www.eventbrite.com/e/rep-huffman-community-town-hall-101119-tickets-74743847861",,,,1181735155595173893,https://twitter.com/RepHuffman/status/1181735155595173893
2019-10-08 20:33:06,RepHuffman,,1,3,18,"We have all benefited from our longstanding laws for managing fisheries resources. I'm touring the country to get feedback on improving how we manage fisheries in the face of climate change and other challenges.",,,,1181668866440732677,https://twitter.com/RepHuffman/status/1181668866440732677
2019-10-08 15:39:42,RepHuffman,,7,10,25,"Refusing to let a key witness testify about Trump's abuses of power is obstruction of justice. @USAmbEU has vital information to share, &amp; his testimony is being blocked by the Trump admin. Congress &amp; the American people have a right to this information",,@USAmbEU,,1181595027732140032,https://twitter.com/RepHuffman/status/1181595027732140032
2019-10-08 03:49:01,RepHuffman,,0,3,19,"Conditions are changing and we have a chance to fine tune the Magnuson-Stevens Act - and that's what this tour is all about. Keep checking in with us as I continue my nationwide tour!",,,,1181416179061153793,https://twitter.com/RepHuffman/status/1181416179061153793
2019-10-08 03:49:00,RepHuffman,,8,12,57,"I just finished the second session of our listening tour! These sessions have already been a great way for me to hear from all kinds of stakeholders on the status of fisheries management.",,,,1181416177119223809,https://twitter.com/RepHuffman/status/1181416177119223809
2019-10-07 21:57:09,RepHuffman,,6,9,36,"The president is threatening our democracy by stonewalling congressional oversight. @realdonaldtrump’s attempts to undermine the separation of powers is creating a dangerous precedent that could take generations to remedy.",,@realDonaldTrump,,1181327628290154499,https://twitter.com/RepHuffman/status/1181327628290154499
2019-10-07 19:30:28,RepHuffman,,2,6,40,"As a longtime advocate for endangered species, it is disturbing to see these vulnerable creatures targeted across my home state. Fortunately, I believe the compassion of my fellow Californians is too strong to be overcome by Trump's reckless whims.",,,,1181290717345386497,https://twitter.com/RepHuffman/status/1181290717345386497
2019-10-06 15:45:27,RepHuffman,,7,15,36,"The consequences of climate change aren’t limited to the obvious like rising ocean temperatures or severe weather. The surge of infectious disease is just one of the ripple effects from our rising climate. Have a look at this ",,,,1180871701653004288,https://twitter.com/RepHuffman/status/1180871701653004288
2019-10-05 23:09:48,RepHuffman,,1,4,15,"Petaluma is leading the charge in addressing disaster readiness. In CA, we are vulnerable to many disasters—from earthquakes and wildfires to infrastructure contamination and cyber threats. Being prepared can make all the difference.",,,,1180621137623027713,https://twitter.com/RepHuffman/status/1180621137623027713
2019-10-05 18:24:46,RepHuffman,,8,23,62,"Overfishing is a danger to our oceans and the livelihood of fishing communities. We need sustainable practices—based in science—for the environment and economy.",,,,1180549405939765248,https://twitter.com/RepHuffman/status/1180549405939765248
2019-10-04 22:50:00,RepHuffman,,3,4,8,"Join me for the first sessions on my Listening Tour in Arcata (10/5, 2:30 p.m) & San Francisco (10/7, 1:00 p.m.). We’re bringing stakeholders together to discuss making our oceans and fisheries environmentally & economically resilient. Free & open to all!",,,,1180253764713730048,https://twitter.com/RepHuffman/status/1180253764713730048
2019-10-04 18:28:41,RepHuffman,,11,15,62,".@realdonaldtrump has repeatedly broken his oath of office &amp; used his power for political gain. The evidence is clear: Congress must impeach. Our democracy depends on it.",,@realDonaldTrump,,1180188001953046528,https://twitter.com/RepHuffman/status/1180188001953046528
2019-10-04 13:36:26,RepHuffman,,4,10,18,"An accurate wake-up call by @Citi. #ClimateChange isn’t just an environmental risk, it’s an economic one. Natural disasters disrupt global trade and cost businesses billions of dollars. It’s time we treat climate change as the overarching threat it is.",,@Citi,#ClimateChange,1180114454400372736,https://twitter.com/RepHuffman/status/1180114454400372736
2019-10-03 20:53:06,RepHuffman,,3,11,40,"Happy #FatBearWeek! Salmon are so important – not just for tribes and fishermen, but for the fat bears of Katmai and many other ecosystems! Countless groups rely on these fish, which is why we must protect salmon strongholds from threats like #PebbleMine.",,,#FatBearWeek #PebbleMine,1179861960847966208,https://twitter.com/RepHuffman/status/1179861960847966208
2019-10-02 18:58:47,RepHuffman,,2,6,17,"Excellent piece by my friend, @RepLowenthal, on the urgent need to #ProtectTheArctic. The ANWR is a fragile and beautiful resource that needs safeguarding. Trump is continuing to threaten these lands, but we will continue our fight to protect them.",,@RepLowenthal,#ProtectTheArctic,1179470802955177984,https://twitter.com/RepHuffman/status/1179470802955177984
2019-10-01 17:09:07,RepHuffman,CNNnewsroom,3,4,37,"I joined @CNN to talk impeachment and how Dems are still delivering on bold legislation #ForThePeople. Trump has betrayed his oath of office, and we will act swiftly and decisively to defend our constitution.",,@CNN,#ForThePeople,1179080817588473856,https://twitter.com/RepHuffman/status/1179080817588473856
2019-09-25 21:04:42,RepHuffman,NRDems,1,5,9,"Important oceans policy thread from @NRDems on our ongoing #OceanClimateAction work. ",,@NRDems,#OceanClimateAction,1176965774054965248,https://twitter.com/RepHuffman/status/1176965774054965248
2019-09-25 14:00:38,RepHuffman,RepRaulGrijalva,2,6,20,"While we work on the broader climate solutions we'll need, we're legislating on #OceanClimateAction already. We'll be voting on ocean health and coastal resilience bills in committee today, and there's more to come. 2/2",,,#OceanClimateAction,1176859057161945090,https://twitter.com/RepHuffman/status/1176859057161945090
2019-09-25 13:55:30,RepHuffman,,4,10,31,"We knew the oceans were in trouble, and today's intl report underscores the urgency: we must take #OceanClimateAction and we must do so quickly. At @NRDems we've been working on this all year. My first subcommittee hearing was on ocean health. 1/2",,@NRDems,#OceanClimateAction,1176857765052145664,https://twitter.com/RepHuffman/status/1176857765052145664
2019-09-24 18:06:29,RepHuffman,repjohnlewis,7,12,56,"As always, @repjohnlewis is the conscience of the Congress. We can't sit by as Trump repeatedly violates his oath to protect the Constitution. The House must act decisively to defend our democracy, by pursuing the strongest possible response at the quickest possible pace.",,@repjohnlewis,,1176558537650122752,https://twitter.com/RepHuffman/status/1176558537650122752
2019-09-20 21:01:31,RepHuffman,,2,2,5,"#CA02: Need to renew your passport? The SF Passport Agency will offer open walk-ins tomorrow (Saturday, Sept 21). No appointment needed for any passport renewal or first time application, routine or expedited. More here: http://bit.ly/2lSw65e",,,#CA02,1175153036450250752,https://twitter.com/RepHuffman/status/1175153036450250752
2019-09-19 17:39:58,RepHuffman,,5,14,73,"Important initiative by @RepKatieHill to call for a renegotiated NAFTA that truly helps communities, workers, and the environment. We must include real climate standards in NAFTA 2.0, and we must stay in the Paris climate agreement. #ActonClimate",,@RepKatieHill,#ActonClimate,1174739923603197964,https://twitter.com/RepHuffman/status/1174739923603197964
2019-09-18 16:19:16,RepHuffman,JonahGottlieb,0,0,6,"Glad you and your colleagues made the trip from California. See you soon.",,,,1174357230382190593,https://twitter.com/RepHuffman/status/1174357230382190593
2019-09-18 15:46:19,RepHuffman,TheWCS,3,12,32,"Thanks for supporting our bill! This is a great bipartisan effort with @VernBuchanan and other colleagues to tackle the growing international extinction crisis and protect critically endangered wildlife. Read more about it here https://huffman.house.gov/media-center/press-releases/rep-huffman-introduces-bipartisan-bill-to-address-world-extinction-crisis_",,@VernBuchanan,,1174348937983090689,https://twitter.com/RepHuffman/status/1174348937983090689
2019-09-12 17:24:58,RepHuffman,NRDems,15,37,137,"A great bipartisan vote. Thanks to all who have been standing with us in this effort to protect the Arctic Refuge!",,,,1172199437508079617,https://twitter.com/RepHuffman/status/1172199437508079617
2019-09-12 14:22:50,RepHuffman,NRDems,7,19,56,"The debate on the House floor is happening RIGHT NOW on whether to #ProtectTheArctic from Trump's oil and gas drilling spree. A vote on my bill is coming soon.",,,#ProtectTheArctic,1172153601164292097,https://twitter.com/RepHuffman/status/1172153601164292097
2019-09-12 13:07:17,RepHuffman,johnpodesta,6,24,50,"Important: what the Trump administration is racing to do to America's Arctic will lock us into a future of unsustainable carbon pollution. The House will vote TODAY on my bill to #ProtectTheArctic from the Trump tax law's oil drilling mandate.",,,#ProtectTheArctic,1172134585372688390,https://twitter.com/RepHuffman/status/1172134585372688390
2019-09-11 21:09:12,RepHuffman,jacob_holzman,0,3,23," ",,,,1171893477648584706,https://twitter.com/RepHuffman/status/1171893477648584706
2019-09-11 14:36:47,RepHuffman,NRDems,3,10,30,"This morning's press conference is over, but it's not too late to watch. Important discussion about my bill to protect America’s Arctic from Trump's reckless drilling plan:",,,,1171794724501565440,https://twitter.com/RepHuffman/status/1171794724501565440
2019-09-11 14:31:19,RepHuffman,,7,39,101,"President Trump and his crony cabinet are waging a war on science with sharpies — and threatening reprisals against scientists for doing their jobs. In a place as special as the #Arctic Coastal Plain, this is a recipe for disaster. #ProtecttheArctic",,,#Arctic #ProtecttheArctic,1171793348975312897,https://twitter.com/RepHuffman/status/1171793348975312897
