date,username,to,replies,retweets,favorites,text,geo,mentions,hashtags,id,permalink
2020-03-02 16:32:09,RepMcNerney,,3,3,14,"Older Americans have the fundamental right to: Preserved and improved Social Security benefits Protection against financial exploitation and digital identity theft Protection against age discrimination in the workforce #ProtectOlderAmericans",,,#ProtectOlderAmericans,1234516857476042754,https://twitter.com/RepMcNerney/status/1234516857476042754
2020-02-28 21:26:09,RepMcNerney,,1,2,5,"The men and women who carried Operation Desert Storm helped bring an end to the Gulf War. Their service and sacrifice should be honored and remembered.",,,,1233503682177781760,https://twitter.com/RepMcNerney/status/1233503682177781760
2020-02-27 21:50:36,RepMcNerney,,0,4,5,"I'm excited to announce I'm accepting submissions for the 2020 Congressional Art Competition from now until Friday, April 17th! Check out my website for more information on eligibility and how to participate:",,,,1233147446609547271,https://twitter.com/RepMcNerney/status/1233147446609547271
2020-02-18 22:42:13,RepMcNerney,,3,10,8,"SCAM ALERT: There have been reports of scam calls in our area from someone pretending to be a representative from PG&E – making threats to shut off customers’ power if they do not make a payment. PG&E has confirmed that this is a scam.",,,,1229898943179427840,https://twitter.com/RepMcNerney/status/1229898943179427840
2020-02-13 22:29:55,RepMcNerney,,5,8,21,"Great to join @pewtrusts for a conversation with state leaders on bridging gaps in broadband access and adoption. It’s critical that policymakers at the federal level partner with states and local communities to find solutions.",,@pewtrusts,,1228083911495995393,https://twitter.com/RepMcNerney/status/1228083911495995393
2020-02-13 00:06:53,RepMcNerney,,2,15,35,"Opening the entire 6 GHz band for unlicensed use would foster innovation and greatly benefit American consumers and our nation's economy. Today I sent a letter with @RepMGriffith to @AjitPaiFCC urging the Chairman to do just that.",,@RepMGriffith @AjitPaiFCC,,1227745926682497029,https://twitter.com/RepMcNerney/status/1227745926682497029
2020-02-12 21:39:34,RepMcNerney,,0,8,20,"Today I’m voting for #KeepItWild legislation to protect 1.3 million acres of wilderness. This important bill is just another example of how @HouseDemocrats are fighting the #ClimateCrisis and protecting our #PublicLands.",,@HouseDemocrats,#KeepItWild #ClimateCrisis #PublicLands,1227708851568463873,https://twitter.com/RepMcNerney/status/1227708851568463873
2020-02-12 18:29:34,RepMcNerney,,7,3,12,"It’s time to end political interference with women’s private medical decisions. It’s time for the Women’s Health Protection Act #WHPA.",,,#WHPA,1227661034212773888,https://twitter.com/RepMcNerney/status/1227661034212773888
2020-02-11 18:16:28,RepMcNerney,,5,3,10,"More backward logic from the Trump Administration: While our nation faces a looming climate crisis, the #TrumpBudget proposes to slash EPA funding by 26.5%, cut DOE Energy Efficiency and Renewable Energy funding by 74%, &amp; eliminate the Advanced Research Projects Agency.",,,#TrumpBudget,1227295352753180673,https://twitter.com/RepMcNerney/status/1227295352753180673
2020-02-06 22:47:37,RepMcNerney,,7,0,12,"While corporate profits are soaring, most Americans are working too hard for too little. The #PROAct strengthens workers’ power to organize and negotiate for a fair share of the profits they produce.",,,#PROAct,1225551647289552897,https://twitter.com/RepMcNerney/status/1225551647289552897
2020-02-06 19:19:52,RepMcNerney,,1,1,5,"Help make sure everyone in our community is counted in #Census2020. The @USCensusBureau is hiring in our district and across the country. Learn more or apply today at: https://recruitment.2020census.gov/",,@uscensusbureau,#Census2020,1225499368389849088,https://twitter.com/RepMcNerney/status/1225499368389849088
2020-02-06 18:19:24,RepMcNerney,,5,71,143,"#CitizensUnited opened a floodgate of corporate spending in politics and caused a wave of dark money to wash over our elections, drowning out the voices of the American people.",,,#CitizensUnited,1225484150825771009,https://twitter.com/RepMcNerney/status/1225484150825771009
2020-02-05 21:57:19,RepMcNerney,,8,8,33,"This is a sad day for our nation. With this vote, Senate Republicans have signed off on foreign interference in our elections.",,,,1225176604453875723,https://twitter.com/RepMcNerney/status/1225176604453875723
2020-02-04 20:30:58,RepMcNerney,,2,4,6,"Protecting people with pre-existing conditions is something we can all agree on. At tonight’s #SOTU, I want to hear how we can work together to improve the #StateOfHealthCare #ForThePeople.",,,#SOTU #StateOfHealthCare #ForThePeople,1224792485760851970,https://twitter.com/RepMcNerney/status/1224792485760851970
2020-01-31 19:39:12,RepMcNerney,,4,3,7,"Don’t forget, today is the last day for Californians to sign-up for health insurance through @CoveredCA.",,@CoveredCA,,1223329904550432769,https://twitter.com/RepMcNerney/status/1223329904550432769
2020-01-30 21:08:46,RepMcNerney,,3,3,10,"The Trump Administration is trying to throw people off the #SocialSecurity rolls with their proposed rule for disability insurance. Americans EARN these benefits! That’s why I joined 100+ of my colleagues calling on them to halt this disastrous proposal! #NoSocialSecurityCuts",,,#SocialSecurity #NoSocialSecurityCuts,1222990056853512192,https://twitter.com/RepMcNerney/status/1222990056853512192
2020-01-30 19:15:20,RepMcNerney,,1,5,23,"Fred Korematsu challenged an Executive Order that forcefully interned hundreds of thousands of Japanese Americans during WWII. On #KorematsuDay we commemorate his contributions to ensuring Americans' civil liberties and his tireless work against injustice in our nation.",,,#KorematsuDay,1222961510298853376,https://twitter.com/RepMcNerney/status/1222961510298853376
2020-01-30 18:09:40,RepMcNerney,,3,0,8,"Any senator who validates these outrageous claims is paving the way for a government that operates outside the bounds of its own laws, giving unrestrained power to lawmakers with no mechanism to hold them accountable. Is that what we want as a nation?",,,,1222944983969386499,https://twitter.com/RepMcNerney/status/1222944983969386499
2020-01-30 18:09:39,RepMcNerney,,4,2,9,"Acquitting this president will open a floodgate of foreign interference in our elections justified by using this same argument. This assertion could also be used to defend other wrongful acts by lawmakers & candidates, rendering them impervious to consequences for their misdeeds.",,,,1222944983298334720,https://twitter.com/RepMcNerney/status/1222944983298334720
2020-01-30 18:09:39,RepMcNerney,,6,5,18,"The president's lawyers have argued that his office affords him unprecedented power and by extension, anyone running for office cannot be held accountable for breaking the law if it’s in an effort to get elected.",,,,1222944982560059393,https://twitter.com/RepMcNerney/status/1222944982560059393
2020-01-30 00:17:26,RepMcNerney,,0,4,4,"During the recent wildfires, 88 cell towers went down in @CCCounty, cutting people off from emergency services &amp; loved ones. I asked @AjitPaiFCC to hold a field hearing in Northern California on this issue &amp; today I'm following up on his commitment to me.",,@CCCounty @AjitPaiFCC,,1222675150627315712,https://twitter.com/RepMcNerney/status/1222675150627315712
2020-01-29 20:37:12,RepMcNerney,,4,5,25,"The balance of power in our nation is derived from our Constitution. Anyone who votes to leave this president in office will be an accomplice to the collapse of our country’s very foundation.",,,,1222619725630406663,https://twitter.com/RepMcNerney/status/1222619725630406663
2020-01-24 19:47:08,RepMcNerney,,4,5,7,"Thanks to everyone who came out to my Stockton and Antioch open house events! Your thoughts and concerns are important to me, and these events are a great opportunity for me to hear directly from you about the critical issues facing our community and our nation.",,,,1220795188853059589,https://twitter.com/RepMcNerney/status/1220795188853059589
2020-01-23 19:08:13,RepMcNerney,RepMcNerney,1,1,4,"If you’re in the Antioch area, I hope you can make it to my Antioch office for my open house tonight!",,,,1220423006926856193,https://twitter.com/RepMcNerney/status/1220423006926856193
2020-01-22 23:17:56,RepMcNerney,,24,212,251,"Veterans with traumatic brain injuries (TBIs) can have constant pain & reduced cognitive function. I wrote the law to improve care for service members with TBIs & am disgusted the president would trivialize these severe injuries. Our troops deserve better.",,,,1220123459738574849,https://twitter.com/RepMcNerney/status/1220123459738574849
2020-01-22 18:44:11,RepMcNerney,,28,15,73,"This sham trial proves that the GOP is officially the party of Trump. Both House and Senate Republicans have shown that they are governed by the fear of crossing their leader, rather than the oath they swore to uphold. This is a sad statement about the future of our democracy.",,,,1220054567293005824,https://twitter.com/RepMcNerney/status/1220054567293005824
2020-01-22 17:32:14,RepMcNerney,RepMcNerney,1,2,5,"Looking forward to seeing everyone at my open house in Stockton tonight! Stop by my office between 6:00 PM - 7:30 PM for an update on what's happening in Washington and a discussion about the important issues impacting our nation.",,,,1220036463661895682,https://twitter.com/RepMcNerney/status/1220036463661895682
2020-01-20 18:44:26,RepMcNerney,,2,2,9,"This year marks the 25th anniversary of the day of service that honors Dr. Martin Luther King, Jr. As we celebrate his life and the contributions he made to our nation, I hope you’ll join me in recommitting to finding ways to best serve our own community. https://www.nationalservice.gov/serve-your-community/mlk-day-service",,,,1219329857697566721,https://twitter.com/RepMcNerney/status/1219329857697566721
2020-01-14 18:09:24,RepMcNerney,,1,2,6,"Next Thursday, January 23rd, I'll be hosting an open house event at my Antioch office from 6:00-7:30 PM. I'm looking forward to hearing from you about the issues that are important to our community!",,,,1217146714521513985,https://twitter.com/RepMcNerney/status/1217146714521513985
2020-01-14 17:57:46,RepMcNerney,,0,5,2,"I'll be hosting the an open house event at my Stockton office next Wednesday, January 22nd from 6:00-7:30 PM. Hope to see you there!",,,,1217143783340564480,https://twitter.com/RepMcNerney/status/1217143783340564480
2020-01-08 19:45:06,RepMcNerney,EnergyCommerce,2,5,16,"The #climatecrisis is the greatest threat of our time. We need bold action, and that’s why I’m proud to join my E&amp;C colleagues to announce our #CLEANfuture proposal.",,,#climatecrisis #CLEANfuture,1214996470153265154,https://twitter.com/RepMcNerney/status/1214996470153265154
2020-01-08 19:22:54,RepMcNerney,,2,32,63,"One year ago today, the House introduced #HR8, the Bipartisan Background Checks Act of 2019. We passed this legislation shortly after, but @senatemajldr refuses to bring this crucial bill to the Senate floor. RT to tell him it’s time to vote to #EndGunViolence.",,@senatemajldr,#HR8 #EndGunViolence,1214990883243868164,https://twitter.com/RepMcNerney/status/1214990883243868164
2020-01-04 01:55:57,RepMcNerney,,5,2,12,"Our founding fathers created a system of checks and balances to ensure this kind of reckless behavior could be stopped by a co-equal branch of government. We cannot allow the sole power in the executive to force our nation into another senseless war.",,,,1213277856459083776,https://twitter.com/RepMcNerney/status/1213277856459083776
2020-01-04 01:55:26,RepMcNerney,,2,3,9,"But once again this president has acted without any thought for a long-term national security strategy, and put more Americans’ lives in danger.",,,,1213277727723282432,https://twitter.com/RepMcNerney/status/1213277727723282432
2020-01-04 01:54:25,RepMcNerney,,0,2,7,"None of us will shed a tear for Qasem Suleimani - he was a murderer, responsible for the deaths of hundreds of American troops and thousands of innocent civilians.",,,,1213277471405203457,https://twitter.com/RepMcNerney/status/1213277471405203457
2020-01-04 01:54:09,RepMcNerney,,9,6,16,"With no congressional approval or consultation, the president launched targeted airstrikes and has now ordered thousands more soldiers to a region of the world that he promised to withdraw American troops from.",,,,1213277405663703040,https://twitter.com/RepMcNerney/status/1213277405663703040
2019-12-18 19:32:41,RepMcNerney,HouseDemocrats,32,13,63,"I'm getting ready to speak on the House floor in support of the articles of impeachment. You can can follow along with the debate below.",,,,1207383197559996418,https://twitter.com/RepMcNerney/status/1207383197559996418
2019-12-16 23:10:47,RepMcNerney,,27,18,66,"If the president's actions bare no consequence, future presidents may act without constraint and American democracy will be at an end. Therefore, I will uphold my sworn duty to defend the Constitution and vote to impeach this president.",,,,1206713312173608961,https://twitter.com/RepMcNerney/status/1206713312173608961
2019-12-13 20:34:26,RepMcNerney,,1,1,5,"California's open enrollment period to sign-up for health insurance continues until January 31st. Those who sign-up by December 15th will be covered starting the first of the year. For more information, visit Covered California's website:",,,,1205586801957769221,https://twitter.com/RepMcNerney/status/1205586801957769221
2019-12-12 20:03:55,RepMcNerney,,4,8,37,"Today I cast my vote for Marta and the millions of others struggling with the skyrocketing price of prescription medication. Passing H.R. 3 is the first step to #LowerDrugCosts for the American people.",,,#LowerDrugCosts,1205216733742714882,https://twitter.com/RepMcNerney/status/1205216733742714882
2019-12-10 23:05:09,RepMcNerney,,5,9,18,"Coastal communities are already suffering from a rise in sea levels, increased flooding, & severe weather due to #ClimateChange. @HouseDemocrats just passed bipartisan #OceanClimateAction bills to protect the 42% of Americans living in these areas.",,@HouseDemocrats,#ClimateChange #OceanClimateAction,1204537563433852929,https://twitter.com/RepMcNerney/status/1204537563433852929
2019-12-10 16:54:28,RepMcNerney,,4,7,14,"Today marks two years since @POTUS and @FCC repealed #NetNeutrality rules. We passed the #SaveTheInternet Act in the House earlier this year, and I’m joining @SenateDems in demanding an immediate vote on this bill in the Senate!",,@POTUS @FCC @SenateDems,#NetNeutrality #NetNeutrality #SaveTheInternet,1204444279986425856,https://twitter.com/RepMcNerney/status/1204444279986425856
2019-12-06 19:07:07,RepMcNerney,,7,4,13,"There is nothing more sacred in our democracy than the right to vote. That’s why @HouseDemocrats passed #HR4 to put an end to egregious voter suppression tactics and #RestoreTheVote #ForThePeople.",,@HouseDemocrats,#HR4 #RestoreTheVote #ForThePeople,1203028110544904194,https://twitter.com/RepMcNerney/status/1203028110544904194
2019-12-04 19:44:34,RepMcNerney,,5,5,14,"Because of Trump’s #FamilySeparation policy: Thousands of families have been torn apart Parents have been deported without their children The Admin has yet to reunify all separated families #DontLookAway - watch the panel on #USCCRReports https://www.facebook.com/congressional.hispanic.caucus/",,,#FamilySeparation #DontLookAway #USCCRReports,1202312758580174850,https://twitter.com/RepMcNerney/status/1202312758580174850
2019-11-28 23:56:25,RepMcNerney,CACorrections,1,1,15,"Thanks to all the volunteers who came out to help serve our community!",,,,1200201812571238406,https://twitter.com/RepMcNerney/status/1200201812571238406
2019-11-28 23:53:26,RepMcNerney,,3,1,20,"Wishing you and yours a very happy Thanksgiving!",,,,1200201060855533573,https://twitter.com/RepMcNerney/status/1200201060855533573
2019-11-26 19:10:11,RepMcNerney,,3,2,14,"SNAP is the first line of defense against hunger and food insecurity those in need. But this administration wants to cut this crucial program, risking the health of our most vulnerable population: our children. #1MillionKids",,,#1MillionKids,1199405004471382021,https://twitter.com/RepMcNerney/status/1199405004471382021
2019-11-25 19:09:18,RepMcNerney,,3,3,10,"Across the country, many family members take on the role of caregiver for loved ones in need. We can all support these selfless individuals this #NationalFamilyCaregiversMonth with simple acts of kindness, such as sending a card, helping them run an errand, or preparing a meal.",,,#NationalFamilyCaregiversMonth,1199042395385614336,https://twitter.com/RepMcNerney/status/1199042395385614336
2019-11-20 19:49:56,RepMcNerney,,2,1,7,"A persistent gender-based wage gap continues to harm women, their families, and the economy – and it is particularly damaging for Latinas. We must #DemandMore and pass the #PaycheckFairness Act now. #LatinaEqualPay",,,#DemandMore #PaycheckFairness #LatinaEqualPay,1197240678302076932,https://twitter.com/RepMcNerney/status/1197240678302076932
2019-11-19 17:48:59,RepMcNerney,,0,1,7,"I had a great time this weekend at the NAACP Stockton Branch Freedom Fund Banquet. It was an honor to help recognize the six awardees for their contributions and service to our community.",,,,1196847853899067392,https://twitter.com/RepMcNerney/status/1196847853899067392
2019-11-14 17:42:24,RepMcNerney,,8,9,26,"Our children shouldn't have to go to school in fear. The House has passed multiple commonsense gun safety bills, and it's past time for the Senate to act. #EnoughIsEnough",,,#EnoughIsEnough,1195034256214503424,https://twitter.com/RepMcNerney/status/1195034256214503424
2019-11-13 17:28:42,RepMcNerney,,2,0,14,"2019 marks the 100th anniversary of Congressional passage of the 19th Amendment affirming women’s right to vote. But women's rights are still not guaranteed in the Constitution. That’s why I’m proud to cosponsor the Equal Rights Amendment. #ERANow! #ERAHearing",,,#ERANow #ERAHearing,1194668423617351680,https://twitter.com/RepMcNerney/status/1194668423617351680
2019-11-12 23:20:44,RepMcNerney,,2,1,8,"#DACA recipients are integral members of our communities. They've built their lives here and should have the opportunity to continue contributing to our communities without the constant threat of deportation. For DACA recipients #HomeisHere, and I am proud to stand with them.",,,#DACA #HomeisHere,1194394628017065985,https://twitter.com/RepMcNerney/status/1194394628017065985
2019-11-12 23:11:37,RepMcNerney,,2,7,27,"Over 4 million Californians have diabetes & struggle with medical costs that are approximately 2.3x higher than those without. Last year, @CDCgov provided more than $6 million for prevention &amp; education programs, &amp; I'll continue to support this critical funding. #CountMeInADA",,@CDCgov,#CountMeInADA,1194392332952637440,https://twitter.com/RepMcNerney/status/1194392332952637440
2019-11-12 23:00:59,RepMcNerney,,1,3,7,"This administration wants to allow widespread discrimination in our health care system, jeopardizing many Americans' care – including women & the LGBTQ community. We can’t allow this. That’s why I’m proud to cosponsor the #PutPatientsFirst Act to stop this harmful rule.",,,#PutPatientsFirst,1194389656856604673,https://twitter.com/RepMcNerney/status/1194389656856604673
2019-11-12 02:09:04,RepMcNerney,,1,2,12,"It was a privilege to attend today’s #VeteransDay Ceremony in Antioch and to recognize this year’s Antioch Veteran of the Year, Mr. Denny Hollison. Thank you to all of our nation’s veterans for their service and their sacrifice.",,,#VeteransDay,1194074600746946564,https://twitter.com/RepMcNerney/status/1194074600746946564
2019-11-05 18:58:05,RepMcNerney,,6,4,14,"President Trump is intentionally and willfully condemning future generations to a world of catastrophic climate change and conflict. Our withdrawal from the Paris Climate Accord will abandon America's leadership at a time when the world needs it most.",,,,1191791814061297666,https://twitter.com/RepMcNerney/status/1191791814061297666
2019-10-31 19:58:35,RepMcNerney,NALC_National,3,2,8,"It was a privilege to sit down with Ivan, a Stocktonian and @NALC_National Local Hero Award winner, who courageously helped a young girl escape a dangerous and horrible situation.",,@NALC_National,,1189995100329431041,https://twitter.com/RepMcNerney/status/1189995100329431041
2019-10-28 23:02:40,RepMcNerney,,1,8,11,"Diwali celebrates the inner light that protects us during the darkest times. I want to thank the Mountain House Sikh community for inviting me to the join them during the Diwali Mela Festival of Lights.",,,,1188954261108985856,https://twitter.com/RepMcNerney/status/1188954261108985856
2019-10-24 18:09:40,RepMcNerney,,1,4,15,"#VaccinesWork to save children’s lives from deadly diseases. Over 400 million children are vaccinated each year to #EndPolio, and we are closer than ever to eradicating this disease. #WorldPolioDay",,,#VaccinesWork #EndPolio #WorldPolioDay,1187430974033936385,https://twitter.com/RepMcNerney/status/1187430974033936385
2019-10-24 17:47:41,RepMcNerney,,0,2,11,"Great turn-out at the Stockton Walk to End Alzheimer’s this past weekend! Over the last five years, Congress has quadrupled Alzheimer’s research funding, but we still have more work to do. I’ll continue to support and push for federal investment in research until we find a cure.",,,,1187425442380296193,https://twitter.com/RepMcNerney/status/1187425442380296193
2019-10-23 21:55:48,RepMcNerney,,0,0,6,"Thanks to the students from McCaffrey Middle School who stopped by the Capitol today! It was great to hear from such bright and inquisitive young people.",,,,1187125497458761731,https://twitter.com/RepMcNerney/status/1187125497458761731
2019-10-23 21:18:01,RepMcNerney,,3,2,7,"Federal investment in neuroscience research is crucial to medical discovery. As @SfNtweets holds its annual meeting, I will continue to push for much-needed funding to advance our understanding of the brain and the nervous system, and to combat neurodegenerative illnesses.",,@SfNtweets,,1187115988657102850,https://twitter.com/RepMcNerney/status/1187115988657102850
2019-10-21 21:23:44,RepMcNerney,,0,3,8,"The cost of prescription medication is skyrocketing and Americans demand that Congress take action. H.R. 3 would give Medicare the authority to negotiate #LowerDrugCosts for the American people.",,,#LowerDrugCosts,1186392650192183298,https://twitter.com/RepMcNerney/status/1186392650192183298
2019-10-21 20:41:28,RepMcNerney,,0,1,7,"Open enrollment has begun. Californians can sign-up for health insurance coverage from now until January 31st by visiting the Covered California website.",,,,1186382012531269636,https://twitter.com/RepMcNerney/status/1186382012531269636
2019-10-18 21:55:23,RepMcNerney,,3,1,8,"The Outsourcing Accountability Act will bring real transparency at a time when consumers are becoming increasingly conscious about where they spend and invest their money. We deserve to know if companies are exploiting these practices at the expense of American workers.",,,,1185313450668544000,https://twitter.com/RepMcNerney/status/1185313450668544000
2019-10-17 20:01:25,RepMcNerney,,1,0,5,"My thoughts are with his family and the people of his district, whom he so loved.",,,,1184922382567378944,https://twitter.com/RepMcNerney/status/1184922382567378944
2019-10-17 20:01:14,RepMcNerney,,1,0,5,"His faith led him to a life of public service, and his stalwart belief in equality and democracy fueled his pursuit for truth and justice. To many of us, Elijah was the moral compass for this hallowed chamber.",,,,1184922338023952384,https://twitter.com/RepMcNerney/status/1184922338023952384
2019-10-17 20:01:01,RepMcNerney,,1,1,6,"He was a man of principle, who led by example – always expounding on our shared humanity rather than exploiting our differences, cultivating friendships on both sides of the aisle.",,,,1184922280641597442,https://twitter.com/RepMcNerney/status/1184922280641597442
2019-10-17 20:00:34,RepMcNerney,,5,2,20,"Today, our country mourns the loss of a great champion of truth, and my colleagues and I mourn the loss of a dear friend. Elijah Cummings came to Congress to represent his community in Baltimore, and throughout his tenure he represented much more.",,,,1184922169375150082,https://twitter.com/RepMcNerney/status/1184922169375150082
2019-10-02 00:59:20,RepMcNerney,,3,7,22,"My statement on the D.C. Circuit Court's #NetNeutrality decision:",,,#NetNeutrality #NetNeutrality,1179199151751467009,https://twitter.com/RepMcNerney/status/1179199151751467009
2019-09-26 22:52:33,RepMcNerney,PattyMurray,4,2,3,"Thank you for your leadership in the Senate!",,,,1177355304713039872,https://twitter.com/RepMcNerney/status/1177355304713039872
2019-09-26 22:51:37,RepMcNerney,,2,1,6,"Congress must act to ensure Americans’ safety. PFAS are dangerous chemicals found in drinking water throughout the country. I was proud to stand with my colleagues today to support congressional action to address this pressing issue.",,,,1177355068301074434,https://twitter.com/RepMcNerney/status/1177355068301074434
2019-09-26 22:28:51,RepMcNerney,,0,16,25,"Yesterday, @repbenraylujan, @RepYvetteClarke and I introduced the Digital Equity Act – a critical piece of legislation to close gaps in broadband adoption and digital literacy. #digitalequitynow",,@repbenraylujan @RepYvetteClarke,#digitalequitynow,1177349339204804609,https://twitter.com/RepMcNerney/status/1177349339204804609
