date,username,to,replies,retweets,favorites,text,geo,mentions,hashtags,id,permalink
2019-09-25 19:00:33,RepMcNerney,,3,8,9,"Our oceans absorb 1/3 of CO2 emissions and 90% of heat from #ClimateChange. But right now they’re under extreme stress, resulting in increased warming and ocean acidity. Today @NRDems vote on 10 #OceanClimateAction bills. We must protect our oceans to save our planet.",,@NRDems,#ClimateChange #OceanClimateAction,1176934530227326978,https://twitter.com/RepMcNerney/status/1176934530227326978
2019-09-25 00:28:52,RepMcNerney,,13,75,325,"To fulfill our sworn duty, Congress must move forward with an impeachment inquiry. Brazen lies have been a hallmark of this presidency and it is now time for a reckoning. 2/2",,,,1176654769882062849,https://twitter.com/RepMcNerney/status/1176654769882062849
2019-09-25 00:28:04,RepMcNerney,,24,58,186,"When I came to Washington, I swore an oath to uphold the Constitution and I do not take that responsibility lightly. The allegations against the president are grave, and they are a threat to our democracy and national security. 1/2",,,,1176654567712464897,https://twitter.com/RepMcNerney/status/1176654567712464897
2019-09-24 13:13:09,RepMcNerney,TheAtlanticFest,5,3,4,"Excited to join my colleague @HurdOnTheHill for this important conversation on #AI and military readiness. #TheAtlanticFest",,@HurdOnTheHill,#AI #TheAtlanticFest,1176484717811707905,https://twitter.com/RepMcNerney/status/1176484717811707905
2019-09-20 21:49:10,RepMcNerney,,9,4,22,"Americans and people around the world expect the United States to lead on critical issues, but time is running out. We need a bold agenda to combat #climatechange, and that starts with the passage of H.R. 9, the #ClimateActionNow Act.",,,#climatechange #ClimateActionNow,1175165028258975744,https://twitter.com/RepMcNerney/status/1175165028258975744
2019-09-20 21:09:54,RepMcNerney,,3,0,5,"Under the Trump Administration, @EPAAWheeler apparently gets to decide what is and is not a science issue, and overrule an entire board of actual scientists.",,@EPAAWheeler,,1175155145878974464,https://twitter.com/RepMcNerney/status/1175155145878974464
2019-09-18 20:23:58,RepMcNerney,,5,3,14,"Clean water is a fundamental human right. The #DirtyWaterRule is an unprecedented attack on the health and safety of all Americans, putting the water sources for tens of millions of people at risk. We must put #PeopleBeforePolluters and #ProtectOurWater.",,,#DirtyWaterRule #PeopleBeforePolluters #ProtectOurWater,1174418807592538113,https://twitter.com/RepMcNerney/status/1174418807592538113
2019-09-17 18:43:38,RepMcNerney,POLITICOLive,0,2,5,"Excited to join @POLITICOLive for an important discussion on AI. #POLITICOAI",,@POLITICOLive,#POLITICOAI,1174031173779107842,https://twitter.com/RepMcNerney/status/1174031173779107842
2019-09-17 16:33:38,RepMcNerney,,0,0,5,"With a former coal lobbyist at the helm, the EPA has been reduced to a shell of what it once was as President Trump continues to ram through a big-business agenda that will ultimately make our water less safe for use and consumption.",,,,1173998457264254976,https://twitter.com/RepMcNerney/status/1173998457264254976
2019-09-17 16:32:14,RepMcNerney,,0,0,2,"Thanks to @TheBridgeWork for the opportunity to discuss what I'm working on in Congress &amp; as co-chair of the AI Caucus. Check out the full profile here:",,@TheBridgeWork,,1173998104619683846,https://twitter.com/RepMcNerney/status/1173998104619683846
2019-09-16 21:22:18,RepMcNerney,,2,0,6,"By following this deliberative process, the Judiciary Committee’s inquiry will be a transparent and thorough examination of current evidence. These proceedings will answer questions that are critical to determining if impeachment is necessary. 2/2",,,,1173708715809226754,https://twitter.com/RepMcNerney/status/1173708715809226754
2019-09-16 21:22:04,RepMcNerney,,6,3,36,"I support Chairman Nadler’s decision to open a formal impeachment inquiry. Americans deserve to know the truth, and many are gravely concerned by the president’s dubious actions. 1/2",,,,1173708657034518528,https://twitter.com/RepMcNerney/status/1173708657034518528
2019-09-16 20:08:18,RepMcNerney,,0,0,8,"Hispanic Americans make our communities more vibrant and prosperous. Happy #HispanicHeritageMonth to all those celebrating in my district and across the country!",,,#HispanicHeritageMonth,1173690092902391810,https://twitter.com/RepMcNerney/status/1173690092902391810
2019-09-13 16:48:01,RepMcNerney,,4,0,6,"Dreamers, TPS & DED recipients are important members of our communities in California & across the country. I was happy to meet with @carecensf and representatives from my district to discuss permanent protections for these groups and their families.",,@carecensf,,1172552523556823040,https://twitter.com/RepMcNerney/status/1172552523556823040
2019-09-12 17:19:32,RepMcNerney,,2,3,11,"Last Congress, Republicans opened 19 million acres of federally protected, untouched Alaska wilderness to big oil. Opening the Arctic Refuge would destroy one of the last unspoiled places on Earth. This is no place for drilling & today I was proud to vote to #ProtectTheArctic.",,,#ProtectTheArctic,1172198066352459776,https://twitter.com/RepMcNerney/status/1172198066352459776
2019-09-12 00:20:53,RepMcNerney,,0,1,4,"Thanks to representatives from @AmericanCancer for stopping by my office to discuss their legislative priorities. I’ve long supported federal investments in research and I’ll continue to advocate for the critical funding needed in the continued search for a cure.",,@AmericanCancer,,1171941717500731392,https://twitter.com/RepMcNerney/status/1171941717500731392
2019-09-11 21:43:50,RepMcNerney,,2,4,10,"President Trump wants to open our coasts to more oil & gas drilling, but coastal drilling destroys beaches, businesses and communities' way of life. That’s why I voted for @RepCunningham's bill to #ProtectOurCoast.",,@RepCunningham,#ProtectOurCoast,1171902195102617601,https://twitter.com/RepMcNerney/status/1171902195102617601
2019-09-11 19:55:45,RepMcNerney,,0,7,15,"Over 70% of Americans support banning high-capacity magazines, which are too often used in mass shootings. Gun violence is an epidemic, but we can make our communities safer with rational legislative action. That’s why I’m proud to cosponsor the #KeepAmericansSafeAct.",,,#KeepAmericansSafeAct,1171874991471771649,https://twitter.com/RepMcNerney/status/1171874991471771649
2019-09-11 18:44:15,RepMcNerney,,1,1,8,"Many of us remember exactly where we were #WhenTheWorldStopped 18 years ago. Today we honor the memory of those lost and pay tribute to the heroes who risked their own lives to save others. We must #NeverForget.",,,#WhenTheWorldStopped #NeverForget,1171857001778954241,https://twitter.com/RepMcNerney/status/1171857001778954241
2019-09-10 18:06:12,RepMcNerney,,3,5,8,"A study by the @IPS_DC found that the average Black family would need 228 years to obtain the wealth of a White family in the 21st Century. #400YearsLater",,@IPS_DC,#400YearsLater,1171485036001906691,https://twitter.com/RepMcNerney/status/1171485036001906691
2019-09-10 18:05:38,RepMcNerney,,5,2,8,"#400YearsLater, the Transatlantic Slave Trade is still the largest coerced migration of human beings in the world's history. Slavery officially lasted in the US for 246 years, &amp; the psychological &amp; economic toll has consequences to this day. 1/2",,,#400YearsLater,1171484894716780544,https://twitter.com/RepMcNerney/status/1171484894716780544
2019-09-09 18:39:57,RepMcNerney,,0,1,5,"I recently had the privilege of presenting Mr. Robert Welker with the National Defense Service Medal and the Vietnam Service Medal. It was an honor to thank Mr. Welker, who is a Navy veteran, for his service during the Vietnam War and his service to our country.",,,,1171131143179124743,https://twitter.com/RepMcNerney/status/1171131143179124743
2019-09-05 16:21:40,RepMcNerney,,7,10,16,"Thousands of #Dreamers in my district &amp; across the country need permanent protection from deportation. While the Trump administration threatens their legal status, forcing them to live in fear, @TheDemocrats are working to #ProtectTheDream for all #DACA, #TPS &amp; #DED recipients.",,@TheDemocrats,#Dreamers #ProtectTheDream #DACA #TPS #DED,1169646792532746241,https://twitter.com/RepMcNerney/status/1169646792532746241
2019-09-02 15:34:35,RepMcNerney,,0,1,3,"Great turnout at last week’s town halls! Many of you came with important questions about some of our nation’s most pressing issues, and we had a very informative discussion about how to move our country forward.",,,,1168547776390717444,https://twitter.com/RepMcNerney/status/1168547776390717444
2019-08-20 17:49:04,RepMcNerney,,11,2,2,"I hope you can join me for a town hall in Stockton on Friday, August 30th from 6:30 PM to 7:30 PM at Cesar Chavez High School.",,,,1163870579977576448,https://twitter.com/RepMcNerney/status/1163870579977576448
2019-08-20 17:39:12,RepMcNerney,,6,8,23,"While the President is playing political games and backpedaling on his commitments, gun violence continues to devastate communities across our nation. It’s been 175 days since the House passed the bipartisan #HR8 and commonsense #HR1112. The Senate must #DoSomething.",,,#HR8 #HR1112 #DoSomething,1163868095905243136,https://twitter.com/RepMcNerney/status/1163868095905243136
2019-08-20 17:32:05,RepMcNerney,,2,4,4,"I hope you can join me for a joint town hall with my colleague @RepDeSaulnier on Thursday, August 29th, from 6:30 PM to 8:00 PM at the Antioch Community Center.",,@RepDeSaulnier,,1163866306946506752,https://twitter.com/RepMcNerney/status/1163866306946506752
2019-08-15 18:28:56,RepMcNerney,,2,9,26,"For 7 years, #DACA has successfully protected 800K young people from deportation. These #Dreamers are our neighbors, family, &amp; friends. But the Trump administration is threatening their future in the U.S. That's why @HouseDemocrats are continuing to fight to #ProtectTheDream.",,@HouseDemocrats,#DACA #Dreamers #ProtectTheDream,1162068672854351872,https://twitter.com/RepMcNerney/status/1162068672854351872
2019-08-14 18:32:12,RepMcNerney,,2,3,5,"1 in 7 Californians relies on social security. As we celebrate 84 years of this critical program, let us recommit to ensuring its longevity and expanding it to meet Americans' changing needs. #SocSec84",,,#SocSec84,1161707106438918144,https://twitter.com/RepMcNerney/status/1161707106438918144
2019-08-14 17:32:59,RepMcNerney,BerkeleyLab,1,8,16,"I had a great time meeting with the men and women undertaking the critical work at our National Labs!",,,,1161692204269821953,https://twitter.com/RepMcNerney/status/1161692204269821953
2019-08-13 18:43:27,RepMcNerney,,0,4,6,"In my district, the Delta is home to many endangered and protected species. This ecosystem and our local economy depend on their survival, yet once again the president is choosing the interests of industry over the interests of the American public.",,,,1161347551955521536,https://twitter.com/RepMcNerney/status/1161347551955521536
2019-08-05 17:00:33,RepMcNerney,,65,240,681,"Right now, @senatemajldr is blocking the progress of two practical pieces of legislation that would enhance our background check system. #EnoughIsEnough. He &amp; other Republicans who are in the pocket of the NRA must answer: Whose side are you on?",,@senatemajldr,#EnoughIsEnough,1158422551036596224,https://twitter.com/RepMcNerney/status/1158422551036596224
2019-08-02 19:15:21,RepMcNerney,,5,9,31,"Americans are sick & tired of the demands & desires of special interest coming before their needs. We need a constitutional amendment to end the culture of corruption that is fueled by our #campaignfinance system. That's why my proposal would eliminate PACs &amp; ban #darkmoney.",,,#campaignfinance #darkmoney,1157369310286876672,https://twitter.com/RepMcNerney/status/1157369310286876672
2019-07-31 22:12:44,RepMcNerney,,4,0,6,"As National Parks & Rec Month comes to an end, I hope you’ll join me in thanking our own California Parks Department for taking care of the most diverse collection of natural, cultural, and recreational resources in our state. #GameOnJuly",,,#GameOnJuly,1156689178127753216,https://twitter.com/RepMcNerney/status/1156689178127753216
2019-07-30 02:48:51,RepMcNerney,,3,4,9,"Across the nation, communities regularly face the tragedy of gun violence. This is an epidemic that can only be curbed by bold actions, but we must all share in the political will to advance reforms. For the sake of all Americans, we can & must do better.",,,,1156033887094464518,https://twitter.com/RepMcNerney/status/1156033887094464518
2019-07-24 21:23:58,RepMcNerney,,5,7,22,"Today, the House passed the #StopBadRobocalls Act – which includes an amendment that I offered to increase penalties against the most egregious violators of the law. This commonsense legislation is critical for protecting consumers and putting an end to these abusive practices.",,,#StopBadRobocalls,1154140188597194752,https://twitter.com/RepMcNerney/status/1154140188597194752
2019-07-24 21:18:25,RepMcNerney,,2,7,5,"Over a million Americans are at risk of losing their pensions if the House fails to pass the #ButchLewisAct - putting their families’ financial security and future at risk. No one should live in fear that their hard-earned retirement savings will collapse.",,,#ButchLewisAct,1154138790543405056,https://twitter.com/RepMcNerney/status/1154138790543405056
2019-07-24 18:42:17,RepMcNerney,,6,13,26,"Today, the House votes to #PassthePASTAct, which would end the inhumane practice of soring #horses by intentionally inflicting pain to their feet in order to win prizes. I'm proud to cosponsor H.R. 693 &amp; call on the Senate to swiftly pass this bill &amp; end this senseless cruelty.",,,#PassthePASTAct #horses,1154099500178378752,https://twitter.com/RepMcNerney/status/1154099500178378752
2019-07-24 17:33:36,RepMcNerney,,6,8,14,"Achieving net zero carbon pollution by 2050 is necessary to protect the climate, public health and our economy. Combating this crisis is still possible, but only if we #ActOnClimate now. #100by50",,,#ActOnClimate #100by50,1154082214033969153,https://twitter.com/RepMcNerney/status/1154082214033969153
2019-07-24 15:56:44,RepMcNerney,HouseJudiciary,16,5,13,"Today, we witnessed Robert Mueller testify under oath that his report does NOT exonerate the President. #MuellerHearings",,,#MuellerHearings,1154057837724786688,https://twitter.com/RepMcNerney/status/1154057837724786688
2019-07-24 13:09:13,RepMcNerney,,0,1,2,"I’m excited to join @POLITICOLive for a discussion about #AI and the federal government. Tune in here to follow along: https://www.politico.com/live-stream/unlocking-the-ai-data-puzzle-in-federal-government",,@POLITICOLive,#AI,1154015680766861314,https://twitter.com/RepMcNerney/status/1154015680766861314
2019-07-17 21:19:10,RepMcNerney,,2,5,17,"Today @EnergyCommerce passed the #StopBadRobocalls Act – a crucial step to put consumers back in control of their phones. I’m proud to cosponsor this bill, which includes an amendment I offered with @RepBillFlores to increase penalties for the most egregious violators of the law.",,@EnergyCommerce @RepBillFlores,#StopBadRobocalls,1151602263598800896,https://twitter.com/RepMcNerney/status/1151602263598800896
2019-07-17 19:59:29,RepMcNerney,,7,29,42,"Science is under attack. This administration has prohibited federal scientists from speaking about climate change, & climate data has been scrubbed from many gov't websites. We must protect their work to safeguard public health & our environment. #ScienceNotSilence #ForThePeople",,,#ScienceNotSilence #ForThePeople,1151582213936492545,https://twitter.com/RepMcNerney/status/1151582213936492545
2019-07-16 17:42:35,RepMcNerney,,2,4,9,"#OTD in 1969, #Apollo11 sent three astronauts on a trajectory to the moon. Today we celebrate this achievement and recognize that our unique American spirit has always given us the courage to dream big and the resiliency to follow through. #Apollo50th",,,#OTD #Apollo11 #Apollo50th,1151185373860630528,https://twitter.com/RepMcNerney/status/1151185373860630528
2019-07-16 02:58:22,RepMcNerney,,18,14,42,"This president has shown himself over and over to be a racist. These attacks have only unified Democrats and reminded the American people why they decided to change the makeup of Congress in 2018.",,,,1150962852511064064,https://twitter.com/RepMcNerney/status/1150962852511064064
2019-07-12 18:53:08,RepMcNerney,,5,3,13,"#ICEraids are expected to take place this weekend in cities across the country. Make sure you #KnowYourRights.",,,#ICEraids #KnowYourRights,1149753573984690178,https://twitter.com/RepMcNerney/status/1149753573984690178
2019-07-11 21:02:31,RepMcNerney,,4,3,16,"Secretary Acosta is defending an indefensible decision that protected a predator and robbed his victims of a chance for justice. Americans have no confidence in his ability to head the department charged with fighting human trafficking. He should resign immediately.",,,,1149423746693959680,https://twitter.com/RepMcNerney/status/1149423746693959680
2019-07-10 16:23:45,RepMcNerney,,3,3,4,"Due to the the multi-employer pension crisis, 1.5 MILLION retirees, workers & their families are set to lose benefits they earned throughout a lifetime of hard work. By advancing the #ButchLewisAct, @WaysMeansCmte will ensure all retirees are guaranteed the benefits they deserve.",,@WaysMeansCmte,#ButchLewisAct,1148991207844003842,https://twitter.com/RepMcNerney/status/1148991207844003842
2019-07-07 17:12:01,RepMcNerney,SpeakerPelosi,0,4,16,"Congratulations! #USWMNT",,,#USWMNT,1147916190188212224,https://twitter.com/RepMcNerney/status/1147916190188212224
2019-07-04 14:55:28,RepMcNerney,,2,2,3,"Wishing everyone a safe and happy 4th of July! Happy #IndependenceDay!",,,#IndependenceDay,1146794663707328512,https://twitter.com/RepMcNerney/status/1146794663707328512
2019-06-28 15:21:53,RepMcNerney,,2,6,11,"The #SCOTUS #gerrymandering decision highlights the need for Congress to take action. Last week, I secured funding in one of the House spending packages for @NSF to study &amp; establish science-based best practices for congressional redistricting so we can ensure a fair process.",,@NSF,#SCOTUS #gerrymandering,1144626981054668802,https://twitter.com/RepMcNerney/status/1144626981054668802
2019-06-26 22:44:02,RepMcNerney,,5,7,13,"The spreading of political disinformation on social media poses grave consequences to our nation’s democracy. That’s why my @EnergyCommerce colleagues &amp; I sent a letter to Mark Zuckerberg with questions about @facebook's handling of the doctored video of Speaker Pelosi.",,@EnergyCommerce @Facebook,,1144013477327118336,https://twitter.com/RepMcNerney/status/1144013477327118336
2019-06-26 15:42:34,RepMcNerney,,0,6,8,"Two amendments that I introduced were included in yesterday's spending package that passed on the House floor. #CBD #Gerrymandering",,,#CBD #Gerrymandering,1143907410337292291,https://twitter.com/RepMcNerney/status/1143907410337292291
2019-06-25 18:45:25,RepMcNerney,,3,14,27,"Six years ago, SCOTUS gutted the Voting Rights Act in the Shelby County v. Holder decision. Millions of Americans were left vulnerable to racial discrimination & voter disenfranchisement, unraveling the legacy of this momentous legislation. We must #RestoreTheVote &amp; pass #HR4.",,,#RestoreTheVote #HR4,1143591040735162368,https://twitter.com/RepMcNerney/status/1143591040735162368
2019-06-25 18:22:12,RepMcNerney,,0,5,4,"Small businesses are the backbone of our economy, creating jobs and driving innovation. H.R.3351 makes substantial investments in resources for entrepreneurs & small businesses – like the 30,000 in my district – by providing access to training & materials to help them succeed.",,,,1143585196081635330,https://twitter.com/RepMcNerney/status/1143585196081635330
2019-06-25 16:26:24,RepMcNerney,,0,9,7,"We must renew our commitment to protecting the air we breathe, the water we drink, and the planet we all call home. That’s why I support the FY20 Interior-Environment bill, which includes $37.3 billion to protect the environment, ensure clean air & water, & preserve wildlife.",,,,1143556054552403969,https://twitter.com/RepMcNerney/status/1143556054552403969
2019-06-23 14:03:40,RepMcNerney,,9,6,24,"I introduced two amendments that passed on the House floor this week. One directs the FDA to set safe consumption levels for #CBD products, and the other tackles the widespread problem of #gerrymandering.",,,#CBD #gerrymandering,1142795358420066305,https://twitter.com/RepMcNerney/status/1142795358420066305
2019-06-20 20:55:02,RepMcNerney,,3,1,7,"With a recorded 70.8 million displaced people fleeing violence & persecution around the world, there is still much work to do. That’s why I'm proud to join my colleagues in recognizing #WorldRefugeeDay by cosponsoring H.Res. 444 to reaffirm U.S. commitment to protecting refugees.",,,#WorldRefugeeDay,1141811719603441665,https://twitter.com/RepMcNerney/status/1141811719603441665
2019-06-20 18:28:40,RepMcNerney,,3,3,15,"Millions of women, #LGBTQ Americans, and people of color rely on the Affordable Care Act, but the Trump administration is threatening their health by trying to roll back critical protections. We need to #PutPatientsFirst and keep discrimination out of our healthcare.",,,#LGBTQ #PutPatientsFirst,1141774884877602817,https://twitter.com/RepMcNerney/status/1141774884877602817
2019-06-20 15:03:14,RepMcNerney,,0,1,1,"@HouseDemocrats are pushing forward funding legislation #ForThePeople. That why the FY2020 Commerce-Justice-Science bill provides $74 billion to promote civil rights, reduce gun violence, combat climate change, &amp; address many other issues that are important to Americans.",,@HouseDemocrats,#ForThePeople,1141723188134653956,https://twitter.com/RepMcNerney/status/1141723188134653956
2019-06-19 22:20:24,RepMcNerney,,3,12,21,"Today, my colleagues & I sent a letter to @AjitPaiFCC urging him to move forward with taking a fresh look at the 5.9 GHz band. It’s time we re-examine how this band is being used &amp; how to allocate it in a way that meets the demands of our times &amp; best serves the American people.",,@AjitPaiFCC,,1141470813864026112,https://twitter.com/RepMcNerney/status/1141470813864026112
2019-06-19 17:28:26,RepMcNerney,,3,9,11,"The Trump administration is moving forward with their #DirtyPowerScam – gutting the #CleanPowerPlan &amp; rolling back the progress we’ve made on climate change solutions. @EPAAWheeler is once again putting polluter profits over Americans’ best interests.",,@EPAAWheeler,#DirtyPowerScam #CleanPowerPlan,1141397337601970176,https://twitter.com/RepMcNerney/status/1141397337601970176
2019-06-19 14:45:01,RepMcNerney,LeaderHoyer,0,1,6,"Thank you, my friend! And a big thanks to all for the warm birthday wishes.",,,,1141356212413435910,https://twitter.com/RepMcNerney/status/1141356212413435910
2019-06-17 23:23:30,RepMcNerney,,3,4,4,"Today marks the longest period in U.S. history without an increase to the federal minimum wage since it's establishment in 1938. No one working full-time in this country should be living in poverty. It's time to #RaiseTheWage.",,,#RaiseTheWage,1140761917528715264,https://twitter.com/RepMcNerney/status/1140761917528715264
2019-06-14 20:56:44,RepMcNerney,,8,6,21,"Hate has no place here. As we celebrate #Pride, let us recognize the important history of the #LGBT community and that we still have more to do to make our nation a fairer, more just country.",,,#Pride #Pride #LGBT,1139637821105479680,https://twitter.com/RepMcNerney/status/1139637821105479680
2019-06-13 20:47:59,RepMcNerney,,5,4,14,"Whether he doesn’t understand the law or doesn’t care about it, the president’s indifference on election interference is a threat to our democracy and to our very way of life.",,,,1139273229451894784,https://twitter.com/RepMcNerney/status/1139273229451894784
2019-06-13 20:47:59,RepMcNerney,,7,4,12,"Once again, President Trump is using his media platform to make lawless activity seem normal. But the American people understand that any foreign entity offering campaign information has ulterior motives.",,,,1139273228608856064,https://twitter.com/RepMcNerney/status/1139273228608856064
2019-06-13 01:38:46,RepMcNerney,drfeifei,0,2,2,"I’m looking forward to continuing to work together on this important issue.",,,,1138984019222306817,https://twitter.com/RepMcNerney/status/1138984019222306817
2019-06-13 01:05:20,RepMcNerney,,1,5,15,"As co-chair of the Congressional #AICaucus, I was excited to host a roundtable conversation today with leading experts from @StanfordHAI. Thanks to @drfeifei, Dr. John Etchemendy &amp; @MPSellitto for an engaging discussion about their work at the Institute &amp; emerging trends in #AI.",,@StanfordHAI @drfeifei @MPSellitto,#AICaucus #AI,1138975608216707072,https://twitter.com/RepMcNerney/status/1138975608216707072
2019-06-12 19:12:17,RepMcNerney,,2,15,52,"More than 5,000 people are diagnosed with ALS every year. I’ve long supported federal funding for ALS research and will continue to do so until a cure is found. Thanks to @alsassociation for meeting with me to discuss how Congress can continue to support #ALSAdvocacy.",,@alsassociation,#ALSAdvocacy,1138886758479872001,https://twitter.com/RepMcNerney/status/1138886758479872001
2019-06-12 17:33:14,RepMcNerney,,4,4,4,"#PublicCharge is a rule that would allow the Trump administration to restrict green cards based on income, health, English proficiency, age &amp; use of public programs. This proposal is another cruel attack on #immigrant communities.",,,#PublicCharge #immigrant,1138861834172293120,https://twitter.com/RepMcNerney/status/1138861834172293120
