date,username,to,replies,retweets,favorites,text,geo,mentions,hashtags,id,permalink
2019-03-15 21:17:46,RepMcNerney,,1,1,13,"I had the opportunity to meet with Oakley Mayor Claire Alaura to discuss how we can work together on important issues in our community - including transportation and public safety. At the end of our meeting, I was honored when she presented me with the key to the city.",,,,1106665816005771266,https://twitter.com/RepMcNerney/status/1106665816005771266
2019-03-14 19:56:36,RepMcNerney,,6,14,47,"As a mathematician, #PiDay holds a special place in my heart. While you enjoy your sweet treat today, it’s also the perfect occasion to reflect on the importance of science and mathematics in our lives.",,,#PiDay,1106283005784535040,https://twitter.com/RepMcNerney/status/1106283005784535040
2019-03-14 19:39:48,RepMcNerney,,2,8,19,"Restoring #NetNeutrality is one of most important digital rights issues today. The #SaveTheNet Act gives the power back to the people, stops abusive corporate practices, and fosters innovation and competition.",,,#NetNeutrality #NetNeutrality #SaveTheNet,1106278774029594624,https://twitter.com/RepMcNerney/status/1106278774029594624
2019-03-13 22:17:57,RepMcNerney,,6,6,21,"The Delta is the lifeblood of our community – that’s why I proudly cosponsored legislation to designate the Sacramento-San Joaquin River Delta as California’s first National Heritage Area. Today is a great victory for the Delta region as that legislation has been signed into law.",,,,1105956187298766848,https://twitter.com/RepMcNerney/status/1105956187298766848
2019-03-12 21:17:34,RepMcNerney,,3,40,75,"When the @FCC moved to repeal #netneutrality, more than 8,000 of my constituents reached out to my office to express their concerns. The #SaveTheNet Act will restore these crucial protections, and I’m proud to be an original cosponsor of this important legislation.",,@FCC,#netneutrality #netneutrality #SaveTheNet,1105578604770013190,https://twitter.com/RepMcNerney/status/1105578604770013190
2019-03-09 02:04:49,RepMcNerney,,7,11,37,"Today was a good day in Washington because the House passed the #ForThePeople Act. I’m proud to be on the right side of history as a cosponsor of this important legislation, which would put our government back in the hands of the American people.",,,#ForThePeople,1104201339792429056,https://twitter.com/RepMcNerney/status/1104201339792429056
2019-03-08 20:16:23,RepMcNerney,,2,6,17,"This #InternationalWomensDay, I'm proud to celebrate the record number of women I have the privilege of serving alongside in Congress. Today and everyday, let us recommit ourselves to the fight for equality.",,,#InternationalWomensDay,1104113653169750017,https://twitter.com/RepMcNerney/status/1104113653169750017
2019-03-07 23:14:02,RepMcNerney,,0,2,9,"Today, Port of Stockton Director Richard Aschieris & I discussed the Port’s future & its contributions to our community. It is the 4th busiest port in California & employs over 10,000 people. As a member of the Congressional Ports Caucus, I’ll continue to fight for its success.",,,,1103795974932258816,https://twitter.com/RepMcNerney/status/1103795974932258816
2019-03-07 20:29:35,RepMcNerney,,7,5,15,"As a co-chair of the Bipartisan #CampaignFinance Reform Caucus, I am committed to fixing our broken system &amp; ending the undue influence of money in our elections. The #ForThePeople Act is a vital step toward restoring the voice of the voters &amp; I’m proud to be a cosponsor.",,,#CampaignFinance #ForThePeople,1103754589738799104,https://twitter.com/RepMcNerney/status/1103754589738799104
2019-03-06 20:25:34,RepMcNerney,,1,2,9,"I'm excited to announce the 2019 Congressional Art Competition! If you're a high school student or know a high school student in the 9th Congressional District who has a passion for art, check out my website for more information on how to participate: https://mcnerney.house.gov/services/2019-congressional-art-competition",,,,1103391190722977792,https://twitter.com/RepMcNerney/status/1103391190722977792
2019-03-06 16:30:03,RepMcNerney,SpeakerPelosi,1,8,28,"I’ve heard from thousands of my constituents, and I’ve stood with Americans across the nation in the fight to restore #NetNeutrality. Today my colleagues and I are proud to introduce legislation to #SaveTheNet.",,,#NetNeutrality #NetNeutrality #SaveTheNet,1103331920199540737,https://twitter.com/RepMcNerney/status/1103331920199540737
2019-03-04 18:39:34,RepMcNerney,,3,2,15,"San Joaquin RTD is an award-winning innovator in meeting the transportation needs of our community. I was honored to join them for the grand opening of the Union Transfer Station.",,,,1102639737494487040,https://twitter.com/RepMcNerney/status/1102639737494487040
