date,username,to,replies,retweets,favorites,text,geo,mentions,hashtags,id,permalink
2019-06-12 17:29:43,RepMcNerney,,2,4,9,"For the first time in more than 20 years, we have an appropriations package that includes funding for @CDCgov &amp; @NIH to conduct gun violence prevention research. I'm proud to stand with my @HouseDemocrats colleagues in the fight for a safer America #ForThePeople.",,@CDCgov @NIH @HouseDemocrats,#ForThePeople,1138860945571229697,https://twitter.com/RepMcNerney/status/1138860945571229697
2019-06-12 16:46:54,RepMcNerney,,2,3,7,"Nearly 30 MILLION Americans are living without health insurance, and another 40 million cannot afford their co-pays or deductibles. We can do better. Today’s @WaysmeansCmte hearing on universal coverage is a step toward making #MedicareforAll a reality.",,@WaysMeansCmte,#MedicareforAll,1138850174003032064,https://twitter.com/RepMcNerney/status/1138850174003032064
2019-06-11 17:30:54,RepMcNerney,,2,3,5,"Congratulations to this year’s Military Academy appointees! These six exemplary students from California’s 9th Congressional District are going on to attend the Military Academy, Naval Academy and Air Force Academy.",,,,1138498856314953729,https://twitter.com/RepMcNerney/status/1138498856314953729
2019-06-11 16:45:44,RepMcNerney,,2,4,5,"It’s been more than 2 months since the House passed the #SaveTheNet Act, and Americans across the political spectrum agree that we need to restore #NetNeutrality rules. But today @SenateMajLdr blocked a vote on it in the Senate, burying it in his legislative graveyard.",,@senatemajldr,#SaveTheNet #NetNeutrality #NetNeutrality,1138487492250939399,https://twitter.com/RepMcNerney/status/1138487492250939399
2019-06-11 14:57:42,RepMcNerney,,6,47,130,"On one of the darkest days in our nation’s history, our 9/11 first responders risked everything to help their fellow Americans. With the 9/11 Victim Compensation Fund set to expire, we cannot turn our backs on these heroes. #Renew911VCF",,,#Renew911VCF,1138460303946067969,https://twitter.com/RepMcNerney/status/1138460303946067969
2019-06-09 14:16:15,RepMcNerney,,6,9,18,"As we celebrate #ImmigrantHeritageMonth, the House passage of the Dream &amp; Promise Act is a reminder that much our nation’s success is due to our commitment to welcoming new communities. #HR6",,,#ImmigrantHeritageMonth #HR6,1137725096032899072,https://twitter.com/RepMcNerney/status/1137725096032899072
2019-06-07 20:01:00,RepMcNerney,sciam,2,0,11,"Great conversations yesterday at our 3rd #ScienceOnTheHill event! Thanks to all those who attended and participated!",,,#ScienceOnTheHill,1137087081535234048,https://twitter.com/RepMcNerney/status/1137087081535234048
2019-06-06 21:44:07,RepMcNerney,,0,5,7,"On the 75th Anniversary of D-Day, we remember the bravery and sacrifice of all those who fought at Normandy and honor their legacy. #DDAY75",,,#DDAY75,1136750642683404288,https://twitter.com/RepMcNerney/status/1136750642683404288
2019-06-05 18:18:37,RepMcNerney,,1,6,12,"This #WorldEnvironmentDay, we're reminded that we should listen to scientists and experts about the urgent need to combat #climatechange, instead of someone who goes around saying things like “we have the cleanest climates.” That’s… not how this works.",,,#WorldEnvironmentDay #climatechange,1136336537514369025,https://twitter.com/RepMcNerney/status/1136336537514369025
2019-06-05 16:37:44,RepMcNerney,,4,10,13,"100 days ago, the House passed #HR8, the Bipartisan Background Checks Act. Today, my colleagues and I called on @senatemajldr to bring this commonsense legislation to the Senate floor for a vote because #EnoughIsEnough. #EndGunViolence",,@senatemajldr,#HR8 #EnoughIsEnough #EndGunViolence,1136311151464202243,https://twitter.com/RepMcNerney/status/1136311151464202243
2019-06-05 15:44:18,RepMcNerney,,4,5,10,"More than 90% of excess heat & about 1/3 of carbon dioxide in our atmosphere is absorbed by the ocean. As we continue to take #ClimateActionNow, we must also #ProtectOurOceans. That’s why I’m proud to support critical legislation essential to the preservation of our oceans.",,,#ClimateActionNow #ProtectOurOceans,1136297703699374081,https://twitter.com/RepMcNerney/status/1136297703699374081
2019-06-04 20:21:18,RepMcNerney,,0,3,12,"Today we heard from many #FosterYouthVoices about their personal experiences &amp; how we can improve our child welfare system. I had the privilege of hosting a young woman named Erica, who has become an advocate on this issue &amp; many other issues affecting young people in America.",,,#FosterYouthVoices,1136005026764251136,https://twitter.com/RepMcNerney/status/1136005026764251136
2019-06-03 19:00:23,RepMcNerney,,0,5,13,"Over 415k children are living in foster care in the U.S. Tomorrow, I'll be participating in #FosterYouthShadowDay as foster youth from across the country will meet with Members of Congress to talk about how government can improve our child welfare system. #FosterYouthVoices",,,#FosterYouthShadowDay #FosterYouthVoices,1135622273786941440,https://twitter.com/RepMcNerney/status/1135622273786941440
2019-06-01 19:06:00,RepMcNerney,,7,9,26,"Two years ago today, the president decided to pull out of the Paris Climate Agreement and put the future of nation’s economy and public health at risk. I voted for the #ClimateActionNow Act, which blocks Trump from removing us. America can either lead or be left behind.",,,#ClimateActionNow,1134898912433717248,https://twitter.com/RepMcNerney/status/1134898912433717248
2019-05-29 19:42:02,RepMcNerney,,2,3,1,"Congratulations to the 8th graders of Hazelton Elementary! I’m never more optimistic about our nation’s future than when I’m surrounded by bright young people who will lead the next generation.",,,,1133820814955044866,https://twitter.com/RepMcNerney/status/1133820814955044866
2019-05-28 20:57:48,RepMcNerney,sciam,2,13,28,"Looking forward to a great discussion next week! Hope you can join us!",,,,1133477495033016320,https://twitter.com/RepMcNerney/status/1133477495033016320
2019-05-27 15:52:44,RepMcNerney,,1,6,5,"On #MemorialDay, we pay tribute to the brave men and women who gave the ultimate sacrifice to protect our country and all that we stand for. Thank you to our nation’s heroes and their families, who also sacrifice so much so that their loved ones can serve.",,,#MemorialDay,1133038336560586755,https://twitter.com/RepMcNerney/status/1133038336560586755
2019-05-24 21:16:04,RepMcNerney,,6,4,14,"Since abandoning the Iran Deal, the U.S. has forfeited its position of diplomatic strength in pursuit of a reckless ideology. The President is now escalating his aggression by deploying 1,500 additional soldiers to the Middle East, which may provoke a wider conflict.",,,,1132032540137676803,https://twitter.com/RepMcNerney/status/1132032540137676803
2019-05-24 02:06:24,RepMcNerney,,4,4,7,"I recently introduced bipartisan legislation to put the federal government on a path to harness the full potential of AI in a responsible way – one that will enhance government’s ability to fulfill its mission, create new economic opportunities & reduce potential harmful effects.",,,,1131743216355684352,https://twitter.com/RepMcNerney/status/1131743216355684352
2019-05-22 18:31:32,RepMcNerney,,8,7,12,"We exist because of the diverse array of living organisms all around us. But because of humans, 1 million species are in danger of extinction. If we don’t #ActOnClimate &amp; #StopExtinction, we could lose the animals &amp; plants that make Earth livable. #InternationalBiodiversityDay",,,#ActOnClimate #StopExtinction #InternationalBiodiversityDay,1131266359739015170,https://twitter.com/RepMcNerney/status/1131266359739015170
2019-05-22 18:09:09,RepMcNerney,,2,6,14,"To mitigate and combat the threats of #climatechange, our nation must #ActOnClimate now and invest in a clean energy future for all Americans. That’s why I’m proud to support the #LIFTAmerica Act, which would fund the installation of solar panels in underserved communities.",,,#climatechange #ActOnClimate #LIFTAmerica,1131260726188941314,https://twitter.com/RepMcNerney/status/1131260726188941314
2019-05-22 17:37:45,RepMcNerney,,0,4,11,"Yesterday’s Grid Innovation and Infrastructure Expo featured cutting edge technologies that are paving the way for a cleaner, modernized power grid. Thanks to my co-hosts @boblatta, @Edison_Electric, @NEMAupdates and @gridwisedc.",,@boblatta @Edison_Electric @NEMAupdates @gridwisedc,,1131252823797248002,https://twitter.com/RepMcNerney/status/1131252823797248002
2019-05-21 19:52:15,RepMcNerney,,0,5,17,"100 years ago, the House of Representatives passed the 19th Amendment. Today, we’re celebrating this milestone in our nation’s history by wearing a yellow rose in honor of those who fought to give women a voice in our government. #WomensVote100",,,#WomensVote100,1130924281830023168,https://twitter.com/RepMcNerney/status/1130924281830023168
2019-05-21 17:17:03,RepMcNerney,,3,4,12,"Mr. President, stop provoking and start talking. Use all diplomatic channels to ease tensions with Iran.",,,,1130885226811600896,https://twitter.com/RepMcNerney/status/1130885226811600896
2019-05-17 20:06:08,RepMcNerney,,3,2,16,"I can’t imagine what it was like to be the first to see that groundbreaking image of a black hole – and to know your work contributed to this achievement – but I think Dr. Katie Bouman sums it up perfectly. #WomenInSTEM",,,#WomenInSTEM,1129478227477573632,https://twitter.com/RepMcNerney/status/1129478227477573632
2019-05-17 17:39:34,RepMcNerney,,4,3,13,"We cannot claim to be the land of the free until all our citizens have equal protection under the law. For many #LGBTQ Americans that is not the reality. But today @HouseDemocrats have said no more by passing #HR5 because fairness &amp; equality are our nation's core values.",,@HouseDemocrats,#LGBTQ #HR5,1129441342025805824,https://twitter.com/RepMcNerney/status/1129441342025805824
2019-05-16 17:42:41,RepMcNerney,,1,2,9,"Thanks to Dr. Katie Bouman and members of the @ehtelescope team for testifying before @HouseScience about their groundbreaking work capturing the first image of a black hole, and about the importance of continued investment in scientific advancement.",,@ehtelescope @HouseScience,,1129079737903669250,https://twitter.com/RepMcNerney/status/1129079737903669250
2019-05-16 17:12:45,RepMcNerney,,1,4,9,"Millions of Americans who rely on prescription drugs are depending on Congress to ensure their medications are affordable. This week, the House is taking action #ForThePeople and voting on critical legislation to lower drug costs and #ProtectOurCare.",,,#ForThePeople #ProtectOurCare,1129072203650260998,https://twitter.com/RepMcNerney/status/1129072203650260998
2019-05-16 17:06:04,RepMcNerney,,1,5,10,"By escalating tensions with Iran, this administration sends us closer to another senseless war without any Congressional input or our Constitutionally-required authorization for use of military force. After decades of endless war, the American people have had enough. #NoIranWar",,,#NoIranWar,1129070522808111104,https://twitter.com/RepMcNerney/status/1129070522808111104
2019-05-13 20:09:47,RepMcNerney,,4,8,17,"In 2019, 25 million Americans in rural communities still lack access to affordable high-speed internet. Closing the digital divide means increased job and educational opportunities for those Americans. #RuralBroadband",,,#RuralBroadband,1128029593653456897,https://twitter.com/RepMcNerney/status/1128029593653456897
2019-05-12 16:24:30,RepMcNerney,,0,2,17,"On this day, let’s honor the special women in our lives who have guided us and made a positive impact on us. Today, I’ll be celebrating with my wife Mary, whose love, kindness and strength has been the bedrock of our family. Happy #MothersDay to all those celebrating today.",,,#MothersDay #MothersDay,1127610509354840064,https://twitter.com/RepMcNerney/status/1127610509354840064
2019-05-10 23:13:09,RepMcNerney,,3,5,17,"This week, the administration announced it will be increasing our military presence in Iranian territory. By doing so, President Trump is intensifying tensions with Iran, and putting our troops in danger with his aggressive tactics.",,,,1126988576846118912,https://twitter.com/RepMcNerney/status/1126988576846118912
2019-05-09 18:17:38,RepMcNerney,,307,337,1101,"The Trump Administration is trying to take us back to a time when it was legal to discriminate against Americans with pre-existing conditions. But we won't let that happen. That’s why I'm voting for the Protecting Americans with Preexisting Conditions Act. #ProtectOurCare",,,#ProtectOurCare,1126551818430033922,https://twitter.com/RepMcNerney/status/1126551818430033922
2019-05-08 15:45:18,RepMcNerney,,0,0,5,"Great to have @SJCOG in Washington today! I’m committed to fighting for critical infrastructure investments and essential transportation funding for our area, and I look forward to continuing to work with these dedicated community leaders to strengthen our region.",,@SJCOG,,1126151096731361281,https://twitter.com/RepMcNerney/status/1126151096731361281
2019-05-06 18:54:50,RepMcNerney,,1,1,3,"Small businesses are the backbone of our economy - they create two out of every three new jobs each year. This #NationalSmallBusinessWeek and every week, I’m proud to honor our hardworking small business men and women, and to champion the small businesses in my district.",,,#NationalSmallBusinessWeek,1125474017891246081,https://twitter.com/RepMcNerney/status/1125474017891246081
2019-05-04 23:17:12,RepMcNerney,,5,0,7,"Instead, he would rather split hairs over the honesty of his answers and forego answering anymore questions all together.",,,,1124815269413695488,https://twitter.com/RepMcNerney/status/1124815269413695488
2019-05-04 23:17:12,RepMcNerney,,3,0,6,"His answers before the Senate Judiciary Committee and his failure to appear before the House Judiciary Committee confirm that he is not committed to the job he is charged with: upholding our constitution.",,,,1124815267333378048,https://twitter.com/RepMcNerney/status/1124815267333378048
2019-05-04 23:17:11,RepMcNerney,,8,2,16,"This week, Attorney General Barr proved that he is working to protect the president, and not working on behalf of the American people.",,,,1124815262887415808,https://twitter.com/RepMcNerney/status/1124815262887415808
2019-05-03 14:08:31,RepMcNerney,,0,2,7,"As a long-time opponent of the wasteful and ill-conceived #DeltaTunnels, I’m looking forward to working with @GavinNewsom and others on a comprehensive approach to a sustainable water future for California.",,@GavinNewsom,#DeltaTunnels,1124314800517931008,https://twitter.com/RepMcNerney/status/1124314800517931008
2019-05-02 17:34:41,RepMcNerney,,5,10,29,"Today the House passed H.R. 9, the #ClimateActionNow Act. The U.S. has always led by example. That's why it's imperative that we rejoin the Paris Climate Accord. If we retreat, we are condemning future generations to a world filled with catastrophic #climatechange and conflict.",,,#ClimateActionNow #climatechange,1124004295773425664,https://twitter.com/RepMcNerney/status/1124004295773425664
2019-05-01 18:52:05,RepMcNerney,,6,3,10,"The President’s decision to withdraw from the Paris Agreement puts the future of our environment, economy, and health at risk. It’s time to say “We are still in.” #ClimateActionNow",,,#ClimateActionNow,1123661384607260672,https://twitter.com/RepMcNerney/status/1123661384607260672
2019-04-29 17:27:52,RepMcNerney,,1,0,6,"Thanks to everyone who came out to my Antioch open house! As I head back to Washington, I’m re-energized after hearing your stories, ideas and concerns, and I’m looking forward to continuing to work on your behalf.",,,,1122915415330623488,https://twitter.com/RepMcNerney/status/1122915415330623488
2019-04-24 19:49:27,RepMcNerney,,0,1,5,"Hope to see you on Friday at my open house! Please stop by my Antioch office anytime between 6:00 PM - 7:30 PM to hear what's going on in Washington and to share your views on issues important to you and our community.",,,,1121139106766032897,https://twitter.com/RepMcNerney/status/1121139106766032897
2019-04-24 03:00:38,RepMcNerney,,0,3,14,"My thoughts go out to those affected by last night's fire — especially the brave firefighter who was injured while working to extinguish the blaze. Thank you to all of our first responders who routinely put the safety of our community before their own.",,,,1120885228657106944,https://twitter.com/RepMcNerney/status/1120885228657106944
2019-04-20 18:08:28,RepMcNerney,,1,1,8,"Thanks to everyone who came out to my Stockton open house! I’m looking forward to catching up with more folks at my Antioch open house next week!",,,,1119664142032437248,https://twitter.com/RepMcNerney/status/1119664142032437248
2019-04-15 02:33:50,RepMcNerney,,1,2,13,"It was great to see so many people that care about our environment, science, and the importance of “moving green” out today at the Stockton Earth Day Festival!",,,,1117616993568481280,https://twitter.com/RepMcNerney/status/1117616993568481280
2019-04-14 17:33:24,RepMcNerney,,1,9,21,"I hope you’ll join me in wishing our Sikh American neighbors and friends a very happy #Vaisakhi!",,,#Vaisakhi,1117480991864569863,https://twitter.com/RepMcNerney/status/1117480991864569863
2019-04-14 01:40:39,RepMcNerney,,2,2,12,"This week in the world of science, two groundbreaking advances made the headlines. From the first image of a black hole to the discovery of a new human relative, this was only possible because of humanity’s innate drive to know more.",,,,1117241223838863360,https://twitter.com/RepMcNerney/status/1117241223838863360
2019-04-11 17:06:52,RepMcNerney,,1,0,11,"Because of the hard work of some extraordinary scientists we are able to witness something that is truly amazing: the first picture of a black hole. We need to think about this as something bigger than ourselves. https://www.sciencenews.org/article/black-hole-first-picture-event-horizon-telescope",,,,1116387150826700800,https://twitter.com/RepMcNerney/status/1116387150826700800
2019-04-10 21:01:50,RepMcNerney,,5,17,26,"The first 100 days of the 116th Congress have been focused on protecting the rights of voters, fighting #climatechange, ensuring LGBTQ rights, and protecting dreamers. I look forward to the work that will continue to be done throughout this Congress. #100DaysForThePeople",,,#climatechange #100DaysForThePeople,1116083891578855425,https://twitter.com/RepMcNerney/status/1116083891578855425
2019-04-10 15:50:37,RepMcNerney,,1,37,62,"You called, wrote letters, attended town halls and made your voices heard. Today is a victory for free speech, democracy and above all the American people. #SaveTheNet",,,#SaveTheNet,1116005573475041280,https://twitter.com/RepMcNerney/status/1116005573475041280
2019-04-10 15:47:34,RepMcNerney,,2,3,14,"The House of Representatives just passed the #SavetheNet Act! I’m proud to be an original cosponsor of this critical legislation that will restore strong #netneutrality protections for my constituents and all Americans.",,,#SavetheNet #netneutrality #netneutrality,1116004806592729088,https://twitter.com/RepMcNerney/status/1116004806592729088
2019-04-09 20:48:10,RepMcNerney,,1,6,12,"The #SaveTheNet Act takes an approach that accounts for the internet of today and of tomorrow, and it provides certainty for Americans across the country. I'm proud to be an original cosponsor of this critical legislation, and I'll continue to fight to restore #NetNeutrality.",,,#SaveTheNet #NetNeutrality #NetNeutrality,1115718066682441729,https://twitter.com/RepMcNerney/status/1115718066682441729
2019-04-08 23:20:25,RepMcNerney,,1,1,2,"My @reddit AMA on #netneutrality and the Save the Internet Act will start at 8 PM EST, but you can submit your questions now. I'm looking forward to a great discussion! #SaveTheNet",,@reddit,#netneutrality #netneutrality #SaveTheNet,1115393990763978752,https://twitter.com/RepMcNerney/status/1115393990763978752
2019-04-08 12:00:00,RepMcNerney,,3,39,81,"I'll be hosting a @Reddit AMA on #NetNeutrality tonight from 8 to 9 PM EST. Hope you can join me! #SaveTheNet",,@reddit,#NetNeutrality #NetNeutrality #SaveTheNet,1115222759921991680,https://twitter.com/RepMcNerney/status/1115222759921991680
2019-04-05 19:43:48,RepMcNerney,,2,1,4,"If you're in the Antioch area, I hope you can stop by my open house on April 26th. I'll be hosting it at my Antioch office from 6:00 PM - 7:30 PM, and I'm looking forward to having some great discussions about the issues that are most important to you.",,,,1114252316037865472,https://twitter.com/RepMcNerney/status/1114252316037865472
2019-04-04 19:09:19,RepMcNerney,,3,7,18,"As a former wind energy engineer, I can tell you the president's recent claims are blatantly false. Wind is one of the lowest-priced sources of energy, and unlike fossil fuels, it produces no harmful emissions that contribute to #climatechange.",,,#climatechange,1113881247816855552,https://twitter.com/RepMcNerney/status/1113881247816855552
2019-04-02 20:00:01,RepMcNerney,,1,2,9,"Today is World Autism Day – a day to promote understanding and acceptance of people with autism and their unique strengths and challenges. #Congress4LIUB",,,#Congress4LIUB,1113169231057641472,https://twitter.com/RepMcNerney/status/1113169231057641472
2019-04-02 18:30:00,RepMcNerney,,1,0,3,"#EqualPay is not just an issue for women. It impacts families, businesses and our economy. The House has passed the #PaycheckFairnessAct to ensure equal pay for equal work, and now it’s the Senate’s turn.",,,#EqualPay #PaycheckFairnessAct,1113146581006508033,https://twitter.com/RepMcNerney/status/1113146581006508033
2019-04-02 18:00:00,RepMcNerney,,1,1,5,"Unsafe levels of contamination in drinking water disproportionately affects vulnerable communities. The president’s #DirtyWaterRule will put the health of Americans across the country at further risk. Safe drinking water is a human right, &amp; we must #ProtectCleanWater for all.",,,#DirtyWaterRule #ProtectCleanWater,1113139029862572032,https://twitter.com/RepMcNerney/status/1113139029862572032
2019-04-02 17:04:03,RepMcNerney,,1,17,37,"Trump’s #DirtyWaterRule will put the drinking water sources for tens of millions of people at risk, as well as the wetlands that communities rely on for flood protection. It's time to #ProtectCleanWater.",,,#DirtyWaterRule #ProtectCleanWater,1113124948829188096,https://twitter.com/RepMcNerney/status/1113124948829188096
2019-04-01 21:33:54,RepMcNerney,,1,1,4,"I'll be hosting an open house at my Stockton office on Thursday, April 18th from 6:00 PM - 7:30 PM EST. I hope to see you there!",,,,1112830471359160320,https://twitter.com/RepMcNerney/status/1112830471359160320
2019-03-30 17:57:56,RepMcNerney,,2,3,9,"This week, @HouseDemocrats introduced two major pieces of legislation to preserve protections for people with pre-existing conditions and to recommit the U.S. to leading the fight against #climatechange.",,@HouseDemocrats,#climatechange,1112051346650423297,https://twitter.com/RepMcNerney/status/1112051346650423297
2019-03-29 21:20:40,RepMcNerney,,0,0,6,"On #VietnamVeteransDay, we commemorate the withdrawal of U.S. combat and combat support units from South Vietnam in 1973. We thank all those who served and honor those who did not return home.",,,#VietnamVeteransDay,1111739977900216320,https://twitter.com/RepMcNerney/status/1111739977900216320
2019-03-27 20:11:12,RepMcNerney,,4,3,27,"Thanks to the representatives from @CalStateEastBay who stopped by my DC office. I’ve long fought to expand access to higher education and I’ll continue to defend crucial federal funding - especially Pell Grants, which enable countless students to continue their education.",,@CalStateEastBay,,1110997721140334593,https://twitter.com/RepMcNerney/status/1110997721140334593
2019-03-26 17:25:21,RepMcNerney,,0,0,7,"Today in #SubCommTech we took a critical step in the fight to restore #netneutrality by advancing #SavetheNet to the full @EnergyCommerce. This important piece of legislation would reestablish vital net neutrality protections to ensure a free and open internet #ForThePeople.",,@EnergyCommerce,#SubCommTech #netneutrality #netneutrality #SavetheNet #ForThePeople,1110593595030077441,https://twitter.com/RepMcNerney/status/1110593595030077441
2019-03-26 16:59:33,RepMcNerney,,4,4,13,"#Netneutrality fuels competition &amp; innovation in our economy, enables the internet to be an equalizer &amp; is essential for our democracy. The #SaveTheNet Act is a simple &amp; straightforward bill that would restore net neutrality protections, &amp; I’m proud to be an original cosponsor.",,,#Netneutrality #Netneutrality #SaveTheNet,1110587101341458432,https://twitter.com/RepMcNerney/status/1110587101341458432
2019-03-23 21:35:25,RepMcNerney,,0,0,4,"Earlier this week I joined Mike Burkholder to talk about some of issues I’m working on and what’s happening in Washington. Check out the link for the the full interview.",,,,1109569363881967619,https://twitter.com/RepMcNerney/status/1109569363881967619
2019-03-22 19:53:06,RepMcNerney,,0,0,4,"Great turn out at yesterday’s Veterans Town Hall! Thank you to everyone who came and participated in the informative discussion.",,,,1109181226764718087,https://twitter.com/RepMcNerney/status/1109181226764718087
2019-03-21 18:49:43,RepMcNerney,,2,5,19,"I am cosponsoring the #SaveTheNet Act to restore critical #NetNeutrality protections. These protections are the core of a free and open internet, and ensure consumers – not corporations – are in control.",,,#SaveTheNet #NetNeutrality #NetNeutrality,1108802888237752326,https://twitter.com/RepMcNerney/status/1108802888237752326
