date,username,to,replies,retweets,favorites,text,geo,mentions,hashtags,id,permalink
2019-10-22 16:01:56,TamikaGHamilton,theRealLaRocca,1,0,1,"Have you called Manhattan? They seem to be active",,,,1186674053827842048,https://twitter.com/TamikaGHamilton/status/1186674053827842048
2019-10-22 14:33:50,TamikaGHamilton,,6,81,222,"We are going to WIN! #Tamika2020",,,#Tamika2020,1186651883097640963,https://twitter.com/TamikaGHamilton/status/1186651883097640963
2019-10-21 19:21:23,TamikaGHamilton,,1,3,15,"Lyndaaaaaaaaaa! You know who you are. I have no words. Will not forget you, that’s a promise",,,,1186361859185659904,https://twitter.com/TamikaGHamilton/status/1186361859185659904
2019-10-21 19:10:52,TamikaGHamilton,,1,114,112,"Do you want another 5 years of a “do nothing Congress?” The President needs the House and Senate Be apart of History and send me to the Hill Americans need to put Americans in office!! #TeamTamika #Tamika2020",,,#TeamTamika #Tamika2020,1186359212080680960,https://twitter.com/TamikaGHamilton/status/1186359212080680960
2019-10-21 19:01:32,TamikaGHamilton,metalrockerlion,0,0,0,"Thank you!",,,,1186356864939741184,https://twitter.com/TamikaGHamilton/status/1186356864939741184
2019-10-21 04:57:33,TamikaGHamilton,conservelatino,0,0,0,"Question: What did he offer them in exchange for their support???",,,,1186144467960528896,https://twitter.com/TamikaGHamilton/status/1186144467960528896
2019-10-21 03:53:12,TamikaGHamilton,johno051317,1,2,6,"Thank you so much! Thank you for helping me get to the finish line. I only have to close a 9% gap. My opponent has never run against anyone like me! Ready to take him on",,,,1186128274537140224,https://twitter.com/TamikaGHamilton/status/1186128274537140224
2019-10-21 03:13:34,TamikaGHamilton,Opinion8dKellie,3,13,31,"http://www.votetamika.com",,,,1186118301291663360,https://twitter.com/TamikaGHamilton/status/1186118301291663360
2019-10-21 03:13:11,TamikaGHamilton,RhondaM19141869,1,1,7,"Hi Rhonda! I’m coming to Sutter!",,,,1186118203782524928,https://twitter.com/TamikaGHamilton/status/1186118203782524928
2019-10-21 01:10:27,TamikaGHamilton,Ericmichealral2,1,3,5,"Thank you a million times over! Can we get to over 1k shares?!",,,,1186087315896074240,https://twitter.com/TamikaGHamilton/status/1186087315896074240
2019-10-20 23:10:23,TamikaGHamilton,MaryAnnArizona,0,1,2,"An Amazing young woman! Check her out",,,,1186057102147473409,https://twitter.com/TamikaGHamilton/status/1186057102147473409
2019-10-20 20:12:45,TamikaGHamilton,HotepJesus,0,0,2,"I can’t deal!",,,,1186012397917523970,https://twitter.com/TamikaGHamilton/status/1186012397917523970
2019-10-19 19:15:41,TamikaGHamilton,heath4freedom,1,12,15,"Thank you @heath4freedom !!! Let’s do this!!",,@heath4freedom,,1185635650936033280,https://twitter.com/TamikaGHamilton/status/1185635650936033280
2019-10-19 19:14:50,TamikaGHamilton,GodMadeMe17,0,0,0," ",,,,1185635436766478336,https://twitter.com/TamikaGHamilton/status/1185635436766478336
2019-10-19 16:42:38,TamikaGHamilton,GodMadeMe17,0,0,0,"Done! Thank you for your service",,,,1185597134298476544,https://twitter.com/TamikaGHamilton/status/1185597134298476544
2019-10-19 15:28:41,TamikaGHamilton,JAG7495,0,1,2,"Bingo",,,,1185578521025892352,https://twitter.com/TamikaGHamilton/status/1185578521025892352
2019-10-19 15:04:49,TamikaGHamilton,,14,73,101,"Let’s not get carried away w/the exchange btwn #Hillary &amp; #Tulsi This was an atta girl moment. Hillary is still the godmother of the DNC Tulsi needs to raise her profile &amp; be an outsider. Hillary did her a favor! Tulsi is being groomed for 2024",,,#Hillary #Tulsi,1185572518066675712,https://twitter.com/TamikaGHamilton/status/1185572518066675712
2019-10-19 03:07:48,TamikaGHamilton,kevinh1071,0,0,2,"Wow! Such an honor! Thank you for believing in me ",,,,1185392074973011968,https://twitter.com/TamikaGHamilton/status/1185392074973011968
2019-10-19 01:43:58,TamikaGHamilton,SocalMAGA37,0,13,25,"No donation is too small. Thank you so much! Make California Great Again",,,,1185370974474031104,https://twitter.com/TamikaGHamilton/status/1185370974474031104
2019-10-18 20:42:56,TamikaGHamilton,,1,7,11,"Thank you @maggieslist1! Such an honor to be among these amazing candidates! #Tamika2020",,@maggieslist1,#Tamika2020,1185295220675506176,https://twitter.com/TamikaGHamilton/status/1185295220675506176
2019-10-18 19:26:20,TamikaGHamilton,parscale,0,14,18,"To take the House, we need 218. Currently Republicans have 199! Support Candidates who love their District & Nation #Tamika2020",,,#Tamika2020,1185275940412129282,https://twitter.com/TamikaGHamilton/status/1185275940412129282
2019-10-18 14:08:13,TamikaGHamilton,,5,89,60,"#Election2020 #KAG #Tamika2020",,,#Election2020 #KAG #Tamika2020,1185195886109814784,https://twitter.com/TamikaGHamilton/status/1185195886109814784
2019-10-18 13:31:47,TamikaGHamilton,1Terry,0,0,0,"Hi Terry! We are going to win! Thank you for believing in this race",,,,1185186716631498752,https://twitter.com/TamikaGHamilton/status/1185186716631498752
2019-10-17 23:17:11,TamikaGHamilton,,3,82,70,"My day is getting better! I’m officially on @winred",,@WINRED,,1184971647683420160,https://twitter.com/TamikaGHamilton/status/1184971647683420160
2019-10-17 21:56:48,TamikaGHamilton,darylnelson01,0,14,14,"Thank you! ",,,,1184951421575127040,https://twitter.com/TamikaGHamilton/status/1184951421575127040
2019-10-17 21:34:34,TamikaGHamilton,Stand4TruthNow,0,0,0,"I live here and I’m out here everyday. I still need everyone’s support",,,,1184945824846897152,https://twitter.com/TamikaGHamilton/status/1184945824846897152
2019-10-17 19:54:14,TamikaGHamilton,29Aspect,3,7,17,"Check out my interview w/Eric Bolling!",,,,1184920576533516288,https://twitter.com/TamikaGHamilton/status/1184920576533516288
2019-10-16 23:01:18,TamikaGHamilton,dvaughnmd,1,0,1,"Thank you so much! Please sign up if you haven’t already so you can get the latest info about the campaign.",,,,1184605265359851520,https://twitter.com/TamikaGHamilton/status/1184605265359851520
2019-10-16 15:31:43,TamikaGHamilton,jus1_kimberely,0,0,0,"Whoa!",,,,1184492120884690946,https://twitter.com/TamikaGHamilton/status/1184492120884690946
2019-10-16 03:59:28,TamikaGHamilton,kaylynhf,0,0,2," ",,,,1184317912623931398,https://twitter.com/TamikaGHamilton/status/1184317912623931398
2019-10-15 14:21:11,TamikaGHamilton,,7,118,94,"@KingJames this is what you’re defending! First your making deals w/@GavinNewsom, when we have the most homeless in the Nation The people of Hong Kong are fighting for basic liberties &amp; you’re worried about your bank account",,@KingJames @GavinNewsom,,1184111984507142146,https://twitter.com/TamikaGHamilton/status/1184111984507142146
2019-10-15 05:20:05,TamikaGHamilton,mrfezzywig77,0,0,2,"Hi..my website will relaunch tomorrow",,,,1183975812124381186,https://twitter.com/TamikaGHamilton/status/1183975812124381186
2019-10-15 02:25:50,TamikaGHamilton,KalebPenbury,0,0,1,"Basically",,,,1183931959208099840,https://twitter.com/TamikaGHamilton/status/1183931959208099840
2019-10-15 02:24:59,TamikaGHamilton,RepGaramendi,0,0,2,"Seeing that you’ve dodged being drafted, you will never understand the sacrifice it takes to be in the military. Peace corps doesn’t count. #Tamika2020",,,#Tamika2020,1183931747563528192,https://twitter.com/TamikaGHamilton/status/1183931747563528192
2019-10-15 02:00:17,TamikaGHamilton,29Aspect,0,1,7,"Melissa! My ride or die, my day zero. ",,,,1183925529944252416,https://twitter.com/TamikaGHamilton/status/1183925529944252416
2019-10-15 01:59:16,TamikaGHamilton,RealSaavedra,1,2,11,"This is what happens when money is more important than freedom",,,,1183925275735625729,https://twitter.com/TamikaGHamilton/status/1183925275735625729
2019-10-15 01:56:15,TamikaGHamilton,InsideTimsHead,0,0,1,"Thank you",,,,1183924516231057409,https://twitter.com/TamikaGHamilton/status/1183924516231057409
2019-10-15 01:20:16,TamikaGHamilton,lanik66,1,7,14,"Thank you Lani! You mean more to me than you will ever know. This past year has been crazy but amazing! @lanik66 is sooo special",,@lanik66,,1183915461072670720,https://twitter.com/TamikaGHamilton/status/1183915461072670720
2019-10-15 01:19:20,TamikaGHamilton,SPWTalessia,0,5,12,"Thank you love! You have been there since day zero. Please follow @SPWTalessia",,@SPWTalessia,,1183915227504508929,https://twitter.com/TamikaGHamilton/status/1183915227504508929
2019-10-15 01:09:36,TamikaGHamilton,,4,10,29,"I’m so excited to announce that I’ve been endorsed by Maggie’s List! This is so exciting! Thank you Maggie’s List, so honored!",,,,1183912776349016064,https://twitter.com/TamikaGHamilton/status/1183912776349016064
2019-10-14 18:50:55,TamikaGHamilton,,1,47,30,"I can’t do this alone. Your support is paramount! Donate today! Make a pledge of $10...",,,,1183817475969843200,https://twitter.com/TamikaGHamilton/status/1183817475969843200
2019-10-14 18:47:53,TamikaGHamilton,,3,45,62,"The same celebs who are running their mouths about war, are the same losers who walk past homeless camps! Currently in California we have the highest homeless Veteran population in the Nation, 11k!",,,,1183816712614903808,https://twitter.com/TamikaGHamilton/status/1183816712614903808
2019-10-14 18:42:13,TamikaGHamilton,,0,34,43,"I will never reduce the lives of our soldiers & the issues in foreign nations to a tweet count My one comment on this issue: Until you sacrifice your life personally or your child’s to a war, you have zero room to speak #AmericaFirst",,,#AmericaFirst,1183815287583301633,https://twitter.com/TamikaGHamilton/status/1183815287583301633
2019-10-14 13:53:37,TamikaGHamilton,tramiller101,0,0,0,"Social is great to spread the word only. To win elections we need boots on the ground.",,,,1183742660168695809,https://twitter.com/TamikaGHamilton/status/1183742660168695809
2019-10-14 13:52:05,TamikaGHamilton,MGBreakfastclu1,1,0,4,"Yes!",,,,1183742273172860928,https://twitter.com/TamikaGHamilton/status/1183742273172860928
2019-10-14 05:47:11,TamikaGHamilton,lilboosny,0,0,1,"Thank you",,,,1183620242418761728,https://twitter.com/TamikaGHamilton/status/1183620242418761728
2019-10-14 05:37:34,TamikaGHamilton,RepGaramendi,0,0,0,"Easy for you to say when you don’t have a son/daughter fighting",,,,1183617822875779080,https://twitter.com/TamikaGHamilton/status/1183617822875779080
2019-10-14 05:17:48,TamikaGHamilton,,12,204,535,"America is the only free Nation left in the World Once we lose our right to bear arms, we lose EVERYTHING As a member of Congress, I will do everything in my power to make sure that doesn’t happen! Stand with me and help me take this seat from a long time Democrat!",,,,1183612850574544896,https://twitter.com/TamikaGHamilton/status/1183612850574544896
2019-10-14 03:13:18,TamikaGHamilton,TODAYshow,0,0,1,"Make sure you hit up the sweatshops where Nike gear is being manufactured. I hear the working conditions are state of the art. You all are bunch of hypocrites.",,,,1183581518091804673,https://twitter.com/TamikaGHamilton/status/1183581518091804673
2019-10-13 19:39:45,TamikaGHamilton,,0,1,6,"Thank you @SonnieJohnson",,@SonnieJohnson,,1183467378115432448,https://twitter.com/TamikaGHamilton/status/1183467378115432448
2019-10-13 17:34:31,TamikaGHamilton,Jasonwaldvogel1,0,2,3,"Exactly",,,,1183435862404526080,https://twitter.com/TamikaGHamilton/status/1183435862404526080
2019-10-13 15:38:30,TamikaGHamilton,,4,43,49,"Good Morning Patriots! Fundraising is essential to keep pace with my Democrat opponent, John Garamendi. Show your support by donating today!",,,,1183406668178055169,https://twitter.com/TamikaGHamilton/status/1183406668178055169
2019-10-13 14:52:19,TamikaGHamilton,CaliConsNews,1,2,5,"For the recall, contact your local Republican Party. I was there with my central committee helping yesterday.",,,,1183395043022983171,https://twitter.com/TamikaGHamilton/status/1183395043022983171
2019-10-13 07:04:27,TamikaGHamilton,1Craftikittti,0,0,0,"Wow but not surprised. Thanks for letting me know",,,,1183277299883364357,https://twitter.com/TamikaGHamilton/status/1183277299883364357
2019-10-13 06:17:55,TamikaGHamilton,,1,13,29,"Social media is great to help spread messages quicker but the real work for campaigns is on the ground. Consider getting involved locally, candidates need you",,,,1183265589197852673,https://twitter.com/TamikaGHamilton/status/1183265589197852673
2019-10-13 00:52:53,TamikaGHamilton,,0,5,18,"",,,,1183183795043721217,https://twitter.com/TamikaGHamilton/status/1183183795043721217
2019-10-12 23:32:09,TamikaGHamilton,OCCaliPatriot,0,1,4,"Actually people from the democrat booth came to sign the petition today!",,,,1183163476266471424,https://twitter.com/TamikaGHamilton/status/1183163476266471424
2019-10-12 20:09:22,TamikaGHamilton,,9,100,153,"Solano Republican Party is working hard to recall @GavinNewsom !!!! People are crossing party lines to take back California #RecallGavinNewsom",,@GavinNewsom,#RecallGavinNewsom,1183112443779665920,https://twitter.com/TamikaGHamilton/status/1183112443779665920
2019-10-12 20:07:46,TamikaGHamilton,,1,36,45,"I’m in Rio Visto getting signatures for my petition! I live here, this is my community, and these are my people #WinRed #tamika2020",,,#WinRed #tamika2020,1183112041529131008,https://twitter.com/TamikaGHamilton/status/1183112041529131008
2019-10-12 05:45:09,TamikaGHamilton,pattipromqueen,0,2,1,"Hi! Yes I’m very familiar with this list. Hope you have a great weekend",,,,1182894958082084867,https://twitter.com/TamikaGHamilton/status/1182894958082084867
2019-10-12 05:42:17,TamikaGHamilton,glamourmag,0,0,0,"When will you feature another narrative? I’m a conservative woman running for office in California. It’s sad that only one side is able to speak. Have you forgotten that conservative look at this magazine as well? How long will you ignore us? What about our voices?",,,,1182894234371670020,https://twitter.com/TamikaGHamilton/status/1182894234371670020
2019-10-12 05:33:30,TamikaGHamilton,GavinNewsom,0,2,5,"@GavinNewsom signed death sentences for the first responders! My husband is a police officer &amp; I will not be silent. We can’t legislate the hearts of man. “We the people” must stand up to the tyranny happening in CA. These laws only hurt law abiding citizens! Vote him OUT",,@GavinNewsom,,1182892026351640578,https://twitter.com/TamikaGHamilton/status/1182892026351640578
2019-10-11 13:51:53,TamikaGHamilton,LeeTggra,1,0,1,"Thousands of voters stayed home. It’s possible. And if we talk policy vs emotional voting, it’s really possible",,,,1182655058279727104,https://twitter.com/TamikaGHamilton/status/1182655058279727104
2019-10-11 07:06:08,TamikaGHamilton,DontTreadOnUS,0,0,1,"Great idea",,,,1182552947550347264,https://twitter.com/TamikaGHamilton/status/1182552947550347264
2019-10-11 04:44:32,TamikaGHamilton,1929Kent,0,0,2," ",,,,1182517314366795777,https://twitter.com/TamikaGHamilton/status/1182517314366795777
2019-10-11 00:29:01,TamikaGHamilton,MahgdalenRose,0,5,12," ",,,,1182453012272271360,https://twitter.com/TamikaGHamilton/status/1182453012272271360
2019-10-10 20:39:38,TamikaGHamilton,WayneDupreeShow,0,2,5,"Big Mad!",,,,1182395286506721280,https://twitter.com/TamikaGHamilton/status/1182395286506721280
2019-10-10 16:41:39,TamikaGHamilton,,29,330,193,"Do you want @realDonaldTrump to hold a rally in California?",,@realDonaldTrump,,1182335394160898048,https://twitter.com/TamikaGHamilton/status/1182335394160898048
2019-10-10 14:46:58,TamikaGHamilton,SharikaSoal84,0,0,0,"I want the media to tell the truth. I want people to think freely. And I never asked for your endorsement. I don’t know where all of this is coming from but I’m one person. Your upset over not getting a response to a DM. It happens but be clear I’m not a fraud",,,,1182306534945984512,https://twitter.com/TamikaGHamilton/status/1182306534945984512
2019-10-10 14:44:27,TamikaGHamilton,SharikaSoal84,0,0,0,"I’m disappointed you assumed. I don’t know you but I hope all is well with you. I’m going back to running my race and taking my children to school. God Bless you",,,,1182305900075216896,https://twitter.com/TamikaGHamilton/status/1182305900075216896
2019-10-10 14:38:35,TamikaGHamilton,SharikaSoal84,0,1,3,"So I missed your DM! I hope you realize that wasn’t intentional. You didn’t even ask if I saw it before going on a rant. I’m a mom of 4, wife, & I still work.",,,,1182304425508929537,https://twitter.com/TamikaGHamilton/status/1182304425508929537
2019-10-10 14:36:32,TamikaGHamilton,SharikaSoal84,0,0,1,"I don’t know what you are talking about. Your free to do what you want but I literally have no clue to what your referring to",,,,1182303909001351175,https://twitter.com/TamikaGHamilton/status/1182303909001351175
2019-10-10 14:34:13,TamikaGHamilton,SharikaSoal84,0,0,0,"What are you referring to? And why go to name calling?",,,,1182303325175205890,https://twitter.com/TamikaGHamilton/status/1182303325175205890
2019-10-10 14:32:18,TamikaGHamilton,SharikaSoal84,0,1,1,"Good Morning, what’s going on",,,,1182302842113028096,https://twitter.com/TamikaGHamilton/status/1182302842113028096
2019-10-10 14:22:43,TamikaGHamilton,,6,223,194,"ATTN AMERICANS: Voting in the primary is crucial Check online for the dates in your state. California Primary: March 3 It’s not the time to sit back. Thousands of voters stayed home in 2018! Check w/your friends/family/neighbors..make sure they are registered #Tamika2020",,,#Tamika2020,1182300433143889922,https://twitter.com/TamikaGHamilton/status/1182300433143889922
2019-10-10 13:56:16,TamikaGHamilton,CharriseLane,1,0,1,"Thank you Charrise ",,,,1182293773813813259,https://twitter.com/TamikaGHamilton/status/1182293773813813259
2019-10-10 06:55:52,TamikaGHamilton,MarkLea46085880,0,0,0,"Totally agree and thank you for the support",,,,1182187977235025922,https://twitter.com/TamikaGHamilton/status/1182187977235025922
2019-10-10 05:31:08,TamikaGHamilton,NextLAMayor,0,0,1,"Exactly",,,,1182166654488207360,https://twitter.com/TamikaGHamilton/status/1182166654488207360
2019-10-10 01:10:18,TamikaGHamilton,MahgdalenRose,0,0,6,"Anyone that wants to say anything negative about this young woman, come see me. @MahgdalenRose your beautiful",,@MahgdalenRose,,1182101013290840064,https://twitter.com/TamikaGHamilton/status/1182101013290840064
2019-10-09 14:01:59,TamikaGHamilton,,0,1,2,"@KamalaHarris needs to come the hell home. She has no business on anything that resembles a campaign trail. She is DOA!",,@KamalaHarris,,1181932825525682177,https://twitter.com/TamikaGHamilton/status/1181932825525682177
2019-10-09 13:49:44,TamikaGHamilton,spydamanbearpig,1,0,0,"I’m ready to work! #Tamika2020",,,#Tamika2020,1181929744092160000,https://twitter.com/TamikaGHamilton/status/1181929744092160000
2019-10-09 13:46:59,TamikaGHamilton,,16,228,363,"I’m asking Democrats to sincerely reconsider support for your base in 2020 Look at their policies & how they are destroying California Take a chance and VoteRed",,,,1181929050236805122,https://twitter.com/TamikaGHamilton/status/1181929050236805122
2019-10-09 13:35:56,TamikaGHamilton,DonaldJTrumpJr,0,1,11,"This never gets old!",,,,1181926268989657092,https://twitter.com/TamikaGHamilton/status/1181926268989657092
2019-10-09 07:09:17,TamikaGHamilton,,23,69,80,"If they can easily cut off our electric, what else can they do? #pgeshutoff",,,#pgeshutoff,1181828964085460993,https://twitter.com/TamikaGHamilton/status/1181828964085460993
2019-10-09 03:05:18,TamikaGHamilton,,0,0,1,"@QuanKimberly made a great point for us affected by the power outage: gas up you car! And make sure you charge your phones. Again please send this to your California family/friends",,@QuanKimberly,,1181767565250482176,https://twitter.com/TamikaGHamilton/status/1181767565250482176
2019-10-09 02:58:04,TamikaGHamilton,,1,56,24,"Also schools will be closing due to the power outage..please send the link to your California family/friends",,,,1181765745887236096,https://twitter.com/TamikaGHamilton/status/1181765745887236096
2019-10-09 02:56:00,TamikaGHamilton,,1,7,3,"Areas affected my the PG&E shutdown: Solano (32,862 customers): Fairfield, Vacaville, Suisun City, Vallejo, Dixon Glenn (1,590 customers): Orland, Willows, Artois, Elk Creek, Glenn",,,,1181765225298554880,https://twitter.com/TamikaGHamilton/status/1181765225298554880
2019-10-09 02:54:11,TamikaGHamilton,,0,6,4,"Yolo (5,791 customers): Winters, Esparto, Guinda, Capay, Brooks, Madison, Rumsey, Woodland, Davis, Dunnigan, Zamora Yuba (6k): Marysville, Browns Valley, Oregon House, Brownsville, Wheatland, Dobbins, Camptonville, Smartville, Challenge, Rackerby, Strawberry Valley, Loma Rica",,,,1181764770141110274,https://twitter.com/TamikaGHamilton/status/1181764770141110274
2019-10-09 02:52:22,TamikaGHamilton,,0,5,6,"Here are the areas affected in the 3rd District starting w/Lake County (26,430 customers): Clearlake, Lakeport, Clearlake Oaks, Lucerne, Nice, Upper Lake, Lower Lake, Middletown, Kelseyville, Cobb, Hidden Valley Lake, Glenhaven, Witter Springs, Clearlake Park, Loch Lomond",,,,1181764310659301378,https://twitter.com/TamikaGHamilton/status/1181764310659301378
2019-10-09 02:45:00,TamikaGHamilton,,1,8,6,"PG&E will give further updates...link provided",,,,1181762458936938496,https://twitter.com/TamikaGHamilton/status/1181762458936938496
2019-10-09 02:44:11,TamikaGHamilton,,0,7,4,"This interactive map shows my district: Solano...please R/T and send to anyone you know in Northern California",,,,1181762253361565696,https://twitter.com/TamikaGHamilton/status/1181762253361565696
2019-10-09 02:41:55,TamikaGHamilton,,3,13,12,"ATTN: On Tuesday afternoon, the utility announced will shut off power to 800,000 customers in Northern and Central California starting early Wednesday. PG&E said it would notify affected customers directly.",,,,1181761682386718720,https://twitter.com/TamikaGHamilton/status/1181761682386718720
2019-10-09 00:31:29,TamikaGHamilton,Tina_C_A,1,0,0,"Thank you for the support! We are going to WIN. And there are some amazing people in California",,,,1181728855163191296,https://twitter.com/TamikaGHamilton/status/1181728855163191296
2019-10-08 23:22:58,TamikaGHamilton,SPWTalessia,0,0,0,"And I Ohhh",,,,1181711613969096704,https://twitter.com/TamikaGHamilton/status/1181711613969096704
2019-10-08 23:19:47,TamikaGHamilton,SPWTalessia,0,0,0,"What did I miss...let me read",,,,1181710811271557121,https://twitter.com/TamikaGHamilton/status/1181710811271557121
2019-10-08 23:12:21,TamikaGHamilton,,0,1,1,"@SonnieJohnson I want to invite you to the 3rd District. Let’s make it happen",,@SonnieJohnson,,1181708941941587968,https://twitter.com/TamikaGHamilton/status/1181708941941587968
2019-10-08 22:57:22,TamikaGHamilton,,1,6,14,"As a member of Congress I will focus on taking people across the finish line. We can’t talk about fatherless homes & not have a plan to bring them back home. The first step is forgiveness",,,,1181705171815911425,https://twitter.com/TamikaGHamilton/status/1181705171815911425
2019-10-08 05:12:17,TamikaGHamilton,pfabiani,0,0,1,"Thank youuuuu",,,,1181437134932021253,https://twitter.com/TamikaGHamilton/status/1181437134932021253
2019-10-08 00:07:01,TamikaGHamilton,CorrinRankin,0,0,0,"I can hear the President’s voice when he says, “China”",,,,1181360313356079104,https://twitter.com/TamikaGHamilton/status/1181360313356079104
2019-10-07 23:48:25,TamikaGHamilton,,0,0,0,"@Essence @EBONYMag @voguemagazine @Cosmopolitan I know some pretty amazing women running for Congress! Primary season is around the corner, let’s have some diversity thought ",,@Essence @EBONYMag @voguemagazine @Cosmopolitan,,1181355629434167298,https://twitter.com/TamikaGHamilton/status/1181355629434167298
2019-10-07 16:10:40,TamikaGHamilton,GmahoganyX,1,0,0,"You lost me on generalizing all Black ppl comment. Have a nice day",,,,1181240431918514176,https://twitter.com/TamikaGHamilton/status/1181240431918514176
2019-10-07 16:03:22,TamikaGHamilton,GmahoganyX,1,0,1,"We don’t have to talk to one another like this.",,,,1181238598177185794,https://twitter.com/TamikaGHamilton/status/1181238598177185794
2019-10-07 15:50:13,TamikaGHamilton,KPaddy19,0,0,0,"I just want to focus my energy is what I can control. When I come home to see my family we should meet. Until then, the primary for elections is coming. Get ppl together and talk about the candidates. March 3",,,,1181235286816083968,https://twitter.com/TamikaGHamilton/status/1181235286816083968
2019-10-07 15:46:41,TamikaGHamilton,KPaddy19,1,0,0,"I didn’t say you support them. I said what about them, big difference. You know your people and that’s the first step. I personally am not going to tell someone what to do w/their voice or talent. You sound like a leader, so just step out and do the thing",,,,1181234399066509313,https://twitter.com/TamikaGHamilton/status/1181234399066509313
2019-10-07 15:37:49,TamikaGHamilton,KPaddy19,1,0,0,"Fed up? Why? What about the lawmakers who are to blame? What about Al and Jesse who have been collecting checks off our pain for decades? What do you want these ppl in the photo to do? I’m not waiting around for someone to do anything, I stepped out.",,,,1181232167336022017,https://twitter.com/TamikaGHamilton/status/1181232167336022017
2019-10-07 15:18:00,TamikaGHamilton,KPaddy19,2,0,0,"I’m from Maryland as well. Community leaders need to rise up. Have you been getting people together? The lawmakers are the issue.",,,,1181227178001698818,https://twitter.com/TamikaGHamilton/status/1181227178001698818
2019-10-07 15:16:31,TamikaGHamilton,KPaddy19,2,0,0,"I can’t speak for other people. I personally never use the terms “plantation.”",,,,1181226804612255744,https://twitter.com/TamikaGHamilton/status/1181226804612255744
