date,username,to,replies,retweets,favorites,text,geo,mentions,hashtags,id,permalink
2020-03-02 22:13:29,TamikaGHamilton,WilkowMajority,1,1,20,"Thank you Andrew! We’re going to make HISTORY.",,,,1234602753923506181,https://twitter.com/TamikaGHamilton/status/1234602753923506181
2020-03-02 21:12:22,TamikaGHamilton,,33,167,508,"It’s time District 3. Let’s make History. Can’t stop God’s plan. Let’s take down the old guard. And that transcends government.....#Tamika2020",,,#Tamika2020,1234587376350973953,https://twitter.com/TamikaGHamilton/status/1234587376350973953
2020-03-02 05:59:13,TamikaGHamilton,QuanKimberly,0,0,5," you Kim",,,,1234357573031096320,https://twitter.com/TamikaGHamilton/status/1234357573031096320
2020-03-02 01:10:03,TamikaGHamilton,CAGOP,12,167,450,"Only 2 more days til March 3. Let’s make history! #GOTV",,,#GOTV,1234284802838122496,https://twitter.com/TamikaGHamilton/status/1234284802838122496
2020-03-02 01:08:24,TamikaGHamilton,Surabees,1,1,3,"I’m running for Congress against @RepGaramendi and I will unseat him!",,@RepGaramendi,,1234284386658308097,https://twitter.com/TamikaGHamilton/status/1234284386658308097
2020-03-02 00:19:21,TamikaGHamilton,,9,128,359,"My campaign family rides for me!!! #Tamika2020",,,#Tamika2020,1234272045250121730,https://twitter.com/TamikaGHamilton/status/1234272045250121730
2020-02-29 15:11:03,TamikaGHamilton,PatriciaBrink16,1,0,1,"Great to see you again! #GOTV",,,#GOTV,1233771673226113025,https://twitter.com/TamikaGHamilton/status/1233771673226113025
2020-02-28 20:20:05,TamikaGHamilton,,25,256,310,"My opponent @RepGaramendi at his best. It’s past time to retire this 50yr career politician! Help me defeat @RepGaramendi R/T &amp; don’t forget to Donate. https://secure.anedot.com/tamika-hamilton-for-congress/contribute",,@RepGaramendi @RepGaramendi,,1233487052878077952,https://twitter.com/TamikaGHamilton/status/1233487052878077952
2020-02-28 04:11:13,TamikaGHamilton,haze_martha,0,0,2,"I’m running in California. I’m going to take John Garamendi’s seat.",,,,1233243231183241216,https://twitter.com/TamikaGHamilton/status/1233243231183241216
2020-02-27 22:12:46,TamikaGHamilton,Ace_Tarheel,1,0,3," ",,,,1233153025935458306,https://twitter.com/TamikaGHamilton/status/1233153025935458306
2020-02-27 21:09:20,TamikaGHamilton,OceanPatriot9,0,1,1," ",,,,1233137061844021249,https://twitter.com/TamikaGHamilton/status/1233137061844021249
2020-02-27 21:08:01,TamikaGHamilton,AdrianNormanDC,0,0,9,"Yet when he is found, he must restore sevenfold; He may have to give up all the substance of his house (Proverbs 6:31)",,,,1233136731332825088,https://twitter.com/TamikaGHamilton/status/1233136731332825088
2020-02-27 20:35:38,TamikaGHamilton,,3,19,94,"You will know them by their fruit.",,,,1233128578243411973,https://twitter.com/TamikaGHamilton/status/1233128578243411973
2020-02-26 14:57:19,TamikaGHamilton,christafalo,1,0,4,"Thank you @christafalo. God is going to give us what we’ve been praying for. Keep my family in your prayers as well.",,@christafalo,,1232681052939751424,https://twitter.com/TamikaGHamilton/status/1232681052939751424
2020-02-26 05:54:40,TamikaGHamilton,vacareporter,0,0,1,"Thank you Nick!",,,,1232544491367587840,https://twitter.com/TamikaGHamilton/status/1232544491367587840
2020-02-26 05:54:24,TamikaGHamilton,vacareporter,0,24,46,"Thank you Nick for sitting down with me today. Check out the latest article about my candidacy @vacareporter",,@vacareporter,,1232544424334221319,https://twitter.com/TamikaGHamilton/status/1232544424334221319
2020-02-26 01:15:06,TamikaGHamilton,CyFlys,0,0,1,"I appreciate you. I will be #8",,,,1232474134552006656,https://twitter.com/TamikaGHamilton/status/1232474134552006656
2020-02-25 21:38:28,TamikaGHamilton,RealKiraDavis,0,0,1,"Suddenly I no longer feel oppressed. Thank you love",,,,1232419618314014722,https://twitter.com/TamikaGHamilton/status/1232419618314014722
2020-02-25 21:30:03,TamikaGHamilton,RealKiraDavis,1,0,3,"Priorities, priorities",,,,1232417500542861312,https://twitter.com/TamikaGHamilton/status/1232417500542861312
2020-02-25 21:28:01,TamikaGHamilton,RealKiraDavis,0,0,4,"@RealKiraDavis I’m dying laughing inside. I can’t read your tweets when I’m supposed to look serious! A A Ron for the win",,@RealKiraDavis,,1232416987009052672,https://twitter.com/TamikaGHamilton/status/1232416987009052672
2020-02-25 21:10:31,TamikaGHamilton,RealKiraDavis,0,0,5,"Let me know if I can be of any assistance.",,,,1232412580888510466,https://twitter.com/TamikaGHamilton/status/1232412580888510466
2020-02-25 20:12:29,TamikaGHamilton,RealKiraDavis,1,2,22,"We can’t let this man think he can run for President!",,,,1232397979132186625,https://twitter.com/TamikaGHamilton/status/1232397979132186625
2020-02-25 19:33:40,TamikaGHamilton,,2,10,31,"I’m going to be on the @WilkowMajority show! Take a listen in about 10min",,@WilkowMajority,,1232388211659309056,https://twitter.com/TamikaGHamilton/status/1232388211659309056
2020-02-23 23:39:45,TamikaGHamilton,JenzHouse,1,0,3,"Hi. I encourage her to go to the polls on March 3. #votetamika",,,#votetamika,1231725363337646080,https://twitter.com/TamikaGHamilton/status/1231725363337646080
2020-02-23 21:58:09,TamikaGHamilton,RustleLeaf83,0,0,2,"I’m convinced I will win.",,,,1231699794407481345,https://twitter.com/TamikaGHamilton/status/1231699794407481345
2020-02-23 18:09:06,TamikaGHamilton,,3,51,159,"Liberty is so heavy on my heart today. Don’t take it for granted America.",,,,1231642150292443136,https://twitter.com/TamikaGHamilton/status/1231642150292443136
2020-02-23 17:41:50,TamikaGHamilton,,6,26,54,"8 more days and a wake up...California Primary Election, March 3 #Tamika2020 #newera",,,#Tamika2020 #newera,1231635289560322049,https://twitter.com/TamikaGHamilton/status/1231635289560322049
2020-02-23 14:25:41,TamikaGHamilton,chiproytx,0,3,29,"We must go shopping together. I love the sound of those deals. Outlets in Texas are the best!",,,,1231585927950036992,https://twitter.com/TamikaGHamilton/status/1231585927950036992
2020-02-22 03:30:47,TamikaGHamilton,TrustGod7733,1,0,2,"Thank you! You’re taking me to the finish line.",,,,1231058727458856960,https://twitter.com/TamikaGHamilton/status/1231058727458856960
2020-02-21 18:37:48,TamikaGHamilton,conservelatino,1,2,8,"Noooooo",,,,1230924598260064256,https://twitter.com/TamikaGHamilton/status/1230924598260064256
2020-02-21 18:26:45,TamikaGHamilton,nevets1352,0,0,1,"Also the link to my website is in my BIO. http://www.votetamika.com",,,,1230921819181289472,https://twitter.com/TamikaGHamilton/status/1230921819181289472
2020-02-21 18:26:08,TamikaGHamilton,nevets1352,0,0,2,"",,,,1230921664914812928,https://twitter.com/TamikaGHamilton/status/1230921664914812928
2020-02-21 17:23:21,TamikaGHamilton,QuanKimberly,0,0,2,"Kimmmmm",,,,1230905862614421506,https://twitter.com/TamikaGHamilton/status/1230905862614421506
2020-02-21 16:52:52,TamikaGHamilton,,2,28,51,"March 3 is the California Primary Election. Exercise your rights!!!#Tamika2020",,,#Tamika2020,1230898190397784065,https://twitter.com/TamikaGHamilton/status/1230898190397784065
2020-02-21 14:13:53,TamikaGHamilton,,6,20,70,"Now we’re back to Russia! This game, “Presidential Harassment” is getting rather old We can’t seem to get past the level called “Faux Investigation = Wasted Tax Money” Well, at least we know that in the end, @realDonaldTrump wins by a landslide #Trump2020",,@realDonaldTrump,#Trump2020,1230858183658180608,https://twitter.com/TamikaGHamilton/status/1230858183658180608
2020-02-20 17:31:18,TamikaGHamilton,,0,0,0,"@SonnieJohnson ",,@SonnieJohnson,,1230545476610482176,https://twitter.com/TamikaGHamilton/status/1230545476610482176
2020-02-20 17:05:03,TamikaGHamilton,RealKiraDavis,0,2,5,"Let’s go!",,,,1230538868245450752,https://twitter.com/TamikaGHamilton/status/1230538868245450752
2020-02-20 17:04:00,TamikaGHamilton,RealKiraDavis,0,1,5,"@RealKiraDavis you embody “We the people”... so your support means so much.",,@RealKiraDavis,,1230538604872515584,https://twitter.com/TamikaGHamilton/status/1230538604872515584
2020-02-20 14:34:19,TamikaGHamilton,SonnieJohnson,1,1,12,"I wish I could ride out for this little boy. So hurt for him.",,,,1230500935597621255,https://twitter.com/TamikaGHamilton/status/1230500935597621255
2020-02-20 14:30:15,TamikaGHamilton,JSchwaeber,2,0,14,"Bingo",,,,1230499911587618816,https://twitter.com/TamikaGHamilton/status/1230499911587618816
2020-02-20 04:17:20,TamikaGHamilton,conservelatino,1,2,42,"Winning!",,,,1230345667530215424,https://twitter.com/TamikaGHamilton/status/1230345667530215424
2020-02-20 02:29:31,TamikaGHamilton,rsultzba,0,0,0,"You always have my back.",,,,1230318535764664320,https://twitter.com/TamikaGHamilton/status/1230318535764664320
2020-02-20 02:01:30,TamikaGHamilton,,8,58,113,"The endorsements keep rolling in! @JoinTravisAllen just endorsed my campaign for Congress! #finishstrong",,@JoinTravisAllen,#finishstrong,1230311481889026048,https://twitter.com/TamikaGHamilton/status/1230311481889026048
2020-02-18 17:00:12,TamikaGHamilton,OceanPatriot9,0,1,1," ",,,,1229812874601648128,https://twitter.com/TamikaGHamilton/status/1229812874601648128
2020-02-17 18:31:50,TamikaGHamilton,SeanB95926,0,0,3,"Hi Sean! Thank you. Can’t wait to represent you",,,,1229473547875012608,https://twitter.com/TamikaGHamilton/status/1229473547875012608
2020-02-17 17:55:22,TamikaGHamilton,BMahoneyTweets,0,0,2,"We got this! Can’t wait to see you again.",,,,1229464370540773376,https://twitter.com/TamikaGHamilton/status/1229464370540773376
2020-02-17 17:40:10,TamikaGHamilton,,13,65,242,"Had such a great time this weekend w/@RandPaul. Can’t wait to spend more time with you in DC.",,@RandPaul,,1229460542521131008,https://twitter.com/TamikaGHamilton/status/1229460542521131008
2020-02-17 15:00:41,TamikaGHamilton,kander4588,1,0,1,"I appreciate your support Kelly! We got this",,,,1229420406508965893,https://twitter.com/TamikaGHamilton/status/1229420406508965893
2020-02-17 14:52:36,TamikaGHamilton,RealJohnDennis,1,34,89,"Hey John! So good to see you and other endorsed candidates yesterday Wasn’t @randpaul speech great? Thank you for the support as always. See you soon.",,@RandPaul,,1229418372410019841,https://twitter.com/TamikaGHamilton/status/1229418372410019841
2020-02-14 22:56:43,TamikaGHamilton,,4,32,113,"District 3 isn’t for sale.",,,,1228453043894505472,https://twitter.com/TamikaGHamilton/status/1228453043894505472
2020-02-14 16:18:06,TamikaGHamilton,,1,11,15,"I’ll be on the @KTKZ1380AM w/ Phil Cowan @0830 to discuss my campaign for congress",,@KTKZ1380AM,,1228352726607642624,https://twitter.com/TamikaGHamilton/status/1228352726607642624
2020-02-14 04:59:27,TamikaGHamilton,Scotsarewe,1,0,1,"You got that right",,,,1228181941167345665,https://twitter.com/TamikaGHamilton/status/1228181941167345665
2020-02-14 03:27:22,TamikaGHamilton,,74,555,1261,"Just got the @CAGOP endorsement! Thank you to the courageous board members who decided to support my campaign. On to Victory! Thank you Jesus",,@CAGOP,,1228158766870233096,https://twitter.com/TamikaGHamilton/status/1228158766870233096
2020-02-13 19:02:04,TamikaGHamilton,MrsOrzechowski,0,0,2,"Everyone needs a Chelsea. See you soon.",,,,1228031601189126144,https://twitter.com/TamikaGHamilton/status/1228031601189126144
2020-02-13 03:22:42,TamikaGHamilton,MrsOrzechowski,0,0,3,"Thank you @MrsOrzechowski. You’ve been riding with me since day zero",,@MrsOrzechowski,,1227795205039898625,https://twitter.com/TamikaGHamilton/status/1227795205039898625
2020-02-13 03:17:58,TamikaGHamilton,,1,2,10,"There is something about @RealKiraDavis ....",,@RealKiraDavis,,1227794010741202945,https://twitter.com/TamikaGHamilton/status/1227794010741202945
2020-02-13 03:15:49,TamikaGHamilton,KNP2BP,1,2,3,"Thank you for seeing me. Keep fighting with me to keep America great",,,,1227793472737796096,https://twitter.com/TamikaGHamilton/status/1227793472737796096
2020-02-12 23:28:43,TamikaGHamilton,RealKiraDavis,1,5,23,"#AB5 is a hot mess &amp; should be repealed immediately",,,#AB5,1227736321365438464,https://twitter.com/TamikaGHamilton/status/1227736321365438464
2020-02-12 22:15:43,TamikaGHamilton,SavedBaldGuy,2,0,1,"Thank you for your support",,,,1227717948669714433,https://twitter.com/TamikaGHamilton/status/1227717948669714433
2020-02-12 22:15:36,TamikaGHamilton,kevinclosson,1,0,1,"Thank you!",,,,1227717918915325952,https://twitter.com/TamikaGHamilton/status/1227717918915325952
2020-02-12 22:15:24,TamikaGHamilton,SavedBaldGuy,1,3,3,"http://www.votetamika.com",,,,1227717867589619712,https://twitter.com/TamikaGHamilton/status/1227717867589619712
2020-02-12 22:11:54,TamikaGHamilton,KevinKileyCA,1,13,32,"Your support is invaluable. Thank you",,,,1227716989969256448,https://twitter.com/TamikaGHamilton/status/1227716989969256448
2020-02-12 13:51:43,TamikaGHamilton,,1,5,19,"Thank you for the article @SacObserver http://sacobserver.com/2020/02/running-republican-in-rural-california-a-black-womans-congressional-campaign-is-gaining-ground/",,@SacObserver,,1227591110861578241,https://twitter.com/TamikaGHamilton/status/1227591110861578241
2020-02-11 22:27:40,TamikaGHamilton,mellocard,0,4,31,"We receive it.",,,,1227358569852354560,https://twitter.com/TamikaGHamilton/status/1227358569852354560
2020-02-11 19:18:30,TamikaGHamilton,,181,914,2538,"Good news: By securing the support of over 80% of the Republican Central Committees in my congressional district, I’ve met the threshold necessary to be endorsed by the @CAGOP. The Board is holding a call on February 13 to vote on endorsing me. Send your prayers!",,@CAGOP,,1227310961440251904,https://twitter.com/TamikaGHamilton/status/1227310961440251904
2020-02-11 15:56:18,TamikaGHamilton,swissfamily6,0,0,0,"Let’s meet!",,,,1227260078891253760,https://twitter.com/TamikaGHamilton/status/1227260078891253760
2020-02-10 20:09:26,TamikaGHamilton,littlemouse94bb,0,0,2,"Thank you!!!!!",,,,1226961391413792770,https://twitter.com/TamikaGHamilton/status/1226961391413792770
2020-02-09 22:04:47,TamikaGHamilton,BurgessOwens,0,2,6,"@BurgessOwens is correct. My husband is a peace officer and I stand up for the blue. @NYCMayor failure to protect his officers is nothing short of disgraceful.",,@BurgessOwens @NYCMayor,,1226628034167394304,https://twitter.com/TamikaGHamilton/status/1226628034167394304
2020-02-09 21:52:24,TamikaGHamilton,SonnieJohnson,3,11,18,"Social media influencers will not yield results. How many seats did we lose this far? I pray @parscale takes a chance on real people doing the work on the ground. Making videos and memes will never be enough for the blk vote. We need face/face after being ignored for so long. ",,@parscale,,1226624916402786304,https://twitter.com/TamikaGHamilton/status/1226624916402786304
2020-02-09 16:16:26,TamikaGHamilton,Reblyn1963,0,2,3,"Thank you for the love and support",,,,1226540368495173633,https://twitter.com/TamikaGHamilton/status/1226540368495173633
2020-02-09 15:56:44,TamikaGHamilton,,17,137,350,"I run for their future.",,,,1226535409603117056,https://twitter.com/TamikaGHamilton/status/1226535409603117056
2020-02-09 01:41:11,TamikaGHamilton,,2,31,56,"",,,,1226320105862098944,https://twitter.com/TamikaGHamilton/status/1226320105862098944
2020-02-08 22:39:37,TamikaGHamilton,rondeaulivia,0,0,2,"So need to do this!",,,,1226274411205971969,https://twitter.com/TamikaGHamilton/status/1226274411205971969
2020-02-08 21:15:25,TamikaGHamilton,IlhanMN,31,135,286,"As a member of Air Force for the past 16 years, this is an insult. The military receives this entitlement b/c of the sacrifice they make to this Nation. This ain’t it @IlhanMN but I will tell you more Jan 2021",,@IlhanMN,,1226253221200482304,https://twitter.com/TamikaGHamilton/status/1226253221200482304
2020-02-08 15:21:10,TamikaGHamilton,SonnieJohnson,0,0,5,"I can’t wait! Thank you Sonnie for paving the way for us.",,,,1226164073433157632,https://twitter.com/TamikaGHamilton/status/1226164073433157632
2020-02-08 05:10:07,TamikaGHamilton,GavinNewsom,3,3,36,"You will be amongst friends...nothing to see folks",,,,1226010297997000705,https://twitter.com/TamikaGHamilton/status/1226010297997000705
2020-02-06 05:15:15,TamikaGHamilton,TheBwoyDej,0,0,1,"No worries...but it’s still home",,,,1225286810844024833,https://twitter.com/TamikaGHamilton/status/1225286810844024833
2020-02-06 05:13:58,TamikaGHamilton,TheBwoyDej,1,0,2,"I’m in California now..but I’m originally from Maryland",,,,1225286491124879361,https://twitter.com/TamikaGHamilton/status/1225286491124879361
2020-02-06 05:11:45,TamikaGHamilton,JoyAnnReid,2,5,20,"Joy Reid: 'Trump's Benghazi' Joy Reid: ""Heartland - that sounds to a lot of people sort of like a dog whistle for white voters""",,,,1225285930308648960,https://twitter.com/TamikaGHamilton/status/1225285930308648960
2020-02-06 04:52:07,TamikaGHamilton,TheBwoyDej,1,0,0,"What county do you reside?",,,,1225280989343047681,https://twitter.com/TamikaGHamilton/status/1225280989343047681
2020-02-06 04:47:33,TamikaGHamilton,indiequick,2,0,5,"“girl”...What era is this again? Jim Crow? Slavery?",,,,1225279842112786434,https://twitter.com/TamikaGHamilton/status/1225279842112786434
2020-02-06 03:39:17,TamikaGHamilton,,12,112,158,"",,,,1225262661950001153,https://twitter.com/TamikaGHamilton/status/1225262661950001153
2020-02-06 01:02:11,TamikaGHamilton,GavinNewsom,1,11,54,"And how much did PG&E pay you and your wife? Asking for a friend",,,,1225223124544708608,https://twitter.com/TamikaGHamilton/status/1225223124544708608
2020-02-05 22:22:58,TamikaGHamilton,,10,97,267,"",,,,1225183059374309378,https://twitter.com/TamikaGHamilton/status/1225183059374309378
2020-02-05 22:14:22,TamikaGHamilton,Noah64753823,0,0,3,"Nay we are good",,,,1225180893796392960,https://twitter.com/TamikaGHamilton/status/1225180893796392960
2020-02-05 22:11:11,TamikaGHamilton,,14,73,246,"I’m a Maryland girl who grew up listening to go-go music. My family never talked about politics I didn’t walk off a plantation nor did I walk away from anything My message is simple, I’m fighting for my children’s freedom & District 3 We will make HISTORY #Tamika2020",,,#Tamika2020,1225180093988794368,https://twitter.com/TamikaGHamilton/status/1225180093988794368
2020-02-05 21:41:14,TamikaGHamilton,,9,34,130,"Utah come get your boy @MittRomney",,@MittRomney,,1225172557470396416,https://twitter.com/TamikaGHamilton/status/1225172557470396416
2020-02-05 21:29:31,TamikaGHamilton,SonnieJohnson,0,3,8,"Follow the money",,,,1225169608795029504,https://twitter.com/TamikaGHamilton/status/1225169608795029504
2020-02-05 15:01:42,TamikaGHamilton,boijingle,2,2,29,"Thank you! We are going to win",,,,1225072007672283136,https://twitter.com/TamikaGHamilton/status/1225072007672283136
2020-02-05 05:31:19,TamikaGHamilton,GavinNewsom,21,159,883,"Gavin please stop. I literally gasped...you can’t be serious. Your delusions amaze me. California is dying before our eyes.",,,,1224928468695048193,https://twitter.com/TamikaGHamilton/status/1224928468695048193
2020-02-05 05:25:17,TamikaGHamilton,,1,34,68,"@SpeakerPelosi theatrical performance earned a 0% rating on Rotten Tomatoes. You overplayed your hand tonight. I hope your voters took note. We need a new speaker...calling @GOPLeader",,@SpeakerPelosi @GOPLeader,,1224926949606227968,https://twitter.com/TamikaGHamilton/status/1224926949606227968
2020-02-04 23:42:02,TamikaGHamilton,lanik66,0,0,1,"Love them!",,,,1224840566770302976,https://twitter.com/TamikaGHamilton/status/1224840566770302976
2020-02-03 07:34:52,TamikaGHamilton,clabaugh_mark,2,0,2,"Thank you! We will make history. ",,,,1224234783816867840,https://twitter.com/TamikaGHamilton/status/1224234783816867840
2020-02-03 05:27:36,TamikaGHamilton,realDonaldTrump,26,48,156,"I’m running for Congress in California against John Garamendi. Let’s put California back on the map and close this 9% gap. http://www.votetamika.com",,,,1224202756723888128,https://twitter.com/TamikaGHamilton/status/1224202756723888128
2020-02-01 18:54:14,TamikaGHamilton,engyn243,1,0,3,"Tell them I said Thank You!",,,,1223680978280804352,https://twitter.com/TamikaGHamilton/status/1223680978280804352
2020-02-01 18:43:21,TamikaGHamilton,,5,33,62,"",,,,1223678238146252800,https://twitter.com/TamikaGHamilton/status/1223678238146252800
2020-01-31 17:57:45,TamikaGHamilton,BobbieBerta2,0,1,5,"Solano Republican Building!",,,,1223304372764831744,https://twitter.com/TamikaGHamilton/status/1223304372764831744
2020-01-31 15:46:34,TamikaGHamilton,,0,0,2,"@majorformayor I wish I could “like” this a million times....",,,,1223271362434715649,https://twitter.com/TamikaGHamilton/status/1223271362434715649
2020-01-30 21:20:43,TamikaGHamilton,Sar_kasm3,0,0,3,"Thank you ",,,,1222993064903376896,https://twitter.com/TamikaGHamilton/status/1222993064903376896
2020-01-29 22:19:11,TamikaGHamilton,pastorlocke,2,0,2,"Thank you a million times over!!!",,,,1222645388923899904,https://twitter.com/TamikaGHamilton/status/1222645388923899904
2020-01-29 22:15:49,TamikaGHamilton,BurgessOwens,4,30,103,"I can’t wait to serve w/you! Let’s get this win!",,,,1222644544010801152,https://twitter.com/TamikaGHamilton/status/1222644544010801152
2020-01-29 22:01:11,TamikaGHamilton,,16,198,496,"Thank you @BurgessOwens for coming to my district to support me! Your wisdom &amp; encouragement has been invaluable. See you soon",,@BurgessOwens,,1222640861919371265,https://twitter.com/TamikaGHamilton/status/1222640861919371265
2020-01-29 20:27:20,TamikaGHamilton,grybuck1,1,1,11,"I’m going to help candidates at the local level",,,,1222617244519165953,https://twitter.com/TamikaGHamilton/status/1222617244519165953
2020-01-29 20:26:34,TamikaGHamilton,JoesGarage11,1,0,1,"Wow! Could send me a DM with your email please",,,,1222617049190387712,https://twitter.com/TamikaGHamilton/status/1222617049190387712
2020-01-29 20:25:04,TamikaGHamilton,amanda_fawkes,1,0,3,"I’m glad you took the time to answer.",,,,1222616672927809536,https://twitter.com/TamikaGHamilton/status/1222616672927809536
2020-01-29 20:20:20,TamikaGHamilton,AnnieOa11193435,1,0,0,"Tell me why",,,,1222615482219429888,https://twitter.com/TamikaGHamilton/status/1222615482219429888
2020-01-29 20:19:21,TamikaGHamilton,msinz2,1,0,0,"Why, tell me",,,,1222615235565015040,https://twitter.com/TamikaGHamilton/status/1222615235565015040
2020-01-29 20:19:07,TamikaGHamilton,catchthecourtni,0,0,2,"Thank you for commenting",,,,1222615173799632901,https://twitter.com/TamikaGHamilton/status/1222615173799632901
2020-01-29 19:22:24,TamikaGHamilton,,40,59,141,"Is your life any better since Democrats have taken over California? Now is the time to express in the comments....",,,,1222600903913435136,https://twitter.com/TamikaGHamilton/status/1222600903913435136
2020-01-28 22:35:57,TamikaGHamilton,EleniForCA,14,48,90,"VOTE NO CALIFORNIA!",,,,1222287221656412160,https://twitter.com/TamikaGHamilton/status/1222287221656412160
2020-01-28 19:20:50,TamikaGHamilton,RepGaramendi,0,0,4,"The truth is coming",,,,1222238119245664256,https://twitter.com/TamikaGHamilton/status/1222238119245664256
2020-01-28 15:27:29,TamikaGHamilton,SeanTho06207623,3,0,1,"Where is your faith? ",,,,1222179394816368640,https://twitter.com/TamikaGHamilton/status/1222179394816368640
2020-01-28 15:21:43,TamikaGHamilton,,5,26,62,"This faux impeachment trial is such a bore. At least give us some entertainment if we must sit & watch our tax dollars go down the drain. I want to hear from the world’s most famous unqualified son of Vice President baby daddy, Hunter Biden! Give us Hunter! @JoeBiden",,@JoeBiden,,1222177944505683968,https://twitter.com/TamikaGHamilton/status/1222177944505683968
2020-01-27 19:01:19,TamikaGHamilton,RightyJim,0,0,1,"Exactly",,,,1221870819267108869,https://twitter.com/TamikaGHamilton/status/1221870819267108869
2020-01-27 18:56:51,TamikaGHamilton,GavinNewsom,10,9,145,"Gavin...where are your priorities?",,,,1221869697521446915,https://twitter.com/TamikaGHamilton/status/1221869697521446915
2020-01-25 20:09:58,TamikaGHamilton,nevets1352,1,0,4,"Steven we will connect. Thank you for the support!",,,,1221163322176757760,https://twitter.com/TamikaGHamilton/status/1221163322176757760
2020-01-24 15:06:50,TamikaGHamilton,LATiffani1,0,0,0,"Thank you Tiff!!",,,,1220724648196874247,https://twitter.com/TamikaGHamilton/status/1220724648196874247
2020-01-24 07:59:13,TamikaGHamilton,,60,249,583,"Late night thought... Instead of a candidate’s forum, we need a voter’s forum I want to know why people in @RepAdamSchiff district (CA-28) continue to vote for him Someone please set this up Asking for the Nation....",,@RepAdamSchiff,,1220617034678951936,https://twitter.com/TamikaGHamilton/status/1220617034678951936
2020-01-23 19:56:21,TamikaGHamilton,fleccas,0,0,1,"He and Jeb are in a strong tie....",,,,1220435116905979904,https://twitter.com/TamikaGHamilton/status/1220435116905979904
2020-01-23 15:48:54,TamikaGHamilton,,2,19,44,"40 days until the Primary election...it’s your time to be apart of the process. Volunteer in any capacity that you’re able.",,,,1220372847098380288,https://twitter.com/TamikaGHamilton/status/1220372847098380288
2020-01-20 06:07:36,TamikaGHamilton,,0,17,36,"For those who missed it, check out my interview with @SamShaneKFBK",,@SamShaneKFBK,,1219139393950085120,https://twitter.com/TamikaGHamilton/status/1219139393950085120
2020-01-18 17:03:18,TamikaGHamilton,conservelatino,2,1,1,"Anthony!!! Don’t start this morning...",,,,1218579628308066304,https://twitter.com/TamikaGHamilton/status/1218579628308066304
2020-01-18 14:50:54,TamikaGHamilton,,2,27,65,"The ppl of California say they’re mad about what’s happening to our beautiful state...but I can’t tell Disrupt the system",,,,1218546310476779520,https://twitter.com/TamikaGHamilton/status/1218546310476779520
