date,username,to,replies,retweets,favorites,text,geo,mentions,hashtags,id,permalink
2019-07-12 06:18:12,TamikaGHamilton,,1,6,26,"I dare @AOC @RashidaTlaib @IlhanMN to begin a discussion w/o saying,”women of color.” I get it, you want to deflect b/c you don’t know what your talking about half the time. Your making it hard for those who truly deal w/ racism? #desensitize",,@AOC @RashidaTlaib @IlhanMN,#desensitize,1149563592355614720,https://twitter.com/TamikaGHamilton/status/1149563592355614720
2019-07-11 17:30:35,TamikaGHamilton,GavinNewsom,1,1,4,"ANGEL FAMILIES ANGEL FAMILIES ANGEL FAMILIES ANGEL FAMILIES",,,,1149370415300542464,https://twitter.com/TamikaGHamilton/status/1149370415300542464
2019-07-11 16:14:43,TamikaGHamilton,GOPLeader,1,19,22,"The left will stop at nothing to weaken the defense of this country. Troops already live on meager wages. We are already experiencing a sharp decline in recruitment. Contact your local lawmaker to tell them to vote NO",,,,1149351320584769536,https://twitter.com/TamikaGHamilton/status/1149351320584769536
2019-07-11 14:31:20,TamikaGHamilton,realDailyWire,3,15,36,"Targeting people that broke the law. I want people to think about Angel Moms every time they want to feel sorry about raids. #angelmoms #Hamilton4Congress",,,#angelmoms #Hamilton4Congress,1149325302218162176,https://twitter.com/TamikaGHamilton/status/1149325302218162176
2019-07-11 04:50:37,TamikaGHamilton,StacyShafer6,0,0,0,"God Bless You..thank you so much",,,,1149179161384124416,https://twitter.com/TamikaGHamilton/status/1149179161384124416
2019-07-11 03:32:22,TamikaGHamilton,jonvoight,0,6,24,"Sir..I’m running for Congress in California. Please consider reaching back out to me. Need your support.",,,,1149159467402985472,https://twitter.com/TamikaGHamilton/status/1149159467402985472
2019-07-11 02:03:50,TamikaGHamilton,,3,19,35,"Great leaders never accept the world as it was and always work for the world as it should be ~Condoleezza Rice",,,,1149137190363885569,https://twitter.com/TamikaGHamilton/status/1149137190363885569
2019-07-11 01:18:36,TamikaGHamilton,jbirdpaulson,3,18,22,"This ..Seriously @GavinNewsom Do you know about this?",,@GavinNewsom,,1149125807660384256,https://twitter.com/TamikaGHamilton/status/1149125807660384256
2019-07-10 23:35:07,TamikaGHamilton,,1,16,36,"In terms of education, especially w/the fact that 75% of blk boys can’t pass a comprehensive reading test. We must remedy their home/community life. Parents need support too.",,,,1149099762597027840,https://twitter.com/TamikaGHamilton/status/1149099762597027840
2019-07-10 23:33:06,TamikaGHamilton,,17,57,112,"I can’t speak on the homeless enough. California is beginning to look 3rd world in major cities. Why don’t we invest the 21 billion in medical facilities? Some of the homeless are severely mentally ill.",,,,1149099257514737664,https://twitter.com/TamikaGHamilton/status/1149099257514737664
2019-07-10 13:27:44,TamikaGHamilton,,1,3,9,"Hollywood needs to swallow their pride and ask the President for help to free #ASAPROCKY. Go straight to @realDonaldTrump who has the power. Young ppl I hope your paying attention.",,@realDonaldTrump,#ASAPROCKY,1148946909639241728,https://twitter.com/TamikaGHamilton/status/1148946909639241728
2019-07-10 13:04:48,TamikaGHamilton,,11,7,14,"DHS was created b/c of 9/11 & now @AOC I’m her infinite wisdom wants to abolish it for pandering purposes. @SpeakerPelosi When will you reign this freshman in? Her thoughts are cancer to ppl who never read history.",,@AOC @SpeakerPelosi,,1148941138813845504,https://twitter.com/TamikaGHamilton/status/1148941138813845504
2019-07-10 12:48:55,TamikaGHamilton,,6,16,25,"So a Minnesota city council wants to oblige non citizens and remove the pledge of allegiance....what country do we live in again? #AmericaFirst #Hamilton4Congress #2020",,,#AmericaFirst #Hamilton4Congress,1148937143219212294,https://twitter.com/TamikaGHamilton/status/1148937143219212294
2019-07-10 06:10:35,TamikaGHamilton,AOC,0,0,4,"What about Angel Moms????? What about the Angel Moms?????!",,,,1148836896740560896,https://twitter.com/TamikaGHamilton/status/1148836896740560896
2019-07-10 05:35:27,TamikaGHamilton,GavinNewsom,1,0,8,"And you are fining Americans for not having insurance but giving illegals free healthcare...",,,,1148828055231614976,https://twitter.com/TamikaGHamilton/status/1148828055231614976
2019-07-10 05:29:33,TamikaGHamilton,,1,24,54,"Until every effort is exhausted to account for homeless veterans, I don’t want to hear about an illegal immigrant and their plight. 11k vets are on the streets of California right NOW. Lawmakers should be ashamed",,,,1148826571240804352,https://twitter.com/TamikaGHamilton/status/1148826571240804352
2019-07-10 05:22:13,TamikaGHamilton,GavinNewsom,0,6,22,"This is coming from the same administration that gave 1million licenses to illegals to drive. If you cared about the environment so much why would you add to the problem. Also I don’t see you helping black ppl get identification. Off topic but relevant.",,,,1148824724757106688,https://twitter.com/TamikaGHamilton/status/1148824724757106688
2019-07-10 01:42:06,TamikaGHamilton,Patrici15767099,0,2,4,"This ",,,,1148769331498512385,https://twitter.com/TamikaGHamilton/status/1148769331498512385
2019-07-10 01:40:10,TamikaGHamilton,EddieZipperer,0,0,2,"Based!",,,,1148768843839369216,https://twitter.com/TamikaGHamilton/status/1148768843839369216
2019-07-09 16:52:33,TamikaGHamilton,SenSchumer,3,12,20,"And what have you been doing? Why haven’t you done more work combatting sex trafficking as a whole? He’s one man but there thousands if not millions more like him. And let’s not forget the 80% of illegals who are molested/raped at the border",,,,1148636066707984385,https://twitter.com/TamikaGHamilton/status/1148636066707984385
2019-07-09 16:50:52,TamikaGHamilton,slothanova,0,0,1,"9/11",,,,1148635642533859328,https://twitter.com/TamikaGHamilton/status/1148635642533859328
2019-07-09 16:42:03,TamikaGHamilton,RealSaavedra,2,10,17,"This is what I am up against...we also need people to run against the leftists in office that pass these laws",,,,1148633423486914560,https://twitter.com/TamikaGHamilton/status/1148633423486914560
2019-07-09 16:26:38,TamikaGHamilton,StacyShafer6,1,0,0,"You are right..I stand corrected. The information is reading still supports sanctuary cities. So upsetting how the truth is suppressed",,,,1148629543512444928,https://twitter.com/TamikaGHamilton/status/1148629543512444928
2019-07-09 16:13:53,TamikaGHamilton,StacyShafer6,1,0,0,"Some cities in TX but Florida made it a state law so cities can’t do it.",,,,1148626333859061762,https://twitter.com/TamikaGHamilton/status/1148626333859061762
2019-07-09 15:30:57,TamikaGHamilton,,1,16,31,"Sanctuary State=Most human trafficking...when the numbers came out in Jan. FL, CA, and TX were reported the top 3. FL lawmakers worked tirelessly to sign a law to end sanctuary states, why not CA?Dems are flying illegals to TX & letting them flood the border",,,,1148615531261378560,https://twitter.com/TamikaGHamilton/status/1148615531261378560
2019-07-09 14:03:03,TamikaGHamilton,Buzzsaws1990,1,0,0,"It’s all up to the real Americans",,,,1148593409839550465,https://twitter.com/TamikaGHamilton/status/1148593409839550465
2019-07-09 14:02:38,TamikaGHamilton,SDNYnews,1,6,12,"This is only the beginning. I’m waiting for the full picture to be revealed. It’s not a coincidence that “sanctuary states” also have the highest percentage of sex trafficking. We must sanctuary states/cities",,,,1148593304319090688,https://twitter.com/TamikaGHamilton/status/1148593304319090688
2019-07-09 13:07:03,TamikaGHamilton,,2,12,9,"As you can see this has always been about power. They don’t want to help the American ppl. Justice Democrats & those aligned w/them must be stopped.",,,,1148579318097780736,https://twitter.com/TamikaGHamilton/status/1148579318097780736
2019-07-09 06:54:59,TamikaGHamilton,DailyCaller,0,1,0,"Please paying to see this woman.",,,,1148485685680017414,https://twitter.com/TamikaGHamilton/status/1148485685680017414
2019-07-09 06:48:26,TamikaGHamilton,,0,8,27,"Congress shouldn’t be giving themselves a raise if they haven’t solved any problems #Hamilton4Congress",,,#Hamilton4Congress,1148484033535365120,https://twitter.com/TamikaGHamilton/status/1148484033535365120
2019-07-09 06:33:22,TamikaGHamilton,VenturaReport,0,1,3,"Check out my latest interview....Also follow/RT/subscribe to @VenturaReport",,@VenturaReport,,1148480245030248448,https://twitter.com/TamikaGHamilton/status/1148480245030248448
2019-07-09 06:31:42,TamikaGHamilton,Beautful_Chaos,1,0,0,"Thank you Beautiful",,,,1148479822953238528,https://twitter.com/TamikaGHamilton/status/1148479822953238528
2019-07-09 06:30:57,TamikaGHamilton,thehill,5,10,16,"I see @SpeakerPelosi has taken a page out of @AOC @RashidaTlaib @IlhanMN book. When you have no argument just invoke racism. It’s not going to work in 2020. #Hamilton2020",,@SpeakerPelosi @AOC @RashidaTlaib @IlhanMN,#Hamilton2020,1148479633727217664,https://twitter.com/TamikaGHamilton/status/1148479633727217664
2019-07-09 01:34:36,TamikaGHamilton,,0,0,1,"@KamalaHarris wants the black vote so bad, she dreamt up a vanity proposal that will never pass. What’s your record on helping minorities in California? #kamkamcantwin #Hamilton2020",,@KamalaHarris,#kamkamcantwin #Hamilton2020,1148405057743757313,https://twitter.com/TamikaGHamilton/status/1148405057743757313
2019-07-09 01:30:54,TamikaGHamilton,,0,0,0,"@GavinNewsom and his democratic government found money to give themselves a raise but can’t find the money to place portable toilets near homeless encampments",,@GavinNewsom,,1148404124322418690,https://twitter.com/TamikaGHamilton/status/1148404124322418690
2019-07-08 23:31:46,TamikaGHamilton,DemocratsLying,1,0,1,"Very True",,,,1148374144204996609,https://twitter.com/TamikaGHamilton/status/1148374144204996609
2019-07-08 21:09:07,TamikaGHamilton,CalVic932,0,0,3,"Thank you so much",,,,1148338246616621061,https://twitter.com/TamikaGHamilton/status/1148338246616621061
2019-07-08 21:01:56,TamikaGHamilton,ericswalwell,1,7,20,"Yes we do need young conservative moms in Congress..#Hamilton4Congress",,,#Hamilton4Congress,1148336436237615104,https://twitter.com/TamikaGHamilton/status/1148336436237615104
2019-07-08 21:00:15,TamikaGHamilton,grgpetro,0,0,1," ",,,,1148336014521323520,https://twitter.com/TamikaGHamilton/status/1148336014521323520
2019-07-08 20:50:13,TamikaGHamilton,,2,17,19,"2/2 We must stop the exploitation of homeless workers. Where should they report non payment, so it can be investigated? Local police? I want to hear your thoughts?",,,,1148333488019402752,https://twitter.com/TamikaGHamilton/status/1148333488019402752
2019-07-08 20:47:47,TamikaGHamilton,,0,21,15,"1/2...Yesterday I was speaking to the homeless in Fairfield, CA. A gentleman named George told me some employers take advantage of the homeless. At times they were only paid partial wages after working a full week",,,,1148332878377263105,https://twitter.com/TamikaGHamilton/status/1148332878377263105
2019-07-08 17:48:01,TamikaGHamilton,,3,10,16,"We can do this! Check out these numbers...",,,,1148287636492046336,https://twitter.com/TamikaGHamilton/status/1148287636492046336
2019-07-08 17:45:07,TamikaGHamilton,,1,0,0,"John Garamendi",,,,1148286907832365056,https://twitter.com/TamikaGHamilton/status/1148286907832365056
2019-07-08 17:41:47,TamikaGHamilton,,4,40,80,"Here is what I stand for: Protecting the Constitution, will never sign anything that infringes on the right to bear arms, Pro-Life, secure our sovereign nation, Americans will never be 2nd, and find out where the $$$$is going",,,,1148286070452154368,https://twitter.com/TamikaGHamilton/status/1148286070452154368
2019-07-08 17:39:30,TamikaGHamilton,,0,2,7,"I hate that I can’t break the lines on twitter!! Let me try this again ",,,,1148285494221950976,https://twitter.com/TamikaGHamilton/status/1148285494221950976
2019-07-08 15:48:47,TamikaGHamilton,SaraCarterDC,3,18,35,"WHAT DID SHE DO FOR HER OWN PEOPLE IN CA? NOTHING! Ask the homeless/sex traffick victims/DACA what she did for them....Stop pandering. This will never happen",,,,1148257632643194881,https://twitter.com/TamikaGHamilton/status/1148257632643194881
2019-07-08 15:03:15,TamikaGHamilton,,20,80,197,"I come from a legacy of men who gave their life for this country. My grandfathers served in the Army. I continued this tradition by serving in the USAF. I gave 14 years active duty & currently 2 yrs reserve. Time to work for the 3rd District in Congress",,,,1148246170709319681,https://twitter.com/TamikaGHamilton/status/1148246170709319681
2019-07-08 14:25:58,TamikaGHamilton,CNN,2,22,28,"I read this trash and saw you tried to put Trump in the same breath as this monster. You should have added that @realDonaldTrump banned Epstein for LIFE from his properties. FAKE NEWS",,@realDonaldTrump,,1148236788520980480,https://twitter.com/TamikaGHamilton/status/1148236788520980480
2019-07-08 06:06:43,TamikaGHamilton,thedailybeast,0,7,22,"Finally! Justice for all the victims. May we brace for what’s ahead. This is just the beginning",,,,1148111148018888705,https://twitter.com/TamikaGHamilton/status/1148111148018888705
2019-07-08 05:58:09,TamikaGHamilton,gotyer6string,0,0,2,"Thank you for this advice. I will use it",,,,1148108991316152321,https://twitter.com/TamikaGHamilton/status/1148108991316152321
2019-07-08 05:57:51,TamikaGHamilton,,2,6,17,"Angel Moms are my priority @agnes_gibboney ...remember what we spoke about. I will never forget #HAMILTON2020 #USA",,@agnes_gibboney,#HAMILTON2020 #USA,1148108917529960448,https://twitter.com/TamikaGHamilton/status/1148108917529960448
2019-07-08 05:20:57,TamikaGHamilton,,1,18,33,"Turn California Red....it only takes a spark. #flipitred #hamilton4congress #2020",,,#flipitred #hamilton4congress,1148099633526108160,https://twitter.com/TamikaGHamilton/status/1148099633526108160
2019-07-08 05:00:41,TamikaGHamilton,,4,39,31,"Tell @realDonaldTrump @POTUS about me...Let’s get 1k retweets",,@realDonaldTrump @POTUS,,1148094530819780609,https://twitter.com/TamikaGHamilton/status/1148094530819780609
2019-07-08 04:58:43,TamikaGHamilton,KatBenson5,0,0,2,"Hi..the link is in my bio. My website is coming soon. Thank you so much for the support",,,,1148094035346612225,https://twitter.com/TamikaGHamilton/status/1148094035346612225
2019-07-08 04:47:44,TamikaGHamilton,TheLynchTone,1,0,2,"We are both right. Informing low info. voters, voter registration, and the list goes on and on. There is so much that could be done. I talk to so many ppl who don’t even know what’s going on. Trying to survive is all that’s on their mind. It’s truly sad",,,,1148091273435156485,https://twitter.com/TamikaGHamilton/status/1148091273435156485
2019-07-08 04:44:17,TamikaGHamilton,gotyer6string,2,0,3,"John Garamendi",,,,1148090405851783169,https://twitter.com/TamikaGHamilton/status/1148090405851783169
2019-07-08 04:40:55,TamikaGHamilton,,7,109,106,"I want the Nation to help me win this seat. Please spread the word by donating/RT/reposting. You don’t have to live in my district to support. Tell your nearest Republican about me as well. #hamilton4congress #2020",,,#hamilton4congress,1148089557146951682,https://twitter.com/TamikaGHamilton/status/1148089557146951682
2019-07-08 04:36:35,TamikaGHamilton,joycekennedy2,1,0,1,"Thank you but pray. Keep your money and take care of yourself. Just keep my family in your prayers. I appreciate your message and willingness to sacrifice.",,,,1148088465218629632,https://twitter.com/TamikaGHamilton/status/1148088465218629632
2019-07-08 04:18:21,TamikaGHamilton,,9,66,142,"When are we going to hold California lawmakers responsible for their inaction? The border, sex trafficking, homeless and high taxes. Find candidates and let’s support them.",,,,1148083878206115841,https://twitter.com/TamikaGHamilton/status/1148083878206115841
2019-07-08 04:07:53,TamikaGHamilton,,4,30,34,"Support my run for Congress. Donate to help me jump start my grassroots campaign. Link in bio #hamilton4congress #2020",,,#hamilton4congress,1148081245030498304,https://twitter.com/TamikaGHamilton/status/1148081245030498304
2019-07-08 03:57:07,TamikaGHamilton,joycekennedy2,0,0,1,"Republican",,,,1148078533190664192,https://twitter.com/TamikaGHamilton/status/1148078533190664192
2019-07-08 03:42:43,TamikaGHamilton,KamalaHarris,3,10,43,"You don’t speak for this black woman. While you were having a parade in SF, you were surrounded by the 7k homeless. Your actions are disgraceful to say the least. Charity begins at home. You are not fit to run a nation if you can’t run your state.",,,,1148074910016651265,https://twitter.com/TamikaGHamilton/status/1148074910016651265
2019-07-08 02:16:41,TamikaGHamilton,,31,87,181,"Most of all I’m running for Congress for my children. I want them to live free and die free. Pray for them as we embark on this journey. #hamilton4congress #2020 #Congress",,,#hamilton4congress #Congress,1148053260130848768,https://twitter.com/TamikaGHamilton/status/1148053260130848768
2019-07-06 06:07:36,TamikaGHamilton,EA_6Bjunkie,0,0,0,"I updated my profile a while ago. Thank you for thinking of protecting me.",,,,1147386596443881473,https://twitter.com/TamikaGHamilton/status/1147386596443881473
2019-07-06 02:52:45,TamikaGHamilton,Animalsmatter9,0,0,1,"God Bless you!",,,,1147337561234235392,https://twitter.com/TamikaGHamilton/status/1147337561234235392
2019-07-06 02:43:55,TamikaGHamilton,Animalsmatter9,1,0,1,"Thank you and keep telling people about my campaign",,,,1147335338899099650,https://twitter.com/TamikaGHamilton/status/1147335338899099650
2019-07-06 00:17:41,TamikaGHamilton,GavinNewsom,15,162,255,"I swear this is comedy....he’s taxing the hell out California and acts like he doesn’t know why people are broke.",,,,1147298537958305794,https://twitter.com/TamikaGHamilton/status/1147298537958305794
2019-07-05 23:59:47,TamikaGHamilton,VenturaReport,2,6,6,"Check out my latest interview with @VenturaReport",,@VenturaReport,,1147294029626822656,https://twitter.com/TamikaGHamilton/status/1147294029626822656
2019-07-05 14:51:46,TamikaGHamilton,JJ502877261,1,0,0,"No a woman raised with manners calls her elders, “Sir/Ma’am.” My grandfathers were Army Veterans, they raised me to have respect.",,,,1147156118629543936,https://twitter.com/TamikaGHamilton/status/1147156118629543936
2019-07-05 07:34:01,TamikaGHamilton,agnes_gibboney,0,0,1,"Likewise ...we will see eachother again soon",,,,1147045956786855937,https://twitter.com/TamikaGHamilton/status/1147045956786855937
2019-07-05 03:45:10,TamikaGHamilton,cattybitchwitch,0,0,1,"Thank you so much! And please tell your followers to RT and donate if they are able. I’m grassroots and I’m praying the President sees my effort. We can win!",,,,1146988361552293889,https://twitter.com/TamikaGHamilton/status/1146988361552293889
2019-07-05 03:36:27,TamikaGHamilton,realDonaldTrump,3,7,21,"Sir I’m running for Congress in California..come here for a rally",,,,1146986169038565376,https://twitter.com/TamikaGHamilton/status/1146986169038565376
2019-07-05 03:34:42,TamikaGHamilton,realDonaldTrump,0,2,13," ",,,,1146985729832022017,https://twitter.com/TamikaGHamilton/status/1146985729832022017
2019-07-04 17:01:24,TamikaGHamilton,JebBush,0,1,2,"I’m so disappointed in you. What are you implying? @SecretService , I know there are patriots that will protect the President",,@SecretService,,1146826354739965953,https://twitter.com/TamikaGHamilton/status/1146826354739965953
2019-07-04 07:14:37,TamikaGHamilton,RepSwalwell,1,1,17,"Hmmm I’m in the military and I would have loved to be involved in the parade. The military supports the President, regardless of party affiliation.",,,,1146678685526720513,https://twitter.com/TamikaGHamilton/status/1146678685526720513
2019-07-04 07:13:14,TamikaGHamilton,SenatorSinema,0,1,3,"Agreed!",,,,1146678337965740032,https://twitter.com/TamikaGHamilton/status/1146678337965740032
2019-07-04 07:10:58,TamikaGHamilton,BetteMidler,1,2,10,"I’m so excited! Thank you @realDonaldTrump",,@realDonaldTrump,,1146677765619367936,https://twitter.com/TamikaGHamilton/status/1146677765619367936
2019-07-03 00:22:48,TamikaGHamilton,,17,267,392,"While the left is pandering at the border, Angel Families are forgotten. I met this beautiful mom & took this video. Send her some love. I will never forget & I will use my platform to speak for them. @agnes_gibboney",,@agnes_gibboney,,1146212661438361601,https://twitter.com/TamikaGHamilton/status/1146212661438361601
2019-07-02 23:37:59,TamikaGHamilton,,3,17,65,"Why can’t our tax dollars go to priority housing to Veterans? @realDonaldTrump please check this on this. The VA doesn’t do enough",,@realDonaldTrump,,1146201382195585024,https://twitter.com/TamikaGHamilton/status/1146201382195585024
2019-07-02 20:19:47,TamikaGHamilton,wilson_yah,0,0,0,"You are right. My grandfather dies from ALS",,,,1146151503599529984,https://twitter.com/TamikaGHamilton/status/1146151503599529984
2019-07-02 20:19:07,TamikaGHamilton,WatchYourRepsSC,0,0,0,"Unfortunately it’s privatized..",,,,1146151334753685504,https://twitter.com/TamikaGHamilton/status/1146151334753685504
2019-07-02 19:59:38,TamikaGHamilton,,1,0,1,"I appreciate the comment but it’s not a requirement @TulsiGabbard is running for President and posts commercials/tweets in her uniform as well.",,@TulsiGabbard,,1146146433675849728,https://twitter.com/TamikaGHamilton/status/1146146433675849728
2019-07-02 19:23:03,TamikaGHamilton,lori_tech,0,0,1,"Yes! Antoine Tucker",,,,1146137226624954369,https://twitter.com/TamikaGHamilton/status/1146137226624954369
2019-07-02 19:09:37,TamikaGHamilton,,0,0,1,"@ali I stand with you",,@ali,,1146133843671281664,https://twitter.com/TamikaGHamilton/status/1146133843671281664
2019-07-02 18:28:23,TamikaGHamilton,RashidaTlaib,3,2,10,"Americans over Illegals...those people can go home. Their home countries are accountable. Why should Americans slave to take care of people that aren’t their own?",,,,1146123468347281408,https://twitter.com/TamikaGHamilton/status/1146123468347281408
2019-07-02 18:18:48,TamikaGHamilton,OsigahK,0,0,0," ",,,,1146121056056254464,https://twitter.com/TamikaGHamilton/status/1146121056056254464
2019-07-02 14:37:38,TamikaGHamilton,Justiceseek3r4u,0,0,0,"Thank you for the encouragement. We will win and support our president",,,,1146065396379688961,https://twitter.com/TamikaGHamilton/status/1146065396379688961
2019-07-02 14:34:42,TamikaGHamilton,KatBenson5,0,2,3,"I live here too and running for Congress. Spread the word",,,,1146064660568764416,https://twitter.com/TamikaGHamilton/status/1146064660568764416
2019-07-02 14:04:44,TamikaGHamilton,GrahamAllen_1,1,2,3,"This goes to show the demographic they aim to please....people know your history before they take away your freedom",,,,1146057118354591744,https://twitter.com/TamikaGHamilton/status/1146057118354591744
2019-07-02 13:52:49,TamikaGHamilton,,0,0,0,"@Nike When I heard you dropped Betsy Ross sneakers, I was stunned. It’s the flag, and slaves died for the flag in the civil war. Please consider donating the stock to myself and my district. I have children and homeless in need in CA",,@Nike,,1146054118739329025,https://twitter.com/TamikaGHamilton/status/1146054118739329025
2019-07-02 07:44:58,TamikaGHamilton,IlhanMN,1,6,15,"How about the pedophiles that roam on Twitter? How about calling out twitter for giving them a platform?! But you won’t cause you rather push this fake outrage narrative. You and @AOC have made it easy to vote for @realDonaldTrump",,@AOC @realDonaldTrump,,1145961548537454592,https://twitter.com/TamikaGHamilton/status/1145961548537454592
2019-07-02 06:57:20,TamikaGHamilton,SenKamalaHarris,0,2,10,"What about @MrAndyNgo????",,@MrAndyNgo,,1145949559379517440,https://twitter.com/TamikaGHamilton/status/1145949559379517440
2019-07-01 22:25:03,TamikaGHamilton,,0,10,21,"So only @AndrewYang is taking a lead on freedom of speech? If your not for upholding the constitution, you shouldn’t be running for President. @MrAndyNgo we stand with you.",,@AndrewYang @MrAndyNgo,,1145820638835163136,https://twitter.com/TamikaGHamilton/status/1145820638835163136
2019-07-01 20:15:51,TamikaGHamilton,momthruhh,0,0,0,"3rd",,,,1145788126989651968,https://twitter.com/TamikaGHamilton/status/1145788126989651968
2019-07-01 14:17:32,TamikaGHamilton,stillgray,0,24,47,"When I’m in Congress, this will get checked. #ANTIFA is a result of low IQ ppl who don’t understand our republic. And MSM that does speak on it are cowards as well...",,,#ANTIFA,1145697951215259648,https://twitter.com/TamikaGHamilton/status/1145697951215259648
2019-07-01 13:40:59,TamikaGHamilton,,1,12,10,"@nytimes &amp; @kcroninfurman should be ashamed of themselves for running a story about doxxing border patrol agents. Whose next, the military? Call Jane Fonda &amp; ask how that worked out for her",,@nytimes @kcroninfurman,,1145688753857368065,https://twitter.com/TamikaGHamilton/status/1145688753857368065
2019-07-01 13:15:22,TamikaGHamilton,AOC,0,1,6,"@SpeakerPelosi “glass of water with a D”",,@SpeakerPelosi,,1145682308810194950,https://twitter.com/TamikaGHamilton/status/1145682308810194950
2019-07-01 06:21:17,TamikaGHamilton,,1,42,61,"Help me defeat the establishment and take back California. One district at a time. Your donating to a grassroots campaign.",,,,1145578101578989568,https://twitter.com/TamikaGHamilton/status/1145578101578989568
2019-07-01 02:11:36,TamikaGHamilton,WCivility,1,0,1,"This!",,,,1145515263363670017,https://twitter.com/TamikaGHamilton/status/1145515263363670017
2019-07-01 02:09:19,TamikaGHamilton,GavinNewsom,0,0,12,"Gavin must have been looking at my Instagram...just spoke on our elderly the other night",,,,1145514690056818688,https://twitter.com/TamikaGHamilton/status/1145514690056818688
