date,username,to,replies,retweets,favorites,text,geo,mentions,hashtags,id,permalink
2020-02-16 00:34:50,vicki4senate,ShannonGroveCA,0,2,2,"I couldn’t agree more!",,,,1228840122763759617,https://twitter.com/vicki4senate/status/1228840122763759617
2020-02-14 03:58:16,vicki4senate,atensnut,0,0,0,"Senator Sanders so many politicians say this and my question is are you a millionaire or billionaire and do you give your money away? Hard working middle class citizens want answers not more government control and free stuff!",,,,1228166542749102080,https://twitter.com/vicki4senate/status/1228166542749102080
2020-02-05 05:43:23,vicki4senate,ShannonGroveCA,1,1,3,"Many independent contractors who need/choose flexible schedules have been impacted by this less than thought through bill. I support the need to change AB5.",,,,1224931503093608449,https://twitter.com/vicki4senate/status/1224931503093608449
2020-01-20 17:38:29,vicki4senate,,0,1,3,"Thank you Mr. President. Right to Pray in Public Schools President Trump announcement: full video https://youtu.be/FvS1ShJrs6o via @YouTube",,@YouTube,,1219313261146820609,https://twitter.com/vicki4senate/status/1219313261146820609
2020-01-19 16:43:04,vicki4senate,ShannonGroveCA,0,1,1,"AB5 has not brought solutions, but it has created new problems for many independent contractors in CA.#FixAB5 #AB5#Vicki4Senate",,,#FixAB5,1218936927065231360,https://twitter.com/vicki4senate/status/1218936927065231360
2020-01-19 16:37:26,vicki4senate,ShannonGroveCA,0,0,0,"Congratulations to the beautiful bride, to you, and your family.",,,,1218935506425110528,https://twitter.com/vicki4senate/status/1218935506425110528
2020-01-14 05:46:28,vicki4senate,ShannonGroveCA,0,0,1,"I fully agree.",,,,1216959749188505600,https://twitter.com/vicki4senate/status/1216959749188505600
2019-12-23 16:32:10,vicki4senate,TheRealJohnHCox,0,0,0,"Gavins solution..attack Trump admin because they won’t pay for the mess he enabled! CA we can do better.",,,,1209149708918243329,https://twitter.com/vicki4senate/status/1209149708918243329
2019-12-23 16:26:00,vicki4senate,,0,0,0,"https://twitter.com/R3Thorns/status/1208373752398012418",,,,1209148157453455362,https://twitter.com/vicki4senate/status/1209148157453455362
2019-12-23 16:23:57,vicki4senate,,0,0,0,"Neighborly love and service at its best. #CAChristmasSpirit",,,#CAChristmasSpirit,1209147641155608576,https://twitter.com/vicki4senate/status/1209147641155608576
2019-12-20 18:28:47,vicki4senate,,0,0,0,"Amazing precision and oneness of movement! Unified. 2016 VIT HD TOP SECRET DRUM CORPS https://youtu.be/kd8UXijXtqM via @YouTube",,@YouTube,,1208091892132352001,https://twitter.com/vicki4senate/status/1208091892132352001
2019-12-20 18:20:44,vicki4senate,JoelNBCLA,0,0,1,"As we acknowledge the crisis let’s engage and put lasting solutions to work. Mental health and public safety are priority.",,,,1208089870372986880,https://twitter.com/vicki4senate/status/1208089870372986880
2019-12-19 14:32:52,vicki4senate,,0,0,0,"Enjoy the sounds of Christmas! Hear the new beat. Christmas! for KING & COUNTRY - ""Little Drummer Boy"" | Live from CMA Country Christmas https://youtu.be/fPcA4bQjWFw via @YouTube",,@YouTube,,1207670136083079168,https://twitter.com/vicki4senate/status/1207670136083079168
2019-12-06 01:10:55,vicki4senate,,0,0,1,"Today's the day! I filed for candidacy in #MontereyCounty. Proud to swear an oath to uphold our Constitution and honored to work towards representing our region. Are you ready for change in California? Get involved and donate here: http://www.vicki4senate.com/donate #CASenateDistrict17",,,#MontereyCounty #CASenateDistrict17,1202757274810273792,https://twitter.com/vicki4senate/status/1202757274810273792
2019-11-29 07:30:22,vicki4senate,senatormelendez,1,1,1,"Bloomberg regarding more taxes... Tax the poor that’s how they can be controlled and conform... NO I don’t think that’s what the people want #Nonsense",,,#Nonsense,1200316054125174784,https://twitter.com/vicki4senate/status/1200316054125174784
2019-11-29 07:24:37,vicki4senate,,0,1,1,"President Trump issues proclamation honoring God on Thanksgiving Day https://metrovoicenews.com/president-trump-issues-proclamation-honoring-god-on-thanksgiving-day/ via @metrovoice#thankful",,@MetroVoice,,1200314606444376065,https://twitter.com/vicki4senate/status/1200314606444376065
2019-11-26 22:20:59,vicki4senate,,0,1,1,"How do you like the direction California is headed? Looking to send a message to Sacramento? Vote for Vicki Nohrden!#SenateDistrict17 #Vicki4Senate #Vickiwillfight4you!",,,#SenateDistrict17 #Vicki4Senate #Vickiwillfight4you,1199453020934660097,https://twitter.com/vicki4senate/status/1199453020934660097
2019-11-24 17:28:54,vicki4senate,GregGutfeldShow,0,0,0,"A little humor....",,,,1198654738633388032,https://twitter.com/vicki4senate/status/1198654738633388032
2019-11-21 07:17:36,vicki4senate,ShannonGroveCA,1,2,5,"Governor Newsome what’s your plan? Power outages not going over too well ..30 some counties without power. Not to mention the redirecting of the gas tax. People are madd, are you listening? Time to do something! I’m willing to work with you. #CASenate District 17#Vicki Nohrden",,,#CASenate,1197413735838519298,https://twitter.com/vicki4senate/status/1197413735838519298
2019-11-21 07:08:20,vicki4senate,joncoupal,0,2,3,"So very sad,but unfortunately true. Time for real change in California. #vicki4senate#CASenateDistrict17#VickiNohrden",,,,1197411405009281025,https://twitter.com/vicki4senate/status/1197411405009281025
2019-11-11 00:51:33,vicki4senate,charliekirk11,0,0,2," ",,,,1193692705588596741,https://twitter.com/vicki4senate/status/1193692705588596741
2019-11-11 00:50:26,vicki4senate,DineshDSouza,0,0,2,"Exactly!",,,,1193692425891434497,https://twitter.com/vicki4senate/status/1193692425891434497
2019-11-11 00:49:59,vicki4senate,charliekirk11,0,0,3,"Sad. She wasn’t there for us when she was the CA Attorney General either.",,,,1193692310107590658,https://twitter.com/vicki4senate/status/1193692310107590658
2019-11-11 00:46:29,vicki4senate,charliekirk11,0,0,1,"Looks like assault to me!",,,,1193691431640059904,https://twitter.com/vicki4senate/status/1193691431640059904
2019-11-06 17:29:30,vicki4senate,,0,1,0,"It’s filing day! I’m excited to be running for change in California and for all the people in #CASenateDistrict17 who are standing behind me. Let’s make some change!",,,#CASenateDistrict17,1192131908768944128,https://twitter.com/vicki4senate/status/1192131908768944128
2019-11-02 04:21:30,vicki4senate,,0,0,1,"Help Senator Mike Morrell Support Parent's Rights to be involved in their Children's Education --Support SB 673 which amends AB 329 (CHYA) - Sign the Petition! http://chng.it/FPXyRWKy via @Change#vicki4senate",,@Change,,1190484050408026113,https://twitter.com/vicki4senate/status/1190484050408026113
2019-10-24 14:56:13,vicki4senate,DujelindaMz,0,0,1,"Only problem they keep shutting off the power!!",,,,1187382290181025797,https://twitter.com/vicki4senate/status/1187382290181025797
2019-10-24 14:51:13,vicki4senate,,0,1,1,"Is this becoming the new normal? Not good. California-Reno fuel pipeline shut down again due to power outage https://foxreno.com/news/local/california-reno-fuel-pipeline-shut-down-again-due-to-power-outage #CAshutdown#Vicki4senate#reformca",,,,1187381035085881350,https://twitter.com/vicki4senate/status/1187381035085881350
2019-10-23 16:13:56,vicki4senate,ABC7,0,0,0,"Hint, take a look at CA policies and the newest gas tax you imposed! #Vicki4senate",,,#Vicki4senate,1187039461743321089,https://twitter.com/vicki4senate/status/1187039461743321089
2019-10-23 02:17:34,vicki4senate,,0,1,3,"Did you read @carmelpinecone this week? You might have seen a familiar face on Pg 8... I'm excited to share why I'm running for Senate District 17, excited to change the direction our state is going. Will you join me? http://pineconearchive.fileburstcdn.com/191018PCA.pdf #Vicki4Senate #Change4CA #CASenate",,@carmelpinecone,#Vicki4Senate #Change4CA #CASenate,1186828984169844736,https://twitter.com/vicki4senate/status/1186828984169844736
2019-10-17 15:27:03,vicki4senate,joncoupal,0,0,1,"California is facing a crisis from homelessness to mental health from skyrocketing living costs, rising crime to failing education. Time for real solutions. #CAtruth",,,#CAtruth,1184853337591562240,https://twitter.com/vicki4senate/status/1184853337591562240
2019-10-17 15:13:02,vicki4senate,HJTA,0,1,1,"#ProptectProp13",,,#ProptectProp13,1184849807652732931,https://twitter.com/vicki4senate/status/1184849807652732931
2019-10-17 15:11:27,vicki4senate,millanpatterson,0,0,0,"California is waking up. The one party rule is failing the state. #CAtruth",,,#CAtruth,1184849410481483776,https://twitter.com/vicki4senate/status/1184849410481483776
2019-09-30 16:21:42,vicki4senate,RudyGiuliani,1,0,2,"We have to learn, at least be willing to listen to the real story not media narratives!",,,,1178706497280196613,https://twitter.com/vicki4senate/status/1178706497280196613
2019-09-30 16:14:25,vicki4senate,charliekirk11,0,0,0,"Disgraceful!",,,,1178704661257129984,https://twitter.com/vicki4senate/status/1178704661257129984
2019-09-09 19:54:19,vicki4senate,,0,1,1,"Californians more Gas Tax? #taxtaxtax https://www.sacbee.com/news/nation-world/national/article234762262.html?",,,#taxtaxtax,1171149856188112896,https://twitter.com/vicki4senate/status/1171149856188112896
2019-09-01 00:21:43,vicki4senate,gjandrews,0,1,2,"The people are chanting, ""You are not representing California for all."" Suppose their tired of no representation that they have to come all the way to Sacramento to have their voice heard? The other question is are they representing you and your values?#FreedomOfSpeech",,,#FreedomOfSpeech,1167955660564090888,https://twitter.com/vicki4senate/status/1167955660564090888
2019-08-28 01:23:10,vicki4senate,,1,1,1,"California Assembly approves measure to lower voting age to 17. The question is, ""Where oh where has the common sense gone? Should California lower the voting age to 17? Why or why not?http://www.abc10.com/article/news/politics/california-assembly-approves-measure-to-lower-voting-age-to-17/103-928489a7-0407-4c31-a712-9bd367db05de via @ABC10",,@ABC10,,1166521572003201024,https://twitter.com/vicki4senate/status/1166521572003201024
2019-08-27 08:40:20,vicki4senate,,0,1,1,"New group launches to warn young people about socialism#stopsocialism",,,,1166269202346307584,https://twitter.com/vicki4senate/status/1166269202346307584
2019-08-21 07:23:14,vicki4senate,,0,0,1,"Famed San Francisco Truffle Shop Owner Attacked By Homeless Man, Saved By Son",,,,1164075470842765312,https://twitter.com/vicki4senate/status/1164075470842765312
2019-08-19 22:58:15,vicki4senate,,0,2,2,"I'm running for CA Senate District 17. This Senate race will have major consequences for the future especially the way the Democratic Party is creeping towards socialism from housing to roads, healthcare to energy and education policies. Partner w/me.https://secure.anedot.com/nohrden-for-senate-2020/donate?fbclid=IwAR1PbgHIuNYWm0266y_5JCkTci7oqPumg_VAMUVsNkTsMlpMoB45hW0v_88",,,,1163586000922140672,https://twitter.com/vicki4senate/status/1163586000922140672
2019-08-17 19:23:39,vicki4senate,,1,1,1,"What's the Deal with the Green New Deal?",,,,1162807217940135936,https://twitter.com/vicki4senate/status/1162807217940135936
2019-07-31 12:30:58,vicki4senate,supitsshekinah,0,0,0,"And it’s ok to be real..",,,,1156542768405069824,https://twitter.com/vicki4senate/status/1156542768405069824
2019-07-31 12:08:00,vicki4senate,WhiteHouse,0,0,1,"Thank you @WhiteHouse@TheRealDonaldTrump for Remembering the builders of our foundation. God bless America@wisdombuilds.",,,,1156536990214475777,https://twitter.com/vicki4senate/status/1156536990214475777
2019-07-30 00:47:23,vicki4senate,pnjaban,1,1,1,"We need to stop looking the other way at lawless behavior.",,,,1156003321171214336,https://twitter.com/vicki4senate/status/1156003321171214336
2019-07-30 00:43:39,vicki4senate,,0,1,1,"High-speed rail route took land from farmers. The money they’re owed hasn’t arrived https://www.latimes.com/local/california/la-me-bullet-train-cash-20190610-story.html@CAfarmers@Anyonelistening@Fifthlargesteconomy@greenewdeal@CAGOP",,,,1156002379298328581,https://twitter.com/vicki4senate/status/1156002379298328581
2019-07-27 16:53:15,vicki4senate,DineshDSouza,0,0,0,"Good point!",,,,1155159224642490369,https://twitter.com/vicki4senate/status/1155159224642490369
2019-07-26 21:10:17,vicki4senate,,0,0,0,"Just made a donation to Santa Cruz GOP https://www.santacruzrepublicans.com/sccrccbbq2019?recruiter_id=5963",,,,1154861521408843776,https://twitter.com/vicki4senate/status/1154861521408843776
2019-07-25 14:14:03,vicki4senate,,0,0,0,"#Californiacandobetter#CAsolutions#HomelessinCA#Time4RealSolutions Hear Mayor Steinberg call on California to declare homeless a right to shelter",,,,1154394382902026240,https://twitter.com/vicki4senate/status/1154394382902026240
2019-07-15 06:00:21,vicki4senate,realDonaldTrump,0,0,1,"United we stand divided we fall. Consider where you want to live. I’ve travelled many third world nations and not one shines like America. Why? We r one nation under God. Stop the labeling, name calling and unedifying comments.. our children are watching ",,,,1150646263492173824,https://twitter.com/vicki4senate/status/1150646263492173824
2019-06-30 16:25:29,vicki4senate,ShannonGroveCA,0,0,0,"A reminder to all of us your vote is important in every election. Yes on 6 to stop the gas tax could have saved every taxpayer these coming increases. Thank you Senator Grove for speaking up.",,,,1145367764917350401,https://twitter.com/vicki4senate/status/1145367764917350401
2019-06-30 16:11:07,vicki4senate,PressSec,0,0,0,"Sarah you are an amazing woman and you did an amazing job. All the best.",,,,1145364150341623808,https://twitter.com/vicki4senate/status/1145364150341623808
2019-06-18 15:41:11,vicki4senate,capoliticalnews,0,0,0,"Justice obstructing justice.",,,,1141007961248059392,https://twitter.com/vicki4senate/status/1141007961248059392
2019-06-18 15:37:00,vicki4senate,GOP,0,0,1,"Agreed!",,,,1141006909417259013,https://twitter.com/vicki4senate/status/1141006909417259013
2019-06-15 04:49:26,vicki4senate,,0,0,0,"Christian School Raided By CA Gov't. David Lynn Arrested. Christian Bake... https://youtu.be/yItWlHlZxYQ via @YouTube",,@YouTube,,1139756778185379847,https://twitter.com/vicki4senate/status/1139756778185379847
2019-06-14 15:28:29,vicki4senate,,0,0,0,"@POTUS Happy Birthday Mr. President. You are celebrated and remembered today. I hope you enjoy a day of celebration for you and your family.",,@POTUS,,1139555213855997952,https://twitter.com/vicki4senate/status/1139555213855997952
2019-06-14 15:05:16,vicki4senate,RoxanneForAD46,1,0,0,"What was the final outcome?",,,,1139549372239118336,https://twitter.com/vicki4senate/status/1139549372239118336
2019-06-14 15:03:48,vicki4senate,GOP,0,0,0,"America awaken!",,,,1139549001022185472,https://twitter.com/vicki4senate/status/1139549001022185472
2019-06-14 15:03:04,vicki4senate,,0,0,0,"Communism Expert on What’s Behind the Push for Open Borders https://www.theepochtimes.com/communism-expert-on-whats-behind-the-push-for-open-borders_2941964.html via @epochtimes",,@EpochTimes,,1139548818179907585,https://twitter.com/vicki4senate/status/1139548818179907585
2019-06-10 16:31:28,vicki4senate,charliekirk11,0,0,0,"I fully support education not indoctrination. Home school education is needed.",,,,1138121510596489217,https://twitter.com/vicki4senate/status/1138121510596489217
2019-06-10 16:30:15,vicki4senate,RoxanneForAD46,0,0,0,"There’s a saying, “whatever you tolerate will dominate.” We need real solutions!",,,,1138121207620952064,https://twitter.com/vicki4senate/status/1138121207620952064
2019-06-10 16:28:46,vicki4senate,,0,0,0,"Ep. 85 - Why Are There So Many Mass Shootings?",,,,1138120834256531456,https://twitter.com/vicki4senate/status/1138120834256531456
2019-06-09 15:26:06,vicki4senate,JudgeJeanine,0,0,1,"And so glad he did. Expecting him to complete his course of both terms!",,,,1137742676067999744,https://twitter.com/vicki4senate/status/1137742676067999744
2019-06-09 15:24:53,vicki4senate,DestinHall,0,0,1,"Time for awakening and change in state governments across our nation.",,,,1137742367455232000,https://twitter.com/vicki4senate/status/1137742367455232000
2019-06-06 15:17:35,vicki4senate,realDonaldTrump,0,1,1,"Giving honor where honor is due.",,,,1136653366933590018,https://twitter.com/vicki4senate/status/1136653366933590018
2019-05-24 17:14:22,vicki4senate,,0,1,1,"California let your voice be heard#no socialized healthcare. Rep. Jimmy Panetta, officials advocate for health care legislation",,,,1131971715892776960,https://twitter.com/vicki4senate/status/1131971715892776960
2019-05-24 01:38:48,vicki4senate,realDonaldTrump,0,0,0,"My concern is it’s a real witch engaged in the process pushing it. Pray for our President. Enough is enough!",,,,1131736273620688896,https://twitter.com/vicki4senate/status/1131736273620688896
2019-05-24 01:35:34,vicki4senate,realDonaldTrump,0,0,0,"I think they actually earned it!",,,,1131735456859582465,https://twitter.com/vicki4senate/status/1131735456859582465
2019-05-23 04:57:14,vicki4senate,,0,0,2,"The War on Children: The Comprehensive Sexuality Education Agenda - 11 mins https://youtu.be/6yTvdCHgEHQ via @YouTube#helloparents",,@YouTube,,1131423821125246976,https://twitter.com/vicki4senate/status/1131423821125246976
2019-05-17 16:54:08,vicki4senate,AsmLuzRivas,1,1,2,"I don’t think our government should be advocating for business using abortion as their lure! Out of order. #Think again California.",,,#Think,1129429905836367872,https://twitter.com/vicki4senate/status/1129429905836367872
2019-05-10 13:59:33,vicki4senate,,0,0,0,"California Senate: Oppose the New Bill passed that would keep Trumps name off of the 2020 Ballot - Sign the Petition! http://chng.it/vVqVkWk2 via @Change",,@Change,,1126849256059392001,https://twitter.com/vicki4senate/status/1126849256059392001
2019-05-07 15:46:30,vicki4senate,,0,0,0,"John MacArthur exposes the root “We will not bow” https://youtu.be/OePlT2wZA5s via @YouTube",,@YouTube,,1125789008892555265,https://twitter.com/vicki4senate/status/1125789008892555265
2019-04-23 14:51:33,vicki4senate,dutchsheets,0,0,0,"Agree.",,,,1120701750204198914,https://twitter.com/vicki4senate/status/1120701750204198914
2019-04-23 14:50:49,vicki4senate,,0,1,1,"This is a time to believe the word of the Lord and not be shaken. Do not quit, do not back up. Press the battle to the full, and you’ll see heaven fight for you. The Hidden Enemy Revealed | Rabshakeh - Flow Prophetic",,,,1120701566808285184,https://twitter.com/vicki4senate/status/1120701566808285184
2019-04-01 16:06:37,vicki4senate,BarbieBreathitt,0,0,0,"So sorry to hear. Praying for wisdom and healing.",,,,1112748109153472515,https://twitter.com/vicki4senate/status/1112748109153472515
2019-04-01 16:03:11,vicki4senate,thehill,0,0,0,"Time to put your faith in truth and move on.",,,,1112747245638541312,https://twitter.com/vicki4senate/status/1112747245638541312
2019-04-01 16:01:39,vicki4senate,FLOTUS,0,0,0,"A time to enjoy the beauty",,,,1112746858374266880,https://twitter.com/vicki4senate/status/1112746858374266880
2019-03-31 12:34:17,vicki4senate,SecNielsen,0,0,0,"Clear!",,,,1112332286698020864,https://twitter.com/vicki4senate/status/1112332286698020864
2019-03-31 12:33:44,vicki4senate,GrahamAllen_1,0,0,0,"Truth suspended!",,,,1112332145593245697,https://twitter.com/vicki4senate/status/1112332145593245697
2019-03-31 12:33:05,vicki4senate,JudgeJeanine,0,0,0,"True justice. Expose, arrest and bring to justice those behind the scenes even if it’s those politicians who pointed the finger!",,,,1112331981512007680,https://twitter.com/vicki4senate/status/1112331981512007680
2019-03-31 12:30:53,vicki4senate,Cap_Institute,0,0,0,"What?",,,,1112331429982027776,https://twitter.com/vicki4senate/status/1112331429982027776
2019-03-31 12:30:01,vicki4senate,,0,0,0,"Who Are the Rich, White Men Institutionalizing Transgender Ideology? https://thefederalist.com/2018/02/20/rich-white-men-institutionalizing-transgender-ideology/#.XKCyu2ISLkg.twitter",,,,1112331209403564033,https://twitter.com/vicki4senate/status/1112331209403564033
2019-03-29 16:40:26,vicki4senate,capoliticalnews,0,0,0,"Racism divides and destroys. Not a good choice.",,,,1111669452817391616,https://twitter.com/vicki4senate/status/1111669452817391616
2019-03-26 04:44:32,vicki4senate,PatrickHussion,0,1,1,"Welcome President Trump.",,,,1110402129112387585,https://twitter.com/vicki4senate/status/1110402129112387585
2019-03-26 04:39:19,vicki4senate,capoliticalnews,0,0,0,"America wake up!",,,,1110400815812866048,https://twitter.com/vicki4senate/status/1110400815812866048
2019-03-17 16:53:00,vicki4senate,charliekirk11,0,0,0,"Finish the wall.",,,,1107323962873139200,https://twitter.com/vicki4senate/status/1107323962873139200
2019-03-17 16:52:33,vicki4senate,dutchsheets,0,0,8,"Happy Birthday Dutch.",,,,1107323847970181122,https://twitter.com/vicki4senate/status/1107323847970181122
2019-03-17 16:50:42,vicki4senate,,0,0,0,"The Candace Owens Show: Paris Dennard https://www.prageru.com/video/the-candace-owens-show-paris-dennard/",,,,1107323385179066368,https://twitter.com/vicki4senate/status/1107323385179066368
2019-03-13 17:11:24,vicki4senate,GavinNewsom,0,2,2,"Governor Newsome we need to return to common sense. We do need immigration reform but you have to fix the hole in the roof before you decorate the room. Build the wall.",,,,1105879039888154626,https://twitter.com/vicki4senate/status/1105879039888154626
2019-03-13 17:08:26,vicki4senate,CAGOP,0,0,0,"Time for a Turnaround. This is my home I don’t plan to leave. Standing up for freedom to see the change.",,,,1105878296808456192,https://twitter.com/vicki4senate/status/1105878296808456192
2019-03-07 05:03:47,vicki4senate,DeepStateExpose,0,0,6,"Incoherent",,,,1103521605865488384,https://twitter.com/vicki4senate/status/1103521605865488384
2019-03-07 05:01:53,vicki4senate,GrahamAllen_1,0,0,0,"No",,,,1103521124069957633,https://twitter.com/vicki4senate/status/1103521124069957633
2019-03-07 04:56:48,vicki4senate,,0,0,0,"Senator @tedcruz has a plan to build @realdonaldtrump's wall and make El Chapo pay for it... Join the fight to #BuildTheWall and support Ted's #ELCHAPOAct: https://action.tedcruz.org/el-chapo/ #TXSen https://twitter.com",,@tedcruz @realDonaldTrump,#BuildTheWall #ELCHAPOAct #TXSen,1103519845117616128,https://twitter.com/vicki4senate/status/1103519845117616128
2019-03-07 04:56:11,vicki4senate,thehill,1,0,0,"Don’t ask don’t tell...",,,,1103519690733678597,https://twitter.com/vicki4senate/status/1103519690733678597
2019-03-07 04:53:29,vicki4senate,JerryFalwellJr,0,0,0,"The rest of the real story!",,,,1103519010094645254,https://twitter.com/vicki4senate/status/1103519010094645254
2019-03-07 04:48:58,vicki4senate,charliekirk11,0,0,0," ",,,,1103517873438318593,https://twitter.com/vicki4senate/status/1103517873438318593
2019-03-04 06:06:10,vicki4senate,,0,0,0,"In case your wondering...RENEGADE STATE: The Four Families Of California And The Private Company ... https://youtu.be/epyIYc_7hbM via @YouTube",,@YouTube,,1102450141322108928,https://twitter.com/vicki4senate/status/1102450141322108928
2019-03-03 21:07:48,vicki4senate,,0,0,0,"https://spectator.org/everyone-is-smart-except-trump/",,,,1102314656498999296,https://twitter.com/vicki4senate/status/1102314656498999296
