date,username,to,replies,retweets,favorites,text,geo,mentions,hashtags,id,permalink
2019-08-26 16:25:07,votebrownrigg,,0,0,1,"Great to get away for a couple of breathtaking days hiking in Yosemite. Being here always reminds me of the value of independence, foresight, determination and good public policy — thank you John Muir, thank you Teddy Roosevelt.",,,,1166023781179166721,https://twitter.com/votebrownrigg/status/1166023781179166721
2019-08-23 22:03:10,votebrownrigg,,7,1,3,"Every community on the Peninsula is different and solutions are never one size fits all. I get it. As your state senator, I’ll get it done for you with local solutions to the issues you and your neighbors are facing. Ones that work for your community—not for Sacramento.",,,,1165021689475948544,https://twitter.com/votebrownrigg/status/1165021689475948544
2019-08-23 17:01:51,votebrownrigg,,1,0,2,"Honored to announce that #TeamBrownrigg has racked up 640 community endorsers! Since Day 1, I wanted to run a people-powered grassroots movement that listens to the issues facing you and your families &amp; gets solutions. Thank you for your trust, confidence, and support!",,,#TeamBrownrigg,1164945860972728320,https://twitter.com/votebrownrigg/status/1164945860972728320
2019-08-21 20:27:11,votebrownrigg,,0,0,0,"",,,,1164272759494647810,https://twitter.com/votebrownrigg/status/1164272759494647810
2019-08-21 20:25:04,votebrownrigg,,1,0,0,"those issues. Every neighborhood is different and being a Neighborhood State Senator, means making sure your unique issues are heard. It also means being your voice in Sacramento in a way that gets results for you and your community.",,,,1164272227426004993,https://twitter.com/votebrownrigg/status/1164272227426004993
2019-08-21 20:11:55,votebrownrigg,,1,1,3,"Lots of folks ask me, “so what exactly IS a neighborhood state senator?” I tell them it means going into every community in our district to listen—to really hear your concerns and the issues facing you and your neighbors— and to talk about the way we can work together to solve",,,,1164268915826077696,https://twitter.com/votebrownrigg/status/1164268915826077696
2019-08-20 23:27:18,votebrownrigg,,0,2,3,"Thanks to David Lewis of Save the Bay, and Supervisor David Pine for their leadership, and shout outs to East Palo Alto Mayor Lisa Gauthier, Redwood City community leader Dan Ponti and Green Foothills ED Megan Fluke for sharing their personal and professional perspectives.",,,,1163955698012700672,https://twitter.com/votebrownrigg/status/1163955698012700672
2019-08-20 23:27:16,votebrownrigg,,1,1,2,"and without paving over endangered habitat. These natural tidal lands need to be preserved, not least as a natural breakwater against sea level rise. Calling on every candidate for state senate to stand with the environment and against deep pocketed developers.",,,,1163955690211356678,https://twitter.com/votebrownrigg/status/1163955690211356678
2019-08-20 23:27:16,votebrownrigg,,1,2,4,"Proud to join 60 electeds, community leaders & environmental groups protesting development of these beautiful baylands outside of Redwood City. Yes, we need more housing & cities need to deliver it. But we can do it closer to transit — as we have under my watch in Burlingame —",,,,1163955688982208512,https://twitter.com/votebrownrigg/status/1163955688982208512
2019-08-19 21:41:56,votebrownrigg,,0,0,0,"critical pollinators everywhere. As Neighborhood State Senator, you have my word that I'll fight for smart, commonsense policies—including protections for bees and beekeepers—that will make the Peninsula a leader in environmental sustainability and local agriculture.",,,,1163566794042466305,https://twitter.com/votebrownrigg/status/1163566794042466305
2019-08-19 21:41:56,votebrownrigg,,1,0,1,"Last week was National Honey Bee Day. As city Councilmember & former two-term mayor, I'm honored to have helped remove the long-standing beekeeping prohibition in Burlingame. We expanded bee-friendly policies for hive keepers in our community to help combat the ongoing loss of",,,,1163566793212010496,https://twitter.com/votebrownrigg/status/1163566793212010496
2019-08-15 15:07:14,votebrownrigg,,1,0,0,"We need smart, neighborhood-based policies from Sacramento that respect homeowners but reign in skyrocketing housing costs that are making it impossible for our middle-class families, our teachers, nurses, firefighters, and our kids to live and work in our community.",,,,1162017911957020674,https://twitter.com/votebrownrigg/status/1162017911957020674
2019-08-15 15:07:13,votebrownrigg,,1,0,0,"Affordability Alert: According to this article, housing prices are at an all-time high in San Mateo County with the “cheapest place to live here is now in East Palo Alto with an average home price of $1,056,000.”",,,,1162017910858092544,https://twitter.com/votebrownrigg/status/1162017910858092544
2019-08-14 23:22:21,votebrownrigg,,0,1,1,"That’s because this campaign’s supporters — people like you — are regular, hard-working voters from around the District, not special interests from Sacramento. In fact 80% of our donors are from SD13 and our average donation is $250. Check it out here.",,,,1161780126142619654,https://twitter.com/votebrownrigg/status/1161780126142619654
2019-08-14 23:22:21,votebrownrigg,,1,0,2,"Check out this story on the race for Senate District 13 by Political analyst Sue Lempert for the San Mateo Daily Journal. Notice that the columnist describes the outside special interests that are financially bankrolling the other four candidates but not our campaign.",,,,1161780125224058891,https://twitter.com/votebrownrigg/status/1161780125224058891
2019-08-13 19:29:06,votebrownrigg,,0,0,1,"Honored to be a part of the Coastside Democratic Club candidate forum! Great conversation about taking on the affordability crisis and strengthening disaster preparedness for the Coast and Bay sides, including more egress points to allow for safer, more efficient evacuation.",,,,1161359040410243074,https://twitter.com/votebrownrigg/status/1161359040410243074
2019-08-12 14:14:32,votebrownrigg,,0,0,2,"#Woodside? Brownrigg for Senate is on your side! That's why we’re hosting a house party in your neck of the woods on August 25! If you’d like to learn more about my campaign, please join us for this event. Email Andrew@VoteBrownrigg.com for more details or to RSVP.",,,#Woodside,1160917488219107328,https://twitter.com/votebrownrigg/status/1160917488219107328
2019-08-09 19:33:13,votebrownrigg,,0,0,2,"Did you miss Gary Welsey’s op-ed in the Almanac News about why he’s supporting my campaign? Check it out here: https://www.almanacnews.com/print/story/2019/07/31/letter-support-for-brownrigg-for-the-state-senate",,,,1159910521505832962,https://twitter.com/votebrownrigg/status/1159910521505832962
2019-08-05 20:07:13,votebrownrigg,,0,0,0,"Gary Wesley of Mountain View in @AlmanacNews on why he supports Mike Brownrigg for State Senate https://www.almanacnews.com/print/story/2019/07/31/letter-support-for-brownrigg-for-the-state-senate",,@AlmanacNews,,1158469528713490432,https://twitter.com/votebrownrigg/status/1158469528713490432
2019-08-02 19:19:10,votebrownrigg,,0,0,2,"Mark your calendars: We’ll be at the East Palo Alto Blues Festival all day tomorrow and Sunday. Walk—or dance—by our booth, meet Mike, and learn more about how he’ll be a neighborhood State Senator who listens and brings folks together to find real solutions for the Peninsula.",,,,1157370273034846208,https://twitter.com/votebrownrigg/status/1157370273034846208
2019-08-02 03:23:03,votebrownrigg,,0,1,2,"Great to see everyone at last week's Thursday Night’s Live in Mountainview! Good conversations and lots of one-on-ones with local families about the affordability crisis and the struggles of raising a family on the Peninsula and how Sacramento can help.",,,,1157129658019864578,https://twitter.com/votebrownrigg/status/1157129658019864578
2019-08-01 01:33:42,votebrownrigg,,0,0,2,"Great time watching yesterday's primary debate in Palo Alto’s First Congregation Church—ideas & plans flying fast & furious. Everyone will have their favorite performances, but for me, I'm proud to be a Democrat and all of them look and sound more presidential than the incumbent.",,,,1156739750327459840,https://twitter.com/votebrownrigg/status/1156739750327459840
2019-07-26 16:53:45,votebrownrigg,,0,0,1,"This post caught my eye. We need to get our transit agencies thinking outside the box about how to get more people onto transit instead of how to maximize their revenue. As state senator, I will fight for smarter, more efficient transit for the Peninsula.",,,,1154796960672600065,https://twitter.com/votebrownrigg/status/1154796960672600065
2019-07-25 16:34:48,votebrownrigg,,0,0,2,"Excited to hold our 39th house party in East Palo Alto last weekend! Thanks to everyone who came out to talk — among other things — education funding and enrollment in Ravenswood. #neighborhoodstatesenator",,,#neighborhoodstatesenator,1154429806701887488,https://twitter.com/votebrownrigg/status/1154429806701887488
2019-07-23 16:35:25,votebrownrigg,,0,2,4,"Menlo Park: Excited to be headed to your neck of the woods this Saturday for our 40th House Party!! We here to listen and learn more about the issues facing you and your neighbors. Email Andrew@votebrownrigg.com for more information. Looking forward to seeing you!",,,,1153705185656655874,https://twitter.com/votebrownrigg/status/1153705185656655874
2019-07-15 17:08:16,votebrownrigg,,0,0,1,"It’s been my honor to meet all of you & hear about the issues facing you & your families. We have more house parties on the calendar and are on track to have 100 by the end of the year! Email andrew@votebrownrigg.com if you’re interested in hosting or would like to attend one.",,,,1150814347226210310,https://twitter.com/votebrownrigg/status/1150814347226210310
2019-07-15 17:06:21,votebrownrigg,,0,0,2,"Sending a big thanks to everyone who has come out to one of our Brownrigg for State Senate house parties since we launched the campaign. We hit a huge milestone: 38 house parties in 18 cities & we have more scheduled that will cover the rest of the cities in the District!",,,,1150813864398864385,https://twitter.com/votebrownrigg/status/1150813864398864385
2019-07-12 14:02:08,votebrownrigg,,0,0,0,"",,,,1149680342518960129,https://twitter.com/votebrownrigg/status/1149680342518960129
2019-07-12 14:02:08,votebrownrigg,,2,0,2,"Last week’s earthquakes should serve as the jolt we need to re-examine our building codes, reinforce all new development and commit to an early warning emergency alert system that saves lives—things I’ve fought for in Burlingame, things I’ll fight for in Sacramento.",,,,1149680341612998656,https://twitter.com/votebrownrigg/status/1149680341612998656
2019-07-11 13:45:42,votebrownrigg,,0,0,3,"Fun to be part of Gunn High School's 40th reunion (how did that happen?) at Michael's at Shoreline in Mountain View this weekend. Thank you Ron Morita and to all the organizing committee for the great events. Really fun to see so many old friends, some of them from grade school!",,,,1149313820323700738,https://twitter.com/votebrownrigg/status/1149313820323700738
2019-05-10 00:09:31,votebrownrigg,votebrownrigg,0,0,2,"We need more resources for teachers, mental health, music and everything that makes schools a life changing experience for our kids.",,,,1126640374741520384,https://twitter.com/votebrownrigg/status/1126640374741520384
2019-05-10 00:09:16,votebrownrigg,,0,0,2,"Thrilled to rally yesterday with my fellow Burlingame residents on El Camino Real to demand more state funding for local schools! ",,,,1126640310572896256,https://twitter.com/votebrownrigg/status/1126640310572896256
2019-05-09 20:36:26,votebrownrigg,,0,0,4,"Celebrating @Caltrain Station with those who bike, skate, & otherwise transport themselves to work without a car. Thanks to Proterra, a world leading electric bus manufacturer based right here on the Peninsula, & to our Citizens Environmental Council for providing swag & fruit!",,,,1126586750657130496,https://twitter.com/votebrownrigg/status/1126586750657130496
2019-05-03 18:40:40,votebrownrigg,votebrownrigg,0,1,1,"These problems aren’t easy, but I’m fully prepared to work together to ensure a more affordable future for all families here, and across California.",,,,1124383287542071296,https://twitter.com/votebrownrigg/status/1124383287542071296
2019-05-03 18:40:15,votebrownrigg,,1,1,5,"Had a blast at our TENTH house party last night in Los Altos Hills! I enjoyed discussing the complex issues of expanding affordable housing, while also committing to keep our green spaces protected.",,,,1124383182193692672,https://twitter.com/votebrownrigg/status/1124383182193692672
2019-05-02 23:39:37,votebrownrigg,votebrownrigg,0,1,1,"If you cannot take the heat, AG Barr, get out of the kitchen. It is time for you to resign.",,,,1124096132374724614,https://twitter.com/votebrownrigg/status/1124096132374724614
2019-05-02 23:39:27,votebrownrigg,votebrownrigg,0,0,0,"I served in the Executive Branch and this is part of the job — Congress has a right and obligation, on behalf of the American people (i.e., all of us) to make sure the Executive Branch is doing its job properly, legally, ethically and soundly.",,,,1124096091660722177,https://twitter.com/votebrownrigg/status/1124096091660722177
2019-05-02 23:39:10,votebrownrigg,,0,1,2,"I am deeply disappointed by Attorney General Barr’s refusal to carry out the duties that are required of him by the Constitution. He has misled Congress and the American people, and today, he refused to testify before the House of Representatives.",,,,1124096019363508226,https://twitter.com/votebrownrigg/status/1124096019363508226
2019-04-29 20:04:26,votebrownrigg,,0,0,2,"Wonderful meeting with passionate residents of Redwood City, discussing how to expand resources for teachers & how to make our education system work for all students. It inspires me to see even our youngest residents excited for this election - thank you Elena for the drawing!",,,,1122954816114708480,https://twitter.com/votebrownrigg/status/1122954816114708480
2019-04-26 01:27:20,votebrownrigg,votebrownrigg,0,0,2,"As your State Senator, I will work to find solutions to the #AffordabilityCrisis and give folks hope that the California Dream of homeownership is making a come back in San Mateo and Santa Clara Counties.",,,#AffordabilityCrisis,1121586524930228225,https://twitter.com/votebrownrigg/status/1121586524930228225
2019-04-26 01:26:52,votebrownrigg,votebrownrigg,0,0,2,"Too many workers, teachers, & families in our community are being forced out of our District due to a lack of affordable housing.",,,,1121586410505392128,https://twitter.com/votebrownrigg/status/1121586410505392128
2019-04-26 01:25:26,votebrownrigg,,0,0,4,"San Mateo’s First-time Home Buyer Program is a fantastic example of the type of programs we need on the Peninsula — and across California — to take a bite out of the Affordability Crisis holding back so many families.",,,,1121586046565675008,https://twitter.com/votebrownrigg/status/1121586046565675008
2019-04-24 19:44:55,votebrownrigg,votebrownrigg,0,0,1,"To the victims as well as their families, friends & our community, I express my deepest sympathies and wishes for full & speedy recoveries by all. And to the First Responders who show up in minutes, save lives and put others first, I am always sending appreciation and gratitude.",,,,1121137967953637381,https://twitter.com/votebrownrigg/status/1121137967953637381
2019-04-24 19:44:13,votebrownrigg,,0,0,0,"It was with deep sadness & shock that I read the breaking news of a driver plowing into eight pedestrians in Sunnyvale last night.",,,,1121137787942531073,https://twitter.com/votebrownrigg/status/1121137787942531073
2019-04-24 02:15:53,votebrownrigg,,0,0,0,"April has zoomed by and we are rapidly approaching our end of the month fundraising deadline. Please join you neighbors today and donate whatever you can — large or small —to my campaign to be your #NeighborhoodStateSenator. Every little bit helps!",,,#NeighborhoodStateSenator,1120873966891966464,https://twitter.com/votebrownrigg/status/1120873966891966464
2019-04-23 00:00:49,votebrownrigg,votebrownrigg,0,0,6,"And as state senator, you have my word that I’ll never back down from combating rising sea-levels, strengthening clean energy policies and opposing offshore drilling.",,,,1120477587816484864,https://twitter.com/votebrownrigg/status/1120477587816484864
2019-04-23 00:00:37,votebrownrigg,,0,1,2,"Happy #EarthDay! Today I urge all of you to take a moment to get outside and soak up our beatiful planet. We must all do our part to protect against #climatechange. That’s why I’ve been working to make San Mateo County a waste innovator as Chair of the Zero Landfill Committee. ",,,#EarthDay #EarthDay #climatechange,1120477537661067264,https://twitter.com/votebrownrigg/status/1120477537661067264
2019-04-19 23:04:34,votebrownrigg,votebrownrigg,0,0,0,"Improvements include: ADA improvements, improved bicycle facilities, increased pedestrian safety with highlighted cross-walks, improved lighting and signage, and new street resurfacing and sustainable landscaping!",,,,1119376269366312960,https://twitter.com/votebrownrigg/status/1119376269366312960
2019-04-19 23:03:59,votebrownrigg,,0,0,2,"Great afternoon with Burlingame Mayor Donna Colson and my fellow Burlingame City Council colleagues at the new California Drive roundabout ribbon cutting! ",,,,1119376121521295360,https://twitter.com/votebrownrigg/status/1119376121521295360
2019-04-18 20:02:01,votebrownrigg,,0,0,1,"I'm relying on help from grassroots supporters like you to fuel our people-powered campaign. Please join your neighbors and chip in today so we can continue our work to bring integrity and honesty to our elections!",,,,1118967943998656514,https://twitter.com/votebrownrigg/status/1118967943998656514
2019-04-17 23:43:17,votebrownrigg,votebrownrigg,0,1,1,"This is a simple, smart step to make our community and schools safer. If we save even one toddler from picking up a loaded gun and hurting themself or others, we have done a good thing.",,,,1118661239943491585,https://twitter.com/votebrownrigg/status/1118661239943491585
2019-04-17 23:42:37,votebrownrigg,,0,1,2,"Proud to propose a new #gunsafety ordinance at the latest Burlingame City Council meeting which will require all firearms to be locked in a safebox or have trigger guards! @MomsDemand @AMarch4OurLives",,@MomsDemand @AMarch4OurLives,#gunsafety,1118661071726755840,https://twitter.com/votebrownrigg/status/1118661071726755840
2019-04-16 20:39:07,votebrownrigg,votebrownrigg,6,20,142,"I plan to ask my city council colleagues tonight to agendize a new ordinance requiring all guns to be locked up or have trigger guards. @MomsDemand, we hear you!",,@MomsDemand,,1118252501570969602,https://twitter.com/votebrownrigg/status/1118252501570969602
2019-04-16 20:38:30,votebrownrigg,,0,1,6,"Thank you, @RepSpeier, for the important session at Burlingame High School on Saturday against gun violence and your longtime leadership on this issue. Kudos to the Sandy Hook parent and two students from Marjory Stoneman Douglas for your courage.",,@RepSpeier,,1118252349703647232,https://twitter.com/votebrownrigg/status/1118252349703647232
2019-04-15 23:14:37,votebrownrigg,,0,0,0,"Too many Peninsula families are feeling squeezed, especially on #TaxDay. I’m running for State Senate to find solutions to the #AffordabilityCrisis affecting so many families in San Mateo &amp; Santa Clara Counties, by modernizing our tax system to make it work for all CA families.",,,#TaxDay #AffordabilityCrisis,1117929247958372353,https://twitter.com/votebrownrigg/status/1117929247958372353
2019-04-15 16:49:06,votebrownrigg,,0,0,0,"Have you joined your neighbors in supporting my campaign for State Senate? This is a people-powered campaign, and we cannot do this without grassroots support from folks like you. Please join us by donating today or sharing with friends and family! http://secure.actblue.com/donate/votebrownrigg",,,,1117832230443687936,https://twitter.com/votebrownrigg/status/1117832230443687936
2019-04-13 21:25:18,votebrownrigg,votebrownrigg,0,0,1,"And I stand with their fight for equal logistical support for all categories and equal equipment for all categories. I urge you to learn more by visiting http://surfequity.org/timeline. The time is now. #EqualPayforEqualPlay ",,,#EqualPayforEqualPlay,1117176961858564096,https://twitter.com/votebrownrigg/status/1117176961858564096
2019-04-13 21:23:02,votebrownrigg,,0,0,0,"I stand with @SurfEquity and their fight to end discrimination in athletic competitions, their push to require both a female category and a male category for all athletic competitions held on CA state lands and equal prize money for category winners. http://surfequity.org/timeline",,@SurfEquity,,1117176389960998914,https://twitter.com/votebrownrigg/status/1117176389960998914
2019-04-12 22:27:11,votebrownrigg,,0,0,1,"Happy birthday, Mom!! So happy to see you happy, by the water, with the love of your life and the treasure of ours, Philip.",,,,1116830148068696066,https://twitter.com/votebrownrigg/status/1116830148068696066
2019-04-12 21:59:17,votebrownrigg,,0,0,1,"Excited to announce our new volunteer sign-up portal! Visit https://www.votebrownrigg.com/volunteer to sign up today. I hope you'll join our fight to solve the #AffordabilityCrisis &amp; bring a voice to every neighborhood in our sprawling District with common sense, neighborhood-focused solutions.",,,#AffordabilityCrisis,1116823124857589761,https://twitter.com/votebrownrigg/status/1116823124857589761
2019-04-12 00:59:25,votebrownrigg,,0,1,4,"Here's the newest edition to the Brownrigg family, Harley, showing off her support for her dad's campaign! Happy #NationalPetDay from our home to yours! ",,,#NationalPetDay,1116506070778646528,https://twitter.com/votebrownrigg/status/1116506070778646528
2019-04-06 19:07:21,votebrownrigg,votebrownrigg,0,0,1,"Thanks to Michael McCord and the whole wonderful team — I appreciate the shout out for helping launch this with you 10 years ago but it is your passion and energy that has grown that small acorn into a mighty oak of sustainability.",,,,1114605532428394496,https://twitter.com/votebrownrigg/status/1114605532428394496
2019-04-06 19:07:13,votebrownrigg,,0,0,0,"So proud of the Citizens Environmental Council which was honored at last night’s Sustainable San Mateo County charity event!",,,,1114605497787666432,https://twitter.com/votebrownrigg/status/1114605497787666432
2019-04-05 17:44:48,votebrownrigg,,0,0,0,"I’m running for state Senate to find real solutions to the #AffordabilityCrisis and other challenges facing families from South San Francisco to Mountain View, from Pescadero to San Mateo.",,,#AffordabilityCrisis,1114222370204655616,https://twitter.com/votebrownrigg/status/1114222370204655616
2019-04-04 23:53:23,votebrownrigg,votebrownrigg,0,0,2,"Dr. King’s legacy of love for one’s neighbors, welcomeness of strangers and aid to those in need should inspire us all to the calls of service and community. Peace is not easy nor is it a given, as Dr. King said so often, we have to work at it.",,,,1113952738679721984,https://twitter.com/votebrownrigg/status/1113952738679721984
2019-04-04 23:52:39,votebrownrigg,,0,0,0,"As we remember the life and legacy of Dr. Martin Luther King on the 50th anniversary of his assassination, I hope today serves as a day of peace and reflection for all of us.",,,,1113952552528171008,https://twitter.com/votebrownrigg/status/1113952552528171008
2019-04-04 16:06:02,votebrownrigg,,0,0,1,"Please join your neighbors in supporting my campaign for State Senate by donating today. We can't tackle the #AffordabilityCrisis together without grassroots support from folks like you! #NeighborhoodStateSenator https://secure.actblue.com/donate/votebrownrigg",,,#AffordabilityCrisis #NeighborhoodStateSenator,1113835124016025601,https://twitter.com/votebrownrigg/status/1113835124016025601
2019-04-03 18:45:59,votebrownrigg,votebrownrigg,0,1,2,"I’m running for State Senate to continue to fight for equality in the workplace, pay equity, and funding Planned Parenthood and #affordablechildcare.",,,#affordablechildcare,1113512989913518080,https://twitter.com/votebrownrigg/status/1113512989913518080
2019-04-03 18:45:27,votebrownrigg,,1,1,4,"Still celebrating #EqualPayDay, which should be every day. Special appreciation to the four strong women in my life, my daughter Grace and my partner and lifelong love, Marty, my mother Linda and sister Sylvia.",,,#EqualPayDay,1113512854907305984,https://twitter.com/votebrownrigg/status/1113512854907305984
2019-04-03 16:04:33,votebrownrigg,,0,0,2,"There’s no place as beautiful as the Peninsula. I’m proud to have been born and raised in this district and to have raised my family here. Our tight-knit community reminds me of who we can be when we work together with common purpose. #NeighborhoodStateSenator",,,#NeighborhoodStateSenator,1113472362937090048,https://twitter.com/votebrownrigg/status/1113472362937090048
2019-04-02 19:40:45,votebrownrigg,votebrownrigg,0,0,2,"Thank you to the @PeninsulaHumane for coming and ensuring this beautiful bird gets the rehabilitation he needs to be released back into our gorgeous California sky!",,@PeninsulaHumane,,1113164385617305601,https://twitter.com/votebrownrigg/status/1113164385617305601
2019-04-02 19:39:48,votebrownrigg,,0,0,3,"It’s a gray day for sure, but not in our office! Had a visit from a with a broken wing, and he seemed to enjoy our little look out over Burlingame Ave!",,,,1113164146009227264,https://twitter.com/votebrownrigg/status/1113164146009227264
