date,username,to,replies,retweets,favorites,text,geo,mentions,hashtags,id,permalink
2020-03-02 16:52:58,votebrownrigg,,0,1,2,"Just one more day until Election Day! If you haven't mailed in your ballot yet, it has to be postmarked by Tuesday, March 3 in order for it to count. You can also go to a Vote Center to vote or to turn in your ballot. And don't forget to vote for Mike!",,,,1234522094005735425,https://twitter.com/votebrownrigg/status/1234522094005735425
2020-02-28 16:05:54,votebrownrigg,,0,0,0,"Thank you, Florence Fang, vice chairwoman of the US-China Coronavirus Action Network, and to the many, many volunteers who assembled boxes and donations to send to Wuhan yesterday. Former Millbrae Mayor Wayne Lee and I were more than happy to help out with the labels.",,,,1233423086571016193,https://twitter.com/votebrownrigg/status/1233423086571016193
2020-02-27 16:52:46,votebrownrigg,,0,2,5,"Five days until Election Day and Team Brownrigg is busy hitting the streets. Have you voted yet? If you haven't voted yet, we encourage you to mail your ballot as soon as possible. Ballots must be postmarked by March 3 in order to be counted.",,,,1233072493616758785,https://twitter.com/votebrownrigg/status/1233072493616758785
2020-02-23 22:14:25,votebrownrigg,,1,2,11,"IT'S A CLEAN SWEEP! I am excited to have endorsements from every major, Peninsula-based newspaper. The San Mateo Daily Journal, the Palo Alto Daily Post, the Palo Alto Weekly, the Mountain View Voice and the Menlo Park Almanac have all endorsed me, as has KHMB Coastside Radio.",,,,1231703888706719746,https://twitter.com/votebrownrigg/status/1231703888706719746
2020-02-21 03:49:37,votebrownrigg,,0,0,1,"I am excited and thankful to have received the endorsement of the Daily Post...https://padailypost.com/2020/02/20/opinion-post-endorses-brownrigg-for-state-senate/",,,,1230701082055036931,https://twitter.com/votebrownrigg/status/1230701082055036931
2020-02-14 20:06:50,votebrownrigg,paloaltoweekly,0,3,3,"I am proud to have received this endorsement...",,,,1228410289323794432,https://twitter.com/votebrownrigg/status/1228410289323794432
2020-02-12 04:14:34,votebrownrigg,,0,1,2,"Three more weeks until Election Day and the house parties keep on happening. We are now up to 109!",,,,1227445867961032704,https://twitter.com/votebrownrigg/status/1227445867961032704
2020-02-02 16:27:09,votebrownrigg,,0,0,3,"Yesterday was a great day: Had coffee with the Latino Council of Half Moon Bay, canvassed in sunny Pacifica and beautiful Millbrae, and then finished up the day with a house party in San Bruno. Thank you everyone - residents and volunteers - for your energy, ideas and support.",,,,1224006349849128960,https://twitter.com/votebrownrigg/status/1224006349849128960
2020-01-30 16:58:36,votebrownrigg,mercnews,1,1,5,"My opinion piece in today's @mercnews...",,@mercnews,,1222927099960254465,https://twitter.com/votebrownrigg/status/1222927099960254465
2020-01-26 17:01:46,votebrownrigg,,0,1,8,"What started as a crazy idea became a reality yesterday as we had our 100th house party! Thank you to the Cannons, the Roots, the Kinsellas, and the Israelits for being such gracious hosts, and to all those who attended. We aren't done, still have more house parties scheduled.",,,,1221478347504402432,https://twitter.com/votebrownrigg/status/1221478347504402432
2020-01-25 21:34:06,votebrownrigg,,0,0,2,"Happy Year of the Rat! Wishing you and your family wealth, health, and peace of mind in 2020.",,,,1221184493278515200,https://twitter.com/votebrownrigg/status/1221184493278515200
2020-01-22 01:54:32,votebrownrigg,,0,0,0,"Read Mike's take on some of the important issues we face in this interview with the Palo Alto Daily Post...https://padailypost.com/2020/01/21/state-senate-candidate-michael-brownrigg-gives-views-on-issues-first-in-a-series-of-candidate-profiles/",,,,1219800484224962560,https://twitter.com/votebrownrigg/status/1219800484224962560
2020-01-21 01:41:40,votebrownrigg,,0,0,3,"Thank you to the Peninsula Multifaith Coalition for another amazing MLK Jr. Mulltifaith Day of Service. It is wonderful to see so many volunteers dedicating their day to a variety of projects - putting together soup mixes, assembling toys, singing to seniors, and so much more.",,,,1219434855072579585,https://twitter.com/votebrownrigg/status/1219434855072579585
2020-01-14 04:49:05,votebrownrigg,,0,0,3,"I am proud and humbled to receive the endorsement of the International Brotherhood of Electrical Workers Local Union 617. I look forward to building a stronger, greener, more efficient California with IBEW Local Union 617 and its members over the decade ahead.",,,,1216945307587465217,https://twitter.com/votebrownrigg/status/1216945307587465217
2020-01-13 04:40:43,votebrownrigg,,0,0,4,"Another week, another four house parties. That brings us to 89 to date; well on our way to our once seemingly unattainable goal of 100 before the primary election on March 3rd. Thank you to all of the hosts and to everybody who attends. Onward!",,,,1216580813963157506,https://twitter.com/votebrownrigg/status/1216580813963157506
2020-01-08 05:00:30,votebrownrigg,,0,0,5,"I am very appreciative of these words of support...",,,,1214773851172700161,https://twitter.com/votebrownrigg/status/1214773851172700161
2020-01-04 18:03:54,votebrownrigg,,0,0,3,"Ballots will be mailed in less than a month and Team Brownrigg is fired up and ready to play. Wanna play with us? If so, go to https://www.votebrownrigg.com/volunteer and fill out the form, or send an email to our field director, Brieanna Nicker, at brieanna@votebrownrigg.com. Let's go!",,,,1213521450801364992,https://twitter.com/votebrownrigg/status/1213521450801364992
2020-01-02 22:54:13,votebrownrigg,,0,0,1,"The beginning of a new year is often a time for resolutions. Instead, I thought I would share “ten values” I hold as a public servant and will use to operate as your State Senator. You can find the values here...",,,,1212869733545955328,https://twitter.com/votebrownrigg/status/1212869733545955328
2020-01-01 00:28:18,votebrownrigg,,0,0,2,"Spent some time in the LA area during the holidays with my family. Saw plenty of sunshine and plenty of snow. Snow in Los Angeles? Yup, that has to be an omen that 2020 is going to be special! Marty and I wish you and your family a wonderful, happy and healthy new year.",,,,1212168634774233088,https://twitter.com/votebrownrigg/status/1212168634774233088
2019-12-24 19:14:05,votebrownrigg,,0,0,2,"From my family to yours, wishing everyone a happy holiday season!",,,,1209552844371529729,https://twitter.com/votebrownrigg/status/1209552844371529729
2019-12-22 19:45:51,votebrownrigg,,0,0,2,"Another two house parties over the last few days, including one kindly hosted by Palo Altans for @SensibleZoning. This brings our house party count to date to 80! We are well on our way to our ambitious goal of 100 house parties before the primary election on March 3. Onward!",,@SensibleZoning,,1208836065227767808,https://twitter.com/votebrownrigg/status/1208836065227767808
2019-12-19 19:26:20,votebrownrigg,,0,0,1,"Yesterday, at an event organized by Elected Officials to Protect California, I, along with other elected officials in the area, called on Gov. Gavin Newsom to take bolder action on climate change, including placing a moratorium on any new fossil fuel projects.",,,,1207743988079284224,https://twitter.com/votebrownrigg/status/1207743988079284224
2019-12-17 19:30:15,votebrownrigg,,0,0,4,"Last night was the Burlingame City Council swearing-in ceremony for Emily Beach and Donna Colson, who I am so proud to call colleagues and friends, as well as madame mayor. Each was resoundingly re-elected this fall and sworn-in last night by their husbands.",,,,1207020200458981376,https://twitter.com/votebrownrigg/status/1207020200458981376
2019-12-16 22:24:06,votebrownrigg,,0,0,2,"Had a busy weekend canvassing voters in Burlingame, San Mateo and San Bruno. Thank you to all of the volunteers and a special shout out to San Bruno Councilmember Marty Medina.",,,,1206701561327411200,https://twitter.com/votebrownrigg/status/1206701561327411200
2019-12-11 18:13:08,votebrownrigg,,1,0,1,"Congratulations to Linda Mason and Marty Medina, sworn in last night to the San Bruno City Council. The city of San Bruno is in excellent hands! And thanks, Marty, for putting one of my signs in front your house ",,,,1204826463154737152,https://twitter.com/votebrownrigg/status/1204826463154737152
2019-12-09 05:03:41,votebrownrigg,,0,0,4,"What a wonderful holiday celebration! Thank you to all of the hosts and to all who attended. Onward!",,,,1203903018749399040,https://twitter.com/votebrownrigg/status/1203903018749399040
2019-12-06 22:48:10,votebrownrigg,,0,0,5,"Very proud to officially throw my hat in the ring and file the paperwork to become your next State Senator for our amazing Peninsula -- from Brisbane and South San Francisco, down to Mountain View and Sunnyvale, from ocean to bay. I get it, and with your help, we’ll get it done!",,,,1203083738592100352,https://twitter.com/votebrownrigg/status/1203083738592100352
2019-12-06 17:15:41,votebrownrigg,,0,0,3,"Thank you @kevinmullin for an informative coffee yesterday with your constituents around Burlingame. And thank you for recognizing our all-star small business couple Nora and John Kevranian, proprietors of Nuts For Candy, for putting big smiles on small faces for 25 years!",,@kevinmullin,,1203000068170584064,https://twitter.com/votebrownrigg/status/1203000068170584064
2019-12-03 21:17:00,votebrownrigg,,0,0,1,"Thanks to Jerry Pierce for the tour of our baylands and the waters off the Redwood City port. The ecosystem is a working asset, a living asset, but more than anything, a natural asset that we have to fight to protect. What’s done is done but we can shape the future...and we must.",,,,1201973634543144960,https://twitter.com/votebrownrigg/status/1201973634543144960
2019-11-28 00:48:33,votebrownrigg,,1,0,6,"My favorite holiday: no gifts, lots of family and friends, and good food. On this Thanksgiving, a special shout out to all our friends who offer their time, energy, compassion, and love to those who need it most. Thank you, and Happy Thanksgiving to all!",,,,1199852544400318464,https://twitter.com/votebrownrigg/status/1199852544400318464
2019-11-25 21:42:40,votebrownrigg,,0,0,4,"Our grassroots campaign continues to gain momentum. Over the past week alone, we had five more house parties, bringing our total to 71! Thank you to the hosts and to all those who attended.",,,,1199080989554688001,https://twitter.com/votebrownrigg/status/1199080989554688001
2019-11-24 00:31:12,votebrownrigg,,0,0,3,"A great morning in San Mateo, working with @Samaritan_House to provide Thanksgiving dinners to those in need. I know for a fact that the volunteers took away as much fulfillment from the experience as any of the families did in groceries. Thank you to everybody at Samaritan House",,@Samaritan_House,,1198398626134777856,https://twitter.com/votebrownrigg/status/1198398626134777856
2019-11-21 05:05:19,votebrownrigg,,0,0,5,"A fun night watching the Democratic Presidential Debate with some of our house party hosts. And it was quite the moment when our TV ad was shown during the debate!",,,,1197380445203136512,https://twitter.com/votebrownrigg/status/1197380445203136512
2019-11-18 22:46:53,votebrownrigg,,0,0,5,"When it comes to issues that matter most to Peninsula families — from fighting climate change to tackling the affordable housing crisis — I get it and I’ll get it done.",,,,1196560435316580352,https://twitter.com/votebrownrigg/status/1196560435316580352
2019-11-15 21:43:11,votebrownrigg,,0,1,7,"As a former US diplomat for 12 years, I have been proud to watch Amb. Taylor and Amb. Yovanovich this week. US diplomats leave partisanship and politics behind at the water’s edge. They work as one people, advancing and protecting American values and security. #FSProud",,,#FSProud,1195457241727455232,https://twitter.com/votebrownrigg/status/1195457241727455232
2019-10-25 17:26:44,votebrownrigg,,1,9,60,"Proud to be a part of the Burlingame City Council that passed an ordinance requiring all firearms in a home to be safely stored. Here is a photo of representatives from @MomsDemand Action, expressing their support of the ordinance during a City Council meeting earlier this month.",,@MomsDemand,,1187782558378971136,https://twitter.com/votebrownrigg/status/1187782558378971136
2019-10-23 20:29:17,votebrownrigg,,0,0,2,"Yesterday, we broke ground on the “Village at Burlingame,"" a new affordable housing apartment building, which will provide 132 units of affordable housing — 82 of them for very low income households. I am very proud of this project; one that I initiated in 2014 when I was mayor.",,,,1187103721324302336,https://twitter.com/votebrownrigg/status/1187103721324302336
2019-10-17 23:59:40,votebrownrigg,,0,0,1,"Just got a look at the new voting machines that will be used in San Mateo County during our upcoming elections.",,,,1184982338884624384,https://twitter.com/votebrownrigg/status/1184982338884624384
2019-10-14 20:56:22,votebrownrigg,,0,0,2,"Had fun this morning cheering on Farmer John Mueller and serving coffee at the World Championship Pumpkin Weigh-Off in Half Moon Bay. One of Farmer John's two pumpkins - named Kona Moon - weighed in at 881 pounds!",,,,1183849048492478464,https://twitter.com/votebrownrigg/status/1183849048492478464
2019-10-13 21:54:56,votebrownrigg,,0,1,3,"Another weekend, another three house parties, including one in a barber shop in San Bruno!",,,,1183501398882697216,https://twitter.com/votebrownrigg/status/1183501398882697216
2019-10-11 15:53:28,votebrownrigg,,3,0,4,"A message from Mike's wife, Marty... Today is Mike's birthday. Please join me in wishing my husband, our next State Senator, and one of the most caring people I know a Happy Birthday by ""liking"" this message or by leaving him a comment. Thank you.",,,,1182685657807736832,https://twitter.com/votebrownrigg/status/1182685657807736832
2019-10-10 18:45:25,votebrownrigg,,0,0,2,"Thank you @OCindivisible for putting on such a great event Tuesday night! Lots of letter writing to encourage folks in Virginia to pledge to vote in every election, especially this upcoming November. Good reminder to vote early &amp; often! - Brie, dish cleaner and Field Director",,@OCindivisible,,1182366541414719489,https://twitter.com/votebrownrigg/status/1182366541414719489
2019-10-03 17:34:53,votebrownrigg,,0,0,5,"Great to see such involvement last night, as residents and city personnel worked together on a traffic calming initiative in Burlingame. An initiative I was proud to launch last year when I was mayor. An example of how government should be working for -- and with -- the people.",,,,1179812074777501701,https://twitter.com/votebrownrigg/status/1179812074777501701
2019-10-02 16:05:17,votebrownrigg,,0,1,7,"Feeling the energy at Franklin Elementary School on ""Walk and Bike To School Day""! Thanks to Principal Jude Lawrence and the whole team at Franklin, and all our great neighborhood elementary schools, for being such warm and welcoming places for parents and children.",,,,1179427141454303238,https://twitter.com/votebrownrigg/status/1179427141454303238
2019-09-30 00:08:28,votebrownrigg,,0,0,1,"As the sun sets on this Sunday, I would like to wish a Happy New Year to those who celebrate Rosh Hashanah.",,,,1178461574748495872,https://twitter.com/votebrownrigg/status/1178461574748495872
2019-09-25 00:58:59,votebrownrigg,,0,0,1,"I support the lawsuit filed today by California AG Becerra and four groups against the Trump administration over a decision made earlier this year that could allow construction of a new housing development on the Cargill Salt property in Redwood City.",,,,1176662347026329600,https://twitter.com/votebrownrigg/status/1176662347026329600
2019-09-20 17:37:36,votebrownrigg,,1,1,3,"Vaping and the use of flavored tobacco, particularly among children, is quickly becoming a health crisis. I want to act NOW to protect our kids. Read this article to see what I am proposing for Burlingame.",,,,1175101719694307328,https://twitter.com/votebrownrigg/status/1175101719694307328
2019-09-18 18:44:28,votebrownrigg,,0,0,4,"Thank you, San Mateo County Supervisors, for your leadership on the climate crisis. I was pleased to speak in support of your Climate Crisis resolution yesterday, and to support the work you have done on Peninsula Clean Energy, creating a flood and sea level rise agency, and more",,,,1174393767836545024,https://twitter.com/votebrownrigg/status/1174393767836545024
2019-09-16 20:48:48,votebrownrigg,,0,0,5,"This past weekend reminded me so vividly of what we all know about the amazing Bay Area. From Fiestas Patrias, to Annual Moon Festival events, to Palestine Cultural Day, our communities recognize that we can be proud and love our country, and also be so proud of our heritage.",,,,1173700282301079553,https://twitter.com/votebrownrigg/status/1173700282301079553
2019-09-13 20:03:25,votebrownrigg,,0,0,2,"We need more and better transit NOW. As your Neighbor State Senator, my priorities will be finding smart, commonsense ways to bring more efficient transit to the Peninsula, like expanding BART around the bay or extending Caltrain, and boost capacity.",,,,1172601699804078082,https://twitter.com/votebrownrigg/status/1172601699804078082
2019-09-12 23:08:05,votebrownrigg,,0,0,0,"In the State Senate I’ll get it done for California the same way I helped get it done for my city. This is all part of electrifying our economy and using carbon free energy to power our prosperity, which is critical in our battle against climate change.",,,,1172285784294117377,https://twitter.com/votebrownrigg/status/1172285784294117377
2019-09-12 23:07:58,votebrownrigg,,1,0,2,"As a councilmember and mayor who voted to help make this happen, so pleased and proud to help cut the ribbon on six new high-speed chargers for Burlingame. The state of California needs 250,000 chargers over the next 10 years, but we only have 15,000 installed.",,,,1172285756292968448,https://twitter.com/votebrownrigg/status/1172285756292968448
2019-09-12 21:28:16,votebrownrigg,,0,0,0,"Hey #FosterCity, join us on Saturday! I’ll be in your neighborhood and I want to hear from you about the biggest issues facing you, your family and your community. Join us! Please email Emily@votebrownrigg.com for more details.",,,#FosterCity,1172260662875164684,https://twitter.com/votebrownrigg/status/1172260662875164684
2019-09-07 18:09:12,votebrownrigg,,0,0,2,"One of the annual events that makes every community feel like a family, the AYSO opening day parade! Thank you coaches, families, board members, referees & everybody else who makes it possible for 1200 kids to have a great time playing soccer this fall.",,,,1170398626411089920,https://twitter.com/votebrownrigg/status/1170398626411089920
2019-09-06 19:32:21,votebrownrigg,,0,0,1,"for the last three years of his life. I wish there had been a memory cafe where he lived. If you or a loved one are living with dementia and would like to find a memory cafe in your community, go to https://www.memorycafedirectory.com/",,,,1170057164964139009,https://twitter.com/votebrownrigg/status/1170057164964139009
2019-09-06 19:32:15,votebrownrigg,,1,0,0,"Memory cafes are warm, safe places to share stories, tell a joke, and just be together. It’s like a very exclusive social club that serves coffee! I left high school my senior year to help my grandfather stay in his home until he died and helped my dad through this cruel disease",,,,1170057140448481280,https://twitter.com/votebrownrigg/status/1170057140448481280
2019-09-06 19:32:15,votebrownrigg,,1,1,1,"Could not be more proud of my old friend, Charles Voltz, for visualizing and opening a “Memory Cafe” in Burlingame to expand socializing opportunities for those in our community living with dementia and the caregivers who serve them.",,,,1170057139324444678,https://twitter.com/votebrownrigg/status/1170057139324444678
2019-09-05 23:51:03,votebrownrigg,,0,0,1,"Los Altos & Brisbane, #TeamBrownrigg is comin’ at you! We’re hosting house parties in your neck of the woods this weekend. I’d love to see you there. Please email Emily@VoteBrownrigg.com if you can attend or for more information!",,,#TeamBrownrigg,1169759881496276993,https://twitter.com/votebrownrigg/status/1169759881496276993
2019-09-04 15:39:21,votebrownrigg,,0,0,0,"We must never accept mass shootings as normal & we must always look for better ways to reduce high-capacity guns & to prevent any gun from being in the wrong hands. That’s what I’ll be fighting for & getting results for.",,,,1169273753748086784,https://twitter.com/votebrownrigg/status/1169273753748086784
2019-09-04 15:39:21,votebrownrigg,,1,0,0,"We must keep guns away from kids & schools. Period. That’s why I'm proud of our work in Burlingame to require all guns have trigger guards or be kept in locked storage cases.",,,,1169273752548515841,https://twitter.com/votebrownrigg/status/1169273752548515841
2019-09-04 15:39:21,votebrownrigg,,1,0,1,"Horrified, but sadly no longer shocked, by last week’s incident of a student threatening gun violence at my alma mater, Gunn High School, in Palo Alto. Kudos for the swift, brave action by PA & school district officials for having zero tolerance for this terrifying post.",,,,1169273751554416641,https://twitter.com/votebrownrigg/status/1169273751554416641
2019-09-02 20:27:40,votebrownrigg,,0,0,1,"sacrifices made by working men & women across California & the country for the safer conditions, higher pay, better benefits, manageable hours, & workers’ rights we enjoy today. Wishing everyone a safe, happy & relaxing long weekend. All brought to you by organized labor (3/3)",,,,1168621533046157312,https://twitter.com/votebrownrigg/status/1168621533046157312
2019-09-02 20:27:39,votebrownrigg,,1,0,1,"for immigrant rights, for workplace safety, you name it. This year, a Gallup Poll found that 64% of Americans approve of labor unions--a 16-percentage point increase over the past decade. This Labor Day, let’s take a moment to reflect on the dignity of work & the decades of (2/3)",,,,1168621531800461314,https://twitter.com/votebrownrigg/status/1168621531800461314
2019-09-02 20:27:39,votebrownrigg,,1,1,3,"Who should be thanked for weekends off? Thank a union. For overtime pay? Thank a union. For child labor laws? Thank a union. For more than a century, the American labor movement has fought for its members & all working people, for gender equality, for racial justice (1/3)",,,,1168621530592567296,https://twitter.com/votebrownrigg/status/1168621530592567296
2019-08-30 15:44:10,votebrownrigg,,0,0,2,"My goal? To be #JustLikeJerry and follow in Senator Hill’s footsteps. That means always showing up to be available and to listen to the concerns of every community across the district.",,,#JustLikeJerry,1167463025386885121,https://twitter.com/votebrownrigg/status/1167463025386885121
2019-08-29 18:52:15,votebrownrigg,,1,0,1,"Many officers on our police force face up to a “2-and-half-hour commute home” after a long, stressful shift! Glad to see San Mateo County step up & do something about the affordability crisis & allow our police to get the rest they deserve & require.",,,,1167147971911311362,https://twitter.com/votebrownrigg/status/1167147971911311362
2019-08-29 13:15:54,votebrownrigg,,0,0,1,"Sen Jerry Hill leaves big shoes to fill, but I will follow in his footsteps. As your Neighborhood State Senator, I pledge to be #JustLikeJerry—I’ll go everywhere in this district &amp; I’ll show up, be available &amp; listen to your concerns about what you want to see done in Sacramento.",,,#JustLikeJerry,1167063323793342465,https://twitter.com/votebrownrigg/status/1167063323793342465
2019-08-29 00:40:23,votebrownrigg,,0,0,0,"If you would like to host a house party, join us at a house party or sit down with me over coffee to talk about issues that matter to you and your family and community, please contact Emily at Emily@votebrownrigg.com. (2/2)",,,,1166873192142651392,https://twitter.com/votebrownrigg/status/1166873192142651392
2019-08-29 00:40:22,votebrownrigg,,1,0,2,"Excited to ring in our 45th house party in my hometown of Burlingame yesterday! This brings #TeamBrownrigg to 45 house parties in 21 cities across the District with even more schedule over the next few weeks. Thank you for the hospitality and great conversations! (1/2)",,,#TeamBrownrigg,1166873190372716544,https://twitter.com/votebrownrigg/status/1166873190372716544
2019-08-27 19:51:17,votebrownrigg,,0,0,0,"#TeamBrownrigg couldn't ask for better mascots. Hope you had a happy #NationalDogDay yesterday from Patch, Harley and all of us at Brownrigg for Senate campaign HQ. These Neighborhood Dogs are supporting a Neighborhood State Senator!",,,#TeamBrownrigg #NationalDogDay,1166438050395824128,https://twitter.com/votebrownrigg/status/1166438050395824128
2019-08-27 14:38:19,votebrownrigg,,0,0,0,"the effective and meaningful gun safety steps Sunnyvale took under his watch. These are common sense gun safety solutions that I’ll fight to bring to every neighborhood as your State Senator. (2/2)",,,,1166359292548718592,https://twitter.com/votebrownrigg/status/1166359292548718592
2019-08-27 14:38:19,votebrownrigg,,1,0,1,"Excited that my colleagues on the Burlingame City Council & I are supporting a new ordinance requiring all guns have trigger guards or be kept in a locked storage case. Too many gun deaths are preventable. Grateful to former Sunnyvale mayor Tony Spitaleri for sharing (1/2)",,,,1166359291500122112,https://twitter.com/votebrownrigg/status/1166359291500122112
