date,username,to,replies,retweets,favorites,text,geo,mentions,hashtags,id,permalink
2019-04-02 18:46:35,votebrownrigg,,0,0,2,"Special congratulations to our @RepSpeier, the new co-chair of the House Democratic Women's Caucus! I’m running for State Senate to continue to fight for equality in the workplace, pay equity, and funding Planned Parenthood and #affordablechildcare.",,@RepSpeier,#affordablechildcare,1113150750891233280,https://twitter.com/votebrownrigg/status/1113150750891233280
2019-04-02 01:07:22,votebrownrigg,,0,1,2,"Today, as we celebrate #CesarChavezDay, we celebrate all that he stood for, including the dignity of work, the profound equality of every man and woman, and the respect that honest labor should command. Let's all remember the power we have to achieve better outcomes for all.",,,#CesarChavezDay,1112884190826000384,https://twitter.com/votebrownrigg/status/1112884190826000384
2019-04-01 21:55:56,votebrownrigg,votebrownrigg,0,0,1,"Looking forward to expanding HEART’s innovative first time home buyer program and building out its crucial loan portfolio to affordable housing developers around the County.",,,,1112836018309259264,https://twitter.com/votebrownrigg/status/1112836018309259264
2019-04-01 21:55:48,votebrownrigg,,0,0,6,"Proud to have joined the board of HEART, the affordable housing public/private partnership for the County of San Mateo. Thanks to my fellow electeds at the Council of Cities for voting me onto the board!",,,,1112835981617487872,https://twitter.com/votebrownrigg/status/1112835981617487872
2019-03-31 21:55:57,votebrownrigg,,0,4,13,"Happy to support Assemblyman @kevinmullin,Senator Jerry Hill, &amp; Assemblyman @AsmMarcBerman in their important efforts to bring more transparency and security to our elections. Jerry Hill said democracy is under attack and I think he’s right. @CACleanMoney",,@kevinmullin @AsmMarcBerman @CACleanMoney,,1112473630934327296,https://twitter.com/votebrownrigg/status/1112473630934327296
2019-03-30 00:32:55,votebrownrigg,votebrownrigg,0,1,2,"A recent European report found microplastic particles in 100% of the studied adults’ guts. Keep plastic out of our oceans, our land fills and our bodies! #Plastapocalypse",,,#Plastapocalypse,1111788358378770432,https://twitter.com/votebrownrigg/status/1111788358378770432
2019-03-30 00:32:29,votebrownrigg,,0,0,2,"Terrific conversation at the Plastic Waste Summit hosted by SBWMA. Happy to be a keynote speaker on our global plastic problem, highlighting the urgency of banning single use plastic — if it can’t be recycled it should not be sold.",,,,1111788249339424768,https://twitter.com/votebrownrigg/status/1111788249339424768
2019-03-29 23:51:58,votebrownrigg,,0,2,3,"We are 3 days away from our end of month fundraising deadline. Please join your neighbors in supporting my campaign for State Senate by contributing today, before our March 31 fundraising deadline!",,,,1111778052952854528,https://twitter.com/votebrownrigg/status/1111778052952854528
2019-03-25 17:42:09,votebrownrigg,,0,2,4,"Heartfelt thanks to Salah Albakri, friends from Yaseen Foundation and many new friends for an amazing evening of food, music and politics. #100HouseParties",,,#100HouseParties,1110235434926260224,https://twitter.com/votebrownrigg/status/1110235434926260224
2019-03-23 23:55:44,votebrownrigg,votebrownrigg,2,0,2,"Heard loud and clear at House Party #4: Los Altos is challenged by a one-size-fits-all housing approach from Sacramento given the very modest commercial areas. Climate change another high priority.",,,,1109604674972188672,https://twitter.com/votebrownrigg/status/1109604674972188672
2019-03-23 23:55:07,votebrownrigg,,0,0,0,"A beautiful afternoon in Los Altos (are there any other kind?) with new friend Suzy Allison and her friends, and old friend Dermott Larkin. Affordability crisis and solutions, especially for teachers, main topics of concern.",,,,1109604518650535936,https://twitter.com/votebrownrigg/status/1109604518650535936
2019-03-22 16:07:51,votebrownrigg,votebrownrigg,1,0,2,"This is why I believe it is critical to bring a public, four year degree granting capacity to our amazing community college system, so these great kids can stay in their current living arrangements and AFFORD to get a four year degree! Let’s make this happen!",,,,1109124539621892096,https://twitter.com/votebrownrigg/status/1109124539621892096
2019-03-22 16:07:32,votebrownrigg,,0,0,1,"This report documents how unaffordable college is for less affluent kids when ALL costs are taken into account, especially if they cannot live at home.",,,,1109124459145748481,https://twitter.com/votebrownrigg/status/1109124459145748481
2019-03-21 00:48:57,votebrownrigg,,0,2,3,"In solidarity after New Zealand, joined 300 people at an anti-Islamophobia dinner as a guest of my friend, Salah Albakri, keynoted by @shaunking. The effort starts by listening and linking arms.",,@shaunking,,1108530904438210560,https://twitter.com/votebrownrigg/status/1108530904438210560
2019-03-20 16:13:32,votebrownrigg,votebrownrigg,0,0,3,"This pledge is about respecting voters and giving them the opportunity to choose their candidate based on facts and the positive, solution-based platforms of each candidate. It is important to restore civility in politics and it can start right here, right now.",,,,1108401196463583232,https://twitter.com/votebrownrigg/status/1108401196463583232
2019-03-20 16:13:08,votebrownrigg,,0,0,2,"Grateful and pleased that my colleagues have joined me in the #CleanCampaignPledge. The voters of San Mateo and Santa Clara counties expect -- and deserve -- more from us as candidates than anonymous personal attacks and dirty politics.",,,#CleanCampaignPledge,1108401094252589056,https://twitter.com/votebrownrigg/status/1108401094252589056
2019-03-14 18:48:41,votebrownrigg,,0,0,2,"A big thanks to all that have already signed my #CleanCampaignPledge urging all candidates in the SD-13 race to run a CLEAN, HONEST campaign. If you haven't signed yet, click here ",,,#CleanCampaignPledge,1106265912926072832,https://twitter.com/votebrownrigg/status/1106265912926072832
2019-03-13 19:56:24,votebrownrigg,,1,0,4,"Have you signed my #CleanCampaignPledge yet?! Ad your name TODAY and urge all candidates to commit to running a CLEAN, honest campaign! https://www.votebrownrigg.com/cleancampaign",,,#CleanCampaignPledge,1105920564152098816,https://twitter.com/votebrownrigg/status/1105920564152098816
2019-03-12 17:42:55,votebrownrigg,evan_adams,0,0,0,"Thanks Evan. We have to do much more for housing. This is a critical issue for me, for all of us, the fabric of our communities is fraying. But a better approach is for cities to decide how to upzone to achieve the thousands of extra units we need, like burlingame or Mtn View has",,,,1105524583451377664,https://twitter.com/votebrownrigg/status/1105524583451377664
2019-03-12 16:58:51,votebrownrigg,votebrownrigg,0,0,3,"Please sign the pledge today, and urge all candidates to commit to running a CLEAN, honest campaign! ",,,,1105513497314508800,https://twitter.com/votebrownrigg/status/1105513497314508800
2019-03-12 16:58:34,votebrownrigg,,0,0,4,"Proud that my campaign is urging State Senate District 13 candidates to sign the pledge to run clean, fair and truthful campaigns in the March 2020 Primary. Thank you @sallylieber for signing on! http://www.votebrownrigg.com/cleancampaign",,@sallylieber,,1105513422442061825,https://twitter.com/votebrownrigg/status/1105513422442061825
2019-03-11 22:25:13,votebrownrigg,votebrownrigg,0,1,2,"This is a great example of what we all need to do better, finding services to help our growing senior population age in place, with dignity and plenty of social interaction. Entertainment provided by barbershop quartet Sound Judgment, out of Burlingame.",,,,1105233239000535042,https://twitter.com/votebrownrigg/status/1105233239000535042
2019-03-11 22:25:01,votebrownrigg,,0,0,2,"Brisbane Village Helping Hands is in its third year of matching volunteers with tasks requested by Brisbane's senior population, many of whom no longer drive but still live independently.",,,,1105233190925422592,https://twitter.com/votebrownrigg/status/1105233190925422592
2019-03-09 00:52:49,votebrownrigg,,0,3,6,"Happy to be celebrating and recognizing #InternationalWomensDay2019, with special appreciation to the four strong women in my life, my daughter Grace and my partner and lifelong love, Marty, my mother Linda and sister Sylvia.",,,#InternationalWomensDay2019,1104183221665722369,https://twitter.com/votebrownrigg/status/1104183221665722369
2019-03-07 00:22:35,votebrownrigg,,1,0,2,"As your #NeighborhoodStateSenator, I want to listen and understand each community’s perspectives and priorities. Economic growth is better than decline as a general matter but creates real challenges for communities. https://vimeo.com/239483848 @peeryfoundation",,@peeryfoundation,#NeighborhoodStateSenator,1103450835785142272,https://twitter.com/votebrownrigg/status/1103450835785142272
2019-03-05 23:40:51,votebrownrigg,votebrownrigg,0,1,5,"In Burlingame I’m proud to be a charter member of the Adaptation Task Force, looking at ways to protect our land from encroachment by the bay. Since 40% of our revenue comes from businesses within a few feet of the bay, this is almost an existential threat to our communities.",,,,1103077946141470720,https://twitter.com/votebrownrigg/status/1103077946141470720
2019-03-05 23:29:55,votebrownrigg,,0,0,4,"Battling climate change, which means getting carbon out of our energy stream and helping cities adapt to inevitable sea level rise, is the most important environmental and infrastructure challenge before us.",,,,1103075194887798785,https://twitter.com/votebrownrigg/status/1103075194887798785
2019-03-04 17:16:28,votebrownrigg,,0,0,4,"Thank you to everyone who attended yesterday’s house party in Burlingame! Grateful for the chance to discuss climate change and our place in fighting it. #100HouseParties",,,#100HouseParties,1102618825877467137,https://twitter.com/votebrownrigg/status/1102618825877467137
